DATE,TITLE,SUMMARY
2022-09-03 14:46:27,Police: Plane circling Mississippi city threatens to crash,Police say the pilot of a small airplane has been circling over Tupelo and other parts of northeast Mississippi and had threatened to crash the aircraft into a Walmart store
2022-09-03 14:20:36,17 states weigh adopting California's electric car mandate,Seventeen states that tie their vehicle emission standards to rules established in California must decide whether to follow that state&rsquo;s strict new rules
2022-09-03 13:55:41,Border Patrol: 9 migrants found dead in Rio Grande at Texas,"Officials say at least nine migrants died when dozens attempted a hazardous crossing of the Rio Grande river near Eagle Pass, Texas"
2022-09-03 13:17:38,Police in Mississippi say pilot threatening to crash plane into a local Walmart; store evacuated,Police in Mississippi say pilot threatening to crash plane into a local Walmart; store evacuated
2022-09-03 13:11:02,Who gets to tell the story of a historic civil rights site?,A fight is brewing in Tennessee over a legendary civil rights and labor organizing center whose alumni and supporters include Rosa Parks and Eleanor Roosevelt
