DATE,TITLE,SUMMARY
2022-03-01 19:40:31,Single vs. head of household: How it affects your tax return,"If you're confusing the single and head of household filing statuses, you may be leaving tax breaks on the table. Here's what to know for your 2021 return."
2022-03-01 14:40:34,"When it comes to a will or estate plan, don't just set it and forget it","Health issues and remarriage might prompt you to update your will, but be aware of other life changes that require a review of your estate plan, say experts."
2022-03-01 14:22:08,Warren Buffett's advice for college students: Chase the job you'd want if ‘you had no need for money’,Berkshire Hathaway CEO Warren Buffett advises prioritizing places you want to work — and people you want to work with — over jobs that only offer a high salary.
2022-03-01 10:45:56,How the Russia-Ukraine conflict could affect young people’s finances,The Russia-Ukraine conflict could affect the finances of young people in a number of ways. Here are some tips on how to cushion the impact of the crisis.
2022-03-07 16:08:57,"Steve Wozniak: Steve Jobs wasn't a natural-born leader, he worked to 'develop his communication' skills","Steve Wozniak says Steve Jobs compensated for his engineering skills by turning himself into a skilled communicator and marketer, all to help Apple succeed."
2022-03-07 14:52:01,Remarrying? Here are financial considerations to keep in mind before saying ‘I do’,"When it comes to remarriage, advisors recommend engaged couples look at their financial pasts, presents and futures before tying the knot again."
2022-03-08 06:44:36,A travel guide is fleeing Ukraine — and hosting free online ‘tours’ along the way,"A travel guide's virtual tours around Kyiv used to draw between 30 and 100 people. But over 1,800 tuned in to her livestreamed Ukraine tours after the invasion."
2022-03-07 21:58:40,Joint vs. separate accounts: How couples choose to handle finances could impact their financial success,"About 43% of couples who are married, in a civil partnership or living together only have joint accounts, according to a new survey."
2022-03-07 18:48:41,Should you super fund a 529 college savings plan? Here’s what experts say,"It's possible to kick-start your 529 college savings plan with a larger, upfront contribution. Here's what to know about this strategy."
2022-03-08 20:55:29,Considering a Roth IRA conversion? Here's what investors need to know to reduce the tax bite,"If you're eyeing a Roth IRA conversion, there may be ways to lessen the tax bite, financial experts say. Here's what investors need to know."
2022-03-08 14:28:05,"This is 'the last place you want to get your stock advice from,' says investing expert",Understanding the biases and motivations of the people dispensing stock advice can help make you a better investor.
2022-03-09 18:40:30,Here's what happens to Russian oligarch yachts after they're seized,European governments that seized the yachts and villas of Russian oligarchs now face a more difficult question: What to do with them?
2022-03-09 15:27:41,Here’s how urban and rural Americans build wealth differently,There are key differences between rural and urban Americans when it comes to building wealth. Here's how it may affect retirement.
2022-03-09 16:36:36,Britain impounds private jet with suspected links to Russian oligarch amid new aviation sanctions,The U.K. on Wednesday impounded a private jet connected to Russian oligarch Roman Abramovich under new aviation sanctions levied at the pariah state.
2022-03-10 06:43:10,This country regularly tops the Philippines’ tourist arrivals — and it’s not China,"Residents from South Korea topped the list of visitor arrivals to the Philippines each year from 2010 to 2020, according to the Philippines' tourism department."
2022-03-10 16:27:50,"Retirees likely shielded from inflation hit on these expenses, report finds","Annual inflation rose by 7.9% in February, but some retirees may not feel the brunt of certain rising costs, according to a J.P. Morgan report."
2022-03-11 20:37:26,'Golden passports' for the rich face new restrictions in global crackdown on Russian oligarchs,Sweeping sanctions against Putin's oligarchs has led governments to limit and in some cases end their lucrative pay-for-passport programs.
2022-03-12 14:00:02,Cash-rich states create 'competitive environment’ with flurry of tax cuts,"There’s been a wave of state-level tax cuts spurred by budget surpluses, and more may be coming, policy experts say. Here's what taxpayers need to know."
2022-03-14 14:10:06,"Brits offered £350 a month to house Ukraine refugees, Benedict Cumberbatch plans to take part","""Doctor Strange"" star Cumberbatch told Sky News on Sunday that ""everyone needs to do as much as they can"" to support Ukrainians."
2022-03-14 16:41:47,Bipartisan group of lawmakers pushes IRS for answers on 'numerous problems' facing taxpayers,"A group of bipartisan lawmakers is pressing the IRS for answers regarding ""numerous"" concerns amid a challenging tax season."
2022-03-14 16:40:41,Almost 90% of Americans are able to erase this $30 credit card fee just by asking. Here's what to say when you call,"Many credit card issuers will waive a late fee if you simply call and ask, experts say. Here's what to say to boost your odds of success."
2022-03-16 00:33:13,Theranos saga returns to courtroom as Holmes' top deputy Balwani set for criminal trial,"Ramesh ""Sunny"" Balwani, Elizabeth Holmes' ex-boyfriend and business partner, is set to face the jury in his criminal fraud trial this week."
2022-03-15 15:44:12,Eligible taxpayers can claim earned income tax credit in these states,More than a dozen states added or expanded earned income tax credits in 2021. Here's what to know about this write-off for low to moderate earners.
2022-03-16 13:15:01,"Inflation is causing some older Americans to delay retirement plans, survey shows","Inflation is causing some older Americans to postpone major life events, including retirement, according to a Nationwide survey."
2022-03-16 19:47:51,Steve Wozniak's best investing tips – and why he’s ‘very skeptical’ of most cryptocurrencies,"Steve Wozniak is a famously cautious investor who hates owning stocks. He also stars in online reality investing show ""Unicorn Hunters."" Here's how he weighs his decisions."
2022-03-18 00:06:22,Americans are pausing investments because of the Russia-Ukraine war. Here's what it could cost them,"The ongoing Russia-Ukraine war is hurting Americans' financial outlook, causing many to pause investing, according to a survey. Here's why that's a problem."
2022-03-17 18:17:09,"A million new millionaires were created in U.S. last year, and the richest got richer, report says","The roaring stock market and crypto gains created more than a million new millionaires in the U.S. last year, according to a new report."
2022-03-18 18:16:36,The IRS has delivered more than 45 million tax refunds. This is the average payment,"The IRS has issued more than 45 million refunds worth almost $152 billion, as of March 11. Here's the average payment."
2022-03-18 17:50:47,Mark Zuckerberg’s advice for young people: Focus more on building relationships than being 'objective focused',"On a March episode of Lex Fridman's podcast, the Meta CEO explained why he thinks college students should be selective about who they hang out with."
2022-03-18 08:19:10,The 4 types of vacations that may be hard to book in 2022,"After two years of vacation plans being halted by Covid-19, travelers are beginning to regain their confidence and are booking holidays up to a year in advance."
2022-03-19 13:30:02,"Meet Erin Collins, National Taxpayer Advocate for the IRS","Erin Collins, the national taxpayer advocate, fights for systemic changes within the IRS. Here’s what to know about the Taxpayer Advocate Service."
2022-03-21 01:19:03,Oligarch Roman Abramovich's $50 million Colorado mansion could become a sanctions target,A Rocky Mountain mansion owned by Russian oligarch Roman Abramovich would likely be among the first assets frozen by the U.S. government if he is sanctioned.
2022-03-20 13:30:01,Check out this 'insanely great' offer letter Steve Jobs wrote to hire an employee – who now regrets turning him down,"In the 1980s, the Apple co-founder offered an $80,000 salary to a former colleague while trying to convince him to work at his new start-up. Now, the recipient says he regrets turning Jobs down."
2022-03-21 19:14:05,Warren Buffett paid $11.6 billion for a company run by his 'long-time friend' — here's why he values trust so much,"Warren Buffett views trust and ""integrity"" as essential in the workplace. That's likely why he seems confident that Berkshire Hathaway's latest acquisition will succeed."
2022-03-21 14:00:26,Op-ed: Why investors should care about who owns their advisor's firm,"There are many factors to consider when selecting a financial advisor, from acumen to personal chemistry. Also important: who actually owns the advisor's firm."
2022-03-21 12:30:01,Buying your first home? Here's what you need to know,People looking to buy a home for the first time face a steep learning curve. Here are some of the basics from experts in the field.
2022-03-22 17:08:19,Inflation is spiking the cost of pet parenthood yet owners are still splurging on care,"More than 70% of dog owners are feeling the sting of inflation when spending on food and supplies. But many are still willing to splurge, a report shows."
2022-03-23 13:06:12,"Apple co-founder Steve Wozniak: 'Of all Big Tech, Facebook is No. 1 that I don't like'","Steve Wozniak, inventor of the first commercial PC, says he recently deactivated his Facebook account — and he doesn't trust the platform's privacy standards."
2022-03-24 12:39:04,How to avoid a 6-figure tax penalty on foreign bank accounts,"If you have overseas financial accounts, you may need to disclose balances to the U.S. Department of the Treasury by April 15 or incur a steep tax penalty."
2022-03-24 11:20:00,Russian oligarch Abramovich's two superyachts worth a combined $1 billion are escaping sanctions — for now,The azure waters of southwest Turkey saw the arrival of a two multimillion-dollar superyachts this week reportedly belonging to Russian oligarch Roman Abramovich.
2022-03-24 08:13:11,UK government budget gives little relief to young people squeezed by cost of living crisis,"In his Spring Statement, U.K. Finance Minister Rishi Sunak acknowledged that the Russia-Ukraine war was putting more pressure on the cost of living in Britain."
2022-03-24 16:00:01,Here's how to settle your loved one's estate after they pass away,"Experts say settling an estate can take six months to several years, depending on prior planning and simplicity of the assets. Here's what to know."
2022-03-25 14:11:02,Treasury Secretary Yellen says Russian oligarch Abramovich 'could face sanctions' by U.S.,
2022-03-25 15:33:08,"57% of U.S. households paid no federal income tax last year as Covid took a toll, study says","More than half of Americans paid no federal income tax last year due to Covid-relief funds, tax credits and stimulus, according to a new report."
2022-03-26 13:00:02,How to avoid a tax filing rejection if last year's return is still pending,"Is your 2020 tax return still pending? There’s a special step to follow when electronically filing your 2021 return, the IRS says."
2022-03-28 04:43:49,What it’s like to travel to Australia right now,"CNBC Travel looks into what it's now like to visit a country that was once labeled ""Fortress Australia"" because of its strict Covid-19 policies."
2022-03-28 08:25:06,Soaring prices are hitting young Brits. The new U.K. budget won't hurt much,U.K. inflation hit 6.2% last month — and prices are expected to rise further still.
2022-03-29 11:14:32,Some passports are better than others. Here's a list of the most powerful ones,"Luxembourg, one of the smallest countries in Europe, tops a new passport index that analyzes factors that affect global citizens."
2022-03-29 11:05:20,Soaring prices are hitting young Brits. The new UK budget won't help much,U.K. inflation hit 6.2% last month — and prices are expected to rise further still.
2022-03-30 05:08:20,Turkey may become the new playground for Russian oligarchs – but it's a risky strategy,"Russian oligarch wealth is on the hunt for a new home, and Turkey is quickly establishing itself as a welcome host."
2022-03-29 18:46:42,Last chance to avoid a 50% penalty on required withdrawals is April 1 for some retirees,"If you turned age 72 during the second half of 2021, the deadline for your first annual required withdrawal from retirement accounts is April 1, 2022."
2022-03-29 17:46:20,Sen. Elizabeth Warren says billionaires should pay more taxes to help the 'next Elon Musk',"""I'm happy to celebrate success, but let's remember, Elon Musk didn't make it on his own,"" the Massachusetts Democrat told CNBC on Tuesday."
2022-03-29 18:30:47,"Biden’s budget proposes tax hike on married filers making more than $450,000","President Joe Biden has proposed a hike on the top marginal income tax bracket for single filers earning more than $400,000 and married couples above $450,000."
2022-03-31 13:16:32,Charlie Munger warns Gen Z investors: It's 'way harder' for recent college graduates 'to get rich and stay rich',Billionaire investor Charlie Munger says its more difficult for young people to get rich off investments — and maintain that wealth — than it used to be. Here's why.
2022-03-31 22:54:26,Why Biden’s billionaire minimum income tax may be a tough sell,"President Joe Biden has proposed a billionaire minimum tax as part of his 2023 federal budget. However, it may be a tough sell in Congress, experts say."
2022-03-31 16:51:46,"Americans are 'wasting too much money on housing,' says top economist—here are 4 ways to get 'house rich'","With interest rates on home mortgages spiking, it's getting more expensive to buy a home in the U.S. Whether you rent or own, too many people are wasting money on housing, says a Harvard-trained economist. He shares four ways to lower expenses and become ""house rich."""
2022-04-01 07:16:52,There are signs a recession could be on the way. Here are some ways to protect your savings,"If an economic downturn is around the corner, here are some ways to help protect your savings."
2022-04-01 17:39:00,"Soaring markets helped the richest 1% gain $6.5 trillion in wealth last year, according to the Fed","The wealth of the top 1% increased by $6.5 trillion last year, mainly driven by soaring stock prices and financial markets, according to the Federal Reserve."
2022-04-01 13:20:56,Sen. Bernie Sanders: Billionaires like Elon Musk and Jeff Bezos are 'off taking joy rides on their rocket ships',"Sen. Bernie Sanders, I-Vt., compared three billionaires in the U.S. to oligarchs at a recent Senate Committee on Budget hearing, citing their space companies."
2022-04-01 09:17:41,There are big shake-ups in the latest list of Asia’s 100 'best' restaurants,Japan's Den rose two spots to clinch the title of Asia's best restaurant in 2022.
2022-04-04 13:00:01,Getting a divorce? Here's how to tackle those money issues,"When going through a divorce, it's crucial to focus on future financial health, and financial advisors can help newly single ex-spouses sort out money matters."
2022-04-04 11:00:02,Here's a simple way to make a monthly budget and start saving money,"The more you track your expenses, the better you'll get at budgeting month to month."
2022-04-05 12:30:01,Op-ed: Here's what every woman needs to know about investing,
2022-04-05 04:01:01,Manhattan residential real estate sales hit a record $7.3 billion in the first quarter,"Manhattan real estate sales topped $7 billion in the first quarter, marking the strongest-ever start to a year as the market shows no signs of slowing."
2022-04-05 20:06:24,Here's how much power Elon Musk actually has at Twitter now — and what he might do with it,"Billionaire Elon Musk is now Twitter's largest outside shareholder, and joining its board of directors. Here's what it means for Twitter and Musk going forward."
2022-04-05 13:04:35,"Couples spend $2,300 on wedding flowers. Here's the best 'way to cut flower costs,' according to florists","An uptick in weddings, a shortage of flowers, and stress on the supply chain have all made wedding flowers that much pricier."
2022-04-06 20:46:11,Jack Dorsey regrets that he’s ‘partially to blame’ for the state of the internet today,Twitter co-founder and ex-CEO Jack Dorsey recently tweeted that he regrets the role his company has played in creating a centralized internet. Here's what that means.
2022-04-07 12:17:39,Inside the $87 million hilltop palace for sale in Beverly Hills,The palatial main residence reigns over 90210 from an impressive hilltop that delivers 360-degree views.
2022-04-07 06:04:06,Here's why people are still flipping out on airliners,"Despite fines, flight bans and online embarrassment, people are still having meltdowns aboard airplanes."
2022-04-08 05:21:35,Is a recession on the way? These unconventional economic indicators may provide some clues,"From the men's underwear index, to the hemline index — here are some unusual economic indicators that could be worth monitoring."
2022-04-07 18:44:28,Ketanji Brown Jackson's 1-word advice for young people: 'Persevere',Supreme Court Justice Ketanji Brown Jackson is the first Black woman to be nominated to the highest court. She wants young people to follow in her footsteps.
2022-04-08 15:40:37,"Waiving a home inspection is risky, but this hack can help—if you pull it off: Real estate agent","The homebuying market has been fiercely competitive for the last two years, and it's pushed more buyers to strip the inspection clause from their bids."
2022-04-08 15:30:46,Elon Musk says humans could eventually download their brains into robots — and Grimes thinks Jeff Bezos would do it,The concept of prolonging human life by downloading old brains into new bodies is a fixture of science-fiction. Elon Musk says it'll be possible one day.
2022-04-09 13:00:02,There’s a growing interest in wealth taxes on the super-rich. Here’s why it hasn’t happened,"Americans increasingly favor a wealth tax on the ultra-rich, but despite the uptick in proposals, these policies have struggled to gain traction."
2022-04-11 19:24:57,"Why billionaires Mark Zuckerberg, Jeff Bezos and Peter Thiel want to live longer — and Elon Musk doesn't","Tech billionaires are investing in start-ups focused on anti-aging, life-prolonging and other forms of longevity research. Here's why Elon Musk isn't among them."
2022-04-13 16:24:00,"Ex-Google CEO Eric Schmidt on the world's biggest problem: 'If we don't address climate change, we really will be toast'",Former Google CEO and chairman Eric Schmidt says climate change is the world's most pressing issue today. Here's why.
2022-04-13 13:01:17,Meet 'The Trans Capitalist' focused on bringing financial literacy to the LGBTQ+ community,"K. Kenneth Davis, a financial educator known as The Trans Capitalist, struggled with money while transitioning. Now he's helping teach and empower others."
2022-04-13 11:01:04,How to protect your savings as inflation soars,"Surging prices are making it increasingly challenging to manage the cost of living, so it's important to understand the best ways to protect your savings."
2022-04-14 11:18:03,"Lamborghini customers are now waiting more than 12 months for a car, CEO says","The wait time for a new Lamborghini SUV or super-car is now over 12 months, the automaker's CEO told CNBC."
2022-04-15 01:00:09,Elon Musk could try to run three major companies at once — the last known CEO who did it is now an international fugitive,"If Elon Musk buys Twitter, he could land on a very exclusive — and somewhat infamous — shortlist of CEOs who've run at least three of the world's largest companies at once."
2022-04-14 17:57:41,"Worried about rising inflation? With nearly risk free I bonds soon to pay 9.62%, here's what you need to know","I bonds, an inflation-protected and nearly risk-free investment, may soon pay an estimated 9.62% return. Here’s what to know before purchasing."
2022-04-14 16:27:19,MacKenzie Scott worried about paying rent with 'nickels' she earned waitressing — now she's worth $46 billion,"In 1992, aspiring writer MacKenzie Scott took a finance job to make ends meet. Now, she's a billionaire philanthropist and one of the world's wealthiest women."
2022-04-15 13:30:02,"I saved $150,000 in 5 years: Here are my top tips for growing wealth without feeling deprived","The Wealthy Wolfe founder Parween Mander shares the steps she took to save $150,000 in five years and her top tips for growing your wealth."
2022-04-20 02:27:13,Young people are saving money and paying off debt through ‘cash stuffing.’ Here’s how it works,"With inflation heating up, some TikTok creators are turning to 'cash stuffing' to manage their expenses."
2022-04-19 23:01:01,"Failing to get top grades at college could cost you £3,800 a year, new British study reveals","Graduating with a lower final degree grade from college in the U.K. could mean earning around £3,800 ($4,946) less a year, according to a study."
2022-04-20 00:28:29,Distressed sales and 9-figure discounts: Hard-to-sell mega-mansions find a last resort at real estate auction,"An auction can act as a metaphorical real-estate guillotine, slicing inflated asking prices in half or worse, according to a CNBC review of recent sales."
2022-04-19 21:42:37,A $1 million winning Powerball ticket will expire soon. Here's how much lottery players leave on the table,"Whether due to losing a ticket, not checking it closely or some other mishap, lottery winners have left millions of dollars unclaimed over the years."
2022-04-20 18:17:56,"Supreme Court rejects challenge to SALT limit from New York, New Jersey","The U.S. Supreme Court has rejected a challenge from New York and other states to overturn the $10,000 limit on the federal deduction for state and local taxes."
2022-04-20 18:35:53,Mark Zuckerberg on Sheryl Sandberg’s superpower: ‘It's just exceptionally rare to find people' with both 'IQ and EQ',Mark Zuckerberg credits much of Meta's growth to COO Sheryl Sandberg's combination of emotional intelligence and industry knowledge. Here's why.
2022-04-20 19:07:05,"What we learned from the Biden, Harris tax returns, according to experts","President Joe Biden and Vice President Kamala Harris have released their 2021 tax returns. Here are a few key takeaways, according to experts."
2022-04-21 14:48:23,Hit with an unexpected tax bill? It’s time to adjust your withholdings,"If you had a surprise bill this tax-filing season, it may be time to adjust your withholdings, according to financial experts. Here’s what to know."
2022-04-20 22:53:57,Distress sales and 9-figure discounts: Hard-to-sell mega-mansions find a last resort at real estate auction,"An auction can act as a metaphorical real-estate guillotine, slicing inflated asking prices in half or worse, according to a CNBC review of recent sales."
2022-04-22 04:36:32,Why would an Oscar-winning actor create a travel app? Kevin Costner shares his story,HearHere — a road trip app co-founded by Kevin Costner — notifies travelers when they're approaching a place with a great historical backstory.
2022-04-22 00:14:00,Florida taxpayers could face a $1 billion Disney debt bomb if its special district status is revoked,"The Florida legislature on Thursday cleared a bill that would dissolve Disney's special improvement district, effective June 2023."
2022-04-22 16:26:04,Why the U.S. is going after yachts and mansions of Russian billionaire oligarchs,
2022-04-22 17:33:13,"74% of people do not think they will ever achieve high net worth status, survey finds","Achieving high net worth status seems out of reach to many people, a survey finds. Calculating your bottom line can be the first step to becoming wealthier."
2022-04-22 14:50:22,Here’s what to do if you missed the April 18 tax filing deadline,"If you missed the April 18 tax deadline, you may cut back on penalties by filing your return promptly. Here's everything late filers need to know."
2022-04-23 13:00:01,"These are the books that Warren Buffett, Mark Zuckerberg and Daymond John turned to for crucial business lessons",Billionaires Buffett and Zuckerberg are just a few of the successful business leaders who have gleaned important lessons and career advice from books they've read throughout the years. Here are a few examples of the books on business that have influenced some of the business world's biggest success stories.
