DATE,TITLE,SUMMARY
2022-07-31 14:10:18,I spent 5 years interviewing 225 millionaires. Here are the 4 types of rich people and their top habits,"Most millionaires use similar strategies to build wealth, according to best-selling author and financial expert Tom Corley, who has interviewed 225 of them. Here are the four types of ""rich people,"" and the habits that helped them become millionaires."
2022-08-01 15:11:58,"Employee stock purchase plans can carry 'a big risk,' says advisor. What to know before buying in","If you’re working for a public company, you may have a chance to buy discounted shares through an employee stock purchase plan, or ESPP. Here's what to know."
2022-08-02 19:38:30,"The jet-tracking teen stopped tweeting Mark Cuban's flights for free, but refused $5,000 from Elon Musk for the same thing","Jack Sweeney turned down $5,000 to stop tracking Elon Musk's airplane flights. Here's why the teen stopped tracking Mark Cuban's private jets for free."
2022-08-02 18:37:37,Rent prices are soaring in these 5 U.S. metros. Here's what to know before moving to a cheaper area,"Rent prices swelled during the first half of 2022, with a double-digit increase year-over-year. Here's what to know before moving to a cheaper area."
2022-08-02 14:06:48,A 45-year-old who's been 'fake retired' for 10 years shares the surprising lessons he learned when he tried to retire early,"Early retiree Sam Dogen didn't understand the challenges of retirement when he retired early at 34 years old. Now taking on side hustles and building additional passive income streams, he explains what it means to be ""fake retired,"" and the lessons he learned along the way."
2022-08-03 23:16:35,"China, Cairo, Italy: The top ‘travel-inspired’ baby names in the U.S. and the UK","Instead of naming their kids after biblical figures or the British monarchy, some parents are choosing the names of places that hold meaningful travel memories."
2022-08-03 22:05:29,"Embryos can count as dependents on Georgia state tax returns: For many families 'there is no benefit at all,' says analyst",Residents of Georgia may now claim embryos as dependents on their 2022 state income tax returns. But the policy raises many questions.
2022-08-03 17:44:38,Why Grammy award-winning rapper Macklemore is making clothes for the golf course,"Grammy award-winning rapper Macklemore is taking his newly-found passion for golf and building his own golf apparel company, Bogey Boys."
2022-08-06 15:07:08,"'I work just 5 hours a week': This 39-year-old makes $160,000 a month in passive income—a look at his typical day","After Graham Cochrane lost his audio engineer job in 2009, he started a music blog. Now, what began as a side hustle has turned into a $160,000-per-year passive income stream. Working just five hours a week, here's what his typical day looks like."
2022-08-07 13:00:02,Self-made millionaire Bethenny Frankel: The most successful people have an ‘unstoppable nature’ that separates them from others,"The most successful people have an ""unstoppable nature"" that sets them apart from the rest, according to self-made millionaire Bethenny Frankel."
2022-08-07 12:00:01,"As climate change threatens more homes, some properties are getting too costly to insure","As climate change threatens the U.S. with more natural disasters, it's becoming increasingly costly for Americans to insure their homes, experts say."
2022-08-08 15:22:21,"Reconciliation bill includes nearly $80 billion for IRS including enforcement, audits: What that means for taxpayers","Senate Democrats on Sunday passed their climate, health and tax package, including nearly $80 billion in IRS funding. Here's what it means for taxpayers."
2022-08-09 00:21:02,Nearly half of Singaporeans want to travel to one place – and it’s not Malaysia,"Japan is the top choice for Singaporean travelers this year, but many are confused about how to get in. A Singaporean travel agent living in Japan explains."
2022-08-09 19:24:27,Inflation Reduction Act extends 'pass-through' tax break limits for 2 more years. Here's what that means for entrepreneurs,Senate Democrats' legislation would continue an existing limit on how pass-through businesses can use losses to reduce their tax bills.
2022-08-09 18:22:48,"With 87,000 new agents, here's who the IRS may target for audits","The Senate approved nearly $80 billion in IRS funding with $45.6 billion for ""enforcement."" Here's who may be affected by more audits."
2022-08-09 17:48:58,"On rare days, the market rises 5% — or even 10%, Wells Fargo finds. How to make sure you're there for it",A new Wells Fargo analysis looked at the best 20 days for the S&amp;P 500 between August 1992 and July 2022. Almost half of them occurred amid a bear market.
2022-08-09 16:42:01,"Hawaii is the 'perfect place to retire by the beach,' says millionaire—but there are 3 big downsides","Sam Dogen's parents retired in Hawaii 15 years ago — and they love it. From health care to home-buying, he shares the both the downsides and benefits of retiring in Hawaii, along with how much money you'd need to live in the beautiful state."
2022-08-10 17:23:37,"With the IRS hiring more employees, here's who agents may target for audits","The Senate approved nearly $80 billion in IRS funding with $45.6 billion for ""enforcement."" Here's who may be affected by more audits."
2022-08-11 22:13:32,How do people in Asia-Pacific feel about travel right now? It depends on where they live,"Just because people can travel doesn’t mean they will, especially in Asia-Pacific, where people have taken a more cautious approach toward the pandemic."
2022-08-11 16:38:35,"State, local relief not in cards for residents of high-tax states as House assesses Inflation Reduction Act","After fighting to repeal the SALT deduction limit, a group of House Democrats say they'll vote for the party's spending package without SALT reform."
2022-08-11 17:22:09,Self-made millionaire: 'Don't buy a home—unless you can afford to waste money',"Should you buy a home right now? Real estate expert Grant Cardone says yes—but only ""if you can afford to waste money."" Owning a home isn't always a great investment, especially during times of rising inflation and high home prices. Here's why the self-made millionaire believes most people are better off renting."
2022-08-12 18:15:12,Investors are piling into high-yield bonds. What to know before adding 'junk' to your portfolio,"With a recent influx of money pouring into high-yield bonds, financial experts urge caution before piling in. Here's what investors need to know."
2022-08-12 19:12:20,"Malcolm Gladwell, addressing criticism: 'Solitary work' can be done at home but for creative work, 'offices really do matter'",Author and podcast host Malcolm Gladwell clarifies his remote-work stance after he slammed working from home and was accused of hypocrisy.
2022-08-13 12:30:01,Elon Musk wants to cut this ‘terrible habit’ from his morning routine: ‘I suspect a lot of people do [this]',"Tesla and SpaceX CEO said he has a ""terrible habit"" of checking his phone immediately after he wakes up. He wants to swap the habit for a workout routine."
2022-08-13 12:00:01,Ultra-rich fueling sales of luxury brands despite inflation and recession fears,High-end luxury brands are reporting strong sales even as retailers catering to more mainstream customers cite a pullback in consumer spending.
2022-08-14 12:30:01,"If you're facing bankruptcy, here's what experts say to do before, during and after you file","With inflation rising and government aid waning, personal bankruptcies may start to climb again soon. If you're facing bankruptcy, here's advice from experts."
2022-08-15 20:11:15,Investors flock to green energy funds as Congress passes climate bill. What to know as assets reach ‘new territory’,There's been a surge of interest in green energy funds as Congress allocates $369 billion for climate change funding. Here's what investors need to know.
2022-08-16 18:23:22,IRS interest rates jump to 6% on Oct. 1. Here’s how much money you’ll get for a missing refund,"If you’re still waiting on a tax refund, you may be earning interest on your unpaid balance, and the rate jumps to 6% on Oct. 1, according to the IRS."
2022-08-16 19:05:06,CNBC Chairman Mark Hoffman to step down in September,CNBC Chairman Mark Hoffman will step down next month after running the network since 2005.
2022-08-17 13:15:01,Mark Cuban's advice for his younger self and anyone starting their career: Learn to 'be a salesperson',"Billionaire Mark Cuban said if he could tell his younger self one thing, it would be to do exactly what he was already doing: ""Be a salesperson."""
2022-08-17 15:52:35,"The world's largest sovereign wealth fund loses $174 billion in the first half, cites inflation and war in Europe","The $1.3 trillion fund returned a negative 14.4% during the period, as stocks and bonds reacted violently to global recession fears and skyrocketing inflation."
2022-08-17 03:49:46,"Looking for an offbeat European holiday? This island has its own rules, language and vodka","Accessible via ferry or flight, Jersey has nearly 50 miles of coastline, more sunshine than mainland U.K. and plenty for travelers to do in the Channel Islands."
2022-08-19 01:45:31,Look beyond Barcelona. Here’s where locals travel in Spain,"From beaches with crystal clear water to new luxury hotels in Madrid, Spanish residents tell CNBC where they love to go."
2022-08-18 19:58:56,The 5 most expensive cars up for sale at Pebble Beach this weekend,Auction sales at the Monterey Car Week are expected to total between $300 million and $490 million.
2022-08-18 18:23:43,Yellen: These are the 4 top priorities for the nearly $80 billion in IRS funding,Treasury Secretary Janet Yellen has outlined four priorities for the $80 billion in IRS funding and requested a plan within six months.
2022-08-18 22:40:31,"What to know about adding a ‘green’ investment fund to your portfolio, now that Biden signed historic climate bill","President Joe Biden signed the Inflation Reduction Act, a historic climate measure. Here's how investors can buy funds with an environmental focus."
2022-08-18 18:48:47,'Company loyalty will make you poor': Early retiree credits his $1 million net worth to these 7 ‘unpopular opinions',"Self-made millionaire Steve Adcock retired early in his mid-30s. He got rich the old-fashioned way, by working a 9-to-5 and saving and investing wisely. He also attributes his financial success to seven unpopular life and money rules."
2022-08-19 17:58:49,There’s a new 1% tax on stock buybacks — here's what it means for your portfolio,President Joe Biden's new 1% excise tax on corporate stock buybacks adds a new levy to the controversial practice. Here's how it may affect investors.
