DATE,TITLE,SUMMARY
2022-12-17 13:25:40,Third Point could see big returns from small changes at Bath & Body Works,Dan Loeb's hedge fund expects the retailer can resolve many of its issues by bringing more experience to Bath & Body work's board.
2022-12-18 12:27:18,Top Wall Street analysts pick these stocks for 2023,"TipRanks analyst ranking service pinpoints Wall Street's best-performing stocks, including Oracle & Domino's."
2022-12-21 18:23:45,Bob Pisani: Think you're a rational investor? These biases make it harder to reach your financial goals,"Most people like to think that they're rational. But — at least when it comes to investing — that's not always the case, Bob Pisani says in his new book."
2022-12-25 13:00:01,Top Wall Street analysts say buy these stocks in a challenging 2023,"TipRanks analyst ranking service pinpoints Wall Street's best-performing stocks, including Amazon and Costco."
2022-12-27 18:01:45,Michael Farr: These are 2023's top stock picks for what could be a rocky year,Lower lows could be ahead for investors. Here are Michael Farr's picks for the new year.
