DATE,TITLE,SUMMARY
2022-11-07 06:43:00,Elon Musk delays $8 'blue check' Twitter verification plan until after the midterms,"Twitter is delaying the rollout of account verifications for its paid Twitter Blue subscription plan until after the midterm elections, a source with knowledge of the decision confirmed to CNN."
2022-11-07 07:43:00,Twitter could be a new wild card for the midterms,"For years, Twitter has been a leader in countering misinformation and protecting elections. It was often ahead of its peers in creating and enforcing new policies, and it was the first major platform to ban former President Donald Trump after the Capitol insurrection, pushing others to follow suit."
2022-11-07 10:43:00,Kathy Griffin suspended from Twitter for impersonating Elon Musk,"Twitter has suspended comedian Kathy Griffin for impersonating the company's new owner, Elon Musk."
2022-11-07 12:43:00,Airbnb to make prices clearer after user complaints of hidden fees,"Airbnb on Monday said it plans to make the total cost of rental properties, including all fees, clearer to customers as they search for places to stay, addressing what is arguably one of the biggest pet peeves about the platform."
2022-11-07 13:43:00,Meta said to be planning significant layoffs,Facebook-parent Meta is said to be planning the first significant layoffs in its history as the company grapples with a shrinking business and fears of a looming recession.
2022-11-07 14:43:00,Why Apple may be working on a 'hey Siri' change,"Apple reportedly wants to put an end to ""Hey."""
2022-11-07 16:43:00,Wall Street Journal: Meta said to be planning significant layoffs,"Facebook-parent Meta is said to be planning the first significant layoffs in its history as the company grapples with a shrinking business and fears of a looming recession, according to the Wall Street Journal."
2022-11-07 17:43:00,Wall Street Journal: Meta is planning significant layoffs,"Facebook-parent Meta is planning the first significant layoffs in its history as the company grapples with a shrinking business and fears of a looming recession, according to the Wall Street Journal."
2022-11-08 07:43:00,iPhone factory workers in China offered bonuses to return to work,One of Apple's largest suppliers is trying to strike a delicate balance in China.
2022-11-08 08:43:00,"A beginner's guide to Mastodon, the Twitter alternative that's on 🔥","If you've heard the word ""mastodon"" a lot since Elon Musk took over Twitter in late October, here's why: The extinct mammal is also the name of a relatively small, formerly little-known social network that has skyrocketed in popularity, as many Twitter users try it out as an alternative for connecting with others online."
2022-11-08 11:43:00,Elizabeth Holmes' request for a new trial is denied,"A federal judge has denied Elizabeth Holmes' request for a new trial, according to court filings on Monday, paving the way for the founder of failed blood testing startup Theranos to be sentenced later this month."
2022-11-08 15:43:00,EU opens deeper probe of Microsoft's Activision deal,"The European Union is taking a closer look at Microsoft's proposed $68.7 billion purchase of video game giant Activision Blizzard, citing concerns the deal could hurt competition in the video game industry."
2022-11-08 18:43:00,Wall Street Journal: Mark Zuckerberg tells employees layoffs coming Wednesday,"Meta CEO Mark Zuckerberg told company executives that major layoffs at the tech giant will begin on Wednesday morning, the Wall Street Journal reported Tuesday afternoon."
2022-11-08 20:43:00,"Twitter to debut gray 'official' check mark to verify government accounts, media and major brands","Twitter said Tuesday evening that to resolve ambiguity about which accounts on its platform have been identity-verified — as opposed to those simply paying $8 a month for a blue check mark on their profiles — the company will introduce a new, gray check mark as part of an ""official"" label."
2022-11-09 07:43:00,"Meta to lay off 11,000 employees, 13% of workforce","Facebook-parent Meta on Wednesday said it is laying off 11,000 employees, marking the most significant job cuts in the tech giant's history."
2022-11-09 08:43:00,Layoffs could weaken Twitter in its biggest global growth markets,It's less than two weeks since Elon Musk completed his acquisition of Twitter and already there are concerns that the company is choosing to ignore key risks in its biggest international growth markets.
2022-11-09 11:43:00,Why Twitter is rolling out gray 'official' check marks,"Days after Elon Musk promised to blow up Twitter's account verification process by giving anyone the option to pay for a blue check mark, he appears to have accepted that some prominent users do need to actually be verified after all."
2022-11-09 11:43:00,Germany blocks sale of chip factory to China over security fears,The German government has blocked the sale of one of its semiconductor factories to a Chinese-owned tech company because of security concerns.
2022-11-09 13:43:00,Tesla drivers will be able to make Zoom calls from their car,"Tesla drivers will soon be able to take a video call directly from their vehicle's touchscreen dashboard, Zoom announced Tuesday."
2022-11-09 13:43:00,Twitter briefly rolled out gray 'official' check marks. Then Elon Musk changed his mind,A new verification mark intended to better identify prominent Twitter accounts has instead become the latest source of chaos at the company under new owner Elon Musk.
2022-11-09 17:43:00,Elon Musk pleads with advertisers to stay on Twitter,"Twitter owner Elon Musk pleaded with advertisers to keep using his platform on Wednesday as he sketched out his plans for user verification, content moderation and even his intention to add banking features to Twitter in front of a live audience of over 100,000 users."
2022-11-09 19:43:00,Biden says Elon Musk's relationship with other countries 'worthy of being looked at',"President Joe Biden said Twitter owner and Tesla CEO Elon Musk's relationship with other countries was ""worthy of being looked at,"" but declined to say how that could be done."
2022-11-09 21:43:00,Twitter battles wave of impersonators after launching new paid verification system,"Twitter appears to be battling a wave of celebrity and corporate impersonators on its platform who have quickly gamed the company's new paid verification system, hours after its launch"
2022-11-10 08:43:00,The sudden decline of one of the largest crypto exchanges could rattle the sports industry,"The near collapse this week of FTX, one of the largest cryptocurrency exchanges, has sent shockwaves throughout the crypto startup and investment community. But the fallout could also spread to the sports industry."
2022-11-10 08:43:00,This company wants to make air travel sustainable,"In 2019, Air Company made a splash when it launched vodka derived from recaptured carbon, in an effort to reduce the amount of the harmful greenhouse gas in the atmosphere."
2022-11-10 13:43:00,Twitter's cybersecurity chief quits amid company turmoil,"Twitter's chief information security officer announced their resignation on Thursday, vacating one of the company's most critical roles just as scrutiny is mounting over Twitter's future and the erratic decisions of its new owner, Elon Musk."
2022-11-10 13:43:00,Silicon Valley's greatest minds misread pandemic demand. Now their employees are paying for it.,"In the early months of the pandemic, Facebook only grew bigger and more central to our lives. With lockdowns spreading, countless people began shopping, socializing and working on Facebook and other online platforms. As CEO Mark Zuckerberg said in March 2020, usage was so high that the company was ""just trying to keep the lights on."""
2022-11-10 18:43:00,Twitter executives quit amid company turmoil,"Twitter's chief information security officer announced their resignation on Thursday, vacating one of the company's most critical roles just as scrutiny is mounting over Twitter's future and the erratic decisions of its new owner, Elon Musk."
2022-11-11 00:43:00,Australia blames Russian-linked ransomware gang for Medibank data breach,"Cyber criminals with links to Russia are behind the attack on one of Australia's largest private health insurers, the Australian Federal Police (AFP) said Friday."
2022-11-11 01:43:00,Australia blames Russian-linked cyber criminals for Medibank data breach,"Cyber criminals with links to Russia are behind a ransomware attack on one of Australia's largest private health insurers that's seen sensitive personal data published to the dark web, the Australian Federal Police (AFP) said Friday."
2022-11-11 03:43:00,Australia blames cyber criminals in Russia for Medibank data breach,"Cyber criminals in Russia are behind a ransomware attack on one of Australia's largest private health insurers that's seen sensitive personal data published to the dark web, the Australian Federal Police (AFP) said Friday."
2022-11-11 07:43:00,Apple curbs AirDrop file sharing on devices in China,"Apple has limited the use of the AirDrop wireless file sharing function on devices in China, just weeks after reports that some protesters had used the popular feature to spread messages critical of the Chinese government."
2022-11-11 11:43:00,A day of chaos brings Twitter closer to the brink,"Two weeks after Elon Musk completed his acquisition of Twitter, the future of the company has never looked less certain."
2022-11-11 15:43:00,"Musk's Twitter may have already violated its latest FTC consent order, legal experts say","Just two weeks into Elon Musk's ownership of Twitter, the company may have already violated its consent agreement with the Federal Trade Commission, legal experts said."
2022-11-13 13:44:00,A guide to parental controls on social media,"A little over a year ago, social media companies were put on notice for how they protect, or fail to protect, their youngest users."
2022-11-14 01:44:00,Elon Musk says 'I have too much work on my plate',"Billionaire Elon Musk said on Monday he was working ""at the absolute most amount ... from morning til night, seven days a week"" when asked about his recent acquisition of Twitter and his leadership of automaker Tesla."
2022-11-14 05:44:00,How an 'electronic nose' could help fight wildfires,"German startup Dryad has designed a cheap sensor that it says could drastically speed up the detection of wildfires, reducing damage and cutting carbon emissions."
2022-11-14 12:05:00,Elon Musk's SpaceX is buying an ad package on Elon Musk's Twitter,"While a number of major brands have announced advertising pauses on Twitter in the wake of Elon Musk's acquisition, the platform has scored a new ad buy from one notable billion-dollar business: Musk's SpaceX."
2022-11-14 15:05:00,Google agrees to $392 million settlement with 40 states over location tracking practices,"Google has agreed to a record $391.5 million settlement with 40 states for allegedly misleading consumers over its location tracking practices, a coalition of attorneys general announced Monday."
2022-11-14 16:05:00,New York Times: Amazon plans to lay off thousands of employees,"Amazon is planning to lay off some 10,000 employees in corporate and technology jobs, the New York Times reported on Monday, citing anonymous sources with knowledge of the matter."
2022-11-15 09:05:00,Apple invested $450 million in a satellite-powered SOS system. We tested it out,"When Apple announced at its closely-watched September product launch event that it would soon introduce an Emergency SOS feature powered by a network of satellites orbiting above Earth, Brooklyn probably wasn't the secluded location most had in mind for using it."
2022-11-15 12:05:00,We tried Apple's new SOS tool for when you don't have cell service,"When Apple announced at its closely-watched September product launch event that it would soon introduce an Emergency SOS feature powered by a network of satellites orbiting above Earth, Brooklyn probably wasn't the secluded location most had in mind for using it."
2022-11-15 14:05:00,"Amazon launches message-based virtual clinic for allergies, acne and hair loss","Amazon on Tuesday launched a virtual clinic to treat common health conditions, including allergies, acne and hair loss, in the latest move by the e-commerce giant to expand its reach into the health care industry."
2022-11-15 17:05:00,Twitter chaos spills into public view as Musk clashes with and fires employees on the platform,"Elon Musk has publicly clashed with a growing number of Twitter employees about the state of the platform, and fired at least one of them in a tweet, in an unusually visible sign of corporate chaos after his $44 billion takeover of the influential company."
2022-11-16 09:05:00,Elon Musk gives ultimatum to Twitter employees: Do 'extremely hardcore' work or get out,"Twitter's new owner Elon Musk has given employees until Thursday evening to commit to ""extremely hardcore"" work or else leave the company, according to a copy of a late-night internal email sent by the billionaire and obtained by CNN."
2022-11-16 13:05:00,Amazon confirms it has begun laying off employees,"Amazon confirmed on Wednesday that layoffs had begun at the company, two days after multiple outlets reported the e-commerce giant planned to cut around 10,000 employees this week."
2022-11-17 02:06:00,UK orders Chinese-owned company to sell Britain's biggest chipmaker,"The UK government has ordered a Chinese-owned company to unwind its takeover of Britain's biggest chipmaker, citing national security concerns."
2022-11-17 08:06:00,Elon Musk is planning a subtle change to Twitter that could make it harder to stop the bots,"Elon Musk has been saying for months that he wants to stamp out spam and fake accounts on Twitter, but a subtle change he's planning to make to the platform could complicate that goal."
2022-11-17 11:06:00,These fireball-dropping drones are on the frontlines of wildfire prevention,"As US wildfires have grown larger and deadlier in recent years, one company is using drones and fire-starting ""dragon eggs"" to help prevent extreme blazes and save firefighters' lives."
2022-11-17 11:06:00,What a Republican-controlled House could mean for Silicon Valley,"With Republicans projected to take control of the House as a result of the midterm elections, tech giants such as Amazon, Google and Meta, who've been in the crosshairs of Democrats in recent years, are soon set to face a very different — but no less hostile — political climate in Washington."
2022-11-17 15:06:00,Good luck finding an iPhone 14 Pro before Christmas,"If you haven't ordered one of the higher-end iPhone 14 models by now, it may be harder than usual to get one before the holidays."
2022-11-17 15:06:00,Airbnb CEO on the tech downturn: 'It's like we're all in a nightclub and the lights just came on',"After years of seemingly unstoppable growth, the tech industry is now facing the ""ultimate reality check"" as it confronts broader economic uncertainty and waves of layoffs, Airbnb CEO Brian Chesky told CNN on Thursday."
2022-11-17 16:06:00,It's decision day for Twitter employees on whether to work under Musk,"One day after Elon Musk gave Twitter employees an ultimatum to commit to working in an ""extremely hardcore"" fashion at the company or leave, some staffers are preparing to exit the company while others are wrestling with the decision."
2022-11-17 17:06:00,The rise and fall of Elizabeth Holmes: A timeline,"More than three years after Elizabeth Holmes was first indicted and nearly four months after her trial kicked off, the founder and former CEO of failed blood testing startup Theranos was found guilty on four out of 11 federal fraud and conspiracy charges."
2022-11-17 19:06:00,Twitter employees head for the exits after Elon Musk' 'extremely hardcore' work ultimatum,"Another employee exodus appears to be underway at Twitter as many workers rejected Elon Musk's ultimatum to work ""extremely hardcore,"" choosing instead to depart the company, according to multiple current and former employees."
2022-11-17 19:06:00,Amazon CEO says job cuts will continue into next year,"Amazon CEO Andy Jassy said job cuts at the e-commerce giant would continue into early next year, in his first public remarks since the company began widespread layoffs earlier this week."
2022-11-17 20:06:00,Twitter employees head for the exits after Elon Musk's 'extremely hardcore' work ultimatum,"Another employee exodus appears to be underway at Twitter as many workers rejected Elon Musk's terms for staying with the company, choosing instead to depart, according to multiple current and former employees."
2022-11-18 07:06:00,Elizabeth Holmes scheduled to be sentenced on Friday,"Elizabeth Holmes, the founder of failed blood testing startup Theranos who was convicted of fraud earlier this year, is scheduled to be sentenced on Friday morning by a judge in court in San Jose, California."
2022-11-18 11:06:00,"As Twitter staff empties out, users fear the worst for platform","On Thursday night, following another exodus of Twitter employees, the outage detection site Down Detector showed a spike in users reporting issues accessing the social media platform. A chart of the sharp increase in outage reports was shared by some users on Twitter, appearing to validate a growing fear that the site would struggle to stay online with fewer staff. But that wasn't exactly the case just yet."
2022-11-18 12:06:00,Twitter is the world's digital public square. What if it dies?,"If Twitter were to suddenly cease to exist, the consequences would be enormous, given how integral the platform is to global communications."
2022-11-18 15:06:00,What to do if you're worried about your Twitter account going away,"As #RIPTwitter continues to trend on Twitter itself and a legion of engineers and other staffers exit the company, some users are preparing for a world without their accounts."
2022-11-18 16:06:00,"Elon Musk unbans several controversial Twitter accounts, but says not yet on Trump","Elon Musk on Friday said Twitter plans to restore several controversial accounts that had previously been banned or suspended, but added that the company has not yet made a decision about the account of former President Donald Trump."
2022-11-18 18:06:00,Elizabeth Holmes sentenced to more than 11 years in prison for fraud,Elizabeth Holmes was sentenced to more than 11 years in prison on Friday following her conviction in January for defrauding investors while running the failed blood testing startup Theranos.
2022-11-20 10:06:00,Twitter was already in disarray. Trump's return will only make it more chaotic,"With his decision on Saturday to restore the personal Twitter account of former President Donald Trump nearly two years after it was permanently banned, Elon Musk could plunge Twitter deeper into chaos — and that may be the point."
2022-11-20 10:06:00,Kindle's 15-year anniversary is a reminder simplicity is king,"Len Edgerly, a 72-year-old podcaster from Cambridge, Massachusetts, has spent the last 14 and a half years talking about his favorite tech product of all time: the Kindle."
2022-11-20 11:06:00,Is AI art really art? This California gallery says yes,"As artificial intelligence becomes increasingly popular for generating images, a question has roiled the art world: Can AI create art?"
2022-11-20 16:06:00,Collapsed FTX owes nearly $3.1 billion to top 50 creditors,"Cryptocurrency exchange FTX, which has filed for US bankruptcy court protection, said it owes its 50 biggest creditors nearly $3.1 billion."
2022-11-21 10:06:00,Twitter Africa employees accuse Elon Musk of discrimination over severance terms,"Laid-off employees at Twitter's Africa headquarters are accusing Twitter of ""deliberately and recklessly flouting the laws of Ghana"" and trying to ""silence and intimidate"" them after they were fired."
2022-11-21 11:06:00,"Twitter won't restore Alex Jones' account, Elon Musk says","Conspiracy theorist Alex Jones won't be returning to Twitter and will remain banned from the platform, according to its new owner, Elon Musk."
2022-11-21 14:06:00,"As Meta and Twitter slash staff, TikTok plans to keep hiring","While much of Silicon Valley is grappling with hiring freezes and job cuts, at least one social media company is still planning to keep hiring: TikTok."
2022-11-21 14:06:00,,"Five days after its successful launch, NASA's Artemis I reached just 80 miles above the moon's surface. Previously the spacecraft also shared impressive views of the Earth."
2022-11-21 22:06:00,Elon Musk says Twitter is 'holding off' restarting paid verification over impersonation concerns,"Elon Musk said Monday evening that Twitter is ""holding off"" the restart of his paid account verification plan over continued concerns of impersonation on the social media platform."
2022-11-22 15:06:00,The federal government just took another big swipe at illegal robocalls,"The federal government took another big swipe at illegal robocalls on Tuesday, as it moved to block a voice provider from the entire US phone network for the very first time."
2022-11-22 15:06:00,Elon Musk has upended Twitter's business. Here's how he could fix it,"Much of Twitter's ad sales team has been fired or pushed out. Large companies from General Mills to Macy's have paused advertising on the platform, with more potentially following suit after new owner Elon Musk's decision to restore the account of former President Donald Trump and other controversial figures. And any cursory scroll of the platform will likely show you fewer big brand ads."
2022-11-22 19:06:00,"HP says it will lay off up to 6,000 workers over the next couple years","HP Inc. announced on Tuesday that it will lay off thousands of workers over the next three years, becoming the latest tech company to significantly downsize staffing amid a souring economic climate."
2022-11-23 10:07:00,"Workers at the world's largest iPhone factory in China clash with police, videos show","Workers at China's largest iPhone assembly factory were seen confronting police, some in riot gear, on Wednesday, according to videos shared over social media."
2022-11-23 13:07:00,House Republicans say TikTok made misleading claims in briefings on data handling,"House Republicans say TikTok may have misled congressional staff in private briefings about the company's handling of US user data, in a new letter to the short-form video app this week."
2022-11-23 15:07:00,Hive is the latest Twitter alternative to gain steam — and to show how hard it would be to replace Twitter,"Elon Musk's rocky takeover of Twitter has already been marked by mass layoffs, resignations and the reinstatement of former president Donald Trump's account, as well as other controversial figures, leaving many users uncertain about the direction of the platform's future."
2022-11-24 16:07:00,Elon Musk says he will begin restoring previously banned Twitter accounts next week,"Elon Musk said Thursday that he will begin restoring most previously banned accounts on Twitter starting next week, in his most wide-reaching move yet to undo the social media platform's policy of permanently suspending users who repeatedly violated its rules."
2022-11-25 02:07:00,The US-China chip war is spilling over to Europe,"Two European chip deals have run into trouble over their links with China, a sign of concern spreading in the West over potential Chinese control of critical infrastructure."
2022-11-25 07:07:00,UK bans Chinese surveillance cameras from 'sensitive' sites,"Hikvision, a leading Chinese surveillance company, has denied suggestions that it poses a threat to Britain's national security after the UK government banned the use of its camera systems at ""sensitive"" sites."
2022-11-25 12:07:00,Musk says new color-coded verification system at Twitter will roll out in a week,"Elon Musk is ready to try his troubled new verification system for Twitter once again. This time, in color."
2022-11-25 21:07:00,Apple has a huge problem with its supplier's iPhone factory in China,A violent workers' revolt at the world's largest iPhone factory this week in central China is further scrambling Apple's strained supply and highlighting how the country's stringent zero-Covid policy is hurting global technology firms.
2022-11-26 06:07:00,Apple has a huge problem with an iPhone factory in China,A violent workers' revolt at the world's largest iPhone factory this week in central China is further scrambling Apple's strained supply and highlighting how the country's stringent zero-Covid policy is hurting global technology firms.
2022-11-27 05:07:00,A look back at Elon Musk's chaotic first month at Twitter,Sunday officially marks one month since the world's richest man took the helm at Twitter.
