DATE,TITLE,SUMMARY
2022-08-10 08:07:16,Protesters disrupt Los Angeles City Council vote on banning homeless encampments near schools,Two people were arrested at a Los Angeles City Council meeting after a group of protesters disrupted a vote on a measure that bars homeless people from gathering near schools.
2022-08-10 10:00:28,"On this day in history, August 10, 1776, Declaration of Independence reaches London","The Second Continental Congress adopted the Declaration of Independence on July 4, 1776. It took five weeks past that point for its rejection of British authority to reach London."
2022-08-10 09:59:38,Disneyland honors Marine who died during 2021 Kabul attack,"Marine Lance Cpl. Dylan Merola, who was killed during the 2021 Afghanistan exit, was honored during the Disneyland Resort Flag Retreat Ceremony."
2022-08-10 09:45:29,Wisconsin Gov. Tony Evers slams GOP primary winner Tim Michels as 'most extreme and divisive nominee possible',"Following Trump-backed Tim Michels' victory in Tuesday night's GOP gubernatorial primary, Wisconsin Democratic Gov. Tony Evers slammed his opponent, calling him ""extreme and divisive."""
2022-08-10 09:00:42,"Trump targeted by Biden administration, and they can do it to you, too",FBI raid shows how Biden administration weaponized the Justice Department and is using it against their political opponents like former President Trump.
2022-08-10 08:59:22,Biden to sign bipartisan burn pits legislation designed to support veterans,President Joe Biden on Wednesday will sign the bipartisan PACT Act to deliver more timely benefits and services to veterans exposed to toxic burn pits.
2022-08-10 10:48:40,"FBI raid on Trump's FL home leaves unanswered questions, AOC's constituents sound off and more top headlines",INSIDE THE INVESTIGATION - FBI raid on Trump's home leaves Americans with more questions than answers
2022-08-10 10:41:29,"NFL great Frank Gore arrested in New Jersey on simple assault charge, police say","NFL great Frank Gore was arrested at a New Jersey casino late last month on a simple assault charge, police revealed Tuesday. Gore is due in court in October."
2022-08-10 11:58:32,"More migrant buses arrive in New York City, days after Mayor Eric Adams scolded Texas Gov. Greg Abbott","Three more buses carrying migrants from Texas arrived in New York City Wednesday morning, the latest in an effort by Texas Gov. Greg Abbott to bring attention to the migrant crisis."
2022-08-10 11:49:34,Trump’s grip over GOP remains firm as Michels tops Kleefisch in Wisconsin primary face-off,"Former President Donald Trump’s clout over the Republican Party was once again on the line in a key gubernatorial primary, and once again the former president’s endorsed candidate won"
2022-08-10 11:45:20,Jeep has reinvented the windshield wiper. Here’s how it works,The new Clean Sweep: Jeep windshield wiper system channels water through the blades to spray it directly ahead of them making them more effective on dirt.
2022-08-10 11:32:02,Kevin Costner honors the late Ray Liotta: He 'will be out there with us all' during 'Field of Dreams' game,"""Yellowstone"" star Kevin Costner took to his Instagram to honor ""Goodfellas"" star Ray Liotta, ahead of the second ""Field of Dreams"" game for the MLB. Liotta passed away in his sleep in May."
2022-08-10 11:20:45,"Roger Goodell defends Deshaun Watson suspension appeal, cites evidence of 'predatory behavior'",NFL Commissioner Roger Goodell defended the decision to appeal the six-game suspension levied on Deshaun Watson. Goodell said there was enough evidence.
2022-08-10 10:48:40,"Burning questions about FBI raid on Trump, AOC's constituents sound off and more top headlines",INSIDE THE INVESTIGATION - FBI raid on Trump's home leaves Americans with more questions than answers
2022-08-10 11:00:43,AFT union promotes method for teachers to help kids change their pronouns without parents knowing,The American Federation of Teachers union promoted the use of a pronoun card for classrooms and provided an option for students to hide their pronouns from their parents.
2022-08-10 11:00:20,FBI raid of Trump's Mar-a-Lago home won't help Democrats in 2024,Some Democrats fervently hope that Trump will run in 2024 because they think that they can defeat him. But others want him to be disqualified by law...
2022-08-10 10:54:53,Jennette McCurdy explains why she was 'jealous' of Ariana Grande: 'Much easier upbringing',"Actress Jennette McCurdy said her career is stagnant and detailed why she was ""jealous"" of Ariana Grande while the stars filmed one season of their Nickelodeon show ""Sam & Cat."""
2022-08-10 13:58:24,"Washington State issues read flag over potential lightning, dry conditions can lead to fires",The National Weather Service issued a warning from 2 a.m. to 11 p.m. on Wednesday. Washington officials fear the dry conditions may lead to a fire if lightning strikes.
2022-08-10 13:55:41,Abbott's campaign hits back after NYC Mayor Adams threatens to bus New Yorkers to Texas,New York City Mayor Eric Adams on Tuesday said he is considering sending a bus load of New Yorkers to Texas in order to help campaign against Texas Gov. Greg Abbott.
2022-08-10 13:53:19,Video shows group of New York City teens opening fire,"New York City police are searching Wednesday for four suspects involved in the shooting of a 17-year-old in the city's Queens borough, which was caught on video."
2022-08-10 13:52:38,Motown legend Lamont Dozier dead at 81,"Lamont Dozier, Motown hitmaker for The Supremes and more, passed away at age 81 at his home near Scottsdale, Arizona, according to a statement issued by his family."
2022-08-10 13:48:16,Woman says 'I hate Mexicans' after punching subway rider in the face: NYPD,Police in New York City are looking for a woman accused of punching another woman on a subway train and saying “I hate Mexicans” as her reason why.
2022-08-10 13:40:56,Herschel Walker says he’s ‘glad’ anti-Trump GOP group used his ex-wife’s graphic comments in new ad,GOP Senate nominee Herschel Walker of Georgia says he’s “glad” that an anti-Trump group launched an ad that includes comments from his ex-wife describing him threatening to shoot her
2022-08-10 13:35:57,Secret Service officer assaulted outside White House; suspect arrested,"The U.S. Secret Service said one of its officers was assaulted outside the White House and suffered non-life-threatening injuries on Tuesday afternoon, and a suspect was taken into custody."
2022-08-10 13:33:43,"South Carolina paramedic, biker killed by car that rammed through wreck scene",A South Carolina paramedic and a motorcyclist died when an elderly woman crashed into a wreck site from an earlier crash. Four total people were struck by the car.
2022-08-10 13:32:02,"Florida AG Moody calls out Biden: Stop 'cowering behind a cough,' reassure Americans after Trump raid",Florida Attorney General Ashley Moody warns of the FBI's overreach and overwhelming response to recover items from Trump's Mar-a-Lago.
2022-08-10 13:29:08,"Illinois' lottery numbers for Tuesday, Aug. 9","Mega Millions jackpot is $65,000,000 and Powerball reaches $35,000,000. Illinois's Luckyday Lotto Evening numbers for Tuesday, Aug. 9 are 2-15-16-27-44."
2022-08-10 14:53:59,"Matthew McConaughey: Down-to-earth Oscar-winning American actor, producer, husband, father","American actor Matthew McConaughey has appeared in Oscar-winning film ""Dallas Buyer's Club."" He has recently become more involved in politics."
2022-08-10 14:48:16,The Porsche Taycan just reclaimed this record from the Tesla Model S,"A Porsche Taycan Turbo S has set a new track record for electric production cars at Germany's Nurburgring race track, beating one held by the Tesla Model S."
2022-08-10 14:45:57,"Beto O’Rourke faults Dems for dip in Hispanic support, calls Abbott migrant buses to DC 'publicity stunt'","Democratic gubernatorial nominee Beto O’Rourke of Texas heavily criticizes GOP Gov. Greg Abbott, and blames fellow Democrats for the dip in Hispanic support, in a Fox News interview."
2022-08-10 14:44:03,San Francisco DA Jenkins officially launches bid to hold onto office after Boudin ousting,"San Francisco District Attorney Brooke Jenkins is running to retain her position in the upcoming special DA election, after taking the position when Boudin was recalled."
2022-08-10 14:43:36,"Mar-a-Lago Raid: Trumpers see investigations as 'badge of honor', 'point of pride', says NY Times guest essay",A New York Times guest essay from Tuesday argued that Trump and his supporters welcome federal investigations and play up persecution to generate political capital.
2022-08-10 14:41:51,UK summons Chinese ambassador over 'aggressive' escalation on Taiwan,"British Foreign Secretary Liz Truss summoned China's ambassador to Britain, Zheng Zeguang, to explain China's actions towards Taiwan in the aftermath of Speaker Nancy Pelosi's visit."
2022-08-10 14:40:12,Chicago infant back home safe after being kidnapped in violent home invasion,Chicago police are investigating after an infant was kidnapped in a violent home invasion only to be returned hours later. The 8-month-old girl's mother knew the invader.
2022-08-10 14:40:08,"Lawn care is made easy this summer with synthetic grass, says home contractor","Homeowners can keep their grass ""alive"" in the summer season with synthetic grass. Whether it's grass-specific for sports, golf or the dog, synthetic turf is a smart option, says a home contractor."
2022-08-10 14:34:50,"Trump raid could warrant AG Garland's impeachment, Rand Paul says: 'This is beyond the pale'","Sen. Rand Paul, R-Ky., reacts to the FBI raid of Mar-a-Lago, emphasizing the need for an investigation into the DOJ and Attorney General Merrick Garland."
2022-08-10 14:12:42,Trump invokes Fifth Amendment rights in deposition for New York AG James' civil investigation,Former President Trump is sitting down for a deposition as part of New York Attorney General Letitia James's civil investigation into his family's business practices.
2022-08-10 15:41:30,4-year-old killed after wandering onto Indiana freeway,Police say a 4-year-old boy died after wandering onto an Indiana freeway at 4 a.m. on Monday. Emergency responders pronounced the boy dead at the scene after performing CPR.
2022-08-10 15:41:16,Elderly man defending NYC laundromat from hammer-wielding detergent bandit caught on cam,The New York Police department is looking for a hammer-yielding detergent bandit accused of hitting a 70-year-old laundromat employee.
2022-08-10 15:38:57,"Naked Florida man wielding machete tried to steal another man's clothes, deputies say","Deputies in Volusia County, Florida, arrested a naked man at a gas station in DeLand after he allegedly threw a machete at another man and tried to steal his clothes."
2022-08-10 15:35:48,Former Trump adviser Ja'Ron Smith launches public safety coalition to reduce violent crime,"Ja’Ron Smith, who served as special assistant for domestic policy under President Trump, has launched a national public safety coalition aimed at combating rising crime rates."
2022-08-10 15:35:36,Pirates’ Rodolfo Castro has phone fall out of pocket during third-base slide,Pittsburgh Pirates infielder Rodolfo Castro had his cellphone fall out of his back pocket while sliding into third base in the fourth inning of Tuesday's game in Arizona.
2022-08-10 15:34:00,Whitney Houston's brother pays tribute to the late singer with performance for her 59th birthday,"The Whitney E. Houston Legacy Foundation put on a gala on Tuesday where the late singer's brother Gary performed to honor his sister. The event took place in Atlanta, Georgia."
2022-08-10 15:31:43,Trump raid leaves me with 8 important questions as a Senate Judiciary Committee member,I am a Republican senator from Utah and serve on the Senate Judiciary Committee. The raid at Trump's Mar-a-Lago home leaves me with 8 critical questions.
2022-08-10 15:27:59,"As kids prepare to head back to school, doctors reveal heavy backpacks have to go","As back-to-school time approaches for students — or has already begun, in many areas — doctors share tips for parents and kids about overweight backpacks and the damage they can do."
2022-08-10 15:26:03,Keith Hernandez takes shot at Mets rival: 'I hate doing Phillies games',Keith Hernandez said during the SNY telecast of the Mets-Reds game that he hates doing Phillies games because over the years they do not play fundamentally sound baseball.
2022-08-10 15:26:00,White Sox's Tim Anderson expected to miss six weeks with tear in left hand,"White Sox All-Star shortstop Tim Anderson is expected to miss the next six weeks due to a tear in his left hand, which he suffered last weekend."
2022-08-10 16:54:45,Vulnerable House Democrats won't say if they plan to vote for Manchin Inflation Reduction Act,House Democrats in tough midterm races refused to say how they plant to vote on the Inflation Reduction Act or how they feel about hiring thousands of new IRS agents.
2022-08-10 16:52:14,Study finds exposure to 'forever' chemicals in household products leads to liver cancer,"A new study published by the Keck School of Medicine found a correlation between regular exposure to ""forever"" chemicals and liver cancer."
2022-08-10 16:48:49,Cameron Smith shuts down questions about LIV Golf deal: 'I’m here to win the FedEx Cup playoffs',2022 British Open Champion Cameron Smith declined to comment on reports that he has already signed a deal to join LIV Golf ahead of this week's FedEx Cup playoff tournament.
2022-08-10 16:48:04,India to begin 'mix and match' COVID booster vaccines this week,"India announced on Wednesday that the country will begin offering Biological E's COVID-19 vaccine Corbevax, which can be paired with both of the country's available vaccines."
2022-08-10 16:47:45,"MLB at Field of Dreams: A-Rod, David Ortiz star in hilarious trailer ahead of Cubs, Reds game",Alex Rodriguez and David Ortiz starred in a fun trailer to hype the MLB at Field of Dreams game between the Chicago Cubs and the Cincinnati Reds.
2022-08-10 16:46:49,Expert casts doubt on report that Ukrainian special forces behind Crimea airfield attack,"Ukrainian special forces is claiming credit for a blast at an air base in Russian-occupied Crimea, but an expert on the region expressed skepticism at the claim."
2022-08-10 16:45:40,Alabama boy says he accidentally shot mother after giving fake story about her death: sheriff's office,"A 12-year-boy accidentally shot and killed his mother, then gave a fake story of what happened the Jefferson County, Alabama Sheriff's Office said in a statement."
2022-08-10 16:43:42,Jacksonville Jaguars will play starters 'a couple series' in first pre-season game against Browns,"The Jacksonville Jaguars coach Doug Peterson announced that he will play starters for ""a couple of series"" in the team's second preseason game against the Browns."
2022-08-10 16:40:55,Abbott sends message to NYC Mayor Adams about campaigning for Beto O'Rourke in Texas: 'Bring it',"Gov. Greg Abbott (R) responded to NYC Mayor Adams' vow to send New Yorkers to Texas, as the mayor complains about illegal immigrants bussed to his city."
2022-08-10 16:39:14,Indiana test scores reveal reading levels remain below pre-pandemic results,"Indiana tests scores have improved from last year, but, still trail pre-pandemic test results. Nearly one in five student's have not mastered foundational reading skills by 3rd grade."
2022-08-10 18:00:17,Trump-backed NC Senate candidate Ted Budd gets key law enforcement endorsement over Democratic opponent,Trump-backed GOP Rep. Ted Budd received a key law enforcement endorsement Wednesday over Democrat opponent Cheri Beasley vying for retiring Republican Richard Burr's Senate seat.
2022-08-10 17:59:11,Here is the global state of monkeypox: Summer 2022,Monkeypox continues to spread around the globe and become more of a cause for concern. Here is an update on how the virus is effecting different parts of the world.
2022-08-10 17:58:24,"Oklahoma Gov. Kevin Stitt hits media for fueling 'distrust', rejects its abortion coverage",Oklahoma Gov. Kevin Stitt pushed back against the media's coverage of his state's abortion bill during an interview with Fox News Digital at CPAC in Texas.
2022-08-10 17:56:04,"Turley: 'Colossal failure' for AG Garland not to appoint Hunter Biden, January 6th special counsels","Law professor at George Washington University Jonathan Turley says it's ""bizarre"" to argue there should not be special counsels looking into Hunter Biden and January 6th."
2022-08-10 17:55:20,"Bus driver charged with interstate stalking of 8-year-old after allegedly threatening to kidnap, torture child",A school bus driver faces federal charges alleging he threatened and stalked an 8-year-old boy in New Hampshire.
2022-08-10 17:48:15,White House blasted for claiming ‘zero’ inflation after latest CPI report: ‘Lying to everyone’,"Twitter slammed President Biden and his press secretary for asserting that inflation is at ""zero,"" though the real rate is only .2% less than the 40-year high."
2022-08-10 17:45:18,Minnesota pharmacist who denied emergency contraception wins case: 'We should be able to live out our beliefs',Minnesota pharmacist George Badeaux and his attorney Charles Shreffler joined 'Fox & Friends First' to discuss their victory in a contraceptive case.
2022-08-10 17:44:17,Polio vaccine campaign underway in London as the virus spreads in the city,Children under 10 living in London are being urged to get a polio vaccine booster as the virus is confirmed to be spreading in the capital for the first time since the 1980s.
2022-08-10 17:43:19,Tim Scott on 'Kilmeade Show': 'No way in the world' Trump raid was about presidential records,"In an appearance on ""The Brian Kilmeade Show,"" Sen. Tim Scott, R-S.C., reacted to the FBI’s decision to execute a search warrant at Trump’s Mar-a-Lago home."
2022-08-10 17:42:21,"As Spider-Man turns 60, fans reflect on the NYC hero's diverse appeal",Spider-Man the iconic NYC superhero turns 60 this month. Spider-Man has always appealed to all races and genders as any child can picture themselves in the iconic suit.
2022-08-10 18:51:17,3 top Washington State University officers retire following misconduct investigation,An internal investigation at WSU determined that they mishandled a complaint and punitive action against an officer who was accused of sexual misconduct.
2022-08-10 18:50:53,Iraq's Sadr tells judiciary to dissolve parliament in a week,Powerful Iraqi Shi'ite Muslim Moqtada al-Sadr called on Iraq's judiciary to dissolve parliament by the end of next week and threatened action if his demands are not met.
2022-08-10 18:44:01,"Adams ramps up pressure on Biden admin to help NYC with migrant surge: ""We just need help’","New York City Mayor Eric Adams says that the Big Apple needs help with the surge in migrants coming to the city, and is urging the federal government to do more."
2022-08-10 18:41:06,Anne Heche: California salon owner details seeing actress an hour before fiery car crash,"Actress Anne Heche, who also dated Ellen DeGeneres, was last seen by a Venice Beach salon owner before crashing her vehicle into a California home."
2022-08-10 18:40:13,"Hawaii man, 75, nabbed for 1982 rape and murder of 15-year-old girl whom he stabbed 59 times: Officials",Investigators in California have cracked a nearly 30-year-old case involving the violent murder of a 15-year-old girl who was abducted while walking to the bus stop.
2022-08-10 18:30:49,Boston high school dean pleads guilty to federal gang-related charges,Former Boston high school dean arrested for shooting student and racketeering. The dean painted himself as an anti-violence activist while being affiliated with a gang.
2022-08-10 18:29:46,Oscars producer responds to Will Smith’s apology to Chris Rock: ‘I’m pulling for him’,"Oscars producer Will Packer is praising actor Will Smith for ""being transparent"" about his ""personal rehabilitation"" process after Smith slapped comedian Chris Rock."
2022-08-10 18:29:36,"BuzzFeed piece ranks J.K. Rowling among 'major villains' like O.J. Simpson, Jim Jones, Benedict Arnold",A BuzzFeed article compared “Harry Potter” author J.K. Rowling to “major villains” like O.J. Simpson and Benedict Arnold because of her stance on transgenderism.
2022-08-10 18:27:23,"Sen. Bennet's midterm ad depicts him as an outdoorsman, but it was filmed on a 24-hour fishing license",Sen. Michael Bennet reportedly purchased a 24-hour fishing license for a new campaign ad depicting the wealthy businessman as an outdoorsman ahead of the midterm elections.
2022-08-10 18:24:43,FBI Trump raid: MSNBC figures balk at calling Mar-a-Lago search a 'raid' even as colleagues use term,"Some MSNBC hosts have objected to calling the FBI's search of Donald Trump's Mar-a-Lago home a ""raid,"" while others on the network continue using the term."
2022-08-10 19:58:18,John Stamos and The Beach Boys honor Bob Saget at Los Angeles concert,"""Full House"" star John Stamos and ""Kokomo"" singers The Beach Boys paid tribute to the late actor Bob Saget at a Los Angeles concert located at The Greek Theatre."
2022-08-10 19:56:53,Spain imposes regulation curbing air conditioner use as temperatures soar,"In an attempt to cut dependence on Russian fuel, Spain has implemented a rule to limit the use of air conditioning during the hottest months of the year."
2022-08-10 19:55:40,Washington State Cougars ex-head football coach sues for wrongful termination,Washington State's ex-head football coach is suing the university for $25 million based on wrongful termination claims. Nick Rolovich had 3 years left on his contract.
2022-08-10 19:52:07,North Korea soldiers in Ukraine would be logistical 'mess’ Putin won’t 'allow': Russia expert,"Reports surfaced this week that North Korea could send up to 100,000 tactical troops to Ukraine to help Russia, but one expert argues this is unlikely."
2022-08-10 19:50:41,"Bucks’ Bobby Portis relishing time in Milwaukee, credits key figure for success: ‘Shout-out to my mom’","Milwaukee Bucks forward Bobby Portis spoke with Fox News Digital about the Bobby Portis Foundation, being raised by a single mom, and resigning in Milwaukee."
2022-08-10 19:50:00,COVID vaccine production from South Africa's Aspen Pharmacare to end this week due to low demand,South Africa's Aspen Pharmacare plans on stopping the manufacturing of COVID vaccines due to a lack of orders. This will only add to Africa's already low vaccination rate.
2022-08-10 19:47:24,Russia resumes oil pipline after Hungary's MOL paid transit fees,Russia begins pumping oil through its pipelines to Central Europe after western sanctions prevented the payment of transit fees from Moscow to Ukraine.
2022-08-10 19:45:55,Little League batter consoles pitcher after scary hit to head: I wanted him to know I was OK,Little League hitter Isaiah Jarvis and pitcher Kaiden Shelton join 'America Reports' Wednesday to share the story behind their viral video of sportsmanship.
2022-08-10 19:41:08,California police arrest multiple suspects in connection with off-duty officer shooting,"California police have arrested multiple people in connection with the fatal shooting of an off-duty police officer. The shooting occurred in Downey, CA."
2022-08-10 19:39:52,Michigan auto company releases industrial chemicals into river,An auto trim maker in Michigan violated the law by releasing industrial chemicals into a river near Detroit. Tribar Manufacturing failed to quickly notify the Department of Environment.
2022-08-10 21:55:07,Texas college students charged after tragic boating accident leaves friend dead,"Texas college students are being charged after one of their friends fell of a boat in 2019 and died under mysterious circumstances, according to one report."
2022-08-10 21:54:51,"China touts relationship with Russia, accuses US of being 'main instigator of the Ukrainian crisis'","A Chinese official accused the U.S. of being the ""main instigator of the Ukrainian crisis,"" five months after Putin launched the invasion of Ukraine."
2022-08-10 21:50:02,"‘Biden boom’ is ‘a real thing,’ insists New York Times' Paul Krugman in new op-ed",New York Times columnist Paul Krugman defended his argument that we are experiencing a “Biden boom” in the economy through an opinion piece on Tuesday.
2022-08-10 21:43:47,"Indiana home explodes, damages at least 39 homes","Authorities responded after a house explosion in Evansville, Indiana, on Wednesday afternoon left 39 homes damaged and at least two injured."
2022-08-10 21:34:17,"California cop killing suspect has violent rap sheet, domestic violence conviction in March","A California man accused of playing a role in the shooting death of an off-duty Monterey Park police officer Monday has a history of violent arrests, sources say."
2022-08-10 21:33:13,"Baltimore boy, 9, allegedly shoots girl, 15, on her front porch; family claims it was no accident","The family of 15-year-old Nykayia Strawder, who was fatally shot outside her Baltimore home, believes the 9-year-old suspect in her death shot her on purpose."
2022-08-10 21:30:21,Rory McIlroy says court made 'right decision' in barring three LIV golfers from FedEx Cup playoffs,"Rory McIlroy suggested LIV golfers not try returning to the PGA Tour. When three of them tried and failed to do so in court, McIlroy was happy with the outcome."
2022-08-10 21:29:39,NY Supreme Court advances journalist's defamation lawsuit against The Daily Beast towards discovery,The New York Supreme Court sided with journalist Carson Griffith in her defamation lawsuit battle against the Daily Beast over a 2019 article she says defamed her.
