DATE,TITLE,SUMMARY
2022-07-31 20:19:38,James Carville sees no 'moral problem' with Democrats supporting 'extremist' Republican candidates,"Democratic strategist James Carville defended the strategy of supporting Trump-backed Republicans in the primaries to Jim Acosta on ""CNN Newsroom"" Saturday."
2022-07-31 20:14:34,"Los Angeles area carjacking suspect shot, killed by police",A suspected armed carjacker was shot and killed by Pasadena police officers following a police pursuit that ended in the 600 block of North Lake Avenue.
2022-07-31 20:02:59,DC schools' COVID-19 vaccine mandate could hit Black students hardest,"Washington, D.C., will require students over the age of 12 to get vaccinated against COVID-19, a move that threatens to fall hardest on the city's Black students."
2022-07-31 19:59:22,England's Chloe Kelly does her best Brandi Chastain impression as she nets game-winner in Euro final,England picked up their first Women's European Championship on Sunday with a victory over Germany thanks to Chloe Kelly being at the right place at the right time.
2022-07-31 19:55:12,ABC panel criticizes Democrats meddling in GOP primaries: 'Embarrassingly hypocritical',"An ABC panel criticized Democratic efforts to meddle in Republican primaries by boosting candidates they deem to be too extreme, arguing the strategy is ""hypocritical."""
2022-07-31 19:49:00,Virginia county reports presence of opioid more deadly than fentanyl,"Virginia State Police has reportedly encountered a case involving protonitazene, a newer synthetic drug that is three times more powerful than fentanyl."
2022-07-31 19:44:56,'Star Trek' actress Nichelle Nichols dead at 89,"""Star Trek"" actress Nichelle Nichols, who starred as Lieutenant Uhura, died on Sunday at the age of 89. She reportedly passed away due to natural causes."
2022-07-31 19:43:24,Chris Rock jokes he was slapped by 'Suge Smith' following Will Smith's on-camera apology post Oscars slap,Chris Rock joked about the Academy Awards incident during a comedy gig in Georgia after Will Smith issued an apology four months after slapping the comedian.
2022-07-31 19:43:13,"Marine veteran, a double amputee, stresses service to country 'in a different way'","Brandon Rumbaugh, a Marine veteran who lost both his legs in military service in Afghanistan, discussed on ""Fox and Friends Weekend"" the Semper Fi and America's Fund, plus CrossFit."
2022-07-31 21:52:35,Suns' Cameron Johnson on being linked to Kevin Durant trade rumors: 'It's the business',"Kevin Durant's reported trade request sparked all kinds of rumors involving the Phoenix Suns, and Cameron Johnson understood the business behind it."
2022-07-31 21:34:55,Indiana police officer shot and killed during traffic stop in 'senseless act of violence',An Elwood Police Department officer was shot and killed around 2:00 a.m. after a suspect he had just pulled over got out of his car and started firing a gun.
2022-07-31 21:33:02,Consumers not keeping up amid 'pay cut recession': Finance expert,"Daniel Roccato, a clinical professor of finance at the University of San Diego's Knauss School of Business, offered tips on surviving the current economic landscape."
2022-07-31 21:32:34,"New York man with loaded AK- 47 arrested near home of Iranian dissident, criminal complaint says",A Yonkers man was arrested last week near the New York City home of a prominent Iranian dissident and police say he had a loaded AK-47 and ammo in his car.
2022-07-31 21:26:13,"Washington Post's Jennifer Rubin suggests Republicans, Trump are turning US into a ‘banana republic’",Washington Post columnist Jennifer Rubin slammed former President Trump and Republicans for transforming America’s politics into “the stuff of tin-pot dictatorships.”
2022-07-31 21:04:28,"Cardinals' DeAndre Hopkins on failed PED test, suspension: 'I wish the rule wasn’t so black and white'","DeAndre Hopkins received a six-game suspension for testing positive for a performance-enhancing drug but he says the NFL's rules on the matter are too ""black and white."""
2022-07-31 20:47:39,"Florida firefighters battle massive house fire, say arson is likely the cause",Firefighters in Florida battled a massive fire on July 30 at a Lake County house and are suspecting that it was began with an act of arson.
2022-07-31 20:33:45,Juan Soto trade rumors: Nationals reportedly whittle down suitors to three as deadline looms,The clock is ticking on a potential Juan Soto trade and the Washington Nationals have reportedly narrowed down the list of potential suitors to three.
2022-07-31 22:50:32,"Ukrainian agriculture tycoon killed by Russian shelling, Zelenskyy says","Ukrainian agriculture tycoon Oleksiy Vadaturskyi and his wife were killed by Russian shelling in the city of Mykolaiv, Ukrainian officials said on Sunday."
2022-07-31 22:36:31,Texas man dies after girlfriend stabbed him to death at apartment: police,"A man in Texas is dead after his girlfriend allegedly stabbed him in the chest on Thursday night while helping a friend move, according to police."
2022-07-31 22:09:26,"California battles worst wildfire this year as flames scorch more than 51,000 acres","California is battling its worst wildfire this year, with more than 51,000 acres burned and multiple communities under evacuation orders."
2022-07-31 22:06:32,MSNBC guest says Herschel Walker is 'what Republicans want from their Negroes',Frequent MSNBC guest Elie Mystal claimed that Georgia Senate candidate Herschel Walker is supported by Republicans only because “he does what he’s told.”
2022-07-31 21:32:34,"New York man with loaded AK-47 arrested near home of Iranian dissident, criminal complaint says","A Yonkers man was arrested last week near the New York City home of a prominent Iranian dissident, and police say he had a loaded AK-47 and ammo in his car."
2022-07-31 23:21:06,NATO says it's prepared to intervene in Kosovo if ‘stability is jeopardized’,NATO issued a statement Sunday saying its Kosovo Force Pristina (KFOR) was prepared to intervene if tensions at the border with Serbia threatened stability.
2022-07-31 22:55:13,Justin Bieber performs for first time after canceling world tour dates due to Ramsay Hunt syndrome diagnosis,Justin Bieber returns to stage for first time in two months on Purpose World Tour in Italy after revealing Ramsay Hunt syndrome diagnosis facial paralysis.
2022-07-31 23:59:33,Flashy NYC bishop robbed of $1M bizarrely re-enacts jewelry heist at service,"A flamboyant Brooklyn bishop, Bishop Lamor Miller-Whitehead, who was recently robbed, recreated the robbery during his service on Sunday to much surprise."
2022-08-01 00:41:22,"Would we rather due process come before the crime, or after the mass shooting of school children?: Gowdy",Fox News host Trey Gowdy explores the dynamic between red flag laws and due process rights in his monologue over the weekend on 'Sunday Night in America.'
2022-08-01 00:34:51,Kentucky residents brace for more rain as death toll from floods rises to 28,The death toll from flooding in Kentucky rose to 28 on Sunday as the National Weather Service warned of more rainfall through Monday morning.
2022-08-01 00:24:30,"California man steals Amazon delivery truck after robbing houses, police say","A man in California led police on a pursuit on July 25 at around 5:18 p.m. after stealing an Amazon delivery truck and robbing two homes, police said."
2022-08-01 00:20:18,"Pat Carroll, actress who voiced Ursula in Disney's 'The Little Mermaid,' dead at 95","Pat Carroll, the comedian and actress best known for voicing villain Ursula in ""The Little Mermaid"" animated movie, died Saturday in Massachusetts."
2022-08-01 00:16:15,Oakland shooting on high school campus leaves three injured: report,"Three people were injured and hospitalized Sunday afternoon after shots rang out at the campus of Oakland Technical High School, prompting a police response."
2022-08-01 01:42:12,"Deebo Samuel, 49ers agree to three-year extension: reports","Deebo Samuel agreed to a three-year contract extension worth around $71.55 million with the San Francisco 49ers on Sunday, according to multiple reports."
2022-08-01 01:35:43,Working Americans 'are going to pay the price' for Biden's climate change agenda: The Big Sunday Show,"Panelists discussed the ""Inflation Reduction Act"" that Sen. Joe Manchin, D-WV, agreed to support and its impact. According to reports, the bill will increase inflation and taxes."
2022-08-01 01:34:09,Alabama prison officials told reporter her 'skirt was too short' to witness execution,"An Alabama-based reporter for AL.com was told by prison officials that her ""skirt was too short"" to view a death row inmate's execution on Thursday evening."
2022-08-01 01:20:17,Deshaun Watson could learn his fate early in the week: reports,A date for determining Deshaun Watson's discipline over sexual assault allegations has reportedly been set. The Cleveland Browns acquired Watson in the offseason.
2022-08-01 01:14:30,"Texas man shoots woman in neck but bullet exits, kills him, police say","A man fired a bullet into a woman's neck, but the bullet exited and struck his leg, killing him, according to the Dallas Police Department."
2022-08-01 01:04:00,Sen. Chuck Grassley attacks 'political interference' in the FBI,"Sen. Chuck Grassley, R-Iowa, described how the alleged political bias in the FBI affected investigations on “Sunday Night in America with Trey Gowdy.”"
2022-08-01 03:46:40,Biden marks passing of 'Star Trek' actress Nichelle Nichols: 'Our nation has lost a trailblazer',"""Star Trek"" star Nichelle Nichols, known for playing Lt. Nyota Uhura, was honored by President Biden in a statement Sunday night after the actress died at the age of 89."
2022-08-01 02:10:26,The rate at which Biden has driven the US economy into the ground is 'genuinely astounding:' Steve Hilton,'The Next Revolution' host Steve Hilton examines the U.S. recession and President Biden's economic mishaps in his opening monologue over the weekend.
2022-08-01 02:08:17,Mark Levin details Congress' authority over election disputes: 'It’s not over until Congress says it's over',"""Life, Liberty & Levin"" host Mark Levin high detailed and refuted claims made by the January 6 committee during his monologue Sunday night."
2022-08-01 01:56:30,Chicago 16-year-old killed in shooting on city's South Side,"A teenager in Chicago was killed during a shooting on the city's South Side on early Sunday morning, according to police. Another man was also injured."
2022-08-01 04:35:30,"5 children among 7 killed in fiery, head-on crash along Chicago-area interstate","Seven people were killed, including five children, when a wrong-way driver smashed head-on into a van on Interstate 90 just outside Chicago Sunday morning. Both cars burst into flames."
2022-08-01 06:00:46,Texas veteran shot down in Vietnam on 7 years as POW at 'Hanoi Hilton' prison camp: 'You keep faith',"Col. James Lamar, 94, was shot down during a bombing mission over North Vietnam in 1966 and spent seven years as a prisoner of war at the ""Hanoi Hilton."""
2022-08-01 06:04:03,"Dems, union leaders responsible for school lockdowns face few repercussions, despite evidence that kids harmed","Despite studies saying the COVID-19 school lockdowns had catastrophic effects on children, the Democrats responsible for keeping schools closed have yet to be held accountable."
2022-08-01 06:00:59,"Kelly Hughes, the first SI Swim model to bare her C-section scar, reacts to negative comments on social media","Kelly Hughes joins Katrina Scott, 2021’s Rookie of the Year, who was photographed when she was six and a half months pregnant. Hunter McGrady also posed six months postpartum."
2022-08-01 06:00:57,Karine Jean-Pierre shares spotlight: Press secretary constantly has someone by her side at briefings,"White House press secretary Karine Jean-Pierre has enlisted help at roughly two-thirds of her briefings in her two months on the job, a Fox analysis finds."
2022-08-01 06:00:39,Sen. Marsha Blackburn's back-to-school tips include warnings for parents about 'woke policies',"Sen. Marsha Blackburn, R-Tenn., shared guidance for parents ahead of this year's back-to-school time, including warnings against woke curriculum and politically motivated teachings."
2022-08-01 06:00:37,"Tim Tebow talks the future of NIL deals, college football realignment","Tim Tebow, who recently announced the next step in his Clean Juice partnership, talked to Fox News Digital about the college football landscape."
2022-08-01 06:00:36,"In Biden's America, 2022 midterm elections can't come soon enough",The 2022 midterm elections are approaching and Americans are struggling to keep gas in their tanks and food on their tables thanks to radical policies of President Biden.
2022-08-01 07:45:07,First grain shipment leaves Ukraine after months of Russian blockade amid food crisis,"Over 26,000 tons of Ukrainian corn is on its way to Lebanon after the first ship set off from Odesa Monday following an agreement between Ukraine, Russia, Turkey and the U.N."
2022-08-01 07:05:00,Michigan professor who wore space helmet in profanity-laced video settles for $95K with university,"Barry Mehler, a history professor at Michigan's Ferris State University, agreed to retire and to accept $95,000 after he sued over a profanity-filled video he made for students."
2022-08-01 09:49:02,"RNC touts 40 million voter contacts, nearly $40M cash-on-hand 100 days before Election Day","The Republican National Committee has contacted more than 40 million voters, has no debt, and $37.4 million cash-on-hand as it heads toward the midterms."
2022-08-01 09:00:31,"Database reveals Biden Department of Education’s ties to campaigns, unions and liberal think tanks","Resumes reveal ties between political appointees in Biden's Department of Education, Democratic campaigns, liberal think tanks and teachers unions."
2022-08-01 09:00:10,Will monkeypox become another COVID or HIV?,"Monkeypox has been reported in over 20,000 people in 75 countries, but there are reasons to believe it doesn't have the same potential as COVID or HIV."
2022-08-01 08:53:48,Nancy Pelosi arrives in Singapore as she begins tour of Asia,"Amid tensions with China, Nancy Pelosi arrived in Singapore Monday, kicking off her Asian tour as questions remain on whether or not she will visit Taiwan."
2022-08-01 11:58:02,New York City boxcutter attack caught on video in heart of tourist capital,NYPD released a disturbing video showing an unidentified suspect slash a woman with a boxcutter near Times Square in an unprovoked daylight attack on Saturday morning.
2022-08-01 11:45:40,Quiz: How well do you know your sandwiches? Try this tasty test of your culinary IQ!,"Test your sandwich knowledge with this tasty food quiz! Whether it's the classic Reuben sandwich or a delicious Italian sub, see how well you know your sandwich facts."
2022-08-01 11:27:52,Deshaun Watson settles three more civil lawsuits as discipline decision looms,Cleveland Browns star Deshaun Watson settled three more active civil lawsuits as a decision in his discipline case is reportedly expected to come Monday.
2022-08-01 11:15:26,NBA champ offers tough critique of Shaq's son trying to break into league: 'Gotta put forth some more effort',"Robert Horry, a former teammate of Los Angeles Lakers legend Shaquille O'Neal, said the NBA icon's son may not have what it takes to make it in the league."
2022-08-01 11:07:07,"Midwest thunderstorms bringing risks of flash flooding, hail, wind damage","States in the Midwest are bracing for strong to severe thunderstorms Monday, which bring the risks of flash flooding, hail, damaging winds and isolated tornadoes."
2022-08-01 11:05:24,"On this day in history, August 1, 1942, Jerry Garcia was born in San Francisco, master of American songcraft","Jerry Garcia's birthday is August 1. He was born in San Francisco in 1942 and proved a master of American musical styles, most notably with The Grateful Dead."
2022-08-01 11:00:58,Oklahoma education secretary: Teachers injecting 'sick material' in schools should be kicked out of profession,Oklahoma education secretary discussed inappropriate materials found in Tulsa Public Schools library and blasted teachers indoctrinating kids with 'sick material.'
2022-08-01 11:00:08,"Against Russia, Ukraine will lose a war of attrition","President Volodymyr Zelenskyy understands the reality: if the war continues to descend into what New York Times columnist Tom Friedman calls a ""somewhat boring slog,"" Ukraine will lose."
2022-08-01 10:45:29,"COVID school closure impact revealed, WH press secretary shares spotlight and more top stories",
2022-08-01 10:41:56,Angels' Shohei Ohtani latest big name mentioned in trade rumors,Shohei Ohtani was the latest big name to hit the trade rumor mill over the last week as the Los Angeles Angels may look to get something back for their superstar.
2022-07-18 00:00:41,"'Life, Liberty & Levin' on Biden's economic policies","Guests: Jon Scott, Larry Kudlow, Elise Stefanik"
2022-07-17 15:00:34,"'MediaBuzz' on media crusading to sink Biden, Trump","Guests: Leslie Marshall, Ben Domenech, Ari Fleischer, Guy Benson, Laura Fink"
2022-08-01 12:45:45,"Primary challenger to 'Squad' member Cori Bush blasts her call to defund the police, private security spending","In an exclusive interview with Fox News Digital, Steve Roberts, the Democratic primary challenger to ""Squad"" member Cori Bush, blasted the congresswoman's position on defund the police."
2022-08-01 12:38:21,California’s McKinney Fire turns deadly as 2 bodies found inside burned vehicle,"The raging McKinney Fire in northern California has claimed the lives of two people who were found inside a burned vehicle along its path, officials announced Monday."
2022-08-01 12:35:05,"'Sunday Morning Futures' on Biden's mental capacity, Jill Biden comparing Latinos to tacos","Guests: Blake Masters, Mayra Flores, Michael Waltz, Ronny Jackson"
2022-08-01 12:25:25,Josh Allen breaks silence after skirmish at Bills training camp: 'The boys got going yesterday',Buffalo Bills training camp started off hot with Josh Allen and Jordan Phillips getting involved in a small skirmish. The Bills are looking for a third straight division title.
2022-08-01 12:25:16,Deshaun Watson receives discipline after sexual assault accusations: reports,Deshaun Watson learned his fate Monday it was announced what discipline the Cleveland Browns quarterback received after facing numerous sex assault allegations.
2022-08-01 12:23:31,Economist slams Facebook for 'absolutely Orwellian' fact-check upholding Biden's recession denial,Top economist Phillip Magness shared his experience with Facebook censorship on 'Fox & Friends First' after detailing the definition of a 'recession.'
2022-08-01 12:21:46,Colorado fisherman breaks brook trout record after 75 years,"Tim Daniel, of Granby, Colorado, broke Colorado’s longest-standing fish record earlier this year when he caught a 7.84-pound brook trout in May in Monarch Lake."
2022-08-01 12:19:27,"For China's military planners, Taiwan is not an easy island to invade","An invasion of Taiwan could be costly for China despite a military imbalance, given the island's geographic features and decades of defensive preparations."
2022-07-28 20:18:38,Mega Millions lottery drawing: Winners can remain anonymous in these states,Can the Illinois Mega Millions lottery jackpot winner stay anonymous? Some states say yes — while most others require ticketholders to reveal their identity to claim the big prize.
2022-08-01 15:19:17,"Pelosi set to visit Taiwan, triggering dire warning from Chinese media personality: report","House Speaker Nancy Pelosi is reportedly planning to visit Taiwan this week, with meetings planned with officials on Tuesday and Wednesday, the Wall Street Journal reported."
2022-08-01 15:05:35,"Late Sam Mills, Carolina and New Orleans football player, to be inducted into the Pro Football Hall of Fame","Sam Mills, the late undrafted D-III football star, is being inducted into the Pro Football Hall of Fame in Canton. Mills played for the Carolina Panthers and the New Orleans Saints."
2022-08-01 15:00:58,Biden team can't punt on North Korea missile program as Obama did,North Korea's Kim Jong Un can probably order a nuclear test any time he wants. He longs for a long-range missile that can reach the continental United States.
2022-08-01 14:59:39,"Humpback whale sightings increase at the Jersey Shore, study says","Sightings of humpback whales along the New Jersey shore have increased over the last decade, according to a study from Rutgers University."
2022-08-01 14:58:45,"Winning the lottery: Blessing for some, curse for others","Typically, hitting the Mega Millions is the single most life-changing event for the winners, but not always in a good way. Does winning the lottery really make your life better?"
2022-08-01 14:55:23,North Carolina's appeals courts will reveal how judges ruled,A North Carolina court is going to make the details public of how a three-judge panel settled certain cases. Each judges vote will be revealed 90 days after decisions are made.
2022-08-01 14:50:16,Australian Senator Lidia Thorpe calls Queen Elizabeth II a ‘colonizing’ leader during swearing-in ceremony,Lidia Thorpe of the Australian Greens party was heard calling Queen Elizabeth II a colonizer Monday during her swearing-in ceremony at the Parliament House in Canberra.
2022-08-01 14:47:28,"June 29, 2022 was the Earth's shortest day ever due to a slight 'wobble'","June 29, 2022, was Earth's shortest day ever. The 1.59 milliseconds shaved off the day were due to a slight ""wobble"" of the Earth."
2022-08-01 14:45:46,Charles Payne's security camera catches man lurking outside his home: 'This is the ultimate violation',"FOX Business' Charles Payne tweeted a video of a man trespassing on his property, arguing “Americans are not safe in the streets and lawmakers want us defenseless in our homes.”"
2022-08-01 17:01:19,Miami Hurricanes new coach Mario Cristobal set to begin first fall camp Friday,"Mario Cristobal, Miami Footballs' new head coach, begins his first fall camp on Friday. The Hurricanes are the current favorite to win the ACC."
2022-08-01 16:59:52,Reuters mocked for fact-checking spoof video of Biden being distracted by ice-cream truck music,Reuters was compelled to fact-check a fake viral video of President Biden being distracted by an ice cream truck during a speech by First Lady Jill Biden.
2022-08-01 16:59:18,California's Death Valley National Park closes roads due to flooding,Roads in Death Valley National Park were closed after they were covered with mud and debris by flash floods. Arizona and Nevada were also hit by flash flooding.
2022-08-01 16:55:47,"NY Mag highlights Kamala Harris' 'slip in political traction,' says she 'reached an unparalleled low point'","A New York Magazine piece described Vice President Kamala Harris as having reached an ""unparalleled low point"" and said her ""thankless portfolio"" was to blame for losses in political traction."
2022-08-01 16:55:44,Ron DeSantis stays quiet as Florida Republicans vie for his endorsement,"Florida Republicans want voters to believe they are allied with Gov. Ron DeSantis, but the popular governor has yet to make a single endorsement for the 2022 midterms."
2022-08-01 16:51:33,MN pharmacist sued for refusing to fill prescription for emergency contraception because of religious beliefs,A Minnesota pharmacist is going on trial after refusing to fill a prescription for emergency contraception because of his religious beliefs.
2022-08-01 12:25:16,Deshaun Watson receives discipline after sexual assault accusations,Deshaun Watson learned his fate Monday it was announced what discipline the Cleveland Browns quarterback received after facing numerous sex assault allegations.
2022-08-01 16:47:58,"US can't provide any 'incentives' for China to invade Taiwan, Gen. Keane warns","Gen. Jack Keane discusses the importance of Nancy Pelosi's presence in Taiwan amid China's growing aggression in the region on ""America's Newsroom."""
2022-08-01 16:37:32,Ron Vitiello blasts Biden's border hypocrisy: 'Only the super-woke think walls don't work',"Ron Vitiello joined ""America's Newsroom"" for the Biden administration for open-border policies and back tracking on original comments about Trump's border wall."
2022-08-01 16:34:09,"Kentucky rescue crews save family of 5 trapped in attic during flooding, video shows","Rescue crews in Wolfe County, Kentucky, rescued a family of five trapped in an attic as floodwaters nearly submerged the home following catastrophic flooding last week."
2022-08-01 19:09:14,Car caught in flash flood? Here's what to do,Safety expert Mike Berna shares tips on what to do if your car gets caught in a fast-moving flood and you've run out of options to drive to safety.
2022-08-01 19:08:42,"23 infants hospitalized in Tennessee for parechovirus, CDC warns","After 23 infants were hospitalized for parechovirus within six weeks, the CDC issued a warning to clinicians about the “unusually large cluster of infections.”"
2022-08-01 19:08:04,Las Vegas Raiders head coach Josh McDaniels returns to Ohio for Pro Football Hall of Fame Game,"Josh McDaniels will be leading the Las Vegas Raiders as their head coach in the annual Pro Football Hall of Fame Game that will be played at his high school alma mater in Canton, Ohio."
2022-08-01 18:51:35,"Kentucky flooding: Nonprofit serving hot meals to victims, first responders as death toll climbs","Mercy Chefs, a Virginia-based disaster relief and humanitarian aid organization, deployed to the eastern part of Kentucky following deadly flash flooding."
