DATE,TITLE,SUMMARY
2022-08-15 23:10:15,Washington Post columnist declares: ‘This is the month Biden finally came into his own’,"Columnist E.J. Dionne Jr. hopes the ""stark contrast"" between Trump and Biden in the wake of the FBI's raid of Mar-a-Lago will be a “reset moment.”"
2022-08-15 23:10:12,Kiely Rodni: California police 'modifying' search effort next week as few signs of missing teen emerge,"The large-scale, interagency search effort for missing Truckee 16-year-old Kiely Rodni is expected to scale down next week, investigators said Monday."
2022-08-15 23:05:32,Jennifer Coolidge on 'Legally Blonde' line she hears from fans the most and whether the 'bend and snap' works,"""The White Lotus"" actress, Jennifer Coolidge, discussed ""Legally Blonde"" and the important lesson she learned about the industry while filming the iconic movie."
2022-08-15 23:01:56,Dodge is finally selling a Challenger Convertible,"Dodge dealers will sell a Challenger convertible conversion that will be completed by Drop Top Customs for $25,999 for the 2023 model year."
2022-08-15 23:01:45,"DIY Dodge Challenger muscle car revealed for $7,995",Dodge will sell body-in-white and full rolling chassis versions of the Challenger for racing car builders through the end of 2023 when production of the car will end.
2022-08-15 22:55:56,LSU's Myles Brennan announces retirement from football: 'It is time for me to start a new chapter in my life',LSU quarterback Myles Brennan announced his retirement from football on Monday after five seasons with the Tigers.
2022-08-15 22:48:36,Greg Gutfeld on Mar-a-Lago raid fallout: Trump is like a black hole that swallows negative energy,"Fox News co-host Greg Gutfeld discussed the public backlash from the FBI raid of former President Donald Trump's Mar-a-Lago home Monday on ""The Five."""
2022-08-15 22:48:27,Rangers fire Chris Woodward after more than 3 seasons as manager,The Texas Rangers started the season with high hopes but with the season winding down they are not in contention to make the playoffs with their high payroll.
2022-08-16 00:53:38,WaPo's reporter tells MSNBC the Biden administration ‘owns the failures’ of the Afghanistan withdrawal,Investigative reporter Craig Whitlock lamented that “the American people are still really trying to come to grips with this idea that they lost the war to the Taliban.”
2022-08-16 00:51:10,Demi Moore shows off her svelte physique in a hot pink string bikini while on a yacht: ‘Soaking up summer’,"59-year-old ""Ghost"" star Demi Moore wore a swimsuit from celebrity-loved brand Eres. Moore also has her own Andie’s swimwear collection."
2022-08-16 00:50:02,"Los Angeles Gascon recall effort fails to make ballot, DA’s opponents say fight not over","The recall effort against LA County District Attorney George Gascón failed to qualify for a ballot, but his opponents say they will continue to fight his progressive policies."
2022-08-16 00:47:21,"Dana Perino on US withdrawal from Afghanistan, one year later: We are embarrassed by this incompetence","Dana Perino and ""The Five"" discuss the state of Afghanistan a year after Biden withdrew American forces from the country."
2022-08-16 00:45:14,Trump Organization CFO Allen Weisselberg considering a plea deal as part of Manhattan DA probe,"Former Trump Organization chief financial officer Allen Weisselberg entered a plea deal as part of the Manhattan District Attorney’s investigation, a source told Fox News."
2022-08-16 00:44:27,Trey Gowdy: Not being able to see the affidavit is 'one source of the anger',"Trey Gowdy discussed with the ""Special Report"" panel how there needs to be more facts presented from the FBI raid on Trump's home in Mar-a-Lago."
2022-08-16 00:39:56,"Dodgers' Walker Buehler done for season, set for elbow surgery",The Los Angeles Dodgers took a blow to the rotation on Monday when it was revealed Walker Buehler will have season-ending elbow surgery later this month.
2022-08-16 00:37:10,"Bronny James throws down vicious dunk, impresses NBA superstars",Bronny James impressed some of the top stars in the NBA on Monday as his California Basketball Club select team took on a French select team.
2022-08-16 00:31:04,Liz Cambage to 'step away' from WNBA after abrupt Sparks exit,"Ex-Los Angeles Sparks center Liz Cambage announced on social media Monday that she will be stepping away from the WNBA, just weeks after terminating her contract with the Sparks."
2022-08-16 00:17:31,Anne Heche's ex James Tupper thanks 'Men in Trees' co-star Emily Bergl for defending late 'genius' actress,Emily Bergl wrote a tribute to co-star Anne Heche on Instagram after she died and was removed from life support Sunday following car crash on Aug. 5.
2022-08-16 02:16:39,Vivek Ramaswamy's firm says its pro-energy fund exceeded $100 million one week after launch,"A new energy-based index fund launched by Vivek Ramaswamy's asset management firm Strive has already exceeded $100 million, according to a press release obtained by Fox News Digital."
2022-08-16 02:09:42,Sean Hannity: The FBI has earned their shattered reputation,"Sean Hannity discussed how the FBI's search and seizure of documents at Trump's Mar-a-Lago home has Americans angry and distrustful on ""Hannity."""
2022-08-16 02:08:07,Sen. Kennedy: Biden's performance as president 'cringeworthy',"Sen. John Kennedy weighed in on Democrat politicians showing hesitance in supporting President Biden's re-election bid in 2024 on ""Jesse Watters Primetime"" Monday."
2022-08-16 01:56:23,Alex Berenson: I plan to sue the White House over Twitter ban,Fox News host Tucker Carlson spoke with former New York Times reporter Alex Berenson about his Twitter reinstatement and his plans to sue the White House.
2022-08-16 01:52:46,California school resource officer disarms student who pulled out loaded gun during fight: police,"A 17-year-old student pulled a loaded gun out of his waistband during a fight at Lincoln High School in Stockton, California, but was disarmed by an officer."
2022-08-16 01:49:47,Trump spox torches CBS News for claiming FBI did not have former president’s passports,Former President Trump's top spokesman pushed back against CBS News anchor Norah O'Donnell's claim that the FBI was not in possession of his passports.
2022-08-16 01:43:17,MSNBC host: 'We have to stop separating the GOP and right-wing extremists',MSNBC fill-in host Tiffany Cross insisted that Republican politicians should be treated the same as right-wing extremists during Monday’s “The ReidOut.”
2022-08-16 01:25:48,Yankees' Anthony Rizzo throws tantrum in dugout after questionable call,"Anthony Rizzo has been having a frustrating last 17 games, and Monday night against the Tampa Bay Rays his frustrations appeared to boil over after a hit by pitch was called back."
2022-08-16 01:19:48,"Mike Rowe and mom Peggy reveal meaning behind title of 'salacious' new book, 'Vacuuming in the Nude'",'Dirty Jobs' TV host Mike Rowe and his mother Peggy preview her new book 'Vacuuming in the Nude: And Other Ways to Get Attention' on 'Jesse Watters Primetime.'
2022-08-16 01:15:55,The Atlantic publishes article mocking 'the right' over concerns about violent pro-abortion group,The Atlantic published a piece casting doubt on Jane's Revenge's role in vandalizing and attacking churches and pregnancy resource centers despite the group's admissions to such crimes.
2022-08-16 03:27:41,"Laura Ingraham: Now, with that writing, who needs a White House press secretary?","Laura Ingraham discussed how media is spreading whatever comes from the White House and how Biden's new inflation bill will hurt Americans on ""The Ingraham Angle."""
2022-08-16 03:00:47,State Department spokesman: US ‘in a stronger position as a country’ because of Afghanistan withdrawal,"""One year later we are in a stronger position as a country because of the President’s decision"" to withdraw from Afghanistan a State Department spokesman claimed Monday."
2022-08-16 03:00:20,Tucker: No honest person could believe the Trump raid was a legitimate act of law enforcement,"""Tucker Carlson Tonight"" host torches the FBI's raid on former President Donald Trump's Mar-a-Lago, Florida home and discusses the importance of free speech."
2022-08-16 03:00:14,Trump attorney: DOJ's inventory list is 'borderline worthless',"Trump attorney Lindsey Halligan expresses concern over how the Justice Department is handling its investigation into former President Donald Trump on ""Hannity."""
2022-08-16 02:54:30,Trump attorney: This is the most sick version of our country I've ever seen,Fox News host Sean Hannity spoke with Trump attorney Alina Habba about the politicization of government institutions and what direction the country is headed.
2022-08-16 04:39:09,Greg Gutfeld: What’s with all the people eating bugs?,"Greg Gutfeld discusses the push by media and celebrities to make eating bugs popular and talks about if the elites will ever adopt the eating habit on ""Gutfeld!"""
2022-08-16 04:02:16,"On this day in history, August 16, American legends Aretha Franklin, Babe Ruth and Elvis Presley died","Celebrated pop culture legends Aretha Franklin, Babe Ruth and Elvis Presley all died on the same August 16 date: Franklin in 2018, Ruth in 1948 and Presley in 1977."
2022-08-16 03:57:06,"Miami police officer critically injured after being shot, suspect killed",A Miami-Dade police officer was fighting for his life in critical condition after he was shot during what police called an altercation Monday night. The suspect was shot and killed.
2022-08-16 06:00:28,New Jersey man returns borrowed book to his public library 75 years late,"Jersey City, New Jersey resident Bob Jablonski returned the book ""Hitler"" 75 years after he first checked it out of the Jersey City Free Public Library. Jablonski checked the book out in 1947."
2022-08-16 06:00:15,"Elvis Presley's final months were plagued with physical pain as he embarked on grueling tour, author claims","Elvis Presley, known as the ""King of Rock 'n' Roll,"" passed away on Aug. 16, 1977 at age 42. Presley's cause of death was heart attack, likely brought on by his addiction to opiates."
2022-08-16 06:00:15,San Francisco defunded the police before reversing course the next year amid calls for 'accountability',San Francisco Mayor London Breed joined the chorus of liberal leaders across the country that vowed to defund the police after the murder of George Floyd in 2020.
2022-08-16 06:00:10,"One year after US left Afghanistan, we are still working to rescue the heroes and friends we left behind","In the hours that followed the fall of Kabul, the veterans community and others mobilized to get as many friends, allies and colleagues out of Afghanistan as we could."
2022-08-16 06:00:07,"CNN, MSNBC, Dems mock criticism of added IRS agents in spending bill: 'Preposterous'","CNN, MSNBC, NBC and some House Democrats have mocked Republican concerns that the IRS expansion would lead to increased audits against poorer Americans."
2022-08-16 06:00:05,"Americans say they're unhappy with the state of the nation, agree political divisiveness is a serious concern","Americans in St. Louis, Missouri, shared their dissatisfaction with the political divisiveness in America and some pleaded for congressional bipartisanship."
2022-08-16 05:52:01,Rapper A$AP Rocky charged with assault of former friend in 2021 Hollywood shooting,The Los Angeles County District Attorney's Office announced assault charges against rapper A$AP Rocky in connection with the 2021 shooting of his former friend in Hollywood.
2022-08-16 04:44:45,Jimmy Failla: They're listening to the Beatles while you're eating the beatles,"Kat Timpf and Jimmy Failla discuss with Gutfeld and other guests how celebrities are now eating bugs and pushing to make eating bugs popular on ""Gutfeld!"""
2022-08-16 06:00:47,Los Angeles deputy DA: Gascón is creating a 'ticking time bomb' by releasing murderers back on the streets,"One LA County deputy district attorney is speaking out and calling George Gascón's ""blanket policy"" of releasing certain violent inmates a “ticking time bomb.”"
2022-08-16 06:00:46,John Kerry's climate office rife with ties to far-left green groups,"John Kerry's climate office has been tight-lipped about its staff, but a review of databases revealed that it is largely filled with officials from major green and global groups."
2022-08-16 08:16:21,"Monkey at California zoo calls 911: 'monkey see, monkey do'","A Capuchin monkey named Route found a cell phone in a golf cart at the Zoo to You offices in Paso Robles, California, and somehow managed to use it to call 911 on Saturday."
2022-08-16 07:37:51,Jennifer Lopez and Ben Affleck hosting second wedding at private 87-acre Georgia estate: report,"Jennifer Lopez and Ben Affleck will host an ""intimate celebration"" for friends and family at his secluded Georgia mansion in honor of their recent marriage."
2022-08-16 07:20:07,"Trump calls for Mar-a-Lago affidavit release, denounces FBI raid: ""No way to justify""","Former President Trump called for the immediate release of the ""completely unredacted"" Mar-a-Lago affidavit on Monday. He also called for the judge to be recused from the case."
2022-08-16 07:02:26,Jury selection begins in R. Kelly's federal trial in Chicago,Jury selection is underway at R. Kelly’s federal trial in his hometown of Chicago. The 'I Wish' singer faces charges that he rigged his 2008 state child pornography trial.
2022-08-16 10:00:48,Overcrowded animal shelters dealing with staffing shortages,"Officials at an animal shelter in Charlotte, North Carolina, say they feel like they are crying wolf sometimes because they've been so full for so long."
2022-08-16 10:00:33,Back-to-school supplies: 10 secrets of saving money amid high inflation,"With today's inflation, shopping for back-to-school supplies may be stressful for many families. Here are 10 ways to save money on school supplies this season."
2022-08-16 10:00:20,"Fetterman blasts Washington, spotlights nonpartisan solutions, in new ad in Pennsylvania’s crucial Senate race",Fox News Exclusive: Pennsylvania Lt. Gov. John Fetterman blames Washington D.C. for the nation’s economic “mess” in new TV commercial by the Keystone State’s Democratic Senate nominee
2022-08-16 09:58:39,"Brittney Griner still seen as 'wrongfully detained' despite Russia trial, State Department spokesman says","Brittney Griner is still ""wrongfully detained"" in the eyes of the U.S. State Department, spokesman Ned Price said during a briefing on Monday."
2022-08-16 09:02:35,"Fire captain denies sharing photos from Kobe Bryant crash site: ""It was horrifying""",Retired Los Angeles fire captain Brian Jordan denied sharing pictures of the bodies of Kobe Bryant and his daughter Gianna after they were killed in a helicopter crash in 2020.
2022-08-16 09:00:10,How Democrats' Inflation Reduction Act delivers five winning issues to the GOP,"The Democrats 'Inflation Reduction Act,' which was approved last week is so riddled with flaws that Republicans have much to run on as the November midterms approach."
2022-08-16 11:57:37,US carries out ICBM test after delaying over tensions with China,The U.S. Air Force conducted drills firing a test ICBM early Tuesday morning as part of a demonstration of the United States' international nuclear capabilities.
2022-08-16 11:56:29,Why the 'Sunday scaries' don't need to be scary: Tips to get through your job worries,"Many people dread going to work the next day — an experience often called the ""Sunday scaries,"" though it can happen any day of the week. Here are expert tips to get through the worries."
2022-08-16 11:41:24,Oklahoma's Brent Venables praises team amid Cale Gundy drama: 'Gotta go through some mud sometimes',Oklahoma football coach Brent Venables opened up about Cale Gundy's decision to resign from the program following an incident during a film session.
2022-08-16 11:39:31,Recall officials still hopeful to oust George Gascon despite signature setback: 'He should not be emboldened',"The attempt to oust Los Angeles DA George Gascon has come to a screeching halt, but some recall officials are hopeful the fight to remove Gascon is not over"
2022-08-16 11:28:44,Shooting outside Memphis hospital emergency room injures 8: report,"A shooting outside the emergency room at Methodist North Hospital in Memphis, Tennessee has left at least eight people injured Tuesday, according to reports."
2022-08-16 11:22:37,Texas falls outside preseason college football rankings despite first-place vote in coaches poll,The Texas Longhorns will start the season with a few key players on the mend and outside of the AP Top 25 poll after receiving a first-place vote in the coaches poll.
2022-08-16 11:06:24,Oklahoma State's Mike Gundy jokes brother's Oklahoma resignation will provide 'good chapter' for future book,"Oklahoma State head coach Mike Gundy talked Saturday about his brother's resignation from the Oklahoma program following his use of a ""racially charged word."""
2022-08-16 11:00:18,"Trump raid shows that FBI, Justice Department want to decide who can be our president",The political and legal ramifications of the FBI raid on Donald Trump's Mar-a-Lago home are just beginning to be felt. There are huge consequences for our country.
2022-08-16 10:52:32,Brett Favre reveals startling number of concussions he likely suffered during NFL career,Brett Favre opened up on the concussions he likely suffered during the course of his 20-year career. He played in the NFL from 1991 to 2010.
2022-08-16 10:32:26,"Padres' Fernando Tatis Jr's failed PED test stemmed from haircut mishap, dad says",The father of San Diego Padres star Fernando Tatis Jr. attempted to explain away the reason for the major leaguer's failed PED test leading to an 80-game suspension.
2022-07-28 18:39:32,Why was ASAP Rocky arrested in Sweden? Breaking down the rapper's legal troubles,ASAP Rocky's arrest in Sweden caused tension in US-Swedish relations after then-President Donald Trump vowed to impose consequences on them.
2022-08-16 13:57:38,Florida suspected drug dealer arrested after sending ‘random text’ to county commissioner,"Jack Edward Fisher, 18, was arrested in Palm Coast, Florida, on Monday after he allegedly sent Flagler County Commissioner Joe Mullins a text that offered to sell him cocaine."
2022-08-15 21:00:43,"'The Five' on Trump Mar-a-Lago affidavit, Kamala Harris losing support","This is a rush transcript from ""The Five,"" August 15, 2022"
2022-08-16 13:47:16,First lady Jill Biden tests positive for COVID-19,"First Lady Jill Biden has tested positive for the coronavirus after she began to develop “cold-like symptoms” late Monday night, her office has announced."
2022-08-16 13:38:38,Health care workers win $10M settlement over hospitals' COVID vaccine mandate: 'This is a big wakeup call',"Liberty Counsel founder Mat Staver explained that NorthShore University HealthSystem implemented a ""jab or job"" policy and denied employees' religious exemptions."
2022-08-16 13:37:39,"Leonardo DiCaprio traveled on gas-guzzling private jets, yachts while funding climate nuisance lawsuits",Leonardo DiCaprio's non-profit foundation awarded grants to a pass-through group funding climate nuisance lawsuits even while traveling the world on private jets and yachts.
2022-08-15 22:00:09,"'Special Report' All-Star Panel on Trump raid, Taliban takeover of Afghanistan","Guests: Juan Williams, Morgan Ortagus, Trey Gowdy"
2022-08-16 13:36:28,Biden returning to White House to sign Inflation Reduction Act ahead of multi-state tour,"Tuesday will see President Biden back in the White House after a vacation in South Carolina, as he signs the Democrats' Inflation Reduction Act reconcilation bill"
2022-08-16 13:32:46,Democrats' tax-and-spend extravaganza will turn IRS into internal repression service,Democrats' so-called Inflation Reduction Act will become law on Tuesday and the IRS payroll will be beefed up to audit more Americans.
2022-08-16 13:31:48,"Texas' lottery numbers for Monday, Aug. 15","The Mega Million's estimated jackpot is $82,000,000. The Powerball estimated jackpot is $66,000,000. The Cash 5 numbers are 10-11-20-28-29."
2022-08-16 16:03:19,Alec Baldwin on 'Rust' shooting: 'Every single person' on set knows who to blame for Halyna Hutchins' death,"Alec Baldwin claimed ""every single person"" on set of ""Rust"" knows who to blame for the death of Halyna Hutchins in a new interview. The actor claimed he did not pull the trigger."
2022-08-16 16:02:40,Former Trump adviser Mick Mulvaney says he hopes Trump does not run in 2024,"Former chief of staff Mick Mulvaney said he hopes Donald Trump will not run in 2024, a little over a week following the FBI's raid of the former president's Mar-a-Lago home."
2022-08-16 16:01:51,China begins discouraging abortions and promoting fertility treatment as birth rate plummets,China's one-child policy of 35 years has led to the nation having one of the lowest birth rates in the world. Beijing is now discouraging abortion and subsidizing fertility treatment.
2022-08-16 16:01:08,"Cruz, Laxalt argue for school choice, cast blame on unions for 'collective lunacy,' 'lost education'",Sen. Ted Cruz and Nevada Senate candidate Adam Laxalt blame teachers unions and Democrats for the drastic consequences of lengthy COVID-19 school closings.
2022-08-16 16:00:53,"Self-steering BMW cuts into oncoming traffic, killing 1",One person is dead and nine are injured after a self-steering BMW test vehicle veered into oncoming traffic in Germany. BMW says the driver 'retains responsibility.'
2022-08-16 16:00:50,Biden's Afghanistan exit was the 'day the world became less safe': Nikki Haley,"Former U.S. Ambassador to the U.N. Nikki Haley warns the president's foreign policy blunder in the Middle East was a ""green light for every enemy."""
2022-08-16 15:59:44,Arizona parents deliver list of 'expectations' to school board: 'Trust has been broken',Arizona parents on “Fox & Friends First” Tuesday unveiled “school board expectations” amid concerns for the curriculum. Parents pushed back by submitting their own list of expectations.
2022-08-16 15:59:12,CNN’s Harwood admits climate bill named ‘Inflation Reduction Act’ as a ‘marketing device’ to hook Manchin,"CNN reporter John Harwood admitted the climate bill was named the ""Inflation Reduction Act"" as a ""marketing device"" to get Sen. Manchin, D-W.Va., on board."
2022-08-16 15:54:26,Judge schedules hearing on unsealing FBI Mar-a-Lago search records,An in-person hearing will take place on Thursday in Florida regarding the unsealing of FBI records related to last week’s raid of former President Trump’s Mar-a-Lago home.
2022-08-16 15:50:18,US ally stranded in Afghanistan laments 'poorly handled' SIV process one year after withdrawal,Fox News' Trey Yingst spoke with a former U.S. embassy employee who said the Special Immigrant Visa process shows a lack of value for the lives of Afghan allies.
2022-08-16 17:56:11,North Dakota school district recruits Florida teachers upset with DeSantis' parental rights law,"The Fargo, North Dakota, public school system is recruiting teachers from Florida who are disenfranchised by legislation regarding sexuality discussions in K-3 classrooms."
2022-08-16 17:53:56,Miami police provide update on officer critically injured in shootout: 'Hard days ahead',"Miami-Dade police asked for prayers after an officer was critically wounded in a shootout on Tuesday. Police director Alfredo Ramirez III says they have ""hard days ahead."""
2022-08-16 17:52:44,Peggy Rowe says she hopes new book inspires people who 'always wanted to do something',"A new Fox News special ‘America’s Grandmother’ highlights Peggy Rowe, mother of ‘How America Works’ host Mike Rowe, and her journey to being a best-selling author at 84 years old."
2022-08-16 17:51:55,"New York to house migrants, homeless in famed Times Square hotel",New York City will soon use the famous Row NYC hotel to house migrants and the homeless. Mayor Eric Adams has blasted Texas Gov. Greg Abbott for bussing migrants to the city.
2022-08-16 17:50:09,"LA County sheriff's deputies shoot, wound man wielding handgun",Los Angeles County sheriff's deputies responded to a complaint of a family disturbance Tuesday morning to find a man wielding a handgun. The deputies shot the man in the lower torso.
2022-08-16 17:48:08,"CNN climate correspondent often issues dire warnings on state of planet, blames GOP: 'End of a livable Earth'",CNN chief climate correspondent Bill Weir frequently criticizes Republicans for inaction on climate change and predicts the end of a habitable Earth.
2022-08-16 17:40:44,San Francisco police union slams city's 'defund' flip-flop: Help us fight crime or 'shut up',San Francisco Police Officer Association President Lt. Tracy McCray says the 'defund the police' movement has devastated her city amid a surge in violent crime.
2022-08-16 17:36:00,Tim Kennedy looks back on botched Afghanistan withdrawal: 'First time you saw Superman bleed',"Veteran and former UFC fighter Tim Kennedy called out President Biden for claims on the Afghanistan withdrawal, calling the exit an 'absolute nightmare'"
2022-08-16 17:28:56,How many kids does Brian Austin Green have? Inside the '90210' actor's relationships and family life,"Brian Austin Green is an actor from ""Beverly Hills, 90210."" He is currently dating Sharna Burgess and has five children Kassius, Noah, Bodhi, Journey and Zane."
2022-08-16 17:28:37,"Tim Ryan voted for Dem bill that will raise taxes, despite calling for lower taxes","Ohio Democrat Rep. Tim Ryan has called for lowering taxes as he campaigns for the Buckeye State's open Senate seat, but he voted for the Inflation Reduction Act which raises taxes."
