DATE,TITLE,SUMMARY
2022-08-05 10:20:33,"Thailand nightclub fire leaves at least 13 dead, dozens injured",A fire broke out at the Mountain B pub in Sattahip district of Chonburi province in Thailand early Friday morning leaving at least 13 people dead.
2022-08-05 10:15:52,"Kyrsten Sinema makes spending bill decision, parade terror in New Mexico and more top headlines",Fox News First brings you Fox News' top headlines every morning.
2022-08-05 10:06:12,Derek Jeter recalls Alex Rodriguez's steroid admission: 'Another distraction',"Alex Rodriguez admitted before the 2009 season to taking performance-enhancing drugs. Derek Jeter recalled the ""distraction"" in ESPN's ""The Captain."""
2022-08-05 10:00:30,Florida Senate showdown: Law enforcement members backing Rubio blast former police chief Demings,"Florida law enforcement officials who support Sen. Marco Rubio take aim at his Democratic challenger, Rep. Val Demings, in the Republican incumbent’s latest campaign commercial"
2022-08-05 09:51:43,China sanctions House Speaker Nancy Pelosi over 'egregious provocation' in visit to Taiwan,"House Speaker Nancy Pelosi was sanctioned by China on Friday, following her visit to Taiwan earlier in the week. Pelosi's immediate family members were also sanctioned."
2022-08-05 09:42:49,"Nancy Pelosi swipes China during press conference in Tokyo, Japan: 'They will not isolate Taiwan'","House Speaker Nancy Pelosi condemned China for trying to isolate Taiwan. She also said her visit to Taiwan does not change the “status quo” between the U.S., China and Taiwan."
2022-08-05 09:37:34,"US will 'pursue' prisoner swap for Brittney Griner and Paul Whelan with Russia, Blinken says","Secretary of State Antony Blinken said the U.S. will ""pursue"" a prisoner swap with Russia. The comment comes one day after Brittney Griner was sentenced to nine years in prison."
2022-08-05 09:00:40,Parents on Randi Weingarten saying conservatives 'undermine' teachers: 'She blocked the schoolhouse door',"Parents fired back at American Federation of Teachers President Randi Weingarten for suggesting ""right-wing extremists"" are undermining public schools."
2022-08-05 12:44:02,RNC to name Milwaukee as 2024 GOP convention host city,"The Republican National Committee on Friday will formally name Milwaukee, Wisconsin as the host city for the GOP’s 2024 presidential nominating convention."
2022-08-05 12:34:14,Former California Democrat leader on Biden losing support: 'Rats running from a sinking ship',"Former Democratic Senate Leader from California Gloria Romero joined ""Fox & Friends First"" to address Joe Biden's struggle to maintain support from his own party."
2022-08-05 12:19:51,"Raiders give head coach Josh McDaniels happy homecoming, beat Jaguars 27-11","The Las Vegas Raiders routed the Jacksonville Jaguars, 27-11, in Thursday night's annual Hall of Fame Game."
2022-08-05 12:10:30,First Texas bus of migrants arrives in NYC,The first busload of illegal immigrants has arrived in New York City from Texas as Gov. Abbott diverts migrants to Democratic cities in protest of Biden's immigration policies.
2022-08-05 12:00:06,"Senate aides hint at Manchin distress over spending bill backlash, desire to avoid 'Build Back Better' mention","Senate aides are detailing what they say is Sen. Joe Manchin's growing defensiveness over his shift in support for a massive Democrat-backed spending bill in place of ""Build Back Better."""
2022-08-05 11:25:12,State flower quiz! Can you match these beautiful flowers with their correct states?,How strong is your flower power? Test your knowledge of these state flowers by matching the flower to the state in this fun and interactive lifestyle quiz!
2022-08-05 09:37:34,"US, Russia move toward Brittney Griner swap talks after Lavrov says Kremlin 'ready'","Secretary of State Antony Blinken said the U.S. will ""pursue"" a prisoner swap with Russia. The comment comes one day after Brittney Griner was sentenced to nine years in prison."
2022-08-05 11:13:28,"Blinken says China's military exercises near Taiwan, Japan represents 'significant escalation'","Following China's recent military drills in the Taiwan Straight, Secretary of State Anthony Blinken condemned the missile launches and called them a ""significant escalation."""
2022-08-05 15:00:43,Biden’s failed Afghanistan withdrawal let Taliban turn nation into a terrorist state,Al Qaeda's return to Afghanistan is proof Biden’s chaotic withdrawal left a failed terrorist state run by the Taliban. Now the U.S. is in far greater danger.
2022-08-05 14:48:41,"Lightning strike safety — what to do, how to keep yourself safe","Two people died after they were struck by lightning outside the White House in Washington, D.C., this week. Here are tips for staying safe in storms when thunder and lightning are present."
2022-08-05 14:46:13,"Border crisis goes to Washington, crime in the suburbs, and more from Fox News Opinion","Read the latest from Fox News Opinion & watch videos from Tucker Carlson, Sean Hannity, Laura Ingraham & more."
2022-08-05 14:44:21,Denver business owner struggling after city bans food trucks downtown: 'We had zero say',"Denver is trying to combat the rise in crime by banning food trucks downtown. Owner of RJ's Tacowich Food Truck Leilani Johnson joined ""Fox & Friends First"" to share her frustration."
2022-08-05 14:36:17,"NYC Staten Island ferry in 'rough waters' with staff shortage, other problems",The NYC Staten Island Ferry has been suffering all summer with the shadow of the coronavirus lingering over the iconic boat. Staff shortages and union disputes have been an issue.
2022-08-05 14:30:47,"California's Newsom shames movie producers, begs them to 'choose freedom' after abortion ruling",California Democrat Gov. Gavin Newsom wants Hollywood movie and TV producers to stop filing in red states like Georgia and Oklahoma which restrict abortion.
2022-08-05 14:27:42,NYC crime: Police outline 'Worst of the Worst' repeat offenders – some with more than 95 arrests,"NYPD arrests have increased by more than 24% as of Aug. 1, but police and the mayor say bail reform laws are preventing them from keeping repeat offenders off the streets."
2022-08-05 14:23:43,More rain expected in Kentucky flooding area; Southwest storms continue,"Severe weather continues over Kentucky and the Ohio and Tennessee valleys, with heavy rain back in the forecast. Meanwhile, the Northeast will feel record heat."
2022-08-05 14:17:53,Florida Rep. Byron Donalds exploring run for House GOP leadership,"GOP congressman Byron Donalds, a first term lawmaker from Florida, is exploring a run for chairman of the House Republican Conference after the November midterms."
2022-08-05 14:14:10,"Graham torches Manchin-Schumer Inflation Reduction Act: This is a 'fraud,' will make everything worse","Sen. Lindsey Graham, R-SC, blasts Democrats' messaging on spending bill and warns the bill could increase financial burden of middle class, working families."
2022-08-05 16:55:08,Mike Pompeo sounds alarm on 'Faulkner Focus': 'The Chinese Communist Party keeps me up at night',Former Secretary of State Mike Pompeo talks about the very real danger of the Chinese Communist Party and how widespread the current threat is to America.
2022-08-05 16:53:58,"1,400-pound great white shark spotted near Myrtle Beach","The non-profit shark tracker OCsearch pinged a great white shark weighing more than 1,400 pounds at 13 feet long off the coast of Myrtle Beach."
2022-08-05 16:49:47,"Heavy rain continues to hit Japan causing flooding, evacuations and safety concerns","Japan has been facing heavy rains that have caused thousands to evacuate, missing persons, flooded roads and loss of power."
2022-08-05 16:47:39,Former Defense Secretary Esper advises American policy toward Taiwan needs update: 'Outlived its usefulness',"Former Secretary of Defense Mark Esper advised the United States to update its policy toward Taiwan, listing that as one step in deterring China's aggression."
2022-08-05 16:42:00,Kentucky storms cause flood warning issue to extend through Sunday,Floods have been ravaging the state of Kentucky this month and weather officials warn there could be more to come. A flood watch has been issued through Sunday across the state.
2022-08-05 16:41:54,'iCarly' star Jennette McCurdy rips Nickelodeon: My childhood was ‘exploited’,"""iCarly"" star Jennette McCurdy speaks out about her traumatizing experience as a former child actor and claims her 'whole childhood and adolescence were very exploited.'"
2022-08-05 16:33:14,Dozens of shark sightings reported in Cape Cod waters this week,Sharks have been swimming in the waters off of Massachusetts and New York this summer. The sightings have forced temporary beach closures in recent weeks.
2022-08-05 12:44:02,RNC names Milwaukee as 2024 GOP convention host city,"The Republican National Committee on Friday formally named Milwaukee, Wisconsin as the host city for the GOP’s 2024 presidential nominating convention."
2022-08-05 16:29:43,"Israel kills top Islamic Jihad terrorist in Gaza, announces formal military operation",The Israeli military killed a senior leader of the Palestinian Islamic Jihad terrorist group. IDF jets struck the target in Gaza on Friday.
2022-08-05 16:28:25,"Biden created 'magnet of lawlessness' at border, says National Border Patrol Council VP",Governor Abbott continued his busing of illegal immigrants and this time sent a bus to NYC. National Border Patrol Council VP said Mayor Adams should take his concerns to Joe Biden.
2022-08-05 17:49:11,"PGA Tour members speak out, slam LIV golfers' antitrust lawsuit: 'You can’t have it both ways'","Several members of the PGA Tour have spoken out publically against an antitrust lawsuit filed by 11 LIV Golf players, aiming to rejoin the Tour."
2022-08-05 17:47:05,"China halts military, climate talks with US in retaliation for Pelosi visit",China has announced it will be suspending collaborative dialogues with the U.S. about key issues such as climate change and illicit drug distribution as retaliation against U.S. relations to Taiwan.
2022-08-05 17:41:26,Rosie O'Donnell responds after daughter says her upbringing was 'not normal',"Rosie O'Donnell's daughter Vivienne explained how her childhood was ""not normal"" in a viral TikTok. The comedian responded in her own TikTok video."
2022-08-05 17:38:51,"Rep. Meijer blasts Democratic 'self-righteousness,' hypocrisy of backing his GOP primary opponent","Republican Rep. Peter Meijer, R-Mich., hammered Democrats for throwing money into an ad campaign for his GOP primary opponent in an interview with CNN."
2022-08-05 17:32:41,"NCAA women's basketball final games to be held in North Carolina, Seattle","The women's basketball NCAA tournament games will be held in Seattle, Washington, and Greenville, South Carolina. The past tournaments took place in four locations."
2022-08-05 17:26:14,Porsche once built a bizarre convertible Cayenne SUV with two rear ends,Porsche built a design study for a convertible version of the Cayenne SUV that featured a roof modeled similar to the one featured on today's 911 Targa sports car.
2022-08-05 17:25:28,"After COVID lockdowns, Twitter outraged at report that officials won’t stop sex parties to prevent monkeypox","Conservative Twitter users called it hypocritical that health officials and politicians won't stop large gatherings to prevent monkeypox, after doing so for COVID."
2022-08-05 17:19:43,Virginia police officer convicted for involvement in capitol protest faces eight years,A Virginia police officer who was convicted of taking part in the Jan. 6 Capitol protest is facing 8 years in prison. This would be the longest prison sentence for anybody involved.
2022-08-05 17:14:54,MMA fighter details how he took down NYC homeless man who was attacking bystanders,MMA fighter Ro Malabanan recounts his heroic take down of an assailant in broad daylight in New York City and highlights the significance of being trained in self-defense.
2022-08-05 17:10:12,Cancer fight intensifies as Pan-Mass Challenge charity ride nears $1B,The Pan-Massachusetts Challenge is a charity bike ride across the Bay State that has raised $831 million for the fight against cancer since its founding in 1980.
2022-08-05 18:56:40,"2024 watch: CPAC attendees choose favorite presidential candidate as Trump, DeSantis remain popular","CPAC attendees told Fox News Digital who they want as the Republican nominee in the 2024 election, and Donald Trump and Ron DeSantis were trendy picks."
2022-08-05 18:55:57,NYC's public university system deletes profile of Johnny Depp lawyer after backlash,New York City's public university system deleted an article celebrating a lawyer who worked on Johnny Depp's legal team after a flurry of complaints from students and faculty.
2022-08-05 18:48:22,Spain reports first deaths from acute hepatitis in children,"Spain has reported its first two deaths from acute hepatitis, or liver inflammation, among children. And of the 46 cases, three required liver transplants."
2022-08-05 18:47:59,DeSantis announces Florida Supreme Court justice nominee Renatha Francis,Gov. Ron DeSantis appointed Renatha Francis to the Florida Supreme Court on Friday after her previous appointment was shot down by a lawsuit concerning her time on the Florida Bar.
2022-08-05 18:39:53,"Driver in Los Angeles crash that killed 6 arrested, charged with vehicular manslaughter, gross negligence","A woman in her 40s reportedly has been arrested following a fatal, multi-vehicle crash Thursday in Los Angeles, California, that left six dead and eight injured."
2022-08-05 18:33:21,Arkansas attorney pleads guilty in role in defrauding farm programs,"Everett Martindale, an Arkansas attorney, has pleaded guilty to his role in a conspiracy to defraud the U.S. Department of Agriculture. He faces up to five years in prison."
2022-08-05 18:29:34,Pennsylvania pipeline developer pleads no contest in pollution case,"Pennsylvania pipeline developer, Energy Transfer Operating, has pleaded no contest to criminal charges that it polluted waterways across the state."
2022-08-05 18:27:27,Green Party co-founder John Rensenbrink dies at 93,"The co-founder of the Green Party, John Rensenbrink, died at the age of 93. The Maine political scientist who helped convene the first Green Party meeting died in hospice."
2022-08-05 18:23:48,New York man accused of Chinese food deliveryman murder found dead in apparent suicide weeks after making bail,"New York's alleged ""duck sauce killer"" Glenn Hirsch, accused of shooting Chinese delivery driver Zhiwen Yan, was found dead Friday, according to his lawyer."
2022-08-05 18:13:22,There’s a new focus on tech-based mental health treatments for young people,"A new investment company wants to help bring together the fields of technology and mental health treatment, which is expected to be a $26,000,000,000 industry by 2027."
2022-08-05 20:10:53,"New Mexico FBI, police investigating if shooting deaths of 3 Muslim men are connected","Police and law enforcement in New Mexico are investigating the possibility that the shooting murders of three Muslim men are connected, according to local reports."
2022-08-05 20:10:35,"North Carolina deputies find $17,460 worth of meth and fentanyl during traffic stop","Sheriff's deputies in North Carolina say that $17,460 worth of meth and fentanyl was found during a traffic stop on Thursday after a K-9 smelled narcotics."
2022-08-05 20:05:10,Mom of California murder victim blasts Soros-backed prosecutors: ‘Helping criminals’,"Making an appearance on ""America Reports,"" Imelda Hernandez joined two other mothers who lost their children to violent crime in pushing to recall Los Angeles District Attorney George Gascon."
2022-08-05 20:01:33,Tennessee just held its primary. Here's a recap of the top contests.,The Tennessee primary was held Thursday. Some of the most-watched contests were the Democrat's primary race for governor and the GOP race for the 5th District congressional seat.
2022-08-05 19:59:56,Blinken flies into 'superpower' battleground in Africa,"Secretary of State Antony Blinken flies to Africa this weekend, days after his Russian counterpart swept through the continent. Both are vying for support over the war in Ukraine."
2022-08-05 19:52:37,"Florida python hunt brings 800 competitors, thousands available in prize money","Aug. 15 marks the start of a Florida python hunt, which will feature 800 competitors and offer thousands of dollars in prize money. Pythons are an invasive species in Florida."
2022-08-05 19:47:10,UK officials believe monkeypox outbreak may be peaking,British health officials have been monitoring the monkeypox outbreak in the country. They believe the virus has peaked and numbers will begin to decline.
2022-08-05 19:46:33,Review: The 2023 Acura Integra is a worthy rad-era reboot,The 2023 Acura Integra brings back the name of one of the brand's original models in a new compact four-door liftback based on the latest Honda Civic.
2022-08-05 19:44:20,House Republicans prep fight against Dems' social spending and tax bill as Senate moves to pass,"House conservatives, including the Republican Study Committee led by Rep. Jim Banks, can't stop Democrats' reconciliation bill. They still plan to fight it."
2022-08-05 19:43:00,China's Sanya Island getaway shutting down its duty free malls amid COVID outbreak,"China's holiday hot spot, Sanya, has started shutting down its duty-free malls in an effort to curb COVID during China's most recent outbreak."
2022-08-05 21:38:10,National Mustard Day is Saturday with sunny mustard-glazed donuts,"French's celebrates National Mustard Day on Aug. 6, 2022, by teaming with Dough Doughnuts of New York City to offer free mustard-glazed donuts, available in person or nationally via online mail order."
2022-08-05 21:38:07,Democratic House Majority PAC spending $20 million in midterm election ads to beat 'extremist' GOP candidates,The House Majority PAC announced an extra $20 million to be spent on advertisements for Democrats ahead of 2022 midterms as the party aims to keep its narrow congressional majority
2022-08-05 21:36:25,"Katharine McPhee blames 'woke' voters for crime in Beverly Hills, will not wear expensive jewelry","""American Idol"" alum Katharine McPhee blames ""woke"" voters in Los Angeles for the rise in crime. McPhee, 38, said she no longer feels comfortable wearing expensive jewelry in Beverly Hills."
2022-08-05 21:34:54,California fruit vendor shot and killed in apparent robbery,"The fruit vendor, who was shot in an apparent robbery, was found on the sidewalk on Rosecrans Avenue and taken to the hospital, where he died due to his injuries."
2022-08-05 21:23:16,Former Nickelodeon star Jennette McCurdy slams network for exploitation: 'Price of showbiz success',"The Fox News Entertainment newsletter brings you the latest Hollywood headlines, celebrity interviews and stories from Los Angeles and beyond."
2022-08-05 21:21:30,49ers’ Kyle Shanahan says players don’t have to fight to be ‘intense’,San Francisco 49ers head coach Kyle Shanahan halted practice on Tuesday after punches were thrown on two separate occasions during training camp.
2022-08-05 21:13:20,Kansas City police say three pharmacies were burglarized within half an hour,"Kansas City police said on Friday that three pharmacies were vandalized during the early morning hours, all within a half an hour timeframe."
2022-08-05 21:08:27,'The Flash' starring Ezra Miller still on track despite actor’s recent scandals: report,"Ezra Miller-led ""The Flash"" is still moving forward despite the actor's involvement in several scandals this year. The news comes shortly after Warner Bros. axed its sister movie ""Batgirl."""
2022-08-05 21:08:02,"Woman seen bloodied, yelling in New Jersey semi-truck found safe",Police in New Jersey found the bloodied woman in the white semi-truck who was seen yelling from the big rig's cabin on Wednesday.
2022-08-05 20:55:54,James Franco slammed by John Leguizamo for being cast as Fidel Castro: 'This F'd up',"More controversy is surrounding actor James Franco, as he was cast as former Cuban leader Fidel Castro. Colombian actor John Leguizamo shared his disgust with Hollywood and the casting choice."
2022-08-05 23:01:30,Taliban-controlled Afghanistan intends to seek seat on UN Human Rights Council: report,"The UN held an ""urgent debate"" in July to discuss human rights concerns in Afghanistan, including the erosion of women's rights, since the Taliban took over last year."
2022-08-05 22:59:51,"Anne Heche crashes car into a home igniting fire, taken away in ambulance with severe burns: report",Anne Heche was reportedly involved in a car crash in Los Angeles on Friday. The actress was taken to the hospital after reportedly suffering from severe burns.
2022-08-05 22:58:15,Suspect at large after Baltimore warehouse shooting injures one: police,Baltimore police are investigating a shooting that took place on Friday afternoon at around 4 p.m. at a labeling warehouse in the city that left one person injured
2022-08-05 22:14:01,Democrats who don't support Biden in 2024 refuse to explain plans for 'new leadership' in White House,"Reps. Dean Phillips and Rep. Angie Craig have both said they seek a 'new generation' of leadership, but refuse to explain how they would keep Biden from running in 2024"
2022-08-05 13:43:11,Third victim dies after lightning strike near White House,"A Wisconsin couple and an unnamed 29-year-old male died after a lightning strike at Lafayette Park near the White House, which left one other person injured."
2022-08-05 22:39:17,Ohio Senate showdown: JD Vance calls polls a ‘big joke’ and vows he'll have the funds needed to fight Tim Ryan,"Trailing in fundraising and in the polls to Democratic Rep. Tim Ryan, Ohio GOP Senate nominee JD Vance says he feels “very confident about where we are.”"
2022-08-05 22:28:53,Browns head coach Kevin Stefanski says team is preparing for different scenarios at quarterback,Cleveland Browns head coach Kevin Stefanski told reporters that the team is preparing for different scenarios at quarterback as Deshaun Watson's suspension plays out.
2022-08-05 22:21:09,Alex Jones ordered to pay $45.2M to Sandy Hook victim's family,Alex Jones must pay $45.2million in total damages to Sandy Hook Elementary parents.
2022-08-05 22:21:43,"Yankees minor leaguer Derek Dietrich, four others suspended for performance-enhancing drugs",New York Yankees minor leaguer Derek Dietrich was one of five players handed a steroid suspension Friday by Major League Baseball. Dietrich tested positive for DMPA.
2022-08-05 22:19:19,Ex-Patriots offensive lineman Rich Ohrnberger crashed into 'church van' to avoid being cut as a rookie,Former New England Patriots offensive lineman Rich Ohrnberger recalled the time where he purposely got into a car accident to avoid being cut by the team.
2022-08-06 01:00:40,'Documented Dreamers' push for citizenship path,"Young legal immigrants risk self-deportation once they age out of their parents' work visa and have to wait in line of 200,000 for a green card."
2022-08-06 00:30:16,Dodgers' Clayton Kershaw lands on injured list after leaving Thursday's game with lower back pain,"Los Angeles Dodgers pitcher Clayton Kershaw was placed on the injured list for the second time this season, this time with a lower back injury suffered Thursday."
2022-08-06 00:19:00,How the US should respond to China and Russia's 'new era of authoritarian aggression': GOP senator,"Sen. Dan Sullivan, R-Alaska, of the Senate Armed Services Committee, responded to China's military drills in the South China Sea Friday on ""Your World."""
2022-08-06 00:17:36,Willow Smith talks father Will Smith slapping Chris Rock at the Oscars: 'Humanness sometimes isn’t accepted',"Willow Smith, the ""Meet Me At Our Spot"" singer, commented on her father Will Smith's infamous slap of Chris Rock at the Oscars."
2022-08-06 00:10:49,Jesse Watters: Liberals suddenly don't want to see migrants,"Fox News host Jesse Watters calls out liberal lawmakers for their handling of illegal immigrants flooding their own cities on ""Jesse Watters Primetime."""
2022-08-05 23:54:14,"Four killed, Ohio police identify person of interest in shooting","Four people have been killed in a small town near Dayton, Ohio. Two of the victims include a mother and her 15-year-old daughter."
2022-08-05 23:49:27,Pierce Brosnan wishes wife Keely a happy 21st anniversary in touching Instagram tribute,"Pierce Brosnan and his wife Keely celebrated their 21st wedding anniversary with a touching throwback wedding photo, which was held in Ireland. The father of five and grandfather of three called his wife, ""my love."""
2022-08-05 23:36:46,Mother of NFL player Kevin Ware's murdered girlfriend seeks justice: 'He's never been held accountable',The mother Taylor Pomaski is seeking justice after Pomaski's boyfriend and former NFL player Kevin Ware was charged with murder and tampering with a corpse.
2022-08-05 23:33:20,"Nicole Hazen, wife of Diamondbacks GM Mike Hazen, dies at 45 following cancer battle","The Arizona Diamondbacks announced the death of Nicole Hazen, wife of general manager Mike Hazen. She died Thursday at age 45 after a long bout with cancer."
2022-08-06 02:39:56,Biden needs to push back against China's 'extreme' response to Pelosi's visit: Former CIA station chief,"Fox News contributor Dan Hoffman joined ""Hannity"" to weigh in on Biden's handling of China's 'extraordinarily aggressive' response to Pelosi's visit to Taiwan."
2022-08-06 02:14:06,"Former Broncos WR Demaryius Thomas died from complications of seizure disorder, autopsy says","Former Denver Broncos wide receiver Demaryius Thomas died in December from a seizure disorder, an autopsy revealed. Thomas was 33 and suffered from CTE."
