DATE,TITLE,SUMMARY
2022-03-29 12:00:04,Macro Economic Drivers with Bryn Talkington and Peter Boockvar,"We are living in exciting times with crazy volatility. What strategies can you use to protect your portfolio and leverage these swings? Melissa Francis sits down with Bryn Talkington, Managing Partner of Requisite Capital Management, and Peter Boockvar, CIO of Bleakley Advisory Group, to look at the market and discuss various strategies. Watch the Full [&#8230;]"
2022-03-28 12:00:29,Bitcoin To Hit $100K!,"I probably don't have to tell you that no matter where you turn these days, everybody and their brother has a new prediction for where the price of Bitcoin (BTC) is headed this year. In February, I let you in on the nitty-gritty behind investment banking behemoth Goldman Sachs' prediction that Bitcoin was headed to [&#8230;]"
2022-04-01 12:00:44,Potential Market Inflection Point Imminent?,"Cautiously Optimistic Commodity prices are soaring, the war between Russia and Ukraine is worsening, inflation is raging, and the Federal Reserve has begun increasing rates. The backdrop seems ominous; however, the market may be just one positive headline away from an inflection point to turn the tide in a positive direction. Timing the market has [&#8230;]"
2022-04-05 15:09:03,Protect Your Portfolio From An Inverted Yield Curve,"In March, the spread between the 5-year Treasury bonds and the 30-year notes inverted. This means that the yield on the shorter-term bonds was actually higher than the yield for the longer-term notes. This is a signal to some that a recession is coming. Since 1955, equities have peaked six times after the start of [&#8230;]"
2022-04-04 15:19:18,Disney - Full Business Strength Ahead,"Disney is starting to fire on all cylinders now that Covid has subsided. Disney's parks are back in full swing, and movie theaters are springing back to life in this post-pandemic environment. Despite Disney's full business nearly back online, the stock sits near a 52-week low. Disney (DIS) should be in the sweet spot of [&#8230;]"
2022-04-03 16:31:01,Yield Curve Inverts Deeper Than August Of 2019,"Like the larger media, this tiny little spec within the media reports the news to you. The 10yr-2yr yield curve has inverted (ref. Yield Curve inversion upcoming). Now, what does it mean? Well, the first thing it usually means is not to panic (especially now that High Yield credit spreads are easing), but to tune [&#8230;]"
2022-04-02 11:00:59,Jobs Report Supports Aggressive Rate Hikes,"The most recent jobs report supports aggressive Fed rate hikes, to reduce inflation, but other factors need to be resolved to solve the big global picture. The Bureau of Labor Statistics released some welcome news today. 431,000 Americans became gainfully employed in March, and the jobless rate was within 0.1% of 3.5%, coming in at [&#8230;]"
2022-04-01 21:55:10,Stocks Have Worst Quarter In 2 Years,"The first quarter of 2022 was the worst first quarter since 2020 in the stock market. The DOW and S&#038;P 500 closed down -4.57% and -4.95%, respectively, and the NASDAQ lost -9.10%. Some of the contributing factors to this rough quester were the start of a rate hiking cycle from the Federal Reserve, high inflation, [&#8230;]"
2022-04-10 12:00:40,U.S. Dollar To Hit $121; Crude Oil To Hit $176?,"It turned out that the dollar weakness we observed in February was about to be over right after the earlier update. I thought we would see more downside for the DX in the area between 94.4 and 92.5 (Fibonacci retracement levels) before the rally resumes, and most readers supported that idea. However, the rally started [&#8230;]"
2022-04-09 11:00:53,Gold Rises Ahead Of CPI Inflation Report,"As of 4:44 PM EDT gold futures basis, the most active June 2022 contract is trading up $11.70, a gain of 0.60% at $1949.50. There were some alarming forecasts for the upcoming release of the latest inflationary data vis-à-vis the CPI (Consumer Price Index) on Tuesday, March 12. Just last week, estimates were released by [&#8230;]"
2022-04-08 21:33:02,Is The Bear Market Rally Over?,"The stock market finished the week in the negative as traders braced for tighter monetary policy from the Federal Reserve. The S&#038;P 500 finished the week just below its 200-day MA, which could signal a move lower if it opens below that level on Monday and makes a move lower. In addition, the red weekly [&#8230;]"
2022-04-08 12:00:18,BTC Technical Outlook Is Bullish!,"If you've hung around my articles long enough, you know that when I take a look at what assets to devote my hard-earned cash to, I've found that both technical and fundamental analysis are two great tools. They've served me well over the years. In fact, earlier this year I did a deep dive into [&#8230;]"
2022-04-07 15:22:59,Earnings Calendar for April 2022,"April means earnings season is almost here! Alcoa (AA) is scheduled to report quarterly earnings to investors on April 20. That marks the unofficial start of earnings season. It's also when our Drift Trader list starts to fire up again, picking stocks that have the potential to run after surprise announcements. Get a jump on [&#8230;]"
2022-04-06 16:22:01,Truth: The New Frontier In Energy,"“The following is an excerpt from Tim Snyder’s “Weekly Quick Facts” newsletter. Tim is an accomplished economist with a deep understanding of applied economics in energy. We encourage you to visit Matador Economics and learn more about Tim. While there, you can sign up for his completely free Daily Energy Briefs and Weekly Quick Facts [&#8230;]"
2022-04-15 17:05:55,Global Inflation Prompts Action By Central Banks,"Inflation is not limited to the United States. It is a global phenomenon prompting central banks worldwide to take action. Central banks worldwide are quickly moving to a more aggressive monetary policy in an attempt to stave off the spiraling international level of inflation. The president of the Federal Reserve Bank of New York, John [&#8230;]"
2022-04-14 16:29:37,Fighting The Eternal Fire,"The Federal Reserve’s vaunted independence, which we heard so much about during the Trump Administration but very little so far under President Biden, will be put to the test this year as it battles 1980s-style inflation during an election year. Will the Fed fight vigorously to fight inflation that now totals an annualized 8.5% according [&#8230;]"
2022-04-13 17:05:04,End Of The Pandemic Or The Beginning Of A Recession?,"“The following is an excerpt from Tim Snyder’s “Weekly Quick Facts” newsletter. Tim is an accomplished economist with a deep understanding of applied economics in energy. We encourage you to visit Matador Economics and learn more about Tim. While there, you can sign up for his completely free Daily Energy Briefs and Weekly Quick Facts [&#8230;]"
2022-04-12 12:00:43,Know Your Crypto Technicals… Every Day!,Everyone’s hyping up crypto. But does anyone actually know what they’re talking about? The noise in the crypto space gets louder every day. But there’s not nearly enough good information out there for responsible traders.  That’s where JC Parets comes in... JC and his talented team at All Star Charts have gone all-in to deliver [&#8230;]
2022-04-11 12:00:12,ETFs To Invest In When Interest Rates Are Rising,"In March, the Federal Reserve decided to raise interest rates for the first time since the Covid-19 Pandemic began. The timing of the interest rate hike was needed as inflation has grown during the pandemic for many reasons. Some believe inflation is on the brink of running out of control, which has Federal Reserve members, [&#8230;]"
2022-04-19 12:00:38,Gold Has Repeated Bullish Pattern,"Back in February, I shared with you an updated monthly chart of gold futures with a completed Cup &#038; Handle pattern just ahead of a potential breakout above the preset trigger. Most readers supported the ambitious target of $2,800 for that exact pattern. So let's check on the chart below and see how it plays [&#8230;]"
2022-04-18 12:00:59,Bitcoin Tested By Uncertainty... And Wins!,"I probably don’t have to tell you that no matter where you turn these days, there’s one thing you can be certain of. Uncertainty. That’s right. There’s a ton of uncertainty no matter where we turn. And that’s true, as a matter of fact, in our daily lives: While we try to make things as [&#8230;]"
2022-04-17 13:00:10,Options-Based Portfolio Screening Tool,"Controlling the overall systemic risk of a portfolio is essential as the markets continue to grapple with inflation, a rising interest rate environment, supply chain challenges, and the Russian/Ukraine conflict. Controlling volatility while generating in-line or superior returns relative to the market is the goal of an options-based portfolio. An option-based strategy is achieved via [&#8230;]"
2022-04-16 19:44:52,The Continuum: Through The Limiters!,"Inflation pushes the 30-year Treasury bond yield through long-term moving average trends! Okay, let’s take a breath. I don’t like to use ‘!’ in titles or even in articles. In fact, when I see too many of them I immediately think that someone really REALLY wants me to see their point. That said, the signal shown below [&#8230;]"
2022-04-23 12:00:11,Gold Declines As Fed Prepares To Fight Inflation,"The Federal Reserve’s next FOMC meeting is just under two weeks away, and market participants are gaining insight from Chairman Powell and other Federal Reserve voting members. Recent statements by Chairman Powell have indicated a major shift in his position regarding inflation. Up until his most recent statements, he maintained that inflation levels had peaked, [&#8230;]"
2022-04-22 21:17:42,DOW Plunges More Than 900 points,"The stock market plunged on Friday, with the DOW suffering its worst one-day loss since the beginning of the pandemic falling 1,019.00 points at its lowest point. The DOW fell 981.36 points, or -2.8%, to finish at 33,811.40, its worst day since 2020. The S&#038;P 500 was down -2.8% at 4,271.78, for its lowest day [&#8230;]"
2022-04-22 12:00:01,"Tesla, Twitter, and Elon Musk","In this episode, Cathie Wood, CEO of ARK Investment Management, joins Melissa Francis and Magnifi by TIFIN to discuss her views on Tesla, Twitter, and Disruptive Innovation. Watch the Full Interview at Magnifi by TIFIN Melissa Francis Welcome everyone today. We're here to talk about Magnifi by TIFIN a marketplace, where you can harness real-time [&#8230;]"
2022-04-21 12:00:19,"Truth Is, It's Not Just About Fueling EVs","“The following is an excerpt from Tim Snyder’s “Weekly Quick Facts” newsletter. Tim is an accomplished economist with a deep understanding of applied economics in energy. We encourage you to visit Matador Economics and learn more about Tim. While there, you can sign up for his completely free Daily Energy Briefs and Weekly Quick Facts [&#8230;]"
2022-04-20 17:31:26,Situation With Russian ETFs Highlights A Bid Risk,"As the world watches Russian troops attack Ukraine, global leaders impose sanctions on Russia, as opposed to sending military personnel to assist the Ukrainian people with repelling Russian forces. Over the long term, these sanctions may impose more damage on Russia and the companies that lay within its borders than troops perhaps could. It is [&#8230;]"
2022-04-28 12:00:34,Let's Get Serious,Federal Reserve Chair Jerome Powell indicated strongly last week that the Fed will likely raise interest rates by 50 basis points at its next meeting on May 3-4. It will likely get more aggressive in its fight against 8%-plus inflation. It’s going to have to because just as fast as the Fed is trying to [&#8230;]
2022-04-27 17:00:56,Reconciling Meta's 50% Sell-Off,"Extreme Bearishness Facebook, recently rebranded as Meta Platforms Inc. (FB), is down 52% from its September 2021 high and now sits at a 52-week low. The recent downturn came after the company reported its quarterly earnings back in February. The stock downturn was related to capital investment in its metaverse initiatives, concerns from growing competition [&#8230;]"
2022-04-26 18:22:45,Bitcoin Still Shines Like A Sun,"In this post, I would like to show you what happens to the structure of the crypto market over time as new stars join the universe with hopes of taking down the shining star, Bitcoin. Chart 1. Market Cap Comparison: Bitcoin, Ethereum, and Altcoins The chart above starts in September of 2017. Both altcoins and [&#8230;]"
2022-04-26 12:00:32,Navigating Volatility - Risk-Controlled Portfolio,"Controlling portfolio beta, which measures overall systemic risk of a portfolio compared to the market, on the whole, is essential as these markets continue to display bouts of extreme volatility. Containing volatility while generating superior returns relative to the market is the goal with an options-based portfolio. Mitigating risk within a portfolio can be achieved [&#8230;]"
2022-04-25 15:07:44,Here's How to Handle Inflation,"I have to admit I almost fell out of my chair when I dug deep into the latest inflation numbers. Compared to a year ago, prices are up a jaw-dropping 8.5%. And in March alone they grew 1.2%. That’s the biggest single-month increase in the last 6 months. And if you look at the trend [&#8230;]"
2022-04-30 11:00:48,Gold Bounces But Couldn't Hold Friday's Highs,"June 2022 gold futures opened Friday morning at $1895.80, far above Thursday’s low of $1871. Trading to a high of $1921.30 and settled in New York up 1.1% at $1911.70. However, on Fridays, Globex trading remains open until 6 PM EDT before closing for the weekend. As of 5:10 EDT, gold has moved back below [&#8230;]"
2022-04-29 21:18:37,NASDAQ Post Worst Month Since October 2008,"The stock market once again plunged Friday, with the NASDAQ suffering its worst monthly loss since October of 2008, losing -13.26%. In addition, the DOW and S&#038;P 500 both finished April in the negative, with losses standing at -4.91% and -8.80%, respectively. On a daily level, the NASDAQ lost -4.17% to close at 12,334.64. The [&#8230;]"
2022-04-28 17:00:14,Retail Fuel Prices Skyrocket,"“The following is an excerpt from Tim Snyder’s “Weekly Quick Facts” newsletter. Tim is an accomplished economist with a deep understanding of applied economics in energy. We encourage you to visit Matador Economics and learn more about Tim. While there, you can sign up for his completely free Daily Energy Briefs and Weekly Quick Facts [&#8230;]"
2022-05-02 15:14:41,Overly Pessimistic Market Conditions?,"April – Worst Month Since 2008 Financial Crisis As April ended, the Nasdaq logged its worst month since the 2008 financial crisis, while the S&#038;P 500 logged its worst month since March of 2020 during the depths of the Covid pandemic. No company has been immune to the onslaught of the macroeconomic environment as many [&#8230;]"
