DATE,TITLE,SUMMARY
2022-08-03 10:58:20,Regeneron tops earnings expectations amid 'record' sales of several products,"<p>Regeneron Pharmaceuticals Inc.  topped expectations with its second-quarter financial results Wednesday morning, though revenue and profits both fell from a year earlier. The company logged net income of $852 million, or $7.47 a share, down from $3.1 billion, or $27.97 a share, in the year-earlier quarter, a decline that the company said largely reflected a lack of sales of its REGEN-COV monoclonal antibody treatment for COVID-19 during the period. On an adjusted basis, Regeneron saw earnings per share fall to $9.77 from $25.80, whereas analysts tracked by FactSet were expecting $8.62. Total revenue dropped to $2.86 billion from $5.14 billion, marking a 44% decline. Analysts were anticipating $2.79 billion revenue. Regeneron said that revenue would have been down 20% when excluding impacts from REGEN-COV. ""There have been no sales of REGEN-COV in the United States during 2022 as the Company had completed its final deliveries of drug product under its agreements with the U.S. government as of December 31, 2021,"" the company said in its release. Chief Executive Leonard Schleifer said in the release that the second quarter showcased ""record net product sales of EYLEA, Dupixent, and Libtayo, as well as multiple regulatory achievements for Dupixent."" Regeneron shares have lost 13% over the past three months as the S&amp;P 500  has fallen about 2%. </p><p>Market Pulse Stories are Rapid-fire, short news bursts on stocks and markets as they move. Visit MarketWatch.com for more information on this news."
2022-08-03 10:44:36,"AmerisourceBergen beats profit and revenue expectations, raises full-year outlook","<p>AmerisourceBergen Corp.  reported Wednesday fiscal third-quarter profit and revenue that beat expectations and raised its full-year outlook, amid strength in its International Healthcare Solutions (IHS) business. Shares of the pharmaceuticals and healthcare products company were still inactive in premarket trading. Net income for the quarter to June 30 rose to $407.0 million, or $1.92 a share, from $292.1 million, or $1.40 a share, in the year-ago period. Excluding nonrecurring items, adjusted earnings per share of $2.62 beat the FactSet consensus of $2.56. Revenue grew 12.5% to $60.06 billion, well above the FactSet consensus of $59.08 billion, with IHS revenue rising 120.3%. For fiscal 2022, the company raised its adjusted EPS guidance range to $10.90 to $11.10 from $10.80 to $11.05. The stock has gained 7.5% year to date while the S&amp;P 500  has dropped 14.2%.</p><p>Market Pulse Stories are Rapid-fire, short news bursts on stocks and markets as they move. Visit MarketWatch.com for more information on this news."
2022-08-03 10:42:45,CVS shares up 2.2% premarket after earnings beat and company raises guidance,"<p>CVS Health Corp. shares  jumped 2.2% in premarket trade Wednesday, after the drug-store chain and medical benefits company posted better-than-expected second-quarter earnings and raised guidance. CVS had net income of $2.951 billion, or $2.23 a share, for the quarter, up from $2.783 billion, or $2.10 a share, in the year-earlier period. Adjusted per-share earnings came to $2.40, ahead of the $2.18 FactSet consensus. Revenue rose to $80.636 billion from $72.616 billion a year ago, also ahead of the $76.409 billion FactSet consensus. Revenue grew across all segments. The company is now expecting full-year EPS of $7.23 to $7.43, up from prior guidance of $6.93 to $7.13. It expects full-year adjusted EPS of $8.40 to $8.60, up from prior guidance of $8.20 to $8.40. The FactSet consensus is for full-year EPS of $8.35. Shares have fallen 7.6% in the year to date, while the S&amp;P 500  has fallen 14%. </p><p>Market Pulse Stories are Rapid-fire, short news bursts on stocks and markets as they move. Visit MarketWatch.com for more information on this news."
2022-08-03 10:26:01,Coronavirus tally: Biden's 'loose cough' returns but President has no fever in 'rebound' COVID case,"<p>President Joe Biden's 'loose cough"" COVID symptom has returned, his doctor said Tuesday, but he continues to fell well and has no fever. White House physician Kevin O'Connor provided the update on the president's condition as he continues to test positive for the virus, as the Associated Press reported. He said Biden's temperature, pulse, blood pressure, respiratory rate and oxygen saturation ""remain entirely normal."" Biden is required to remain in isolation through at least Thursday under Centers for Disease Control and Prevention guidelines - and perhaps longer under tougher White House protocols if he continues to test positive. The daily average for new U.S. cases remains close to 130,000 a day, but not all data are being captured as many people are testing at home. The average stood at 122,625 on Tuesday, according to a New York Times tracker, down 2% from two weeks ago. The daily average for hospitalizations rose to 43,592 up 4% in two weeks. The daily average for deaths is up 3% to 450.  Globally, the confirmed case tally rose above 579.5 million on Wednesday, according to data aggregated by Johns 2Hopkins, while the death toll is above 6.40 million with the U.S. leading the world with 91.6 million cases and 1,031,035 deaths.</p><p>Market Pulse Stories are Rapid-fire, short news bursts on stocks and markets as they move. Visit MarketWatch.com for more information on this news."
2022-08-03 10:23:03,Uber stock looks to extend rally after upgrade,"<p>Shares of Uber Technologies Inc.  could be set to extend their gains Wednesday after Raymond James analyst Aaron Kessler upgraded the ride-hailing stock to outperform from market perform in the wake of the company's latest earnings report. Uber's stock was up 1.6% in premarket trading Wednesday after rising nearly 19% in Tuesday's session following the report. Kessler likes Uber's momentum in its mobility business, as bookings rose 57% on a year-over-year basis when excluding currency impacts. He saw other positive trends in the mobility business as well, including a ""healthy"" number of driver signups. ""The one area that has lagged is the West Coast where recovery is still trailing,"" Kessler wrote, but ""Uber expects trends to continue to improve in 2H."" He also cheered the company's leverage on earnings before interest, taxes, depreciation, and amortization (Ebitda), writing that this stems ""from both the volume recovery as well as increasing operational efficiencies."" Kessler set a $38 price target on the stock, which closed Tuesday at $29.25. Shares have lost 0.8% over the past three months as the S&amp;P 500  has fallen 2.0%.  </p><p>Market Pulse Stories are Rapid-fire, short news bursts on stocks and markets as they move. Visit MarketWatch.com for more information on this news."
2022-08-03 10:21:12,"Dish loses 257,000 pay-TV subscribers in second quarter","<p>Dish Network Corp.  continued to shed subscribers as the telecommunications company posted a mixed earnings report for its second quarter. The company recorded net income of $523 million, or 82 cents a share, compared with net income of $671 million, or $1.06 a share, in the year-earlier quarter. Analysts were anticipating 65 cents a share in GAAP earnings. Revenue fell to $4.21 billion from $4.49 billion, while analysts had been expecting $4.24 billion. The company posted a loss of roughly 257,000 pay-TV subscribers, to finish the quarter with 9.99 million subscribers, including 7.79 million for Dish TV and 2.20 million for Sling TV. Retail wireless subscribers dropped by about 210,000 in the latest quarter, and Dish finished the period with about 7.87 million subscribers in total for the category. Dish shares have lost 47% so far this year as the S&amp;P 500  has declined about 14%. </p><p>Market Pulse Stories are Rapid-fire, short news bursts on stocks and markets as they move. Visit MarketWatch.com for more information on this news."
2022-08-03 22:04:35,"Fastly stock declines following outlook, new CEO","<p>Fastly Inc.  shares declined in the extended session Wednesday after the cloud-software company forecast a weaker-than-expected outlook and announced a new chief executive. Fastly shares declined 4% after hours, following a 7.3% rise in the regular session to close at $13.21. The company reported a second-quarter loss of $69 million, or 14 cents a share, compared with a loss of $57.5 million, or 51 cents a share, in the year-ago period. Adjusted earnings, which exclude stock-based compensation expenses and other items, were 23 cents a share, compared with 15 cents a share in the year-ago period. Revenue rose to $102.5 million from $85 million in the year-ago quarter. Analysts surveyed by FactSet had forecast a loss of 17 cents a share on revenue of $101.3 million. Fastly forecast a loss of 18 cents to 15 cents a share on revenue of $102 million to $105 million for the third quarter, and a loss of 68 cents to 63 cents a share on revenue of $415 million to $425 million for the year. Analysts had estimated a loss of 14 cents a share on revenue of $100.5 million for the third quarter, and a loss of 56 cents a share on revenue of $410 million for the year. Fastly also named Todd Nightingale as its chief executive effective Sept. 1. Back in May, the company started looking for a new CEO.</p><p>Market Pulse Stories are Rapid-fire, short news bursts on stocks and markets as they move. Visit MarketWatch.com for more information on this news."
2022-08-03 21:28:29,Howard Hughes stock rallies after surprise profit,"<p>Howard Hughes Corp.  shares rallied in the extended session Wednesday after the real-estate manager reported a surprise profit. Howard Hughes shares surged more than 15% after hours, following a 1.7% rise in the regular session to close at $69.80. The company reported second-quarter net income of $21.6 million, or 42 cents a share, compared with $4.8 million, or 9 cents a share, in the year-ago period. Revenue rose to $276.7 million from $212.5 million in the year-ago quarter. Analysts surveyed by FactSet had forecast a loss of 39 cents a share on revenue of $203.7 million. ""In a quarter that has been headlined by an economic downturn, rising inflation, and recessionary concerns, we performed exceptionally well,"" said David O'Reilly, Howard Hughes chief executive, in a statement. </p><p>Market Pulse Stories are Rapid-fire, short news bursts on stocks and markets as they move. Visit MarketWatch.com for more information on this news."
2022-08-03 20:57:33,Fortinet stock falls following split outlook,"<p>Fortinet Inc.  shares fell in the extended session Wednesday after some of the cybersecurity company's outlook slipped below the Wall Street consensus following a slight beat. Fortinet shares dropped 11% after hours, following a 4.2% rise in the regular session to close at $62.88. The company reported second-quarter net income of $173.5 million, or 21 cents a share, compared with $137.5 million, or 16 cents a share, in the year-ago period. Adjusted earnings, which exclude stock-based compensation expenses and other items, were 24 cents a share, compared with 19 cents a share in the year-ago period. Revenue rose to $1.03 billion from $801.1 million in the year-ago quarter. Analysts surveyed by FactSet had forecast 22 cents a share on revenue of $1.03 billion. Fortinet forecast earnings of 26 cents to 28 cents a share on revenue of $1.11 billion to $1.14 billion for the third quarter, and $1.01 to $1.06 a share on revenue of $4.35 billion to $4.4 billion for the year. Analysts had estimated 27 cents a share on revenue of $1.13 billion for the third quarter, and $1.03 a share on revenue of $4.39 billion for the year.</p><p>Market Pulse Stories are Rapid-fire, short news bursts on stocks and markets as they move. Visit MarketWatch.com for more information on this news."
2022-08-03 20:33:10,"Fisker says $5,000 Ocean One pre-orders have sold out, production set for Nov. 17","<p>Fisker Inc.  revealed Wednesday that 5,000 customers have paid $5,000 to pre-order the first electric Ocean SUVs produced by the company, and confirmed a November production launch of the vehicles. ""We are delighted to announce that the 5,000 limited edition Fisker Ocean One pre-order units are completely sold out,"" Chief Executive Henrik Fisker said in a statement. Fisker reported a second-quarter loss of $106 million, or 36 cents a share. Analysts on average expected a loss of 41 cents a share, according to FactSet. Reservations for the company's first electric vehicle topped 56,000, up from 45,000 reported in May. The car is expected to start production on Nov. 17. Fisker reported more than $850 million in cash and equivalents as of the end of the quarter, and said that would be sufficient to fund the production launch as well as development through the end of the year. Fisker shares dipped slightly in after-hours trading after closing with a 5.8% gain at $10.41; they have declined 33.6% so far this year, while the S&amp;P 500  have declined 14.2%.</p><p>Market Pulse Stories are Rapid-fire, short news bursts on stocks and markets as they move. Visit MarketWatch.com for more information on this news."
2022-08-03 20:22:57,Qorvo stock rallies on earnings beat,"<p>Qorvo Inc.  shares rallied in the extended session Wednesday after the semiconductor company topped Wall Street estimates for the quarter. Qorvo shares rallied more than 7% after hours, following a 3.6% gain in the regular session to close at $106.87. The company reported fiscal first-quarter net income of $68.9 million, or 65 cents a share, compared with $285.6 million, or $2.51 a share, in the year-ago period. Adjusted earnings, which exclude stock-based compensation expenses and other items, were $2.25 a share, compared with $2.83 a share in the year-ago period. Revenue declined to $1.04 billion from $1.11 billion in the year-ago quarter. Analysts surveyed by FactSet had forecast $2.11 a share on revenue of $1.02 billion. ""Qorvo is executing well and delivering solid results despite macroeconomic headwinds,"" said Bob Bruggeworth, Qorvo chief executive, in a statement. ""We are investing in product and technology leadership across our businesses and expanding our reach in higher growth end markets, such as IoT connectivity, power management, power conversion and defense."" Qorvo forecast earnings of $2.45 to $2.65 a share on revenue of $1.12 billion to $1.15 billion for the current quarter, while analysts expect $2.62 a share and revenue of $1.13 billion for the year.</p><p>Market Pulse Stories are Rapid-fire, short news bursts on stocks and markets as they move. Visit MarketWatch.com for more information on this news."
2022-08-03 20:20:23,Lucid stock plunges after electric-vehicle maker cuts production guidance for the year,"<p>Shares of Lucid Group Inc.  fell more than 10% in after-hours trading Wednesday after the electric-vehicle maker announced a reduction in its production forecast. Lucid said it now expects its 2022 production volume to hit 6,000 to 7,000 vehicles, after stating 12,000 to 14,000 vehicles in May. ""Our revised production guidance reflects the extraordinary supply chain and logistics challenges we encountered,"" Chief Executive Peter Rawlinson said in a statement. ""We've identified the primary bottlenecks, and we are taking appropriate measures - bringing our logistics operations in-house, adding key hires to the executive team, and restructuring our logistics and manufacturing organization."" Lucid reported a second-quarter loss of $555.3 million, or 33 cents a share, on revenue of $97.3 million, after a loss of $1.17 a share on no revenue a year ago. Analysts on average were expecting a loss of 39 cents a share on sales of $145 million, according to FactSet. Lucid reported the delivery of 679 vehicles, up from 360 the quarter before, as the company continues to roll out early versions of its Lucid Air luxury sedan. Reservations for vehicles now top 37,000, up from 30,000 reported three months ago. Lucid's stock closed Wednesday with a 4.2% gain at $20.56, and has declined 46.2% so far this year as the S&amp;P 500 index  has declined 14.2%.</p><p>Market Pulse Stories are Rapid-fire, short news bursts on stocks and markets as they move. Visit MarketWatch.com for more information on this news."
2022-08-03 20:07:34,"Dow records best daily gain in a week, stocks sharply rally as investors focus on bright spots in earnings","<p>U.S. stocks booked powerful gains Wednesday, with the Dow sweeping to its best day in a week, as investors focus on bright spots in second-quarter corporate earnings. The blue-chip Dow Jones Industrial Average  powered almost 500 points higher, or 1.5%, ending near 32,888, which was its best daily percentage gain since July 27, according to FactSet data. The technology heavy S&amp;P 500 index  and Nasdaq Composite Index  booked 1.6% and 2.6% gains, respectively. Focus was on solid earnings reported by PayPal Holdings Inc  and SoFi Technologies Inc. , even though Robinhood Markets Inc.  said late Tuesday it plans to cut 23% of its staff to offset depressed trading activity and a weaker economic environment.</p><p>Market Pulse Stories are Rapid-fire, short news bursts on stocks and markets as they move. Visit MarketWatch.com for more information on this news."
2022-08-03 19:31:46,"Democrats' climate and tax package would cut deficits by $101.5 billion, CBO estimates","<p>Senate Democrats' Inflation Reduction Act would cut deficits by $101.5 billion between this year and 2031, the Congressional Budget Office said in an estimate on Wednesday. The nonpartisan agency also said in an analysis that the beefed-up tax enforcement provisions in the bill would bring in an additional $204 billion in revenue. The $739 billion healthcare, climate and tax package was agreed to by Sen. Joe Manchin, a key West Virginia Democrat, and Senate Majority Leader Chuck Schumer, a New York Democrat. Schumer is aiming to begin votes on the measure soon. Hurdles include the bill's treatment of the so-called carried-interest loophole and the lack of relief on state and local taxes.  </p><p>Market Pulse Stories are Rapid-fire, short news bursts on stocks and markets as they move. Visit MarketWatch.com for more information on this news."
2022-08-03 19:01:47,Biden signs second executive order on protecting abortion access,"<p>President Joe Biden on Wednesday signed an executive order intended to help Americans who travel across state lines for abortions. It followed another order signed last month, in the wake of the Supreme Court decision striking down Roe v. Wade. ""We're doing everything in our power to safeguard access to health care, including the right to choose that women had under Roe v. Wade, which was ripped away by this extreme court,"" Biden said at a White House meeting. Biden, who is still isolating with a case of COVID-19, virtually joined a meeting of the Interagency Task Force on Reproductive Healthcare Access and hailed a Kansas vote on Tuesday that protects access to the procedure.     </p><p>Market Pulse Stories are Rapid-fire, short news bursts on stocks and markets as they move. Visit MarketWatch.com for more information on this news."
2022-08-03 18:39:30,"U.S. oil benchmark ends sharply lower after rise in crude, gasoline inventories","<p>Oil futures ended sharply lower on Wednesday after government data showed an unexpected rise in U.S. crude and gasoline inventories, wiping out early gains that came after OPEC+ delivered only a small increase in its September production target. West Texas Intermediate crude for September delivery   fell $3.76, or 4%, to close at $90.66 a barrel. The U.S. benchmark saw a front-month close of $92.10 a barrel on Feb. 23, the day before Russia's invasion of Ukraine, which sent crude soaring to an intraday high above $130 a barrel in early March.</p><p>Market Pulse Stories are Rapid-fire, short news bursts on stocks and markets as they move. Visit MarketWatch.com for more information on this news."
2022-08-03 17:49:48,Gold snaps 5-session win streak on Wednesday as traders focus on odds of a Fed pivot,"<p>Gold prices finished lower on Wednesday, ending the longest streak of gains for the precious metal since April, as some traders reconsidered the odds of a pivot by the Federal Reserve away from its aggressive rate-hiking stance. December gold   fell $13.30, or 0.7%, to settle at $1,776.40 an ounce on Comex, according to FactSet. The yellow metal came under pressure from climbing Treasury yields and a strong U.S. dollar [s:dxy], both of which can dull the appeal of gold. Investors have now heard from several top Federal Reserve officials this week, including Richmond Fed President Thomas Barkin on Wednesday, who said the central bank sees a path to taming inflation, but that a recession could happen in the process. The lower close ended gold's five-session win streak, its longest since April, according to Dow Jones Market Data.</p><p>Market Pulse Stories are Rapid-fire, short news bursts on stocks and markets as they move. Visit MarketWatch.com for more information on this news."
2022-08-04 11:54:11,"Datadog tops earnings expectations, but stock falls with guidance seen as conservative","<p>Shares of Datadog Inc.  were falling more than 9% in premarket trading Thursday after the cloud-monitoring company beat expectations with its second-quarter results but delivered a third-quarter revenue outlook that fell just shy of the FactSet consensus at the midpoint. The company recorded a net loss of $4.88 million, or 2 cents a share, compared with a loss of $9.36 million, or 3 cents a share, in the year-earlier quarter. On an adjusted basis, Datadog earned 24 cents a share, up from 9 cents a share a year before and ahead of the FactSet consensus, which was for 15 cents a share. Datadog's revenue increased to $406.1 million from $233.5 million, whereas analysts were projecting $382 million. For the third quarter, Datadog executives model revenue of $410 million to $414 million along with adjusted earnings per share of 15 cents to 17 cents. Analysts tracked by FactSet were looking for $413 million in September-quarter revenue and 16 cents in adjusted EPS. For the full year, the management team anticipates $1.61 billion to $1.63 billion in revenue and 74 cents to 81 cents in adjusted EPS. The FactSet consensus was for $1.63 billion in revenue along with 75 cents in adjusted EPS. The company's ""guidance shows conservatism"" as it was increased ""not by the magnitude we've become accustomed to,"" RBC Capital Markets analyst Matthew Hedberg said in a note to clients. Shares of Datadog have lost 37% so far this year as the S&amp;P 500  has dropped 13%.</p><p>Market Pulse Stories are Rapid-fire, short news bursts on stocks and markets as they move. Visit MarketWatch.com for more information on this news."
2022-08-04 11:48:59,"Penn National Gaming stock falls after profit falls below expectations, while revenue tops forecasts","<p>Shares of Penn National Gaming Inc.  slumped 1.7% in premarket trading Thursday, after the online gaming and sports betting company and Barstool Sports partner reported second-quarter profit that missed expectations but revenue that topped, as rising expenses led to a drop in margins. Net income dropped to $26.1 million, or 15 cents a share, from $198.7 million, or $1.17 a share, in the year-ago period. The FactSet consensus was for earnings per share of 50 cents. Revenue rose 5.2% to $16.3 billion, above the FactSet consensus of $1.60 billion, as gaming revenue increased 1.5% to $1.33 billion and food, beverage, hotel and other revenue jumped 25.4% to $301.3 million. Total operating expenses increased more than revenue, rising 13.4% to $1.32 billion, as operating income as a percent of revenue contracted to 18.6% from 24.4%. The company reiterated its 2022 revenue guidance of $6.15 billion to $6.55 billion. The stock has shed 5.5% over the past three months through Wednesday, while the S&amp;P 500  has lost 3.4%.</p><p>Market Pulse Stories are Rapid-fire, short news bursts on stocks and markets as they move. Visit MarketWatch.com for more information on this news."
