DATE,TITLE,SUMMARY
2022-08-04 11:41:53,Lordstown Motor shares up 4.8% premarket after posting small Q2 profit and affirming on track with Endurance electric pick-up truck,"<p>Lordstown Motors Corp. shares  rose 4.8% in premarket trade Thursday, after the company surprised with a small second-quarter profit as it gears up for the launch of its Endurance truck in the coming quarters. The electric truck maker said it had net income of $63,659 in the quarter, or 32 cents a share, after a loss of $108,200, or 61 cents a share, in the year-earlier period. The FactSet consensus was for a loss of 44 cents. The company is still pre-revenue but is on target for the start of commercial production of the Endurance electric pick-up truck in the third quarter with commercial deliveries expected to start in the fourth quarter. The company, which completed the deal to sell its Ohio factory to Foxconn in May, said it expects a lower operating loss in the second half and capex of $140 million to $150 million, which should reduce the minimum capital raise in 2022 to $50 million to $75 million from $150 million. The company had $236 million in cash on hand at quarte-end.  ""Over the past year, we have recruited and developed an experienced senior management team, made significant progress towards launching the Endurance, transitioned to a less capital intensive and flexible business model, established a new vehicle development platform with Foxconn, and raised some additional capital,"" Executive Chairman Daniel Ninivaggi said in a statement.  ""While these were critical foundational steps, we realize that much work remains to be done. "" </p><p>Market Pulse Stories are Rapid-fire, short news bursts on stocks and markets as they move. Visit MarketWatch.com for more information on this news."
2022-08-04 11:36:45,Bausch + Lomb beats earnings and revenue expectations; stock is up 3%,"<p>Shares of Bausch + Lomb Corp.  were up 3.1% in premarket trading on Thursday after the eyecare company outperformed earnings and revenue expectations in the second quarter of 2022. Bausch had earnings of $5 million, or 1 cent per share, in the second quarter of the year, down from $44 million, or 13 cents per share, in the same quarter a year ago. Adjusted earnings per share were 29 cents, against a FactSet consensus of 20 cents. The company reported $941 million in revenue for the quarter, up from $934 million in the same three months of 2021. The FactSet consensus was $909 million. Its vision care business was the only one to report an increase in revenue, to $589 million, up from $556 million. The company maintained its guidance for 2022, saying it expects full-year revenue of $3.75 billion to $3.80 billion. Bausch went public earlier this year following its spinoff from Bausch Health Cos. .</p><p>Market Pulse Stories are Rapid-fire, short news bursts on stocks and markets as they move. Visit MarketWatch.com for more information on this news."
2022-08-04 11:30:01,Shake Shack shares slide 7% premarket as it swings to a loss and revenue falls short of estimates,
2022-08-04 11:28:52,"Wayfair stock slips after wider-than-expected loss and drop in active customers, but revenue beat forecasts","<p>Shares of Wayfair Inc.  slipped 0.6% in premarket trading Thursday, after the online home furnishings company reported a wider-than-expected second-quarter loss and a drop in active customers, citing a ""difficult macroeconomic environment,"" while revenue topped forecasts. The company swung to a net loss of $378 million, or $3.59 a share, from net income of $131 million, or $1.14 a share, in the year-ago period. Excluding nonrecurring items, the adjusted loss per share of $1.94 missed the FactSet loss consensus of $1.90. Revenue dropped 14.9% to $3.28 billion, above the FactSet consensus of $3.20 billion. Active customers of 23.6 million as of June 30 was down 24.1% from last year and below the FactSet consensus of 23.7 million. Orders per customer fell 5.6% to 1.85, but average order value increased 18.7% to $330. The stock, which closed Wednesday at a three-month high, has tumbled 29.0% over the past three months through Wednesday, while the S&amp;P 500 index  has declined 3.4%. </p><p>Market Pulse Stories are Rapid-fire, short news bursts on stocks and markets as they move. Visit MarketWatch.com for more information on this news."
2022-08-04 11:21:31,Eli Lilly stock falls 3% after Q2 top and bottom line results miss Wall Street's forecast,
2022-08-04 11:20:26,ConocoPhillips earnings top $5 billion in latest blowout quarter for oil majors,"<p>ConocoPhillips  shares rose 3.4% in premarket trades Thursday after it said its second-quarter earnings more than doubled to $5.1 billion, or $3.96 per share, up from $2.1 billion, or $1.55 a share, in the year-ago quarter. Excluding items, adjusted earnings were $3.91 a share in the latest quarter. The company beat the profit target of $3.86 a share, according to FactSet estimates. ConocoPhillips said it is adding $5 billion to its planned 2022 return of capital to bring the total to $15 billion. The oil company will pay both a third-quarter ordinary dividend of 46 cents per share and a fourth-quarter variable return of cash  payment of $1.40 per share. Second-quarter production increased by 104 thousand barrels of oil equivalent per day (MBOED) to 1,692 MBOED, below the Wall Street target of 1,703.2 MBOED. The company said it expects third-quarter production of 1.7 to 1.76 million MBOED, compared to the Wall Street estimate of 1,743.6 MBOED. </p><p>Market Pulse Stories are Rapid-fire, short news bursts on stocks and markets as they move. Visit MarketWatch.com for more information on this news."
2022-08-04 11:20:06,Paramount stock gains after earnings exceed expectations,"<p>Shares of Paramount Global Inc.  were headed about 2% higher in premarket trading after the media company once known as ViacomCBS topped expectations with its latest financial results. The company logged operating income of $819 million, down from $1.23 billion a year before. On a per-share basis, Paramount earned 53 cents, compared with $1.50 in the year-earlier quarter. After adjustments, the company posted earnings per share of 64 cents, down from 97 cents a year prior but ahead of the FactSet consensus, which was for 61 cents. The company noted in its earnings release that it incurred higher spending related to its direct-to-consumer services in the latest quarter relative to a year before. Paramount's revenue increased to $7.78 billion from $6.56 billion, while analysts had been projecting $7.56. billion. The company added 4.9 million Paramount+ subscribers and saw revenue from that streaming service rise 120%. The company's total global direct-to-consumer subscriber count increased to almost 64 million and reflected the removal of 3.9 million subscribers from Russia. "" In Q2, we grew total company revenue by 19 percent and took market share in streaming, in broadcast TV, in box office and in upfront dollars, all while increasing our penetration of the most important growth market in media-streaming,"" Chief Executive Bob Bakish said in a release. Shares of Paramount have lost 17% over the past three months as the S&amp;P 500  has fallen by 0.5%. </p><p>Market Pulse Stories are Rapid-fire, short news bursts on stocks and markets as they move. Visit MarketWatch.com for more information on this news."
2022-08-04 11:13:23,Bank of England delivers half-point rate hike as inflation pressures intensify,"<p>The Bank of England, as expected, delivered its largest rate hike in more than 27 years on Thursday in an effort to rein in inflationary pressures that policy makers said have ""intensified significantly"" since the last meeting of the rate-setting Monetary Policy Committee. The committee voted 8-1 to lift Bank Rate by 50 basis points, or half a percentage point, to 1.75%. The BOE said one member preferred to raise the rate by 25 basis points to 1.5%. Rising inflation pressures reflect a near doubling in wholesale gas prices since May, the BOE said, ""owing to Russia's restriction of gas supplies to Europe and the risk of further curbs."" The latest rise in gas prices has led to another significant deterioration in the outlook for activity in the United Kingdom and the rest of Europe, the central bank said, with the U.K. ""now projected to enter recession from the fourth quarter of this year."" </p><p>Market Pulse Stories are Rapid-fire, short news bursts on stocks and markets as they move. Visit MarketWatch.com for more information on this news."
2022-08-04 11:13:03,"Papa John's misses profit and revenue expectations, but same-store sales beats and dividend gets a 20% boost","<p>Shares of Papa John's International Inc.  edged up 0.2% in premarket trading Thursday, after the pizza seller reported second-quarter profit and revenue that came up short of expectations, amid acceleration in commodity costs and labor inflation, and weakness overseas, while North America same-store sales rose more than forecast and the company boosted its dividend by 20%. The company swung to net income of $25.4 million, or 70 cents a share, from a loss of $32.3 million, or $2.30 a share, in the year-ago period. Excluding nonrecurring items, adjusted earnings per share fell to 74 cents from 93 cents, just below the FactSet consensus of 75 cents. Revenue rose 1.5% to $522.7 million, but missed the FactSet consensus of $529.6 million. Same-store sales in North America rose 0.9% to beat expectations of a 0.5% rise, but dropped 8.0% internationally versus expectations of a 0.3% decline. Separately, the company raised its quarterly dividend to 42 cents a share from 35 cents, with the new dividend payable Aug. 26 to shareholders of record on Aug. 15. The stock has gained 4.3% over the past three months through Wednesday, while the S&amp;P 500  lost 3.4%.</p><p>Market Pulse Stories are Rapid-fire, short news bursts on stocks and markets as they move. Visit MarketWatch.com for more information on this news."
2022-08-04 11:00:29,Cowen cuts price target on Green Thumb Industries despite solid quarter,"<p>Cowen analyst Vivien Azer on Thursday reiterated an outperform rating on Green Thumb Industries Inc.  but cut her price target to $20 a share from $45 after the U.S. cannabis company's latest earnings update. Green Thumb Industries earned $24.44 million, or 10 cents a share in its fiscal second quarter, up from $22.05 million, or 10 cents a share, in the year-ago quarter. Revenue rose 14.6% to $254.31 million from $221.87 million. The company's revenue grew 5% over the first quarter. Green Thumb beat the Wall Street earnings target of 4 cents a share and the revenue estimate of $248.9 million, according to FactSet estimates. Cowen's Azer said despite the ""healthy"" quarter, she lowered the company's price target to about 4.2 times her fiscal 2022 sales estimate of $1.2 billion. The price target also ""contemplates a lack of regulatory catalysts coupled with macro headwinds,"" Azer said Shares of Green Thumb Industries are down 56.2% in 2022, compared to a drop of 54.1% by the AdvisorShares Pure US Cannabis ETF  and a loss of 19% by the Nasdaq. .</p><p>Market Pulse Stories are Rapid-fire, short news bursts on stocks and markets as they move. Visit MarketWatch.com for more information on this news."
2022-08-04 10:45:24,SeaWorld posts better-than-expected Q2 earnings,"<p>SeaWorld Entertainment Inc.  posted better-than-expected earnings for the second quarter, but said COVID continued to weigh and the numbers do not yet represent a normalized environment as it works to improve execution. The company posted net income of $116.6 million, or $1.62 a share, for the quarter, down from $127.8 million, or $1.59 a share, in the year-earlier period. Revenue rose 15% to $504.8 million from $439.8 million. The FactSet consensus was for EPS of $1.54 and revenue of $504.0 million.  Guest attendance totaled 6.3 million guests, up 7.8% from a year ago. ""While our second quarter and first half financial results were strong, these results still do not reflect a normalized operating environment and we still have significant scope to improve our execution and our financial results,"" CEO Marc Swanson said in a statement. July revenue continued to grow from a record July 2021, however, and was up abut 20% compared to July of 2019, and the company is expecting another ""solid summer."" The company announced a new $250 million share buyback program.   Shares were not yet active premarket, but have fallen 24% in the year to date, while the S&amp;P 500  has fallen 13%. </p><p>Market Pulse Stories are Rapid-fire, short news bursts on stocks and markets as they move. Visit MarketWatch.com for more information on this news."
2022-08-04 10:44:07,USA Today parent Gannett swings to a loss and revenue falls as inflation and labor shortages weigh,"<p>USA Today parent Gannett Co. Inc.  reported Thursday that it swung to a second-quarter net loss of $53.7 million, or 39 cents a share, from net income of $22.6 million, or 10 cents a share, in the year-ago period. There were not enough analyst estimates compiled by FactSet to have a consensus. Revenue fell 6.9% to $748.7 million, as advertising and marketing services revenue declined 8.7% to $383.6 million and circulation revenue dropped 11.5% to $274.6 million. Operating expenses increased 1.5% to $769.9 million. Same-store revenue decreased 6.3%, while total digital revenue increased 1.5% on a same-store basis. The company cut its 2022 revenue outlook to $2.95 billion to $3.00 billion from $3.1 billion to $3.2 billion. ""Our second quarter results and updated full year outlook reflect industry-wide headwinds in digital advertising as well as rising costs and pressures on consumers which are impacting our near-term performance,"" said Chief Executive Michael Reed. ""During the quarter we experienced a rapidly tightening macroeconomic environment caused by rising inflation coupled with distribution labor shortages and price sensitive consumers which has affected our traditional print business."" The stock, which was still inactive in premarket trading, has dropped 23.6% over the pat three months, while the S&amp;P 500  has lost 3.4%.</p><p>Market Pulse Stories are Rapid-fire, short news bursts on stocks and markets as they move. Visit MarketWatch.com for more information on this news."
2022-08-04 10:29:15,Coronavirus tally: Global case tally falls 9% in latest week but U.S. case numbers continue to rise,
2022-08-04 10:15:42,"WeWork reports wider than expected loss and revenue misses, but adjusted results were less negative","<p>WeWork Inc.  reported Thursday a second-quarter net loss that was wider than expected and revenue that came up shy of forecasts, but an adjusted loss that beat, while the provider of flexible workspaces affirmed its full-year outlook. The net loss narrowed to $577 million, or 76 cents a share, from $889 million, or $6.12 a share, in the year-ago period. The number of shares used to calculate per-share losses increased 424% to 761.55 million. The FactSet per-share loss consensus was 58 cents. Revenue grew 37.4% to $815 million but was below the FactSet consensus of $824.3 million. Adjusted earnings before interest, taxes, depreciation and amortization (Ebitda) was negative $134 million, a $315 million improvement from last year and less negative than the FactSet consensus of $158.2 million. The company had 777 locations supporting 917,000 desks and 658,000 physical memberships as of June 30, representing 72% occupancy and a 33% rise in memberships. The stock, which was still inactive in premarket trading, has tumbled 26.7% over the past three months while the S&amp;P 500  has slipped 3.4%.</p><p>Market Pulse Stories are Rapid-fire, short news bursts on stocks and markets as they move. Visit MarketWatch.com for more information on this news."
2022-08-04 10:14:07,Cigna shares up 1.7% premarket after Q2 earnings beat,"<p>Cigna Corp. shares  rose 1.7% in premarket trade Thursday, after the health care services company beat earnings estimates for the second quarter. Cigna posted net income of $1.981 billion, or $4.90 a share, for the quarter, up from $1.808 billion, or $4.25 a share, in the year-earlier period. Adjusted per-share earnings came to $6.22, ahead of the $5.49 FactSet consensus. Revenue rose to $45.480 billion from $43.131 billion, also ahead of the $44.486 billion FactSet consensus. The company said customer relationships rose 3% in the year to date to 191.3 million.  Shares are up 18% in the year to date, while the S&amp;P 500  has fallen 13%. </p><p>Market Pulse Stories are Rapid-fire, short news bursts on stocks and markets as they move. Visit MarketWatch.com for more information on this news."
2022-08-04 22:14:30,Expedia rides 'strong' travel rebound to earnings beat,"<p>Expedia Group Inc. shares  were headed 6% higher in after-hours trading Thursday after the online-travel company topped expectations with its latest results amid a strong rebound in travel. The company reported a net loss of $185 million, or $1.17 a share, compared with a loss of $301 million, or $2.02 a share, in the year-before quarter. Expedia reported adjusted earnings per share of $1.96, whereas it lost an adjusted $1.13 a share a year prior. Analysts tracked by FactSet were looking for $1.56 a share in adjusted earnings during the latest quarter. Revenue came in at $3.18 billion, up from $2.11 billion a year earlier and ahead of the FactSet consensus, which was for $2.99 billion. ""Despite the disruptions during the summer travel season and an uncertain macroeconomic backdrop, travel demand has remained strong,"" Chief Executive Peter Kern said in a release. Shares of Expedia have lost 32% over the past three months as the S&amp;P 500  has lost 0.6%. </p><p>Market Pulse Stories are Rapid-fire, short news bursts on stocks and markets as they move. Visit MarketWatch.com for more information on this news."
2022-08-04 21:14:03,"GoPro earnings top estimates, but executives warn of headwinds",
2022-08-04 21:00:53,"Virgin Galactic launch delayed yet again, stock falls","<p>Virgin Galactic Holdings Inc.  delayed its initial launch of tourists into space for the third time in less than a year Thursday, sending shares back toward earth. In a quarterly earnings report, executives said the beginning of its commercial space-tourism business will begin in the second quarter of 2023, after it was pushed to the first quarter in May and the end of 2022 in October of last year. ""While our short-term plans now call for commercial service to launch in the second quarter of 2023, progress on our future fleet continues and many of the key elements of our roadmap are now in place to scale the business in a meaningful way,"" Chief Executive Michael Colglazier said in a statement. Shares fell more than 7%, which would add to a 73.4% descent in the past year. Virgin Galactic reported a second-quarter loss of $112.7 million, or 43 cents a share, on $357,000 in revenue. Analysts on average expected a loss of 43 cents a share on sales of roughly $400,000. Executives expect free cash flow to be negative in the third quarter to the tune of $110 million to $120 million, while holding roughly $370 million in cash and equivalents.</p><p>Market Pulse Stories are Rapid-fire, short news bursts on stocks and markets as they move. Visit MarketWatch.com for more information on this news."
2022-08-04 20:57:07,Carvana posts wider loss than expected but stock pops,"<p>Shares of Carvana Co.  were rocketing 11% in after-hours trading Thursday, though the used-car retailer missed expectations with its second-quarter revenue and logged a larger loss than analysts were anticipating. Carvana recorded a net loss of $238 million, or $2.35 a share, whereas it posted net income of $22 million, or 26 cents a share, in the year-prior quarter. Analysts tracked by FactSet were expecting a GAAP loss per share of $1.46. Carvana posted a $239 million loss on the basis of adjusted earnings before interest, taxes, depreciation, and amortization (Ebitda). A year earlier, it posted positive adjusted Ebitda of $112 million. Analysts tracked by FactSet were looking for a $221.8 million loss on the basis of adjusted Ebitda. Revenue came in at $3.88 billion, up from $3.34 billion a year before but below the FactSet consensus, which called for $3.98 billion. The stock has been pummeled in the past year, falling 90% over a 12-month span as the S&amp;P 500  has declined 6%. </p><p>Market Pulse Stories are Rapid-fire, short news bursts on stocks and markets as they move. Visit MarketWatch.com for more information on this news."
2022-08-04 20:01:27,"Dow, S&P 500 end lower as investors await Friday's jobs report","<p>U.S. stocks closed mostly lower on Thursday, ahead of the release of Friday's employment report for July, with investors hoping it will provide insights into whether America's roaring labor market is exhibiting signs of cooling. The Dow Jones Industrial Average  fell about 85 points, or 0.3%, ending near 32,727, a day after all three major stock indexes booked their best daily climb in a week, according to Dow Jones Market Data. The S&amp;P 500 index  shed 0.1% Thursday, while the Nasdaq Composite Index  rose 0.4%. Employment gains in July are expected to drop to 258,000 from 372,000 in the prior month, a poll of economists by The Wall Street Journal estimates. If so, it would mark the smallest increase since December 2021. While a potential U.S. economic downturn and layoffs in tech have been a focus, Meta Platforms Inc. , the parent of Facebook, was seeing success on Thursday with its debut 4-part corporate bond deal.</p><p>Market Pulse Stories are Rapid-fire, short news bursts on stocks and markets as they move. Visit MarketWatch.com for more information on this news."
2022-08-04 19:56:12,U.S. declares monkeypox a public health emergency,"<p>The U.S. has declared the monkeypox outbreak a public health emergency, according to a federal health official. The Department of Health and Human Services can declare a 90-day public health emergency that allows HHS Secretary Xavier Becerra to take additional steps and access new resources to combat public health issues. A total of 6,617 people have tested positive for monkeypox in the U.S. since May, according to the Centers for Disease Control and Prevention. ""In light of evolving circumstances on the ground, I am declaring a public health emergency on monkeypox. We are prepared to take our response to the next level in addressing this virus. We urge every American to take monkeypox seriously,"" Becerra tweeted Thursday. </p><p>Market Pulse Stories are Rapid-fire, short news bursts on stocks and markets as they move. Visit MarketWatch.com for more information on this news."
2022-08-04 19:42:36,Schumer says he expects Senate to begin voting on climate and tax bill Saturday,
2022-08-04 18:39:48,U.S. crude-oil benchmark closes below $90 a barrel for first time since February,"<p>Oil futures fell sharply Thursday, with the U.S. benchmark ending below the $90 a barrel threshold as investors worried about the risk of a global economic slowdown that could crimp demand. West Texas Intermediate crude for September delivery    ended with a loss of $2.12, or 2.3%, at $88.54 a barrel on the New York Mercantile Exchange, the first finish below $90 for a most actively traded contract since Feb. 10, according to FactSet data.</p><p>Market Pulse Stories are Rapid-fire, short news bursts on stocks and markets as they move. Visit MarketWatch.com for more information on this news."
2022-08-04 17:43:03,"Gold futures score highest finish in a month, top $1,800 as investors focus on U.S. recession odds","<p>Gold prices finished 1.7% higher on Thursday to reclaim a footing above the key $1,800 mark, as investors focused on the chances of the U.S. economy slipping into a recession. December gold   closed up 1.7% to settle at $1,806.90 an ounce on Comex, the highest finish for the most-active contract since June 30, according to FactSet data. Demand for the precious metal was attributed to falling U.S. Treasury yields and the ICE US Dollar index [s:dxy] against a basket of rival currencies, factors that can make gold relatively more attractive to haven-seeking investors. Focus also was on Friday's jobs report for July, as investors consider the odds of a pullback for the robust labor market, particularly as the Federal Reserve ramps up its fight against inflation at a four-decade high. </p><p>Market Pulse Stories are Rapid-fire, short news bursts on stocks and markets as they move. Visit MarketWatch.com for more information on this news."
2022-08-04 16:01:28,Fortinet stock on track for worst day in nearly 7 years,"<p>Fortinet Inc.  shares were on track for their worst day in nearly seven years Thursday after the cybersecurity company reported a slight beat on earnings and an unimpressive outlook. Fortinet shares dropped as much as 17% to an intraday low of $52, putting them on track for their worst one-day performance since Oct. 23, 2015, when they dropped 19%. Late Wednesday, the company topped Wall Street expectations but its outlook didn't.. ""We concede results weren't squeaky clean, but the AH stock reaction appears overdone in our view,"" said Citi Research analyst Fatima Boolani in a note. Boolani has a buy rating on the stock and a $78 price target. ""Bears will likely pick on the skinnier product & billings beat (tougher comps vs. 1Q), weaker services performance/guide (temporary), muted bookings upside, and an admittedly unsatisfactory update on the Russia business exit treatment (accounting wise),"" Boolani said.</p><p>Market Pulse Stories are Rapid-fire, short news bursts on stocks and markets as they move. Visit MarketWatch.com for more information on this news."
