DATE,TITLE,SUMMARY
2022-08-02 18:14:34,Applied DNA Sciences blasts more than 350% higher after initiating validation of monkeypox virus test,"<p>Shares of Applied DNA Sciences Inc.  skyrocketed 353.7% higher in very volatile trading Tuesday, after the biotechnology company said it initiated validation of a monkeypox virus test. Trading volume spiked to 73.1 million shares, compared with the full-day average of about 256,450 shares. The stock has been halted no less than 27 times for volatility since the opening bell. The company said if its polymerase chain reaction (PCR)-based monkeypox virus test is validated by is subsidiary Applied DNA Clinical Labs (ADCL), a validation package will be submitted to the New York State Department of Health for approval. New York declared last week a State Disaster Emergency in response to the monkeypox outbreak. ""Based on our experience with the COVID-19 pandemic, we are keenly aware of the crucial role PCR-based diagnostic tools can play in responding and helping to control public health outbreaks,"" said Applied DNA Chief Executive Dr. James Hayward. ""With a proven workflow and testing services born of COVID-19, upon test approval, ADCL stands ready to apply its testing capacity in service of New Yorkers' health."" The stock has not soared 100.7% over the past three months, while the iShares Biotechnology ETF  has gained 3.6% and the S&amp;P 500  has lost 1.0%.</p><p>Market Pulse Stories are Rapid-fire, short news bursts on stocks and markets as they move. Visit MarketWatch.com for more information on this news."
2022-08-02 17:45:10,Gold prices score 5th straight day of wins Tuesday with U.S.-China tensions in focus,"<p>Gold prices end higher Tuesday, climbing for a fifth straight day, after U.S. House Speaker Nancy Pelosi landed in Taiwan, sparking vows of retaliation from Beijing. December gold   rose 0.1% to settle at $1,789.70 an ounce, with the most-active contract ending higher in the past five sessions. Investors also continued to migrate into precious metals Tuesday and other safe-haven assets after a pair of top Federal Reserve officials pushed back on the notion among some investors that the central bank will pivot away an aggressive pace of rate hikes, instead signaling a plan to wait until high inflation subsides. The U.S. dollar climbed  as did Treasury yields, pushing the 10-year rate  up 12 basis points to about 2.73%, according to FactSet.</p><p>Market Pulse Stories are Rapid-fire, short news bursts on stocks and markets as they move. Visit MarketWatch.com for more information on this news."
2022-08-02 17:21:00,: Unity Software stock rises on report of possible China spinoff,"<p>Unity Software Inc. U shares rose Tuesday following a report the gaming-engine company may spin off its business unit in China to expand. Unity shares rose as much as 5% after Reuters reported that Unity was in talks to spin off its China unit to expand into that market, according to four unidentified sources. Shares fell in early July after Unity said it offered to buy IronSource Ltd. for $4.4 billion, following a large decline in May, when the company revealed a workaround to Apple Inc.’s AAPL opt-out of using Identifier for Advertisers inadvertently sabotaged its own ad-targeting tools. Unity shares are down 61% over the past 12 months, compared with a 6% decline in the S&amp;P 500 index SPX.</p><p>Market Pulse Stories are Rapid-fire, short news bursts on stocks and markets as they move. Visit MarketWatch.com for more information on this news."
2022-08-02 15:25:51,Pelosi says U.S. must 'stand by' Taiwan and calls it 'under threat' from China,"<p>House Speaker Nancy Pelosi on Tuesday said the U.S. must ""stand by"" Taiwan as she arrived on the island amid high tensions with China, which considers it a renegade province. Writing in the Washington Post, the California Democrat said Taiwan's democracy is ""under threat,"" citing increased Chinese patrols of bombers, fighter jets and surveillance aircraft near and over Taiwan's air defense zone. Pelosi arrived in Taiwan on Tuesday evening local time, amid warnings from China that her visit could trigger ""serious consequences."" She's the first House speaker to visit Taiwan in 25 years. U.S. stocks   fell Tuesday morning, as analysts blamed rising tensions between the U.S. and China as Pelosi prepared to visit Taiwan. ""In the face of the Chinese Communist Party's (CCP) accelerating aggression, our congressional delegation's visit should be seen as an unequivocal statement that America stands with Taiwan, our democratic partner, as it defends itself and its freedom,"" Pelosi wrote in the Post.      </p><p>Market Pulse Stories are Rapid-fire, short news bursts on stocks and markets as they move. Visit MarketWatch.com for more information on this news."
2022-08-02 14:33:28,Apple drops face-mask mandate for employees at 'most locations' -- The Verge,"<p>Apple Inc.  is dropping its face-mask mandate for employees at ""most locations,"" The Verge reported, citing an internal email from the company's COVID response team that it obtained. ""Don't hesitate to continue wearing a face mask if you feel more comfortable doing so,"" the email reads. ""Also, please respect every individual's decision to wear a mask or not."" The move comes amid a surge in the highly transmissible BA.5 variant of COVID-19. Earlier this week, the Bay Area transit system BART brought back its mask mandate. Apple shares were down 0.5% Tuesday, and are down 9.5% in the year to date, while the Dow Jones Industrial Average  has fallen 9.7%. </p><p>Market Pulse Stories are Rapid-fire, short news bursts on stocks and markets as they move. Visit MarketWatch.com for more information on this news."
2022-08-02 13:33:44,Eliem's stock slides 20% after saying it will discontinue development of pain treatment,"<p>Shares of Eliem Therapeutics Inc.  tumbled 20.0% in premarket trading on Tuesday after the company said it will discontinue development of its treatment for lumbosacral radicular pain after a Phase 2a clinical trial didn't yield strong enough results. Eliem said it has enough capital to fund the development of other therapies and its operations through mid-2024. Eliem's stock is down 70.9% this year, while the S&amp;P 500  has declined 14.5%. </p><p>Market Pulse Stories are Rapid-fire, short news bursts on stocks and markets as they move. Visit MarketWatch.com for more information on this news."
2022-08-02 13:32:16,U.S. stocks open lower ahead of Pelosi's potential visit to Taiwan,"<p>U.S. stocks opened lower Tuesday as investors watch for U.S. House Speaker Nancy Pelosi's potential visit to Taiwan amid tensions between China and the U.S. The Dow Jones Industrial Average  was trading down 0.4% soon after the opening bell, while the S&amp;P 500  fell 0.3% and the Nasdaq Composite  dropped 0.6%, according to FactSet data, at last check. Pelosi was expected to arrive in Taiwan Tuesday despite warnings from China against visiting , according to an Associated Press report.  A White House spokesman said Monday that the U.S. ""will not be intimidated"" by China's opposition to Pelosi's potential visit.</p><p>Market Pulse Stories are Rapid-fire, short news bursts on stocks and markets as they move. Visit MarketWatch.com for more information on this news."
2022-08-02 12:16:48,Semtech confirms buyout talks with Sierra Wireless,"<p>The U.S.-listed shares of Canada-based networking company Sierra Wireless Inc.  rose 0.2% in premarket trading and Canada-based semiconductor company Semtech Corp.  dropped 0.8%, after Semtech confirmed that it was in talks to buy Sierra Wireless for $31 a share. That represents a 4.4% premium to Monday's closing price for Sierra's stock of $29.70. Sierra's market capitalization as of Monday's close was $1.14 billion. Sierra's stock has shot up 19.4% on Monday, after Bloomberg reported that the company and Semtech were in ""advanced"" buyout talks, with a deal announcement possible within days. Semtech said Tuesday that no assurance could be given that an agreement will be reached. Semtech said it doesn't plan to make any other announcements regarding the talks unless a deal is reached. Semtech shares have tumbled 34.3% year to date through Monday while Sierra's stock has rocketed 68.6% and the S&amp;P 500  has lost 13.6%.</p><p>Market Pulse Stories are Rapid-fire, short news bursts on stocks and markets as they move. Visit MarketWatch.com for more information on this news."
2022-08-02 12:00:36,Sabre shares jump 6.6% premarket after company posts smaller-than-expected Q2 loss,"<p>Sabre Corp. shares  jumped 6.6% in premarket trade Tuesday, after the online travel company posted a smaller-than-expected second-quarter loss and said it believes the travel recovery is on a long-term uptrend. The company had a net loss of $192.7 million, or 59 cents a share, for the quarter, narrower than the loss of $251.3 million, or 79 cents a share, posted in the year-earlier period. Adjusted per-share loss came to 25 cents, ahead of the 31 cent FactSet consensus. Revenue climbed to $657.5 million from $419.7 million, also ahead of the $650.0 million FactSet consensus. ""We saw sequential volume improvements in air bookings each month during the second quarter, across all key global regions,"" CEO Sean Menke said in a statement. ""The strong booking fee increase was driven in part by improvements in long-haul international and business travel. As global travel and testing restrictions lifted, a robust travel recovery ensued and we were ready for it."" The travel recovery ""remains on a long-term upward trajectory,"" he added. The company offered full-year revenue guidance under differing bookings recovery scenarios, with the most optimistic being a range of $3.0 billion to $3.3 billion under a 70% booking recovery, that was up from a prior range of $2.8 billion to $3.1 billion. Shares have fallen 27% in the year to date, while the S&amp;P 500  has fallen 13.6%. </p><p>Market Pulse Stories are Rapid-fire, short news bursts on stocks and markets as they move. Visit MarketWatch.com for more information on this news."
2022-08-02 11:56:31,"KKR shares fall after firm misses revenue target, posts loss","<p>KKR & Co. Inc.  shares dropped 4.3% on Tuesday after the private equity firm said it swung to a second-quarter loss of $827.93 million, or $1.22 from net income of $1.28 billion, or $2.05 a share, in the year-ago quarter. Revenue fell to $330.04 million from $3.14 billion. KKR said it lost $1.68 billion on its investments in the quarter, compared to a gain of $3.46 billion in the year-ago period. After-tax distributable earnings fell 9% to $840 million, or 95 cents a share on an adjusted basis. KKR matched the Wall Street estimate of 95 cents a share but fell well short of the revenue estimate of $1.78 billion. During the quarter, KKR drew in $25 billion in fresh capital and $52 billion in the first half of 2022. Real assets AUM has increased 50% to $114 billion over the past 12 months as the firm diversifies. ""With solid business fundamentals and a record $115 billion of dry powder, we continue to be well positioned against a complex backdrop,"" said co-CEOs Joseph Y. Bae and Scott C. Nuttall. </p><p>Market Pulse Stories are Rapid-fire, short news bursts on stocks and markets as they move. Visit MarketWatch.com for more information on this news."
2022-08-02 11:48:31,"Cummins stock jumps after record revenue, 'solid' profit beat expectations amid strong demand in North America","<p>Shares of Cummins Inc.  climbed 1.9% toward a near six-month high in premarket trading Tuesday, after the maker of diesel, natural gas and ""new power"" engines reported record second-quarter revenue and ""solid"" profit that rose above expectations, as demand outside of China remained strong. Net income increased to $702 million, or $4.94 a share, from $600 million, or $4.10 a share, in the year-ago period. The per-share results included 16 cents in costs related to the separation of the filtration business and a 33-cent benefit from adjusting reserves related to the suspension of Russia operations. The FactSet consensus for earnings per share was $4.35. Revenue grew 7.8% to $6.59 billion, above the FactSet consensus of $6.48 billion, as engine, distribution and power systems sales beat expectations and components sales were in line. North America sales rose 15% while international sales fell 2%, due primarily to a slowdown in China and the ""indefinite suspension"" of Russia operations. Cost of sales rose less than revenue, up 4.9% to $4.86 billion, as gross margin improved to 26.2% from 24.2%. The company affirmed its 2022 revenue growth outlook of 8%, while the current FactSet consensus of $25.96 billion implies 8.1% growth. ""The company achieved record revenues and solid profitability in the second quarter of 2022, with demand for our products remaining strong across most of our key markets and regions, apart from China,"" said Chief Executive Jennifer Rumsey. The stock has surged 11.8% over the past three months through Monday, while the S&amp;P 500  has lost 0.9%.</p><p>Market Pulse Stories are Rapid-fire, short news bursts on stocks and markets as they move. Visit MarketWatch.com for more information on this news."
2022-08-02 11:31:55,Marriott shares up 1.9% premarket as earnings and guidance shows travel recover intact,"<p>Marriott International Inc. shares  rose 1.9% premarket Tuesday, after the hotel operator beat estimates for the second quarter and offered upbeat guidance. Marriott posted net income of $678 million, or $2.06 a share, for the quarter, up from $422 million, or $1.28 a share, in the year-earlier period. Adjusted per-share earnings came to $1.80, ahead of the $1.57 FactSet consensus. Revenue rose to $5.338 billion from $3.149 billion a year ago, also ahead of the $4.924 billion FactSet consensus. The company said systemwide constant dollar RevPAR, or revenue per available room, rose 70.6% worldwide and 66.1% in the U.S. and Canada. The company added about 17,000 rooms globally in the quarter.  ""Marriott's second quarter results highlight consumers' love for travel,"" CEO Anthony Capuano said in a statement. ""We have not seen signs of leisure travel abating, with leisure room nights in the region (U.S. and Canada) more than 15 percent higher than second quarter 2019, and ADR meaningfully outpacing pre-pandemic levels.  Europe also experienced notably strong RevPAR recovery, in large part due to the return of international visitors, with June RevPAR exceeding 2019,"" he continued. Marriott is now expecting third-quarter adjusted EPS of $1.59 to $1.60, compared with a FactSet consensus of $1.59. It expects full-year adjusted EPS of $6.33 to $6.59, compared with a FactSet consensus of $6.01. Shares are down 3.4% in the year to date, while the S&amp;P 500  has fallen 13.6%. </p><p>Market Pulse Stories are Rapid-fire, short news bursts on stocks and markets as they move. Visit MarketWatch.com for more information on this news."
2022-08-02 11:25:37,"Molson Coors revenue falls short, shares fall","<p>Molson Coors Beverage Co.  shares fell 3.7% after it said Tuesday its second-quarter profit fell to $47.3 million, or 22 cents a share, from $388.6 million, or $1.79 a share in the year-ago quarter. Adjusted earnings in the latest quarter totaled $1.19 a share. Sales at the beer maker dipped to $2.92 billion from $2.94 billion. Molson Coors beat the Wall Street analyst estimates for earning of $1.18 a share but fell short of the sales estimate of $2.94 billion, according to a FactSet survey. Looking ahead, Molson Coors said uncertainties in the macroeconomic environment such as cost inflation and the coronavirus pandemic could impact its financial performance. However, the company said it continues to expect a mid single-digit increase in 2022 sales from 2021 on a constant currency basis.</p><p>Market Pulse Stories are Rapid-fire, short news bursts on stocks and markets as they move. Visit MarketWatch.com for more information on this news."
2022-08-02 11:22:41,JetBlue stock falls after company posts wider loss than expected,"<p>Shares of JetBlue Airways Corp.  were off 2.9% in premarket trading Tuesday after the airline reported a larger loss than analysts had been expecting. The company posted a second-quarter net loss of $188 million, or 58 cents a share, whereas it recorded net income of $64 million, or 20 cents a share, in the year-prior quarter. After adjusting for special items and the net performance of investments, JetBlue lost 47 cents a share, whereas it lost 65 cents a share in the year-earlier quarter. Analysts tracked by FactSet were modeling an 11-cent adjusted loss per share. Total operating revenues rose to $2.44 billion from $1.50 billion, while analysts had been expecting $2.45 billion. For the third quarter, JetBlue expects cost per available seat mile, excluding fuel, to increase by 15% to 17%. ""We expect the heightened level of operational investments to normalize once we get beyond the summer peak,"" Chief Financial Officer Ursula Hurley said in a release. ""As a result, we expect to see some productivity improvement into the fourth quarter and 2023."" The company announced last week that it intended to merge with Spirit Airlines Inc.  in a $3.8 billion deal. </p><p>Market Pulse Stories are Rapid-fire, short news bursts on stocks and markets as they move. Visit MarketWatch.com for more information on this news."
2022-08-02 11:20:56,Uber stock jumps more than 10% after sales more than double to beat expectations,"<p>Shares of Uber Technologies Inc.  shot up 10.8% toward a three-month high in premarket trading Tuesday, after the ride-hailing and delivery services company swung to a second-quarter loss but reported a more than doubling in revenue that beat expectations by a wide margin. The company reported a second-quarter loss of $2.60 billion, or $1.33 a share, after net income of $1.14 billion, or 58 cents a share, in the year-ago period. The company said the latest quarter's results include a $1.7 billion headwind, primarily from unrealized losses related to the revaluation of its Aurora, Grab and Zomato stakes. The FactSet per-share loss consensus was 27 cents. Revenue jumped 105.5% to $8.07 billion, above the FactSet consensus of $7.36 billion, as mobility revenue grew 119.6% to $1.62 billion, delivery revenue rose 36.9% to $2.69 billion and freight revenue rose five-fold to $1.83 billion. Gross bookings increased 32.8% to $29.08 billion, beating the FactSet consensus of $28.93 billion, with mobility bookings climbing 54.7% to $13.36 billion and delivery bookings rising 7.5% to $13.88 billion. Free cash flow of $382 million beat expectations of $106.7 billion. For the third quarter, the company expects gross bookings of $29.0 billion to $30.0 billion, compared with the FactSet consensus of $30.0 billion. The stock has tumbled 19.1% over the past three months through Monday while the S&amp;P 500  has slipped 0.9%.</p><p>Market Pulse Stories are Rapid-fire, short news bursts on stocks and markets as they move. Visit MarketWatch.com for more information on this news."
2022-08-02 11:15:32,"Apollo Investment shares climb on new fee structure, rebranding announcements","<p>Apollo Investment Corp.  shares rose 3.6% in premarket trading on Tuesday, fueled by a raft of announcements from the company, which include a new fee structure and a rebranding. Apollo's stock closed Monday's session up 0.7% at $11.58. In a statement, the Business Development Corporation said that the new fee structure includes ""substantial permanent reductions to management and incentive fees.""  The new fee structure will boost Apollo's work with MidCap Financial, which it manages, according to the company. ""Historically, MidCap and Apollo as its manager have predominantly originated assets on behalf of U.S. pensions and other global institutional investors,"" Apollo said, in its statement. ""With the reduced fee structure, the BDC will be able to participate in a broader universe of MidCap Financial-originated senior secured loans, while producing similar to enhanced expected shareholder economics."" Apollo also announced a rebranding to MidCap Financial Investment Corporation. This will reflect the BDC's investment strategy of primarily investing in loans originated by MidCap Financial, it said, noting that the company's ticker will change to ""MFIC."" The name and ticker change will be effective on or around August 12, 2022. Additionally, MidCap Financial has made a $30 million aligning equity investment in Apollo at net asset value. Among its slew of announcements on Tuesday, Apollo also increased its quarterly base distribution from 31 cents to 32 cents a share. ""Over the last several years, we have repositioned the BDC's portfolio to have a senior secured orientation,"" said Howard Widra, the Apollo CEO, in the statement. ""Today's announcements reinforce and support the BDC's position as a pure play senior secured middle market BDC."" Apollo also announced fiscal first-quarter results before market open on Tuesday, reporting net investment income of 37 cents a share, compared to 42 cents a share in the year-ago quarter, topping the 35 cents a share estimate from analysts surveyed by FactSet. </p><p>Market Pulse Stories are Rapid-fire, short news bursts on stocks and markets as they move. Visit MarketWatch.com for more information on this news."
2022-08-02 21:52:06,Alteryx soars on second-quarter sales growth,"<p>Alteryx Inc.  shares surged 12.3% in extended trading on Tuesday, lifted by the data analytics software company's second-quarter sales growth. The company's stock closed Tuesday's session up 4.2% at $50.57. Alteryx's second-quarter revenue was $180.6 million, an increase of 50%, compared to revenue of $120.1 million in the year-ago quarter. ""Alteryx delivered an outstanding quarter with ARR growth of 33% year-over-year, driven by our continued success with large enterprise organizations,"" said the company's CEO Mark Anderson, in a statement. The software specialist reported a second-quarter net loss of $106.8 million, or a net loss of $1.56 a share, compared to a net loss of $43.4 million, or a net loss of 65 cents a share, in the prior year's quarter. On an adjusted basis, Alteryx reported a net loss of $31.5 million and a net loss of 46 cents a share, compared to a net loss of $4.7 million or a net loss of 7 cents a share, in the same period last year. Analysts tracked by FactSet were looking for a net loss of 60 cents a share. Shares of Alteryx have declined 16.4% this year, compared to the S&amp;P 500 Index's  14.2% fall.</p><p>Market Pulse Stories are Rapid-fire, short news bursts on stocks and markets as they move. Visit MarketWatch.com for more information on this news."
2022-08-02 21:48:09,"Herbalife stock gains after earnings beat expectations, as company says 'underlying business trends stabilized'","<p>Shares of Herbalife Nutrition Ltd.  were up 11% in after-hours trading Tuesday after the company easily topped expectations with its latest results. The company logged second-quarter net income of $86.5 million, or 88 cents a share, down from $144 million, or $1.31 a share, in the year-earlier quarter. On an adjusted basis, Herbalife earned 96 cents a share, down from $1.55 a share a year before, whereas analysts tracked by FactSet were modeling 61 a share. Net sales fell to $1.39 billion from $1.55 billion but ahead of the FactSet consensus, which was for $1.28 billion. Herbalife disclosed in a release that its ""underlying business trends stabilized during the remainder of the 2nd quarter compared to April levels."" The company is maintaining its full-year net-sales forecast, which called for a 4% to 10% decline, but trimming its forecast for adjusted earnings per share ""primarily due to unfavorable currency movement."" The new outlook calls for $3.25 to $3.75 in adjusted EPS, whereas the prior guidance called for $3.50 to $4.00. Chief Executive John Agwunobi continues to expect that the company will return to posting net-sales growth in the fourth quarter. </p><p>Market Pulse Stories are Rapid-fire, short news bursts on stocks and markets as they move. Visit MarketWatch.com for more information on this news."
2022-08-03 15:52:03,Facebook parent Meta Platforms explores first-ever sale of corporate bonds: report,"<p>Facebook parent Meta Platforms Inc.  has reportedly asked banks to look into demand for a potential corporate bond sale --- what would be the tech giant's first, according to a Bloomberg News report. Per the Bloomberg report, the company has reportedly asked Morgan Stanley , JPMorgan Chase & Co. , Bank of America Corp. , and Barclays PLC  to arrange calls with potential investors. The report that the tech giant, led by CEO Mark Zuckerberg, is considering tapping the bond market comes just days after fellow tech giant Apple Inc. raised $5.5 billion. Meta is one of just 18 companies among the S&amp;P 500 that has no long-term or short-term debt, aside from lease obligations, according to Bloomberg data. S&amp;P Global Ratings assigned Meta an AA- rating on Wednesday, while affirming a ""stable"" outlook. ""Our stable outlook reflects our expectation for roughly flat revenue growth over the next 12-18 months due to a slowing economic environment, but cash balances will remain high with no leverage,"" S&amp;P said in a press release. In addition, Moody's Investors Service assigned Meta an A1 issuer rating. </p><p>Market Pulse Stories are Rapid-fire, short news bursts on stocks and markets as they move. Visit MarketWatch.com for more information on this news."
