DATE,TITLE,SUMMARY
2022-10-24 13:04:12,Rishi Sunak set to become U.K. prime minister as Penny Mordaunt withdraws,Rishi Sunak set to become U.K. prime minister as Penny Mordaunt withdraws
2022-10-24 09:36:37,France to start paying company electric bills: minister,France to start paying company electric bills: minister
2022-10-24 08:50:22,"Hong Kong-listed tech stocks including Alibaba, Baidu see double-digit losses","Hong Kong-listed tech stocks including Alibaba, Baidu see double-digit losses"
2022-10-24 07:55:29,Gilt yields sink after former PM Boris Johnson says he won't seek his old job,Gilt yields sink after former PM Boris Johnson says he won't seek his old job
2022-10-24 07:41:35,Hong Kong stocks in worst one-day fall since 2008 as Xi tightens grip on power,Hong Kong stocks in worst one-day fall since 2008 as Xi tightens grip on power
2022-10-24 06:21:00,"Philips to 'immediately' cut 4,000 jobs after wider-than-expected loss","Philips to 'immediately' cut 4,000 jobs after wider-than-expected loss"
2022-10-24 20:02:00,Dow finishes up more than 400 points as stocks extend last week's bounce,Dow finishes up more than 400 points as stocks extend last week's bounce
2022-10-24 15:52:11,Coronavirus Update: 1 in 10 of those eligible in U.S. have had targeted booster,Coronavirus Update: 1 in 10 of those eligible in U.S. have had targeted booster
2022-10-24 14:02:40,S&P data show rate of inflation in manufacturing is tamest in two years,S&amp;P data show rate of inflation in manufacturing is tamest in two years
2022-10-24 13:51:59,Stock-market live: Nasdaq lags as U.S. stocks build on best week since June,Stock-market live: Nasdaq lags as U.S. stocks build on best week since June
2022-10-24 13:36:16,S&P and Dow adding to gains from winningest stock-market week since June,S&amp;P and Dow adding to gains from winningest stock-market week since June
2022-10-25 08:17:45,Ifo German business climate index remains at low level in October,Ifo German business climate index remains at low level in October
2022-10-25 08:12:09,Universal Music shares jump after Apple hikes streaming prices,Universal Music shares jump after Apple hikes streaming prices
2022-10-25 05:23:59,SAP confirms profit and sales outlook as cloud business boosts revenue,SAP confirms profit and sales outlook as cloud business boosts revenue
2022-10-25 05:17:42,"HSBC profit tumbles 46% on impairment charges, rise in credit provisions","HSBC profit tumbles 46% on impairment charges, rise in credit provisions"
2022-10-25 16:25:07,October has been a good month for stocks so far. Is there more run in the rally?,October has been a good month for stocks so far. Is there more run in the rally?
2022-10-25 15:25:57,Apple to take 30% fee from NFT trading on apps from its App Store,Apple to take 30% fee from NFT trading on apps from its App Store
2022-10-25 15:13:05,Coronavirus Update: Biden to encourage Americans to get updated COVID booster,Coronavirus Update: Biden to encourage Americans to get updated COVID booster
2022-10-25 14:47:41,Jeremy Hunt to remain U.K.’s chancellor of the exchequeur,Jeremy Hunt to remain U.K.’s chancellor of the exchequeur
2022-10-25 14:03:54,U.S. consumer-confidence reading declines to 102.5 in October from 107.8,U.S. consumer-confidence reading declines to 102.5 in October from 107.8
2022-10-25 13:53:32,Former U.S. defense secretary Ash Carter is dead at 68,Former U.S. defense secretary Ash Carter is dead at 68
2022-10-25 13:11:40,Case-Shiller index shows home-price growth decelerating in 20 top U.S. cities,Case-Shiller index shows home-price growth decelerating in 20 top U.S. cities
2022-10-25 12:03:44,Canadian cannabis company Canopy Growth to fast-track entry to U.S. market,Canadian cannabis company Canopy Growth to fast-track entry to U.S. market
2022-10-25 11:15:43,Coca-Cola earnings come in ahead of expectations,Coca-Cola earnings come in ahead of expectations
2022-10-25 10:54:05,Sunak says he was elected by party to fix 'mistakes' made by Truss,Sunak says he was elected by party to fix 'mistakes' made by Truss
2022-10-26 00:39:59,Mobileye prices IPO above targeted range to raise nearly $1 billion,Mobileye prices IPO above targeted range to raise nearly $1 billion
2022-10-25 22:30:26,"Microsoft falls more than 6% as forecast comes up short, cloud growth slows","Microsoft falls more than 6% as forecast comes up short, cloud growth slows"
2022-10-25 20:14:35,"Microsoft stock slips despite earnings beat, as cloud growth misses projections","Microsoft stock slips despite earnings beat, as cloud growth misses projections"
2022-10-25 20:06:33,Alphabet stock falls over 6% as earnings and revenue miss targets,Alphabet stock falls over 6% as earnings and revenue miss targets
2022-10-25 20:03:38,Dow ends up over 300 points as stocks gain for third straight session,Dow ends up over 300 points as stocks gain for third straight session
2022-10-26 15:45:48,Intel spinoff Mobileye's stock jumps 28% from IPO price in Nasdaq debut,Intel spinoff Mobileye's stock jumps 28% from IPO price in Nasdaq debut
2022-10-26 15:37:53,Dow industrials up 300 points as investors reassess pace of Fed rate increases,Dow industrials up 300 points as investors reassess pace of Fed rate increases
2022-10-26 15:31:20,Coronavirus Update: Why experts are now warning of a ‘tripledemic’ this winter,Coronavirus Update: Why experts are now warning of a ‘tripledemic’ this winter
2022-10-26 15:08:31,U.K. fracking stocks slump after Sunak reinstates ban,U.K. fracking stocks slump after Sunak reinstates ban
2022-10-26 15:07:32,Biden administration announces effort to target 'junk fees' charged by banks,Biden administration announces effort to target 'junk fees' charged by banks
2022-10-26 14:56:38,All but six Dow stocks in positive territory as index runs gain to 225 points,All but six Dow stocks in positive territory as index runs gain to 225 points
2022-10-26 14:39:53,Live markets coverage: Has the U.S. dollar ceased acting as a ‘wrecking ball’?,Live markets coverage: Has the U.S. dollar ceased acting as a ‘wrecking ball’?
2022-10-26 13:59:21,Microsoft’s skid is a 128-point drag on the Dow industrials early Wednesday,Microsoft’s skid is a 128-point drag on the Dow industrials early Wednesday
2022-10-26 13:38:51,Nasdaq steers Wall Street lower at open after tech earnings disappointments,Nasdaq steers Wall Street lower at open after tech earnings disappointments
2022-10-26 12:33:15,U.S. trade deficit in goods widens to $92.2 billion as exports stumble,U.S. trade deficit in goods widens to $92.2 billion as exports stumble
2022-10-27 11:22:16,"Meta Platforms shares dive in premarket trade, as analysts slash ratings","Meta Platforms shares dive in premarket trade, as analysts slash ratings"
2022-10-27 11:09:55,McDonald's reports 9.5% growth in same-restaurant sales,McDonald's reports 9.5% growth in same-restaurant sales
2022-10-27 11:06:52,Southwest Airlines says its planes are more full than before the pandemic,Southwest Airlines says its planes are more full than before the pandemic
2022-10-27 10:52:36,Caterpillar shares climb after earnings beat,Caterpillar shares climb after earnings beat
2022-10-27 08:21:00,Shell stock rallies as oil giant to buy back $4 billion in shares,Shell stock rallies as oil giant to buy back $4 billion in shares
2022-10-27 08:19:48,"Credit Suisse shares stumble after announcing capital raise, reorg","Credit Suisse shares stumble after announcing capital raise, reorg"
2022-10-27 06:48:08,"TotalEnergies reports higher profit, but $3.1 billion impairment over Russia","TotalEnergies reports higher profit, but $3.1 billion impairment over Russia"
2022-10-27 06:45:57,Shell earnings fall 18% as it kicks off $4 billion buyback,Shell earnings fall 18% as it kicks off $4 billion buyback
2022-10-27 05:31:53,"Credit Suisse to sell some securitized assets, raise up to $4.06B via new shares","Credit Suisse to sell some securitized assets, raise up to $4.06B via new shares"
2022-10-27 05:23:45,Credit Suisse swings to wider-than-forecast loss of $4.09 billion,Credit Suisse swings to wider-than-forecast loss of $4.09 billion
2022-10-27 20:35:06,"Apple earnings top estimates, but stock falls as iPhone revenue misses","Apple earnings top estimates, but stock falls as iPhone revenue misses"
2022-10-27 20:24:39,EU bans new gas-fueled cars starting in 2035 in effort to hit net-zero emissions,EU bans new gas-fueled cars starting in 2035 in effort to hit net-zero emissions
2022-10-27 20:05:37,Amazon stock down over 18% on weak holiday revenue forecast,Amazon stock down over 18% on weak holiday revenue forecast
2022-10-27 20:01:58,Dow finishes up about 200 points as Meta stock weighs on Nasdaq,Dow finishes up about 200 points as Meta stock weighs on Nasdaq
2022-10-27 18:13:47,"Meta's woes are tanking its stock, but these chip stocks are benefiting from it","Meta's woes are tanking its stock, but these chip stocks are benefiting from it"
2022-10-27 16:39:28,Natural-gas prices just posted a 6-session drop of 26%. What's behind the fall?,Natural-gas prices just posted a 6-session drop of 26%. What's behind the fall?
2022-10-27 14:57:28,Coronavirus Update: Chinese city of Wuhan is back in partial lockdown,Coronavirus Update: Chinese city of Wuhan is back in partial lockdown
2022-10-27 14:00:44,Stock dive below $100 could cost Meta more than $80 billion in market valuation,Stock dive below $100 could cost Meta more than $80 billion in market valuation
2022-10-27 13:50:59,"Dow jumps 300 points as tech components Intel, Apple and Microsoft bring up rear","Dow jumps 300 points as tech components Intel, Apple and Microsoft bring up rear"
2022-10-27 13:21:03,Shares of Facebook parent Meta down some 24% in premarket trades,Shares of Facebook parent Meta down some 24% in premarket trades
2022-10-28 03:25:57,Elon Musk on the hook to pay more than $200 million to 3 fired Twitter execs,Elon Musk on the hook to pay more than $200 million to 3 fired Twitter execs
2022-10-28 00:56:09,"Elon Musk completes Twitter purchase, fires CEO and other top execs: reports","Elon Musk completes Twitter purchase, fires CEO and other top execs: reports"
2022-10-28 17:13:29,The Dow is headed for its best October ever. Why is the stock index up so much?,The Dow is headed for its best October ever. Why is the stock index up so much?
2022-10-28 16:18:02,Here's why COVID-19 may be to blame for the surge in RSV illness among children,Here's why COVID-19 may be to blame for the surge in RSV illness among children
2022-10-28 15:39:25,Apple shares headed for best single day since 2020,Apple shares headed for best single day since 2020
2022-10-28 15:35:34,"Coronavirus Update: No evidence that new subvariants pose more danger, says WHO","Coronavirus Update: No evidence that new subvariants pose more danger, says WHO"
2022-10-28 15:25:25,Dow industrials rally to two-month high,Dow industrials rally to two-month high
2022-10-28 14:22:08,U.S. consumer mood improving even as inflation expectations intensify: UMich,U.S. consumer mood improving even as inflation expectations intensify: UMich
2022-10-28 14:04:39,U.S. pending home sales record biggest monthly drop since early days of pandemic,U.S. pending home sales record biggest monthly drop since early days of pandemic
2022-10-28 14:00:36,Intel and Apple in lead as Dow jumps 400 points — Friday’s live markets coverage,Intel and Apple in lead as Dow jumps 400 points — Friday’s live markets coverage
2022-10-28 12:56:59,Paul Pelosi ‘violently assaulted’ in home break-in: House speaker's office,Paul Pelosi ‘violently assaulted’ in home break-in: House speaker's office
2022-10-28 12:40:35,U.S. savings rate falls to 3.1% in September from 3.4% in August,U.S. savings rate falls to 3.1% in September from 3.4% in August
2022-10-28 20:38:05,Apple stock finishes up 7.6% in best day since 2020,Apple stock finishes up 7.6% in best day since 2020
2022-10-28 20:00:58,"Dow ends up over 800 points Friday, extending win streak to sixth session","Dow ends up over 800 points Friday, extending win streak to sixth session"
2022-10-30 23:46:55,"As streaming prices rise, here's what's really worth paying for in November","As streaming prices rise, here's what's really worth paying for in November"
2022-10-30 23:18:10,Why the Dow is having a killer month as it heads for best October ever,Why the Dow is having a killer month as it heads for best October ever
2022-10-30 22:50:27,Another jumbo Fed rate hike is expected this week -- but what comes next?,Another jumbo Fed rate hike is expected this week -- but what comes next?
2022-10-30 22:12:14,Lula defeats Bolsonaro to become Brazil’s president in tight runoff,Lula defeats Bolsonaro to become Brazil’s president in tight runoff
2022-10-31 14:02:50,Biden to accuse oil companies of refusing to ‘help lower prices at the pump’,Biden to accuse oil companies of refusing to ‘help lower prices at the pump’
2022-10-31 13:44:30,Coronavirus Update: New subvariants behind 42.5% of N.Y. region’s weekly cases,Coronavirus Update: New subvariants behind 42.5% of N.Y. region’s weekly cases
2022-10-31 12:58:48,Chicago business barometer weakens in October,Chicago business barometer weakens in October
2022-10-31 12:39:36,Blue-chip sights set on record October even as U.S. stocks edge lower at open,Blue-chip sights set on record October even as U.S. stocks edge lower at open
2022-10-31 09:59:43,Emerson confirms climate tech deal and tops earnings expectations,Emerson confirms climate tech deal and tops earnings expectations
2022-10-31 09:10:51,Eurozone inflation reaches 10.7% in October as core prices climb 5%,Eurozone inflation reaches 10.7% in October as core prices climb 5%
2022-10-31 08:10:59,Brazilian ETFs fall after Lula victory in presidential election,Brazilian ETFs fall after Lula victory in presidential election
2022-10-31 07:28:24,Swiss National Bank posts $143 billion loss over nine months,Swiss National Bank posts $143 billion loss over nine months
2022-10-31 19:09:02,"Dow ends lower Monday but paces monthly gains, up 14% in October","Dow ends lower Monday but paces monthly gains, up 14% in October"
2022-11-01 10:17:45,Pfizer shares climb on improved sales guidance,Pfizer shares climb on improved sales guidance
2022-11-01 10:10:48,Uber shares climb after upbeat outlook,Uber shares climb after upbeat outlook
2022-11-01 09:37:35,Johnson & Johnson to buy Abiomed for $16.6 billion,Johnson & Johnson to buy Abiomed for $16.6 billion
2022-11-01 08:35:49,Saudi Aramco has earned $130 billion in the first nine months of the year,Saudi Aramco has earned $130 billion in the first nine months of the year
2022-11-01 08:16:58,Ocado shares surge after inking South Korean deal,Ocado shares surge after inking South Korean deal
2022-11-01 19:03:34,"U.S. stocks end lower as investors weigh latest data, brace for Fed decision","U.S. stocks end lower as investors weigh latest data, brace for Fed decision"
2022-11-01 15:10:43,Worried the Fed will cause a recession? These 20 dividend stocks have your back.,Worried the Fed will cause a recession? These 20 dividend stocks have your back.
2022-11-01 14:50:02,Opinion: NASA offers soft-landing lessons for the Fed,Opinion: NASA offers soft-landing lessons for the Fed
2022-11-01 14:42:50,Coronavirus Update: Hospitalizations on rise in N.Y.C. as new strains spread,Coronavirus Update: Hospitalizations on rise in N.Y.C. as new strains spread
2022-11-01 13:29:55,Chief Justice Roberts delays release of Trump tax returns to House committee,Chief Justice Roberts delays release of Trump tax returns to House committee
2022-11-01 13:20:18,U.S. manufacturing expands narrowly in October,U.S. manufacturing expands narrowly in October
2022-11-01 13:19:22,U.S. job openings rose unexpectedly in September to 10.7 million,U.S. job openings rose unexpectedly in September to 10.7 million
2022-11-01 12:44:29,U.S. stocks kick off November with gains; Treasury yields decline as Fed gathers,U.S. stocks kick off November with gains; Treasury yields decline as Fed gathers
2022-11-01 11:15:04,Asset manager Atlas to be acquired by Poseidon in $10.9 billion deal,Asset manager Atlas to be acquired by Poseidon in $10.9 billion deal
2022-11-02 16:44:44,The Dow stock index has turned positive just minutes away from a Fed decision,The Dow stock index has turned positive just minutes away from a Fed decision
2022-11-02 16:20:02,The Fed interest-rate decision is close. Here's how stocks have reacted before.,The Fed interest-rate decision is close. Here's how stocks have reacted before.
2022-11-02 15:34:13,This energy company is America's hottest stock. Why won't its CEO pump more oil?,This energy company is America's hottest stock. Why won't its CEO pump more oil?
2022-11-02 15:08:45,Coronavirus Update: China suspends access to zone surrounding iPhone facility,Coronavirus Update: China suspends access to zone surrounding iPhone facility
2022-11-02 14:22:22,Shares of LL Flooring — the former Lumber Liquidators — fall to 52-week low,Shares of LL Flooring — the former Lumber Liquidators — fall to 52-week low
2022-11-02 13:24:21,MarketWatch Live: The only 4 words Fed chief Powell needs in his news conference,MarketWatch Live: The only 4 words Fed chief Powell needs in his news conference
2022-11-02 13:01:10,Why isn’t the U.S. building enough housing? Tune in live at noon.,Why isn’t the U.S. building enough housing? Tune in live at noon.
2022-11-02 12:35:58,Stock indexes edging lower at open as Wall Street awaits Fed interest-rate news,Stock indexes edging lower at open as Wall Street awaits Fed interest-rate news
2022-11-02 11:40:15,Amazon starts day with sub-trillion-dollar market cap for first time since 2020,Amazon starts day with sub-trillion-dollar market cap for first time since 2020
2022-11-02 11:19:24,"U.S. economy outpaces forecast to add 239,000 private-sector jobs in Oct.: ADP","U.S. economy outpaces forecast to add 239,000 private-sector jobs in Oct.: ADP"
2022-11-02 19:35:55,Roku stock plunges after hours as earnings forecast disappoints,Roku stock plunges after hours as earnings forecast disappoints
2022-11-02 19:32:09,Qualcomm stock falls over 5% as outlook falls short of expectations,Qualcomm stock falls over 5% as outlook falls short of expectations
2022-11-02 19:04:34,"Dow finishes down 500 points, Nasdaq falls over 3% after Powell's remarks","Dow finishes down 500 points, Nasdaq falls over 3% after Powell's remarks"
2022-11-02 18:49:12,Dow's down nearly 400 points in final minutes of session as stocks slide,Dow's down nearly 400 points in final minutes of session as stocks slide
2022-11-02 17:55:06,Stocks reverse direction and are now down across the board as Powell speaks,Stocks reverse direction and are now down across the board as Powell speaks
2022-11-02 17:47:46,Did the Fed ruin holiday shopping with its rate hike? You better not overspend.,Did the Fed ruin holiday shopping with its rate hike? You better not overspend.
2022-11-02 17:12:21,Stocks jump after Fed raises interest rates but hints it may ease up soon,Stocks jump after Fed raises interest rates but hints it may ease up soon
2022-11-02 17:05:20,"The Fed raises interest rates three-quarters of a point, with range top now 4%","The Fed raises interest rates three-quarters of a point, with range top now 4%"
2022-11-03 12:35:20,U.S. stocks open lower as Fed chief Powell’s words weigh on Wall Street,U.S. stocks open lower as Fed chief Powell’s words weigh on Wall Street
2022-11-03 11:57:27,Former Pakistan premier Imran Khan wounded in gun attack,Former Pakistan premier Imran Khan wounded in gun attack
2022-11-03 11:40:19,U.S. labor productivity rises slightly in third quarter after two sharp declines,U.S. labor productivity rises slightly in third quarter after two sharp declines
2022-11-03 11:38:17,U.S. trade deficit widened in September,U.S. trade deficit widened in September
2022-11-03 11:37:16,U.S. first-time unemployment claims dipped in late October,U.S. first-time unemployment claims dipped in late October
2022-11-03 11:12:51,Bank of England’s interest-rate hike is its biggest in three decades,Bank of England’s interest-rate hike is its biggest in three decades
2022-11-03 10:16:38,Peloton shares dive after holiday forecast misses analyst estimates,Peloton shares dive after holiday forecast misses analyst estimates
2022-11-03 10:12:54,Q3 same-store sales jumped 14% at Burger King and climbed 12% at Popeyes,Q3 same-store sales jumped 14% at Burger King and climbed 12% at Popeyes
2022-11-03 10:10:20,Moderna earnings come in well below analyst estimates,Moderna earnings come in well below analyst estimates
2022-11-03 09:11:15,Two-year yield reaches highest level since 2007 after Powell's comments,Two-year yield reaches highest level since 2007 after Powell's comments
2022-11-03 19:16:58,Coinbase reports wider-than-expected loss and revenue miss,Coinbase reports wider-than-expected loss and revenue miss
2022-11-03 19:10:24,"Starbucks stock rises in late trading as earnings, revenue top estimates","Starbucks stock rises in late trading as earnings, revenue top estimates"
2022-11-03 19:01:22,U.S. stocks extend losing streak to 4th day ahead of jobs data; Nasdaq off 1.7%,U.S. stocks extend losing streak to 4th day ahead of jobs data; Nasdaq off 1.7%
2022-11-03 16:34:45,Qualcomm stock falls to its lowest point in 2 years amid smartphone shortfall,Qualcomm stock falls to its lowest point in 2 years amid smartphone shortfall
2022-11-03 15:11:34,How good a leader has Tim Cook been for Apple and its stock? Check these numbers,How good a leader has Tim Cook been for Apple and its stock? Check these numbers
2022-11-03 14:15:40,Coronavirus Update: Moderna lowers vaccine-sales outlook by billions of dollars,Coronavirus Update: Moderna lowers vaccine-sales outlook by billions of dollars
2022-11-03 14:00:34,Dow industrials down less than 100 points as stock-market skid abates,Dow industrials down less than 100 points as stock-market skid abates
2022-11-03 13:24:33,U.S. factory orders rise in September to belie manufacturing-slowdown concerns,U.S. factory orders rise in September to belie manufacturing-slowdown concerns
2022-11-03 13:19:29,ISM gauge of U.S. economy's services sector drops to post-lockdown low,ISM gauge of U.S. economy's services sector drops to post-lockdown low
2022-11-04 06:59:41,German factory orders drop by a bigger-than-expected 4% in September,German factory orders drop by a bigger-than-expected 4% in September
2022-11-04 17:50:45,"High inflation? Not for marijuana, which is actually getting cheaper.","High inflation? Not for marijuana, which is actually getting cheaper."
2022-11-04 14:48:28,"Coronavirus Update: Daily U.S. cases are back above 40,000","Coronavirus Update: Daily U.S. cases are back above 40,000"
2022-11-04 14:21:36,Salesforce and Apple are sole significant decliners as Dow surges 450 points,Salesforce and Apple are sole significant decliners as Dow surges 450 points
2022-11-04 12:36:03,China said to have set sights on a less disruptive COVID approach,China said to have set sights on a less disruptive COVID approach
2022-11-04 12:22:43,Are political ads persuading voters? ‘Best New Ideas in Money’ podcast explores.,Are political ads persuading voters? ‘Best New Ideas in Money’ podcast explores.
2022-11-04 11:58:35,Amazon on track to snap longest stock-market losing streak in three years,Amazon on track to snap longest stock-market losing streak in three years
2022-11-04 11:34:25,"Monthly U.S. job growth slows to 261,000 from 315,000; unemployment rate 3.7%","Monthly U.S. job growth slows to 261,000 from 315,000; unemployment rate 3.7%"
2022-11-04 11:32:39,"U.S. economy added a greater-than-forecast 261,000 jobs in October","U.S. economy added a greater-than-forecast 261,000 jobs in October"
2022-11-04 11:27:43,MarketWatch Live: Stocks on the rise Friday ahead of U.S. jobs report,MarketWatch Live: Stocks on the rise Friday ahead of U.S. jobs report
2022-11-04 11:02:14,Coming up: U.S. jobs report for October,Coming up: U.S. jobs report for October
2022-11-04 19:01:38,"Dow ends up over 400 points Friday, but stocks suffer weekly losses","Dow ends up over 400 points Friday, but stocks suffer weekly losses"
