DATE,TITLE,SUMMARY
2022-08-01 13:42:08,"Black Knight sees record slowdown in home price growth in June, and biggest jump in inventory in 12 years","<p>Black Knight Inc.  said Monday that year-over-year home price growth in June dropped by nearly two percentage points, which the data analytics company said was the ""greatest single-month slowdown on record"" since at least the early 1970s. Black Knight said the slowdown to 17.3% annual home price growth in June from 19.3% was broad based was a record by far, ""and it wasn't even close,"" said Black Knight Data & Analytics President Ben Graboske; in comparison, the strongest single-month slowing during the 2006 housing downturn was 1.19 percentage points. The slowdown comes along with a 22% increase in the number of homes listed for sale the past two months, which was the biggest inventory gain in 12 years. The company said the ""clear driver"" of the inventory gains is a decline in sales activity, resulting from the lowest levels of home affordability in nearly 40 years due to rising interest rates. </p><p>Market Pulse Stories are Rapid-fire, short news bursts on stocks and markets as they move. Visit MarketWatch.com for more information on this news."
2022-08-01 13:41:32,"Palo Alto Networks stock is positioned for 'total platform domination,' says analyst","<p>Wolfe Research analyst Joshua Tilton initiated coverage of Palo Alto Networks Inc. shares  with an outperform rating and $700 price target Monday, writing that while investors seem to view Palo Alto Networks as a place to ""hide out"" in the current market, they don't appropriately recognize the value and upside potential of its next-generation security portfolio. He wrote that his channel checks indicate sustained strong demand for the company's firewall business, and with the shares trading at 21 times his base-case estimates for enterprise value to 2023 free-cash flow, he thinks that investors can continue to take cover in the stock. ""However, if there is one thing to take away from this launch it's that we believe PANW is so much more than just firewall, and it's not getting credit for it,"" Tilton wrote. ""Bottom line, in a market where investors may not be buying new names, we are here to tell you that it's ok to stay invested in PANW for the firewall business, but we really think you should be adding to your position for what's next... total platform domination."" The stock has gained 25% over the past 12 months as the S&amp;P 500  has lost about 7%.</p><p>Market Pulse Stories are Rapid-fire, short news bursts on stocks and markets as they move. Visit MarketWatch.com for more information on this news."
2022-08-01 13:32:43,U.S. stocks kick off August in the red after best month for stocks since November 2020,"<p>U.S. stocks opened lower on Monday, the first trading day of August, as they looked to give back some of their gains from July --- the best month for the S&amp;P 500 since November 2020. The Dow Jones Industrial Average  retreated 112 points, or 0.3%, to 32,732, while the S&amp;P 500  shed 22 points, or 0.6%, to 4,107. The tech-heavy Nasdaq Composite , which led stocks higher last week, lost 68 points, or 0.6%, to 12,323. If stocks finish lower on Monday, they will snap a three-session winning streak for the main benchmarks. </p><p>Market Pulse Stories are Rapid-fire, short news bursts on stocks and markets as they move. Visit MarketWatch.com for more information on this news."
2022-08-01 12:52:47,Marriott Vacations adds $500 million to stock buyback authorization,"<p>Marriott Vacations Worldwide Corp.  said Monday it has boosted its stock repurchase authorization by $500 million. The vacation ownership, rental and exchange company said it had about $28 million remaining in its stock buyback program as of July 29, prior to increase. The company's buyback authorization now represents about 9.3% of the company's market capitalization, which was $5.67 billion as of Friday's stock closing price. The company said it spent $193 million to buy back stock in the second quarter, and has spent $131 million since then through the end of July. The stock, which was wasn't active in premarket trading, has lost 8.3% over the past three months, while the S&amp;P 500  has eased less than 0.1%.</p><p>Market Pulse Stories are Rapid-fire, short news bursts on stocks and markets as they move. Visit MarketWatch.com for more information on this news."
2022-08-01 11:57:17,Global Payments to buy EVO Payments for $4 billion,"<p>Global Payments Inc.  announced Monday that its plans to acquire EVO Payments Inc.  for $34 a share in an all-cash deal that values EVO at $4.0 billion. Global Payments expects that the merger with EVO, which offers payment-technology and acquiring services, will expand its international footprint into new markets while giving it additional scale in existing markets. ""The acquisition of EVO is highly complementary to our technology-enabled strategy and provides meaningful opportunities to increase scale in our business globally,"" Global Payments Chief Operating Officer Cameron Bready said in a release. Additionally, Global Payments reported second-quarter results while beating profit expectations. The company notched a net loss of $673.0 million, or $2.42 a share, whereas it earned $263.6 million, or 89 cents a share, in the year-earlier quarter. On an adjusted basis, Global Payments earned $2.36 a share, up from $2.04 a share a year before and ahead of the FactSet consensus, which was for $2.34 a share. The company posted $2.28 billion in GAAP revenue, up from $2.14 billion a year before, whereas analysts were predicting $2.30 billion. Global Payments further announced that Silver Lake has committed to make a $1.5 billion long-term strategic investment in the company through convertible senior notes. The company also said that it had reached a deal to sell Netspend's consumer assets to Searchlight Capital and Rev Worldwide for $1 billion, while Global Payments will retain the Netspend business-to-business assets. Shares of Global Payments have lost 9.5% so far this year as the S&amp;P 500  has fallen 13.3%.</p><p>Market Pulse Stories are Rapid-fire, short news bursts on stocks and markets as they move. Visit MarketWatch.com for more information on this news."
2022-08-01 11:47:14,Royal Caribbean to offer $900 million in convertible bonds due 2025,
2022-08-01 11:38:13,Nikola to acquire Romeo Power for 74 cents a share or about $144 million in all-stock deal,"<p>Electric truck maker Nikola Corp.  has agreed to acquire Romeo Power Inc.  for 74 cents a share in stock or a total of $144 million, the companies said in a joint statement. Romeo, which is based in Cypress, California, makes storage technology for commercial vehicles that is focused on making lithium-ion battery modules and packs. The price is equal to a 34% premium over Romeo's closing price on Friday. ""Romeo has been a valued supplier to Nikola, and we are excited to further leverage their technological capabilities as the landscape for vehicle electrification grows more sophisticated. With control over the essential battery pack technologies and manufacturing process, we believe we will be able to accelerate the development of our electrification platform and better serve our customers,"" said Nikola CEO Mark Russell. The deal is expected to close by end-October. The news sent Romeo shares up 22.8% premarket, while Nikola shares fell 1.5%. </p><p>Market Pulse Stories are Rapid-fire, short news bursts on stocks and markets as they move. Visit MarketWatch.com for more information on this news."
2022-08-01 11:35:06,Colgate-Palmolive to acquire three Red Collar pet food manufacturing plants for $700 million,"<p>Colgate-Palmolive Co.  has announced plans to purchase three dry pet food manufacturing plants  from Red Collar Pet Foods for $700 million. The acquisition will support the growth of Colgate-Palmolive's Hill's Pet Nutrition business, according to a statement released before market open on Monday. The plants, which are in Orangeburg, South Carolina; Clinton, Oklahoma; and Washington Court House, Ohio, will produce dry pet food for Hill's Science Diet and Prescription Diet brands. ""This investment will help further strengthen the Hill's business today and for the long term,"" said Colgate-Palmolive CEO Noel Wallace, in the statement. Approximately 350 employees involved in the dry pet food operations will be transferred. The acquisition is not included in Colgate-Palmolive's current guidance and is not expected to have a material impact on the company's diluted EPS in 2022. On Friday Colgate-Palmolive reported second-quarter earnings that fell from a year earlier but topped estimates. The company's sales rose to $4.484 billion from $4.260 billion a year ago, topping the FactSet consensus of $4.350 billion. Colgate-Palmolive, which has raised pricing by 8.5%, also reiterated its expectation of full-year sales growth at the high end of its 1% to 4% range. The company's shares, which are down 7.7% this year, rose almost 1% to $79.50 before market open. The S&amp;P 500  has fallen 13.3% this year.</p><p>Market Pulse Stories are Rapid-fire, short news bursts on stocks and markets as they move. Visit MarketWatch.com for more information on this news."
2022-08-01 11:34:57,Baker Hughes to sell OFS Russia business to local management team,"<p>Baker Hughes Co.  announced Monday an agreement to sell its oilfield services (OFS) business in Russia to its local management team. Financial details of the deal were not disclosed. The oil services company's stock was little changed in premarket trading. Baker Hughes said the sale agreement follows its previously announced suspension of new investments in Russia to comply with laws and sanctions in place after Russia's invasion of Ukraine. The deal is expected to close in the second half of 2022. The new business in Russia will operate independently of Baker Hughes and will assume all current OFS Russia assets, liabilities and obligations. Baker Hughes stock has dropped 17.2% over the past three months, while the VanEck Oil Services ETF  has lost 8.4% and the S&amp;P 500  has inched less than 0.1% lower.</p><p>Market Pulse Stories are Rapid-fire, short news bursts on stocks and markets as they move. Visit MarketWatch.com for more information on this news."
2022-08-01 11:06:51,Boeing stock surges to lead the Dow's gainers after 787 deliveries could resume after hurdle cleared with FAA,"<p>Shares of Boeing Co.  ran up 4.7% early Monday, to pace the Dow Jones Industrial Average's  premarket gainers, after the aerospace and defense giant reportedly cleared a hurdle with the Federal Aviation Administration (FAA) that could allow it to resume deliveries of its 787 airliner. The FAA said it would approve Boeing's process for validating fixes to each 787 plane before they are delivered to customers, according to an Associated Press report. Separately, The Wall Street Journal reported that Boeing's defense manufacturing plants will vote on Wednesday on a labor contract proposal, which temporarily delays a strike that was scheduled to begin as soon as Monday. Boeing's implied premarket stock gain would add about 49 points to the Dow's price, while Dow futures  fell 28 points, or 0.1%. The stock is on track to open at the highest levels seen during regular-session hours since April 26. </p><p>Market Pulse Stories are Rapid-fire, short news bursts on stocks and markets as they move. Visit MarketWatch.com for more information on this news."
2022-08-01 10:43:35,Valvoline to sell Global Products business to Aramco for $2.65 billion in cash,
2022-08-01 10:32:11,Alibaba says it will 'strive to maintain' NYSE listing after cracking SEC's delisting warning list,"<p>Alibaba Group Holding Ltd.  acknowledged in a Monday filing that it has been identified by the Securities and Exchange Commission as a foreign company whose auditing paperwork couldn't be fully inspected by the Public Company Accounting Oversight Board, though the company said it would work to stay listed on the New York Stock Exchange. The U.S. Holding Foreign Companies Accountable Act sets various rules about the inspection of international companies' auditing processes, and if the Public Company Accounting Oversight Board can't fully inspect the accounting firm that audited a foreign company's financials for three years, that company's shares won't be able to be listed on the NYSE or other U.S. exchanges. ""Alibaba will continue to monitor market developments, comply with applicable laws and regulations and strive to maintain its listing status on both the NYSE and the Hong Kong Stock Exchange,"" the company said in its Monday morning filing. Alibaba's U.S.-listed shares are up about 2% in premarket trading Monday after they declined more than 11% in Friday's session. </p><p>Market Pulse Stories are Rapid-fire, short news bursts on stocks and markets as they move. Visit MarketWatch.com for more information on this news."
2022-08-01 10:23:44,"Perkin Elmer to raise $2.45 billion in cash by selling Applied, Food and Enterprise Services businesses","<p>Shares of PerkinElmer Inc.  rose 1.4% in premarket trading Monday, after the disease diagnosis company announced an agreement to sell its Applied, Food and Enterprise Services businesses for $2.45 billion in cash to private-equity firm New Mountain Capital. As part of the deal, PerkinElmer will receive $2.30 billion at closing, which is expected to occur in the first quarter of 2023, and $150 million will be payable contingent on exit valuation. ""Following the close of the transaction, we will be a pure-play, high growth, high margin Life Sciences and Diagnostics company with unique scale,"" said Chief Executive Prahlad Singh. ""The company's increased financial strength will support accelerated investment into attractive end markets across science and disease, and drive advanced research, discovery, and improve global health."" The Life Sciences and Diagnostics businesses are expected to generate about $3.3 billion in revenue on 2022. The stock has gained 4.5% over the past three months but has lost 23.8% year to date through Friday, while the S&amp;P 500  has lost 13.3% this year.</p><p>Market Pulse Stories are Rapid-fire, short news bursts on stocks and markets as they move. Visit MarketWatch.com for more information on this news."
2022-08-01 10:13:53,Coronavirus tally: Biden tests positive for a second day in rare rebound case after taking Paxlovid,"<p>President Joe Biden tested positive for COVID-19 for the second straight day, in what appears to be a rare case of ""rebound"" following treatment with anti-viral Paxlovid, the Associated Press reported. In a letter noting the positive test, Dr. Kevin O'Connor, the White House physician, said Sunday that the president ""continues to feel well"" and will keep on working from the executive residence while he isolates. Biden tested positive on Saturday, requiring him to cancel travel and in-person events as he isolates for at least five days in accordance with Centers for Disease Control and Prevention guidelines.  The news comes as the daily average for new U.S. cases remains close to 130,000 a day, but not all data are being captured as many people are testing at home. The average stood at 123,553 on Sunday, according to a New York Times tracker, down 5% from two weeks ago. The daily average for hospitalizations rose to 44,389 up 8% in two weeks. The daily average for deaths is up 2% to 435.  Globally, the confirmed case tally rose above 577.3 million on Monday, according to data aggregated by Johns Hopkins, while the death toll is above 6.40 million with the U.S. leading the world with 91.3 million cases and 1,029,926 deaths.</p><p>Market Pulse Stories are Rapid-fire, short news bursts on stocks and markets as they move. Visit MarketWatch.com for more information on this news."
2022-08-01 10:13:03,"NIO, other China-based EV maker stocks surge after July deliveries jump","<p>The U.S.-listed shares of NIO Inc.  rallied 4.2% in premarket trading Monday, after the China-based electric vehicle maker reported deliveries rose in July from a year ago to mark a third-straight monthly increase. The company said July deliveries increased 26.7% to 10,052 vehicles. That comes after a 60.3% increase in July and a 4.7% rise in May, which followed a 28.6% drop in April due to COVID-related shutdowns. In July, NIO said its deliveries included 7,579 premium sport-utility vehicles (SUVs) and 2,473 premium sedans. Also on Monday, fellow China-based EV makers XPeng Inc.  reported a 43% jump in July deliveries to 11,524 vehicles, to send the stock up 3.9% premarket, and shares of Li Auto Inc.  climbed 4.2% after the company reported July deliveries that grew 21.3% to 10,422 vehicles. Over the past three months, NIO's stock has hiked up 18.1%, XPeng shares have slipped 0.7% and Li Auto's stock has soared 46.4%, while the S&amp;P 500  has inched lower by less than 0.1%.</p><p>Market Pulse Stories are Rapid-fire, short news bursts on stocks and markets as they move. Visit MarketWatch.com for more information on this news."
2022-08-01 21:26:16,Woodward shares plunge on lowered guidance,"<p>Shares of Woodward Inc.  plunged 7.43% in extended trading on Monday after the aircraft component maker lowered its full-year guidance. The company's stock closed Monday's session up 0.09% at $104.79. Woodward reported fiscal third-quarter net income of $39 million, or 64 cents a share, compared to net income of $49 million, or 74 cents a share, in the prior year's quarter. Analysts tracked by FactSet had forecast earnings of 91 cents a share. Woodward's third-quarter sales were $614 million, compared with $557 million in the same period last year. Citing ""continuing global supply-chain and labor disruptions and net inflationary impacts,"" Woodward revised its full-year guidance to between $2.35 billion and $2.4 billion, from its prior forecast of $2.4 billion and $2.55 billion. Analysts surveyed by FactSet are looking for full-year revenue of $2.416 billion. Shares of Woodward, which is seen as a beneficiary of a Boeing Co.  resumption of 787 Dreamliner deliveries, have fallen 4.3% this year. The S&amp;P 500 Index  has fallen 13.6% in 2022.</p><p>Market Pulse Stories are Rapid-fire, short news bursts on stocks and markets as they move. Visit MarketWatch.com for more information on this news."
2022-08-01 21:15:46,Biden to speak about 'successful counterterrorism operation' at 7:30 p.m. Eastern,"<p>President Joe Biden plans to give a speech on Monday evening about ""a successful counterterrorism operation,"" according to a White House statement. The remarks are slated to come at 7:30 p.m. Eastern Time. A senior Biden administration official said the U.S. conducted a counterterrorism operation against a ""significant"" Al Qaeda target in Afghanistan over the weekend, and the operation was successful with no civilian casualties.</p><p>Market Pulse Stories are Rapid-fire, short news bursts on stocks and markets as they move. Visit MarketWatch.com for more information on this news."
2022-08-01 20:25:33,Avis Budget stock climbs after big earnings beat,"<p>Shares of Avis Budget Group Inc.  were up more than 4% in after-hours trading Monday after the company easily topped profit expectations for its latest quarter. The rental-car company posted net income of $774 million, or $15.71 a share, compared with $398 million, or $5.63 a share, in the year-earlier period. On an adjusted basis, Avis earned $15.94 a share, up from $5.90 a share a year before and above the FactSet consensus, which was for $11.48 a share. Revenue climbed to $3.24 billion from $2.37 billion, while analysts were anticipating $3.17 billion. Avis executives said in a release that the latest revenue total marked record performance on the metric. Chief Executive Joe Ferraro said that the company's ""enhanced revenue generation, diligent fleet management and stringent cost control"" helped drive the results. Shares of Avis have lost 32% over the past three months, though they're up 119% in a 12-month span. The S&amp;P 500  has dropped 0.3% over three months and 6.3% over 12 months. </p><p>Market Pulse Stories are Rapid-fire, short news bursts on stocks and markets as they move. Visit MarketWatch.com for more information on this news."
2022-08-01 20:00:47,"Dow, S&P 500 end lower Monday, kick off August under cloud of potential recession","<p>U.S. stocks finished lower Monday, kicking off August on a downbeat note, after a strong July rally carried the main equity benchmarks to their best month of gains in almost two years. The Dow Jones Industrial Average  shed about 45 points, or 0.1%, to end the session near 32,799. The S&amp;P 500 index  lost 0.3%, while the Nasdaq Composite Index  closed 0.2% lower. The month of August kicked off under a series of unknowns, including whether investors betting on the Federal Reserve to ""pivot"" away from its aggressive rate-hiking stance to quell inflation at its sharpest in four-decade might be risking further losses, as both the equity and debt markets aim to turn the page on a painful first half of 2022. Another big question looming over markets has been whether parts of the bond market and commodity complex may be signaling that a recession looms, despite vows by Fed Chairman Jerome Powell to battle inflation, while aiming to steer the economy to a soft landing. The 10-year Treasury yield continued to retreat Monday to about 2.605%, down from its peak 3.482% yield so far this year on June 14, according to Dow Jones Market Data. Those questions, including if the strong U.S. labor market can help the economy avoid a recession, will keep Friday's job report from July in focus.</p><p>Market Pulse Stories are Rapid-fire, short news bursts on stocks and markets as they move. Visit MarketWatch.com for more information on this news."
2022-08-01 19:16:51,U.S. Treasury raises third-quarter borrowing estimate to $444 billion,
2022-08-01 19:12:53,"Oracle layoffs have begun, according to reports","<p>Oracle Corp.  has begun layoffs, according to multiple reports Monday.  Job cuts affecting employees in the Bay Area have started, according to The Information, which also reported last month that the tech giant is planning to slash thousands of jobs as it seeks to shave $1 billion in costs. Some employees in the customer-experience unit were told Monday that their jobs were being eliminated, Bloomberg News reported, citing LinkedIn posts by affected employees. Oracle, which moved its headquarters from Redwood City, Calif., to Austin while retaining many California-based employees, did not immediately respond to MarketWatch's request for comment. </p><p>Market Pulse Stories are Rapid-fire, short news bursts on stocks and markets as they move. Visit MarketWatch.com for more information on this news."
2022-08-01 18:54:57,Opendoor Labs to pay $62 million to settle FTC allegations that it deceived home sellers,"<p>Shares of Opendoor Technologies Inc.  fell 2.7% in afternoon trading Monday, after the U.S. Federal Trade Commission said subsidiary online home buying company Opendoor Labs Inc. will have to pay $62 million for deceiving potential home sellers. The FTC said it took the action because of its allegations that Opendoor ""pitched potential sellers using misleading and deceptive information, and in reality, most people who sold to Opendoor made thousands of dollars less"" than if they sold their homes using the traditional process. On top of the $62 million payment, the FTC's order prohibits Opendoor from making ""deceptive, false and unsubstantiated claims"" to consumers about how much money they will receiver, and requires Opendoor to provide ""competent and reliable evidence"" to support any claims made about costs, savings or benefits from using Opendoor. The stock has plunged 67.3% year to date, amid increasing signs of a housing market slowdown, while the S&amp;P 500  has lost 13.7%.</p><p>Market Pulse Stories are Rapid-fire, short news bursts on stocks and markets as they move. Visit MarketWatch.com for more information on this news."
2022-08-01 18:29:28,Atlas Worldwide stocks shoots up in volatile trading after WSJ report of buyout talks with Apollo-led group,"<p>Shares of Atlas Worldwide Holdings  shot up 12.5% toward a four-month high in volatile afternoon trading Monday, after The Wall Street Journal reported that the aircraft and aviation operating services was in advanced buyout talks by a group led by asset management services company Apollo Global Management Inc. The stock, which was up as much as 16.2% earlier in the session, has been halted once for volatility in afternoon trading. The WSJ report, which cites people familiar with the matter, said a deal could come soon, while details of the negotiations couldn't be learned. Atlas Air's market capitalization at current stock prices was $2.40 billion. Atlas Air's stock has rocketed 44.2% since it closed at a 16-month low of $59.04 on July 6, while the S&amp;P 500  has gained 7.3% over the same time.</p><p>Market Pulse Stories are Rapid-fire, short news bursts on stocks and markets as they move. Visit MarketWatch.com for more information on this news."
