DATE,TITLE,SUMMARY
2022-12-20 12:31:33,FTX Victims Face a Tough Road Getting Their Money Back,"The bankrupt crypto exchange owes billions to a long line of creditors. Getting their money back could prove difficult, given the unique nature of cryptocurrency assets."
2022-12-20 10:30:40,China’s Abrupt Covid Pivot Leaves Many Without Medicines,Millions are desperate to get their hands on fever-reducing drugs and antivirals such as Pfizer’s Paxlovid as infections across China outpace supplies.
2022-12-20 12:24:49,How TikTok Became a Diplomatic Crisis,A Chinese app conquered the planet — and now the U.S. is threatening to shut it down. Can the world’s biggest virality machine survive?
2022-12-20 14:40:10,Bank of Japan Surprises Markets With Policy Change,"The adjustment to bond buying policies was a rare move for the central bank, keen on helping the country battle rising inflation and a weak currency."
2022-12-20 08:00:08,Release of Trump Tax Returns Could Herald New Era for Taxpayer Privacy,Revealing private documents risks a tit for tat with Republicans set to retake control of the House of Representatives.
2022-12-20 01:00:53,King Charles III Is the New Face of U.K. Money,"Pound notes with the new sovereign’s image will begin appearing in 2024, though money with his mother’s likeness will still be in circulation."
2022-12-19 22:18:58,"Drew Griffin, CNN Investigative Journalist, Dies at 60",His reporting on delayed care for military veterans at Veterans Affairs hospitals led to the resignation of the secretary of the department.
2022-12-18 00:49:46,Sam Bankman-Fried Is Expected to Agree to Extradition to the US,"The FTX founder, now in prison in the Bahamas, faces criminal charges that he engaged in widespread fraud since founding the cryptocurrency exchange in 2019."
