DATE,TITLE,SUMMARY
2022-11-15 21:00:00,Russia retreats from Kherson. Why is the U.S. nudging Ukraine on peace talks?,Russia says all its forces are gone from the key southern city of Kherson. Yet the Biden administration is publicly asking Ukraine to show a
2022-11-15 21:00:00,A crash course in organ transplants helps Ukraine's cash-strapped healthcare system,"The war has hammered Ukraine's health care budget, leaving some patients without access to care. U.S. hospitals are helping to fill the gap"
2022-11-15 21:00:00,France accepts a migrant rescue ship as relations sour with Italy,"France allowed the Ocean Viking humanitarian ship to dock in the port of Toulon on Friday, after Italy's new far-right government refused to"
2022-11-15 21:00:00,"He has attempted the journey to Europe three times, and refuses to give up",Mamadou Niang has decided he has no choice but to leave his native Senegal. Salinization has made it impossible to farm his family's land
2022-11-15 21:00:00,"Ukrainian soldiers who helped liberate Kherson describe relief, joy and apprehension",Many soldiers from the southern port city of Kherson spent months trying to liberate their homes. The Russian retreat last week was a major 
2022-11-15 21:00:00,Ukraine's President Zelenskyy makes surprise visit to liberated city of Kherson,"The Ukrainian president appears openly in front of the main government building in the southern city, and speaks to cheering residents who "
2022-11-15 21:00:00,Turkey blames Kurdish group for Istanbul bombing,"Turkish authorities blamed a Kurdish group active in Syria. Turkey views the group as the Syrian affiliate of the Kurdistan Workers Party, "
2022-11-15 21:00:00,4 takeaways from President Biden's 'very blunt' meeting with China's Xi Jinping,The three-hour meeting between Xi and President Biden finished Monday with both leaders expressing an openness to restoring communication 
