DATE,TITLE,SUMMARY
2022-11-06 21:00:00,Sunak vows to get UK off polluting fossil fuels and turn it into a 'clean energy superpower',
2022-11-06 21:00:00,'Lock her up!': Lone heckler and crowd's treatment of her at Trump rally reveals deep divides,
2022-11-06 21:00:00,England and Wales ignore FIFA's plea to 'focus on football' in Qatar,
2022-11-06 21:00:00,Rugby player and former X Factor singer Levi Davis missing in Spain,
2022-11-06 21:00:00,The growing trend of 'quiet quitting' - and whether you should worry about being 'quiet fired',
2022-11-06 21:00:00,World Cup critics are 'arrogant' and 'cannot accept' Qatar as hosts,
2022-11-06 21:00:00,Nineteen dead after passenger plane crashes into Lake Victoria as it was landing at airport,
