DATE,TITLE,SUMMARY
2022-01-03 11:23:00,"Tesla accident leaves one dead and 20 injured in Paris, prompting taxi firm to suspend use of model",
2022-01-03 11:23:00,Injured turtle's 'forever home' in Scotland,
2022-01-03 11:23:00,"Amazon plastic packaging use soared 29% during pandemic, Oceana estimates",
2022-01-03 11:23:00,'Lava bombs' erupt from La Palma volcano,
2022-01-03 11:23:00,Inside a Cambridge research lab battling Omicron,
2022-01-03 11:23:00,Driverless Amsterdam canal taxis,
2022-01-03 11:23:00,Astronauts give lesson that's out of this world,
2022-01-03 11:23:00,Tim Peake worried by kids' physics books,
2022-01-03 11:23:00,"NASA mission or no, thousands of people could still be killed by a completely unpredictable asteroid impact",
