DATE,TITLE,SUMMARY
2022-11-07 13:12:00,Things A Republican-Held Congress Plans To Do Immediately,
2022-11-07 12:15:00,Study Finds 100% Of Relationships Last Forever,
2022-11-07 12:00:00,Usain Bolt Recalls Discovering Talent For Running Through Corporate Wellness Challenge,
2022-11-07 11:45:00,Centrist Advocates Moderate Approach To Genocide,
2022-11-07 11:30:00,Regular Been Coming To Local Diner Long Enough To Know All The Forks By Name,
2022-11-07 11:15:00,"Miss Argentina, Miss Puerto Rico Reveal They Are Married",
2022-11-07 11:00:00,All Of Man’s Best Clothes Associated With Relationship He Destroyed,
2022-11-07 20:55:00,Raphael Warnock Surges In Polls After Taking Off Glasses,
2022-11-07 20:30:00,Elon Musk Touts Project To Teach Neuralink Monkeys To Commit Sexual Harassment,
2022-11-07 19:09:00,Astros Win First World Series Since Cheating Scandal,
2022-11-07 18:41:00,Bullied Loner Plans Office Shooting,
2022-11-07 18:30:06,Americans Explain Why They Are Not Voting In The Midterms,
2022-11-08 13:09:00,Stressed-Out Woman Treats Herself To Additional $400 Of Credit Card Debt,
2022-11-08 12:30:00,Scientists Discover Fluffy Planet With Density Of A Marshmallow,
2022-11-08 12:15:00,Nursing Home CEO Afraid He’ll End Up In One Of Those Places He Owns,
2022-11-08 12:00:00,Most Brilliant Ways Elon Musk Plans To Make Twitter Profitable,
2022-11-08 11:45:00,Cheeks Of Adorable Pet Hamster Filled With Own Babies,
2022-11-08 11:30:00,Armed Conservative Monitoring Polling Site Disappointed How Few People Vote In Midterms,
2022-11-08 11:15:00,Kidnapper Not About To Wake Up At 5 A.M. To Abduct Jogging Woman,
2022-11-08 11:00:00,Obama Claims He’s Still President After Seeing How Susceptible Voters Are To Conspiracy Theories,
2022-11-08 17:23:06,Republican Voters Given Toll-Free Number To Call If They Witness Legitimate Vote,
2022-11-08 17:09:00,"Elderly Poll Watcher Doing Slow, Confused Job Of Intimidating Voters",
2022-11-08 21:07:00,U.N. Chief Tells Climate Summit: Cooperate Or Perish,
2022-11-09 13:16:00,Scenes From The Midterm Elections,
2022-11-09 13:15:00,Kamala Harris Loses Benefits After Hours Get Cut At Work,
2022-11-09 13:14:00,AI Software Company Patches Bug That Caused App To Treat Black People Equally,
2022-11-09 11:00:00,National Park Service Urging Visitors To Stop Licking Toxic Psychedelic Toads,
2022-11-09 18:37:00,Smiling Fetterman Asks Oz If He’d Mind Slowly Repeating Concession For 5th Time,
2022-11-09 17:37:15,Dumbass Nation Puts Congress In Power Again,
2022-11-09 16:35:00,Victorious Senator Vows To Still Fight For Billionaires Who Didn’t Funnel Dark Money Into Campaign,
2022-11-09 16:20:00,New Legislation Would Prohibit Texting While Stabbing,
2022-11-09 13:22:00,What To Say To Someone Who Is Saving Themselves For Marriage,
2022-11-09 22:20:00,Biggest Winners And Losers From The Midterm Elections,
2022-11-09 20:35:00,Chris Evans Named ‘People’ Magazine’s 2022 Sexiest Man Alive,
2022-11-09 19:40:00,Winklevoss Twins Spend Joyous Afternoon Jerking Each Other Off,
2022-11-09 19:15:00,Beto O’Rourke Asks Advisors If Getting Paralyzed By Tree Would Help 2026 Election Chances,
2022-11-10 11:30:00,Clueless Commuters Walk Past World-Famous Subway Masturbator Without Realizing,
2022-11-10 11:15:00,Tearful U.N. Secretary Holds Up Glacier’s Remains As Dire Climate Warning,
2022-11-10 11:00:00,Moment Of Silence Sponsored By Foot Locker,
2022-11-10 14:54:00,They Said A Rock Could Never Have A Tasty Little Guy Inside: How Oysters Proved Everyone Wrong,
2022-11-10 13:55:00,‘Call Of Duty’ Adds Premium Skin Only Available To Players Who Kill Someone In Real Life,
2022-11-10 13:37:00,Things That Will Get You Permanently Banned From Elon Musk’s Twitter,
2022-11-10 13:29:00,How Should We Reduce Political Polarization?,
2022-11-10 13:25:00,A Real Ship Show,
2022-11-10 13:18:00,I’d Probably Do Fine In Prison Because I Get Along With Everybody,
2022-11-10 12:00:00,Stolen Bitcoin Worth $3 Billion Found In Popcorn Tin,
2022-11-10 11:45:00,Kid Could Afford To Be More Discerning About Which Rocks Are Worth Collecting,
2022-11-10 20:33:00,First Gen Z Member Elected To Congress,
2022-11-10 17:40:00,Onion Sports’ NFL Week 10 Picks,
2022-11-11 12:00:00,Parents At Zoo Shield Children’s Eyes From Gorillas Having Public Execution,
2022-11-11 11:45:00,Study Finds Majority Of Americans Die Within Same Trash Compactor They Were Born Into,
2022-11-11 11:30:00,Twitter Employees React To Getting Laid Off,
2022-11-11 11:15:00,Trophy Shopper Poses With 200 Pounds Of Pre-Packaged Ground Beef,
2022-11-11 11:00:00,Voters Reelect Dead Pennsylvania State Representative,
2022-11-11 21:13:00,The Onion Mourns The Passing Of Gallagher,
2022-11-11 21:00:00,The Onion’s Guide To Renewable Energy,
2022-11-11 20:55:00,Sam Bankman-Fried Sobs After Accidentally Dropping Last Crypto Down Sewer Grate,
2022-11-11 20:03:00,KFC Apologizes For Kristallnacht Chicken And Cheese Promotion,
2022-11-11 18:50:00,Crypto Confidence Soars After CEO Defrauds Customers Just Like Real Bank,
2022-11-11 18:45:00,Raphael Warnock Loses All Faith In God After Being Forced Into Runoff Against Herschel Walker,
2022-11-11 18:24:00,U.S. Pledges To Reduce Reliance On Energy Siphoned From Unconscious Americans Living In Simulation,
2022-11-11 18:22:33,Honor Our Troops By Watching Over This Sleeping Soldier,
2022-11-13 11:00:00,"Week In Review: November 13, 2022",
2022-11-14 13:27:00,Arsonist Worried He Forgot To Turn Stove On Before Leaving House,
2022-11-14 11:00:00,"Small Study Shows Money Can Buy Happiness For Households Earning Up To $123,000",
2022-11-14 17:52:10,Daily Affirmation: Your Heart Is A Magnet,
2022-11-14 17:20:00,Amazon Prime Acquires Broadcast Rights To NBA’s Showers,
2022-11-14 15:48:00,Republicans Explain Why Ron DeSantis Should Run For President,
2022-11-14 15:39:00,Ted Cruz Announces Plans To Once Again Like Porn On 9/11,
2022-11-14 15:38:00,Custody Agreement Designates Wednesdays For Child To Wander Around Entirely On Own,
2022-11-14 20:20:00,Democrats Retain Control Of Senate With Nevada Victory,
2022-11-14 20:00:00,Steven Spielberg Fondly Recalls How Jewish Upbringing Inspired ‘Jurassic Park’,
2022-11-15 11:30:00,Fox News Host Warns Democrats Trying To Keep Women Single,
2022-11-15 11:15:00,Old-Fashioned Stalker Thinks Technology Makes Hunting Women Too Easy,
2022-11-15 11:00:00,Democrats Vow To Make Better Effort To Reach Out To Hollywood Elite,
2022-11-15 20:45:00,Tiffany Trump Charged Full Venue Price For Mar-A-Lago Wedding,
2022-11-15 20:20:00,Annoying Bus Crash Momentarily Ruins 8 Billion Human Population Milestone,
2022-11-15 20:03:00,Dolly Parton Receives $100 Million From Jeff Bezos To Spend On Charity,
2022-11-15 20:02:00,Jay Leno Rushed To Hospital For Emergency Denim Grafts,
2022-11-15 20:00:00,"‘Holy Shit, This Past Week Has Been Really Hard On Him,’ Says Man Seeing Disheveled Sam Bankman-Fried Photo From 2021",
2022-11-15 20:00:00,Elon Musk Demands Twitter Servers Explain What All These Wires For,
2022-11-16 12:57:00,Things To Never Post On Social Media If You’ve Had An Abortion,
2022-11-16 12:30:00,What To Know About The Collapse Of FTX,
2022-11-16 12:15:00,New Sponsored Google Maps Feature Directs Every Driver To Denny’s,
2022-11-16 12:00:00,MTA Officer Doesn’t Even Look Up From Phone To Shoot Unarmed Civilian,
2022-11-16 11:45:00,TSA Finds Gun Inside Raw Chicken,
2022-11-16 21:43:00,World Population Reaches 8 Billion,
2022-11-16 18:18:53,Archaeologists Discover Ancient Femur That Could Make Mouthwatering Broth,
2022-11-16 11:30:00,Viewers Slam HBO’s ‘Hard Knocks’ For Unnecessary Incest Scene,
2022-11-16 11:15:00,Economy Collapses After 10-Year-Old Boy Spends Entire U.S. GDP On ‘Fortnite’ Skins,
2022-11-16 11:00:00,New Golf Channel Show Just 30-Minute Praising Of Saudi Royals,
2022-11-15 16:54:47,NASA Delays Artemis Launch After Rocket Gets Scared,
2022-11-15 16:35:00,God Criticized For Taking Credit For Universe From Black Creator,
2022-11-15 13:11:54,What Elon Musk Told Twitter Employees During His First Company Meeting,
2022-11-15 11:30:00,Fox News Host Warns Democrats Trying To Keep Women Single,
2022-11-15 11:15:00,Old-Fashioned Stalker Thinks Technology Makes Hunting Women Too Easy,
2022-11-15 11:00:00,Democrats Vow To Make Better Effort To Reach Out To Hollywood Elite,
2022-11-14 20:20:00,Democrats Retain Control Of Senate With Nevada Victory,
2022-11-14 20:00:00,Steven Spielberg Fondly Recalls How Jewish Upbringing Inspired ‘Jurassic Park’,
2022-11-14 17:52:10,Daily Affirmation: Your Heart Is A Magnet,
2022-11-14 17:20:00,Amazon Prime Acquires Broadcast Rights To NBA’s Showers,
2022-11-14 15:48:00,Republicans Explain Why Ron DeSantis Should Run For President,
2022-11-14 15:39:00,Ted Cruz Announces Plans To Once Again Like Porn On 9/11,
2022-11-14 15:38:00,Custody Agreement Designates Wednesdays For Child To Wander Around Entirely On Own,
2022-11-14 13:27:00,Arsonist Worried He Forgot To Turn Stove On Before Leaving House,
2022-11-14 11:00:00,"Small Study Shows Money Can Buy Happiness For Households Earning Up To $123,000",
2022-11-13 11:00:00,"Week In Review: November 13, 2022",
2022-11-11 21:13:00,The Onion Mourns The Passing Of Gallagher,
2022-11-11 21:00:00,The Onion’s Guide To Renewable Energy,
2022-11-11 20:55:00,Sam Bankman-Fried Sobs After Accidentally Dropping Last Crypto Down Sewer Grate,
2022-11-11 20:03:00,KFC Apologizes For Kristallnacht Chicken And Cheese Promotion,
2022-11-11 18:50:00,Crypto Confidence Soars After CEO Defrauds Customers Just Like Real Bank,
2022-11-11 18:45:00,Raphael Warnock Loses All Faith In God After Being Forced Into Runoff Against Herschel Walker,
2022-11-11 18:24:00,U.S. Pledges To Reduce Reliance On Energy Siphoned From Unconscious Americans Living In Simulation,
2022-11-11 18:22:33,Honor Our Troops By Watching Over This Sleeping Soldier,
2022-11-11 12:00:00,Parents At Zoo Shield Children’s Eyes From Gorillas Having Public Execution,
2022-11-11 11:45:00,Study Finds Majority Of Americans Die Within Same Trash Compactor They Were Born Into,
2022-11-11 11:30:00,Twitter Employees React To Getting Laid Off,
2022-11-11 11:15:00,Trophy Shopper Poses With 200 Pounds Of Pre-Packaged Ground Beef,
2022-11-11 11:00:00,Voters Reelect Dead Pennsylvania State Representative,
2022-11-10 21:37:52,Bullied Loner Plans Office Shooting,
2022-11-10 20:33:00,First Gen Z Member Elected To Congress,
2022-11-10 17:40:00,Onion Sports’ NFL Week 10 Picks,
2022-11-10 14:54:00,They Said A Rock Could Never Have A Tasty Little Guy Inside: How Oysters Proved Everyone Wrong,
2022-11-10 13:55:00,‘Call Of Duty’ Adds Premium Skin Only Available To Players Who Kill Someone In Real Life,
2022-11-10 13:37:00,Things That Will Get You Permanently Banned From Elon Musk’s Twitter,
2022-11-17 13:47:00,What To Say To Someone Who Lost Money In The Crypto Crash,
2022-11-17 12:30:00,What Happened To The Midterms ‘Red Wave’?,"<p>Expectations of a significant Republican Party takeover of both chambers of Congress failed to materialize, as Democrats retained control of the Senate and GOP gains were lower than expected in the House. <em>The Onion</em> polled all 330 million Americans to ask why the midterms “red wave” didn’t come to fruition.</p><p><a href=""https://www.theonion.com/what-happened-to-the-midterms-red-wave-1849792769"">Read more...</a>"
2022-11-17 12:15:00,Still Can’t Afford Your Own Sphere? Why Disks Could Be Your Ticket To Roundness On A Budget,
2022-11-17 12:00:00,Astronaut Stunned By How Fuckable Earth Looks From Space,
2022-11-17 11:45:00,Kamala Harris Picks Up Seasonal Job At Macy’s,
2022-11-17 11:30:00,"Steve Jobs’ Old Birkenstocks Sell For $218,000 At Auction",
2022-11-17 11:15:00,Concerned Pediatrician Explains That Child Should’ve Been Radicalized Online By Now,
2022-11-17 11:00:00,Jewish Neighbors Make Small Talk About Controlling The Weather,
2022-11-17 19:40:00,Artemis Rocket Carrying Mannequins To Determine Viability Of Department Stores On Moon,
2022-11-17 18:20:00,Onion Sports’ NFL Week 11 Picks,
2022-11-17 18:18:00,When Hairy Met Sally,
2022-11-17 22:39:00,Ticketmaster Opens New Workhouse Where Taylor Swift Fans Can Labor To Earn Their Eras Tickets,
2022-11-17 21:27:00,Things Gen Z Hates About Millennials,
2022-11-17 21:17:00,Trump Announces 2024 Presidential Bid,
2022-11-18 13:02:00,Neighborhood Gentrifies Right Through 6-Lane Highway,
2022-11-18 11:30:00,White Teacher In Texas Fired After Telling Students His Race ‘The Superior One’,
2022-11-18 11:15:00,Things Never To Say To A Tom Brady Fan,
2022-11-18 11:00:00,Facebook HQ On Lockdown After Mark Zuckerberg’s Avatar Breaks Out Of Metaverse,
2022-11-18 18:20:00,Injured Birthday Clown Taken Behind Bouncy House To Be Shot,
2022-11-18 18:15:00,The History Of Ex-Presidents Who Tried To Run Again,
2022-11-18 19:45:00,Nancy Pelosi Will Not Seek Reelection As Democratic Leader In House,
2022-11-18 18:54:14,Walgreens To Now Offer Baths,
2022-11-19 18:55:00,So-Called Alabama Fan Buried Without Team Merch,
2022-11-20 11:00:00,"Week In Review: November 20, 2022",
2022-11-20 16:00:00,Qatar World Cup Games To Cut Off Human Sales After 75th Minute,
2022-11-21 13:50:00,British World Cup Attendees Accused Of Smuggling Alcohol Into Stadium Through Bloodstreams,
2022-11-21 13:50:00,Priest Never Sure How To Fill Awkward Silence After Last Rites Finished But Before Person Dies,
2022-11-21 13:46:00,Biggest Shortcomings Of Tesla’s Self-Driving Cars,
2022-11-21 13:45:00,New STEM Program Teaches Students Skills To Appease Whims Of Capricious Tech CEO,
2022-11-21 13:45:00,Toddler Demands Full Investigation Into Why That Man Has No Hair,
2022-11-21 13:40:00,Landlord Pledges To Address Tenant Infestation,
2022-11-21 11:00:00,Study: Sperm Counts Worldwide Have Plunged 62% In Under 50 Years,
2022-11-21 19:03:00,Elon Musk Criticized For Firing So Many Employees Rather Than Spending Decades Grinding Them Down,
2022-11-21 16:23:23,Things You Should Never Say To A Flight Attendant,
2022-11-21 14:40:00,"‘No Way To Prevent This,’ Says Only Nation Where This Regularly Happens",
2022-11-21 20:44:00,Elizabeth Holmes Sentenced To More Than 11 Years In Prison,
2022-11-21 20:36:00,Elon Musk’s Rules Of ‘Insane Productivity’ That Were Sent To All Twitter Employees,
2022-11-22 11:45:00,Qatar Bans Beer Sales At World Cup Stadiums,
2022-11-22 11:30:00,Police Team-Building Scavenger Hunt Challenges Officers To Arrest Someone From Every Race,
2022-11-22 11:15:00,Rihanna Admits She Just Uses Whatever Makeup On Sale At Walgreens,
2022-11-22 11:00:00,Child Walks In On Parents Failing To Reignite Spark In Marriage,
2022-11-22 17:11:13,"This Is An Unauthorized, Non-Paid Advertisement For Country Crock",
2022-11-22 13:46:00,The Onion Is Giving Away $8.3 Trillion In NFTs,
2022-11-22 20:14:00,Mariah Carey Loses ‘Queen Of Christmas’ Trademark Bid,
2022-11-22 20:10:00,Cash-Flush FIFA Executives Note Every World Cup Host Has Had Slaves At One Point,
2022-11-22 19:06:00,"Saudis Celebrate Shocking World Cup Win By Flipping Over A Woman, Setting Her On Fire",
2022-11-23 15:13:00,What To Know About The 2022 World Cup,
2022-11-23 13:05:00,Thanksgiving Fact: Did You Know?,
2022-11-23 12:45:00,"Bob Dylan’s Teenage Love Letters Sell For Over $650,000 At Auction",
2022-11-23 12:30:00,Family Switches To Artificial LED Turkey For Thanksgiving,
2022-11-23 12:15:00,Weapon Added To Each Thanksgiving Place Setting In Preparation For Blowout Family Argument,
2022-11-23 12:00:00,Biden Meets With Turkeys Who’ve Lost Loved Ones To Thanksgiving,
2022-11-23 11:45:00,Mom Urges Family Members Not To Fight Turkey Again This Year,
2022-11-23 11:30:00,Mom Thinks It’s Time 8-Year-Old Learned Santa Claus Isn’t Real Father,
2022-11-23 11:15:00,What Americans Dread The Most About The Holidays,
2022-11-23 11:00:00,How To Tell Your Mom You’re Not Coming Home For The Holidays,
2022-11-23 19:19:00,Supreme Court Allows House Democrats To Obtain Trump’s Tax Returns,
2022-11-24 12:15:00,Thanksgiving 2022: What Are We Thankful For?,"<p>Americans across the nation are sitting down to celebrate Thanksgiving. <em>The Onion</em> polled all 330 million Americans to find out what they’re most thankful for. </p><p><a href=""https://www.theonion.com/thanksgiving-2022-what-are-we-thankful-for-1849817957"">Read more...</a>"
2022-11-24 12:05:00,Little-Known Origins Of Your Favorite Thanksgiving Foods,
2022-11-24 12:00:00,Americans Celebrate Thanksgiving,
2022-11-24 11:45:00,Classic Thanksgiving Dishes Ranked From Best To Worst,
2022-11-24 11:30:00,Onion Sports’ NFL Week 12 Picks,
2022-11-24 11:15:00,‘Help! Fucking Help! There’s Blood And Feces Everywhere And The Doors Won’t Unlock!’ Our Tech Columnist Takes A Sneak-Peek Inside A Self-Driving Tesla,
2022-11-24 11:00:00,Frustrated Man Still On Waitlist To Register As Sex Offender,
2022-11-25 13:05:00,Target Now Offering Snipers To Take Out Other Shoppers For Black Friday,
2022-11-25 12:00:00,Campbell’s Introduces New Line Of Extra Hearty One-Chunk Soups,
2022-11-25 11:45:00,Things Former Twitter Employees Said About Elon Musk That Got Them Fired,
2022-11-25 11:30:00,Increasingly Unhinged Nate Silver Declares 39 Has 83% Chance Of Being 64,
2022-11-25 11:15:00,Cash-Strapped Subway Threatens To Reveal Identities Of Customers Who Eat Subway If They Don’t Pay,
2022-11-25 11:00:00,Chivalrous Predator Opens Trunk For Date,
2022-11-27 11:05:00,"Week In Review: November 27, 2022",
