DATE,TITLE,SUMMARY
2022-12-13 17:05:00,Dad Finally Quits Drinking,
2022-12-13 16:46:00,Jan. 6 Rioters Explain Why They Stormed The Capitol,
2022-12-13 20:41:00,Arizona Governor Building Illegal Makeshift Border Wall During Final Days In Office,
2022-12-13 20:20:00,Elon Musk Receives Experimental Neuralink Implant In Attempt To Delete Memory Of Being Booed,
2022-12-14 12:00:00,Biggest Reasons Not To Sleep With A Coworker,
2022-12-14 11:45:00,Kansas Keystone Pipeline Leak Largest In Pipeline’s History,
2022-12-14 11:30:00,Nation Forgives Harvey Weinstein After He Gets Really Good At Football,
2022-12-14 11:15:00,"Johnson & Johnson Raises Price Of Band-Aids To $100,000 Apiece",
2022-12-14 11:00:00,Restaurant Puts Fun Little Santa Hat On Severed Head Of Animal That Screamed When It Died,
2022-12-14 20:54:00,Bill Protecting Same-Sex Marriage Signed Into Law,
2022-12-14 16:55:00,What To Know About ‘Avatar: The Way Of Water’,
2022-12-14 16:20:00,Good Fir Nothing,
2022-12-14 16:19:12,Onion Explains: The International State Of Women's Rights Pt. 3,
2022-12-15 13:50:00,What Will Happen To FTX Founder Sam Bankman-Fried?,
2022-12-15 12:00:00,CEOs React To Arrest Of Sam Bankman-Fried,
2022-12-15 11:45:00,‘Woman’ Named Dictionary.com’s 2022 Word Of The Year,
2022-12-15 11:30:00,Ancestry Website Shows Chart Of Which Dead People Busted Loads Inside Other Dead People,
2022-12-15 11:15:00,Uncle Returns From Trip Abroad With Treasure Trove Of Prescription Medications,
2022-12-15 11:00:00,Could Something Bad Happen?,
2022-12-15 19:50:00,Onion Sports’ NFL Week 15 Picks,
2022-12-15 19:10:00,Cat Clinging To Side Of Christmas Tree Admits That Was Extent Of Plan,
2022-12-15 17:47:00,Worst Mistakes You Can Make At A Company Holiday Party,
2022-12-15 20:52:00,U.S. Announces Nuclear Fusion Energy Breakthrough,
2022-12-15 20:00:00,Gates Foundation Unveils Initiative To Give Starving Africans Fat Suits,
2022-12-16 12:45:00,What To Know About The Nuclear Fusion Breakthrough,
2022-12-16 12:30:00,Ron DeSantis Introduces New Son Barron Trump,
2022-12-16 12:15:00,Pharma Company’s Holiday Party Features Insulin Fountain,
2022-12-16 12:00:00,Elon Musk No Longer Richest Person In World,
2022-12-16 11:45:00,Subway Introduces Mandatory 72-Hour Psychiatric Hold For Anyone Thinking Of Ordering Sandwich,
2022-12-16 11:30:00,Single Woman Feels Safer Keeping Loaded Baked Potato In Nightstand,
2022-12-16 11:15:00,Conservatives Explain How Woke Culture Is Destroying America,
2022-12-16 11:00:00,‘America’s Test Kitchen’ Begs Middle-Aged Women To Stop Sending Them Panties,
2022-12-16 13:00:00,Elon Musk Hides In Dark Twitter Office As Landlord Bangs On Door Demanding Rent,
2022-12-16 19:55:00,Senate Votes To Ban TikTok On Government Devices,
2022-12-18 11:00:00,"Week In Review: December 18, 2022",
2022-12-18 20:50:00,Mac Jones Calls Game ‘Must Win’ After Bill Belichick Shows Him Picture His Of Family Sleeping,
2022-12-18 20:50:00,Mac Jones Calls Game ‘Must Win’ After Bill Belichick Shows Him Picture Of His Family Sleeping,
2022-12-19 12:30:00,Neymar Wins World Cup’s Golden Tears Award For Most Faked Injuries,
2022-12-19 12:30:00,Trump Mocked For ‘Major Announcement’ He’s Selling Trading Cards,
2022-12-19 12:00:00,Meryl Streep Dropped By Agent After Failing To Develop Massive TikTok Following,
2022-12-19 11:45:00,Disappointed Man Reaches Bottom Of Ice Cream Carton Right When He Was Hitting His Stride,
2022-12-19 11:30:00,"Report: Over 10,000 Pedestrians Struck Annually By Drivers Rushing To Beat McDonald’s Breakfast Cut-Off Time",
2022-12-19 11:15:00,What To Say If Your Boss Asks You To Work On Christmas,
2022-12-19 11:00:00,At Least Man Masturbating On Bus Wearing Mask,
2022-12-19 18:51:00,Argentina Wins 2022 World Cup,
2022-12-19 18:44:00,Hanukkah Fact: Did You Know?,
2022-12-19 18:32:00,"Prince William, Prince Harry Settle Dispute With Arranged Marriages Between Children",
2022-12-19 18:32:00,"‘The Curse Is Lifted,’ Says Messi Before Transforming Back Into Soccer Ball",
2022-12-20 12:00:00,FIFA Officials Open For 2030 World Cup Bribes,
2022-12-20 11:45:00,Things To Never Say To A TSA Officer,
2022-12-20 11:30:00,Report: Hundreds Of Swimmers Die Every Year Getting Tangled Up In Plastic Lane Dividers,
2022-12-20 11:15:00,"Drill Sergeant Struggling To Communicate That New Recruits Are, In Fact, The Worst He’s Ever Seen",
2022-12-20 11:00:00,"‘They Hate Me–They Hate Me Because I’m Fat,’ Says Sobbing Biden Viewing Latest Approval Ratings",
2022-12-20 09:00:00,"Giant Aquarium Housing 1,500 Fish Bursts In Berlin",
2022-12-20 13:05:00,"Please Stop Watching Me Bake These Macarons, It Makes Me Self-Conscious And I Can’t Concentrate",
2022-12-20 18:43:00,Twitter Users Vote For Elon Musk To Step Down As CEO,
2022-12-21 13:05:00,How To Tell Your Mom You’re Not Coming Home For The Holidays,
2022-12-21 12:15:00,"Ho, Ho, Ho, A Cabal Of Elite Pedophiles Is Trying To Kill Me!",
2022-12-21 12:00:00,Ex-Christian Makes Uncomfortable Small Talk After Running Into Jesus Christ At Store,
2022-12-21 11:45:00,Compassionate Man Leaves Wife To Give Her Space To Deal With Cancer Diagnosis,
2022-12-21 11:30:00,Most Common Issues Men Bring Up In Therapy,
2022-12-21 11:15:00,Man Who Could Have Been Holding Gun In Diverging Timeline Shot Dead By Police,
2022-12-21 11:00:00,Skeleton In Sketchy Doctor’s Office Assembled Completely Wrong,
2022-12-21 10:00:00,Potential Candidates To Replace Elon Musk As Twitter CEO,
2022-12-21 09:30:00,U.N. Votes To Remove Iran From Women’s Rights Council,
2022-12-21 19:30:00,‘Fortnite’ Maker Fined $520 Million For Invading Kids’ Privacy And Tricking Players,
2022-12-22 12:15:00,Michael Jordan Opens Up About Long-Term Effects Of Orange Gatorade Seeping Out Of Head,
2022-12-22 11:45:00,What To Say If Someone Is Gaslighting You,
2022-12-22 11:30:00,Girlfriend In One Of Those Moods Where She Misses Her Deceased Mother,
2022-12-22 11:15:00,Married Couple Celebrates First Anniversary With Piece Of Wedding DJ Saved In Freezer,
2022-12-22 11:00:00,Father Engages Siri In Argument About WWII,
2022-12-22 11:00:00,Where To Leave A Single Strand Of Hair To Drive Your Lover’s Wife Wild,
2022-12-22 10:30:00,‘It’s Going To Be A White Christmas!’ Says Man Who Will Spend Holiday Trapped In Overturned Car,
2022-12-22 10:30:00,Petco Begins Selling Pre-Killed Gerbils,
2022-12-22 08:57:00,"Nazi Secretary, 97, Convicted For Role In 10,000 Murders At Death Camp",
2022-12-22 20:19:00,Powerful ‘Bomb Cyclone’ Expected To Disrupt Holiday Travel,
2022-12-23 13:26:00,James Cameron ‘Proves’ Jack Couldn’t Have Survived Titanic Sinking,
2022-12-23 13:05:00,"Ho, Ho, Ho! I Saw You Masturbating!",
2022-12-23 12:00:00,Man Peels Price Tag Off Gift For Dog,
2022-12-23 11:45:00,U.S. Treasury Introduces New Wild Bills That Can Be Used For Any Dollar Amount,
2022-12-23 11:15:00,Restaurant Customers Explain Why They Refuse To Tip,
2022-12-23 11:00:00,"Dad Drinking, Ashing Into Same Beer Can",
2022-12-23 18:40:00,Christmas Tree Lot Guy So Ready For Annual 46-Week Vacation,
2022-12-23 18:39:00,Husky Boy Relegated To Standing Next To Santa,
2022-12-26 11:15:00,"Zombie Virus Revived After 48,500 Years In Permafrost",
2022-12-26 11:00:00,Doctors Warn Insomnia Can Affect Ability Of Weird Guy To Stand In Doorway Watching You Sleep,
2022-12-26 14:17:00,Existential Horror At Wealthy Elite Selling Off Humanity’s Future Successfully Sublimated Into Yelling At Cashier,
2022-12-26 12:15:00,Things To Never Say To Your Amazon Delivery Driver,
2022-12-26 12:00:00,Drake Gifts DJ Khaled 4 Luxury Toilets For Christmas,
2022-12-26 11:45:00,Shanghai Tower Named World’s Tallest Building Amid Late Growth Spurt,
2022-12-26 11:30:00,Mom Wants To Know When Couple Going To Give Her Better Grandchildren,
2022-12-27 14:31:00,Pride At Using Big Word Causes Man To Completely Lose Train Of Thought,
2022-12-27 12:15:00,French Baguette Given UNESCO World Heritage Protection,
2022-12-27 12:00:00,Childless Man Wonders Who’ll Be There To Neglect Him When He’s Old,
2022-12-27 11:45:00,Nation’s Drunk Women List Mental Illnesses They Have,
2022-12-27 11:30:00,"Unfortunate Study Finds Abusing Waitstaff Secret To Longer, Happier Life",
2022-12-27 11:15:00,Narcan Vending Machine Reverses 600 Overdoses,
2022-12-27 11:00:00,Things All Cats Do That Prove They Are Psychopaths,
2022-12-28 12:15:00,England No Longer Majority Christian,
2022-12-28 12:00:00,Self-Loving Tesla Forgives Itself For Running Over Child,
2022-12-28 11:45:00,New Pam Ad Campaign Reminds Teens That Pam Can Get Them High And Is Easy To Obtain,
2022-12-28 11:30:00,Studio Offers Free Kanye West Tattoo Removal,
2022-12-28 11:15:00,Breaking: Tsh Ch-Ch-Tsh Ch-Ch-Tsh Ch-Ch-Tsh,
2022-12-28 11:00:00,Short Death Row Inmate Strapped Into Electric Booster Seat,
2022-12-28 15:05:00,Signs You’ve Spent Too Much Time With Your Family Over The Holidays,
2022-12-29 12:00:00,Things People Hate The Most About Disney Adults,
2022-12-29 11:45:00,NRA Congratulates School Shooter For Terrific Aim Given Such Small Targets,
2022-12-29 11:30:00,Hertz To Pay $168 Million After Falsely Accusing Customers Of Stealing Rental Cars,
2022-12-29 11:15:00,"Ancient Buddhist Temples, Thrilling Muay Thai Matches, And Other Must-See Attractions Your Dumb Ass Missed Out On By Visiting Norway",
2022-12-29 11:00:00,Reformed Nazi Puts Swastika Tattoo In Sarcastic Quotation Marks,
2022-12-29 12:30:00,Police Let Jogger Keep Body She Found After No One Claims It Within 90 Days,
2022-12-29 12:15:00,Florida Woman Suing Velveeta Over ‘False’ Cooking Time Claim,
2022-12-30 15:55:00,"BREAKING: 129,600… 129,599… 129,598…",
2022-12-30 14:15:00,Nation's Single Friends Announce Plans To Just Sort Of Stand There While Couples Kiss On New Year's Eve,
2022-12-30 12:15:00,South Koreans To Become Younger As Traditional Age System Scrapped,
2022-12-30 11:45:00,Flesh-Eating Bacteria Struggle To Chew Through Leathery Florida Residents,
2022-12-30 11:45:00,Police Release Composite Sketch Of What They Would Prefer Murder Suspect To Look Like,
2022-12-30 11:30:00,Hospital Patient Arrested For Switching Off Neighbor’s ‘Noisy’ Oxygen Machine,
2022-12-30 11:15:00,Things To Never Say To A Taylor Swift Fan,
2022-12-30 11:00:00,Protagonist’s Wife To Answer His Phone Call While Mixing Food In Bowl,
