DATE,TITLE,SUMMARY
2022-08-04 12:00:00,"Proposed Tax Break for Buying Electric Vehicles Is Too Hard to Get, Auto Makers Say","Draft rules for battery parts and minerals mean few current vehicles would be eligible, say lobbyists."
2022-08-04 20:13:00,Brad Jacobs Will Step Aside as CEO of XPO Logistics,"Mario Harik would succeed Mr. Jacobs, who will step down in the fourth quarter. Mr. Jacobs has started to carve apart the business he built through a series of rapid-fire acquisitions."
2022-08-05 01:40:00,Musk Alleges Fraud by Twitter in Countersuit,The billionaire Elon Musk said the social-media platform misrepresented users as well as the level of false accounts. Twitter said the claims are inaccurate.
2022-08-04 23:05:00,"DoorDash Revenue Climbs as Restaurants Raise Prices, Consumers Continue Spending",The food-delivery company raised its full-year guidance even as it expects a softer spending environment. Shares climbed more than 13% in after-hours trading.
2022-08-04 23:45:00,Carvana Cuts Costs as Demand for Used Autos Remains Under Pressure,The online used car dealer said reducing expenses is its top priority after focusing for years on aggressive sales growth.
2022-08-04 23:42:00,Beyond Meat Plans to Lay Off 4% of Global Workforce,The company’s CEO says job cuts are part of a plan to reduce costs as inflation prompts consumers to buy less-expensive protein.
2022-08-05 00:46:00,Warner Bros. Discovery Considers Free Ad-Supported Streaming Plan,The move is the latest effort by a streaming giant to reach a broader audience as the competition for users intensifies.
2022-08-05 12:36:00,"U.S. Added 528,000 Jobs in July",The U.S. economy has now recouped the number of jobs lost in the wake of the pandemic. The jobless rate dropped to 3.5%.
2022-08-05 12:55:00,Amazon Buying Roomba Maker iRobot for $1.7 Billion,"The deal for the robot vacuum, which would be Amazon’s fourth-largest acquisition, adds to a connected-home portfolio that also includes the Alexa virtual assistant speaker and Ring video doorbell."
2022-08-05 10:08:00,Evergrande Backs Out of Plan to Build World's Largest Soccer Stadium,"The struggling Chinese property developer said it would receive a refund equivalent to about $818 million, and intends to use the money to help repay debt."
2022-08-05 09:30:00,The Hot New Trend for Gucci and Chanel: Middle America,"After years focused mainly on expansion in China, luxury brands are rediscovering the U.S., opening boutiques across America in cities where they have never previously operated stand-alone stores."
2022-08-05 10:00:00,Databricks Says It Has Surpassed $1 Billion in Annualized Revenue,"Databricks Inc. says it has topped $1 billion in annualized revenue, a milestone that comes as the nine-year-old data analytics company looks to acquire other tech startups to drive growth."
2022-08-05 09:30:00,New Weight-Loss Drugs Can Fatten Drugmakers' Profits,A new class of treatments for obesity can have a big impact on public health and on the bottom lines of companies like Eli Lilly and Novo Nordisk
2022-08-05 02:00:00,Musk Alleges Fraud by Twitter in Countersuit,The billionaire Elon Musk said the social-media platform misrepresented users as well as the level of false accounts. Twitter said the claims are inaccurate.
2022-08-05 15:46:00,Pfizer in Advanced Talks to Buy Global Blood Therapeutics,Acquiring the maker of a recently approved drug for sickle-cell disease would be the latest move by the drug giant to bolster its portfolio and pipeline.
2022-08-05 15:50:00,Jobs Report to Keep Fed on Aggressive Tightening Path,"The U.S. economy is still firing on many cylinders, which makes it more likely that Fed officials conclude they need to raise rates to higher levels and to keep rates at those levels for longer to cool the economy."
2022-08-05 17:59:00,Snapshot of Jobs Market as It Reaches Pandemic Recovery Milestone,"Covid-19 altered industry hiring trends, who is in the workforce and put pressure on wages that is driving high inflation."
2022-08-05 15:23:00,Coinbase's Rapid Rise Left It Exposed in Crypto's Collapse,"Fast expansion made Coinbase the biggest U.S. exchange for digital currency. Now it faces high expenses, dwindling cash and a challenge from regulators."
2022-08-05 14:23:00,Cheapskates Rejoice: Free Samples Are Back,"Tidbits return, putting grocery-store grazers on the hunt; ‘I stalk the sample person’"
2022-08-05 16:03:00,CSX Railroad Chief Hays T. Watkins Promoted One-Stop Shipping,"An ambitious executive, who has died at age 96, expanded rail giant into trucks, barges and container ships but pulled back from diversification into energy and resorts."
2022-08-05 21:03:00,"July Jobs Report: U.S. Added 528,000 New Jobs",The U.S. economy has now recouped the 22 million jobs lost in the wake of the pandemic. The jobless rate dropped to 3.5%.
2022-08-05 14:23:00,Cheapskates Rejoice: Free Samples Are Back,"Tidbits return, putting grocery-store grazers on the hunt; ‘I stalk the sample person’"
2022-08-05 19:31:00,Oracle Lays Off Hundreds of Employees,The layoffs primarily hit Oracle’s advertising and customer experience group as the company emphasizes cloud and healthcare IT services.
2022-08-05 22:49:00,California DMV Accuses Tesla of False Advertising,The state agency alleged that Tesla has inaccurately portrayed its cars as autonomous.
2022-08-06 04:00:00,"At Ford, Quality Is Now Problem 1","Ford used to tout the reliability of its vehicles in ads. After a string of recalls, the auto maker is trying to change how it finds problems."
2022-08-06 04:01:00,The Inside Story of Carlos Ghosn's Brazen Escape From Japan,"The scheme involved stacks of cash, a stealthy dash to the airport, and plenty of cloak-and-dagger tactics. In the end, though, the auto executive had to hunker down in a claustrophobic box, hoping no one would look inside."
2022-08-06 04:00:00,The Other Electric Vehicle: E-Bikes Gain Ground for Americans Avoiding Gas Cars,Electric cars weren’t the only thing to post record sales last year. A growing number of Americans are turning to electric bikes for at least some of their transportation needs.
2022-08-06 13:32:00,"Berkshire Hathaway's Earnings Fall, Hurt by Market Volatility","The company posted a loss of $43.8 billion, compared with a profit of $28.1 billion in the year-earlier period."
2022-08-06 14:11:00,Shale Drillers Warn of Higher Costs as They Report Record Profits,Many companies in the oil patch are boosting their budgets to cope with labor shortages and soaring prices of raw materials and services.
2022-08-06 21:37:00,"Eli Lilly, Cummins Speak Out Against Indiana's Ban on Most Abortions","The companies say the state’s new restrictions could affect where they add staff; covering travel ‘may not be enough’ to retain talent, Lilly says."
2022-08-06 21:37:00,"Eli Lilly, Cummins Speak Out Against Indiana's Abortion Ban","The companies say the state’s new restrictions could affect where they add staff; covering travel “may not be enough” to retain talent, Lilly says."
2022-08-07 12:03:00,Phones Know Who Went to an Abortion Clinic. Whom Will They Tell?,Myriad state restrictions on accessing or performing abortions prompt some companies to pledge not to share sensitive mobile-phone data.
2022-08-07 10:00:00,Ben & Jerry's to Take On Owner Over Israeli Business,"A New York court is set to hear the ice-cream brand’s request to block its parent company, Unilever, from selling Ben &amp; Jerry’s Israeli business in what lawyers say is a first-of-its-kind case."
2022-08-07 06:54:00,China's Export Growth Stays Surprisingly Robust,"China’s export machine remained resilient in July following a strong bounceback from the spring’s harsh Covid-19 restrictions, defying again predictions of softening global demand for Chinese-made goods."
2022-08-07 14:43:00,How One Grocery Chain Is Preparing for a Downturn,Pennsylvania-based Karns Foods said it is readjusting prices weekly and dropping some products as consumers become more cost-conscious and recession fears grow.
2022-08-07 16:37:00,CVS Plans to Bid for Signify Health,"CVS is seeking to buy Signify Health, according to people familiar with the matter, as the drugstore and insurance giant looks to expand in home-health services."
2022-08-07 18:19:00,"Tom Alberg, Early Amazon Investor and Long-Time Amazon Board Member, Dies at 82","Mr. Alberg was known in business circles as a ‘Day 1 investor’ in Amazon, and served on the company’s board for 23 years."
2022-08-07 23:14:00,UPS Nears Deal to Buy Italian Healthcare-Logistics Provider Bomi Group,The acquisition would broaden the Atlanta-based transportation giant’s operations in Europe and Latin America.
2022-08-07 21:10:00,"Senate Passes Democrats' Climate, Healthcare and Tax Bill","After more than 15 hours of amendments, Democrats passed the legislation, with Vice President Kamala Harris casting the tiebreaking vote. The measure now moves to the House."
2022-08-07 19:00:00,Economy Week Ahead: Inflation and Inventories in Focus,Economists estimate that consumer prices moderated in July and wholesalers’ inventories rose modestly.
2022-08-08 07:29:00,SoftBank Reports Record $23 Billion Quarterly Loss as Tech Downturn Hits,The Japanese technology investor suffered losses after holdings such as Uber and DoorDash lost value.
2022-08-08 07:25:00,UPS to Buy Italian Healthcare-Logistics Provider Bomi Group,The acquisition would broaden the Atlanta-based transportation giant’s operations in Europe and Latin America.
2022-08-08 09:33:00,Hiring Gets Easier for Some Employers Despite Hot Job Market,"Verizon, Uber, Marriott and others hardest hit by the pandemic say they are seeing emerging signs that recruiting workers is becoming less of a challenge, even as the overall job market remains tight."
2022-08-08 09:33:00,Antitrust Bill Targeting Big Tech in Limbo,The legislative clock is ticking down on a bill that would block the largest tech companies from favoring their own products and services.
2022-08-08 09:30:00,How YouTube Keeps Broadcasting Inside Russia's Digital Iron Curtain,"Russia has fined Google’s video site hundreds of millions of dollars but hasn’t blocked its access, allowing the country’s citizens to view one of the few sources of independent information about the war in Ukraine."
2022-08-08 10:00:00,Risks From Falling Valuations Prompt More Startups to Extend Funding Rounds,"Rather than risk selling shares at lower prices in new fundraising rounds, a growing number of venture capital-backed startups are extending previous rounds—in some cases, extending ones that appeared closed over a year ago."
2022-08-08 11:54:00,SoftBank Reports Record $23 Billion Quarterly Loss,The Japanese technology investor suffered losses after holdings such as Uber and DoorDash lost value.
2022-08-08 11:11:00,Pfizer Agrees to $5.4 Billion Deal for Global Blood Therapeutics,"Pfizer has agreed to buy Global Blood Therapeutics for $5.4 billion, a deal that will give the big drugmaker a foothold in the treatment of sickle-cell disease."
2022-08-08 06:21:00,Two Chinese Cities Approve Baidu's Unmanned Self-Driving Taxis,"China, seeking to catch up to the U.S. in autonomous driving cars, has been increasingly active in setting up regulations that allow such vehicles on public roads."
2022-08-07 21:10:00,"Senate Passes Democrats' Climate, Healthcare and Tax Bill","After more than 15 hours of amendments, Democrats passed the legislation, with Vice President Kamala Harris casting the tiebreaking vote. The measure now moves to the House."
2022-08-08 09:25:00,World's Biggest Miner Rebuffed on $5.8 Billion Copper Play,"Copper mining company Oz Minerals rejected a takeover approach by BHP, which is seeking to boost its output of a metal needed for electric vehicles, wind turbines and solar farms."
2022-08-08 11:00:00,Lyft Creates Media Division to Expand Its Advertising Services,"Through its Lyft Media unit, the ride-hailing company plans to offer more ads inside cars, on its app and at bike-share stations."
