DATE,TITLE,SUMMARY
2022-07-31 15:27:00,"China's Stumbling Manufacturing, Property Sectors Show Long Road to Recovery",Data for the two key sectors was negative in July. The pressure isn’t expected to ease.
2022-07-31 15:00:00,How JetBlue Prevailed in Fight With Frontier for Spirit Airlines,"After a rough courtship, the carriers now face regulators and hurdles in merging the two different airlines."
2022-07-31 13:51:00,Consumers Have Powered Through the Pandemic---Until Now,Recent government data show that household spending is increasingly strained and some companies are bracing for an economic downturn.
2022-07-31 14:34:00,Black and Hispanic Employees Often Get Stuck at the Lowest Rung of the Workplace,A new comprehensive survey by McKinsey suggests that companies’ diversity efforts have largely missed the employees who stand to gain the most from them.
2022-07-31 14:03:00,Lower Inflation Likely Requires Higher Unemployment; How High Is the Question,"The answer is quite high, if underlying inflation and the “natural” unemployment rate have risen, some economists say."
2022-07-31 19:00:00,Economy Week Ahead: Hiring and Trade in Focus,The Labor Department is expected to report that job openings declined for the third consecutive month in June but remained historically elevated.
2022-07-31 10:00:00,Farm Giants Expect Continued Food-Supply Problems,Grain traders ADM and Bunge say crop supplies are tight and consumer demand is steady as commodity prices fall.
2022-07-31 14:00:00,U.S. Eyes Companies Over Iran Oil Exports,The U.S. believes a global network of companies has been helping Iran evade sanctions and export oil by blending it with Iraqi oil in ship-to-ship transfers at sea to hide its origins.
2022-07-29 18:53:00,Consumer Spending Grew Much Faster in June,"U.S. households’ spending rose 1.1% last month, the Commerce Department said, as annual inflation hit a new four-decade high, outpacing income growth."
2022-07-31 12:00:00,Silicon Valley Lurches Between Deep Cuts and Bold Spending,The market correction is leaving some startups in crisis as others are taking employees on vacation.
2022-07-31 15:00:00,How JetBlue Prevailed in Fight With Frontier for Spirit Airlines,"After a rough courtship, the carriers now face regulators and hurdles in merging the two airlines."
2022-07-31 10:00:00,Farm Giants Expect Continued Food-Supply Problems,Grain traders ADM and Bunge say crop supplies are tight and consumer demand is steady as commodity prices fall.
2022-07-31 15:00:00,Inside Ferrari's Plan to Enter the Electric-Vehicle Market,The luxury sports-car company aims to start selling a fully electric vehicle in 2025. Can it do that and still be Ferrari?
2022-07-30 14:00:00,"Starbucks, Uber, CVS to Report Earnings Amid Shrinking Economy",Companies across several industries will detail their respective performance during a quarter of economic contraction.
2022-07-31 11:00:00,U.S. Would Gain Power to Negotiate Drug Prices Under Manchin-Schumer Bill,"The legislation would also cap out-of-pocket drug costs for Medicare beneficiaries at $2,000 a year."
2022-07-31 09:30:00,The U.S. Is Investing Big in Chips. So Is the Rest of the World.,"With the federal incentives now available, a key question will be to what extent the U.S. is able to land major chip-factory investments that would have gone elsewhere."
2022-07-31 15:27:00,"China's Stumbling Manufacturing, Property Sectors Show Long Road to Recovery",Data for the two key sectors was negative in July. The pressure isn’t expected to ease.
2022-07-31 09:30:00,Falling Food Prices Ease Upward Pressure on Global Inflation,"Agricultural markets remain volatile as a result of war and hot weather. In the U.S., the impact on grocery bills might be muted."
2022-07-31 14:03:00,Lower Inflation Likely Requires Higher Unemployment; How High Is the Question,"The answer is quite high, if underlying inflation and the “natural” unemployment rate have risen, some economists say."
2022-07-31 19:00:00,Economy Week Ahead: Hiring and Trade in Focus,The Labor Department is expected to report that job openings declined for the third consecutive month in June but remained historically elevated.
2022-08-01 14:12:00,Celsius Energy Drink Gets $550 Million Investment From PepsiCo,"Deal with Celsius Holdings, which has a market capitalization of more than $6 billion, expands the soda and snacks company’s bet on the energy drinks market."
2022-08-01 15:32:00,Estée Lauder in Talks to Buy Luxury Brand Tom Ford,"Estée Lauder is in talks to buy luxury fashion brand Tom Ford, according to people familiar with the matter, in what could be a deal worth $3 billion or more."
2022-08-01 13:36:00,Nikola to Buy Battery Maker Romeo Power for $144 Million,The electric-truck startup said the deal would give it control over battery-related processes that currently represent a bottleneck for the industry.
2022-08-01 14:31:00,"Facing Labor Shortages, Pella Reinvents the Company Town in Rural Iowa",The maker of doors and windows is spending $30 million hoping to get people to move to its headquarters; ‘We just didn’t have the amenities’
2022-08-01 16:00:00,Amazon Wants Its NFL Coverage to Come in Different Flavors,The company’s Prime Video streaming service is bringing in comedy group Dude Perfect to call some “Thursday Night Football” games this fall in a bid to expand the broadcast’s reach.
2022-08-01 16:44:00,"The Popular Chicken Sandwich Gets a Redo at Panera Bread, Popeyes",Restaurants are adding new versions of the profitable meal despite rising poultry prices and increased competition.
2022-08-01 09:33:00,EV Startup VinFast Hits the U.S. With Novel Pricing Strategy,"VinFast is the latest startup to test American EV demand, and it brings a novel pricing strategy to keep consumer costs down."
2022-08-01 16:48:00,U.S. Factories Are Far From Recession,Survey data on Monday showed U.S. manufacturers remain in expansion mode.
2022-08-01 17:44:00,Trial Starts in Justice Department's Bid to Block Publishing Merger,Trial proceedings kicked off in the antitrust challenge to Penguin Random House’s planned acquisition of rival publisher Simon &amp; Schuster.
2022-08-01 09:30:00,Amgen Fights IRS Over $10.7 Billion Tax Bill,"Amgen is fighting a $10.7 billion tax bill from the IRS, which says the biotech improperly shifted nearly $24 billion in profits to a Puerto Rico subsidiary to reduce its tax burden."
2022-08-01 17:08:00,U.S. Factory Growth Slowed in July on Decline in Orders,"Inflation pressures eased last month as commodity price pressures diminished, according to surveys of purchasing managers."
2022-08-01 11:00:00,Utilities Enter Peak Hurricane Season Lacking Vital Transformers,"Lengthy outages loom after storms, as surging electricity demand and global supply-chain issues quadruple wait times for the vital equipment."
2022-08-01 22:12:00,TD Bank Nears Deal to Buy Cowen,"Toronto-Dominion Bank is close to a more than $1 billion deal to buy investment bank Cowen, according to people familiar with the matter."
2022-08-01 18:59:00,Apollo-Led Group in Advanced Talks to Buy Atlas Air,"A deal for the airfreight company could come soon assuming talks don’t fall apart, people familiar with the matter said."
2022-08-01 20:27:00,Activision Blizzard Profit Slumps as Sales Shrink,"Results from the videogame company, which is slated to be purchased by Microsoft, indicate growth is slowing in response to record inflation."
2022-08-02 09:43:00,Reliance's $11 Billion Bid Wins Lion's Share of 5G Spectrum in India Auction,"The sale of airwaves for high-speed platforms exceeded forecasts, lifting hopes of a rapid rollout as New Delhi seeks to close a technology gap with other countries, including China."
2022-08-02 09:30:00,"Snack, Deodorant Makers Target Cost-Conscious Shoppers With New Brands and Sizes","Consumer-goods companies say they have been monitoring shopper data and are preparing for a possible economic downturn, but surging inflation requires more than just ramping up promotions."
2022-08-02 09:30:00,How Cyber Chiefs Cut Through Marketing Noise,Here are five strategies corporate security chiefs use to weed out unsuitable cyber providers.
2022-08-02 09:30:00,"Demand for Workers Eased in June, Economists Estimate",U.S. job openings are estimated to have remained robust in June while easing from higher levels earlier in the year amid a broader economic slowdown.
2022-07-30 09:30:00,"If This Is a Recession, We Might Not Know for Months",The economy’s second-straight decline in output sparks debate—and the waiting game.
2022-08-02 10:18:00,BP Profit Surges on High Energy Prices,"The London-based company is the latest oil major to cash in on the highest energy prices in more than a decade, reporting strong second-quarter profit helped by fuel-making margins and oil trading."
2022-08-02 09:30:00,"Wildfire Season Is Now All Year, Forcing Businesses to Think Ahead","Every U.S. state but Delaware had wildfires last year, meaning that companies nationwide should take steps to mitigate the risk, experts said."
2022-08-02 11:42:00,"British Airways Halts Ticket Sales on Domestic, European Heathrow Routes",The airline said the move was aimed at accommodating customers needing to rebook travel because of flight cancellations at the airport.
2022-08-02 14:16:00,"Uber Revenue Doubles, Sending Shares Surging","The ride-hailing company’s revenue was partly boosted by high ride prices, triggered by a yearlong driver shortage in the U.S."
2022-08-02 15:46:00,"Oatly Lowers Full-Year Outlook, Posts Wider Loss",The oat-milk manufacturer said macro challenges make it harder to switch consumers from dairy.
2022-08-02 16:42:00,Marriott Says Travel Demand Is Resilient Amid Economic Jitters,"The hotel operator reported a roughly 70% jump in revenue to $5.34 billion, exceeding forecasts, in the latest sign Americans are shifting their spending from goods toward travel and services."
2022-08-02 16:01:00,Fed Official Says Economy Needs Rate Setting That Slows Economic Growth,Chicago Fed President Charles Evans is hopeful the central bank can dial down the magnitude of rate increases over the remainder of the year.
2022-08-02 16:24:00,Stephen King Testifies Against Publishing Merger,The bestselling writer is a government witness in the Justice Department case against Penguin Random House’s planned acquisition of Simon &amp; Schuster.
2022-08-02 16:38:00,Caterpillar Second-Quarter Sales Rise With Higher Prices for Machinery,Higher prices and increased sales helped to offset a continued drag from rising material and transportation costs on the company’s bottom line.
2022-08-02 14:00:00,College Affirmative Action Policies Backed by Major Companies,"Apple, General Motors and Lyft are among those urging the Supreme Court to affirm the practice."
2022-08-02 16:28:00,SoftBank Emerges as a Big Loser of the Tech Downturn. Again.,CEO Masayoshi Son pledged to curb his aggressive investment bets yet plunged into startups last year at the market top. He will have to engineer his next comeback without key lieutenants.
2022-08-02 17:22:00,West Virginia Reaches $400 Million Opioid Deal with Distributors,"The settlement reached with McKesson, AmerisourceBergen and Cardinal Health is the latest in a wave of others over the past year."
2022-08-02 15:41:00,Instagram Boss to Decamp to London to Expand Global Push,Adam Mosseri plans to work with the platform’s product team to attract more creators during a temporary stint at parent Meta Platform’s second-largest engineering hub.
2022-08-02 17:59:00,Rivian Says Senate Climate Deal Puts It at Disadvantage,"The electric-vehicle startup is warning that most of its vehicles would be ineligible for a $7,500 tax credit under the proposed changes."
2022-08-02 19:11:00,Equifax Sent Lenders Inaccurate Credit Scores on Millions of Consumers,"During a three-week period this year, the credit reporting company sent faulty scores to lenders big and small, resulting in higher interest rates and denied applications."
2022-08-02 18:07:00,British Airways Halts Ticket Sales on Some Heathrow Routes,The airline said the move to pause sales on all domestic and European routes from the airport was aimed at accommodating customers needing to rebook travel because of flight cancellations.
2022-08-02 17:22:00,West Virginia Reaches $400 Million Opioid Deal With Distributors,"The settlement reached with McKesson, AmerisourceBergen and Cardinal Health is the latest in a wave of others over the past year."
2022-08-02 15:09:00,Demand for Workers Falls to Lowest Level in Nine Months,"The Labor Department said there were 10.7 million job openings in June, the lowest level since September. Still, total job openings remained well above the number of available workers."
2022-08-02 22:20:00,Fed Officials Signal Additional Rate Rises Warranted,Chicago Fed President Charles Evans said he hoped the central bank would be able to moderate its rate increases over the remainder of the year.
2022-08-02 16:38:00,Caterpillar Second-Quarter Sales Rise With Higher Prices for Machinery,Higher prices and increased sales helped to offset a continued drag from rising material and transportation costs on the company’s bottom line.
2022-08-02 09:30:00,WeWork Joins Rush of Tech Companies Into Office Software,"Cisco, Honeywell and startups say their tech services help landlords and tenants adjust to the hybrid workplace."
2022-08-02 22:21:00,Airbnb Swings to Profit as Rentals Remain Strong Despite Inflation,A weaker-than-expected bookings outlook overshadowed otherwise strong results.
2022-08-02 23:32:00,Chip Maker AMD Prospers as Rival Intel Struggles,Sales surged at Advanced Micro Devices despite woes in the personal-computer market.
2022-08-02 20:12:00,"Electronic Arts Posts Higher Sales, Profit",The videogame company’s quarterly results topped expectations on the strength of soccer and racing games.
2022-08-02 23:46:00,Match Splits With Tinder CEO as Earnings Fall Short,"The online dating company’s new chief executive has shaken up the leadership of Match’s Tinder unit, citing product missteps as he seeks to boost growth."
2022-08-02 23:21:00,"Starbucks Hit by Higher Costs, but U.S. Demand Is Strong","The coffee giant said increased employee wages, training and costs for ingredients hurt its store-level profit."
2022-08-02 21:30:00,"Signify Health Considers Strategic Alternatives, Including a Sale",The healthcare-services company has a market value of more than $4 billion.
2022-08-02 16:28:00,SoftBank Is a Big Loser of the Tech Downturn. Again.,CEO Masayoshi Son pledged to curb his aggressive investment bets yet plunged into startups last year at the market top. He will have to engineer his next comeback without key lieutenants.
2022-08-02 19:11:00,Equifax Sent Lenders Wrong Credit Scores,"During a three-week period this year, the credit reporting company sent faulty scores to lenders big and small, resulting in higher interest rates and denied applications."
2022-08-03 09:30:00,CEOs Ditch the Warm Talk as Economy Cools,"The era of the kinder, gentler CEO is fading. As the economy worsens, corporate chiefs are bringing back blunt demands, performance reviews and the swag police."
2022-08-03 10:58:00,Tod's Founding Family to Take Luxury-Loafer Maker Private,The family behind luxury Italian shoemaker Tod’s said it plans to take the company private as part of an effort to boost growth at the maker of high-end loafers.
2022-08-03 11:03:00,"As Recession Risks Mount, Businesses Are Still Hiring",Demand for labor to make goods and provide services has so far remained well above the number of available workers despite a contracting economy.
2022-08-03 11:00:00,"Cost of Democrats' Corporate-Tax Increase Skews to Wealthy, Reaches Middle Class","Republicans and businesses, pushing back on Democrats’ bill, point to a wide-ranging burden of 15% minimum tax on large businesses."
2022-08-03 13:30:00,Moderna Profit Falls Amid Charges for Unused Covid Vaccines,"The biotechnology company’s quarterly revenue came in at $4.75 billion, driven almost entirely by sales of its messenger RNA-based vaccine. The results topped analyst expectations."
2022-08-03 13:09:00,Grubhub Parent Takes $3 Billion Write-Down on Food-Ordering Service,Just Eat said it was continuing to actively explore the partial or full sale of the U.S. business.
2022-08-03 12:26:00,Under Armour Lowers Profit Targets for Year,"Citing price markdowns and higher freight costs that it said would continue to weigh on its results, Under Armour lowered its profit targets for its fiscal year."
2022-08-03 13:31:00,New York Times Adds Digital Subscribers as Digital Advertising Declines,The news organization ended the second quarter with 8.4 million paid digital-only subscribers.
2022-08-03 15:29:00,Netflix Is Scrambling to Learn the Ad Business It Long Disdained,Reed Hastings insisted on focusing on subscriptions until competitors started nibbling away at his business model.
2022-08-03 14:58:00,"You're Back at the Office. Your Annoying Colleagues Are, Too.",Employees are rediscovering the pet peeves that come with working inches apart from one another
2022-08-03 17:54:00,"Boeing Defense Workers Accept Contract, Drop Strike Plan",The vote by workers at three of the company’s defense manufacturing plants follows their rejection of an earlier proposal last month.
2022-08-03 09:30:00,CEOs Ditch Kinder Approach as Economy Shows Signs of Chilling,"The era of the kinder, gentler CEO is fading. As the economy worsens, corporate chiefs are bringing back blunt demands, performance reviews and the swag police."
2022-08-03 19:26:00,Eli Lilly's Covid-19 Antibody Treatment to Be Sold Commercially,The Biden administration and drug maker are in talks to ensure bebtelovimab remains available to people without health insurance.
2022-08-03 17:54:00,"Boeing Defense Workers Accept New Contract, Drop Strike Plan",The vote by workers at three of the company’s defense manufacturing plants follows their rejection of an earlier proposal last month.
2022-08-03 19:47:00,Airbus Scraps Qatar Airways Jet Deal Amid Paint Spat,"The European plane maker has canceled the airline’s orders for 19 A350 wide-bodies, ending its business with the carrier."
2022-08-03 14:00:00,"Big Tech Is the West's Surprise Weapon in Competition With Russia, China","Amazon Web Services, Microsoft, Google and others face criticism at home over their influence in the marketplace and public square, but their role in Ukraine shows how they are becoming an asset in the West’s rivalry with Russia and China."
2022-08-03 11:03:00,"As Recession Risks Mount, Businesses Are Still Hiring",Demand for labor to make goods and provide services has so far remained well above the number of available workers despite a contracting economy.
2022-08-03 22:03:00,Walmart Lays Off Hundreds of Corporate Workers,The retailer is restructuring headquarters operations after warning of profit troubles last week as merchandise has piled up in its stores. Around 200 jobs are being cut.
2022-08-03 16:50:00,Moderna Profit Falls Amid Charges for Unused Covid Vaccines,"The biotechnology company’s quarterly revenue increases 9%, lifted by sales of its messenger-RNA-based vaccine."
2022-08-03 23:41:00,EV Maker Lucid Cuts Production Outlook in Half,The luxury sedan maker cites supply-chain and logistical challenges as well as internal bottlenecks for lower output projection.
2022-08-03 21:03:00,"Russian Oil Cap Push Faces Doubts From Energy, Finance Industry","Biden administration officials, meeting with businesses about the strategy, have faced hard questions about the plan’s feasibility."
2022-08-03 20:43:00,What Twitter Subpoenas to Elon Musk's Inner Circle Could Yield,"The social-media company’s legal team is seeking communications from the Tesla CEO’s financial backers, investors and friends."
2022-08-03 20:49:00,Warner Bros. Scraps 'Batgirl' and Other Films Amid Broader Cost-Cutting Effort,New management at Warner Bros. Discovery plans to overhaul the company’s distribution strategy for movies.
2022-08-03 22:41:00,"Inflation and Rising Rates Knock Results at Allstate, MetLife",Allstate CEO says the company’s ad spending will decline as the insurer seeks to increase premium rates and limit sales in some states.
2022-08-04 02:40:00,'Days of Our Lives' Leaves NBC for Peacock,"The long-running daytime soap opera, which has aired on NBC’s broadcast network since 1965, will exclusively stream on Peacock starting Sept. 12."
2022-08-04 07:36:00,"Toyota Profit Takes Hit From Supply-Chain Troubles, Higher Costs",But the auto maker sees production recovering as semiconductor shortages ease.
2022-08-03 23:26:00,Alex Jones Testifies That Sandy Hook Judgment Could Doom His Media Empire,The founder of Infowars was found liable for speculating that the 2012 elementary school shooting was a hoax.
2022-08-04 10:14:00,Glencore Profit Doubles on Energy-Market Volatility,"The commodities giant said profit more than doubled in the first six months of the year, boosted by significant market volatility stirred up by macroeconomic and geopolitical events—a theme it expects to continue for markets through the rest of 2022."
2022-08-04 09:30:00,Tesla Shareholders Expected to Clear Path to 3-for-1 Stock Split,The electric-vehicle make has said the stock split is designed to make ownership more accessible to employees and individual investors.
2022-08-04 12:20:00,Bank of England Makes Biggest Rate Rise Since 1995,"The U.K. central bank raised its key interest rate by a half percentage point, the largest single step in more than a quarter-century, as it follows the Federal Reserve in giving priority to the fight against inflation over the risk of hurting growth."
2022-08-03 22:53:00,"Brazil's Central Bank Raises Selic Lending Rate to 13.75%, Considers Increase in September","Brazil’s central bank raised its benchmark interest rate as expected Wednesday, the 12th consecutive time, and said it would consider another rate increase at its next meeting in September."
2022-08-04 13:00:00,Las Vegas Casinos Are Booming,"Whatever jitters they might have about a potential recession, people are flocking to the entertainment and gambling oasis."
2022-08-04 14:06:00,Wayfair's Sales Drop as It Loses Customers,"Online furniture seller Wayfair posted broad declines in its business, the latest sign of its struggle to reignite consumer interest coming out of the pandemic."
2022-08-04 12:18:00,Alibaba Posts First Revenue Drop Since Going Public,"The company blamed China’s Covid outbreak for the slim drop, saying its main domestic e-commerce business was hit by pandemic-related supply chain and logistics disruptions in April and May."
2022-08-04 13:12:00,Jobless Claims Rose Last Week to Near High for Year,"Initial jobless claims increased slightly to a seasonally adjusted 260,000 last week, close to the 2022 peak set earlier in July."
2022-08-04 09:30:00,"The Beatles, Beyoncé and How to Be Creative Today",What we can learn about collaboration and remote work from two pandemic hits.
2022-08-04 12:09:00,"Paramount Revenue Rose 19% on 'Top Gun,' Streaming Service",The media company said that movie and direct-to-consumer revenue both doubled in the second quarter.
2022-08-04 15:53:00,Demand for U.S. Energy Exports Narrowed June's Trade Deficit,"The trade gap shrank 6.2% to $79.6 billion, as a rise in shipments of energy products pushed up exports, while cooling consumer appetite weighed on imports."
2022-08-03 11:00:00,"Cost of Democrats' Corporate-Tax Increase Skews to Wealthy, Reaches Middle Class","Republicans and businesses, pushing back on Democrats’ bill, point to a wide-ranging burden of 15% minimum tax on large businesses."
2022-08-04 16:46:00,Eli Lilly Revenue Falls on Lower Covid Treatment Sales,The pharmaceutical company cut its profit outlook for the year as the stronger U.S. dollar impacts results.
2022-08-04 16:44:00,Kellogg Lifts Outlook After Quarterly Sales Rise,The food company said consumer demand held up despite raising its prices in recent months.
2022-08-04 20:18:00,Goldman Sachs Credit-Card Practices Under Investigation,"The bank said regulators are looking at several areas, including how it handles customer refunds and resolves billing disputes."
2022-08-04 17:02:00,"Mortgage Rates Hit 4.99%, Dropping Below 5% for First Time Since April",Rates have fallen swiftly from their 13-year high of 5.81% in June.
2022-08-04 20:52:00,"Paramount Revenue Gets Lift From 'Top Gun' Sequel, Streaming Service",‘The Lost City’ and ‘Sonic the Hedgehog 2’ helped drive strong film results in the latest quarter.
2022-08-04 22:44:00,Warner Bros. Discovery Weighs Free Ad-Supported Streaming Plan,The move is the latest effort by a streaming giant to reach a broader audience as the competition for users intensifies.
2022-08-04 22:01:00,Lyft Belt-Tightening Aids Second-Quarter Results,The ride-hailing company says the supply of available drivers is improving after a prolonged shortage.
2022-08-04 23:42:00,TikTok Pares Pandemic-Era Perks in Return to Office Push,Some locations are strained as thousands of new workers look for work stations and parking spaces.
2022-08-04 22:04:00,Twitter Rebuts Musk's Assertion That He Was Hoodwinked,"The social-media company filed its response to the billionaire’s countersuit, providing a glimpse of his case for walking away from a $44 billion takeover."
2022-08-04 15:23:00,Jobless Claims Rose Last Week to Near High for Year,"Initial jobless claims increased slightly to a seasonally adjusted 260,000 last week, close to the 2022 peak set earlier in July."
2022-08-04 22:52:00,Elon Musk Suggests Big Tesla Factory Expansion Plans,"The electric-vehicle maker, which is striving to sell 20 million vehicles annually, could ultimately build 10 or 12 factories, its CEO says."
