DATE,TITLE,SUMMARY
2023-07-19 19:14:46,‘Barbie’ director Greta Gerwig has worried about negotiating: ‘I don’t want to ask for too much’,"Even for hit Hollywood film directors like Greta Gerwig, negotiating a salary can be a daunting and uncomfortable process."
2023-07-19 18:36:33,$1 billion Powerball jackpot is up for grabs. Here’s what the winner could owe in taxes,The Powerball jackpot has grown to an estimated $1 billion. Here's what the winner can expect to pay in taxes.
2023-07-20 15:42:41,Harvard psychologist: The 'common enemy effect' may explain why Elon Musk's declining popularity could benefit Mark Zuckerberg,"Could Elon Musk's declining popularity, and something psychologists call the ""common enemy effect,"" provide a boon to rival Mark Zuckerberg's business?"
2023-07-20 15:02:45,Winning ticket for Powerball’s $1.08 billion jackpot sold in California — here’s how much the winner will owe in taxes,"The Powerball winner will face a 24% federal tax withholding, but that won't cover the entire tax bill."
2023-07-20 13:30:15,Mark Cuban on the biggest career regret from his 20s—what he'd change if he could 'do it again',"Mark Cuban, the billionaire owner of the Dallas Mavericks, says his early-career impostor syndrome often led him to talk too much in business meetings."
2023-07-21 18:46:12,This lesser-known 401(k) plan change will soon strip higher earners of a tax break,There's a 401(k) catch-up contribution change coming for higher earners in 2024. Here's what older retirement savers need to know.
2023-07-21 14:13:48,Barbara Corcoran: This is the No. 1 quality that all ‘worthwhile employees’ share,Not everyone wants to go the extra mile at work. But Barbara Corcoran says doing more than you're asked is the key to success.
2023-07-21 12:45:01,"Mark Cuban says his 13-year-old son is a 'little mini-me,' selling candy at school: 'He's hustling'","Billionaire ""Shark Tank"" star Mark Cuban's teen son creates spreadsheets to track his candy sales. ""He's hustling and selling stuff all the time,"" Cuban says."
2023-07-23 13:45:01,Mark Cuban says this is the No. 1 biggest time waster: ‘It kills so much time',"Cuban doesn't have much time to waste as a billionaire investor, Dallas Mavericks owner, ""Shark Tank"" personality, author and father of three."
2023-07-24 03:52:50,China to resume 15-day visa-free entry for citizens of Singapore and Brunei,"China will reinstate its 15-day visa-free entry for citizens of Singapore and Brunei from July 26, according to the embassies of both countries."
2023-07-24 18:38:43,"IRS halts most unannounced visits to taxpayers, citing safety concerns",The IRS has ended most unannounced visits to homes or businesses for unpaid taxes. Here's what taxpayers need to know.
2023-07-25 20:18:56,LVMH earnings suggest luxury spending is suddenly slowing in the U.S.,"LVMH sales rose in Asia and Europe, but the luxury goods company struggled in the U.S. during the second quarter."
2023-07-25 20:38:41,"Elon Musk's rebrand of Twitter to 'X' could get him in legal trouble with Mark Zuckerberg and Microsoft, experts say","Elon Musk's Twitter rebrand is legally risky, experts say: Meta, Microsoft and multiple other companies already own trademarks to ""X"" as a name."
2023-07-25 20:42:04,"Despite interest rate hikes, nearly 70% of middle-income Americans haven't switched to higher-yield savings","Despite inflation concerns, nearly 70% of middle-income Americans still haven't moved savings to higher-yielding accounts, a new survey found."
2023-07-25 15:32:56,Senate panel probes billionaire Leon Black's $158 million in payments to Jeffrey Epstein,The Senate Finance Committee revealed an investigation into Apollo Global Management co-founder Leon Black's ties to Jeffrey Epstein.
2023-07-26 07:54:54,What happened to the Chinese travel boom everyone was waiting for? It stayed in China,"Rather than a boom, the recovery of international travel in China is likely to be spread out over 2023 and 2024, says Mastercard economist David Mann."
2023-07-27 04:24:45,I'm a solo female traveler from Europe. Here's why I chose to go to Vietnam,"Vietnam has great weather, interesting culture, fantastic food and friendly people — and it's a place with plenty to see in a week."
2023-07-26 18:37:29,New bill aims to help low-income Americans with disabilities build emergency savings through a federal match,Disabled Americans face obstacles to building wealth. A new bill aims to help low-income disabled individuals save through a federal match in ABLE accounts.
2023-07-26 17:14:42,Mega Millions jackpot hits $910 million. Here's the tax bill if you win,The Mega Millions jackpot has grown to $910 million. Here's what the winner can expect to pay in taxes.
2023-07-27 18:03:22,Treasury bills are still paying above 5%. Here's what to know before buying,Treasury bill yields are still well above 5% following another interest rate hike from the Federal Reserve. Here's what investors need to know.
2023-07-27 21:24:31,You may be overlooking an important point about target-date funds,Target-date funds have become the most popular 401(k) investments. But differences in stock and bond allocations mean they might not be right for everyone.
2023-07-28 18:32:01,"Mega Millions jackpot hits $940 million. If you win, here's the tax bill",The Mega Millions jackpot jumped to $940 million Friday. Here's what to expect for the tax bill if you win.
2023-07-28 14:56:51,"As interest rates, inventory issues keep car costs high, what drivers are doing to make ownership possible","The average monthly auto payment reached $733, a new record, in the second quarter of the year. Some drivers are extending repayment or putting off purchases."
2023-07-29 13:00:01,"37% of baby boomers have more stock exposure than they should, Fidelity says. These 4 tips can help","Even in retirement, investors should have exposure to stocks, experts say. But the question they must ask: How much is enough?"
2023-07-30 13:00:01,House lawmakers scrutinize pandemic-era small business tax break expert calls 'fraught with fraud',Scrutiny of a pandemic-era tax credit intensified this week for the employee retention tax credit. Here's what it means for small businesses.
2023-07-31 17:56:26,Mega Millions jackpot hits $1.05 billion. Here's the possible tax bill for the winner,The Mega Millions jackpot has soared above $1 billion for the fifth time in history. Here's the expected tax bill if you win.
2023-08-01 20:12:13,Joe Biden says he'd fire employees who don't take personal time off: It's 'a hell of a lot more important' than your job,"President Joe Biden takes personal time off seriously, saying he'd even consider firing staffers who sacrificed personal health and wellbeing for their job."
2023-08-01 20:21:57,The 5 U.S. metro areas with the highest single-family rents — 3 are in California,Americans are still feeling the pinch from the high costs of single-family rentals. But experts say there may be hidden costs of moving.
2023-08-01 23:25:02,"Barbara Corcoran used this tactic to buy a $800,000 luxury trailer in California that wasn't for sale","In a video tour with Caleb Simpson, Barbara Corcoran explained how she bought a double-wide trailer that wasn't for sale."
2023-08-01 12:00:01,Retirement account balances have increased substantially for high-income households. These factors help explain why,There's a growing discrepancy between retirement balances for high- and low-income workers. New research finds some less obvious factors contribute to that gap.
2023-08-02 13:49:21,Ferrari raises guidance after profit jumps as more customers personalize their sports cars,"Ferrari has greatly extended its options lists, offering its customers a huge range of choices in paint finishes, interior materials and other details."
2023-08-03 02:50:30,"Burned by the European heat, travelers are seeking new destinations this summer","Summer travel interest is shifting as European travelers seek cooler weather in parts of Scandinavia, Scotland, Latvia, Estonia and northern Spain."
2023-08-02 19:50:02,IRS unveils 'paperless processing initiative' for taxpayers. Here’s what to expect,"The IRS will offer digital correspondence for the 2024 season and aims to provide ""paperless processing"" for tax returns in 2025. Here's what to know."
2023-08-02 16:51:03,Terry Crews: 'I would have made more money at McDonald's' than I did in the NFL,Terry Crews says he only made $150 per week during a six-month stint of his professional football career. Here's how he survived before his big acting break.
2023-08-04 00:33:27,A new luxury hotel is opening near Singapore — but you'll need a boat to reach it,ONE°15 Marina Nirup Island joins other private islands that have opened in Indonesia's Riau Island. A Westin hotel is scheduled to open in late 2024.
2023-08-03 20:44:31,Mega Millions jackpot hits $1.25 billion. Here’s how it benefits the government,The Mega Millions jackpot has grown to an estimated $1.25 billion. Here's how the lottery benefits the government.
2023-08-03 19:06:50,Bill Gates used to think this habit was lazy and 'unnecessary'—now it's his No. 1 key for a healthy brain,"Bill Gates used to consider sleep ""unnecessary"" and lazy. Now, it's a non-negotiable part of his daily health routine, he says — here's why."
2023-08-03 18:21:30,Couples leverage 'something borrowed' to cut wedding costs,"The average cost for a wedding has increased to $30,000, but brides are being more savvy with their budgets and renting items instead of purchasing them."
2023-08-03 17:54:26,Secondhand luxury watch prices slump to near two-year low after a pandemic run,Experts had warned that a bubble could burst along with cryptocurrency and other trendy pandemic booms. But the recent declines appear to mark a stabilization.
2023-08-04 09:44:30,How interest rates impact your money — from savings to mortgages,"Interest rates may seem abstract, but they affect everyone. CNBC Make It examines the role they play in your finances."
2023-08-04 19:59:14,Why Mark Cuban doesn't own yachts or hire house cleaners: 'I try to be the same person I was when I was poor',"Mark Cuban may be a multi-billionaire, but he doesn't have chauffeurs, butlers or a fancy yacht. Here's why."
2023-08-04 21:17:40,Money market funds are paying above 5%. What to know before ditching your savings account,Money market funds are now paying above 5%. Here's what to know before transferring cash from a savings account.
2023-08-07 00:18:36,A market slaughtering dogs was a top tourist attraction. Then a video was leaked,The sale of dog and cat meat is now banned at Indonesia's Tomohon Extreme Market — a live animal market named for the brutal practices that occurred there.
2023-08-08 06:46:02,Champagne sales are booming. But its taste could soon change forever — thanks to climate change,Europe's soaring temperatures and increasingly volatile weather are sparking fears that France's Champagne region could become unsuitable for its production.
2023-08-07 19:02:58,The Mega Millions jackpot hits $1.55 billion. What's the best payout option? Experts weigh lump sum vs. annuity,The Mega Millions jackpot is up to $1.55 billion. Here's how to decide between the lump sum or annuity payout option.
2023-08-08 19:30:37,Soft landing vs. mild recession: What advisors are telling their clients about the economy,"After more than a year of gloomy forecasts for the U.S. economy, some experts have backed off recession predictions. Here's what financial advisors say."
2023-08-08 15:51:19,"This toxic mindset can cost you ‘tens of thousands of dollars,' says psychologist—how to avoid it","Self-worth issues can affect your long-term wealth, says psychologist and podcast host Dr. Adia Gooden. Here is how to avoid those costly mistakes."
2023-08-09 16:32:34,These 2 states offer unemployment benefits to workers on strike,Workers who go on strike generally don't qualify for unemployment benefits. But two states — New York and New Jersey — are the exception to that rule.
2023-08-10 04:01:01,"The average Manhattan rent just hit a new record of $5,588 a month","Rents in Manhattan hit a new high in July, as higher interest rates and low supply continued to drive up prices."
2023-08-10 00:28:43,Cat-sitting to save on travel costs? I looked after 5 and got a free place in Spain for two weeks,"Cat-sitting in Mallorca, Spain, allowed me to live like a local, exploring the island's beaches, mountains and food. I even borrowed the cat-owner's car."
2023-08-09 17:57:06,"Winner of record $1.6 billion-plus Mega Millions jackpot should watch out for these pitfalls, experts warn","There’s a winner for the $1.6 billion-plus Mega Millions jackpot, and all six numbers matched a ticket sold in Florida. Experts cover possible pitfalls."
2023-08-11 00:14:01,"$1,850 a day? What it costs to visit the 10 most expensive vacation destinations in the world","The Caribbean island of St. Barts is the world's most expensive place to visit, according to a ranking of average travel costs in 100 popular vacation spots."
2023-08-10 19:14:04,Luxury NYC buildings woo residents with coworking spaces as remote work lingers,"Tenants are increasingly looking for a ""third space"" where they can work away from both home and the office but are still close by."
2023-08-10 19:36:49,Here are ways to adjust your portfolio as some experts predict a soft landing for the economy,Some experts are now expecting a soft landing for the economy rather than a mild recession. Here's how advisors are adjusting portfolios.
2023-08-10 17:08:13,Mark Cuban nearly went broke at age 27—and became a millionaire 5 years later,"Mark Cuban says he lost nearly all his cash while running his first company, after his secretary stole $82,000 from a corporate bank account. Here's how he rebounded."
2023-08-10 16:36:11,"Here's the inflation breakdown for July, in one chart","The consumer price index rose 3.2% in July from 12 months earlier, slightly less than expected."
2023-08-10 21:13:14,"Don't sabotage yourself with this common but toxic mindset, says psychologist: It can cost you 'tens of thousands of dollars'","Self-worth issues can affect your long-term wealth, says psychologist and podcast host Dr. Adia Gooden. Here is how to avoid those costly mistakes."
2023-08-11 16:58:49,How to maximize Series I bond redemptions amid falling inflation,"Some investors are wondering when to sell Series I bonds amid falling inflation. Here's how to maximize interest, according to experts."
2023-08-12 12:30:01,Shoppers embrace 'girl math' to justify luxury purchases — here's how it works,Cash-strapped consumers can justify their luxury purchases with TikTok's latest trend: 'girl math.'
2023-08-13 13:00:01,Mark Cuban: 'Success isn’t necessarily how much money you have'—here's how he defines it,"Mark Cuban says success isn't about how much money you have in the bank — it's about how happy you are in life, and the two aren't always connected. Here's why."
2023-08-14 00:16:24,Chances are you haven’t used A.I. to plan a vacation. That’s about to change,Some 40% of travelers aren't interested in using artificial intelligence to plan their trips. But it's coming anyway.
2023-08-14 20:15:14,How to help the victims of the Maui wildfires,Thousands of Hawaii residents have been displaced by the worst U.S. wildfire in over 100 years. Here are some resources for those who want to help.
2023-08-14 18:19:47,"Don’t be ‘complacent’ about volatility, warns advisor, even if there's a soft landing for the economy","Even if there's a soft landing for the economy, investors should still prepare for more stock market volatility, one advisor says."
2023-08-15 18:12:31,Will Smith: The No. 1 one thing you can't build a successful career without—you may already have it,"Oscar-winning actor Will Smith says you need a strong support system to become highly successful. Here's why, and who you should have on your team."
2023-08-15 21:22:04,Self-made millionaire: I copied these 5 rich people habits to earn my first $1 million,"Inspired by his rich basketball coaches, Alan Corey copies their habits to build his own wealth. Now he's a self-made millionaire running his own businesses. Here's how he made his first $1 million."
2023-08-16 15:19:53,CEO built her $96 million company with a simple 2-word lesson: It's 'the most powerful thing you can do',"Jennifer Hyman learned the one of the most important lessons of her career as a 22-year-old intern — and used the strategy to start Rent the Runway, she says."
2023-08-16 12:30:02,How to leverage 0% capital gains with this lesser-known tax strategy,"If you're sitting on profitable investments, you may consider tax-gain harvesting to rebalance your portfolio or save on future taxes."
2023-08-16 13:47:50,"Look inside the $44.5 million Tuscan-style mega villa perched 2,000 feet above Malibu","""If you have a God complex, this is the house for you,"" says the listing agent for the estate."
2023-08-18 17:43:46,4 places to keep your cash as the Federal Reserve weighs a policy shift,"As the next policy move from the Federal Reserve remains unclear, here are four of the best options for your cash."
2023-08-19 13:00:01,"Mark Cuban passed on an early Uber investment—his $250,000 would be worth $2.3 billion today: ‘Whoops’","Mark Cuban's net worth is estimated at more than $5 billion. It could have been even higher, if he hadn't passed on investing in Uber in 2009, he said."
2023-08-21 00:20:52,I was charged ‘junk fees’ by a New York City hotel. Here’s what happened next,"Junk fees, resort fees, destination fees. Whatever you call them, mandatory hotel fees are on the rise, with new lawsuits and legislation aimed at reining them in."
2023-08-20 13:00:02,Bill Gates thought school wasn't 'interesting' as a child—until a conversation with his 8th grade teacher,"When it came to school, Microsoft co-founder Bill Gates used to think ""the less effort you put in, the cooler you were,"" he says. Here's what changed his mind."
2023-08-20 12:30:01,"Lawmakers weigh tax rule 'backslide' for Venmo, PayPal users, says analyst. What it means for you","Some lawmakers want to increase the tax-reporting thresholds for Form 1099-K, which covers payments from companies such as Venmo or PayPal. Here's what to know."
2023-08-21 20:21:11,"The most expensive cars sold at Pebble Beach, even amid disappointing auctions",A $30 million Ferrari led the parade of trophy cars sold during Monterey Car Week last week.
2023-08-21 18:47:55,Barbara Corcoran: A $320 coat was the 'best investment I ever made' at age 23—'it changed my life',"To get the part, you have to look the part, says real estate entrepreneur and investor Barbara Corcoran. A $320 coat helped her learn the lesson at a young age."
2023-08-23 02:29:52,More single moms are taking long trips abroad with the kids — here's how they do it,"More single parents are taking extended vacations overseas, with trips designed to keep the kids busy while they work."
2023-08-22 16:08:11,"Your student debt could win you up to 100,000 airline miles through Frontier Airlines","One hundred lucky winners will receive up to 100,000 Frontier Airline miles through a recently announced sweepstakes."
2023-08-22 17:31:18,A 39-year-old 'frugal' self-made millionaire shares 4 books that helped him get rich young,Self-made millionaire and Parent Portfolio co-founder Jonathan Sanchez shares the four best books that helped him get rich and build passive income streams.
2023-08-22 15:48:12,"Even millionaires are feeling financially insecure, report finds","These days, only 12% of Americans consider themselves wealthy, including just 29% of millionaires. Some go so far as to say they’re poor."
2023-08-22 16:01:54,"Ferrari CEO says nearly a third of new buyers are under 40, even as wait lists grow","Benedetto Vigna said that despite limited supply, the company continues to expand its reach among younger, new clients."
2023-08-23 18:56:34,These are the key tax policy issues to watch for during the first GOP presidential debate,Here are some of the key tax policy issues experts are watching for at the first Republican presidential debate on Wednesday.
2023-08-23 14:44:33,Mark Cuban says his kids see downsides to his wealth: 'It sets an expectation’,Billionaire entrepreneur Mark Cuban says his kids are aware that people see them differently because of his wealth. Here's what he does to keep them humble.
2023-08-24 19:39:26,"There's no 'free lunch' with high-interest cash options, advisor says. How to plan for taxes","Savers are now getting higher cash yields after interest rate hikes. But taxes on those earnings could be a surprise, experts say. Here's how to prepare."
2023-08-24 16:01:35,Barbara Corcoran says this is the No. 1 mistake new home buyers can easily avoid: 'Go back for another look',Corcoran has over 40 years of experience in the real estate business and says this is the most common mistake people make when buying their first home.
2023-08-25 13:32:54,Watches of Switzerland shares plunge by a quarter after Rolex buys retailer Bucherer,The Watches of Switzerland Group lost a quarter of its value on Friday after luxury watchmaker Rolex announced a deal to buy watch retailer Bucherer.
2023-08-25 08:38:46,"Dubai luxury home prices soar by almost 50%, with Tokyo's up 26%. Here's where other cities stand","Taking second and third places were Tokyo, which saw an annual 26.2% rise, and Manila, which climbed 19.9%."
2023-08-27 23:01:36,"Your boarding pass and weight, please: Why airlines are asking passengers to step on the scales","Airlines weigh passengers in the name of safety and fuel efficiency, often because it's required by law. But whether it's necessary depends on who you ask."
2023-08-29 04:42:27,How much do weddings cost? This one in Las Vegas is just $15,"What does a $15 wedding get you? A ceremony, photos, flowers and a live broadcast from a Las Vegas chapel so your friends and family can watch from home."
2023-08-28 20:29:20,IRS delays change for 401(k) catch-up contributions. Here's what higher earners need to know,"The IRS has delayed the ""Secure 2.0"" change for 401(k) catch-up contributions. Here's what higher earners need to know."
2023-08-29 17:35:55,Treasury proposes crypto reporting rule to 'close the tax gap.' What it means for investors,The IRS on Friday unveiled proposed regulations for tax reporting for cryptocurrency and other digital assets. Here's what it means for investors.
2023-08-29 20:38:48,Bill Gates: This is the major contributor to climate change that people are 'probably least aware of’—It's 'a challenge’,"Bill Gates discussed the importance of plant-based meat alternatives with Ahmir ""Questlove"" Thompson on the latest episode of his podcast, ""Unconfuse Me."""
2023-08-31 14:15:26,This is the No. 1 trait you need to be more successful than most—Mark Cuban learned it by age 12,Mark Cuban said his mother taught him how to be confident through dancing. Experts say you need that self-assurance to be successful in the workplace.
2023-09-01 18:40:17,SEC delays decision on spot bitcoin exchange-traded funds. What that means for investors,Regulators have delayed a decision on the first spot bitcoin exchange-traded funds. Here's what investors need to know before purchasing.
2023-09-01 15:29:33,Powerball's jackpot rises to $420 million—here's the after-tax payout for every U.S. state,"State taxes might reduce your winnings by tens of millions of dollars, depending on where you live."
2023-09-01 12:30:01,Here are 3 costly financial surprises for first-time homebuyers — and how to prepare for them,"If you're a first-time homebuyer, experts say it's critical to prepare for hidden expenses. Here are three of the costliest ones."
2023-09-01 09:02:11,Chinese smartphone maker teases a foldable smartphone that you can wear like a purse,The Honor V Purse is a smartphone that folds outward with a top strip that contains the camera. Customizable straps can be attached to the device.
2023-09-03 23:15:17,A new hotel trend that puts you to sleep — literally,"From beds that use artificial intelligence to on-call hypnotherapists, more hotels are luring travelers in by promising a good night's sleep."
2023-09-06 15:06:13,Economist: This is the No. 1 best and worst money I ever spent,"Laurence J. Kotlikoff, bestselling author and Harvard-trained economist, shares the best and worst money he ever spent."
2023-09-06 05:09:39,"There are just six bitcoin billionaires in the world, new crypto super-rich report says","Hundreds of millions of people have crypto investments, but only few of them have holdings worth more than $1 million, a new survey shows."
2023-09-07 02:10:11,"Wall, what wall? Two detained after leveling part of China's Great Wall","In an apparent attempt to create a shortcut, two people working in Shanxi province allegedly used machinery to remove a section of the Great Wall of China."
2023-09-08 04:44:34,Asia's ultra-rich population records largest drop in the world. Here's how North America and Europe did,"Asia's ultra-high net worth population declined about 10.9% in 2022, marking the largest fall in the world, a recent report by Altrata showed."
2023-09-08 01:07:16,Where to stay in India? Here are 8 former palaces that are now hotels,"After the government abolished payments to the country's Maharajas in 1971, some palace owners opened their doors to paying hotel customers."
2023-09-07 19:01:00,Airbnb CEO shares the No. 1 thing people get wrong about success: I thought 'everything in my life would be fixed',"Brian Chesky thought helping Airbnb succeed would mean ""everything in my life would be fixed,"" he says. Instead, he felt more isolated than ever — here's why."
