DATE,TITLE,SUMMARY
2023-05-26 14:33:43,"30-year-old started his business with a website, sewing kit and Pizza Hut salary—now he's a billionaire","When Ben Francis co-launched Gymshark from his parents' garage, he was 19, worked for Pizza Hut and didn't know how to sew. Here's how he became a billionaire."
2023-05-27 13:30:01,Mark Cuban says Twitter's new algorithms are designed to help one man only: Elon Musk,"Elon Musk responds to Mark Cuban's frustrations about Twitter's algorithm, but the spat isn't over. Now Cuban is raising a new issue about the timeline."
2023-05-27 13:09:09,3 investing tips as the federal debt ceiling 'X-date' approaches,"Many investors are bracing for economic fallout as the federal debt ceiling ""X-date"" deadline approaches. Here's how to invest, according to advisors."
2023-05-29 03:38:53,The biggest money mistakes that could change your future — and how to get ahead of them right now,Financial experts share their tips on how to reverse and prevent money mistakes — both big and small.
2023-05-30 18:57:06,Proposed debt ceiling deal would cut part of $80 billion IRS funding,The proposed debt ceiling deal may include up to $21.4 billion in IRS budget cuts. Here's what it means for taxpayers.
2023-05-31 12:00:01,New study pegs the median age of the world's billionaires at 67,"While tech wunderkinds and music and sports celebrities may get the most attention, the world's billionaires are largely aging entrepreneurs."
2023-06-01 05:13:19,Elon Musk is the world's richest person again,"Tesla CEO Elon Musk is the world's richest person again, after shares of the U.S. electric carmaker rose 26% in the past month."
2023-06-02 05:38:26,"When to teach kids about money, according to the experts — and how to do it","Knowing when to start teaching to kids about money and identifying what money skills they need can be tricky, but experts say it is crucial for their futures."
2023-06-01 19:31:06,Here's how to buy Treasury bills as yields top 5%,Treasury bill yields have climbed over the past few months and currently top 5%. Here's what investors need to know before purchasing.
2023-06-02 15:58:59,"Why wealthy Americans love UBS, the secretive Swiss banking giant","UBS's wealth management division has attracted wealthy foreign clients, due in part to strong Swiss secrecy laws."
2023-06-02 13:00:01,How to manage a big retirement risk amid health-care inflation,"Retirees need to protect investments from the ""sequence of returns risk."" Here's how health-care inflation can make it worse."
2023-06-02 15:47:31,"Billionaire Tom Siebel faces tumult at C3.ai as investor lawsuit, short sellers question metrics","Tom Siebel, who became a billionaire after selling Siebel Systems to Oracle in 2006, now faces a investor lawsuit and short sellers at AI software vendor C3.ai."
2023-06-03 13:00:01,Barack Obama shares his No. 1 piece of advice for his own daughters: Don't let your hunger for success ruin your happiness,"Having a successful career is important to most people, but it shouldn't be a substitute for family and friendship, says former U.S. president Barack Obama."
2023-06-04 12:30:01,"Borrowers brace for student loan bills to resume — '$600 a month, where is that going to come from?'",The more than three-year-long pause on federal student loan payments is slated to finally conclude within months. Consumer advocates and borrowers are worried.
2023-06-05 14:37:49,"Universal basic income of nearly $2,000 a month to be trialed in England for the first time","Plans for a universal basic income trial have just been published in the U.K., and could see people receive no-strings-attached cash for the next two years."
2023-06-06 13:34:05,These lesser-known tax tips may help college-bound families,"College is a major expense for many families, but a payment strategy can provide significant tax savings, according to a college funding expert."
2023-06-06 12:00:01,"Swimply, the rental company of home pools, adds pickleball courts to its offerings",Swimply is expanding beyond offering rentals of private pools to include pickleball courts as demand for space grows along with the sport.
2023-06-07 13:30:01,"Millionaires see market volatility, inflation among biggest threats to wealth, CNBC survey finds","CNBC's latest millionaire survey reveals the biggest threats to personal wealth. Here are the best ways to protect from these risks, according to experts."
2023-06-07 14:24:27,"Here are tax-savvy ways to donate money, according to a charitable giving expert","If you're planning to donate money, certain charitable giving moves provide a bigger tax benefit. Here's what investors need to know."
2023-06-07 12:29:44,"Millionaires favor DeSantis in Republican presidential primary, but support for Trump grows","Republican millionaires are souring on Gov. Ron DeSantis and more often supporting Donald Trump, a sign of possible shifting winds among donors."
2023-06-07 12:28:41,"Millionaires are hoarding cash, betting on higher rates, CNBC survey says","Wealthy investors are still cautious on the stock market, but not as bearish as they were at the start of the year."
2023-06-08 14:46:49,"IRS still has a sizable backlog of returns despite improvements, taxpayer advocate says","Despite improvements, the IRS still has a sizeable backlog of tax returns, according to Erin Collins, the country's national taxpayer advocate."
2023-06-08 03:18:52,It’s now cheaper for travelers to go to Bhutan — if they stay long enough,"Travelers who visit Bhutan for at least five nights won't have to pay the full amount for the country's daily $200 tourist tax, or Sustainable Development Fee."
2023-06-09 00:24:25,Train review: What it’s like to ride the Venice Simplon-Orient-Express,"Paying $2,000 for a hotel room is pricey, but an overnight ride on the historic Venice Simplon-Orient-Express trains costs about as much —  per square meter."
2023-06-09 13:34:01,One of America's richest self-made women quit her job to cook edibles—now her net worth is $225 million,"Nancy Whiteman left her consulting job to start an edible cannabis company. Now she's one of America's richest self-made women, with a net worth of $225 million."
2023-06-09 15:52:22,"This one-time strategy can waive IRS tax penalties. 'It’s like a get out of jail free card,' expert says","This lesser-known first-time penalty abatement may waive IRS fees in certain situations, tax pros say. Here's how to qualify."
2023-06-10 13:00:01,"At a time when most Americans are living paycheck to paycheck, the 'quiet luxury' trend takes over","Buoyed by Gwyneth Paltrow's courtroom wardrobe and HBO's final season of ""Succession,"" the look of ""quiet luxury"" has quickly caught on."
2023-06-12 02:21:43,George Soros hands control of his $25 billion empire to his son Alex,"The older Soros, often targeted by right-wing conspiracists, has been one of the U.S. Democratic Party's largest donors."
2023-06-12 20:05:08,"The rich often misjudge the potency of their retirement savings, report finds","Relative to other income groups, high earners tend to think they're on track for retirement when they're actually not, a new study found."
2023-06-13 15:55:15,NHL's Ottawa Senators reach deal with Toronto billionaire Michael Andlauer for record price,Toronto billionaire Michal Andlauer has agreed to acquire the NHL's Ottawa Senators.
2023-06-13 14:52:13,Mark Cuban says this is the No. 1 piece of advice he wishes he'd received in his 30s,Billionaire entrepreneur and investor Mark Cuban says he regrets the way he used to treat people. Here's why — and the advice that could've helped him fix it.
2023-06-13 16:00:47,"What does it take to be wealthy? Well-being is a more important measure than money or assets, survey finds","A new Charles Schwab survey finds well-being, not money, has become the leading measure of wealth for most adults today."
2023-06-13 04:21:38,The ‘breakout travel trend’ of the decade: What to know about expedition cruising,"Expedition cruises are often smaller, focus on less-visited or harder to reach destinations, and have onboard specialists to educate passengers."
2023-06-13 19:01:35,IRS: Meet this June 15 deadline to 'avoid a surprise at tax time',"The second-quarter estimated tax deadline for 2023 is June 15. Here's how to avoid a surprise at tax time, according to the IRS."
2023-06-15 00:32:36,"Disney World is packed, but lines can be short — if you follow several tips","The easiest ways to avoid lines at Disney World cost money. But paying for them is worth every cent, says CNBC's Travel Editor Monica Pitrelli."
2023-06-14 19:35:29,How to shift your bond portfolio as the Fed pauses interest rate hikes,"The Federal Reserve on Wednesday announced a break from raising interest rates, while projecting two more hikes. Here's what it means for bond portfolios."
2023-06-14 17:14:21,Mark Cuban: Here's what my younger self got right—and why so many people still get it wrong,"Mark Cuban says the business strategy he got right in his 20s was focusing on profitability, not raising money. Here's why he advises others to do the same."
2023-06-14 21:26:44,Barbara Corcoran says people get 2 things wrong about being rich: 'I'm no happier today than I was when I was dirt poor',"Being rich does not make you happy or fix your problems, Corcoran says. It can even complicate existing relationships."
2023-06-15 17:53:39,Ultra-long-haul flights are coming back. Qantas wants to break the record,Qantas has placed an order for new Airbus A350-1000 planes for nonstop flights between New York's John F. Kennedy International Airport and Sydney.
2023-06-15 17:10:35,"Amid economic uncertainty, it's an 'attractive time' for investment-grade bonds, financial expert says","Speaking at CNBC's Financial Advisor Summit, fixed income expert Sonal Desai of Franklin Templeton Fixed Income covers what to know about bond allocations."
2023-06-15 06:23:08,"China to see the world's biggest millionaire exodus this year, new study shows","According to a report by investment migration consultancy Henley & Partners, China is expected to lose the largest number of dollar millionaires this year due to migration."
2023-06-16 06:13:42,Michelin Guide adds 17 food stalls in Singapore to its Bib Gourmand list,"In total, 79 dining establishments in the city-state were named to the list, up from 67 last year."
2023-06-17 11:50:01,Why Charles Schwab became a financial 'supermarket',"Charles Schwab is the largest brokerage business in the U.S., a leading provider for financial advisors, a top ETF asset manager and one of the biggest banks."
2023-06-18 13:00:01,"Firms are 'bombarding' small businesses with ads for a Covid-era tax credit, advisor says. Here's how to know if you qualify",The employee retention tax credit was created for businesses affected by the Covid-19 pandemic. Here's what to know before amending tax returns to claim it.
2023-06-19 23:03:07,These workers take ‘hush trips.’ Here’s how they’re hiding them from the boss,"Nearly one in 10 workers took a ""hush trip"" in the past year. CNBC Travel spoke to several about where they went and how they mask their whereabouts."
2023-06-19 12:30:01,"A.I. will make having a lucrative side hustle or startup much easier, says Airbnb CEO",Airbnb CEO Brian Chesky predicts that artificial intelligence will make it easier for aspiring entrepreneurs to create their own businesses. Here's how.
2023-06-20 21:38:29,"IRS weighs guidance for small business tax credit. ‘People were duped,’ taxpayer advocate says",The IRS is weighing guidance for small businesses that wrongly claimed the employee retention tax credit. Here's what entrepreneurs need to know.
2023-06-21 18:06:04,"The taxpayer experience this year 'vastly improved' compared with 2022, report finds",The national taxpayer advocate said taxpayer experience vastly improved during the 2023 filing season. Here's what still needs to change.
2023-06-21 16:52:44,Mark Cuban says successful people share 1 trait 'most people' don't have: It's 'the one thing in life you can control',"The key to success, says billionaire entrepreneur and investor Mark Cuban: expending as much effort as possible, particularly in the workplace. Here's why."
2023-06-21 19:01:36,"'It's gonna be tough, but it's gonna be worth it': Barbara Corcoran on what she would tell her 23-year-old self","""Shark Tank"" investor Barbara Corcoran would advise her younger self to be resilient: ""It's gonna be tough, but it's gonna be worth it."""
2023-06-22 15:58:02,'We've entered the Twilight Zone': Behind the beef that led to Elon Musk and Mark Zuckerberg's 'cage match',The tech billionaires have for years publicly taken jabs at each other.
2023-06-22 14:41:19,The problem with ESG funds—and how to make a 'real impact' with your money: Financial expert,"Values Added Financial partner Ari Weisbard explains how to use money to do right by your community, while still meeting your long-term wealth-building goals."
2023-06-22 02:13:50,Serving 'lunch' before midnight — and other ways airlines can help reduce jet lag,"Changes to in-flight lighting, food and sleep schedules can reduce passenger jet lag, according to new research from Qantas and the University of Sydney."
2023-06-23 05:45:33,"A.I. has a discrimination problem. In banking, the consequences can be severe","When it comes to banking and financial services, the problem of artificial intelligence amplifying existing human biases can be severe."
2023-06-22 20:45:29,What to know about crypto investing as regulators weigh the first spot bitcoin exchange-traded funds,Bitcoin rallied this week amid news of possible spot bitcoin exchange-traded funds. Here's what investors need to know before purchasing.
2023-06-23 16:07:52,Here's how much you can make and still pay 0% capital gains taxes for 2023,Inflation boosted the capital gains tax brackets for 2023. Here's how much you can make to pay 0% capital gains on investments.
2023-06-25 13:00:01,Barack Obama shares the No. 1 tactic he uses to maintain a positive mindset: 'It can sustain your spirit',"Being the president of the United States takes a toll on your mental health, says Barack Obama. Here's the tactic he's used to maintain a positive mindset."
2023-06-26 01:10:51,"He spent 250,000 euros to renovate a penthouse in Barcelona. This is what it looks like","Douglas Loewe explains how he doubled the value of an apartment he purchased in Eixample, Barcelona."
2023-06-26 20:05:13,"'Enormously costly' business loan fraud drove inflation in home prices in certain markets, research suggests","Covid-era PPP loan fraud may have contributed to home price inflation in certain U.S. markets, research suggests."
2023-06-27 14:03:18,45-year-old self-made millionaire shares his 4 'cheat codes' to help skyrocket your wealth,"In his early 20s, Alan Corey invested the income from his 9-to-5 job into real estate. Now, at 45, he's a self-made millionaire. From home-buying to renting, the financial expert and entrepreneur shares his top ""cheat codes"" to skyrocket your wealth."
2023-06-27 19:29:58,"Some advisors are flocking to alternative investments, survey finds. What investors need to know","Some advisors are turning to alternative investments, according to a new survey from the Financial Planning Association. Here's what investors need to know."
2023-06-27 19:00:27,"Don't budget, says financial psychologist. Here's why he recommends a 'spending plan' instead",Budgeting helps address areas you need to control but can come across as restrictive. Spending plans offer more freedom.
2023-06-28 20:49:54,Here's what a new Supreme Court case could mean for federal wealth tax proposals,"The Supreme Court will soon hear a case that could have broad effects on the U.S. tax code, including future wealth tax proposals."
2023-06-28 15:25:00,"Here's the No. 1 number to calculate if you want to be rich, says millionaire—'very few people' know it","Want to be rich? Get to know your expenses, from big things like rent and groceries to little ones like how much you tip or spend on gifts. Self-made millionaire Domonique Broadway shares the No. 1 number you need to calculate if you want to build wealth."
2023-06-29 18:25:32,4 ways to save on cooling costs as a dangerous heat wave grips millions of Americans,Here are four ways to save on cooling costs as a dangerous heat wave threatens millions of Americans.
2023-06-29 13:49:36,"3 reasons it can be smarter to rent, even if you can afford to buy","Flexibility, the ""nuisance"" factor and the hidden costs of homeownership may mean renting is the better choice for some people."
2023-06-30 19:38:08,"Supreme Court's student loan decision will have 'detrimental impact' on borrowers, financial advisor says","The Supreme Court's student loan decision may have a 'detrimental impact' on borrowers, financial advisor says. Here's how to prepare before payments resume."
2023-06-30 20:29:53,The world's youngest self-made billionaire 'absolutely' recommends dropping out of college to make money instead—here’s why,"Austin Russell, the world's youngest self-made billionaire, dropped out of Stanford to focus on his business full time, and he recommends others do the same."
2023-06-30 12:30:01,This safety net for the elderly and disabled comes with strict rules on savings. That may change,Supplemental Security Income benefits provide a safety net for low-income elderly and disabled individuals. But the program also comes with saving restrictions.
2023-07-01 13:00:01,Kim Kardashian’s $3.2 billion Skims brand started in her bathtub: I’d dye my own shapewear ‘with tea bags and coffee’,Kim Kardashian launched Skims in 2019 after years of dying her own shapewear to match her skin tone. The company was most recently valued at $3.2 billion.
2023-07-02 13:00:01,'I went out and bought my parents a car': Barbara Corcoran on the first time she felt successful,"The first time she felt successful, Barbara Corcoran spent her money on others. She shares the importance of giving back and what success now means to her."
2023-07-02 13:00:01,"With just 8% of new vehicles costing under $30,000, 'it’s the least affordable car market in modern history,' expert says","As consumer tastes change, carmakers are upgrading their lineups and scaling back on less-expensive cars."
2023-07-04 02:36:33,Mercedes' Toto Wolff shares his tips on leading a superstar team and 2 key values for long-term success,"Mercedes F1's Toto Wolff said he would rather lose the world championship than forsake values, amongst other leadership tips he shared at Energy Asia."
2023-07-06 00:17:36,The best places to eat in Andalusia — from a chef with three Michelin stars,"From bars to beachside restaurants, Chef Angel Leon of the three-Michelin-starred Aponiente recommends where to eat on the southern tip of Spain."
2023-07-05 19:15:47,Millions of high earners pay this investment income tax every year. Here's how to avoid it,Higher earners may be subject to the 3.8% net investment income tax every year. Here's how to reduce your tax bill.
2023-07-07 18:08:03,"The No. 1 way to grow your wealth, according to a self-made millionaire: It’s ‘deceptively simple’","Growing your wealth should be boring, Ramit Sethi says. He shares three strategies that allow you to grow your money in the long term."
2023-07-07 13:00:01,Op-ed: Cruise line stocks are a light on the horizon for investors seeking diversification,Market breadth improved as of late May and leadership expanded to cyclical sectors. One place for investors seeking diversification could be cruise companies.
2023-07-07 20:44:29,Powerball jackpot soars to $615 million. Here's how much the winner could owe in taxes,"If you win the Powerball jackpot, your winnings will shrink after the IRS cut. Here's what to know."
2023-07-09 13:31:45,Here's how one single father spent a decade planning for his dream family via surrogacy,This man spent a decade planning for a baby through surrogacy. Here's what prospective parents need to know about the process.
2023-07-09 13:00:01,Bill Gates says Warren Buffett taught him to value free time: Filling ‘every minute of your schedule’ doesn’t make you more serious,"Bill Gates said he used to think leaders filled every minute of their days working toward success, until he saw Warren Buffett's calendar."
2023-07-10 12:30:01,Self-made millionaire: 'A.I. will be the biggest wealth creator in history'—2 ways to use it to make money right now,"If you start learning artificial intelligence skills now, you'll be ahead of the curve when it becomes ubiquitous, says self-made millionaire Matt Higgins."
2023-07-10 02:39:19,"From Taylor Swift to the World Cup, travelers are paying big bucks to catch overseas games and shows","Fueled by a YOLO mentality following years of pandemic-era lockdowns, more are traveling to attend music, sports and other major events."
2023-07-11 05:35:03,"'Tourflation'? Taylor Swift, Beyoncé and Bruce Springsteen could be making inflation worse","As inflation remains high in many countries around the world, economists have found themselves considering a surprising potential contributor: music concerts."
2023-07-11 03:55:57,One of Asia’s most luxurious trains is returning to the rails with a new route,"Belmond announced today that the Eastern & Oriental Express luxury train, which will run from Singapore to Malaysia, is restarting in February 2024."
2023-07-10 17:16:15,Powerball jackpot grows to $650 million. Here’s the tax bill if there’s a winner,"If you beat the odds and win the Powerball jackpot, your winnings shrink significantly after the IRS takes its share."
2023-07-10 14:23:37,"Trying to choose Pretax vs. Roth 401(k)? Why it's trickier than you think, experts say","If you're trying to pick between pretax and Roth 401(k) contributions, here are some factors you need to consider."
2023-07-11 19:43:45,Longtime Aretha Franklin estate battle shows the importance of having a proper will,Aretha Franklin's sons disputed which of two handwritten wills governs the Queen of Soul's estate.
2023-07-11 16:17:55,"Powerball jackpot hits $725 million. If you win, here's the tax bill","If you win the Powerball jackpot, your winnings drop significantly after taxes. Here's what to expect."
2023-07-11 13:37:24,"Spend better, not less: Duke behavioral economics expert on his top 4 money tips",Psychology and behavioral economics professor Dan Ariely on the financial habits he adopts and encourages his students to use to be happy and good with money.
2023-07-12 15:43:54,"Nearly 1.5 million taxpayers are 'leaving money on the table' as key tax deadline nears, advisor says","If you didn't file your 2019 tax return, the deadline to claim your refund is approaching. Here's what to know."
2023-07-12 20:29:09,Billionaire Mark Cuban swears by this ‘powerful’ negotiation hack: It’s ‘money in the bank’,Many people opt for persuasion when negotiating. Mark Cuban prefers to stay silent instead. Here's why.
2023-07-12 18:44:59,United unveils new first-class seats in nearly once-in-a-decade refresh,United and other airlines are refreshing their cabins to include better technology and privacy to win over high-paying travelers.
2023-07-12 18:34:44,"From 'Barbie' to Formula 1, TAG Heuer is making its mark on the luxury watch market","Luxury watch maker TAG Heuer, which is owned by LVMH, is riding a wave of marketing successes and new launches."
2023-07-12 17:47:26,"Powerball jackpot hits $750 million. If you win, here's the tax bill","If you win the Powerball jackpot, your winnings drop significantly after taxes. Here's what to expect."
2023-07-13 22:19:26,What cooling inflation means for your Series I bonds,"As inflation cools, investors are weighing whether to buy or sell Series I bonds amid other competitive options for cash. Here's what you need to know."
2023-07-14 18:44:45,"Biden administration announces student debt forgiveness for 804,000 federal borrowers—here's who qualifies",The Biden administration has now forgiven more than $116 billion in student debt. Here's who qualifies for the latest round of forgiveness.
2023-07-14 14:54:22,Powerball jackpot climbs to $875 million. Here’s how much the winner could pay in taxes,The Powerball jackpot jumped to $875 million. Here's what to expect for taxes if you score the winning ticket.
2023-07-16 13:25:01,Barbara Corcoran: You don't need to 'work your buns off to get rich'—here’s what to do instead,"Many of today's most prominent business moguls work themselves to the bone. That's completely unnecessary, says millionaire investor Barbara Corcoran."
2023-07-18 06:42:40,"Can ChatGPT find ‘hidden gems’ for trips in Europe? Yes, if you use these prompts","ChatGPT can find off-the-beaten track gems in Europe if you ask the right questions, says the London-based travel writer Lisa Lucas."
2023-07-17 16:13:33,Powerball jackpot hits $900 million. Here's the tax bill if you win,The Powerball jackpot has grown to $900 million. Here's what the winner can expect to pay in taxes.
2023-07-18 18:34:59,Here's how Biden's $39 billion in student loan forgiveness may impact your taxes,"If you're eligible for the Biden administration's $39 billion in student loan forgiveness, here's how it may affect your taxes."
2023-07-18 15:07:00,One of the world’s richest self-made men started as a motel janitor—now he has a net worth of $1.2 billion,"Before he founded booking platform Yanolja, Lee Su Jin started his hospitality career as a ""love hotel"" janitor. Now, he has a net worth of $1.2 billion."
2023-07-19 15:08:57,Singapore’s passport is now the most powerful in the world. Here's how other countries ranked,"Singapore has overtaken Japan to boast the most powerful passport in the world, the Henley Passport Index showed."
