DATE,TITLE,SUMMARY
2023-04-14 12:05:11,Fears mount that Europe's commercial real estate sector could be the next to fall,"Concerns are mounting around the health of Europe's commercial real estate market, with some investors questioning whether it could be the next sector to blow."
2023-04-14 19:59:54,"Today's homebuyers have their mortgage rate tipping point, and it's artificially low","The majority of potential homebuyers say they won't accept a 30-year fixed mortgage rate over 5.5%, according to a new survey. The current rate is around 6.4%."
2023-04-17 15:25:43,"Homebuilder sentiment rises in April, as builders grab near-record share of the market","Homebuilder sentiment rose in April, as builders gained an edge from a lack of supply on the resale market."
2023-04-17 11:33:32,Sweden's economic gloom goes from bad to worse as government predicts steeper GDP contraction,"The Swedish government predicted 2023 would be a ""gloomy"" year for the country, but new GDP expectations present a worse outlook than previously expected."
2023-04-18 19:08:02,Federal court strikes down a California city's natural gas ban,The decision could have ramifications for similar efforts by other cities and counties in California to ban natural gas appliances in new buildings.
2023-04-19 14:18:27,Mortgage demand from homebuyers drops 10% as interest rates jump,"Mortgage demand dropped last week after interest rates increased. Rates continued moving higher this week, portending a slowdown in the spring market."
2023-04-20 18:05:43,Home sales fell in March amid volatility in mortgage rates,"Sales of previously owned homes declined 2.4% in March compared with February, according to the National Association of Realtors."
2023-04-21 22:07:05,Google's 80-acre San Jose mega-campus is on hold as company reckons with economic slowdown,"Construction of Google's campus in San Jose, California, has been halted as the company's cost-cutting efforts stifle development."
2023-04-24 20:26:27,Sen. Wyden asks billionaire Harlan Crow for list of gifts to Supreme Court Justice Thomas,Supreme Court Justice Clarence Thomas has faced criticism for weeks over a report that Republican billionaire donor Harlan Crow treated him to luxury trips.
2023-04-26 16:52:06,"A massive geothermal apartment complex is going up in Brooklyn, the first of its kind",
2023-04-26 15:00:01,Rent or buy? Here's how to make that decision in the current real estate market,"Deciding whether to rent or buy has never been simple, and this housing market isn’t making it any easier. Here's how to determine what makes sense for you."
2023-04-26 11:38:39,"Mortgage demand rebounds, even as interest rates hit the highest level in over a month","Mortgage demand rebounded despite a rise in interest rates, as homebuyers take advantage of easing house prices."
2023-04-27 07:01:48,Singapore hikes property tax in latest round of cooling measures,"Both local and foreign buyers of residential properties will now have to pay higher additional buyers' stamp duties, which will take effect from today."
2023-04-27 18:21:12,The average price for a house in the Hamptons just hit a record $3 million,"Despite stock market volatility, rising mortgage rates, layoffs in tech and finance and fears of recession, the wealthy are still bidding and buying."
2023-04-30 14:13:13,Charlie Munger reportedly warns of trouble for the U.S. commercial property market,Charlie Munger believes there is trouble ahead for the U.S. commercial property market.
2023-05-01 15:37:20,The Federal Reserve is expected to hike rates one more time. What that means for you,This could mark the 10th time the Fed has raised its benchmark interest rate over the past year or so. Here's what that means to your wallet.
2023-05-01 13:46:18,Charlie Munger says the U.S. commercial property market is in trouble: FT report,Charlie Munger believes there is trouble ahead for the U.S. commercial property market.
2023-05-02 14:42:39,Home prices are back on the rise as the spring market proves more competitive than expected,"A sharp drop in new listings, adding to an already meager supply of homes for sale, is leading to renewed bidding wars."
2023-05-03 11:00:01,Mortgage demand drops as bank failures hit jumbo loan rates,"Mortgage demand dropped last week despite a slight easing in interest rates, while trouble in the banking sector makes jumbo loans more expensive."
2023-05-03 20:54:52,Billionaire Stephen Deckoff buys Jeffrey Epstein's private islands,Jeffrey Epstein used his private retreat in the U.S. Virgin Islands to sexually abuse multiple women. A billionaire plans a new luxury resort there.
2023-05-03 19:24:31,Here's how the Federal Reserve's latest quarter-point interest rate hike impacts your money,"When the Federal Reserve boosts its benchmark rate, everything from credit cards to savings accounts can be affected."
2023-05-08 19:50:53,Abandoned coal mines may be gold mines for geothermal energy,
2023-05-09 15:00:57,"German regulator warns of a 'nervous time' for banks, predicts stress in the property market",The banking sector has been under the spotlight since March with the collapse of Silicon Valley Bank and the rescue of several other embattled lenders.
2023-05-09 12:09:26,Brits are being offered no-deposit 100% mortgage loans for the first time since 2008,Renters in the U.K. will be able to borrow up to 100% of the value of a property in a new mortgage scheme introduced by Skipton Building Society.
2023-05-10 06:30:01,CNBC Daily Open: Bracing for April’s consumer price index,Markets had a quiet Tuesday as investors braced for key inflation reports coming out later today and Thursday.
2023-05-09 23:38:22,CNBC Daily Open: Bracing for April’s CPI reading,Markets had a quiet Tuesday as investors braced for key inflation reports coming out later today and Thursday.
2023-05-10 16:44:11,"Here’s the inflation breakdown for April 2023, in one chart","Inflation moderated for the 10th consecutive month in April. Households will likely see continuing price relief in food, energy and housing, economists said."
2023-05-10 11:31:42,Mortgage demand surged after Fed signaled potential pause in rate hikes,"Mortgage demand rose last week after interest rates pulled back slightly. Demand is still far lower, however, than it was a year ago."
2023-05-12 00:59:21,Want to buy a cheap house in rural Japan? This millennial farmer offers his advice,"""This is specifically for Japan: If you can't speak the language, you can't get along with your neighbors … communication is very difficult,"" said Lee Xian Jie."
2023-05-14 11:00:01,"In Chinatowns across the U.S., tradition and history collide with luxury development","In major Chinatowns, luxury development and public-use projects have altered the fabric of these historic communities."
2023-05-15 13:32:48,Hamptons rental prices fall for the summer as owners contend with oversupply,"At the start of the Covid pandemic, throngs of wealthy New Yorkers fled the city for the Hamptons and many bought homes. Now they want to find renters."
2023-05-16 16:14:59,Homebuilder sentiment pulls out of negative territory for the first time in nearly a year,It's the fifth straight month of gains and the first reading of builder sentiment since July that wasn't negative.
2023-05-17 13:05:07,Mortgage demand drops as interest rates hit a 2-month high,"Mortgage applications to purchase a home dropped 4.8% last week compared with the previous week, according to the Mortgage Bankers Association."
2023-05-18 14:20:36,"Home sales fell in April as buyers contended with high prices, fluctuating mortgage rates","Sales of previously owned homes fell 3.4% in April from March, according to the National Association of Realtors."
2023-05-18 14:28:54,This $18 million Invisible House is the most expensive listing in Joshua Tree — and it's already a money-maker,It was one of Airbnb's most wish-listed properties in 2023 and generated $1.4 million in revenue between guest rentals and production shoots.
2023-05-19 18:39:31,An exclusive look inside Amazon's uniquely sustainable HQ2,Amazon's HQ2 in Virginia has many features that contribute toward the company's goal of reaching net zero carbon emissions across all operations by 2040.
2023-05-22 15:56:40,Southwest states strike landmark deal with Biden to conserve Colorado River water,The Biden administration will compensate states for 2.3 million acre-feet of savings using funding from the Inflation Reduction Act.
2023-05-24 00:15:19,'Hurricane has landed:' Activist investor Jonathan Litt doubles down on office space short,Land and Buildings' Jonathan Litt bets stalled return-to-office plans will stir up more trouble in commercial real estate.
2023-05-24 18:21:14,"Young adults are taking longer to reach 'key life milestones' impacting finances later, analysis shows","In terms of finances, young adults are taking longer to reach ""key life milestones,"" compared to four decades ago, according to a Pew Research Center analysis."
2023-05-24 14:37:19,Mortgage demand drops again as rates cross back over 7%,"The average rate on the popular 30-year fixed mortgage crossed over 7% on Tuesday, according to Mortgage News Daily. The highest level since early March."
2023-05-25 21:14:52,"When couples say they broke up over money, it's not the real reason, therapist says. Here's what is",Psychoanalyst Orna Guralnik said money is one of the biggest stressors on relationships. But she sees a way forward for couples fighting about their finances.
2023-05-27 15:11:09,Why major commercial real estate firms are joining resources to recruit Black student-athletes,A paid internship program that teaches the fundamentals of real estate investing has launched a new partnership with Black student-athletes.
2023-05-30 14:37:51,"Home price declines may be over, S&P Case-Shiller says","Nationally, home prices in March were 0.7% higher than March 2022, S&amp;P CoreLogic Case-Shiller Indices said."
2023-05-31 11:34:49,Mortgage demand drops to the lowest level in three months,Mortgage demand continues to drop as interest rates climb higher.
2023-05-31 00:09:38,New warning signs emerge for China's property market,"Data for May show China's massive property sector is still struggling to turn around, despite signs of recovery earlier this year."
2023-05-31 16:07:43,These home improvement projects pay off most — major kitchen and bath remodelings don't make the cut,The top home projects promising the greatest returns in resale value are not the ones you would expect.
2023-06-01 01:26:29,Singapore overtakes Hong Kong as the most expensive Asia-Pacific city for private homes,"According to the Urban Land Institute Asia Pacific Centre for Housing, the median price of Singapore's private homes is $1.2 million, compared to $1.16 million in Hong Kong."
2023-06-01 14:00:01,Measuring inflation can be tricky and quirky. Here are 3 examples,"Inflation readings in consumer price index categories such as housing, health insurance and technology don't always jibe with consumers' reality."
2023-06-02 19:03:13,Arizona sets limits on construction around Phoenix as groundwater dwindles,"Earlier this year, Arizona projected that developers planning to build homes in the Phoenix area don't have enough groundwater supplies to execute those plans."
2023-06-07 11:33:43,Mortgage demand drops despite rates coming off recent highs,"Mortgage rates fell back from their recent highs, but demand dropped for the fourth straight week."
2023-06-07 05:18:51,China's stimulus could focus on its 'dire' property sector. Here's what economists expect,Economists expect China's stimulus package to focus on the property sector amid continued weak economic data.
2023-06-08 00:32:59,"New York overtakes Hong Kong as the most expensive city in the world for expats, new survey shows","Nearly all Asian locations surveyed fell in rankings, indicating that expats will find living in Asia ""relatively cheaper,"" said ECA International."
2023-06-07 19:24:10,"Homeownership is a great way to build wealth, advisor says. Here's how to make that purchase successful","Even with high home prices and interest rates, owning a home can still pay off in the long run, one advisor says."
2023-06-08 18:38:25,The shortage of houses is hitting some people and areas harder than others,"The U.S. is facing a shortage of affordable houses relative to only a few years ago, and it's hitting cities such as El Paso, Boise and Spokane the hardest."
2023-06-09 13:00:01,The Federal Reserve may pause its interest rate hiking campaign. What that means for you,"After raising interest rates 10 times since March 2022, the Fed may take a pause. Here's what that means to your wallet."
2023-06-09 12:56:52,HSBC pulls some UK mortgage deals as fears of rising rates hits home buyers once more,"Analysts expect mortgage rates to soar and housing prices to plummet in the U.K., as the effect of higher interest rates ripples through the British housing market."
2023-06-12 16:11:57,Goldman Sachs CEO David Solomon warns of pain ahead for commercial real estate,The commercial real estate industry is in the throes of a painful adjustment to higher borrowing costs and lower occupancy rates.
2023-06-12 16:20:07,Confronting aging: How LGBTQ+ seniors can tackle their special caregiving challenges,"Older LGBTQ+ Americans are twice as likely to be single and four times less likely to have children, presenting some special challenges to ensuring elder care."
2023-06-12 20:10:36,"Tornado alley is widening, putting millions more people and properties at risk",Tornado alley is expanding due to a warmer climate.
2023-06-14 11:29:27,Mortgage demand surges as interest rates ease off recent highs,"Mortgage rates pulled back for the second straight week last week, and it was enough to get both current and potential homeowners on the phone with lenders."
2023-06-14 00:11:10,"China’s real estate slump predicted to last for years, threatening to spill into the wider region","Goldman Sachs economists said China's ""property weakness will likely be a multi-year growth drag"" for the economy."
2023-06-14 18:59:30,This map shows how much money renters in every state need to earn to afford a 2-bedroom apartment,"In no U.S. state or city can a full-time worker earning the local minimum wage afford a two-bedroom apartment, the National Low Income Housing Coalition finds."
2023-06-14 18:06:28,Here's how the Federal Reserve's pause in interest rate hikes affects your money,"At the end of its two-day meeting Wednesday, the Fed said it would skip a rate hike in June."
2023-06-14 18:09:29,We're calling up this DIY hardware stock just days after adding it to our Bullpen watch list,We're intentionally starting this new position on the small side given the overbought nature of the market and will look to add on pullbacks.
2023-06-14 13:57:29,Why economists say it's a near certainty that housing inflation will soon fall,"The consumer price index will soon reflect easing price trends in U.S. housing, economists said."
2023-06-16 00:14:06,China's economic recovery is stalling. Here's what to expect next,A raft of weak Chinese economic data in May has raised hopes of decisive policy intervention.
2023-06-15 18:09:23,Fed's pause on interest rates is a blow to affordable housing in California,"Mortgage rates likely will remain high despite the Fed's pause on interest rate hikes, a blow to affordable housing in California, says state treasurer Fiona Ma."
2023-06-17 00:18:29,"The IPO market may be heating up, and that will put pressure on the Fed, Cramer says","CNBC's Jim Cramer on Friday said he feels the Federal Reserve needs to be transparent with its plans, especially as the IPO market starts to heat up."
2023-06-17 13:00:01,Mortgage points may help homebuyers lower monthly costs amid high interest rates. How to know if this strategy is right for you,"Interest rates are expected to stay high this year, which means mortgages are more expensive. Experts say this strategy can help buyers reduce monthly costs."
2023-06-19 13:19:00,Why Amazon built a second headquarters and how the pandemic reshaped HQ2,The grand opening caps off plans that began six years ago with a highly publicized search for a location to build HQ2.
2023-06-20 06:30:01,CNBC Daily Open: The Chinese dragon's still dozing,"China's central bank has started cutting rates to boost the economy. But for now, the Chinese dragon’s still dozy."
2023-06-19 23:43:34,"CNBC Daily Open: China, the dozing dragon","China's central bank has started cutting rates to boost the economy. But for now, the Chinese dragon’s still dozy."
2023-06-20 15:15:57,Amazon HQ2 is not matching the original hype. The economy is partly to blame,"Amazon's scaled back Amazon HQ2 plans show an economy, from inflation to interest rates and a tight labor market, that is slowing corporate expansion ambitions."
2023-06-21 11:23:28,"Weekly mortgage demand was flat, even as interest rates drop for the third straight week","The average rate on the most popular mortgage, the 30-year fixed, fell for the third straight week"
2023-06-22 14:39:01,Home sales barely budge from April to May in sluggish spring market,"The traditionally busy spring selling season is bogged down by high interest rates, inflated prices and tight supply."
2023-06-26 16:15:18,Mortgage catastrophe brews in Britain as millions are pushed toward insolvency,Research estimates that the Bank of England's latest rate hike could see 1.2 million U.K. households run out of savings by the end of the year.
2023-06-26 16:14:42,Billions in federal infrastructure spending could be wasted due to outdated government rainfall models,"NOAA's precipitation expectation model, Atlas 14, is based on backward-looking data and does not incorporate the effects of global warming."
2023-06-27 06:30:01,"CNBC Daily Open: Tech, meet reality",Tech stocks slumped across the board as enthusiasm over artificial intelligence was replaced by a more clear-eyed view of today’s economic conditions.
2023-06-26 23:42:50,CNBC Daily Open: Tech confronts reality,Tech stocks slumped across the board as enthusiasm over artificial intelligence was replaced by a more clear-eyed view of today’s economic conditions.
2023-06-26 20:05:13,"'Enormously costly' business loan fraud drove inflation in home prices in certain markets, research suggests","Covid-era PPP loan fraud may have contributed to home price inflation in certain U.S. markets, research suggests."
2023-06-27 15:48:52,"Stocks rise on strong housing data, bolstering our newest Club holding","The Investing Club holds its ""Morning Meeting"" every weekday at 10:20 a.m. ET."
2023-06-27 14:43:51,"Home prices rose for third straight month in April, S&P Case-Shiller index says",Housing prices are recovering steadily after hitting a bottom earlier this year.
2023-06-28 11:33:09,"Mortgage demand grows, driven by sales of new homes","While applications for mortgages to buy a home rose week to week, they were still down more than 20% compared with a year earlier."
2023-06-28 06:30:01,CNBC Daily Open: Consumers might just prevent a U.S. recession,"Fresh economic data from the U.S. showed a resilient economy that, with luck, might eventually defy predictions of recession."
2023-06-27 23:40:09,CNBC Daily Open: Consumers might just fend off a U.S. recession,"Fresh economic data from the U.S. showed a resilient economy that, with luck, might eventually defy predictions of recession."
2023-06-28 18:53:24,Here’s how the resilient housing market benefits our home improvement and construction stocks,Strong demand for new homes and reignited renovation trends are positive signs for three of our Club stocks.
2023-06-29 15:34:20,These retailers will take over Bed Bath & Beyond's 'top-notch' store leases,Burlington Stores is set to take over 50 former Bed Bath & Beyond locations after the home goods retailer auctioned its leases.
2023-06-29 13:49:36,"3 reasons it can be smarter to rent, even if you can afford to buy","Flexibility, the ""nuisance"" factor and the hidden costs of homeownership may mean renting is the better choice for some people."
2023-06-29 19:12:41,House hunting is already tough. Guess what? It's about to get harder,"In the last week of June, the number of homes for sale fell below year-ago levels for the first time in 59 weeks."
2023-07-06 18:07:13,Mortgage rate soars to 7.22% after strong economic data,"The average rate on the popular 30-year fixed mortgage hit 7.22%, according to Mortgage News Daily."
2023-07-06 11:36:46,"Mortgage demand drops to lowest level in a month, as interest rates rise","Rising interest rates had a direct impact on mortgage demand, which had been rising for weeks."
2023-07-07 12:30:01,"Don’t 'drive yourself as crazy as the markets are,’ advisor says — here's how to navigate volatility","To navigate a fluctuating market, take a broad view of your assets and capital, says one financial advisor."
2023-07-07 11:55:45,Britain's house prices are slumping as mortgage rates soar — and there could be worse to come,U.K. house prices fell at their fastest annual pace in 12 years in June as still escalating mortgage costs piled further pressure on the property market.
2023-07-10 17:09:51,"Home prices are hitting new highs again, as high rates put the squeeze on supply","After falling for much of last year, home prices nationally are setting new highs in some markets."
2023-07-11 06:09:54,Chinese real estate stocks rise as Beijing extends property support measures,"The move encourages financial institutions to continue deferring loan payments, while propping up financial support for real estate enterprises"
2023-07-12 11:18:36,"Bank of England warns of mortgage agony, says monthly costs could jump £500 for some","The central bank said that the amount of household debt remains ""some way below"" the historic peak reached in 2007."
2023-07-13 13:30:01,"Hybrid work is the new normal, as companies rethink work habits and office and retail space","Hybrid work has changed where and how many people work. Experts say the time for employers, cities and retailers to adapt is now."
2023-07-15 11:05:01,East Coast mayors call for more office-to-apartment conversions,Public officials across the U.S. have called for looser building codes and increased subsidy for developers who convert offices into housing.
2023-07-17 06:43:57,China property investment slide deepens in June as structural shift inflicts pain,The National Bureau of Statistics says the property sector is shifting from high-speed development to stable development in the medium to long term.
2023-07-17 18:49:22,More Americans are moving to Spain — and paying high prices for real estate,The expat American population in Spain jumped 13% from 2019 to 2021 and is the foreign demographic paying the second-highest amount for living space.
2023-07-17 12:33:27,The mortgage market isn't sending the signal homebuyers need on affordability,"Mortgage rates should move down sharply from 7% as inflation falls, the Fed nears the end of its hikes, and recession fears wane. So why isn't that happening?"
2023-07-18 14:00:50,Fed banking regulator warns A.I. could lead to illegal lending practices like excluding minorities,"Michael S. Barr said AI technology has potential, but also can be used for nefarious means."
2023-07-18 15:17:27,"Homebuilder sentiment rises again in July, but builders warn higher mortgage rates are hurting",It marks the seventh straight month of gains and the highest level since June 2022. A reading above 50 is considered positive sentiment.
2023-07-18 09:36:06,Chinese property developer Evergrande posts $81 billion loss over the past two years,China Evergrande Group posted a combined loss of $81 billion in its long overdue earnings report late on Monday.
2023-07-19 14:18:33,"These 10 states are America's strongest housing markets, offering buyers the best value","America is in a housing affordability crisis, but these 10 states offer homebuyers and sellers the best bang for their buck."
2023-07-19 11:00:01,Mortgage-refinance demand recovers some after rates come off recent highs,"Total mortgage application volume rose 1.1% last week compared with the previous week, according to the MBA's seasonally adjusted index."
2023-07-20 08:54:03,Singapore and Lisbon top ranking of the cities with the biggest surge in prime rents,"Rents in prime residential areas increased the most in Singapore, Lisbon and Berlin in the first half of the year, according to a report by Savills."
2023-07-20 18:23:33,June home sales drop to the slowest pace in 14 years as short supply chokes the market,June home sales declined 18.9% compared with last year. That's the slowest sales pace for June since 2009.
2023-07-21 18:00:29,Another interest rate hike is likely coming from the Federal Reserve. Here are 5 ways it could affect you,The U.S. central bank has indicated another increase in interest rates is coming as it tries to further ease inflation.
2023-07-21 13:46:43,"Less than 5% of U.S. housing supply is accessible to older, disabled Americans. These changes may help","Accessible, affordable housing is out of reach for many disabled or elderly Americans. Experts who testified at a Senate panel said certain changes may help."
2023-07-24 07:01:57,"A 10-year rally in U.S. home prices could be coming to an end, says Yale's Robert Shiller","A decade-long rally in U.S. home prices could finally come to an end once the Federal Reserve stops its rate-hiking cycle, said the professor of economics."
2023-07-24 05:27:12,China has announced a slew of measures to bolster its economy. Here's what we know so far,Chinese leaders have signaled in recent weeks they are likely to be judicious and targeted in their policy support.
