DATE,TITLE,SUMMARY
2023-01-12 20:07:02,Rep. Gallagher introduces package of bills to fight back against Mexican cartels,"Rep. Mike Gallagher, R-Wis., is introducing a number of bills in the House to tackle Mexican cartels amid growing violence and a crisis at the U.S.-Mexico border."
2023-01-12 19:33:07,Lawmakers aim to fight 'smash-and-grab' robberies with bipartisan bill to hold criminals accountable,"Bipartisan House members introduced a bill to boost the coordination between federal, state and local authorities to crack down on organized crime across the nation."
2023-01-12 19:31:05,"Robert K. Hur, Biden special counsel, oversaw indictments of top Baltimore officials","Robert K. Hur, who is appointed as special counsel to investigate President Biden's handling of classified documents, oversaw indictments of several top Baltimore officials."
2023-01-12 21:49:39,Colorado congressman puts pressure on Biden to release Delaware visitor logs,"Colorado Rep. Ken Buck, a Republican, sent President Biden a letter calling on the president to release the visitor logs from his Delaware home amid DocuGate."
2023-01-12 21:37:23,White House asked if Biden will be interviewed by federal investigators over classified docs in garage,"Karine Jean-Pierre said during a press conference on Thursday that she's not going to ""get into hypotheticals"" when asked if Biden would be interviewed by federal investigators."
2023-01-12 21:16:20,"Buttigieg avoided calls, public appearances on paternity leave, FOIA documents show","Department of Transportation Secretary Pete Buttigieg rejected phone calls and requests for public appearances as he was on maternity leave in 2021, internal documents show."
2023-01-12 20:55:57,New Kansas AG Kobach wants state Supreme Court to reconsider abortion ruling,Republican Kansas Attorney General Kris Kobach has requested that the state Supreme Court reconsider a ruling that declared abortion to be a right under the state constitution.
2023-01-12 20:30:10,White House claims Biden classified docs were 'inadvertently misplaced',"The White House says it is confident that a thorough review of President Biden's mishandling of classified documents will reveal that they were ""inadvertently misplaced."""
2023-01-12 22:52:01,State Department dodges questions on Biden classified documents,The State Department dodged questions about classified documents stored at President Biden's former offices that may be connected to Secretary of State Blinken.
2023-01-12 22:28:30,Abortion survivor calls Democrats' collective opposition to Born-Alive bill 'traumatizing and disgusting',"Abortion survivor Melissa Ohden was excited by the passage of the Born-Alive Act, but ""disturbed"" by Democrats' partisanship on an issue she calls ""common sense."""
2023-01-13 00:11:03,"Emails suggest Hunter Biden had access to garage where president kept classified docs, Corvette","Hunter Biden listed his home address as President Biden's Wilmington, Delaware, residence, where classified documents were discovered, documents show."
2023-01-12 23:38:00,White House says it's being 'transparent' about classified documents despite keeping under wraps for months,"White House Press Secretary Karine Jean-Pierre says that the Biden administration has been ""transparent"" over classified document discoveries."
2023-01-12 23:30:58,What the House GOP can do to Rep George Santos — if they wanted to,"The GOP has some options when it comes to George Santos, but each path has its pitfalls, and most Republicans don't appear ready to take drastic measures."
2023-01-12 23:09:58,"DOJ survey finds vast majority have positive interactions with cops, contradicts defund the police 'narrative'","A Justice Department report found most people who interacted with police in 2020 had a positive experience, which a police advocate says contradicts the anti-law enforcement narrative."
2023-01-13 01:23:37,"UFO sightings surged over last two years, US intel report says","The Pentagon's All-Domain Anomaly Resolution Office has gathered 366 UFO sightings over the past two years, intelligence officials wrote in a report to Congress."
2023-01-13 01:11:46,Florida Coast Guard asks for help with migrant surge moments after WH accuses DeSantis of 'political stunts’,"Moments after the Biden Administration blasted Ron DeSantis' move to activate the national guard, the Republican governor shares that the U.S. Coast Guard asked for the state's assistance in dealing with the migrant surge."
2023-01-13 02:04:42,White House won't say how many people could have accessed classified Biden documents in garage,The White House declined to give an estimate of the number of people who could have had access to the classified found in President Biden's Wilmington garage.
2023-01-13 02:03:20,Former Biden assistant questioned by law enforcement over classified docs repeatedly appeared in Hunter emails,"Kathy Chung, a former aide to President Biden who was interviewed by investigators this week, frequently emailed the president's son Hunter Biden about a range of issues."
2023-01-13 01:50:37,"Biden admin dealt blow by Sixth Circuit ruling against vaccine mandate in Kentucky, Ohio, Tennessee",A federal appeals court ruled on Thursday that the Biden administration cannot enforce a mandate requiring workers who contract with the federal government to vaccinate.
2023-01-13 01:42:03,Karine Jean-Pierre dodges questions about visitor logs to Biden's Delaware home where he kept classified docs,"Karine Jean-Pierre refused to answer a question asking if the White House will release visitor logs to President Biden's Wilmington, Delaware, residence after classified documents were found there."
2023-01-13 07:05:37,"Democrats scramble to defend Biden's handling of classified materials, point fingers at Trump","Democrats hare rushing to defend President Biden over his handling of classified documents, highlighting “differences” between how he and Trump handled classified materials."
2023-01-13 07:00:05,Democrats push to amend Constitution so 16-year-olds can vote,"House Democrats will try once more to amend the Constitution in order to lower the voting age to 16, an idea that has been popular with Democrats but unpopular with Republicans."
2023-01-13 14:10:27,"2 Kentucky organizations funded $2.3M in support of school safety, mental health",The Department of Health and Human Services has awarded two Kentucky organizations $2.3 million to help fund school safety and support mental health.
2023-01-13 14:10:22,GOP bill blocks Biden admin from banning gas stoves: ‘Regulation run amok’,"Dozens of House Republicans introduced legislation this week to block the Biden administration from banning gas stoves, after a consumer protection agency hinted one might be coming."
2023-01-13 13:52:18,Trump UN ambassador vows 'full court press' to combat China's fentanyl 'abuses' in this state if elected gov,"Former UN Ambassador Kelly Craft, a Republican running for Kentucky governor, has vowed to take on the Chinese Communist Party and its role in the importation of fentanyl into the state."
2023-01-13 13:46:19,"Pennsylvania Gov. Tom Wolf has issued more pardons than any governor in PA's history, administration says","The governor of Pennsylvania has given out a record number of pardons in the state since he took office. He signed a total of 2,540 pardons since 2015."
2023-01-13 16:04:59,"GOP rep introduces bill to restart border wall construction, days after Mexican president lauds Biden","Rep. Clay Higgins, R-La., is introducing legislation to re-fire construction of the wall at the southern border, warning that the U.S. has lost its sovereignty."
2023-01-13 15:42:14,Manchin opponent? West Virginia GOP governor ‘seriously’ mulling Senate run against incumbent Democrat,"Republican Gov. Jim Justice of West Virginia says he is “seriously considering running for U.S. Senate” in 2024, when Democratic Sen. Joe Manchin is up for re-election."
2023-01-13 15:37:42,Kansas Gov. Kelly's COVID diagnosis was false positive,"Democratic Kansas Governor Laura Kelly's recently-disclosed COVID-19 diagnosis turned out to be a false positive, according to her office. She will return to the Statehouse Friday."
2023-01-13 15:36:09,Biden admin renames 5 places that used 'harmful' term for Native American women,The Interior Department announced that five places in states across the country would be renamed. The sites previously included a racist term for a Native American woman.
2023-01-13 16:43:17,"Senate candidate Katie Porter responds to toxic workplace allegations, says she expects 'people to work hard'","California Democrat Rep. Katie Porter, the embattled congresswoman looking to ascend to the Senate, responded to toxic workplace accusations as she tries to soften her image."
2023-01-13 17:57:31,'Not taking our gas stoves': Gov. DeSantis flames Biden agency considering gas stove ban chaos in unique way,"Governor Ron DeSantis of Florida vowed that nobody would be ""taking our gas stoves away,"" after a CPSC commissioner suggested a ban was ""on the table."""
2023-01-13 17:52:08,Service members terminated over unvaxxed status could be reinstated in military with GOP-led bills,Republicans want to reinstate terminated service members into the military after the Biden admin's controversial COVID-19 vaccine policy was rolled back in the NDAA.
2023-01-13 17:43:05,What we know so far: Timeline of Biden's classified documents debacle,"A timeline of the discovery of now three sets of classified documents at the Penn Biden Center in Washington, D.C., and the garage of President Biden's personal residence in Wilmington, Delaware."
2023-01-13 17:40:16,"Whitmer, other Michigan Dems outline agenda for new legislative session","Gov. Gretchen Whitmer and other Michigan Democrats outlined their priorities for the state's new legislative session Thursday, with much of the discussion surrounding tax policy."
2023-01-13 17:40:15,Encouraging migrants to cross the southern border illegally: free speech or felony? Americans weigh in,"People in Austin, Texas, shared whether they believe a law criminalizing the encouragement or inducement of illegal immigration is valid or violates free speech."
2023-01-13 17:38:07,"Wisconsin Senate GOP leader proposes flat tax, Democrat Gov. Evers publicly opposes","A flat income tax proposal by Republican Wisconsin Senate leader Devin LeMaiheu is unlikely to become law, as Democratic Gov. Tony Evers has voiced strong opposition to it."
2023-01-13 17:35:00,Biden ignores shouted questions on classified documents investigation as he meets with Japanese PM,President Biden said nothing to the press pool Friday as he entered the White House with Prime Minister Fumio Kishida of Japan amid questions about his handling of classified documents.
2023-01-13 17:25:26,Democrats want January 6 memorial in the Capitol to honor ‘democracy’s defining moment’,"Democrats have proposed legislation to erect a memorial to the January 6 riot that depicts the events of that day and honors the people who ""held the fabric of our nation together."""
2023-01-13 17:24:47,"GOP targets DC non-citizen voting, moving against 'attack on the foundation of this republic'","House Oversight Committee Chairman Rep. James Comer, R-Ky., has introduced a joint resolution disapproving of a Washington, D.C., bill that would permit noncitizens to vote in local elections."
2023-01-13 17:12:11,Biden admin gives top energy post to climate activist who failed Senate confirmation over ethics concerns,"The Biden administration appointed Elizabeth Klein, who has previously been questioned for potential conflicts of interest, to lead the Bureau of Ocean Energy Management."
2023-01-13 17:10:19,NV Gov. Joe Lombardo orders indefinite freeze on new state regulations,Nevada Gov. Joe Lombardo signed an order freezing new state regulations. Agencies will be required to recommend 10 eliminations to streamline regulation processes.
2023-01-13 17:05:37,"Squad Dem launches wild rant defending 'wokeness', says Chip Roy wants 'old America' that 'enslaved Africans'","Far-left Squad member Rep. Jamaal Bowman, D-N.Y., launched on a wild rant against Rep. Chip Roy, R-Texas, claiming he wanted to go back to the ""old America"" that ""enslaved Africans."""
2023-01-13 17:02:03,"Wisconsin, North Carolina latest states to ban TikTok on government-issued devices","Govs. Tony Evers of Wisconsin and Roy Cooper of North Carolina, both Democrats, are among the most recent in the nation to have signed off on TikTok bans for government devices."
2023-01-13 17:00:14,Four McCarthy holdouts get seats on top House committees,Four GOP lawmakers who stalled Kevin McCarthy’s speakership until he met their demands earned seats for the first time on some of the chambers powerful committee.
2023-01-13 18:57:35,McCarthy says Republicans would 'look at' expunging Trump impeachments,"House Speaker Kevin McCarthy is expressing openness to “look at” the possibility of expunging impeachments against former President Donald Trump, should a resolution be brought forward."
2023-01-13 18:47:12,Hunter Biden hangs around Malibu while questions swirl around his father's classified docs,"President Biden’s son, Hunter, was spotted in sunny Malibu, California, on Thursday amid speculations over his involvement in the president’s classified document scandal."
2023-01-13 18:33:53,McCarthy invites Biden to deliver State of the Union address Feb. 7,"House Speaker Kevin McCarthy on Friday invited President Biden to ""fulfill his duty under the Constitution"" and deliver a State of the Union address on Feb. 7."
2023-01-13 18:30:05,Jim Jordan launches first investigation as Judiciary chair into Biden classified docs scandal,"Rep. Jim Jordan's first investigation as the head of the House Judiciary Committee is an investigation into President Biden's ""mishandling"" of classified documents."
2023-01-13 18:20:37,Who had access to Biden classified documents? Republican demands White House release Delaware visitor logs,"Texas Congressman Lance Gooden wrote a letter to President Biden demanding that he turn over visitor logs for the president's Delaware home, where classified documents were discovered."
2023-01-13 18:12:17,Numerous people visited Joe Biden's house while classified documents were stored in his Wilmington garage,White House press secretary Karine Jean-Pierre dodged questions Thursday on whether the Biden administration would release a visitor log of the president's Wilmington residence.
2023-01-13 18:09:19,Minnesota Gov. Walz gives tax relief bill 1st signature of legislative session,"Democratic Minnesota Gov. Tim Walz signed his first bill of the 2023 legislative session Thursday, which focused on simplifying tax filing and more broadly providing tax relief."
2023-01-13 20:49:03,Florida Gov. DeSantis announces prescription drug legislation,Florida Gov. Ron DeSantis announced Thursday prescription drug legislation allowing consumers more flexibility. The goal of the proposal is to decrease the price of prescription drugs.
2023-01-13 20:42:40,White House on classified Biden documents: 'This has been done in a transparent way',White House press secretary Karine Jean-Pierre insisted Friday that the administration has been transparent about classified documents found at President Biden's home.
2023-01-13 20:36:36,Republicans end Capitol Hill smoking ban,"Republicans have walked back a more than decade-long ban on smoking in the Capitol, established under former House Speaker Nancy Pelosi in 2007."
2023-01-13 20:30:23,"In Kansas, tensions mount between Democrat governor and GOP legislature over surplus plans",Discrepancies between budget proposals by Democratic Kansas Gov. Laura Kelly and the state's Republican-controlled legislature have begun opening serious political rifts in Topeka.
2023-01-13 20:26:35,DHS helps ‘noncitizen workers’ avoid deportation when they report US labor violations,"DHS on Friday said it was boosting protections for noncitizen workers who report labor rights violations in the U.S., by allowing them to avoid deportation."
2023-01-13 20:26:24,"A look inside the Pentagon, the heart of the US military","First opened in 1943, the 6.5 million square foot Pentagon serves as a headquarters for the Army, Navy, and Air Force and houses about 27,000 personnel."
2023-01-13 20:22:12,Activists unsurprised by WI elections official's voter turnout comments,"Activist groups are largely unsurprised by Republican Wisconsin elections official Robert Spindell's comments about voter turnout in Milwaukee, particularly in majority-minority areas."
2023-01-13 20:14:21,The White House: A historical look inside America’s most iconic residence,Take a look inside the White House – an icon of American politics that has served as the primary residence of the president of the United States since 1800.
2023-01-13 20:13:17,"Florida hires more than 1,000 officers in six-month period, with bonuses totaling $5M","Florida has hired more than 1,000 officers since last summer, awarding those who joined the state's law enforcement ranks with bonuses that totaled more than $5 million."
2023-01-13 19:34:39,UN’s shot at Biden’s border plan marks latest in fierce pushback from left-wing groups,The United Nations' strong criticism of the Biden administration's border plans marks the latest pushback from left-wing groups on the measures revealed last week.
2023-01-13 19:32:36,AK Gov. Mike Dunleavy proposes plan to capitalize on carbon markets,"Alaska Gov. Mike Dunleavy plans to introduce a carbon management bill, which could help the state diversify its oil-reliant revenues by capitalizing on carbon markets."
2023-01-13 19:26:45,NJ congressman demands investigation into whether offshore wind projects are killing whales,"Rep. Jeff Van Drew, a Republican from New Jersey, called for an investigation into off-shore wind projects in the Garden State after several dead whales washed ashore over a few weeks."
2023-01-13 21:50:05,Pentagon considers back pay for troops discharged over now-repealed COVID vaccine mandate,The Pentagon says it is considering back pay for service members discharged for refusing the coronavirus vaccine following the mandate's repeal.
2023-01-13 21:33:18,Biden spends weekend at Wilmington house where lawyers discovered classified docs,"President Biden is spending his weekend at his residence in Wilmington, Delaware, where Obama-era classified documents were found this week."
2023-01-13 21:04:24,Pennsylvania court decides special elections to fill state House vacancies will be held on Feb. 7,The election to fill the three vacancies in the Pennsylvania House are set to be held on Feb. 7. Partisan control of the state's chamber is at stake.
2023-01-13 20:52:49,"NY Dem calls on George Santos constituents to confront him in person, make his life a 'living nightmare'","A Nassau County Democratic lawmaker called on New York voters to confront Republican Rep. George Santos and ""make his life a living nightmare"" at a protest outside Santos' Queens office Friday."
2023-01-13 23:15:37,New York Democrats introduce Santos Act aimed at preventing candidates from lying about background,A new bill aimed at Rep. George Santos' lies about his resume and family history would require congressional candidates to file more background information with the FEC.
2023-01-13 23:02:42,Trump's deposition unsealed in E. Jean Carroll defamation lawsuit,"Former President Trump's deposition in the E. Jean Carroll defamation case will be unsealed, U.S. District Judge Lewis Kaplin ordered on Friday."
2023-01-13 22:25:04,Illegal immigrant fugitives wanted for homicide and human trafficking deported by ICE,"ICE announced this week that it had deported multiple illegal immigrants wanted for homicide and human trafficking, as deportations remained low during FY 2022."
2023-01-14 00:18:55,Republicans open investigation into botched 2021 Afghanistan withdrawal,"Rep. Michael McCaul, chairman of the House Foreign Affairs Committee, renewed a request for documents on the 2021 Afghanistan withdrawal with the State Department Thursday."
2023-01-14 00:09:48,Illinois Gov. Pritzker signs sweeping abortion protections into law,Democratic Illinois Gov. J.B. Pritzker signed into law a bill to insulate out-of-state abortion seekers from criminal penalties and affirm the practice's legal protection at home.
2023-01-14 00:00:47,Who is Bob Bauer? Biden taps Obama lawyer to handle garage-gate scandal over handling of classified documents,"The White House on Friday announced that Bob Bauer will represent President Biden personally as the special counsel investigates the storage of classified documents at Biden's Wilmington, Delaware, home and think tank in Washington, D.C."
2023-01-14 03:02:08,Kristi Noem says Biden admin. blocked July 4 Mt. Rushmore fireworks for third straight year,South Dakota Governor Kristi Noem tweeted that the Biden administration has once again blocked the state from hosting Independence Day fireworks at Mt. Rushmore.
2023-01-14 02:32:20,Florida Gov. Ron Desantis' office blasts NHL for 'discriminatory' job fair,Florida Governor Ron DeSantis's office is blasting the National Hockey League after it announced a job fair that only allows certain groups of people to attend.
2023-01-14 02:13:38,"Missouri House tightens women's dress code, requiring covering of arms",Republican Missouri State Representative has taken heat after she proposed a rule in the dress code for female lawmakers.
2023-01-14 05:12:48,NHL backtracks after Florida Gov. Ron Desantis' office blasts league for 'discriminatory' job fair,"The NHL is playing clean-up after Florida Gov. Ron DeSantis' office blasted the National Hockey League for hosting a ""discriminatory"" job fair"
2023-01-14 05:09:36,"New House 'Anti-Woke Caucus' will push back on 'wokeness tyranny' in schools, military, govt, GOP rep says","Republican Rep. Jim Banks of Indiana will push back on the ""wokeness"" agenda in Congress and in businesses and schools across the country with a new ""Anti-Woke Caucus."""
2023-01-14 11:00:53,Sending signals: Arkansas’ Asa Hutchinson says Iowa trips show he’s ‘serious’ about potential 2024 run,Former Arkansas Gov. Asa Hutchinson makes two trips this week to Iowa – which he acknowledges is a sign that he’s seriously considering a Republican White House run.
2023-01-14 10:14:54,George Santos dismissed calls to resign from campaign staff after background check uncovered lies: report,Rep. George Santos dismissed calls from his campaign staff to resign after a background check uncovered lies. He is now facing calls to resign from members of Congress.
2023-01-14 13:00:56,McCarthy scores bipartisan victories on China in first week of 118th Congress,"House Speaker Kevin McCarthy notched two big bipartisan wins this week on China, a sign Democrats are hungry for more oversight of America's biggest strategic competitor."
2023-01-14 13:00:16,George Santos not going anywhere two weeks into the new Congress,"Embattled Congressman George Santos, R-N.Y., is not going anywhere anytime soon despite calls for his resignation and referral to the House Ethics Committee for investigation."
2023-01-14 12:48:18,"GOP lawmakers, NRA slam ATF rule to regulate pistol braces: 'Unconstitutional overreach'",Republican lawmakers and gun rights groups slammed the Biden administration after ATF finalized a new rule regulating pistols equipped with a stabilizing brace accessory as a short-barreled rifle.
2023-01-14 13:45:09,Why Kevin McCarthy booted three left-wing Democrats from their House committees,"House Speaker Kevin McCarthy has confirmed that House Democrats Adam Schiff, Ilhan Omar, and Eric Swalwell will not retain their committee assignments over past actions."
2023-01-14 15:04:20,Adams says NYC at 'breaking point' as asylum seekers continue to arrive in record numbers,"Mayor Eric Adams said Friday that New York City was at its ""breaking point"" after reportedly receiving more than 3,100 asylum seekers over the course of the past week."
2023-01-14 16:43:03,Supreme Court takes up religious freedom case involving postal worker who refused to work on Sunday,The U.S. Supreme Court on Friday agreed to hear a religious liberty case concerning a U.S. Postal Service worker who declined to work on Sundays.
2023-01-14 16:35:03,McCarthy hits the ground running as Republican majority notches up productive first week,"House Republicans are off to a running start under new Speaker Kevin McCarthy, passing an ambitious rules package and other legislation in the first week."
2023-01-14 17:02:44,White House aides find 5 more classified documents at Biden's Delaware home,"White House aides announced the discovery of five additional documents with classified markings at President Biden's home in Wilmington, Delaware, on Thursday."
2023-01-14 18:25:58,"Catholic bishops celebrate Born Alive Act, condemn 210 Democrats who voted against",Several Catholic bishops in the United States weighed in on the House's successful passage of the Born-Alive Abortion Survivors Protection Act.
2023-01-14 18:17:24,What we know so far: Timeline of Biden's classified documents debacle,"A timeline of the discovery of now three sets of classified documents at the Penn Biden Center in Washington, D.C., and the garage of President Biden's personal residence in Wilmington, Delaware."
2023-01-14 17:50:46,"5 more classified documents found at Biden's Delaware home, White House lawyer says","White House aides announced the discovery of five additional documents with classified markings at President Biden's home in Wilmington, Delaware, on Thursday."
2023-01-14 20:27:27,Oregon congresswoman suffers concussion after being hit by car,U.S. Rep. Suzanne Bonamici of Oregon is expected to make a full recovery after she and her husband were hit by a car while crossing a street.
