DATE,TITLE,SUMMARY
2023-01-18 22:32:02,"SCOTUS shoots down appeal of NY concealed carry restriction ruling, allowing gun law to still be enforced",The U.S. Supreme Court on Wednesday denied a request for an injunction against New York's concealed carry restrictions brought by a group of gun store owners.
2023-01-18 22:25:45,"Trump says Facebook 'needs us more than we need them,' as campaign calls for reinstatement","Former President Trump told Fox News Digital on Wednesday that Facebook ""needs us more than we need them,"" but confirmed that his campaign is working to discuss his reinstatement to the platform with Meta CEO Mark Zuckerberg ahead of the 2024 election cycle."
2023-01-18 22:21:47,"GOP insiders say Newsom won’t save Democrats in 2024 if Biden bows out, vow to 'mop the floor’ with him",GOP insiders say Democrats shouldn't count on California Gov. Gavin Newsom to keep the White House if President Biden decides against running again in 2024.
2023-01-18 22:13:34,Biden seen holding 'classified document' in resurfaced 2013 photo,A photo from 2013 has resurfaced of President Biden — then serving as vice president in the Obama administration — holding a classified document in front of cameras.
2023-01-18 22:00:47,"Burgess Owens slams San Francisco's $5 million reparations plan: 'Condescending, counterproductive, illogical'","Rep. Burgess Owens is slamming a reparations proposal in San Francisco, saying it ""conveys a racist narrative that Black Americans are a hopeless."""
2023-01-18 21:31:35,POLL: Over half of Americans believe Biden mishandled classified documents,A Quinnipiac University national poll found that most Americans do not think President Joe Biden properly handled classified documents found in his possession.
2023-01-18 21:25:16,"Byron Donalds is asked about George Santos, points out Democratic senator who 'lied about his service'",Florida Rep. Byron Donalds said Wednesday that George Santos should be allowed to sit on House committees while a possible House ethics investigation plays out.
2023-01-18 21:24:29,MT lawmakers seek to interpret state constitution as means to restrict abortion,"Montana lawmakers suggest the state’s constitutional right to privacy extends to unborn babies and should not be infringed upon, a move that could restrict or ban abortion."
2023-01-18 21:23:46,California bill would allow Mexican students near border to pay in-state community college tuition,A new bill introduced in California would allow some low-income Mexico students to be exempted from nonresident tuition fees when attending community colleges.
2023-01-19 00:25:07,"Kamala Harris is Biden's 'shrewd insurance policy' against impeachment, Boebert says","Colorado GOP Rep. Lauren Boebert told Fox News Digital that she thinks President Biden has a ""shrewd insurance policy"" against impeachment, citing Vice President Harris."
2023-01-19 00:04:17,Al Gore says Inflation Reduction Act mainly climate change bill,Former Vice President Al Gore said the Inflation Reduction Act is mainly a climate change bill during a panel discussion.
2023-01-18 23:58:14,Eric Swalwell denies wrongdoing in Chinese spy scandal,Rep. Eric Swalwell is denying he did anything wrong after a suspected Chinese spy reportedly got close to him during his 2014 reelection campaign.
2023-01-18 23:49:48,Republicans Gaetz and MTG trade blows on Twitter as bad blood from House speaker fight continues,Reps. Matt Gaetz of Florida and Marjorie Taylor Greene of Georgia on Wednesday traded barbs on Twitter after the congressman praised his colleague for her new committee assignments.
2023-01-18 23:43:46,Minnesota Democrat argues for menstrual products in boys' bathrooms: 'Not all who menstruate are female',The Minnesota Legislature is considering a bill that would require all public and charter schools to make menstrual products available in girl and boy restrooms.
2023-01-18 23:22:36,Biden classified documents: National Archives won't share info with House Republicans without DOJ approval,"Information about the Joe Biden classified documents cannot be shared with Congress without approval from the Justice Department, the National Archives said."
2023-01-19 03:12:58,Biden admin to launch pilot program to allow Americans to sponsor refugees directly,"The Biden administration on Thursday will announce a program to allow Americans to sponsor refugees if they meet certain criteria, Fox News Digital has confirmed."
2023-01-19 01:48:03,Florida Rep. Greg Steube hospitalized after falling off roof: report,"Congressman Greg Steube has been injured in an accident at his home, according to his staff."
2023-01-19 01:47:12,Utah bill looks to ban gender-affirming surgery for minors,"A proposed bill in Utah would ban gender-affirming surgery for minors. Several states across the U.S. have considered similar bans, including Florida, Arkansas, and Arizona."
2023-01-19 04:00:58,"2024 Watch: Trump’s in – what about DeSantis, Pence, and other potential contenders, long shots, & wild cards",Former President Donald Trump is the only major Republican to date to launch a 2024 presidential campaign. Here's a look at Florida Gov. Ron DeSantis and the other potential contenders
2023-01-19 07:01:31,Matt Gaetz says classified docs scandal 'feels like the Democrats are taking out Joe Biden',"Rep. Matt Gaetz, R-Fla., said Wednesday there's an ""element"" to the Biden classified documents scandal that ""feels like the Democrats"" are trying to unseat the president."
2023-01-19 07:00:42,Conservatives sharpen their spears for historic debt ceiling fight,"Conservatives are getting ready for a fight over the debt ceiling, but one immediate question is whether Democrats will send anyone to the negotiating table."
2023-01-19 10:00:35,Energy workers haven't forgotten and won't forgive Biden for killing Keystone XL jobs: 'It's un-American',"Power the Future, an energy group, released a video blasting the Biden administration for canceling the Keystone XL pipeline two years ago, blaming it for thousands of job losses."
2023-01-19 09:44:07,'Boy Meets World' actor Ben Savage running for California House District 30: report,"""Boy Meets World"" actor Ben Savage is reportedly making another run in politics by entering the race for California's 30th House District. The seat is currently held by Adam Schiff."
2023-01-19 11:38:38,Political cartoons of the day,
2023-01-19 11:02:28,Group backing Ron DeSantis to spend $3.3M to make him the Republican nominee over Donald Trump in 2024: report,"Florida Governor Ron DeSantis has not announced a bid for the White House in 2024, but a political action committee is reportedly looking to shell out major money to make it happen."
2023-01-19 11:00:06,Team investigating Trump classified docs includes seasoned DOJ officials who prosecuted his top allies,"Special Counsel Jack Smith's team of investigators looking into Trump classified documents include seasoned DOJ officials, some of whom prosecuted Trump allies."
2023-01-19 14:13:08,"George Santos said his mother was in World Trade Center on 9/11, but records show she was in Brazil: report","Rep. George Santos's campaign website says his mother was in the South Tower of the World Trade Center on Sept. 11, 2001, but records reportedly show she was not in the U.S."
2023-01-19 13:47:40,Former Ohio House Speaker Larry Householder's $60M bribery trial to begin next week,A trial for Larry Householder regarding the largest corruption case in Ohio's history is set to begin next week. Householder was allegedly involved in a $60 million bribery scheme.
2023-01-19 12:43:29,"Democratic kingmaker Clyburn 'all-in' for Biden 2024, issues warning against primary challengers","South Carolina Congressman James Clyburn says he's ""all-in"" for President Biden to run for re-election in 2024, warning Democrats not to mount a primary challenge to the sitting president."
2023-01-19 15:00:30,Missouri’s new senator vows to fight 'overzealous' Biden administration,"Eric Schmitt, freshman senator from Missouri, vows to bring a ""fighting spirit"" to Capitol Hill and ""go after"" an ""overzealous and overbearing and overreaching federal government."""
2023-01-19 14:49:47,House Speaker Kevin McCarthy officially ends proxy voting,"House Speaker Kevin McCarthy, R-Calif., on Thursday ended proxy voting in the House of Representatives, requiring lawmakers to be present in-person to cast votes."
2023-01-19 14:47:57,George Santos denies performing as a drag queen in Brazil despite photo: 'categorically false',"George Santos has denied claims that he once performed as a drag queen named ""Kitara"" in Brazil, dismissing the report as ""categorically false"" on Thursday."
2023-01-19 14:36:58,SD Gov. Noem's grocery tax cut hits obstacle in GOP-dominated legislature,A repeal of South Dakota's grocery tax proposed by Republican Gov. Kristi Noem is being debated by lawmakers unsure of whether the move would prompt an untenable decline in state revenue.
2023-01-19 14:35:32,"Biden classified document investigation: Secret Service ready to provide Delaware visitors, source says","The U.S. Secret Service maintains an incomplete list of background checks for visitors to President Biden's Wilmington, Delaware, residence where classified documents have been found."
2023-01-19 14:21:37,Eric Adams leads US mayors to demand Biden take action on immigration crisis,New York City Mayor Eric Adams led U.S. mayors in demanding more action from President Biden and Congress to address the immigration crisis on Wednesday.
2023-01-19 14:19:51,Nancy Pelosi takes Hakeem Jeffries on tour of California's high-class Democrat donors,Democratic Leader Hakeem Jeffries will meet with California's top Democratic donors on Thursday during a tour of the state with former Speaker Nancy Pelosi.
2023-01-19 14:18:35,Kansas man on trial for threatening congressman cross-examines him in court,"Chase Neill, who stands accused of threatening to kill Republican Kansas Rep. Jake LaTurner, attempted to cross-examine the congressman in court Wednesday."
2023-01-19 15:54:08,Florida Rep. Greg Steube hospitalized after falling from ladder,"Rep. Greg Steube has been injured and hospitalized after falling off a ladder at his Sarasota, Florida home, Wednesday, according to his office."
2023-01-19 15:47:51,"FBI offers $25K reward for info on pro-life pregnancy center attacks, vandalism",The Federal Bureau of Investigation is offering cash rewards for information on a series of violent attacks on pro-life pregnancy and health care centers.
2023-01-19 15:35:44,FAA Outage: Congressional report notes lawmakers knew messaging system had problems 'for years',"For years, the FAA and members of Congress have been trying to fix and update the Notice to Air Missions system that malfunctioned last week, leading to nationwide delays."
2023-01-19 15:25:10,Democrat Andrea Campbell becomes first Black woman to serve as Massachusetts attorney general,The new Massachusetts Attorney General Andrea Campbell was sworn in on Wednesday. Campbell is the first Black woman to serve as the attorney general in the state's history.
2023-01-19 15:24:05,"Self-driving cars create new opportunities for terrorist attacks, says FBI Director Chris Wray","FBI Director Christopher Wray warned Thursday that terrorists might try to employ self-driving cars in attacks against Americans, and also create new data targets."
2023-01-19 15:16:49,"Florida congressman spends night in ICU after falling 25 feet off ladder, injuries not life-threatening","Florida Rep. Greg Steube is in ""good spirits"" after falling off a ladder at his Sarasota, Florida property and being rushed to the intensive care unit."
2023-01-19 17:16:11,California’s top oil regulator steps down amid neighborhood drilling battle,California’s top oil regulator Ntuk has quit after three years of leading the California Geologic Energy Management Division. His resignation came amid a statewide drilling battle.
2023-01-19 17:07:23,"Jill Biden gets lesion removed from eyelid, deemed noncancerous",A noncancerous lesion was removed from Jill Biden’s left eyelid. The first lady also had two other lesions removed recently that cancerous but likely curable.
2023-01-19 17:00:44,'SMEAR MACHINE': Indiana Republican sounds off after Air Force admits to 'unauthorized release' of her records,"Jennifer-Ruth Green says she feels “vindicated,” yet “frustrated,"" after the Air Force admitted that her military personnel records were released to a third party ""without proper redaction."""
2023-01-19 16:56:05,"New York City becomes first government to distribute free abortion pills, officials say","New York City launched a plan Wednesday to become the first city in the nation to offer free abortion drugs, which have four times the complication rate as surgical abortions."
2023-01-19 16:44:14,4th Republican launches campaign for Louisiana gubernatorial race,A fourth Republican has announced his campaign for the Louisiana gubernatorial race on Wednesday. The election is nine months away and it remains unclear which Democratic will run.
2023-01-19 16:41:03,Comer calls on border officials to testify on Biden policies 'fueling' migrant crisis,Chairman James Comer of the House Oversight Committee announced that it will hold a hearing next month with Biden administration career border officials.
2023-01-19 16:30:29,Kamala Harris to avoid the US-Mexico border during her Thursday visit to Arizona,"Vice President Kamala Harris is not scheduled to visit the border in her trip to Arizona Thursday, even though she was tasked as border czar to deal with the border crisis."
2023-01-19 16:26:44,Deaf Michigan man appears to win Supreme Court's sympathy as arguments begin,"The Supreme Court appears inclined to rule in favor of Miguel Luna Perez, a deaf Michigan man alleging his school district did not provide him adequate assistance under federal law."
2023-01-19 16:25:03,Indiana Supreme Court hearing challenge to statewide abortion ban,The Indiana Supreme Court is hearing a challenge to the state's near-total abortion ban that was passed following the 2022 overturn of Roe v. Wade.
2023-01-19 18:54:36,Harris to push abortion during Florida trip on Roe v. Wade anniversary,"Vice President Kamala Harris will appear in Florida on Sunday, where she is expected to speak on Democrats' pro-abortion agenda on the anniversary of the Roe v. Wade decision."
2023-01-19 18:53:47,Al Gore explains global AI program that is spying on thousands of facilities to monitor emissions,Former Vice President Al Gore on Thursday explained how the Climate TRACE initiative is tracking climate emissions right down to the level of individual facilities.
2023-01-19 18:48:21,"George Santos trashes report claiming he 'let a dog die,' vows negative coverage 'won't stop me'","Rep. George Santos, the embattled first-year congressman facing a slew of ethics probes, ripped a new report alleging he stole $3,000 meant to save a veteran's dog, calling it a ""distraction."""
2023-01-19 18:36:44,Alabama Secretary of State Allen announces withdrawal from voter registration group,Alabama's Secretary of State Wes Allen announced the state's withdrawal from a voter registration group. Allen said that the state will no longer be involved in sharing voting data.
2023-01-19 18:30:03,GOP reps blast DOJ for not watching Biden attorneys handling classified docs: ‘you can’t make this stuff up’,GOP lawmakers weighed in on the Wall Street Journal report that the DOJ held off on having the FBI monitor President Biden's lawyers as they searched his home for classified documents.
2023-01-19 18:12:52,New York Senate rejects Gov. Hochul's nominee to lead the state's highest court,New York Gov. Kathy Hochul nominated Hector Lasalle to lead the state's top court. Gov. Hochul's nominee was rejected by the New York Senate.
2023-01-19 17:48:27,DeSantis takes aim at Biden over handling of documents,Florida Gov. Ron DeSantis took a shot at President Biden on Wednesday after classified documents were recently found in a former Washington office and the president's home.
2023-01-19 17:42:43,Hunter Biden 'quarantined' at Delaware house where classified docs found: 'There was no escaping',President Biden's son Hunter Biden wrote in his memoir in 2021 that he “quarantined” at the Delaware home where classified documents were recently found.
2023-01-19 17:37:42,Biden's inner circle met at Wilmington home where classified docs found,"Classified documents were recently discovered at the same Wilmington, Delaware, home where Biden hosted his inner circle post-vice presidency."
2023-01-19 20:53:30,West Virginia Gov. Justice appoints William Marshall as corrections commissioner,West Virginia Gov. Justice has selected William Marshall to serve as the state's commissioner of the Division of Corrections and Rehabilitation. Marshall is replacing Betsy Jividen.
2023-01-19 20:33:51,Supreme Court leak: Conservatives react to court's inability to find leaker in historic abortion ruling,Conservatives are reacting a report by the Supreme Court outlining that it has been unable to find out who leaked a draft opinion in the Dobbs v. Jackson Women's Health Organization case.
2023-01-19 20:22:36,"Mayorkas claims border encounters have dropped 'significantly' as he faces investigation, possible impeachment","DHS Secretary Alejandro Mayorkas says border encounters ""dropped significantly"" since the agency announced new border actions, but he didn't provide details to support the claim."
2023-01-19 20:15:39,Missouri sued by pro-abortion clergy over post-Roe ban,Pro-abortion religious leaders are suing the state of Missouri over an abortion ban that was enacted following the overturn of Roe v. Wade.
2023-01-19 19:51:31,Wisconsin bail amendment headed to ballot box in April,"A Wisconsin constitutional amendment that would make bail more difficult to obtain for violent offenders, will be put to a public referendum on April 4."
2023-01-19 19:42:52,Supreme Court investigation fails to identify leaker of Dobbs draft decision,"After the leak of a Supreme Court draft decision that would overturn Roe v. Wade, the court launched an investigation, but it has yielded no culprits as of January."
2023-01-19 19:14:51,Mississippi Senate leaders unveil health care proposals,Mississippi Senate leaders are suggesting an $80 million health care proposal for hospitals that are financially struggling. This grant will aid people in getting necessary health care.
2023-01-19 19:13:08,Arizona court rejects GOP push to end early voting,The Arizona Court of Appeal this week rejected an attempt by the GOP to end early voting by arguing mail-in voting violates the state's constitution.
2023-01-19 19:12:40,AZ early voting system ruled constitutional,Arizona’s early voting system was ruled constitutional by the state’s Court of Appeals. It was previously challenged by the state’s Republican Party.
2023-01-19 22:59:48,Nikki Haley exploring 2024 presidential run: 'I've never lost a race',"Nikki Haley says she's close to making a decision on a possible 2024 presidential run, saying that she has ""never lost a race"" and is ""not going to lose now."""
2023-01-19 22:41:01,Biden won't make 2024 announcement until after State of the Union: sources,"President Biden will not make an announcement on a 2024 re-election campaign until after the State of the Union address, according to sources."
2023-01-19 22:30:27,Pennsylvania Democrats push to commemorate 'Jan. 6 Day' in public schools with new bill,"Three Democratic legislators in Pennsylvania are set to introduce a bill this year to establish ""Jan. 6 Day"" at public schools."
2023-01-19 21:52:34,House Judiciary Committee to investigate leak of Supreme Court opinion after SCOTUS whiffs,The House Judiciary Committee will investigate the leak of the opinion that signaled the overturning of Roe v. Wade after a formal investigation failed to identify the culprit.
2023-01-19 21:52:28,Copy of 'Uncle Tom's Cabin' sent to Byron Donalds' office: 'Hate in their heart',"Florida GOP Rep. Byron Donalds – one of only a handful of Black Republican lawmakers serving on Capitol Hill – says his office received a copy of “Uncle Tom's Cabin” at his Washington, D.C., office."
2023-01-19 21:28:39,Biden classified documents: White House refuses to say if it will cooperate with House oversight inquiries,The White House shut down any discussion of the ongoing investigation into President Biden's possession of classified documents at a press gaggle Thursday.
2023-01-19 21:14:43,Kansas man tells jury God threatened Rep. LaTurner through him,"Chase Neill, while standing trial for threatening the life of Republican U.S. Rep. Jake LaTurner of Kansas, told jurors that God himself was threatening the congressman through him."
2023-01-20 00:36:37,Biden says ‘no regrets’ over classified doc handling: ‘Nothing there’,"President Biden said Thursday he had ""no regrets"" when asked about his mishandling of classified documents found on four separate occasions."
2023-01-20 00:23:00,"EXCLUSIVE: Border Patrol chief fumed at Biden admin’s handling of whipping controversy, emails show","Border Patrol Chief Raul Ortiz pushed back at the handling of a furor over allegations that agents had whipped illegal Haitian migrants in 2021, new emails reveal."
2023-01-20 00:19:30,Virginia residents reject massive solar farm plan for third time over environmental concerns,"A northern Virginia county moved closer to denying a third application for a large solar farm, citing concerns over environmental and agriculture impacts."
2023-01-20 00:07:41,"ICE releases nearly 3,000 detained immigrants affected by accidental data leak","ICE confirmed Thursday that has released thousands of immigrants who were affected by a data leak that published personal information of more than 6,000 last year."
2023-01-19 23:52:48,"Trump blasts Biden administration's 'two-tiered justice system,' asks why Biden gets 'white glove treatment'","Donald Trump on Thursday said slammed the nation's ""two standards of justice,"" claiming that President Biden was getting the ""white glove treatment"" in the classified document probe."
2023-01-20 02:30:41,Florida Supreme Court upholds state law banning local governments from implementing restrictions on guns,"In a 4-1 ruling, the Florida Supreme Court rejected a challenge to a state law that prevents local officials from implementing restrictions on gun and ammunition sales."
2023-01-20 01:37:12,Biden says ‘no regrets’ over classified document discovery handling: ‘Nothing there’,"President Biden said Thursday he had ""no regrets"" when asked about his mishandling of classified documents found on four separate occasions."
2023-01-20 01:06:19,AOC files for re-election in deep-blue New York Congressional district,AOC filed for re-election for her New York 14th Congressional District seat on Thursday after cruising to re-election in November 2022.
2023-01-20 00:57:31,"House conservative leader rips media for ‘irrational’ debt ceiling coverage, vows ‘serious fiscal reform’","The chairman of the RSC tore into the press for its hysterical coverage of the debt ceiling, and told his members the GOP would insist on spending cuts before allowing more borrowing."
2023-01-20 03:21:50,US sending another $2.5 billion in military aid to Ukraine,"The U.S. announced another $2.5 billion in military aid for Ukraine on Thursday, bringing the total security assistance to $26.7 billion since Russia invaded."
2023-01-20 02:39:28,Larry Elder takes aim at San Francisco’s $5 million reparations plan: ‘When do we stop?’,"TV and radio host Larry Elder is taking aim at a new proposal in San Francisco to give $5 million to longtime Black residents in the city, asking ""When do we stop?"""
2023-01-20 07:00:46,DeSantis ally warns against donating to ‘Ready for Ron’ as PAC plans to spend $3.3M on ads,"Florida Gov. Ron DeSantis is keeping his distance from Ready for Ron, a PAC that says it will spend $3 million to convince DeSantis to run for president"
2023-01-20 07:00:41,"Gavin Newsom's wife's films shown in schools contain explicit images, push gender ideology, boost his politics","A group founded by Jennifer Siebel Newsom, California Gov. Gavin Newsom's wife, licenses films she directs to public schools that push gender ideology and boost her husband."
2023-01-20 09:28:54,Rep. Greg Steube's 25-foot fall seen by delivery driver who called for help: 911 audio,A 911 call sheds new light on the 25-foot fall Florida Rep. Greg Steube suffered at his home. A delivery driver saw him fall after a branch hit the ladder he was on.
2023-01-20 11:00:14,Attacks and ambushes - the GOP battle for Indiana’s open Senate seat could turn into a ‘Republican civil war’,The potential Republican primary battle for Indiana’s open Senate seat between Rep. Jim Banks and former Gov. Mitch Daniels is showing signs of becoming very heated very quickly
2023-01-20 11:00:12,Pro-lifers set for 50th March for Life after fall of Roe v Wade,"Pro-lifers are set to rally in the nation’s capital Friday for the 50th March for Life, which will mark the first time the event took place since the overturn of Roe v. Wade."
2023-01-20 13:22:09,White House previews Biden re-election message on two-year anniversary of inauguration,The White House has sent a memo to Democratic lawmakers and Biden allies touting the president's accomplishments and previewing themes he could emphasize in a re-election campaign.
2023-01-20 12:56:36,McCarthy move to end proxy voting pressures members to show up given narrow GOP majority,Speaker Kevin McCarthy’s decision to end proxy voting means members will be under pressure to show up for work given the narrow GOP majority that makes every vote count.
