DATE,TITLE,SUMMARY
2023-01-23 05:44:48,Kamala Harris omits right to 'life' when quoting Declaration of Independence in abortion speech,Vice President Kamala Harris left out including the right to life when quoting the Declaration of Independence during remarks about abortion access.
2023-01-23 07:05:45,'You don't need an AR-15': A look at some of Biden's most inaccurate remarks about firearms and 2A supporters,"Joe Biden's tenure in the White House has been marked by a consistent tone surrounding the Second Amendment and firearms, a tone he used even before he became president."
2023-01-23 07:00:45,Meet Biden’s re-nominated judges one Republican called ‘extremists’ and ‘radicals’,The Senate Judiciary Committee will reconsider a batch of judges who have records of defending and fighting for lenient sentencing of violent criminals.
2023-01-23 14:03:44,Pentagon preparing for Speaker McCarthy to visit Taiwan,"The U.S. military is drafting plans to ensure House Speaker Kevin McCarthy's safety on a trip to Taiwan later this year, his first major foreign trip as speaker."
2023-01-23 14:02:11,House GOP gives lawmakers a chance to amend legislation for the first time in nearly 7 years,"For the first time in nearly seven years, House Republicans will allow a modified open amendment process on the House floor, giving all members a say in legislating."
2023-01-23 14:52:32,West Virginia university leaders urge lawmakers to reconsider concealed carry bill,West Virginia university leaders including second amendment supporters are denouncing a concealed carry bill that would allow firearms on college campuses.
2023-01-23 14:22:58,What we know so far: Timeline of Biden's classified documents debacle,"A timeline of the discovery of now three sets of classified documents at the Penn Biden Center in Washington, D.C., and the garage of President Biden's personal residence in Wilmington, Delaware."
2023-01-23 16:19:44,"Jim Banks wins Stephen Miller’s backing for ‘bold pro-American agenda,’ after launching Senate bid","Stephen Miller, a former Trump White House adviser is backing Rep. Jim Banks in his Senate bid in 2024 -- touting his conservative credentials on a host of issues."
2023-01-23 16:13:45,"Who is Biden's incoming chief of staff, Jeff Zients?","President Biden's incoming chief of staff, Jeff Zients, served as the federal government's COVID-19 response coordinator, and in a number of other roles during the Obama administration."
2023-01-23 16:00:38,Republicans demand info from Secret Service on visitors to Biden's Delaware home amid classified docs scandal,House Oversight Republicans are demanding the Secret Service provide information on all visitors who may have been to President Biden's Wilmington home after classified documents were found.
2023-01-23 15:56:45,"Democrats push to eliminate the debt ceiling, allow unlimited government borrowing",Dozens of House Democrats are supporting a bill that would eliminate the debt ceiling and allow the federal government to borrow whatever it needs to pay its bills.
2023-01-23 15:42:59,House Democratic leader's non-binary child arrested in anti-cop protest had 'climate change' nightmares,"House Democratic Whip Katherine Clark's non-binary middle child who was arrested for allegedly assaulting a police officer was her child who had ""nightmares"" over climate change."
2023-01-23 15:42:16,Democratic lawmakers say insurrectionists shouldn't be allowed to run for government,Lawmakers across the country are saying that insurrectionists should not be able to run for government. Many states have already proposed laws in favor of this idea.
2023-01-23 15:29:33,Former Ohio House Speaker Larry Householder remains optimistic as corruption trial begins,Larry Householder is on trial in Cincinnati in what prosecutors have called the largest corruption case in Ohio's history. Lobbyist Matt Borges is also on trial.
2023-01-23 17:52:21,2024 battle for the Senate heats up as Republicans eye Democrats’ majority,There's been plenty of early action in the 2024 battle for the Senate as Republicans aim to win back the chamber's majority from the Democrats.
2023-01-23 17:51:10,"Supreme Court asks Biden admin to weigh in on Florida, Texas social media laws","In a Monday order, the Supreme Court invited the Biden administration to get involved in cases over Florida and Texas laws targeting censorship by social media platforms."
2023-01-23 17:47:03,Congress to return to DC with renewed focus on Biden admin investigations,GOP lawmakers in the House and the Senate are returning to Capitol Hill this week and are expected to hone in on their investigations into President Biden and his administration.
2023-01-23 17:06:39,Overwhelming majority of New Yorkers want George Santos to resign: poll,"A majority of New York voters believe Rep. George Santos should resign, and even a plurality of Republican voters would support the move, according to a new poll."
2023-01-23 16:47:40,FLASHBACK: Wikipedia page for Biden's incoming chief of staff was scrubbed by Dem firm to hide corporate past,"Democratic consulting firm Saguaro Strategies scrubbed the Wikipedia page of President Biden’s incoming chief of staff, Jeff Zients, prior to his appointment as the president’s COVID-19 czar in 2021."
2023-01-23 16:46:51,Democratic lawmakers in DE attempt to legalize marijuana again,Delaware Democrats are reattempting to establish a state-licensed recreational cannabis industry now that the chief bill sponsor has enough votes to make cannabis legal.
2023-01-23 18:46:09,Las Vegas judge who resigned to settle ethics investigation commits suicide by gunshot,A Nevada judge who resigned to settle a discipline investigation after getting entangled in a double-murder case has died. Her death was ruled as a suicide.
2023-01-23 18:43:39,Arkansas man who propped his feet on Nancy Pelosi's desk found guilty for role in Capitol protest,An Arkansas man was found guilty of charges relating to his role in the Jan. 6 Capitol protest. The man propped his feet on Nancy Pelosi's desk during the incident.
2023-01-23 18:31:36,Ted Cruz to reintroduce bill reinstating military members fired over vax mandates: 'We will keep fighting',Texas GOP Senator Ted Cruz is reintroducing his bill to reinstate military service members who were fired under the Biden administration's COVID vaccine mandate and give them back pay.
2023-01-23 18:00:05,Retired top FBI counterintelligence agent who led Trump-Russia probe arrested for own ties to Russian oligarch,"Charles McGonigal, once Special Agent in Charge of FBI NY's Counterintelligence Division, charged with money laundering, breaking US sanctions against Russia oligarch Oleg Deripaska."
2023-01-23 19:58:04,First on Fox: Trump stopping in New Hampshire ahead of South Carolina on Saturday,"Former President Donald Trump will stop on Saturday morning in New Hampshire, the state that for a century’s held the first presidential primary in the race for the White House."
2023-01-23 19:18:09,Legal experts slam FBI’s failure to search Biden’s Rehoboth home as classified documents pile up,"The White House declined to say whether the DOJ will conduct a search of President Biden’s Rehoboth, Delaware, residence – a move legal experts say lacks transparency."
2023-01-23 19:02:18,Global elites took 150+ private jets to fight climate change in Davos,"World leaders converged on Davos, Switzerland, last week to talk about major issues including climate change, but traveled largely to the summit on private jets."
2023-01-23 18:49:07,"Supreme Court leakers banned for life, fined $5,000 under GOP bill","House Republicans proposed a bill that would punish leakers of Supreme Court material with a lifetime ban from the federal court system, after the leak of a high-profile opinion last year."
2023-01-23 21:26:41,GOP senators pressure National Archives to provide 'full transparency' on connection to Biden classified docs,GOP senators are pressuring the National Archives to provide “full transparency” regarding its involvement in the existence of classified documents connected to President Biden.
2023-01-23 21:24:45,Watchdog finds up to $45B spent on fake COVID unemployment claims: ‘Substantial levels of fraud’,A new report from the federal government's watchdog agency found as much as $45 billion was wasted on fake unemployment claims during the COVID pandemic.
2023-01-23 21:21:42,Democratic Rep. Gallego hired staff with history of anti-police tweets to run 2024 Senate campaign,"Rep. Ruben Gallego, who just entered Arizona's 2024 Senate race, hired campaign staffers who have a history of anti-police rhetoric."
2023-01-23 20:49:28,Pete Ricketts sworn in as 100th U.S. senator after Ben Sasse retirement,"On Monday former Nebraska Gov. Pete Ricketts was sworn in as the 100th U.S. senator, taking the place of former Sen. Ben Sasse, who retired to be president of the University of Florida."
2023-01-23 20:45:57,"Buttigieg, Pelosi announce $400M federal grant for Golden Gate Bridge: 'manifestation of America'",Transportation Secretary Pete Buttigieg and Rep. Nancy Pelosi announced a $400 million federal grant to provide improvements to the Golden Gate Bridge.
2023-01-23 20:28:38,"As Biden touts US economy, Americans struggling to make car payments","A growing number of Americans with auto loans are struggling to make their monthly payments, despite President Biden touting the state of the U.S. economy under his stewardship."
2023-01-23 20:21:05,"C-SPAN pushes to 'liberalize' House floor feed after lengthy, drama-filled speaker battle",Rarely had there been such intense scrutiny focused on the House of Representatives prior to the first week of January as lawmakers struggled to elect a speaker.
2023-01-23 22:17:22,"CT Gov. Lamont proposes open carry ban, other gun restrictions","Democratic Connecticut Gov. Ned Lamont announced several proposed gun laws Monday, including tighter registration requirements, purchase limits, and an open carry ban."
2023-01-23 22:15:17,White House: Biden takes classified info 'very seriously' as more docs turn up: 'searched their sock drawer',"The White House reiterated that President Biden takes classified information ""very seriously"" on Monday after the latest batch of documents were discovered at his home in Wilmington, Delaware."
2023-01-23 22:14:30,Videos suggests George Santos partied in drag for years despite claim he dressed up for 'fun' at Brazil party,"Videos that surfaced last week appear to show Rep. George Santos, R-N.Y., dressed in drag on multiple occasions, contradicting his claim he only dressed up for ""fun"" at a Brazil party."
2023-01-23 22:07:08,"DeSantis fights back against White House, defends Florida's rejection of race-based lesson",Florida Gov. Ron DeSantis defended his state’s rejection of an Advanced Placement course on African-American studies — a decision the White House criticized days prior.
2023-01-23 22:01:15,"Russia installs air-defense systems in Moscow, as US focus remains on 'supporting Ukraine'","Russia has installed air-defense systems in several locations in and around Moscow after multiple Ukrainian drone strikes in Russian territory, Fox News has learned."
2023-01-23 21:58:59,Vermont Supreme Court rules in favor of cities allowing noncitizens to vote,The Vermont Supreme Court ruled in favor of policies in place in the cities of Montpelier and Winooski allowing noncitizens to vote in local elections.
2023-01-23 23:31:18,Florida Rep. Steube provides update on his recovery after 25 foot fall from Sarasota roof,"GOP congressman Greg Steube plans on carrying out his congressional duties from his Sarasota, Florida, home for several weeks."
2023-01-23 22:46:02,White House sheds no new light on Biden docs scandal in first response to Oversight Republicans,The White House did not shed much light on requested information from House Republicans seeking information into President Biden's classified documents scandal.
2023-01-23 22:38:37,"MN Gov. Walz proposes $300M for public safety, $1B for affordable housing in budget plan","Democratic Minnesota Gov. Tim Walz unveiled plans for spending on public safety, housing, and healthcare Monday as parts of his administration's budget proposal."
2023-01-23 23:31:18,Florida Rep. Steube provides update on his recovery after 25 foot fall from ladder at Sarasota home,"GOP congressman Greg Steube plans on carrying out his congressional duties from his Sarasota, Florida, home for several weeks."
2023-01-23 22:14:30,Videos suggest George Santos partied in drag for years despite claim he dressed up for 'fun' at Brazil party,"Videos that surfaced last week appear to show Rep. George Santos, R-N.Y., dressed in drag on multiple occasions, contradicting his claim he only dressed up for ""fun"" at a Brazil party."
2023-01-24 01:09:48,California Democrats consider wealth tax — including for people who moved out of state,California Democrats introduced legislation that would impose a new tax on wealthy residents — even if they've already moved out of the state.
2023-01-24 01:03:08,"South Dakota Gov. Noem says phone number hacked, blames Jan. 6 committee leak","South Dakota Gov. Kristi Noem said her cell phone was hacked, blaming the incident on the release of documents by the Jan. 6 committee, that included her Social Security number."
2023-01-24 00:57:13,"Democratic House Leader Jeffries demands McCarthy reappoint Schiff, Swalwell to Intelligence Committee","Democratic Leader Hakeem Jeffries demanded that House Speaker Kevin McCarthy reappoint Adam Schiff, Eric Swalwell and Ilhan Omar to the House Intelligence Committee."
2023-01-24 00:47:28,"DOJ treating investigations into Biden and Trump's handling of classified docs the same, Garland says",Attorney General Merrick Garland said Monday that the Justice Department is treating the investigations into classified documents found at the homes of Joe Biden and Donald Trump the same.
2023-01-24 01:42:10,South Dakota legislators push to teach American exceptionalism in public education,South Dakota lawmakers advanced an initiative allowing for an optional social studies curriculum in K-12 schools teaching American exceptionalism.
2023-01-24 01:37:54,South Dakota House passes $200M housing package,"The South Dakota House has approved a $200 million housing infrastructure fund, with the spending package now going to Republican Gov. Kristi Noem for final approval."
2023-01-24 02:41:37,California reels from string of mass shootings despite having some of the strictest gun laws in US,A gunman killed 11 people at a ballroom in Southern California Saturday evening and was in possession of numerous firearms and ammunition despite the state's strict gun laws.
2023-01-24 07:04:38,"Gavin Newsom clings to TikTok account after most states, Congress ban Chinese-owned app",California Gov. Gavin Newsom is still clinging to his TikTok account amid calls from state Republicans and Democrats to deactivate over security concerns.
2023-01-24 10:00:03,Service members forced to pay back signing bonuses after being fired over COVID vax: ‘Kick in the face’,Unvaccinated service members fired for failing to comply with the Pentagon's vaccine mandate are being forced to pay the government thousands to recoup their original signing bonuses.
2023-01-24 12:47:01,"Florida Supreme Court to hear case on abortion law signed by DeSantis, permits law to remain in effect for now","Florida's Supreme Court will hear a lawsuit challenging the state's 15-week abortion ban, which opponents have called ""dangerous"" and argued violates the state constitution."
2023-01-24 12:04:20,Biden's incoming chief of staff met with Hunter Biden at least three times in 2016,"Jeff Zients, President Biden's incoming chief of staff, met with Hunter Biden on multiple occasions in the final months of President Biden's tenure as vice president."
2023-01-24 14:47:55,Illinois fights back after judge slaps restraining order on gun control law,"Illinois Attorney General Kwame Raoul has appealed a judge's decision to slap the new gun control law with a temporary restraining order, arguing the order was improper."
2023-01-24 14:33:57,Half Moon Bay shooting: Biden pushes assault weapons ban despite few details on type of gun used,President Biden responded to the second mass shooting in California in less than a week by urging lawmakers to get an assault rifle ban on his desk.
2023-01-24 13:54:19,Hard-right McCarthy holdouts land spots on House Rules Committee after speaker fight,"Some of the Republican holdouts during McCathy's bid for speaker have been seated on the House Rules Committee, which sets the terms of debate and votes for bills on the House floor."
2023-01-24 13:50:23,NM bill aimed at protecting communities from climate crisis advances in Legislature,"New Mexico is advancing a bill to help local governments better prepare itself from climate-related threats, including floods, wildfires, and extreme heat."
2023-01-24 13:49:26,Retired top FBI official charged over ties to Russian oligarch faces 2nd indictment: 'Gateway to corruption',"Retired top FBI official Charles McGonigal, charged in New York over alleged ties to a sanctioned Russian oligarch, was hit with a second indictment in DC for over $225K payments."
2023-01-24 13:47:03,Kansas Gov. Laura Kelly will outline agenda for state Legislature in tonight's State of the State address,Kansas Gov. Laura Kelly is scheduled to give her State of the State address on Tuesday night. Some of the proposals expected to be mentioned by the governor include tax cuts.
2023-01-24 16:17:48,Freshman congresswoman boycotts Biden's White House reception for 118th Congress,"A freshman congresswoman will not attend President Biden’s reception Tuesday for the new Congress, citing lack of action from the White House on the border."
2023-01-24 16:14:47,Ghislaine Maxwell says she believes Jeffrey Epstein was 'murdered' in post-conviction prison interview: report,"Convicted sex-trafficker Ghislaine Maxwell says she believes Jeffrey Epstein was ""murdered"" in first post-conviction interview, also saying she wishes she ""never met"" him."
2023-01-24 16:11:59,US may deliver 'significant number' of Abrams tanks to Ukraine despite Pentagon misgivings,The US may deliver a significant number of Abrams tanks to Ukraine despite misgivings from the Pentagon. The U.S. and Germany have disagreed over who should supply tanks.
2023-01-24 16:05:28,Republican senator unveils bills targeting Biden's climate agenda: 'Energy is the backbone of our economy',"Sen. Markwayne Mullin, R-Okla., introduced a series of bills targeting energy security, marking the first pieces of legislation he has introduced as a senator."
2023-01-24 15:56:39,Retired FBI counterintel agent reportedly involved in Trump-Russia probe arrested for ties to Russian oligarch,"Charles McGonigal, once special agent in charge of FBI N.Y.'s Counterintelligence Division, was charged with violating U.S. sanctions, among other accusations."
2023-01-24 15:49:31,"Debt ceiling increase sends Dems into full apocalypse mode: ‘Chaos,’ ‘recession,’ ‘global financial crisis’",Democrats are warning of financial ruin and economic chaos because Republicans are seeking spending cuts as part of a debt ceiling increase later this year.
2023-01-24 17:00:10,"House GOP looks to expand education savings accounts to cover private schools, homeschooling","EXCLUSIVE: Republicans are set to introduce a bill Tuesday that would expand education savings plans to all grade levels for public, private, and homeschool."
2023-01-24 16:58:17,Biden admin gives left-wing groups hundreds of millions to help illegal immigrants fight deportation,"Liberal groups have received hundreds of millions of dollars worth of government contracts amid the escalating border crisis in the last two years, federal records show."
2023-01-24 16:40:47,"FLASHBACK: Biden praised debt ceiling talks as VP, said it was 'great honor' to negotiate with GOP","President Biden, during his tenure as vice president, applauded negotiations surrounding the debt ceiling and how members of Congress should work together to reach “certain compromises.”"
2023-01-24 16:40:27,Dem Rep. Ayanna Pressley promotes abortion funds that help minors get procedure,"Rep. Ayanna Pressley, D-Mass., tweeted, ""Support your local abortion fund,"" to her one million followers on Monday and included a link to the National Network of Abortion Funds."
2023-01-24 16:33:30,Iowa students can use public money to pay for private school under new plan,A plan approved by Iowa Legislatures will allow students to use public money to pay tuition for private schools. Democrats argued this may lead to reduced funding for public schools.
2023-01-24 16:29:40,SNOOP SCOOP: New GOP bill would put stop to IRS's $600 online reporting requirement,California Rep. Michelle Steel and Tennessee Senator Bill Haggerty introduced the SNOOP Act to nix the IRS's new reporting requirement for online transactions over $600.
2023-01-24 18:11:35,"Georgia DA asks judge to keep Trump criminal probe report sealed, citing concern for 'future defendants'","Fulton County District Attorney Fani Willis asked judge not to release a special grand jury report outlining its investigation into former President Donald Trump, reports said."
2023-01-24 18:00:57,Minnesota bill to extend unemployment benefits for laid-off mine workers awaiting signature from Gov. Tim Walz,The Minnesota House voted to approve a bill that would extend unemployment benefits for laid-off mine workers. The bill will go into effect once Gov. Tim Walz signs off on it.
2023-01-24 17:59:25,Top House Dem addresses violence against police as nonbinary child pleads not guilty to assault on cops,"House Democrat Whip Rep. Katherine Clark, D-Mass., was pressed by reporters at an unrelated environmental event Monday over her child's recent arrest at a Boston anti-police protest."
2023-01-24 17:50:01,"Judicial Watch files lawsuit against DOJ for docs on Big Tech censorship, Hunter Biden laptop story",Judicial Watch filed a lawsuit against the Justice Department demanding records between the FBI and social media sites regarding foreign influence in elections and the Hunter Biden laptop story.
2023-01-24 17:25:39,"Texas Republicans demand Biden reimburse state for border efforts, seek meeting on ending crisis",More than two dozen Texas Republicans have written to President Biden requesting a meeting and urging him to reimburse Texas for its efforts to secure the border.
2023-01-24 17:11:38,Senate Republican leaders introduce bills restricting Biden's SPR authority as WH threatens veto,The top Republican on the Senate Energy and Natural Resources Committee introduced bills Tuesday that would curb President Biden's authority over the nation's oil stockpiles.
2023-01-24 17:10:59,"VA gun control bills advance in Legislature after recent shootings at university, elementary campus",Virginia’s Democrat-led Senate has approved a range of gun control bills which would ban most firearms from public college campuses. The bill will go to the GOP-controlled House next.
2023-01-24 17:04:47,Vice President Mike Pence discovered classified documents in Indiana home,"Vice President Mike Pence informed Congress Tuesday that he discovered classified documents in his Carmel, Indiana, home on Jan. 16."
2023-01-24 19:10:04,"NC Democrat calls hit-and-run in state-issued vehicle a 'serious mistake,' refuses to resign","North Carolina State Auditor Beth Wood, who has been charged in a hit-and-run incident on Dec. 8 in Raleigh, has issued an apology while Republicans are urging her to resign."
2023-01-24 19:01:04,FLASHBACK: Pence went after Trump over classified documents before finding stash in his own house,"Former Vice President Mike Pence once described former President Trump's handling of classified documents as ""not proper"" before finding documents in his own home as well."
2023-01-24 18:55:38,George Santos alleges he suffered an 'assassination attempt' in interview with Brazilian podcaster: report,"George Santos, who admitted to ""embellishments"" on his resume, reportedly told a Brazilian podcaster last month he suffered an ""assassination attempt"" and needed police protection."
2023-01-24 18:42:34,'Retire now or get fired': Senate predictions spell trouble for Democrats in 2024,"The Cook Political Report released its Senate ratings, revealing several Democrats who are vulnerable next cycle as the party faces a daunting 2024 map."
2023-01-24 18:38:00,Oregon announces abortion hotline to provide free legal advice,Oregon is preparing to launch an abortion hotline to provide free legal advice to callers from any state following the Supreme Court's decision to overturn Roe v. Wade.
2023-01-24 18:35:21,White House pledges to work in ‘good faith’ with GOP as it investigates DOJ targeting of parents,The White House says it will work with the House Republicans as they investigate the federal government's efforts to target parents at school board meetings.
2023-01-24 18:23:37,Republicans call for search of Biden’s Senate papers: ‘No stone should be left unturned',Several Republican lawmakers called for a search through President Biden's Senate documents at the University of Delaware as the president's classified documents scandal compounds.
2023-01-24 20:11:14,SD Gov. Noem says state will prosecute pharmacists providing abortion pills,"South Dakota Gov. Kristi Noem and state Attorney General Marty Jackley, both Republicans, have announced that they will prosecute pharmacists providing abortion-inducing drugs."
2023-01-24 20:06:53,"Fox News Politics: Another day, another revelation about classified documents","Get the latest updates from the 2024 campaign trail, exclusive interviews and more Fox News politics content"
