DATE,TITLE,SUMMARY
2023-11-10 02:00:08,Arkansas military veteran receives world’s first whole-eye and partial-face transplant,A 46-year-old military veteran who received the first-ever whole-eye and partial-face transplant at NYU Langone Health is speaking out about the life-changing surgery.
2023-12-20 09:45:47,Artificial intelligence experts share 6 of the biggest AI innovations of 2023: 'A landmark year',"From cancer care to communications, here’s where AI moved the needle in health care"
2023-12-15 10:22:07,Artist helps seniors capture precious memories in works of art: 'They bring their life experiences',"Erin Finley, an award-winning artist in Canada, is the creator of Memory Drawing, a program that helps older adults tap into their memories and express them in vibrant color."
2023-12-10 10:00:32,Anti-aging drug for dogs from San Francisco firm moves closer to gaining FDA approval,A drug that could potentially extend the life of large-breed dogs is closer to being approved by the FDA. Veterinarians comment on the medication&apos;s potential.
2023-11-28 10:48:19,"Cancer risk could increase with consumption of certain foods and drinks, study finds","Consuming certain foods and drinks could put people at a higher risk of developing colorectal cancer (CRC), according to a new study published in the journal Nutrients."
2023-11-19 10:15:48,"Cancer deaths among kids and teens fell 24% over past two decades, CDC reports: 'Better treatments'","Deaths among youth cancer patients are on the decline, according to data from the Centers for Disease Control and Prevention. Death rates fell 24% between 2001 and 2021."
2023-11-05 01:16:47,Brooke Shields says drinking excess water led to her seizure: So how much is too much?,"Brooke Shields shared that she had a “grand mal seizure,&quot; which she attributed to drinking too much water. Here&apos;s what to know about the potentially adverse effects."
2023-12-15 18:39:00,"Brown seaweed consumption could help manage and prevent type 2 diabetes, study shows",A new study revealed that brown seaweed could be a promising strategy for blood glucose management. Dr. Joe Whittington comments on how this could prevent type 2 diabetes in patients.
2023-12-05 10:00:51,"California woman with painful fat deposit disorder gets ‘life-changing’ surgery, has ‘newfound freedom’","Lipedema, a common but often overlooked disease, causes abnormal fat to accumulate in the lower body. A California woman shared her personal experience with overcoming the painful condition."
2023-12-15 12:13:29,"Supreme Court's semiautomatic weapon ban ruling, passport reform takes next step and more top headlines",
2023-01-27 11:26:21,"Cities prep for violence ahead of Tyre Nichols video release, Schiff faces another blow and more top headlines",
2023-01-20 11:24:43,"Biden slammed for classified docs response, Alec Baldwin's big mistakes and more top headlines",Fox News First brings you Fox News&apos; top headlines every morning.
2023-04-28 11:10:31,"San Francisco sparks new outrage over violent crime, NFL Draft night stunner and more top headlines","San Francisco sparks new outrage over violent crime, NFL Draft night stunner and more top headlines"
2023-07-03 10:54:19,"American cities ditch July 4th tradition, veterans get blunt this Independence Day and more top headlines","American cities ditch July 4th tradition, veterans get blunt this Independence Day and more top headlines"
2023-08-29 10:34:45,"Ramaswamy's eyebrow-raising Haley attack, violence erupts at protest and more top headlines","Ramaswamy&apos;s eyebrow-raising Haley attack, judge rejects sorority&apos;s trans member lawsuit and more top headlines"
2023-09-18 10:34:30,"Iran set to free 5 Americans after Biden cuts deal, Senate pivots on dress code and more top headlines","Iran set to free 5 Americans after Biden cuts deal, Senate pivots on dress code and more top headlines"
2023-01-02 20:12:33,Ex-Home Depot CEO blasts ‘socialism’ for killing the US work ethic,&quot;Outnumbered&quot; panel reacts to former Home Depot CEO and co-founder Bernie Marcus railing against socialism causing laziness while capitalism helped work ethic.
2023-03-20 12:48:15,Buster Murdaugh blasts 'baseless rumors' surrounding 2015 death of classmate Stephen Smith,"Alex Murdaugh&apos;s eldest son Buster Murdaugh is denying rumors of his involvement in the 2015 death of his classmate, Stephen Smith, miles from the Murdaughs&apos; hunting estate."
2023-03-17 18:23:26,Body of Buster Murdaugh's former classmate Stephen Smith to be exhumed,"The mother of Stephen Smith, Buster Murdaugh&apos;s high school classmate who died in 2015 near the Murdaughs&apos; hunting estate, says she has raised enough money to exhume her son&apos;s body."
2023-03-15 11:00:47,Alex Murdaugh fallout: Death of Buster Murdaugh's high school classmate back in spotlight after verdict,"The 2015 death of Stephen Smith in Hampton, South Carolina, has come under the spotlight after a jury found Alex Murdaugh guilty of murdering his wife and son in 2021."
2023-03-08 16:52:05,Buster Murdaugh under intense scrutiny after Alex Murdaugh's guilty verdict,"Maggie Murdaugh&apos;s friend, Dana Wilson, told &quot;Dateline&quot; in an interview that Buster Murdaugh&apos;s &quot;world will never be the same&quot; after his father was found guilty of murder last week."
2023-03-05 13:57:43,Public demands answers in suspicious death of Buster Murdaugh's classmate after father Alex's conviction,Satterfield family attorney Eric Bland appeared on &apos;Fox &amp; Friends Weekend&apos; to discuss Buster Murdaugh&apos;s potential involvement in the suspicious death of his former classmate.
2023-06-09 15:00:55,Black conservative father and faith leader homeschools 6 kids to 'get God in': 'What could be more important?',"Lauren Green, Fox News Channel&apos;s chief religion correspondent, spoke with Abraham Hamilton of the American Family Association, who shares why he and his wife are homeschooling their 6 children."
2023-10-12 10:18:09,Short questions with Dana Perino for Pete Hegseth,"Pete Hegseth of &quot;Fox &amp; Friends Weekend&quot; reveals how he made his first dollar, plus the joy of raising his children in this latest piece by Dana Perino for Fox News Digital."
2023-01-29 13:24:53,Woke schools challenged by Tennessee House speaker: We can't afford to lose battle 'for the fabric of America',Speaker of the Tennessee House of Representatives Cameron Sexton provides insight on fighting woke ideology in public education during Fox Nation&apos;s MisEducation of America: Live Summit.
2023-01-15 14:00:21,Wife of Navy officer jailed in Japan slams DoD for 'unimaginable' treatment: 'They've abandoned my husband',"Brittany Alkonis, whose husband is jailed in Japan for alleged &apos;negligent driving,&apos; shared her struggle to bring him back to the U.S. with &apos;Fox &amp; Friends Weekend.&apos;"
2023-01-09 09:00:03,"Man spends 8 months on tiny island, captures king penguin story in 'A Year on Planet Earth'","One wildlife cameraman went to great lengths to document the life of the king penguin, spending eight months on a subarctic island for the Fox Nation special."
2023-03-16 15:36:04,Alex Murdaugh fallout: Mother of Buster Murdaugh's deceased high school classmate seeks independent autopsy,"Stephen Smith&apos;s mother, Sandy Smith, is seeking donations for an independent exhumation and autopsy for her son. Smith died in 2015 near the Murdaugh family&apos;s hunting estate."
