DATE,TITLE,SUMMARY
2023-05-02 11:00:00,DOJ sues Tennessee over ban on care for transgender youth,The Justice Department has filed a lawsuit challenging a Tennessee law which bans doctors from providing gender-affirming care to transgender youth. NBC News legal analyst Danny Cevallos breaks down how the Justice Department’s lawsuit could impact the new law taking effect and whether it could have an impact on other states that are trying to pass similar laws.&nbsp 
2023-05-12 21:00:00,"Missing Ohio EMT found alive, police say","Lachelle Jordan, 30, was found on the 16600 block of Euclid Avenue and was taken to a hospital for treatment, Cleveland police said "
2023-05-12 21:00:00,16 million in Midwest and Great Plains bracing for severe weather,16 million people across the Midwest and Great Plains are bracing for severe weather. NBC News’ Blayne Alexander has the latest storm updates 
2023-05-12 21:00:00,Title 42’s end drawing record number of illegal border crossings,"Following Title 42’s end, the U.S. is experiencing an all-time high rate of illegal border crossings. Now an investigation is underway to figure out how a migrant child died at a federally contracted facility in Florida. NBC News’ Tom Llamas has the latest "
2023-05-12 21:00:00,Man thanks nurses who saved his life in a grocery store after suffering cardiac arrest,"In January, Frank Ferrara stopped by a Delaware ACME and suffered a cardiac arrest. Two nearby shoppers who happened to be nurses performed CPR until paramedics arrived. Now, Ferrara has the chance to say thank you to them in-person. NBC News’ Emilie Ikeda shares the story "
2023-05-12 21:00:00,Lori Vallow Daybell found guilty of killing her two kids and conspiring to kill husband’s first wife,An Idaho jury found Lori Vallow Daybell guilty of killing her two children and conspiracy in the death of her husband’s first wife. NBC News’ Gabe Gutierrez has more details on the trial 
2023-05-12 21:00:00,"El Paso, Texas shelter overwhelmed by growing number of migrants","Hours after Title 42 was lifted, shelters in El Paso, Texas are facing growing numbers of migrants released into the U.S. NBC News’ Julia Ainsley is at one shelter tonight "
2023-05-12 21:00:00,'Revenge blocking' is becoming a popular trend in dating apps,"Dating apps have become one of the most popular forms of meeting romantic partners, but now users are using a functionality within the software to block and get other users kicked off of the platform entirely. NBC's Rehema Ellis reports.&nbsp "
2023-05-12 21:00:00,Youtuber whose plane crashed agrees to plead guilty to staging incident,29-year-old Youtuber Trevor Jacob agreed to plead guilty to a felony charge but has not done so yet after federal authorities say he staged a plane crash. They say he did it for the sake of making a video that has racked up more than three million views. NBC News’ Gadi Schwartz has more details 
2023-05-12 21:00:00,Non-profit providing critical doula services to Black women cost-free,Black women are three times more likely to die from a pregnancy-related cause than white women. The non-profit “Parents as Teachers” is trying to change that by providing doula services to families cost-free. NBC News’ Zinhle Essamuah reports 
2023-05-23 02:00:00,Warner Bros. Discovery CEO booed at Boston University graduation amid writers strike,Videos circulating on social media appeared to show BU students chanting “Pay your writers” during David Zaslav's speech on Sunday 
2023-05-23 02:00:00,"Girl, 8, and boy, 4, dead after getting swept away in strong California river current","The pair were with their mother at the Kings River, which has been closed to recreational users since March due to high water levels "
2023-05-23 02:00:00,"Student, 15, arrested after bringing AR-15 and ammunition to a Phoenix high school, police say","The student is facing “serious felony charges” after allegedly bringing the semi-automatic rifle to Bostrom High School, where he was arrested Friday, the Phoenix Police Department said "
2023-05-23 02:00:00,Ex-Florida officer charged with failing to confront Parkland shooter says he is 'looking forward' to his trial,Former Broward County sheriff’s deputy Scot Peterson said Monday that the public needs to know he did everything he could as Nikolas Cruz murdered 14 students and three staff members 
2023-05-23 02:00:00,"Passenger on Frontier Airlines plane hit flight attendant with intercom phone, authorities say","Shuri Turner allegedly assaulted the airline worker while she was being escorted off flight 708 from Denver to Tampa, according to Denver police and the airline "
2023-05-23 02:00:00,TikTok files lawsuit against Montana over download ban,"The state's ban is a violation of the First Amendment, the social media app says "
2023-05-23 02:00:00,California man who stopped to help family of ducks cross road is killed by car,"The 17-year-old girl who hit Casey Rivara, 41, is unlikely to face criminal charges, officials said "
2023-05-23 02:00:00,"Florida tourism thriving after Hurricane Ian, just not everywhere","137 million tourists bring Florida roughly $100 billion a year in revenue and support 1.6 million jobs. However, the recovery from Hurricane Ian is at different stages across the state. Our NBC Orlando station WESH-2’s Sanika Dange speaks with Floridians about the mixed recovery stories "
2023-05-23 02:00:00,Lester Holt speaks with Hurricane Ian survivors eight months later,"Eight months after Hurricane Ian barreled into Florida, Lester Holt speaks with survivors, including some of the community’s youngest members, to hear their experiences and how recovery is going "
2023-05-23 02:00:00,"60,000 pounds of an explosive chemical lost during rail shipment, officials say",The company transporting the ammonium nitrate from Wyoming to California said “the release should pose no risk to public health or the environment” if the loss resulted from a leak 
2023-06-02 13:00:00,Amazon agrees to pay more than $30 million for alleged privacy violations,Amazon has agreed to settle after federal authorities say the company “sacrificed privacy for profits” when it held on to children’s personal information even after parents asked them to delete the data collected with Alexa. Amazon denied violating the law. NBC News’ Jesse Kirsch reports 
2023-06-02 13:00:00,Man who attacked U.S. Rep. Angie Craig in elevator pleads guilty,"Kendrid Hamlin punched Craig in an elevator, and she threw hot coffee on him and escaped. Capitol Police have said there was no evidence she was targeted because of her position "
2023-06-02 13:00:00,Bill Cosby faces new sexual assault lawsuits after states extend statutes of limitations,"Former Playboy model Victoria Valentino has publicly accused Cosby of drugging and raping her in 1969, and accusers in Nevada plan legal action thanks to ""look back window"" laws "
2023-06-02 13:00:00,32 Mississippi school districts still under federal desegregation orders,"The desegregation orders fit into a broader body of civil rights work that is examining jails, police departments and hate crimes in the state, according to the Justice Department "
2023-06-02 13:00:00,Woman who refused tuberculosis treatment is in custody months after an arrest warrant was issued,"The woman, identified in court documents as V.N., was detained and booked into a “negative pressure” room at the Pierce County, Washington, Jail, an official said "
2023-06-02 13:00:00,Attorney accused of rapes in Boston in 2007 and 2008 faces charges,"Matthew Nilo, 35, was arrested Tuesday in New Jersey and will be taken to Massachusetts. He will plead not guilty, his attorney said "
2023-06-02 13:00:00,"Days before Iowa building collapsed, engineers warned it could crumble",Davenport officials said three people are believed to be in the part of the building that collapsed Sunday evening 
2023-06-02 13:00:00,"Women more likely than men to skip or delay medications due to cost, CDC report finds","In 2021, 9.2 million adults said they didn't take a medication as prescribed to save money "
2023-06-02 13:00:00,"The U.S. economy added 339,000 jobs in May, once again beating expectations","The unemployment rate was at 3.7% against the estimate of 3.5%, just above the lowest level since 1969 "
2023-06-13 09:00:00,"Family finds 1,000,000 pennies inside late father’s home","John Reyes was cleaning out his late father-in-law’s home when he made a surprising discovery: an estimated one million pennies stashed in bags, boxes and crates inside a crawl space. NBC News’ Miguel Almaguer shares this story "
2023-06-13 09:00:00,State Department investigating case of detained American in Russia,"“We’ve been seeking to learn more about the apparent detention of Travis Leake,"" Secretary of State Antony Blinken told reporters Monday "
2023-06-13 09:00:00,Underground Erie Canal boat tour turns deadly in Western New York,Police are trying to figure out how an underground tour boat along the Erie Canal capsized and turned into a deadly situation in Western New York. Authorities say the boat had 29 adults on board and somehow flipped over in a cave. NBC News’ Jesse Kirsch has the latest 
2023-06-13 09:00:00,New child labor laws in Iowa draws mixed reaction,"Businesses in Iowa have been struggling to find workers and fought to change the state’s child labor law to make it easier to hire teenagers under sixteen. However, critics say the new law puts low-income kids at risk who might be under pressure to make money for their families and therefore vulnerable to exploitation. NBC News’ Stephanie Gosk reports "
2023-06-13 09:00:00,NYC mandates minimum wage for app-based delivery workers,"The mandate, which took effect Monday, will start at $17.96 per hour and increase to $19.96 per hour by 2025 "
2023-06-13 09:00:00,1 person dead after boat capsizes in cave along Erie Canal in New York,Local travel and hospitality providers were on the boat when it ran into problems in Lockport Cave 
2023-06-13 09:00:00,'Wheel of Fortune' host Pat Sajak announces he will retire next year,"""It’s been a wonderful ride, and I’ll have more to say in the coming months,"" the veteran game show host tweeted "
2023-06-13 09:00:00,Chocolate expected to get more expensive as cocoa prices soar to 7-year highs,"Among the different varieties of chocolate, prices of dark will reportedly be the hardest hit "
2023-06-23 10:00:00,"Debris from missing Titanic submersible found, passengers presumed dead","After four days of searching for the missing submersible that was exploring the Titanic’s wreckage, a Canadian deepsea robot spotted debris from the vessel. The five people on board are presumed to be dead. NBC News’ Tom Costello has the latest updates "
2023-06-23 10:00:00,LA video store making a comeback for nostalgic film fanatics,"A group of optimists is staging an unlikely comeback for video stores. NBC News’ Gadi Schwartz takes us to Vidiots in Los Angeles, which is reopening with the help of supporters like “The Morning Show’s” Mark Duplass "
2023-06-23 10:00:00,Massive cricket invasion takes over Nevada town,"A swarm of crickets has invaded the town of Elko, Nevada. NBC News’ Steve Patterson speaks to residents about the impact of the critters’ takeover "
2023-06-23 10:00:00,"Oregon county sues fossil fuel companies, alleging they caused deadly 2021 heat wave in Northwest","The lawsuit from Multnomah County lists 17 defendants and says the heat dome was ""a direct and foreseeable consequence"" of oil companies’ actions "
2023-06-23 10:00:00,Deion Sanders says he'll have surgery to avoid foot amputation,"Sanders, who has already had two toes amputated, said last week he has no feeling in the bottom of his foot because of circulation issues "
2023-06-23 10:00:00,"Lawyer for Ye dismisses 'dystopian' claims about Donda Academy, asks judge to dismiss suit",Former teachers for the private Christian school have claimed students were fed only sushi and administrators failed to act on accounts of severe bullying 
2023-06-23 10:00:00,He's 7-foot-4. Expectations are high for 1st NBA draft pick Victor Wembanyama.,The 19-year-old Frenchman — who stands 7-foot-4 — was selected as the first pick in Thursday's draft by the San Antonio Spurs 
2023-06-23 10:00:00,"Search Day 4: Titanic submersible debris found, all onboard presumed dead","The debris found at the seafloor was “consistent with a catastrophic implosion of the vessel,” the Coast Guard said "
2023-06-23 10:00:00,"NBA 2023 Draft: Highlights, results and best player moments","As expected, French phenom Victor Wembanyama went No. 1 to the San Antonio Spurs "
2023-06-23 10:00:00,"2 dead in shooting outside Florida McDonald’s, police say",Tallahassee police said they were conducting a double homicide investigation after officers responded to the fast-food restaurant Thursday and found two men dead in the parking lot 
