DATE,TITLE,SUMMARY
2023-01-15 12:00:00,U.K. to supply tanks as Russian missiles hit across Ukraine,"Nine people were reportedly killed and 64 others wounded in the southeastern city of Dnipro, where a Russian missile strike destroyed a section of an apartment building "
2023-01-15 12:00:00,"Mother, 3 children dead following Indiana house fire","The blaze in Fremont was reported about 5 a.m. Saturday and the victims were found minutes later by firefighters inside the burning home, state police said "
2023-01-15 12:00:00,"China reports 60,000 COVID-related deaths, says peak passed",China stopped reporting data on COVID-19 deaths and infections after abruptly lifting anti-virus controls in early December despite a surge in infections that began in October 
2023-01-15 12:00:00,"Clouded leopard who escaped at Dallas Zoo is found after enclosure was cut, police say",Police said Saturday a cut similar to the one in the leopard's enclosure fence was found at the habitat for a breed of monkey. It's unclear if the two incidents are related 
2023-01-15 12:00:00,Miss USA R’Bonney Gabriel crowned Miss Universe 2022,"The second runner-up was Miss Dominican Republic, Andreina Martinez "
2023-01-15 12:00:00,Jaguars roar back from 27-point deficit to stun Chargers and advance in AFC playoffs,Riley Patterson kicked a game-winning 36-yard field goal on the final play of the game as the Jaguars pulled off a 31-30 win 
2023-01-15 12:00:00,Minnesota university under fire for professor’s dismissal over showing images of Prophet Muhammad,"While some, including an official with the local chapter of the Council on American-Islamic Relations, praised the school's response, others said it went too far "
2023-01-15 12:00:00,University of Georgia football player killed in auto wreck days after championship title,Georgia offensive lineman Devin Willock and a recruiting staff member were killed early Sunday in a car wreck 
2023-01-26,More than 30 million people under winter weather alerts,"The fast-moving storm system that leveled homes across the South is racing toward the Northeast, bringing punishing wind and snow along with it. NBC News’ Gabe Gutierrez has more details on the storm and Al Roker has our forecast "
2023-01-26,Newport News teacher’s lawyer alleges school missed warnings in 6-year-old shooting,"The first grade teacher who was shot by her six-year-old student in Newport News, Virginia, intends to sue the school district, according to her lawyer. NBC News’ Yamiche Alcindor has more details on the timeline of the shooting "
2023-01-26,Conjoined twins separated in miracle procedure,"Doctors successfully separated conjoined twin girls in a miracle procedure at Cook Children’s Medical Center in Fort Worth, Texas. NBC News’ Sam Brock reports on the parents’ overjoyed reaction "
2023-01-26,"Alex Murdaugh’s alibi contradicts evidence, state contends","In its opening statement in the Alex Murdaugh murder trial, the state contends that new evidence contradicts Murdaugh’s alibi. However, his attorney argues there’s no forensic evidence to tie him to the murders. NBC News’ Catie Beck has more details about the case "
2023-01-26,Victims of Monterey Park shooting included beloved dance studio manager and longtime regulars,"The coroner's office released a full list of the victims' names Tuesday. Among them was Star Ballroom Dance Studio’s Ming Wei Ma, whom a friend described as “always welcoming "
2023-01-26,Virginia school board votes to replace embattled superintendent after 6-year-old boy shoots teacher,"The move came hours after the teacher's attorney said school administrators ""failed to act"" despite warnings from multiple teachers hours before the shooting "
2023-01-26,"Teacher shot by 6-year-old texted a dire warning to a loved one before she was wounded, source says","The text “showed her frustration,” the source said. “She was frustrated because she was trying to get help with this child, for this child, and then when she needed help, no one was coming "
2023-01-26,Mother accused of strangling 2 children and attempting to kill a third in Massachusetts,"The district attorney said the incident, in which a 5-year-old girl and a 3-old-boy were killed and a 7-month-old boy was injured, was ""an unimaginable, senseless tragedy "
2023-01-26,Transportation Department probe will look at whether Southwest overscheduled flights,"The meltdown at Southwest Airlines last month led to thousands of canceled flights, stranded passengers and lost luggage "
2023-02-05 07:00:00,"A death, an escape and a burglary: Even with an arrest, answers hard to come by in Dallas Zoo crimes","“I don’t know of a zoo that has been subjected to this kind of weirdness,” one expert said "
2023-02-05 07:00:00,Man who allegedly left dead fish at 'Goonies' house rescued from rough seas near stolen yacht,"The man was taken into custody late Friday at a warming center near Astoria, Oregon, police said "
2023-02-05 07:00:00,Connecticut's first LGBTQ-centered school to open later this year,"As lawmakers continue to debate LGBTQ representation in U.S. schools, Connecticut’s PROUD Academy plans to open its doors to queer youths and allies this fall "
2023-02-05 07:00:00,People are zapping their brains at home to improve focus and clear brain fog. But is it safe?,"At-home brain stimulation is flourishing among a group of enthusiasts, who say it gives them a mental edge. The science behind why it may work is still in the early stages "
2023-02-05 07:00:00,Wife pays tribute to 'selfless' marine veteran who died treating people in Ukraine,"“I can’t imagine our lives without him. I loved him so much, and he loved me so well,” Alex Potter said of her husband Pete Reed "
2023-02-05 07:00:00,Biden says U.S. is 'gonna take care' of Chinese spy balloon,"After the president spoke briefly about the balloon on Saturday, the Federal Aviation Administration said it has paused departures and arrivals at three airports in the Carolinas "
2023-02-05 07:00:00,Arctic blast blamed for Massachusetts infant's death as dangerously cold temperatures envelop Northeast,The Arctic air included a record-setting wind chill of minus 108 degrees Fahrenheit on the summit of Mount Washington in New Hampshire 
2023-02-05 07:00:00,Fallout from suspected spy balloon kills 'huge propaganda win' for China,"This incident confirms the fears of most Western nations about China's power ambitions, one expert says "
2023-02-05 07:00:00,Video appears to show Chinese spy balloon being downed,"NBC News speaks to Lisa Roberts, a witness in South Carolina, who filmed the Chinese spy balloon appearing to fall from the sky, and explains the moment she believed to have seen the balloon being shot down from her home.&nbsp "
2023-02-15 07:00:00,Court to reconsider Connecticut's transgender athlete policy,A federal appeals court will rehear a challenge to the state's policy of letting trans girls compete on female sports teams after it was upheld by a three-judge panel 
2023-02-15 07:00:00,White House speaks on unidentified objects being shot down,The White House said today that those unidentified objects shot down last week could be for benign commercial or academic research. NBC News’ Andrea Mitchell reports more on how members of Congress are responding 
2023-02-15 07:00:00,Michigan State students take comfort in one another amid deadly shooting,"“I live at MSU, and I shouldn’t be scared to walk out of my front door, but from now on I will be,"" one student said "
2023-02-15 07:00:00,"Songwriter creates personalized, tiny anthems for everyday people","Mike Long is a songwriter, creating ballads about ordinary, everyday people. He charges about $300 per song and spends more than 20 hours on each composition. NBC News’ Gadi Schwartz shares more about his work "
2023-02-15 07:00:00,Maggie Murdaugh’s sister testifies Alex ‘didn’t seem to be afraid’ after murders,"In Alex Murdaugh’s murder trial, his wife Maggie’s older sister took the stand, testifying through tears about the night she learned her sister and nephew were killed. NBC News’ Catie Beck has more details on her testimony "
2023-02-15 07:00:00,"Michigan State University shooting leaves three students dead, five wounded","Three students were killed and five critically wounded in a shooting on Michigan State University's campus. The 43-year-old suspect had no known connection to MSU and took his own life hours after the shooting, according to police. NBC News’ Maggie Vespa has the latest updates "
2023-02-15 07:00:00,Black patients face historically longer waiting times for kidney transplants due to outdated test,"Historically, Black patients have had to wait longer for kidney transplants than other races, in part because of an outdated test that overestimated their kidney function. Now, a new national rule will remove the test, which is seen as racially bias, in determining who gets a transplant. NBC News’ Yamiche Alcindor shares more "
2023-02-15 07:00:00,4 men arrested in the U.S. in assassination of Haitian President Jovenel Moïse,"11 people face charges in Southern Florida in connection with the investigation into Moïse's 2021 death, which unleashed chaos in the small Caribbean country "
2023-02-15 07:00:00,Missouri man accused of holding woman in basement for weeks could face 5 life sentences,"Timothy Haslett Jr. was arrested late last year after a woman escaped from the home in the Kansas City area and asked neighbors for help, police said "
2023-02-15 07:00:00,"Ahead of Buffalo shooter's sentencing, residents reflect on returning to Tops store","“This is my store. I have no hesitation,” said one customer, Robert Archie. ""You just hope that something else like that doesn’t happen again "
2023-02-25 22:00:00,West Virginia MMA fighters volunteer as security for local drag show,The mixed martial artists volunteered their services after threats led to the cancellation of a local restaurant’s drag brunch 
2023-02-25 22:00:00,Historic winter storm hitting some of California’s major cities,Some of California’s most iconic cities are getting blasted by a winter storm and paralyzing the region that rarely gets this kind of extreme weather. NBC News’ Miguel Almaguer has more details on areas like Los Angeles and San Diego getting put under blizzard warnings 
2023-02-25 22:00:00,Passenger planes have a close call on Burbank Airport runway,"There was another close runway call at Burbank Airport in California, making it the fourth this year. NBC News’ Tom Costello on how the FAA and NTSB are responding amid the recent cluster of “runway incursions "
2023-02-25 22:00:00,Mississippi wants to expand an aggressive police force responsible for recent shootings,"The Mississippi Capitol Police operates in Jackson but is outside of the city’s control, leaving much of its work opaque.&nbsp "
2023-02-25 22:00:00,Body of one climber killed in central Washington avalanche recovered,"Seong Cho was with backcountry travelers on Colchuck Peak when the ground shifted. Two other climbers, Jeannie Lee and Yun Park, are presumed dead and have not been found "
2023-02-25 22:00:00,A man who killed 7 is suspected in his cellmate's slaying at a California prison,"Ramon Escobar was convicted of killing seven people, including his uncle and aunt "
2023-02-25 22:00:00,One arrested in Texas dog attack that left an 81-year-old man dead,"First responders saw bloodied man being dragged around a corner by dogs, and had to fend off the canines with pickaxes and pike poles, the San Antonio fire chief said "
2023-03-08 01:00:00,"WeightWatchers buys telehealth platform Sequence, facilitating access to Ozempic and Wegovy",The diet company hopes to offer members the ability to meet with clinicians who can prescribe obesity and diabetes medications 
2023-03-08 01:00:00,Federal safety board to investigate Norfolk Southern after train derailments,"""Given the number and significance of recent Norfolk Southern accidents, the NTSB also urges the company to take immediate action today,"" the agency said "
2023-03-08 01:00:00,A woman who was found dead in Massachusetts nearly 45 years ago has finally been identified,"Patricia Ann Tucker, 28, was found buried under leaves off a road in the town of Granby on Nov. 15, 1978, investigators said at a news conference Monday. She had been shot in the head. For decades, she was known only as “Granby Girl "
2023-03-08 01:00:00,"Video shows United passenger threatening to 'kill every man on this plane,' attack crew",Francisco Severo Torres was charged with interference and attempted interference with flight crew members and attendants using a dangerous weapon 
2023-03-08 01:00:00,"Man stabs flight attendant, tries to exit plane in midair attack","During a United flight, a 33-year-old man went on an incoherent rant, tried to open one of the plane’s emergency exits, and stabbed a flight attendant with a broken spoon. NBC News’ Tom Costello has more details on the midair attack and other travel chaos "
2023-03-08 01:00:00,U.S. citizen convicted in journalist’s hostage-taking in Somalia,"Michael Scott Moore, a German-American journalist, was abducted in January 2012. Mohamed Tahlil Mohamed and Abdi Yusuf Hassan, a naturalized U.S. citizen, were convicted by a federal court jury in New York on Feb. 24 of aiding in the kidnapping "
2023-03-08 01:00:00,Justice Department sues to block JetBlue’s acquisition of Spirit Airlines,Spirit agreed to sell itself to JetBlue last summer after a long battle for the carrier between JetBlue and Frontier Airlines 
2023-03-08 01:00:00,California hiker dies after falling off perilous Oregon bluff,Authorities said Henry Minh Hoang of the Los Angeles area was hiking beyond a safety fence at a state natural area 96 miles west of Portland when he fell 
2023-03-08 01:00:00,Desperation growing to reach stranded as California deals with snowfall,"As California deals with historic snowfall, there is growing desperation to reach those stranded in the mountains 80 miles outside of Los Angeles. NBC News’ Miguel Almaguer has the latest on the extreme weather and residents’ growing concern "
2023-03-18 15:10:00,14-year-old boy nicknamed 'El Chapito' arrested for the murder of 8 people near Mexico City,"The motive in the killings has not been made public, but drug gangs in Mexico frequently dabble in kidnapping and contract killing "
2023-03-18 15:10:00,Illinois prison guard gets 20 years for inmate beating death,"Following a four-week trial, a jury convicted Alex Banta in April 2022 of conspiracy to deprive civil rights, deprivation of civil rights, obstruction of an investigation, falsification of documents and misleading conduct "
2023-03-18 15:10:00,"Derek Chauvin, ex-officer convicted of killing George Floyd, pleads guilty to federal tax evasion","The onetime Minneapolis police officer is already behind bars for Floyd's death, a murder that sparked a summer of civil rights protests across America "
2023-03-18 15:10:00,YouTube lifts restrictions on Trump’s account,The decision means that Trump’s accounts on three major platforms from which he was suspended or restricted are now restored 
2023-03-18 15:10:00,"Farmworkers lead 5-day march to pressure companies on wages, work conditions",The Florida-based Coalition of Immokalee Workers hoped to use the march to pressure other large companies to join the Fair Food Program for better work conditions and wages 
2023-03-18 15:10:00,Ford recalls more than 1.5 million vehicles over problems with brakes and windshield wipers,The largest of two recalls covers nearly 1.3 million 2013 through 2018 Ford Fusion and Lincoln MKX midsize cars 
2023-03-18 15:10:00,Great-grandmother kidnapped and held for ransom in Mexico,Another U.S. citizen was kidnapped and is being held for ransom in Mexico. The great-grandmother’s family is pleading for help to get her back. NBC News’ Gabe Gutierrez has more details on the FBI’s investigation 
2023-03-18 15:10:00,Heavy rain in California easing historic drought,"California’s parade of atmospheric rivers has left the region in a state of mayhem and misery, however, they are also helping to alleviate many years of severe drought in the state. NBC News’ Miguel Almaguer has more details on the dramatic change that has pulled most of California out of the drought.&nbsp "
2023-03-18 15:10:00,"DOJ, FBI investigating TikTok’s parent company ByteDance","The Justice Department and the FBI are now looking into whether Chinese company ByteDance illegally surveilled journalists, according to a law enforcement official with knowledge of the matter. NBC News’ Hallie Jackson has more details on TikTok’s future in the U.S "
2023-03-28 17:00:00,Mississippi residents fear tornado recovery could take years,"Residents in Rolling Fork and Silver City, Mississippi were devastated by a tornado and are desperate for help. More than a third of the people that reside in these two small, rural towns live in poverty. NBC News’ Priscilla Thompson speaks with those impacted and shares more about the rebuilding process "
2023-03-28 17:00:00,Shooting at Nashville elementary school kills three children and three adults,"A 28-year-old fatally shot three children and three adults at a private elementary school in Nashville, Tennessee, authorities say. NBC News’ Kathy Park has more details on how the shooter got into the school "
2023-03-28 17:00:00,Gwyneth Paltrow ski crash suit: Man says he was sent 'absolutely flying' down the slope,"A Utah skier says the actor slammed into him and caused serious injuries in 2016, but Paltrow says she was the one who was hit "
2023-03-28 17:00:00,"Six killed, including three children, in Tennessee school shooting","A 28-year-old Nashville resident had maps of The Covenant School, a private Christian school, and was heavily armed "
2023-03-28 17:00:00,"Losing weight is good for the heart, even if you regain some of it",The health benefits of weight loss persisted even when people gained some of their weight back 
2023-03-28 17:00:00,Nashville police release surveillance footage showing the shooter entering the school,"Body camera video from officers who encountered the shooter, whom police identified as Audrey Hale, 28, during the attack, is also expected to be released "
2023-04-08 15:28:00,Utah avalanche sparks shelter-in-place order at ski resort,"Snowbird, a mountain resort in Little Cottonwood Canyon southeast of Salt Lake City, said that after an hourslong search, ""no guests or employees were caught in the debris caused by an avalanche"" on Thursday "
2023-04-08 15:28:00,Can you use Ozempic and Wegovy to shed a few pounds quickly?,"For short-term weight loss, drugs like semaglutide aren't the answer "
2023-04-08 15:28:00,Man pleads guilty to manslaughter in robbery killing of rapper Pop Smoke,"Pop Smoke, the 20-year-old New York rapper whose legal name was Bashar Barakah Jackson, was killed on Feb. 19, 2020, at a rented home where he was staying while on a four-day trip to Los Angeles "
2023-04-08 15:28:00,White House blames Trump for chaotic Afghanistan withdrawal,"The White House has released a new report into the U.S. withdrawal from Afghanistan, blaming decisions that the Trump administration made for the chaos that unfolded at Kabul International Airport in August 2021. NBC News’ Allie Raffa breaks down the main takeaways from the report and how it could impact a Republican led investigation into the withdrawal.&nbsp "
2023-04-08 15:28:00,"Justice Thomas accepted trips from GOP donor, report says","According to an article released by ProPublica, Supreme Court Justice Clarence Thomas accepted luxury trips from conservative billionaire Harlan Crow without disclosing them. NBC News’ Lawrence Hurley explains what ethical concerns are raised in the report and whether Thomas has responded to the claims.&nbsp "
2023-04-08 15:28:00,U.S. delegates travel to Taiwan despite tensions with China,"Despite rising tensions with China, a bipartisan group of U.S. delegates met with Taiwanese officials in Taipei just days after House Speaker Kevin McCarthy met with Taiwan’s president in California. NBC News’ Janis Mackey Frayer explains what the meetings were focused on and how they could impact relations between the U.S. and China "
2023-04-08 15:28:00,"U.S. economy adds 236,000 jobs in March, showing slowdown","The U.S. economy added 236,000 jobs in the month of March, lower than the previous month, with the unemployment rate dipping slightly to 3.5% according to the Bureau of Labor Statistics jobs report. NBC's Brian Cheung and Caleb Silver break down the report "
2023-04-08 15:28:00,"Motley Crue guitarist Mick Mars files lawsuit against band, says he was gaslit and pushed out of group","Mars’ lawsuit alleges that the group — particularly Nikki Sixx, had a pattern of belittling him for years, telling him he had cognitive issues and insulting him about alleged poor playing on tour, including a stadium outing he completed with the band in 2022 "
2023-04-08 15:28:00,WWE apologizes for using Auschwitz footage in pro WrestleMania promo,"The pro wrestling body said it moved quickly after learning about the offensive gaffe, adding: ""We apologize for this error "
2023-04-08 15:28:00,Son of controversial Florida data scientist charged with making alleged school threats,"Multiple students in the area of Navarre, Florida, spoke to deputies about seeing posts the son of Rebekah Jones had allegedly shared on Snapchat and Discord "
2023-04-18 16:04:00,FDA authorizes 2nd dose of updated Covid booster for older adults,People 65 and up can get a second dose of the updated booster at least four months after their last dose 
2023-04-18 16:04:00,‘Bad Cinderella’ stars on inspiring others through Broadway,"Linedy Genao, along with her co-star Jordan Dobson, is making history on Broadway in “Bad Cinderella” as the first Latina leading role in an Andrew Lloyd Webber musical. As part of News NOW’s series “Flipping the Script,” Joe Fryer spoke with both actors so discuss how they hope their roles can inspire others.&nbsp "
2023-04-18 16:04:00,Florida boat captain killed and passenger injured after lightning appears to strike boat,"The captain killed was identified as 39-year-old Peter Strong of West Melbourne, the Florida Fish and Wildlife Conservation Commission said "
2023-04-18 16:04:00,N.Y. man is accused of fatally shooting woman who pulled into the wrong driveway,"Kevin Monahan allegedly fired at a car with four friends inside after they realized they’d pulled into the wrong driveway and were leaving, an official said "
2023-04-18 16:04:00,Former NFL defensive end Chris Smith dies at 31,No details regarding the circumstances of Smith's death were shared. Smith played a total of eight seasons in the NFL and signed to the XFL Seattle Sea Dragons in March 
2023-04-18 16:04:00,Buffalo Bills safety Damar Hamlin medically cleared to resume playing after on-field cardiac arrest,"Hamlin collapsed after making what appeared to be a routine tackle in the Jan. 2 game against the Cincinnati Bengals, which was suspended and eventually canceled "
2023-04-18 16:04:00,2 teens accused of fatally beating their Spanish teacher over a bad grade plead guilty,"In a police interview, Willard Miller described the frustrations he had with the way Nohema Graber, 66, taught Spanish and over how the grade in her class was lowering his GPA at Fairfield High School "
2023-04-18 16:04:00,"Up to 1 in 4 students misuse ADHD drugs, study finds",Rates of misuse were the highest in schools that had the highest rates of students being treated for attention-deficit/hyperactivity disorder 
2023-04-18 16:04:00,Texas teacher charged after allegedly encouraging students to fight in classroom,"A Mesquite, Texas, substitute teacher has been fired and is facing charges after allegedly staging student fights in her classroom. NBC News’ Gary Grumbach reports "
2023-04-18 16:04:00,Missouri man accused of shooting teen Ralph Yarl in custody,"Andrew Lester, the man accused of shooting 16-year-old Ralph Yarl when he knocked on his door, has surrendered to police. NBC's Antonia Hylton reports "
2023-05-02 11:00:00,Lawmakers hold hearing on gaps in crypto regulation,A number of lawmakers seem to be intent on finding a way to regulate cryptocurrency while incorporating it into financial markets. NBC’s Gadi Schwartz discusses the takeaways from the hearing with financial services reporter Brendan Pedersen.&nbsp 
2023-05-02 11:00:00,Ed Sheeran plays guitar in courtroom at 'Let’s Get It On' copyright trial,"Sheeran launched into “Thinking Out Loud,"" the song that heirs of Ed Townsend, Marvin Gaye’s co-writer on “Let’s Get It On,” say has “striking similarities” to the 1973 song "
2023-05-02 11:00:00,James Corden addresses divided America in final 'Late Late Show',"Corden announced one year ago that he would be ending his late-night show after eight seasons, citing a desire to return to his native U.K. to be closer to family and loved ones "
2023-05-02 11:00:00,Former Vice President Pence testifies before Jan. 6 grand jury,Mike Pence testified before a federal grand jury looking into the January 6 Capitol riot just one day after a federal appeals court rejected former President Trump’s attempts to block the former vice president’s testimony. NBC News’ Ken Dilanian explains what Pence was likely asked about and how his testimony could impact the Justice Department’s investigation into January 6 
2023-05-02 11:00:00,Trump takes aim at Biden during New Hampshire campaign rally,Former President Trump held his first major campaign event in New Hampshire since President Biden announced his re-election campaign earlier this week. NBC News’ Vaughn Hillyard breaks down the key takeaways from Trump’s speech 
