DATE,TITLE,SUMMARY
2023-01-07 09:00:00,Divisive social media star Andrew Tate detained in Romania in human trafficking case,New father Yappe Pako gets help with his kangaroo care carrier from a midwife. His newborn son is named Ambo Crisostome. They're in the kangaroo care ward at the University Hospital Medical Center at Treichville in the Ivory Coast. A new program teaches the technique to moms and dads. It's especially beneficial for preterm and low birthweight babies. Andrew Caballero-Reynolds for NPR 
2023-01-07 09:00:00,Britain's 2022 Was A Year Of Epic Turbulence,"From left, former British Prime Minister Liz Truss, Labour Party leader Keir Starmer, former British Prime Minister Boris Johnson, and Prime Minister Rishi Sunak and former British Prime Minister Theresa May attend the Remembrance Sunday ceremony at the Cenotaph on Whitehall in London, on Nov. 13 "
2023-01-07 09:00:00,Editors' picks: Our best global photos of 2022 range from heart-rending to hopeful,New father Yappe Pako gets help with his kangaroo care carrier from a midwife. His newborn son is named Ambo Crisostome. They're in the kangaroo care ward at the University Hospital Medical Center at Treichville in the Ivory Coast. A new program teaches the technique to moms and dads. It's especially beneficial for preterm and low birthweight babies. Andrew Caballero-Reynolds for NPR 
2023-01-07 09:00:00,Retired Pope Benedict XVI dies at 95,Pope Benedict XVI greets a crowd in Venice's St. Mark's Square in 2011 
2023-01-07 09:00:00,Cristiano Ronaldo signs with a Saudi soccer club,"Cristiano Ronaldo smiles before the start of Manchester United's match against Sheriff at Old Trafford in Manchester, England, on Oct. 27 "
2023-01-07 09:00:00,War against Ukraine has left Russia isolated and struggling — with more tumult ahead,"Police officers detain demonstrators in St. Petersburg, Russia, on Sept. 21, following calls to protest against the partial mobilization announced by President Vladimir Putin. Putin called on Russian military reservists, saying his promise to use all military means in Ukraine was ""no bluff,"" and hinting that Moscow was prepared to use nuclear weapons "
2023-01-07 09:00:00,He lost his legs fighting for Ukraine. But this story is about love through adversity,"Sgt. Mykhailo (Misha) Varvarych, 28, and his fiance, Iryna (Ira) Botvynska, 19, take part in a therapeutic swimming activity at Moldova pool in Truskavets, Ukraine. Carol Guzy for NPR "
2023-01-07 09:00:00,Russia launches a wave of missiles at Ukraine in a massive New Year's Eve air attack,"People gather at the bottom of a hotel, which has been partially destroyed by a Russian strike in the center of the Ukrainian capital Kyiv on Saturday. Sergei Supinsky/AFP via Getty Images "
2023-01-07 09:00:00,Thousands mourn Benedict XVI at funeral celebrated by pope,"Archbishop Georg Ganswein kneels by the coffin of late Pope Emeritus Benedict XVI is brought to St. Peter's Square for a funeral mass at the Vatican, Thursday, Jan. 5, 2023 "
2023-01-17 12:00:00,Condoleezza Rice calls for 'urgency' in sending weapons and money to Ukraine,"Former Secretary of State Condoleezza Rice - pictured here at a reception of the American Academy in Berlin - has called for ""urgency"" in sending weapons and financial aid to Ukraine "
2023-01-17 12:00:00,Russia names a new commander for its war in Ukraine,Ukraine's Foreign Minister Dmytro Kuleba during a meeting of the NATO Ministers of Foreign Affairs in November. STOYAN NENOV/POOL/AFP via Getty Images 
2023-01-17 12:00:00,What Putin's shake-up of top commanders could mean for the war in Ukraine,"In a move that experts say is a key shift for Russia, the Kremlin has named General Valery Gerasimov as the new overall commander of the war in Ukraine "
2023-01-17 12:00:00,Where The Ukraine War Goes Next,Ukraine's Foreign Minister Dmytro Kuleba during a meeting of the NATO Ministers of Foreign Affairs in November. STOYAN NENOV/POOL/AFP via Getty Images 
2023-01-17 12:00:00,The U.K. pledges tanks to Ukraine as Russian missiles target multiple cities,"In this photo released by the Dnipro Regional Administration, smoke rises after a Russian rocket hit a multistory building leaving many people under debris in Dnipro, Ukraine, on Saturday. Dnipro Regional Administration via AP "
2023-01-17 12:00:00,The death toll from a Russian strike on an apartment complex in Ukraine is now 29,"Emergency workers clear the rubble after a Russian rocket hit a multistory building leaving many people under debris in the southeastern city of Dnipro, Ukraine, on Jan. 14, 2023 "
2023-01-17 12:00:00,Expanded U.S. training for Ukraine forces begins in Germany,"FILE - Weapons lie on the ground as Ukrainian personnel train at a base in Southern England. The U.S. military's new, expanded combat training of Ukrainian forces began in Germany on Jan. 15 "
2023-01-17 12:00:00,Death toll in Russian strike on Ukrainian building up to at least 35,"In this photo released by the State Emergency Service of Ukraine, firefighters carry a wounded woman out of the rubble of a building after a Russian rocket attack on Saturday in Dnipro "
2023-01-17 12:00:00,Germany's defense minister steps down after a string of widely criticized missteps,"Christine Lambrecht rides in a tank during her visit to Tank Training Brigade 9 in Munster, Germany, Feb. 7, 2022 "
2023-01-28 18:00:00,A firefighter's 1943 photos of the Warsaw Ghetto uprising have been found,"This handout negative dated on April 20, 1943, and taken by Polish firefighter Zbigniew Leszek Grzywaczewski shows Jewish people being evacuated from the Warsaw Ghetto. Z. L. Grzywaczewski/Maciej Grzywaczewski/POLIN Museum via AP "
2023-01-28 18:00:00,President Zelenskyy shakes up Ukraine's Cabinet amid corruption allegations,"Ukrainian President Volodymyr Zelenskyy pays his respects to victims of a deadly helicopter crash during a farewell ceremony in Kyiv, Ukraine, on Jan. 21 "
2023-01-28 18:00:00,Latest on Ukraine: Waiting for Germany's Leopard tanks (Jan. 23),A man plays violin on the sidelines of a religious service held by local residents in front of an apartment building in the Ukrainian city of Dnipro on Sunday. The building was destroyed by a Russian missile strike on Jan. 14. Anatolii Stepanov/AFP via Getty Images 
2023-01-28 18:00:00,The U.K. government says more than 200 child asylum-seekers are missing,"Robert Jenrick, Britain's minister of state for immigration, arrives for a Cabinet meeting in Downing street in London on Tuesday "
2023-01-28 18:00:00,"The Doomsday Clock moves to 90 seconds to midnight, signaling more peril than ever","The Bulletin of the Atomic Scientists announced that it has moved the minute hand of the Doomsday Clock to 90 seconds to midnight. From left,, Siegfried Hecker, Daniel Holz, Sharon Squassoni, Mary Robinson and Elbegdorj Tsakhia with the Bulletin of the Atomic Scientists remove a cloth covering the Doomsday Clock at a news conference at the National Press Club in Washington on Tuesday "
2023-01-28 18:00:00,Survey shows a lack of Holocaust awareness in the country that was home to Anne Frank,"King Willem-Alexander puts a stone in an act of remembrance when unveiling a new monument in the heart of Amsterdam's historic Jewish Quarter on Sept. 19, 2021, honoring the 102,000 Dutch victims of the Holocaust "
2023-01-28 18:00:00,Germany agrees to send its Leopard battle tanks to Ukraine after weeks of pressure,"German Chancellor Olaf Scholz stands next to a Leopard 2 main battle tank of the German armed forces while visiting an army training center in Ostenholz, Germany, on Oct. 17, 2022 "
2023-01-28 18:00:00,"The U.S. and Germany pledge tanks to Ukraine, signaling heavy fighting ahead",U.S. Abrams tanks participate in a live fire demonstration during training exercises in Poland in September 2022. President Biden announced Wednesday that the U.S. will be sending 31 Abrams tanks to Ukraine. Germany also said it will be sending tanks 
2023-01-28 18:00:00,German And American Tanks Are Headed for Ukraine,A M1A2 Abrams battle tank. The U.S. has agreed to send 31 of the tanks to Ukraine to help it defend and reclaim its territory from Russian forces. Mateusz Slodkowski/AFP via Getty Images 
2023-01-28 18:00:00,Her ancestors survived the Holocaust. She returns to Germany to reclaim her identity,
2023-02-08 09:00:00,Who's most likely to save us from the next pandemic? The answer may surprise you,"Yeshnee Naidoo prepares a ""flow cell"" for analysis by one of the center's many genetic sequencing machines. Tommy Trenchard for NPR "
2023-02-08 09:00:00,European leaders meet in Kyiv to discuss Ukraine's path toward joining the EU,Ukrainian President Volodymyr Zelenskyy and European Commission President Ursula von der Leyen shake hands after a joint press conference after talks in Kyiv on Thursday. Sergei Supinsky/AFP via Getty Images 
2023-02-08 09:00:00,"Tate Modern's terrace is a nuisance for wealthy neighbors, top U.K. court rules",Owners of apartments (seen at right) opposite Tate Modern have won a privacy case against the famous art gallery. SOPA Images/LightRocket via Getty Images 
2023-02-08 09:00:00,"Polish ambassador warns of a prolonged war in Ukraine, calls for more support","Marek Magierowski (right), the Polish ambassador to the U.S., speaks with host Steve Inskeep at the Polish Embassy in Washington, D.C., on Thursday "
2023-02-08 09:00:00,"Europe bans Russian oil products, the latest strike on the Kremlin war chest","Tires of a truck are pictured at a gas station in Frankfurt, Germany, Jan. 27. A European ban on imports of diesel fuel and other products made from crude oil in Russian refineries takes effect Feb. 5. The goal is to stop feeding Russia's war chest, but fuel costs have already jumped since the war started and they could rise again "
2023-02-08 09:00:00,Dozens of soldiers are freed in a Russia-Ukraine prisoner swap,"Ukrainian State Emergency Service firefighters put out a fire after Russian shelling hit an industrial area in Kherson, Ukraine, on Friday "
2023-02-08 09:00:00,"Shlomo Perel, a Holocaust survivor who inspired the film 'Europa Europa,' dies at 98","This undated photo provided by Yad Vashem Holocaust Memorial shows Shlomo Perel at his home in Givatayim, Israel. Perel, who survived the Holocaust through surreal subterfuge and an extraordinary odyssey that inspired his own writing and an internationally renowned film, has died. He was 98. Yad Vashem Holocaust Memorial via AP "
2023-02-08 09:00:00,The Pope has called for peace in South Sudan in the final part of his Africa tour,"Pope Francis arrives to celebrate mass at the John Garang Mausoleum in Juba, South Sudan, Sunday, Feb. 5, 2023. Francis is in South Sudan on the second leg of a six-day trip that started in Congo, hoping to bring comfort and encouragement to two countries that have been riven by poverty, conflicts and what he calls a ""colonialist mentality"" that has exploited Africa for centuries "
2023-02-08 09:00:00,Latest on Ukraine: EU just banned Russian diesel and other oil products (Feb. 6),"Black smoke rises after shelling in Bakhmut, in eastern Ukraine, on Feb. 3, amid the Russian invasion of Ukraine. Yasuyoshi Chiba/AFP via Getty Images "
2023-02-18 22:00:00,Latest in Ukraine: Updates on Russia's war and a look ahead (Feb. 13),"Ukrainian President Volodymyr Zelenskyy (left) walks with French President Emmanuel Macron on the tarmac of Vélizy-Villacoublay airbase as they prepare to board a flight together, en route to Brussels for a summit at European Parliament, on Feb. 9. Zelenskyy made a surprise Europe tour last week. Mohammed Badra/Pool/AFP via Getty Images "
2023-02-18 22:00:00,Russia deports thousands of Ukrainian children. Investigators say that's a war crime,"A view of the courtyard of Kherson regional children's home in Kherson, southern Ukraine, Friday, Nov. 25, 2022. Russian authorities have been accused of deporting Ukrainian children to Russia to raise them as their own. Thousands of children were seized from schools and orphanages in Ukraine by Russian authorities, according to researchers at Yale University "
2023-02-18 22:00:00,Blinken has a lot on his plate including tensions with China and the war in Ukraine,"Secretary of State Antony Blinken speaks in the briefing room of the State Department in Washington, Jan. 7, 2022 "
2023-02-18 22:00:00,European allies condemn Israel's plan to build more housing units in the West Bank,"A picture taken from the Palestinian village of Aqraba shows the Israeli settlement outpost of Gevat Arnon, near Nablus city in the southern occupied West Bank. Jaafar Ashitiyeh/AFP via Getty Images "
2023-02-18 22:00:00,"U.N. agencies seek $5.6 billion to help Ukraine, its refugees abroad","A man receives humanitarian aid provided by U.N. World Food Program and ADRA charity organization for the residents of the region and internally displaced persons at the distribution center in Kostiantynivka, Ukraine, Friday, Feb. 10, 2023 "
2023-02-18 22:00:00,"Scotland's Nicola Sturgeon, supporter of independence and trans rights, will resign",Scotland's First Minister Nicola Sturgeon announced Wednesday that she would step down. Jane Barlow/Pool/AFP via Getty Images 
2023-02-18 22:00:00,One of 12 boys rescued from the Thai cave dies at a British school,"Relatives of Duangphet ""Dom"" Phromthep, one of the boys rescued from the flooded cave in northern Thailand, greet him as he arrives home in the Mae Sai district, Chiang Rai province, northern Thailand, in 2018 "
2023-02-18 22:00:00,Indian tax inspectors leave BBC offices after nearly 60 hours of questioning,A Border Police officer stands guard outside the office building where Indian tax authorities raided BBC's office in New Delhi. Sajjad Hussain/AFP via Getty Images 
2023-02-18 22:00:00,Ukraine says it shot down 6 Russian balloons that appeared over Kyiv,One of the balloons the General Staff of the Armed Forces of Ukraine says they shot down. General Staff of the Armed Forces of Ukraine 
2023-03-01 15:00:00,"The economic war against Russia, a year later","Tetiana Horobstova, 70, and her husband, Volodymyr, on the balcony of their home, where their daughter was talking on the phone when Russian soldiers came to arrest her in Kherson, Ukraine. Laurel Chor for NPR "
2023-03-01 15:00:00,The key trends to watch in the Russia-Ukraine war,"Pedestrians walk past a large mural of Russian President Vladimir Putin on a residential building in Kashira, a town south of Moscow, on Thursday. Natalia Kolesnikova/AFP via Getty Images "
2023-03-01 15:00:00,Kherson's underground resistance: How ordinary people fought Russia from the shadows,"Tetiana Horobstova, 70, and her husband, Volodymyr, on the balcony of their home, where their daughter was talking on the phone when Russian soldiers came to arrest her in Kherson, Ukraine. Laurel Chor for NPR "
2023-03-01 15:00:00,"For Ukrainians in Dubai, a new restaurant offers a taste of home",(Left) A Ukrainian chef prepares mashed potatoes in the kitchen at Yoy restaurant. (Right) Traditional Ukrainian beet stew known as borsch is being prepared. It's the restaurant's most popular dish 
2023-03-01 15:00:00,Italy has kept its fascist monuments and buildings. The reasons are complex,The fascist origins of this Roman sports center can be seen in its monumental sculpture and architecture 
2023-03-01 15:00:00,Dozens of migrants have been killed in a shipwreck off the coast of Italy,"Rescuers recover a body at a beach near Cutro, southern Italy, after a migrant boat broke apart in rough seas, Sunday, Feb. 26, 2023. Rescue officials say dozens of migrants have died after their boat broke apart off southern Italy "
2023-03-01 15:00:00,Janet Yellen visits Ukraine and pledges even more U.S. economic aid,"Treasury Secretary Janet Yellen speaks at a school in Kyiv, Ukraine, on Monday "
2023-03-01 15:00:00,"When will it be over? And 9 more questions about Russia, Ukraine and a year of war",The Ukrainian flag flutters between buildings destroyed in bombardment in the Ukrainian town of Borodianka. It was one year ago last week that Russia invaded. Sergei Supinksy/AFP via Getty Images 
2023-03-11 16:00:00,"Yevgeny Prigozhin, 'Putin's Chef,' has emerged from the shadows with his Wagner Group","Russian businessman Yevgeny Prigozhin attends a meeting with investors at the Eastern Economic Forum on Sept. 2, 2016, in Vladivostok, Russia "
2023-03-11 16:00:00,"Germany moves toward restrictions on Huawei, as Europe sours on China",Signs promoting 5G wireless technology from Chinese technology firm Huawei are displayed at the PT Expo in Beijing in 2018. Germany is reviewing the presence of Huawei and ZTE components in its telecommunications 
2023-03-11 16:00:00,Ukraine's government says it wasn't involved in the attacks on Nord Stream pipelines,"In this handout photo provided by Swedish Coast Guard, the release of gas emanating from a leak on the Nord Stream 2 gas pipeline in the Baltic Sea on Sept. 28, 2022 in At Sea. Handout/Swedish Coast Guard via Getty Im "
2023-03-11 16:00:00,Prince Harry and Meghan say they will use royal titles for their children,"Prince Harry and Meghan Markle, Duke and Duchess of Sussex, leave after a service of thanksgiving for the reign of Queen Elizabeth II at St Paul's Cathedral in London on June 3, 2022 "
2023-03-11 16:00:00,Adidas reports a $540M loss as it struggles with unsold Yeezy products,"Boxes containing Yeezy shoes made by Adidas are seen at Laced Up, a sneaker resale store, in Paramus, N.J., on Oct. 25, 2022. Adidas' breakup with the rapper formerly known as Kanye West and the inability to sell his popular Yeezy line of shoes helped batter the company's earnings at the end of last year "
2023-03-11 16:00:00,Deadly Russian missile barrage slams targets across Ukraine,"Three Russian rockets launched against Ukraine from Russia's Belgorod region are seen at dawn in Kharkiv, Ukraine, late Thursday, March 9, 2023 "
2023-03-11 16:00:00,"From TV to Telegram to TikTok, Moldova is being flooded with Russian propaganda","A protest against the Moldovan government and pro-EU President Maia Sandu in the capital Chisinau on Feb. 19, 2023. Elena Covalenco/AFP via Getty Images "
2023-03-11 16:00:00,"Russia hits multiple cities across Ukraine, some with hypersonic missiles","People search the rubble of a house following a Russian strike in the village of Velyka Vilshanytsia, near the city of Lviv in Western Ukraine, on Thursday. Yuriy Dyachyshyn/AFP via Getty Images "
2023-03-11 16:00:00,Ukraine's top nuclear plant lost power for the sixth time. Is disaster imminent?,"Ukraine's Zaporizhzhia Nuclear Power Plant, pictured here in October, has operated with emergency power sources six times since Russia's offensive started "
2023-03-11 16:00:00,Russia is firing hypersonic missiles into Ukraine that are nearly impossible to stop,"In this 2018 photo made from footage taken from the Russian Defense Ministry's official website, a Russian Kinzhal hypersonic missile flies during a test in southern Russia "
2023-03-21 23:00:00,Turkey says it will ratify Finland's bid to join NATO,"Turkish President Recep Tayyip Erdogan, right, and Finland's President Sauli Niinisto shake hands during a welcome ceremony at the presidential palace in Ankara, Turkey, on Friday "
2023-03-21 23:00:00,The International Criminal Court issues an arrest warrant for Putin,"Russian President Vladimir Putin speaks to a regional governor via videoconference at the Novo-Ogaryovo residence outside Moscow, Russia, on Oct. 21, 2022. The International Criminal Court said Friday it has issued an arrest warrant for Putin and his children's rights commissioner for possible war crimes. Gavriil Grigorov/Sputnik, Kremlin Pool Photo via AP "
2023-03-21 23:00:00,Putin visits Crimea to mark the anniversary of its annexation from Ukraine,"Russian President Vladimir Putin speaks to the media after a summit in Ashgabat, Turkmenistan, on June 30, 2022. Putin traveled to Crimea to mark the ninth anniversary of the Black Sea peninsula's annexation from Ukraine on Saturday "
2023-03-21 23:00:00,An infamous Russian unit that downed a civilian plane in 2014 was active in Ukraine,"People walk amid the debris at the crash site of the Flight MH17 passenger plane near the village of Grabovo, Ukraine, on July 17, 2014 "
2023-03-21 23:00:00,Russia agrees to extend the Ukraine grain deal again,"The U.N.-chartered vessel MV Valsamitis is loaded to deliver 25,000 tons of Ukrainian wheat to Kenya and 5,000 tons to Ethiopia. It is pictured at the Black Sea port of Chornomorsk in February. Oleksandr Gimanov/AFP via Getty Images "
2023-03-21 23:00:00,Putin makes a surprise visit to Mariupol and tours an occupied city destroyed by war,"In this photo taken from video released by the Russian TV pool on Sunday, March 19, 2023, Russian President Vladimir Putin talks with local residents during a surprise visit to Mariupol "
2023-03-21 23:00:00,France's government survives no-confidence votes as pension reforms move ahead,"A protester chants slogans during a protest in Paris, Monday, March 20, 2023. The French government has survived two no-confidence votes in the lower chamber of parliament, proposed by lawmakers who objected to its push to raise the retirement age from 62 to 64 "
2023-03-21 23:00:00,Latest on Ukraine: Xi Jinping visits Moscow to meet Putin (March 20),"China's leader Xi Jinping claps as he listens to Russian President Vladimir Putin via a video link, from the Great Hall of the People in Beijing on Dec. 2, 2019. Xi will meet Putin this week on a visit to Moscow. Noel Celis/Pool photo via AP "
2023-04-01 04:00:00,Putin says Russia will station tactical nuclear weapons in Belarus,"Russian President Vladimir Putin listens to Russian Transport Minister Vitaly Savelyev during a meeting in Moscow on Saturday. Gavriil Grigorov/Sputnik, Kremlin Pool Photo via AP "
2023-04-01 04:00:00,A scrappy newscast in Kyiv aimed at Russians counters Putin's propaganda machine,"Ilya Ponomarev is the founder of February Morning, an opposition Russian-language online newscast aimed at viewers in Russia. Behind him is a flag symbolizing the ""free Russia of the future,"" created following Russia's 2022 invasion of Ukraine. Ponomarev calls it the ""Russian tricolor without the blood "
2023-04-01 04:00:00,"On the border with Belarus, Ukrainian troops prep for a long war — and the front line","A howitzer is fired at a training area in the Volyn region. Ukraine is using this region, quiet for the moment, to train troops for the front line in the east "
2023-04-01 04:00:00,Foreign volunteers race to train new Ukrainian troops to be sent to the front,"Magnus Ek, 53, a retired Swedish lieutenant, is teaching a group of Ukrainian conscripts how to fire an AK-47 in eastern Ukraine's Donbas region. Ek, who spent a decade as an instructor in Sweden, is among a group of foreign military volunteers who have gone to train Ukrainians how to defend their country from Russia's invasion "
2023-04-01 04:00:00,Latest in Ukraine: Putin will move tactical nuclear weapons into Belarus (March 27),"An aerial view of Bakhmut, the site of heavy battles with Russian troops in the Donetsk region, Ukraine, Sunday "
2023-04-01 04:00:00,A new wave of pension protest breaks out in France as police brace for violence,"Protesters march with flares during a demonstration in Marseille, southern France, on Tuesday. France's government is unfurling massively ramped-up security measures for a fresh blast of marches and strikes against unpopular pension reforms "
2023-04-01 04:00:00,The 'Ukrainian Banksy' has remained in Kharkiv despite Russian attacks,Soldiers spend time swimming in the pool during the course 
2023-04-01 04:00:00,A rehab center revives traumatized Ukrainian troops before their return to battle,Soldiers spend time swimming in the pool during the course 
2023-04-01 04:00:00,All new cars in the EU will be zero-emission by 2035. Here's where the U.S. stands,"Electric cars charge at a hub in downtown Milan on March 23. Starting in 2035, all cars sold in the European Union will be zero-emission vehicles. Gabriel Bouys/AFP via Getty Images "
