DATE,TITLE,SUMMARY
2023-05-19 16:13:42,Negotiators resume weekend debt talks as clock ticks,"How much to cut spending is “the major sticking point,” but it’s “not the only one,” as Rep. Dusty Johnson put it."
2023-05-19 08:30:00,'We better figure it out': The politics trap that could slow a national AI law,"As Congress struggles to address a fast-moving technology, long-simmering partisan mistrust over online speech is already rearing up."
2023-05-20 23:44:50,Debt ceiling talks break down and attacks escalate as deadline approaches,"The GOP wants to raise spending for the military, veterans care and border security; the White House wants to spread the impact of cuts across the board."
2023-05-22 19:05:30,McCarthy: A debt deal could still pass by June 1,"The speaker addressed reporters hours ahead of his latest sitdown with President Joe Biden, as multiple elements of their talks remain up in the air."
2023-05-22 08:30:00,Key Republican recruits hesitate to jump in if Trump is the nominee,Potential Republican candidates in swing states and districts are reluctant to throw hats into ring.
2023-05-23 15:18:44,Guess who just bid $100K for McCarthy's used chapstick,"The fundraiser, which Rep. Marjorie Taylor Greene (R-Ga.) won with a $100,000 bid, is set to benefit Republicans' campaign arm."
2023-05-23 08:30:00,The debt talks are about to test McCarthy’s hold on his party,"The speaker has to keep conservatives happy or risk a threat to his gavel, while avoiding alienation of his battleground-district members."
2023-05-24 08:30:00,White House believes massive Dem bailout may be needed to pass debt ceiling compromise,The prospect of needing so many votes from within the party has begun to color Biden's negotiating strategy.
2023-05-24 08:30:00,House Republicans are dealmaking newbies — and that could be a problem,Kevin McCarthy has mostly been sidelined from major bipartisan negotiations — until now.
2023-05-25 18:00:38,House conservatives blanch at leaked details of McCarthy-Biden debt talks,"The group was already unlikely to support a final bipartisan deal, but lingering anger with Kevin McCarthy could have lasting implications on his speakership."
2023-05-25 12:35:06,Inside House Democrats’ fight over debt ceiling messaging,"As lawmakers head out of town for Memorial Day recess without a debt deal in sight, House Democrats are roiling with frustration at party’s top leaders."
2023-05-25 12:31:39,"Majority of Californians believe Feinstein isn't fit to serve, poll finds",The respondents cited the 89-year-old senator's latest illness as the reason she should resign.
2023-05-26 08:30:00,House Dems in No Labels-allied caucus are livid with No Labels,The group is under fire for its unity presidential bid and for an attack on a Problem Solvers Caucus member.
2023-05-26 01:27:08,A well-liked incumbent stands in the way of Republicans retaking the Pennsylvania Senate seat,The Casey name is near royalty in the Keystone State.
2023-05-27 11:00:00,Debt limit derails the rest of Congress’ must-pass agenda,"Drawn-out talks to avoid a catastrophic default are causing a temporary pileup on lawmakers' other priorities, including spending bills, a trillion-dollar farm package and mammoth defense policy legislation."
2023-05-28 13:56:56,McCarthy races to sell debt deal amid rumblings of right-wing rebellion,"Administration officials, meanwhile, are expected to brief House Democrats on Sunday afternoon."
2023-05-28 13:48:41,"Pragmatic House Republicans support debt deal, Dusty Johnson says","The South Dakota Republican called the deal ""a remarkable conservative accomplishment."""
2023-05-28 13:01:03,"Congress has power to reform Supreme Court, Sen. Whitehouse says","But pushing ethics reforms through Congress “is not going to be easy,” the Democratic senator said."
2023-05-28 04:17:44,"Some new work requirements, no major energy changes: 6 pillars of debt ceiling deal",The policy provisions of the agreement between President Joe Biden and House Speaker Kevin McCarthy appeared to fall far short of conservatives’ demands.
2023-05-28 00:45:33,McCarthy and Biden reach agreement in principle on debt limit,Now they have to get it to President Joe Biden’s desk in time.
2023-05-29 03:09:03,Wrinkles and curveballs in the debt ceiling bill,Sen. Joe Manchin would get the gas pipeline he wants. The IRS would get a steeper than expected cut. And future executive actions would face new (but easily waived) fiscal handcuffs.
2023-05-28 21:10:48,"'My fellow Republicans wanted me to lie,' Liz Cheney says in commencement speech",She urged Colorado College's 2023 graduates to trust in the truth.
2023-05-28 18:45:56,"Biden, McCarthy poised to claim victory after protracted debt drama","Some conservatives are signaling they’re going to try to tank the deal, but early signs are promising it will pass."
2023-05-28 17:36:34,Does the debt deal have enough GOP support? This Democratic senator says he's worried.,Congress must raise the debt limit before June 5 to avoid default.
2023-05-28 15:43:02,Hakeem Jeffries says he has 'no idea' what Kevin McCarthy's talking about,The House Democratic leader said he didn't complain to McCarthy about the debt deal.
2023-05-28 13:56:56,McCarthy races to sell newly released debt deal amid rumblings of far-right rebellion,The full text was released Sunday evening.
2023-05-28 04:17:44,Here are the 6 must-know provisions of the new debt ceiling deal,The policy provisions of the agreement between President Joe Biden and House Speaker Kevin McCarthy appeared to fall far short of conservatives’ demands.
2023-05-30 08:30:00,Democrats hope the Senate could finally have more than one Black woman,"Retirements in Maryland, Delaware and California may clear the way for a history."
2023-05-29 21:34:32,McCarthy rallies support for debt deal amid hints of mutiny,The goal is for there to be a passage vote Wednesday.
2023-05-30 23:27:49,Senate braces for last-minute conservative demands on debt deal,Any one senator can slow down the legislation's passage through the upper chamber. And conservative grumbling has already started.
2023-05-30 22:41:37,Republican candidate accused of lying about military record ends comeback bid,"It's good news for House Republicans, after JR Majewski lost a competitive Ohio seat in 2022."
2023-05-30 21:43:01,‘Not happy’: Key progressive pushes back on new food aid work requirements in debt deal,Few Democrats have weighed in on the deal’s language extending work requirements for a certain age group of people receiving food assistance.
2023-05-30 18:42:45,Utah Republican Chris Stewart plans to resign from House,The departure would reduce the party's five-seat majority in the House and set up a special election.
2023-05-30 16:04:39,McCarthy overcomes Rules rebellion over debt deal,"Once conservative Rep. Thomas Massie announced that he would vote in favor of the rule, the conservative effort to tank the measure in committee lost steam."
2023-05-30 15:17:36,How soon could the debt deal pass Congress?,The House Rules Committee will meet at 3 p.m. Tuesday to set the stage for floor consideration of the debt limit measure.
2023-06-01 08:30:00,'The weirdest legislation that anybody has ever been asked to vote on',"Progressives aren't happy with the deal President Joe Biden struck with Republicans. But given that or default, they’re not revolting."
2023-06-01 01:26:52,"House passes bipartisan debt deal, sending it to Senate",Now the upper chamber has to work to pass the measure before the default deadline on June 5.
2023-06-02 08:30:00,Sinema and Manchin’s covert debt deal operation,"Last term, the two centrist senators publicly shaped nearly every piece of major legislation. They revived the act on the debt limit — but this time, they stayed behind the scenes."
2023-06-02 03:00:48,8 takeaways from the debt ceiling vote,"The agreement secures some GOP priorities on spending, permits and the safety net, but left the heart of President Joe Biden's agenda intact — at least until the next fight."
2023-06-02 02:57:08,"Senate averts default, sends debt bill to Biden’s desk",The vote caps off months of melodrama.
2023-06-01 23:25:12,Senate leaders reach agreement to quickly vote on debt deal,It locks in plans to send the bill to the president's desk well before the Monday default deadline.
2023-06-01 19:10:14,Lawyers for Jim Justice say his coal companies ‘chronically scarce’ on cash,A string of legal challenges against the West Virginia governor shows that the coal baron’s sprawling business enterprise is struggling to pay its bills.
2023-06-01 16:48:22,Just don't boast: How Biden world sought to ace the debt ceiling standoff,The president’s advisers are betting voters will reward Biden for getting things done.
2023-06-01 15:35:12,Defense drama hinders Senate sprint toward debt vote,A new wrinkle unfolded as defense hawks and other Republicans pushed for a commitment from Chuck Schumer to blunt some of the deal’s effects.
2023-06-03 18:15:22,Biden signs debt ceiling bill,"Biden signed H.R. 3746, the ""Fiscal Responsibility Act of 2023,"" two days before Monday’s default deadline, on which the U.S. would run out of cash to pay its bills."
2023-06-05 02:58:27,Indian opposition leader Gandhi calls on U.S. audience to stand up for ‘modern India’,"“To be nasty to people, to be arrogant, to be violent, these are not Indian values,” Rahul Gandhi said."
2023-06-05 19:03:36,House GOP tees up contempt vote for FBI director as Biden probe heats up,"The Oversight Committee plans a first move on Thursday, unless the bureau hands over a copy of a document Republicans say ties the president to explosive allegations."
2023-06-06 19:55:13,Conservatives surprise McCarthy with floor rebellion over debt deal anger,A band of House conservatives derailed a bill that takes aim at gas stove regulation. It could be just the beginning of moves to undercut the speaker.
2023-06-08 12:23:40,Gavin Newsom wants 28th Amendment for guns in U.S. Constitution,California's governor outlines a plan fueled by money left over from his recent reelection.
2023-06-08 02:23:12,House Republicans cancel vote to hold FBI director in contempt,Rep. James Comer said the FBI offered to let his committee review a 2020 document at the center of the standoff.
2023-06-07 21:50:32,"Sunak courts Washington, D.C.",Sunak spoke in broad strokes of the strength and enduring bond between the U.S. and the U.K. in brief comments before congressional leadership.
2023-06-07 17:53:12,Conservatives shut down House floor as revenge for debt deal,The roughly dozen lawmakers say they want certain commitments in writing from Speaker Kevin McCarthy over how leaders will run the chamber moving forward.
2023-06-09 08:30:00,"On the tee, from Washington: Bipartisan anger over Saudi golf mega-deal",But Congress may have to wait to swing at the proposed LIV-PGA Tour merger while federal agencies go for the green.
2023-06-09 08:30:00,Biden world restructures itself around selling Bidenomics,"Fresh off the debt ceiling fight, the next task for the White House is simple salesmanship. But is it that simple?"
2023-06-09 00:20:58,Lawmakers react to Trump indictment news,"The comments largely fell along party lines, with Republicans denouncing the documents investigation and Democrats criticizing the 2024 GOP presidential candidate."
2023-06-09 00:17:09,The conservative Supreme Court might have paved the way for Dems to take the House,The shocking decision could have a domino effect.
2023-06-08 19:30:35,"White House anxiously watches Ukraine’s counteroffensive, seeing the war and Biden’s reputation at stake","With the debt ceiling done, attention turns to the challenges piling up internationally."
2023-06-09 15:29:31,Republicans fail to get top recruit for Wisconsin Senate,Rep. Mike Gallagher declined to run against incumbent Sen. Tammy Baldwin
2023-06-12 08:30:00,The surprising corner of the Senate that's sinking Biden nominees,"Three presidential picks so far this year withdrew because they lacked enough support in the Commerce Committee, where there's four Democrats up for reelection in swing states next fall."
2023-06-12 08:30:00,"If you thought the debt fight was tough, get ready for spending season",Congress has to fund the government before October to avoid a government shutdown. But a debt deal that might have eased that crunch has instead created more tension.
2023-06-13 00:34:07,Trump drew one of his favorite judges. Here’s how she could help his case.,Judge Aileen Cannon has broad power to control the direction — and the pace — of the classified documents case.
2023-06-12 18:25:37,Californians: Have you asked Sens. Feinstein or Padilla for help recently? Send us your receipts.,We also want to hear from staffers and liaisons on how the senators are handling constituent services.
2023-06-12 08:30:00,Capitol Hill reckons with a government funding fight that just got tougher,Congress has to fund the government before October to avoid a government shutdown. But a debt deal that might have eased that crunch has instead created more tension.
2023-06-14 08:30:00,"As indictments pile up, Trump's Senate GOP skeptics multiply",His number of upper-chamber Republican endorsers is equal to the number who say they want another nominee — or who voted to bar him from office.
2023-06-13 19:09:08,'Trying to figure it out': McCarthy's conservative rebels struggle with next steps,"Members of the group know they want significant spending cuts. But they haven't settled on a strategy, how far to push or any of their other demands."
2023-06-15 13:33:00,‘Not a tech-savvy group’: Cruz discredits congress on AI,
2023-06-14 17:23:29,Batter up! Lawmakers suit up for annual Congressional Baseball Game,"Republicans were victorious last year, winning 10-0."
2023-06-16 08:30:00,Meet the member of Congress who’s trying to save Capitol soles,"Rep. Jared Moskowitz (D-Fla.) wants to open the storied doors of the House speaker's lobby to Air Jordans, high-top Chucks and Gazelles. If buttoned-up Washington will agree."
2023-06-15 19:36:01,Biden praises companies for ending hidden fees,"The president recognized several ticketing companies — including Airbnb, SeatGeek and Ticketmaster parent company Live Nation — at the White House."
2023-06-18 15:21:19,House Intel chair touts upcoming special counsel testimony,Rep. Mike Turner will hear closed-door testimony Tuesday.
2023-06-21 12:34:56,Rep. Lisa Blunt Rochester launches bid for Senate seat in Delaware,"If elected, Blunt Rochester could become the third Black woman to ever serve in the Senate."
2023-06-20 21:43:32,Supreme Court turns away veterans in case over 1966 hydrogen bomb accident,The incident was one of the scariest of the Cold War.
2023-06-22 08:30:00,The Freedom Caucus firebrand you may not know well — but should,Rep. Andy Biggs hasn’t figured whether he wants to be an occasional gadfly — or the first to try to take out the speaker.
2023-06-21 17:54:31,Dems push forward on Supreme Court ethics bill following Alito report,"Senate Minority Leader Mitch McConnell said he would try to block any legislation on the floor: ""I think the Chief Justice can address these issues, Congress should stay out of it."""
2023-06-23 13:30:00,House Dems fume at Senate over Biden nominations,House lawmakers say the upper chamber is moving too slowly on key nominations and that the president needs to consult with them more — despite them having no official role in the process.
2023-06-23 09:01:00,Group seeks boost to labor organizing in Senate,The move launches an uphill battle for labor organizing in the narrowly divided upper chamber.
2023-06-22 17:20:28,"George Santos’ father and aunt backed his bail bond, court papers show",A federal court released the names of his so-called sureties after rejecting Santos’ bid to keep them secret.
2023-06-23 16:55:40,Cranky Congress: House GOP hopes a holiday can ease its factional warfare,"After seven straight weeks together, Republicans are ready for a break. As one said: ""Every so often, the kids need to get on the bus and go home."""
2023-06-24 15:42:39,‘Breathtaking’: Lawmakers react to escalating security situation in Russia,Congressional voices across the board stressed the historic scale and scope of Yevgeny Prigozhin’s declaration of war on Russian military leadership.
2023-06-26 08:30:00,House Republicans think Democrats' abortion rights strategy could backfire,New York and California Republicans aren't sweating the onslaught of abortion spending.
2023-06-27 11:55:11,Former Navy SEAL Sheehy announces Montana Senate bid,A crowded primary could complicate the party’s chances of retaking the Senate.
2023-06-26 17:36:47,Freedom Caucus takes key vote on Marjorie Taylor Greene’s future,"It's not yet clear whether the conservative group will formally eject her, but people familiar with the matter pointed to a consensus against her."
2023-06-29 08:30:00,McCarthy confronts a spending mess that will test his speakership,The speaker faces a monumental challenge over the next three months: bringing his conservatives and more centrist members together on a workable plan to fund the government. He's not there yet.
2023-07-01 11:00:00,Why Dems aren't campaigning on affirmative action,"They have other plans to try to boost minority admissions at colleges after the Supreme Court's decision, like going after policies that benefit the children of alumni."
2023-07-06 20:48:22,Marjorie Taylor Greene booted from House Freedom Caucus,"The vote occurred nearly two weeks ago, shortly after the Georgia Republican had called then-fellow Freedom Caucus member Rep. Lauren Boebert a pejorative in a verbal fight on the House floor."
2023-07-05 21:46:15,Leaping from senator to president won't be easy for Tim Scott,"The South Carolina Republican is keeping some distance from the Capitol as he seeks the White House — which makes sense, given recent history in his party."
2023-07-05 21:29:33,Abortion rights likely headed for showdown in Ohio this fall,"Pro-abortion rights groups submitted more than 700,000 signatures for a ballot initiative that would codify the right to an abortion in the state constitution."
2023-07-07 15:52:00,Acting Labor Secretary Julie Su: ‘I remain hopeful for confirmation’,"Key moderate senators, including Joe Manchin, have yet to publicly say whether they will support her nomination."
2023-07-07 08:30:00,McCarthy declines to endorse Trump — looking to avoid a GOP civil war,"The peace might be short-lived, but the speaker's members understand why he's not offering a formal endorsement to Donald Trump."
2023-07-11 18:08:41,Politicians sound off over Tuberville’s white nationalist comment,
2023-07-11 16:54:21,How PGA Tour officials defended their Saudi golf deal to Congress,Democratic senators accused the executives of enabling Saudi Arabia to “sportswash” its human rights abuses.
2023-07-10 23:35:17,Sam Brown launches Senate run in Nevada,
2023-07-12 18:38:43,"House GOP spars with FBI chief on Hunter Biden, Jan. 6 and more","The hearing comes as some within the party are pushing to slash the FBI’s budget, including going after Wray’s salary directly."
2023-07-12 17:08:42,McCarthy confronts bleak reality as conservatives undercut GOP agenda,It's not just the Pentagon policy bill that's delayed on the floor. Prepare for further Republican drama over government spending and a big tax bill.
2023-07-11 22:12:09,McCarthy summons GOP factions to counter threat of a new conservative rebellion,"But several hard-right Republicans left the speaker's meeting less than satisfied, with several must-pass bills hanging in the balance."
2023-07-13 20:00:13,"Manchin opposes Julie Su for Labor secretary, jeopardizing nomination",The acting Labor secretary can't afford to lose any more Democratic votes.
2023-07-13 18:35:44,Nick Begich challenging Peltola for House seat in Alaska,Begich came in third against Peltola and Sarah Palin in the 2022 election for Alaska's at-large seat.
2023-07-16 01:55:30,"Sinema outraised by Gallego again, further clouding her future",Two key Senators who haven't announced reelection plans leave questions about their future unanswered.
2023-07-17 08:30:00,The corporate gig Katie Porter erased from her whiteboard,"Porter, a leading Democratic candidate for U.S. Senate in California, had a stint with a mortgage servicer shortly after working on the issue for the state."
2023-07-17 08:30:00,A group of GOP centrists threatens hardline tactics on tax bill,"Usually it's the conservative bloc of House Republicans stirring trouble. This time, it's centrists who are threatening to hold up a signature party bill."
2023-07-18 17:19:42,Dems grit their teeth to get through another awkward Israel dustup,Members of the Squad carefully avoided a flap while boycotting the Israel president's speech. Then the Progressive Caucus chief created one anyway.
2023-07-18 08:30:00,The battle for the House is currently dominated by GOP fundraising,It’s a stark contrast from the dynamics four years ago.
2023-07-19 18:37:30,Israeli president responds to U.S. lawmaker criticism,At least five progressive members boycotted Herzog's speech.
2023-07-19 17:19:54,Herzog addresses Israel’s critics in speech to Congress,
2023-07-18 17:19:42,Dems grit their teeth through another awkward Israel dustup — and GOP-forced rebuke,Members of the Squad carefully avoided a flap while boycotting the speech by Israel's president. Then the Progressive Caucus chief created one.
2023-07-20 19:52:06,Three key moments from RFK Jr.'s testimony to Congress,"Republicans invited the vaccine skeptic and presidential candidate to testify about ""censorship"" on social media platforms."
2023-07-20 17:30:00,Mayorkas gets new chief of staff with political battle skills,Jonathan Davidson will serve as chief of staff for Mayorkas amid ongoing immigration debate
2023-07-20 16:59:12,GOP centrists pan Trump impeachment erasure as McCarthy denies any deal,A number of lawmakers in Biden-won districts said they would not support a symbolic attempt to expunge the former president's record.
2023-07-20 14:44:05,What no one will say out loud about Nancy Pelosi,At least three scenarios could play out in the coming months.
2023-07-20 14:38:55,"Under oath, RFK Jr. denies allegations of racist and antisemitic remarks",
2023-07-20 13:35:28,Matthew McConaughey has another demand of Washington on gun safety,The actor has launched a grant initiative to safeguard schools a year after tragedy hit his hometown.
2023-07-21 17:54:39,Biden's pick for top Navy leader would be first female Joint Chiefs member,"If confirmed, Franchetti would replace Chief of Naval Operations Adm. Mike Gilday, whose four-term year ends this fall."
2023-07-21 13:03:03,‘Barbie’ or ‘Oppenheimer’? We asked senators which movie they’re seeing.,"From a meme to the halls of Congress, no one can escape the “Barbenheimer” phenomenon."
2023-07-21 08:30:00,Manchin and Sinema back to bedeviling Democrats,"The West Virginian is flirting with a third-party presidential bid and rejecting Biden nominees. And the Arizonan is drawing the ire of Democrats, too."
2023-07-22 20:04:12,Tim Burchett: Americans should know what the government knows about UFOs,A bipartisan push to release government records about extraterrestrial affairs has slowly built on Capitol Hill.
2023-07-24 17:16:29,Biden taps new legislative affairs head as spending fight approaches,"Longtime Hill aide Shuwanza Goff has built relationships not only with mainstream Democrats, but also with progressives and Republican leaders."
2023-07-24 08:30:00,House Republicans start their funding rumble with shutdown looming,"Party leaders are hustling to build support to pass two of their easier spending bills, most of which are dogged by politically unpopular cuts and policy restrictions."
2023-07-25 20:15:17,McCarthy edges back from the brink of a Biden impeachment inquiry,The speaker shifted to suggesting that House GOP investigations might merit one — less than a day after a more direct flirtation on Fox News.
2023-07-25 08:30:00,Dems see a surprising new path to retaking the House — through the Deep South,"The Supreme Court's recent ruling, which declined to whittle down the Voting Rights Act, is prompting challenges to congressional maps in a handful of Southern states."
2023-07-26 19:15:38,"McConnell abruptly leaves press conference, aide cites light-headedness",The Senate minority leader trailed off and stared straight ahead for a few minutes as his fellow senators asked if he was OK.
2023-07-27 21:20:34,White House closely watching McConnell amid health scare,The minority leader’s recent woes have forced the White House to ponder what Senate GOP leadership would look like without him in it.
2023-07-27 20:21:21,Vance sends a ‘wokeness’ questionnaire to State nominees,Holds from Sens. J.D. Vance and Rand Paul are a major reason dozens of U.S. ambassadorships and other State Department roles are vacant.
2023-07-26 19:15:38,McConnell episode alarms Senate GOP,The Senate minority leader trailed off during a press conference and stared straight ahead for a few seconds as his fellow senators asked if he was OK.
2023-07-28 15:22:04,GOP Rep. Donalds blames DeSantis campaign for dustup over controversial Florida education standards,"DeSantis, along with his administration and presidential campaign apparatus, have launched digs at Donalds over the past two days."
2023-07-31 15:19:49,"Americans' confidence in the U.S. military lowest in 2 decades, poll finds",Only 60 percent of Americans expressed “a great deal” or “quite a lot” of confidence in the military in a recent Gallup poll.
