DATE,TITLE,SUMMARY
2023-02-09 19:56:23,Santos was charged with theft in 2017 case tied to Amish dog breeders,The New York congressman had the charge dismissed and his record expunged after claiming his checkbook was stolen.
2023-02-09 17:27:03,Small town mayor files to challenge Menendez in 2024 Democratic primary,"Joe Signorello III has developed a relatively high profile for a mayor of a town of just 14,000."
2023-02-13 09:30:00,Conservatives gloat as Congress starts off with little to show,"The House has been busy on matters that won't become law, while the Senate's doing the bare minimum. And the GOP's right flank is feeling good."
2023-02-15 09:30:00,The time George Santos tried to raise crazy money to host a simple rally for Trump,In 2019 Santos led United for Trump. Fellow Trump supporters questioned his exorbitant spending plans.
2023-02-15 19:05:21,"DOJ won’t charge Gaetz in sex trafficking probe, lawmaker’s office says",Matt Gaetz repeatedly denied having sex with anyone who was underage.
2023-02-15 18:45:00,Divided government threatens to clip wings of Congress' China hawks,Bipartisan senators are rumbling about another bill to ding China after the invasion of U.S. airspace. But they admit getting anything through a split Congress could be a longshot.
2023-02-18 15:36:56,"Aides, gov's office expect Fetterman to return to Senate",Fetterman’s aides said he will likely return from inpatient care in a few weeks.
2023-02-21 09:30:00,GOP lawmakers seek investigation of ‘unauthorized’ disclosure of their Air Force records,Reps. Don Bacon and Zach Nunn say they were two of the 11 people whose records were released by Air Force without approval.
2023-02-22 00:43:16,McClellan elected as Virginia’s first Black woman in Congress,The Virginia state senator has won a special election to replace the late Rep. Don McEachin in a heavily Democratic district.
2023-02-23 18:38:07,Appeals court weighs Rep. Perry’s immunity from Jan. 6 probe,Two of the three D.C. Circuit judges hearing the case appeared highly skeptical of the Justice Department’s narrow view of the Constitution’s “speech or debate” protection for lawmakers.
2023-02-24 19:09:07,Biden immigration policy aides to depart amid criticism of new migration policy,Staff departures are common after midterms. But the president’s immigration team has struggled with turnover.
2023-02-24 17:56:24,George Santos lied to a judge in 2017 bid to help a ‘family friend’ charged with fraud,POLITICO obtained an audio recording of the proceeding where Santos falsely says he worked for Goldman Sachs.
2023-02-28 00:19:20,One House Republican's unique anti-Santos pitch: Block him from profiting off his lies,"Rep. Anthony D'Esposito, a home-state colleague of the first-term fabulist, is circulating the legislation among fellow Republicans."
2023-02-28 00:17:27,Quieter Senate gives Fetterman recovery room,"Democrats have a 50-49 majority as their first-term Pennsylvanian recovers. And with no big thorny legislation on the horizon, his party is giving him ample patience."
2023-02-28 17:50:09,Biden to tap Julie Su as next Labor secretary,"The current deputy Labor secretary will be nominated to replace Marty Walsh, according to two people familiar with the matter."
2023-02-28 17:39:39,House GOP moving to let Jan. 6 defendants access Capitol security footage,The Republican plan follows Speaker Kevin McCarthy's decision to grant Fox News' Tucker Carlson exclusive access to internal film from the day of the attack.
2023-03-01 20:34:18,White House has ‘concerns’ about TikTok’s threat to national security,
2023-03-03 09:30:00,House Dems strategize how to achieve a Speaker Hakeem Jeffries,The caucus' annual retreat was full of optimism for taking the majority next year and installing the first Black speaker.
2023-03-02 20:30:08,House Ethics panel launches investigation into Santos,The committee is also continuing its review of a case involving Democratic Rep. Alexandria Ocasio-Cortez's visit to the 2021 Met Gala.
2023-03-02 18:49:04,DOJ rejects Trump claim of ‘categorical’ immunity from Jan. 6 lawsuits,"But the department also urged a federal appeals court to sidestep ""sensitive questions"" about presidential immunity."
2023-03-05 12:00:00,Biden gets a rare hand from Big Business in quest to ease consumer pain,The bully pulpit has produced some interesting results. But how consequential are they?
2023-03-06 09:30:00,The debt-limit time machine: What the last 10 big fights tell us about this one,A decade filled with fiscal standoffs shows us three telling truths about how Congress and the White House might handle the current impasse — no DeLorean needed.
2023-03-06 17:08:14,Senate Dems try to declare ‘independence’ amid GOP floor takeover,Republicans are expected to force a floor vote on rejecting a progressive D.C. criminal justice move even after the city council tried to unilaterally withdraw the proposal.
2023-03-09 05:31:06,Mitch McConnell hospitalized after a fall,"The Senate minority leader fell while at dinner, his spokesperson said."
2023-03-08 17:51:03,Biden’s nominee for IRS commissioner teed up for confirmation by Senate,The Biden administration pick for the top job at the IRS was poised for confirmation before the Senate postponed the vote as debate continued on abortion legislation and a D.C. crime law.
2023-03-08 17:22:18,McCarthy's GOP tries to move on from Tucker Carlson-Jan. 6 drama,"Hours after Senate Republicans slammed the Fox News host for using speaker-provided footage to downplay the riot, the House majority pushed to talk about other things."
2023-03-10 09:30:00,Manchin makes his moves: Tweaking Biden and courting GOP,The West Virginia centrist is tweaking the Biden administration and staying open to a Republican collaboration on permitting. But ... is he running? He won't say.
2023-03-09 22:49:20,"George Santos masterminded 2017 ATM fraud, former roommate tells feds","“Santos taught me how to skim card information and how to clone cards,” Gustavo Ribeiro Trelha, who was convicted of felony access device fraud, said Wednesday in a sworn declaration submitted to the FBI."
2023-03-13 08:30:00,How Democrats disarmed a brewing Senate battle in Michigan,"Debbie Stabenow is headed toward retirement with a concerted plan that's falling very much into place, with Rep. Elissa Slotkin (D-Mich.) all but clearing the field so far."
2023-03-13 21:59:33,McConnell discharged from hospital with rib fracture,The Senate minority leader had been treated for a concussion after a fall last week.
2023-03-13 20:31:04,Politicians sound off on SVB investors after bank failure,
2023-03-15 08:30:00,Senate Dems confident they can repeal Iraq war authorizations — despite absences,"Two Democratic senators are out due to recent hospitalizations, complicating the math on lawmakers' years-long quest to formally end the Iraq war and reassert congressional authority."
2023-03-14 16:15:00,California's Dem Senate hopefuls vie for higher ground over Silicon Valley Bank debacle,"There's not much daylight between Reps. Katie Porter, Adam Schiff and Barbara Lee over the implosion now rattling markets. They're vocally pushing their own solutions anyway."
2023-03-17 17:05:55,"House GOP ignored Capitol Police requests to review public Jan. 6 footage, lawyer says","Only one of the 40 clips aired on Tucker Carlson's show were reviewed and approved beforehand, the force's general counsel wrote in a sworn court filing."
2023-03-17 08:30:00,House GOP quietly preps take two of its border push,"Republicans' first attempt at big changes to immigration policy publicly failed, but leaders are starting to talk about a revival."
2023-03-20 18:47:35,Four more Oath Keepers convicted of Jan. 6 felonies,The convictions add to a growing roster of Oath Keepers who are facing lengthy prison terms for their role in the Capitol attack.
2023-03-20 01:00:22,McCarthy pushes back against Trump's calls for protests: ‘We want calmness out there’,"""He’s not talking in a harmful way, and nobody should,"" the House speaker said of the former president."
2023-03-21 08:30:00,‘Normalize’ doomsday? Dems lambaste GOP’s latest debt-limit gambit,House conservatives are pushing a plan to guarantee payments to U.S. debt holders — including some foreign nations — while freezing out nearly every domestic obligation.
2023-03-22 15:15:05,Republicans’ best hope for Wisconsin Senate is a Trump critic,Senior Republicans are eager to find a candidate who can bring back the independent and moderate Republican voters they lost in 2020 and 2022.
2023-03-22 08:30:00,National Republicans are looking for Senate candidates who are filthy rich,Democrats have been out-raising Republicans in the past two cycles. Republicans have come up with a possible solution.
2023-03-23 19:28:10,Gun rights hearing turns chaotic amid arrest of Parkland parent,It started when Patricia and Manuel Oliver shouted aloud about their son Joaquin's death before being removed from the room by Capitol Police at Republicans' request.
2023-03-23 17:46:04,‘I try not to waste my time’: McCarthy’s GOP wrangles agenda tests,"House Republicans vowed to open the floor to amendments. But on both education and energy legislation, they're finding that promise sparks its share of internal dissent."
2023-03-22 08:30:00,Republicans are looking for Senate candidates who are filthy rich,Democrats have been out-raising Republicans in the past two cycles. Republicans have come up with a possible solution.
2023-03-23 22:43:00,House GOP eyes a new demand in debt talks: Energy permitting,"Insisting on a link between the two topics, if party leaders embrace the idea, could give Republicans a near-guaranteed win on a signature issue."
2023-03-23 17:46:04,House GOP infighting is threatening their ability to get bills out the door,"House Republicans vowed to open the floor to amendments. But on both education and energy legislation, they're finding that promise sparks its share of internal dissent."
2023-03-28 19:42:44,'Sickened': Partisan clashes ensue after Nashville shooting,
2023-03-28 16:46:15,TikTok is a necessary evil for Democratic campaigns,"President Joe Biden and Congress may want to ban the social media app, but Democratic candidates are still trying to break into voters' For You Pages."
2023-03-29 16:42:02,How Iraq war powers repeal turned into an unlikely bipartisan win,It took four years of relentless campaigning for Sens. Tim Kaine (D-Va.) and Todd Young (R-Ind.) to taste the 66-30 victory they scored Wednesday.
2023-03-28 20:42:47,Juror in Oath Keepers trial reveals secrets from the deliberation room,"In a newly released interview, the juror recounts being disturbed by the tactics of some defense attorneys."
2023-03-30 17:09:45,Meet Kevin McCarthy’s new wingman,"Rep. Garret Graves is ubiquitous in House GOP leadership, from the energy debate to the speakership race. He’s not going anywhere... yet."
2023-03-30 17:00:02,Trump’s standing among Hill conservatives dims ahead of ’24,Interviews with more than 40 congressional conservatives show a surprising number of the former president’s once-ardent supporters have gone quiet about whether they back him.
2023-03-29 21:28:08,Congress appropriated $500M for workers. Democrats can’t agree on whether to spend it.,Two powerful Senate Democrats are at odds over whether funding in last year’s government spending bill can be claimed by workers whose jobs have been sent overseas.
2023-03-29 21:14:17,Here’s what happened when Bernie Sanders put Starbucks’ former CEO in the hot seat,"Former CEO Howard Schultz pushed back against allegations that the company illegally interfered in unionization efforts, but Bernie Sanders was having none of it."
2023-03-30 23:30:37,Hill Republicans sprint to Trump’s corner before indictment details are clear,It was the latest illustration of GOP fealty to the former president as he mounts his third White House bid.
2023-03-31 22:26:56,Fetterman released from inpatient treatment for depression,"The Pennsylvania Democrat said he's ""so happy to be home"" after more than a month of treatment at the Walter Reed National Military Medical Center."
2023-04-02 11:00:00,Want to see the hurdles Biden really faces in making progress on guns? Come to W.Va.,Biden's push to ban assault weapons is stuck in Congress. So are efforts to modernize the ATF's National Tracing Center.
2023-04-02 22:30:00,From agitator to insider: The evolution of AOC,"The New York Democrat, in a wide-ranging interview, tackled her ""really surreal"" start in Congress and the space she's carved out in the party fold."
2023-04-06 16:43:54,White House pulls its punches over GOP judicial nomination blockade,The latest refusal by a Republican senator to return a blue slip has been met with restraint by the administration.
2023-04-06 08:30:00,Freedom Caucus and progressives lock arms — and that could be bad news for McCarthy,"The speaker's immediate headache is a growing right-left alliance on Iraq war powers. But House liberals and conservatives are linking up on other issues, too."
2023-04-07 19:18:56,Bennie Thompson: ‘I chose Liz Cheney over party’,"In an exclusive interview, the Democrat who led the Jan. 6 hearings talks about the parallels between attacks on the committee — and criticism of Trump’s criminal indictment."
2023-04-07 12:09:43,Kevin McCarthy’s blame game sweeps Capitol Hill,"As debt limit pressure mounts, it’s GOP leadership — not just the rank and file — that’s in disarray."
2023-04-09 22:29:19,Sen. Richard Blumenthal injured during basketball parade,The Connecticut Democrat said that he underwent surgery Sunday.
2023-04-11 12:59:41,Virginia Rep. Wexton announces Parkinson's diagnosis,"The disease has primarily affected her speech and balance, the 54-year-old lawmaker said."
2023-04-12 08:30:00,This Korean American Republican is trying to educate her party — in the U.S. and abroad,"Rep. Young Kim (R-Calif.) describes herself as a ""bridge builder"" between America and South Korea. It's a task that isn't always easy, in either nation."
2023-04-12 20:34:24,Feinstein's condition sparks concern she won’t return to the Senate,People in touch with the veteran Democratic senator say her shingles diagnosis has taken a heavy toll.
2023-04-14 17:35:30,McCarthy prepares his opening debt-limit bid — and it’s full of potential pitfalls,"The stakes couldn't be higher for the California Republican, who must avoid a misstep in the talks that would weaken his speakership."
2023-04-18 18:09:40,"Gaetz, Boebert and Biggs raised big bucks off their opposition to McCarthy",It pays to be a party firebrand.
2023-04-18 14:33:40,Fetterman marks Senate return with effort to ban stock trading in Congress,
2023-04-17 23:59:20,Senate Dems weighing a Clarence Thomas invite to future Supreme Court ethics hearing,"If he's asked to appear, the justice is likely to face questions about reports on his relationship with a billionaire GOP donor."
2023-04-19 19:17:32,House GOP plows ahead on risky immigration plan,Republicans are determined to push past internal infighting and pass a broad immigration bill — while separately moving closer to possible impeachment of the DHS chief.
2023-04-19 09:00:00,"Biden is ignoring immigration issues, voters say in poll",The exclusive poll comes three weeks before the Biden administration plans to end Title 42.
2023-04-20 16:32:06,Durbin asks Roberts to testify on Supreme Court ethics flaps,The chair of the Senate Judiciary Committee invited the chief justice to a May 2 hearing.
2023-04-24 19:43:57,"Debt-limit plan won't be changed, House GOP leaders tell holdouts","In an interview with POLITICO, House GOP Whip Tom Emmer said the debt-ceiling proposal is ""not getting changed,"" despite about half a dozen potential Republican holdouts."
2023-04-24 08:30:00,House GOP warns FBI to stay out of controversial surveillance talks,The bureau is at the heart of a fight over a controversial surveillance program. But its toxic relationship with the House GOP means it has to stay far away from reauthorization talks.
2023-04-24 08:30:00,House GOP budget chief moves forward after McCarthy beef,"The House budget chair spends months crafting a budget that is largely symbolic and then trashed by the opposing party. For Rep. Jodey Arrington, it also included some spats with leadership."
2023-04-25 19:27:21,Torres: Biden's age isn't ideal but 'best hope' to win,"Rep. Ritchie Torres (D-N.Y.) said Democrats should do more to build the next generation of leaders, with President Joe Biden launching a reelection campaign at age 80."
2023-04-26 17:30:33,Why the Senate isn't jumping at the opportunity to rescue the debt crisis,"As the House GOP struggles to pass its plan, Washington could soon look to the chamber with a track record of bipartisan deals — where nothing is happening."
2023-04-26 22:27:07,How McCarthy mollified the right on his debt plan — for now,"Conservative strategizing about the House GOP's bill began soon after the speakership battle, at Sen. Rick Scott's dining room table."
2023-04-26 20:16:31,Biden: I'll meet with McCarthy — but not on debt limit,"The president says he’s open to talking, but on the budget first."
2023-04-26 17:30:33,Why the Senate isn't jumping at the opportunity to end the debt crisis,"As the House GOP struggles to pass its plan, Washington could soon look to the chamber with a track record of bipartisan deals — where nothing is happening."
2023-04-28 16:24:49,House GOP leaves Washington with a debt win — but not quite a breakthrough,Most Republicans insist they have little anxiety about Wall Street's rattled nerves as a dysfunctional Congress barrels closer toward this summer’s drop-dead debt limit date.
2023-05-01 15:57:06,"Cardin not running for reelection, opening blue-state Senate seat",The Maryland senator's vacancy will jolt both the state's Democratic congressional delegation and political apparatus.
2023-05-01 08:30:00,The Hill's biggest health care battle you haven't heard about,"Two Senate duos want insulin costs capped at $35 monthly for people with diabetes, but that’s where the similarities end between their proposals."
2023-05-02 19:57:02,"Feinstein ‘hopeful’ she can return to Senate next week, Schumer notes say","The Senate majority leader did not address the California senator's absence during a press conference, but his notes said they spoke Monday."
2023-05-02 00:17:20,Biden won’t move on debt ceiling terms even as he seeks to restart talks,"With threat of a June 1 default now looming, the president invites GOP leaders to talk, but on his terms."
2023-05-03 17:45:25,California lawmaker running for Congress is arrested for drunk driving,Democratic state Sen. Dave Min seeks to replace outgoing Rep. Katie Porter in Orange County.
2023-05-03 21:20:30,Black Caucus presses Senate Dems to blow up tradition on judges,"Members of the House Democratic group met quietly with the Judiciary Committee chair, pushing to halt the practice that gives Republicans power to block home-state picks."
2023-05-03 20:22:07,"Punting on the debt limit is a 'no-go,' lawmakers say",Republicans argue the president should have come to the table sooner. Democrats say it's a clean debt limit hike or bust. Both sides say they won't approve a temporary hike.
2023-05-03 20:22:07,Lawmakers dismiss possibility of debt limit off-ramp,Republicans argue the president should have come to the table sooner. Democrats say it's a clean debt limit hike or bust. Both sides say they won't approve a temporary hike.
2023-05-05 08:30:00,Former Trump campaign staffer subpoenaed by DOJ is now working for House committee on elections,The FBI subpoenaed Thomas Lane for his records at his Virginia home. He now works on the House Administration Committee.
2023-05-07 16:02:02,Biden says he would sign gun legislation immediately if he could,"Saturday’s shooting in Allen, Texas, was the second mass shooting in Texas in recent weeks."
2023-05-07 11:00:00,Jon Tester wanted to soften hemp regulations and turned to industry officials to help craft the bill,A private email reveals the access given to outside advocates for the construction of the Industrial Hemp Act of 2023.
2023-05-08 19:19:55,House and Senate diverge on immigration as border fears mount,"On one end of the Capitol, Republicans are toiling to get the votes for a sweeping immigration bill. Across the building, bipartisan talks are barely getting started."
2023-05-08 13:00:00,Rand Paul riles his GOP colleagues again — this time over TikTok,"While many Republicans favor banning the Chinese-owned social media app, the outspoken Kentucky senator worries it could mean the party would “continuously lose elections for a generation.”"
2023-05-08 08:30:00,Why McConnell and McCarthy locked arms on the debt crisis,"After multiple splits that stressed their party, the Senate GOP leader and the speaker are moving as one as the nation nears a fiscal breaking point."
2023-05-09 08:30:00,Uncharted territory: The Biden-Jeffries relationship comes into focus with the global economy on the line,"The White House used to lean on Nancy Pelosi to get things done in the House. Now, it’s building trust with a new Democratic leader."
2023-05-10 19:21:27,George Santos is facing new charges. Here's a look at some of his biggest scandals.,The New York Republican has pioneered a new kind of political scandal.
2023-05-10 17:37:24,Debt anxiety falls a little on the Hill. It might not be enough.,The minor signs of progress visible in the Capitol are leaving some lawmakers to wonder whether they're meaningful or more of a mirage.
2023-05-10 14:34:25,Read the Santos indictment,"The New York congressman was charged with wire fraud, money laundering and theft of public funds."
2023-05-10 08:30:00,Comer releases Biden family probe update without showing link to president,"The Oversight panel chair revealed that Biden family members, business associates or related companies received more than $10 million from companies run by foreign nationals."
2023-05-11 17:01:58,Feinstein's return fails to unstick controversial judicial nominee,The California Democrat showed up about 90 minutes late to a Judiciary Committee meeting as she continues to recover from her shingles diagnoses.
2023-05-12 15:13:56,Debt limit X-date could still crash Congress’ summer break,"It’s still possible the U.S. won’t hit its $31.4 trillion limit until beyond the end of July, the Congressional Budget Office said Friday."
2023-05-14 15:17:56,"Possibility of 'popular revolt' about gun control, Sen. Chris Murphy says",His comments came after a federal judge ruled a federal law preventing the sale of guns to 18- to 20-year-olds was unconstitutional.
2023-05-15 23:30:44,Intensifying debt talks threaten rare GOP unity,"The House's bill is the ceiling for conservative priorities on a debt deal, and Senate Republicans are hoping their lower chamber colleagues will show some flexibility."
2023-05-15 18:33:41,Virginia Dem lawmaker’s staff injured in baseball bat attack,"“This morning, an individual entered my District Office armed with a baseball bat and asked for me before committing an act of violence against two members of my staff,"" the Virginia Democrat said."
2023-05-15 14:45:40,Supreme Court wades into Trump hotel records fight,The justices are set to mull the power of minority lawmakers to demand records.
2023-05-16 20:28:32,House GOP leaders reassure their Santos critics after Dems launch expulsion push,"During a private meeting held just after Democrats pitched a surprise resolution ejecting Santos from office, Republican leaders briefed his fellow New Yorkers on the options."
2023-05-16 20:18:52,Biden appoints 2 additional top aides to try and get to the finish line on debt ceiling talks,There was talk of progress on Tuesday. But little time remains.
2023-05-17 23:42:09,House Foreign Affairs leadership offered viewing of Afghanistan cable,At issue is access to a cable from diplomats that correctly predicted the fall of Kabul.
2023-05-17 21:23:06,Congress crosses its fingers for the new Big Four to avert debt disaster,Lawmakers say the fresh White House trio and Rep. Garret Graves have the best shot at negotiating a debt deal in time.
2023-05-17 17:25:46,Democrats spar over Santos strategy as GOP punts on bid to expel him,"During a closed-door meeting hours before the party-line defeat of Rep. Robert Garcia’s measure expelling the New York Republican, the party diverged on strategy."
2023-05-17 17:09:16,Rep. Dan Goldman calls McCarthy strategy on Santos a ‘cop out’,
2023-05-18 16:05:39,Controversial judicial pick asks Biden to withdraw after failing to win Dem support,"Several Judiciary Committee Democrats were resisting supporting Michael Delaney, in part because of his past work defending a school in a civil lawsuit over sexual assault."
2023-05-18 10:47:21,Feinstein's primary caregiver: Pelosi's daughter,A quiet caretaking arrangement has raised questions about whether Nancy Pelosi has the ailing senator's personal interests at heart.
2023-05-19 20:43:52,What you need to know about the 14th Amendment and the debt ceiling,A handful of Democrats are urging the president to use the amendment to raise the nation’s debt limit without Congress.
2023-05-19 20:21:53,Biden’s 14th Amendment message to progressives: It ain’t gonna happen,"The president’s advisers fear such a move would trigger a legal battle, undermine global faith in U.S. creditworthiness and damage the economy."
2023-05-19 17:42:28,Expect ‘plot twists and dramatic turns’ in race to succeed Santos,It’s uncertain whether there will even be a primary election for the Long Island swing seat or if party leaders will select the next nominees.
