DATE,TITLE,SUMMARY
2023-09-25 13:21:50,Kevin McCarthy’s Catch-22 on the shutdown,"If he pursues the hard-right approach, it’s DOA in the Senate, and a shutdown is inevitable. If he passes a bipartisan CR to fund the government, his speakership is imperiled."
2023-09-23 11:00:00,"Food stamps, free lunch, airplane inspections: What’s hit when the government shuts down",Government shutdowns can wreak more havoc than you think.
2023-09-27 00:47:47,McCarthy attorney sends cease-and-desist over anti-Gaetz campaign,
2023-09-26 20:55:14,Senators reveal bipartisan plan to avert shutdown for 7 weeks,
2023-09-26 18:13:43,"Hill staffers' student loan repayment program will shut off during a shutdown, right as most other borrowers' debt repayment restarts.",
2023-09-26 18:13:33,A look at the membership of the Senate Ethics Committee — a body unlikely to move swiftly against Bob Menendez.,
2023-09-26 18:03:19,McCarthy pushes for Biden meeting with shutdown 5 days away,
2023-09-26 15:31:18,Senate Democrats turn on Menendez — even Cory Booker,
2023-09-26 14:53:46,Lawmakers from the Democratic Women’s Caucus want committee chairs to add more women as witnesses.,
2023-09-26 13:20:21,"Here we go again: The House tees up a rule vote, while the Senate charts their own shutdown avoidance path.",
2023-09-26 12:10:29,Are Senate Dems fumbling the Menendez scandal?,A surprising split screen has emerged between Washington and the indicted Democrat's home state.
2023-09-25 21:27:21,The son of Sen. Bob Menendez says he's seeking reelection in the House 3 days after father's indictment,The younger Menendez — a freshman member of the House — represents a safe Democratic seat in Hudson County.
2023-09-28 01:23:55,Fetterman responds to new Senate dress code with meme,Fetterman's press release featured a bemused-looking photo of actor Kevin James.
2023-09-27 22:08:03,Attention Hill staff: New guidance warns of campus impact and furloughs in a possible shutdown.,
2023-09-27 20:54:55,"From fax machines to AI, Sen. Markey reflects on his tech legacy",
2023-09-27 20:32:59,Why Republicans are giving Menendez a pass,
2023-09-27 18:55:22,Lina Khan: Congress needs to give 'additional clarity' on AI laws,
2023-09-27 18:44:23,Schumer declines to call on Menendez to resign,
2023-09-27 17:58:20,Bob Menendez wants a private audience with Dem senators tomorrow amid calls to resign,
2023-09-27 16:42:21,The Senate's stopgap funding bill is less than 24 hours old. Some Republican senators already want changes.,
2023-09-27 16:20:55,"McCarthy still lacks votes for GOP stopgap, increasing odds of a shutdown",
2023-09-27 16:18:57,Nancy Mace and Barbara Lee have introduced a bipartisan measure aimed at addressing the nation's backlog of untested rape kits.,
2023-09-27 14:19:22,"Dick Durbin, the Senate's No. 2 Democrat, is calling for Bob Menendez' resignation.",
2023-09-27 14:10:35,Ben Cardin still isn't calling for Bob Menendez's exit. But the Democratic caucus will discuss next steps Wednesday.,
2023-09-27 12:23:59,"Even as the House and Senate took modest steps on spending, a government shutdown looks increasingly likely.",
2023-09-29 03:31:18,House GOP's spending gambit flops,
2023-09-29 01:28:50,Conservatives pitch McCarthy alternatives as ouster talk heats up,"Majority Whip Tom Emmer's name has come up, but there's not consensus around any pick at this point."
2023-09-28 21:52:47,What does Matt Gaetz really want?,"There are a number of theories behind the Florida Republican's hostile feud with Kevin McCarthy, including his widely expected gubernatorial run in 2026."
2023-09-28 20:41:43,The Senate couldn't override Joe Biden's veto of legislation axing additional protections for two species under the Endangered Species Act.,
2023-09-28 19:48:37,Ben Cardin is considering an Egypt aid pause after Bob Menendez's indictment.,
2023-09-28 19:30:50,The House Freedom Caucus wants answers from Kevin McCarthy on the path forward on government funding — and a rebuke of the Senate stopgap.,
2023-09-28 19:04:57,"Bob Menendez still won't resign, as one Democrat weighs expulsion push",
2023-09-28 18:52:46,Ami Bera hopes to address the high cost of treating rabies after his brush with a rabid Capitol Fox.,
2023-09-28 16:58:30,Senate advances shutdown-averting bill as GOP discusses changes,
2023-09-28 16:56:41,GOP senators working with Sinema to hatch border add to spending bill,
2023-09-28 15:27:03,‘F— off’: Gaetz’s inescapable feud with McCarthy grows more hostile,
2023-09-28 14:30:24,House impeachment inquiry off to an awkward start,
2023-09-28 12:17:47,More Ukraine woes in the House as the government nears a shutdown,
2023-09-28 12:17:24,A shutdown still looms. But the Senate sewed up a codified dress code by unanimous consent.,
2023-09-28 09:00:00,What Romney’s private poll says about the likelihood of a shutdown,"As the shutdown deadline nears, Republicans are on very different pages — among themselves and between Congress' two chambers — over how to stop a shutdown."
2023-09-29 21:39:03,The race to replace Dianne Feinstein is about to get even more expensive,A special election means even more money can pour into the Senate race.
2023-09-29 19:18:52,Chuck Schumer said he's spoken with FEMA and will push for disaster relief in light of significant flooding in New York City.,
2023-09-29 19:13:09,The Senate group negotiating border adds for the spending bill is missing something: Any Democratic involvement.,
2023-09-29 17:51:54,"The House GOP's funding patch fails, teeing up shutdown",
2023-09-29 17:13:02,Feinstein's Demise is a Warning for Biden and Trump,Why are we so surprised when elderly politicians kick the bucket?
2023-09-29 16:41:18,"Former Sen. Boxer: Feinstein had a ‘very, very, very, very tough ending’","Feinstein held on to her Senate seat because she “viewed it as a calling,” former California Sen. Barbara Boxer told POLITICO."
2023-09-29 16:02:22,House GOP advances spending plan,
2023-09-29 15:35:50,Dianne Feinstein's life in pictures,The California senator began her political career when she was elected to the San Francisco Board of Supervisors in 1969.
2023-09-29 15:31:21,Matt Gaetz is reaching out to Dems about a McCarthy ouster,
2023-09-29 15:26:47,Joe Manchin is hammering the Biden administration for proposing the most limited offshore oil drilling plan in decades.,
2023-09-29 15:15:23,Jockeying to replace Feinstein ramps up as Newsom faces pressure to act,"The California governor is expected to announce his pick within days, not weeks."
2023-09-29 15:12:24,Feinstein's death throws Senate judicial confirmations into new limbo,
2023-09-29 12:35:06,"A House GOP stopgap funding bill is making its way to the floor, whether or not it has the votes.",
2023-09-29 09:00:00,Dems pressure White House to change economic message,Democrats are loving the Biden economy. They're less certain about his economic message.
2023-09-30 23:05:34,"Shutdown averted, White House prepares to fight for Ukraine aid","The president signed the bill after he and his team kept tabs, but did not overly influence, House Democratic votes for the measure."
2023-09-30 22:45:48,"Four votes, three possible senators: A wild California campaign year lies ahead",Sen. Dianne Feinstein's death will trigger special elections and some complicated political choices.
2023-09-30 21:11:13,Ukraine aid backers still see path for new aid,
2023-09-30 19:35:41,Pelosi to accompany Feinstein's body home to California,A U.S. military plane will take Feinstein back to San Francisco Saturday.
2023-09-30 19:04:17,One of Kevin McCarthy's own leaders opposed his spending bill,
2023-09-30 18:46:14,House GOP stunner: Spending patch passes with mostly Dem votes,
2023-09-30 18:16:47,Rep. Bowman pulled House fire alarm amid vote chaos,
2023-09-30 18:05:25,Senate GOP turns against their own bill — for a reason,
2023-09-30 17:07:06,House GOP fixes bill at 11th hour as pay raise debate rages,
2023-09-30 16:07:39,Pelosi's message to Dems: Don't save McCarthy's speakership,
2023-09-30 14:10:19,"House GOP reverses course, pushes clean funding patch",
2023-09-30 13:57:35,'Risk my job': McCarthy gives in on funding deal with speakership on the line,
2023-09-30 11:00:00,'It's crazy': Shutdown caps Congress' week from hell,"Back in the 1990s, as then-Speaker Gingrich put it, Republicans could at least ""afford to have five or six people be idiots."""
2023-10-01 01:02:22,Shutdown averted: Senate clears stopgap bill with hours to spare,
2023-10-01 00:05:59,Senators unanimously advance shutdown-averting bill,
2023-09-30 23:05:34,White House prepares to fight for Ukraine aid after shutdown averted,"The president signed the bill after he and his team kept tabs, but did not overly influence, House Democratic votes for the measure."
2023-09-30 22:45:48,"4 votes, 3 possible senators: A wild California campaign year lies ahead",Sen. Dianne Feinstein's death will trigger special elections and some complicated political choices.
2023-10-01 20:37:57,Rep. Dean Phillips to step down from leadership position after his calls for primary challenge to Biden,"“My convictions relative to the 2024 presidential race are incongruent with the majority of my caucus,"" Phillips said."
2023-10-01 18:59:43,‘Adopt Kevin or ditch him’: McCarthy’s speakership now at the mercy of Dems,"Some progressives vowed not to bail him out, but Hakeem Jeffries hasn't shown his hand."
2023-10-01 16:18:27,Moderate Republican implores Dems to help McCarthy,
2023-10-01 15:54:51,Graham: Booting McCarthy would be 'disaster',
2023-10-01 15:50:59,OMB chief confident Ukraine aid will come through,
2023-10-01 15:12:08,Ocasio-Cortez: I won't bail out McCarthy,
2023-10-01 14:49:15,McCarthy to Gaetz: 'Bring it on',
2023-10-01 14:01:53,Manchin on McCarthy: 'You can’t reason with unreasonable people',
2023-10-01 13:46:43,"Byron Donalds blasts CR, says McCarthy in trouble",
2023-10-01 13:10:16,Gaetz vows to move to boot McCarthy this week,
2023-10-03 02:44:42,Texas Democratic lawmaker attacked in D.C.,
2023-10-02 23:15:53,It's official: Gaetz to force vote on McCarthy's speakership,
2023-10-02 21:36:53,House panel set to hear from federal prosecutor in Hunter Biden probe,
2023-10-02 21:05:48,A viewer's guide to the McCarthy-Gaetz showdown,
2023-10-02 17:39:15,"As effort to oust McCarthy looms, Jeffries plans to meet with centrist Dem group",
2023-10-02 17:22:41,Bowman camp slams 'Nazi' Republicans after fire alarm flap,
2023-10-02 17:02:26,Gaetz vows to keep dragging out McCarthy drama,
2023-10-02 15:11:57,Menendez' scandals upended all kinds of institutions. But one industry is seeing dollar signs.,An industry preaching stability in tumultuous times has refined its pitch around the troubles of a U.S. Senator.
2023-10-02 12:28:28,"Get ready for another unsettled week in the House, as Kevin McCarthy works to stave off Matt Gaetz's bid to oust him.",
2023-10-02 12:10:03,Bowman's fire alarm fallout resonates back home and in Washington,Those close to Bowman said he was embarrassed by the confusion and was cooperating with investigators.
2023-10-02 09:00:00,GOP senators weigh go-big-or-go-home strategy on Ukraine,The GOP confrontation last week over continued aid was a rude awakening for Mitch McConnell and other senators who back Ukraine funding.
2023-10-04 01:55:03,Jim Jordan is entertaining a speakership bid,
2023-10-04 00:29:24,"Kevin Hern, leader of largest House GOP group, weighs bid for the gavel",
2023-10-04 00:12:12,Scalise contacting members to gauge support for speakership bid,
2023-10-03 23:56:42,McHenry ordered Pelosi to leave her Capitol hideaway office by Wednesday,
2023-10-03 22:57:50,McCarthy won't seek speakership again,
2023-10-03 22:09:36,Ben Cardin is threatening to block military aid to Egypt unless the country makes progress on human rights.,
2023-10-03 20:50:05,McHenry named as acting speaker,
2023-10-03 20:46:05,McCarthy out as speaker,
2023-10-03 18:47:52,McCarthy fails to stop push to boot him from speakership,
2023-10-03 18:21:30,Pelosi will miss the vote to oust her longtime nemesis McCarthy,
2023-10-03 17:54:40,Democrats say Kevin McCarthy ignored a request to postpone scheduled votes to accommodate Dianne Feinstein’s funeral.,
2023-10-03 17:23:42,House Dem leadership whips members to oust McCarthy,
2023-10-03 17:09:35,"New York House Republicans huddled in Kevin McCarthy's office, leaving with harsh words for Matt Gaetz.",
2023-10-03 16:44:23,Rep. Cuellar: ‘I hope they catch’ carjackers,"""You have to stay calm in these situations,” Rep. Henry Cuellar said."
2023-10-03 15:17:58,Centrist Dems leave McCarthy hanging without a lifeline,"They kept GOP backchannels open — but when the embattled speaker gave them no incentive to help save his job, they decided not to."
2023-10-03 13:12:23,Buckle up: McCarthy's future to be decided on Tuesday,
2023-10-03 13:00:00,Nonprofit group plans ad campaign using AI misinfo to fight AI misinfo,AIandYou is launching the public awareness campaign to educate voters on how AI could affect next year’s election.
2023-10-03 12:02:25,House Republicans and Democrats gather Tuesday morning for the first time since Matt Gaetz filed his resolution to oust Kevin McCarthy.,
2023-10-04 21:23:19,‘Anarchists’: Politicians point fingers amid House speaker chaos,
2023-10-04 20:27:23,Why didn’t McCarthy ask Trump to save him?,The now deposed speaker didn’t turn to the ex-president for help.
2023-10-04 19:47:22,"Chuck Schumer and Mitch McConnell are moving forward on Ukraine aid, even with the speaker's seat up for grabs.",
2023-10-04 18:30:28,Mitch McConnell's hope for the House: 'Whoever the next speaker is gets rid of the motion to vacate',
2023-10-04 18:04:19,Trump says he's focused on the White House amid calls for a speaker bid,Trump told reporters outside a Manhattan courthouse that his sole focus is on the 2024 presidential campaign.
2023-10-04 17:20:38,"Scalise officially enters speakership race, setting up clash with Jordan",
2023-10-04 15:57:22,It's on: The bare-knuckle battle for House GOP leadership spots begins,
2023-10-04 14:36:17,Jim Jordan becomes first to announce run for speaker,
2023-10-04 13:24:08,Emmer eyes majority leader bid,
2023-10-04 12:22:19,James Comer is vowing to press ahead with the impeachment inquiry into Joe Biden even after Kevin McCarthy lost his speakership,
2023-10-04 12:03:49,‘He's about clicks’: Florida Republicans furious at Gaetz,They called him divisive and an attention-seeker.
2023-10-04 09:00:00,The rudderless GOP careens toward 2024,Kevin McCarthy's undoing underscores a bigger problem — the inability to govern itself — that risks imperiling the party's chances in 2024.
2023-10-05 19:32:01,Schumer mocks a Trump speakership: ‘We’ve seen a Trump rally at the Capitol already’,"The former president initially seemed to brush aside the idea of throwing his name into the race for speaker, but then said he was considering making a visit to the Capitol."
2023-10-05 16:47:44,Adam Frisch reported a massive nearly $3.4 million third quarter haul in his second bid to defeat Lauren Boebert.,
2023-10-05 16:41:41,Trump considering trip to Congress before speakership election,
2023-10-05 16:29:56,Both Steve Scalise and Jim Jordan continue to accumulate endorsements for their speakership bids.,
2023-10-05 16:20:57,"Lori Trahan is making a bid to lead Democrats’ messaging arm, a vacancy left by Dean Phillips' departure.",
2023-10-05 16:16:58,GOP knives out for Nancy Mace,The South Carolinian's move to join seven hardliners in ousting Kevin McCarthy is confusing her colleagues about her political persona — and prompting active calls for revenge.
2023-10-05 15:50:31,"Rep. George Santos’ former campaign treasurer will plead guilty to a federal felony, prosecutors say",Nancy Marks is a veteran Long Island political operative.
2023-10-05 14:10:59,"Who is, and isn’t, speaking at Feinstein's funeral","Vice President Kamala Harris is speaking, though she had a lukewarm relationship with Feinstein."
2023-10-05 12:59:07,New polling shows Joe Manchin would still face an uphill battle for reelection even if he left the Democratic Party.,
2023-10-05 11:32:29,Speaker race so far: Heir apparent vs. chaos agent,Breaking down the brewing battle between Steve Scalise and Jim Jordan.
2023-10-05 09:00:00,New Jersey politics is a notorious mess. It's about to hit new levels of nasty.,"In a state where politics is defined by its nasty underside, next cycle is shaping up to be particularly volatile."
2023-10-06 22:10:47,Back to 'Bizaroland' as House battles for next speaker,
2023-10-06 21:13:35,Inside the bipartisan deal that might have saved Kevin McCarthy,The Problem Solvers Caucus tried to hatch a power-sharing agreement as the speaker came under threat. The talks didn’t pan out.
2023-10-06 20:41:07,"Now a senator, Laphonza Butler makes a proud return to EMILY’s List","It’s still unclear if Butler will run for the special election to complete the final weeks of Dianne Feinstein’s term, or the full six-year term beginning in 2025."
2023-10-06 20:04:31,Scalise pledges to back GOP nominee for speaker — whoever they are,
2023-10-06 19:16:11,Kevin McCarthy considers resigning from the House before the end of his term,"The deposed former speaker has made clear he plans to stay at least through the speakership election before ending his House career, two people familiar with the matter tell POLITICO."
2023-10-06 17:07:55,"Speaker contenders are dropping out of the planned Fox News TV event, leaving it in jeopardy",
2023-10-06 16:57:40,"Hakeem Jeffries pitches coalition governing in the House, and major changes to the rules",
2023-10-06 15:15:14,Sherrod Brown raised an eye-popping $5.8 million in the third quarter for his crucial Ohio reelection race.,
2023-10-06 14:52:01,Fox News' involvement in speaker race prompts centrist blowback over 'circus',
2023-10-06 14:10:10,House Republicans push major rules change to avert another speakership humiliation,
2023-10-06 13:50:03,"Steve Scalise says he's more than healthy enough to do the job of speaker: ""If the doctors didn't sign off, I wouldn't be doing this.""",
2023-10-06 12:42:02,Endorsements are piling up. But the House is no closer to deciding who will win the speaker’s gavel.,
2023-10-06 09:00:00,How a previously obscure House rule could decide the next speaker,Any one Republican still has the power to force an ejection vote on the House leader. It's a problem that only some in the GOP want to solve.
2023-10-07 22:22:20,Dems want Israel envoy confirmed ‘instantaneously’ after attack,The confirmation of Biden's nominee for U.S. ambassador to Israel suddenly takes on new urgency.
2023-10-07 11:00:00,Empty speaker's office aggravates House-Senate beef,It's not just increased fears about a shutdown. Senators would consider themselves lucky to end the year without a catastrophe.
2023-10-08 11:00:00,Tom Cole: McCarthy’s ‘cuts’ deal with conservatives now void,The House Rules Committee chair says Republicans are free to step back from the deep appropriations cuts dictated by McCarthy’s backroom deal with the far right last June.
2023-10-09 18:01:45,House GOP splits as party braces for key meeting in speaker race,"Kevin McCarthy says he's open to having his job back, but some House Republicans have already moved on."
2023-10-09 16:19:20,McCarthy won't rule out return to speakership after Israel attacks,"At a press conference with the trappings of a House speaker, McCarthy declined to endorse a successor."
2023-10-09 16:09:43,‘Rudderless and leaderless’: House GOP lurches forward after Israel attacks,"Lawmakers appear to have three options to move legislation without a permanent speaker, but they're all problematic."
2023-10-09 14:53:20,"'Planes have already taken off': U.S. sends Israel air defense, munitions after Hamas attack",The country's urgent requests will test America’s industrial base — and Congress.
2023-10-11 02:55:43,House GOP speaker hopefuls equivocate on Trump's 2020 loss,
2023-10-11 00:21:49,'2 percent': House GOP still uncertain either of its speaker hopefuls can win it all,
2023-10-10 22:44:31,Read the updated indictment of Rep. George Santos,Santos was first indicted in May on 13 federal counts.
2023-10-10 22:29:45,Centrist Senate Dems call for freezing $6 billion in Iran assets after Hamas attack in Israel,
2023-10-10 22:24:51,Why a joint Israel-Ukraine aid plan would struggle in Congress,
2023-10-10 22:21:44,George Santos charged with 10 additional crimes in updated indictment,The total is up to 23.
2023-10-10 17:51:52,Chuck Schumer's delegation to Asia will be headed home early amid the crisis in Israel.,
2023-10-10 17:34:50,Jim Jordan's allies have a new poll to crow about,
2023-10-10 17:00:23,Acting speaker suggests Congress might aid Israel before House gets new leader,
2023-10-10 16:47:02,Senate Intel chair wants focus on Hamas before reviewing intelligence failures,
2023-10-10 16:19:16,Michael McCaul and Gregory Meeks are introducing a bipartisan resolution supporting Israel after this weekend's terror attacks.,
2023-10-10 16:00:28,"Chuck Schumer said he covered issues like market access, trade and fentanyl during a meeting with Chinese President Xi Jinping.",
2023-10-10 15:32:36,McCarthy loyalists vow to draw out painful speakership battle,
2023-10-10 13:41:48,Senate Republicans want answers on recently unfrozen Iranian funds after the weekend's terror attacks in Israel.,
2023-10-10 12:52:04,House Republicans wrestle over their choice for speaker — and if they’ll need to change the rules to do it,
2023-10-10 09:00:00,Dems’ bad dream: Menendez taunts party with potential reelect,"More than half of Senate Democrats have now called on the indicted senator to resign. Beyond that, right now they're just hoping he doesn't run again."
2023-10-10 09:00:00,Biden faces a host of crises and a stress test for his theory of the presidency,The horrific attack in Israel has created new challenges for the president and his team. They’re keenly aware that they are under the microscope.
2023-10-11 23:56:19,‘Sh-t thing to say’: Tempers flare among House Dems over the Israel war,Accusations about insensitivity toward Muslims burst out into the open at a caucus meeting.
2023-10-11 21:59:04,Gregory Meeks says he doesn't think the House can act on a resolution expressing support for Israel until a permanent speaker is chosen.,
2023-10-11 20:49:24,Scalise's rise kickstarts battles for other top House GOP posts,
2023-10-11 19:29:18,Jordan throws his support to Scalise,
2023-10-11 17:05:08,Scalise wins Round 1. What's next?,
2023-10-11 16:10:27,Sanders calls Israel's siege on Gaza 'a serious violation of international law',"""The targeting of civilians is a war crime, no matter who does it,"" the Vermont independent said."
2023-10-11 15:49:24,House GOP nixes plan designed to avoid another messy speaker vote,
2023-10-11 14:49:33,Michael McCaul says there was a failure of U.S. and Israeli intelligence leading up to the terrorist attacks over the weekend.,
2023-10-11 14:46:09,House GOP eyes a backup plan if it can't pick a speaker,
2023-10-11 13:25:48,'It wasn't me': George Santos says he won't take a plea deal,
2023-10-11 12:41:52,House Republicans look to lock in their speaker pick behind closed doors,
2023-10-13 02:19:27,'America wants me': How GOP Rep. Wagner recalls a private Scalise-Jordan conversation,
2023-10-13 00:46:11,"Capitol Police brief the Squad, prominent progressives on security amid uptick in threats",
2023-10-13 00:07:38,Scalise drops out of speaker race,
2023-10-13 00:04:50,Scalise drops out of speaker’s race,Jim Jordan is now expected to make another run for the position.
2023-10-12 22:20:42,Scalise hits a wall. Time for Plan B?,
2023-10-12 18:12:25,GOP says time is running out for Scalise to lock down the speakership,
2023-10-12 16:57:30,Kevin Hern is making a special pitch in his House majority leader bid — McGriddles delivered to GOP offices,
2023-10-12 16:55:56,Menendez accused of acting as foreign agent for Egypt while helming Senate Foreign Relations Committee,Federal prosecutors added the new criminal charge against the New Jersey Democrat and his wife.
2023-10-12 16:29:33,Jim Jordan: I've told Trump that I'm backing Scalise for speaker,
2023-10-12 15:00:09,'Big hill': McCarthy shades longtime rival Scalise's speakership chances,
2023-10-12 14:58:57,Democrats in competitive races push White House to freeze $6 billion in Iranian funds,
2023-10-12 14:13:30,"Trump, GOP holdouts cite Scalise's cancer treatment as speaker roadblock",
2023-10-12 12:36:15,Steve Scalise's challenge: Flip holdouts on his speakership candidacy as some fear a repeat of the January floor fight.,
2023-10-13 20:06:31,Jordan wins House GOP's latest speaker nod — but still lacks the votes,
2023-10-13 19:40:10,4 Democratic centrists to McHenry: Let's make a deal,
2023-10-13 19:27:01,‘Human scum’: Santos screams at protester over Israel,
2023-10-13 18:07:04,House Democrats got briefed on Israel as progressives raise concerns over Gaza evacuation,
2023-10-13 17:15:00,‘We are deeply concerned’ – Progressive lawmakers make plea to Biden ahead of Israel’s Gaza campaign,A letter from dozens of members lays out five specific requests of the president over the war in Israel.
2023-10-13 16:35:44,"Even with last-minute challenger, Jordan poised to move toward speaker's gavel",
2023-10-13 16:04:26,Kevin McCarthy said he backs Jim Jordan to be speaker of the House.,
2023-10-13 15:20:35,House GOP rejects — again — bid to avoid messy speaker fight on the floor,
2023-10-13 13:06:59,A bipartisan group of senators wants a reported deal with Qatar to freeze Iran assets made official,
2023-10-13 12:37:11,Chuck Schumer will lead a bipartisan trip to Israel this weekend.,
2023-10-13 12:05:51,Four unlikely speaker scenarios,
