DATE,TITLE,SUMMARY
2023-02-08 00:00:00,Earthquakes Are Unlike Any Other Environmental Disaster,"On February 6, at 4:17 a.m., death came for thousands of people in their sleep. At that moment, 11 miles beneath the south-central Turkish city of Nurdağı—close to the Syrian border—a spark was launched into a geologic powder keg.
An epochal battle between tectonic plates had reached a crescendo. Two gigantic blocks, moving side by side in opposite directions, had been warping the crust for millions of years. Then, in the dark of night, they yielded. The crust cracked. A large swath of the expansive East Anatolian Fault Zone jolted, releasing pent-up energy equivalent to roughly 8 million tons "
2023-02-08 00:00:00,The Bizarre Relationship of a ‘Work Wife’ and a ‘Work Husband’,"It started out as a fairly typical office friendship: You ate lunch together and joked around during breaks. Maybe you bonded over a shared affinity for escape rooms (or board games or birding or some other slightly weird hobby). Over time, you became fluent in the nuances of each other’s workplace beefs. By now, you vent to each other so regularly that the routine frustrations of professional life have spawned a carousel of inside jokes that leavens the day-to-day. You chat about your lives outside work too. But a lot of times, you don’t have to talk at all; if you need to be rescued from a c "
2023-02-08 12:00:00,Feisty Joe Biden Is Back,"It was a raucous, interactive, and argumentative State of the Union like no other. And when it was over, President Joe Biden had provided a clear signal of how he plans to contest the 2024 presidential election.
Leaning hard into his populist “Scranton Joe” persona, an energetic and feisty Biden sparred with congressional Republicans heckling him from the audience as he previewed what will likely be key themes of the reelection campaign that he’s expected to announce within months, if not weeks.
Biden’s speech showed him continuing to formulate an economically focused alternative to the cultur "
2023-02-08 12:00:00,Don’t Read His Lips,"When Jerome Powell, the chairman of the Federal Reserve, spoke last week after the Fed’s monthly meeting, he was trying to convey the message that the fight against inflation was not yet won, and that the Fed anticipated continuing to raise interest rates over the next few months. “We’re talking about a couple more rate hikes,” he said, adding that the Fed needed “substantially more evidence” to be confident that inflation was falling.
All in all, it seemed like a straightforward presentation of the Fed’s outlook. But investors ignored it, because of something else Powell said: namely, that “t "
2023-02-08 11:00:00,Palo Alto’s First Tech Giant Was a Horse Farm,"Silicon Valley has a short memory. The Anglo-American settlements aren’t even 200 years old, but if you ask around, regional history restarts whenever there’s a new defining technology, which happens every couple of decades; we can barely remember the dot-com boom, never mind the radio era.
And yet, if you look closely, there’s a deep continuity. California was a closing link in the capitalist chain that encircled the world at the end of the 1800s. From the railroad to real estate to fruit to radio components, settlers built pre-silicon Palo Alto on new ideas about how science yielded efficien "
2023-02-08 11:00:00,Why There Was No Racial Reckoning,"MEMPHIS, Tenn.—If the summer of 2020 was, for many Americans, a breaking point, then the deaths of Ahmaud Arbery, Breonna Taylor, and George Floyd presented the nation’s leadership class with a crossroads. Would they radically rethink American policing, or would they retreat to the safety of piecemeal reform, earnestly applying Band-Aids over bullet wounds? Two and a half years later, Tyre Nichols is dead, and the choice they made is clear.
It’s not that nothing was done. Some departments vowed to make more data available, and others launched exploratory efforts to let specialists respond to m "
2023-02-08 08:00:00,It’s Important I Remember That Nina Simone Wrote ‘Mississippi Goddam’ in Less Than One Hour—,"and she meant every word.
At times the lyric is insistent, an immaculate conception,
which is to say, perhaps, that urgency is the one true God we answer to

                                           and God, truly, is the one thing we need urgently:

                  Medgar was dead from a b "
2023-02-08 08:00:00,Europe Has Green-Energy FOMO,"Sign up for The Weekly Planet, The Atlantic’s newsletter about living through climate change, here.
It is a good time to be in the decarbonization business in the United States. The Inflation Reduction Act—with its $374 billion cornucopia of green incentives, subsidies, and grants—was designed to entice private companies to invest in the transition away from fossil fuels. Initial reports already suggest that the IRA may be working. An analysis by American Clean Power, a lobbying group of renewable-energy companies, indicates that even just the anticipation of its bounty catalyzed $40 billion i "
2023-02-08 23:39:00,The Legal Decision That Could Rewrite the Abortion Battle—Again,"This is an edition of The Atlantic Daily, a newsletter that guides you through the biggest stories of the day, helps you discover new ideas, and recommends the best in culture. Sign up for it here.
At last night’s State of the Union address, the first one since the fall of Roe v. Wade, President Joe Biden pledged to continue working to protect access to reproductive health care amid more than a dozen extreme state-level bans. But as soon as this week, a legal decision over abortion pills could rewrite the terms of that battle.
First, here are three new stories from The Atlantic.

How Biden suc "
2023-02-08 23:39:00,"George Santos, the GOP’s Useful Liar","After President Joe Biden delivered his State of the Union address last night, George Santos offered his appraisal of the proceedings. “SOTU category is: GASLIGHTING!” the representative pronounced in a tweet.
The review was curious, coming as it did from a man who has fabricated much of his own biography. And the tweet, Trumpian in both look and tone, provoked precisely the replies you might expect under the circumstances: sarcastically invented references to Santos’s “experience” as the host of Jeopardy, to his own State of the Union speech, to his status as a gaslight incarnate. The replies "
2023-02-08 23:39:00,Republicans Keep Underestimating Joe Biden,"Joe Biden knows how to handle a tough crowd. This was evident last night at the State of the Union, and it was apparent to me seven years ago, on March 20, 2016. On that day, President Barack Obama sent Biden to sell the recently struck Iran nuclear deal to the national conference of the American Israel Public Affairs Committee (AIPAC). This was the political equivalent of asking the vice president to push New York Times subscriptions at a Donald Trump rally. Over the previous year, AIPAC had spent every ounce of its political capital to oppose Obama’s accord with Iran, which it cast as an exi "
2023-02-08 17:00:00,The Challenges of Disaster Planning,"Updated at 4:56 pm ET on February 8, 2023
This is an edition of Up for Debate, a newsletter by Conor Friedersdorf. On Wednesdays, he rounds up timely conversations and solicits reader responses to one thought-provoking question. Later, he publishes some thoughtful replies. Sign up for the newsletter here.
Question of the Week
The aftermath of this week’s tragic earthquake in Turkey and Syria is a stark reminder of the devastating impact of severe natural disasters, and how so many of us live under their threat. You might be asking yourself in this moment, What have I done to prepare? We want t "
2023-02-08 17:00:00,Long Live the Octogenarian Sex Record,"After Smokey Robinson announced his upcoming album, many music listeners were aghast. The Motown legend, at the age of 82, unfurled the most blatantly sexual record title of his career: Gasms. It didn’t help that the album, which will be released in late April, includes songs such as “I Wanna Know Your Body” and, ahem, “I Fit in There.” Predictably, the subsequent volley of Viagra jokes alone could’ve crashed Twitter.
Yet Robinson’s catalog has given him every right to proudly unleash an octogenarian sex record—which, who knows, might now be a genre in the making. It wouldn’t be the first genr "
2023-02-08 17:00:00,Photos: Rescue and Recovery in Turkey and Syria,"Three days have passed since a devastating a 7.8-magnitude earthquake struck near the Turkish city of Gaziantep, followed by dozens of powerful aftershocks. Nearly 12,000 deaths have been reported across southern Turkey and northwestern Syria after thousands of buildings collapsed during the quake. A massive rescue effort is underway, with tens of thousands of soldiers, workers, and volunteers still discovering and rescuing victims who have been trapped for as long as 61 hours beneath tons of shattered concrete "
2023-02-08 17:00:00,The Most Important Job Skill of This Century,"A product race is under way in the world of artificial intelligence. Just this week, Google announced plans to release Bard, a search chatbot based on its proprietary large language model; yesterday, Microsoft held an event unveiling a next-generation web browser with a supercharged Bing interface powered by ChatGPT. Though most big tech companies have been quietly developing their own generative-AI tools for years, these giants are scrambling to demonstrate their chops after the public release and runaway adoption of OpenAI’s ChatGPT, which has accumulated more than 30 million users in two mo "
2023-02-08 17:00:00,Turkey’s Trust in Government Has Turned to Dust,"Earthquakes serve as turning points in Turkish history, a shattering of silence in mere seconds. In 1999, an earthquake struck near Istanbul, my hometown. More than 17,000 people were killed and many more injured. I had always known that earthquakes were something to be wary of, that they are expected in a country that sits on the Anatolian Plate bordering two major fault lines. But I had never lived through a quake before, or seen its aftermath. For weeks people slept outdoors—in parks, on the waterfront, in streets and stadiums—unable to go back to homes that had been destroyed, or afraid to "
2023-02-09 07:00:00,Originalism Is Going to Get Women Killed,"American law has not historically been good to women, and whatever progress there once was is now vulnerable to regression. This return is being midwifed into the world by the theory of constitutional interpretation known as originalism—the idea that a law’s constitutionality today is dependent on the Constitution’s purported “original public meaning” when the relevant constitutional text was enacted. Its adherents market originalism as fair and free from favor or prejudice—but its effects are not and will not be fair at all. By its very nature, originalism threatens women and other minority g "
2023-02-09 07:00:00,The Masterpiece No One Wanted to Save,"“There is no possible way of responding to Belsen and Buchenwald,” Lionel Trilling wrote in 1948. “The activity of mind fails before the incommunicability of man’s suffering.” The crimes of both the Nazi and Soviet regimes in the 1930s and ’40s defied all precedents of analysis and feeling. No ism could account for them; no wisdom could make them bearable. Though inside the stream of history, they seemed to belong to a realm of occult, pure evil. Today we’re drowning in art and scholarship about Europe’s terrible 20th century, but for contemporaries of the events, there was no language.
This s "
2023-02-09 07:00:00,How Florida Beat New York,"In a 2018 speech, Hillary Clinton claimed a partial victory in the presidential election she’d lost: “I won the places that are optimistic, diverse, dynamic, moving forward. And [Donald Trump’s] whole campaign, ‘Make America Great Again,’ was looking backwards.” Clinton was echoing a sentiment felt by many on the left, that Democratic-leaning states represent the future and Republican ones represent the last gasps of a dying empire.
[Read: America is growing apart, possibly for good]
Red states do tend to be poorer, sicker, less productive, and less educated. But Clinton’s remarks ignored tren "
2023-02-09 12:00:00,What ChatGPT Can't Teach My Writing Students,"As the first student papers of the academic semester come rolling in, college and high-school teachers are expressing concern about ChatGPT, the artificial-intelligence interface that responds to queries with competent, if boring, paragraphs. It seems to open up whole new vistas of academic dishonesty, and it calls into question how and why we teach writing at all. A professor at the University of Pennsylvania's Wharton School has said that ChatGPT’s answers to his operations-management class would have earned a B or B–. That seems about right; if a student in my first-year writing class had t "
2023-02-09 20:00:00,Beware the Lidless Toilet,"This is an edition of The Atlantic Daily, a newsletter that guides you through the biggest stories of the day, helps you discover new ideas, and recommends the best in culture. Sign up for it here.
Don’t be fooled by the unsettling elegance of the phrase toilet plume. It describes the invisible cloud of particles heaved by a toilet when flushed, and was once feared to be a vector for COVID-19. My colleague Jacob Stern recently revisited the toilet-plume panic for The Atlantic, writing that although this early-pandemic fear hasn’t been substantiated, there are still other reasons to beware of t "
2023-02-09 17:00:00,The Films Steven Soderbergh Watches on a Loop,"Steven Soderbergh is the rare filmmaker who views a sequel as a chance to do something different. In a moviemaking era suffused with safe and predictable follow-ups, Soderbergh’s Ocean’s Twelve remains a sterling example of a strange, surprising left turn from its predecessor’s formula. The biggest challenge is always expectations, he told me in an interview: “What is the expectation from the audience? … How do you not find yourself handcuffed by that and yet not change [the story] so radically that the foundations for everyone’s positive feelings are destroyed?”
In Magic Mike’s Last Dance, th "
2023-02-09 17:00:00,Welcome to the Era of AI Vertigo,"Welcome to the week of AI one-upmanship. On Tuesday, in a surprise announcement, Microsoft unveiled its plans to bring the technology behind OpenAI’s ChatGPT bot to its search engine, Bing. (Remember Bing? Because Bing remembers your jokes.) According to the company, the new tool will be a paradigm shift in the way that humans search the internet. As one early tester demonstrated, the query Find me tickets to a Beyoncé concert in the United States where I won’t need a jacket at night prompts the AI to estimate what constitutes jacket weather, gather tour dates, and then cross-reference those d "
2023-02-09 17:00:00,A ‘Distinctly Human’ Trait That Might Actually Be Universal,"Eleven years ago, on the remote Japanese island of Kojima, a female macaque walked backwards into a stray heap of primate poop, glanced down at her foot, and completely flipped her lid. The monkey hightailed it down the shoreline on three feet, kicking up sand as she sprinted, until she reached a dead tree, where “she repeatedly rubbed her foot and smelled it until all of the sticky matter disappeared,” says Cécile Sarabian, a cognitive ecologist at the University of Hong Kong, who watched the incident unfold. Sarabian, then a graduate student studying parasite transmission among primates, was "
2023-02-09 17:00:00,The Tech Giants Want What the NFL Has,"When Rihanna walks, or is raised, or is lowered onto the Super Bowl stage on Sunday, she will not merely be kicking off the game’s halftime show. She will be culminating Rihanna’s Road to Halftime, presented by Apple Music. The world’s most valuable company is in the first year of a reported five-year, $250 million deal to sponsor one of the most watched live-music performances anywhere, which happens to fit between two halves of a game between the Kansas City Chiefs and the Philadelphia Eagles. For $50 million a year, a tech behemoth does not just want a good show. It also wants a music video "
2023-02-10 07:00:00,The Third Law of Magic,"He spent the night making snow. He packed it tightly into balls of different sizes and stored them in the freezer to keep them stable.
For a long time, he had wanted to make something so simple and natural that no one would suspect concerted thinking had gone into it. He wanted the greatest possible concentration of thought along with the greatest possible efficiency in the execution of that thought.
He had come up with many ideas in the past. He would sell dirt. He would be a newspaper vendor, but the newspaper he sold would not exist. He would create one issue of the newspaper, make only 101 "
2023-02-10 07:00:00,A Qualified Defense of Christopher Rufo,"During the past century or so, social scientists have observed that politics is, like sand after a day at the beach, in everything. It is especially present where you don’t think you’ll find it. You think you’ll find it on the campaign trail and on cable news—these are your beach towels and the floor mats of your car. But how the hell did it get into the glove compartment—or, in universities, into the math department? Rochelle Gutierrez, of the University of Illinois at Urbana-Champaign, has pioneered the teaching of “mathematx,” a form of math education attuned to politically marginalized gro "
2023-02-10 07:00:00,The Catch-24 of Replacing Joe Biden,"Most Democrats don’t want Joe Biden to run for president again in 2024. And yet, as things look now, most Democrats are likely to vote for Joe Biden to run for president again in 2024.
Biden has a few reasons for running: He seems to enjoy being president. His administration has already been more successful than many people expected, though this also gives him a reason to retire gracefully. But nothing motivates Biden more these days than turning back the threat to American democracy that he sees posed by Donald Trump and his heirs, and Biden worries that there is no Democrat who could marshal "
2023-02-10 07:00:00,Black Quarterbacks’ Long Quest for Respect,"The number of Black quarterbacks has soared in the NFL over the past 25 years, and it was only a matter of time before two of them faced each other in the Super Bowl.
Sunday’s championship game will pit the Kansas City Chiefs’ Patrick Mahomes against the Philadelphia Eagles’ Jalen Hurts. Only seven Black quarterbacks have played in a Super Bowl, and just three—including Mahomes—have won. That a record 11 NFL teams had Black starting quarterbacks on opening day of the current season suggests that matchups like this year’s will soon be commonplace. But the fact that no such game has taken place "
2023-02-10 02:00:00,"Photos of the Week: Ice Canoe, Rainbow Mountain, Balloon Debris","Deadly wildfires in southern Chile, a lantern festival in Taiwan, an extreme low tide in Venice, a freight train derailment in Ohio, a volcanic eruption in Indonesia, a unique dining experience in China, scenes of earthquake devastation in Turkey, freezing temperatures in the American northeast, and much more "
2023-02-10 11:00:00,What Politicians’ Libraries Tell Us,"What can we learn from the reading habits of our political leaders? Like any preference, they provide a window into the priorities, obsessions, and inspirations of some of world history’s most consequential figures. Gabriel Boric, Chile’s progressive president, is a “serious reader of poetry,” Lily Meyer writes. One might wonder how his reading has influenced his robust education platform, which promises free university and student-debt forgiveness. On the other end of the spectrum is former President Donald Trump. As David Graham writes, though Trump is, “in strictly literal terms, literate "
2023-02-10 11:00:00,Why Do Fascists Love Dante?,"The nightmarish visions of Dante Alighieri, with their many circles of hell, ringed in blood and fire, would seem perhaps a natural draw for politicians who traffic in the rhetoric of us versus them, good versus evil. But this doesn’t fully explain why the poet—who, after all, lived and wrote 700 years ago—finds himself quoted and adored like a medieval poster boy by Italy’s newly resurgent extreme right.
For Giorgia Meloni, the first prime minister since World War II to lead a party rooted in Italy’s fascist past, Dante has become a patron saint. In one video from early in her run for office "
2023-02-10 08:00:00,Therapy Can Be Microdosed,"The most common number of talk-therapy sessions that people attend in their lifetime is one. That very first meeting with a mental-health practitioner is usually focused on asking the patient introductory questions, not on providing substantial support, and it can fail to keep them coming back for subsequent meetings. Contributing to that lack of sustained engagement is the pervasive idea that years-long, weekly therapy is the only way to receive adequate mental-health treatment, which can be a daunting prospect for many. But some therapists and patients are challenging that idea and making th "
2023-02-10 08:00:00,Red Zeppelin,"The extent of Chinese spying efforts revealed by the surveillance balloon caught hovering in U.S. airspace hardly comes as a huge surprise. This, after all, is what big powers do to one another. But the depth of acrimony over the balloon is telling—a register of how fraught relations between the U.S. and China had already become. Worse, it suggests that the two powers are close to a point where further confrontation becomes inevitable.
That is all the more unfortunate because the relationship seemed to have been moving in a more positive direction. U.S. Secretary of State Antony Blinken was to "
2023-02-10 19:00:00,Blue States Got Too Comfortable,"This is an edition of The Atlantic Daily, a newsletter that guides you through the biggest stories of the day, helps you discover new ideas, and recommends the best in culture. Sign up for it here.
The left has long believed that Democratic states are the future, whereas Republican states are the past. But migration data show that red and blue might be starting to switch places.
First, here are three new stories from The Atlantic.

DEI is an ideological test.
The death of the smart shopper
The catch-24 of replacing Joe Biden

State of Disunion
“Democratic-leaning states represent the future an "
2023-02-11 07:00:00,Struck on One Side,"My memory of the moment, almost a decade ago, is indelible: the sight of a swimmer’s back, both sides equal—each as good and righteous as the other. An ordinary thing, and something I had never had, and still don’t have. To think of that moment is to feel torn—once again—about how I should respond to my condition: whether to own it, which would be the brave response, as well as the proper one, in many people’s eyes; or to regret it, even try to conceal it, which is my natural response.
I have a form of cerebral palsy called hemiplegia, which affects one side of the body. The word has two part "
2023-02-11 12:00:00,America Has Gone Too Far in Legalizing Vice,"“The cause of a gambling problem is the individual’s inability to control the gambling.” So says the National Council on Problem Gambling, an organization funded by the gambling industry to help people who have become addicted to its products. This attitude—that anyone who falls into gambling addiction has only themselves to blame—has allowed state lawmakers to ignore arguments that more access to gambling might make it easier for people to lose control. Since the Supreme Court struck down previous restrictions on sports betting in 2018, 36 states have legalized it (26 of which allow mobile be "
2023-02-11 12:00:00,Why We Lose Our Friends as We Age,"This is an edition of The Wonder Reader, a newsletter in which our editors recommend a set of stories to spark your curiosity and fill you with delight. Sign up here to get it every Saturday morning.
When I was in college, an acquaintance who had graduated a few years prior came back to visit for the weekend. As we walked around campus on Saturday night, he flung his hands into the cold Connecticut air and exclaimed, “You guys are so lucky; you live a minute away from all your friends. You’ll never have this again.”
At the time, I thought it was kind of sad—a grown man pining for my life of un "
2023-02-11 12:00:00,The Case for a Four-Day Workweek in Maryland,"The Maryland State Capitol building is older than America. It is the only state capitol to have also served as the nation’s capital; in the country’s earliest days, Congress met in its chambers. To work in Annapolis is to operate in the shadow of history. So maybe that explains why, 246 years into the American project, one state lawmaker sees his four-day-workweek bill as carrying on in the tradition of the ideals of the Declaration of Independence. That, or it’s just a good hook.
“The Framers put in ‘Life, Liberty, and the pursuit of Happiness,’” Vaughn Stewart, one of the bill’s co-sponsors "
