DATE,TITLE,SUMMARY
2023-01-07 08:00:00,What Snow Days Mean to Adults,"This is an edition of The Wonder Reader, a newsletter in which our editors recommend a set of stories to spark your curiosity and fill you with delight. Sign up here to get it every Saturday morning.
Shortly after our writer Katherine J. Wu, “a born-and-bred Californian,” moved to Boston, she was met with an epic snowstorm—one so bad that the city ran out of places to dump the snow piles. As you can imagine, she wasn’t thrilled. But now, more than eight years later, climate change is threatening winter snow in Boston and the rest of New England, she writes: “Snow may someday cover New England "
2023-01-07 08:00:00,M3GAN’s Killer-Robot Doll Is Just What 2023 Needs,"Come January, Hollywood always undergoes a strange shift in its major releases, from awards-centric fare and festive hits to the doldrums of the post-holiday season. Studios usually regard this period as a dumping ground for low-quality genre films that seem designed to be quickly forgotten. But 2023 is different, because this year, viewers have a special new friend to help them acclimatize: a pint-size robot girl named M3GAN. She’s full of fun facts, exceptionally strong, and surprisingly fond of belting out modern pop songs at random moments, even though she’s dressed like a preppy coed.
Oh "
2023-01-07 08:00:00,The Game Always Goes On,"When the Buffalo Bills safety Damar Hamlin collapsed on the field on Monday night, I was watching a cartoon with my 3-year-old son. When that ended, my son began playing with magnets on the floor, and I switched over to the game. Instead of football, I witnessed a frantic scene. A “routine football hit”—just like the thousands I had been involved in as a professional player—had left a 24-year-old man lying motionless on the grass, an EMT’s hands clasped above his sternum, trying to save his life.
Nearly nine minutes of CPR happened on that field as Hamlin’s teammates circled him and watched. T "
2023-01-08 09:00:00,A Disability Film Unlike Any Other,"Growing up, you might have been told not to stare at the guy in the wheelchair. You were probably taught, more or less, that aggressively averting your eyes when passing a stranger with a physical difference is the “right” thing to do. Most of us—whether we realize it or not—keep up this behavior well into adulthood. Reid Davenport, a disabled filmmaker, leans into this social tension in I Didn’t See You There, an experimental movie narrated by him and shot entirely from his perspective.
The film, which won the Directing Award for U.S. Documentary at the 2022 Sundance Film Festival, has had a "
2023-01-08 09:00:00,Telehealth Is Filling Gaps in Sexual-Assault Care,"This article was originally published by Kaiser Health News.
Amanda Shelley was sitting in her dentist’s waiting room when she received a call from the police. A local teenage girl had been sexually assaulted and needed an exam.
Shelley, a nurse in rural Eagle County, Colorado, went to her car and called a telehealth company to arrange an appointment with a sexual-assault nurse examiner, or SANE. The nurse examiners have extensive training in how to care for assault survivors and collect evidence for possible criminal prosecution.
About an hour later, Shelley met the patient at the Colorado Mo "
2023-01-08 09:00:00,The Coziest Mystery Series Going,"This is an edition of The Atlantic Daily, a newsletter that guides you through the biggest stories of the day, helps you discover new ideas, and recommends the best in culture. Sign up for it here.
Good morning, and welcome back to The Daily’s Sunday culture edition, in which one Atlantic writer reveals what’s keeping them entertained.
Today’s special guest is Kate Lindsay, who has written viral Atlantic articles about the Instagram “ick” and the “Millennial pause.” (Translation: Instagram is over, and Millennials are aging out of the internet, respectively.) She also talked about the Millenni "
2023-01-08 09:00:00,For the Child(ren) I Cannot Carry,"Because “a better life” is the immigrant’s most stubborn
illusion, I wanted a do-over. Other versions behind (beside)  
me like so many costumes (countries). That one: the pink-
jacketed girl sweeping her tambourine under a dome  
of hallelujahs. This one: the hoodied teenager being kissed
on a rooftop the way spring can make the moon’s blemishes
feel holy. I want you to know that there were moments staying
was easy. That I do not regret any of my wishes, even when
I have denied them. For years after the diagnosis, I could not
remember the name of the border inside me. Than "
2023-01-08 07:00:00,Why Some Students Are Skipping College,"Legal challenges now stand in the way of President Joe Biden’s plan to cancel thousands of dollars in education loans for millions of Americans. As a professor focused on debt and inequality, I’m rooting for the plan to succeed. But I’m also concerned that it does nothing to address the problems in higher education that are scaring off a new generation of potential students.
Over the past three and a half years, I have been talking with more than 30 low-income students and their families from across the country about their attitudes toward student debt and their paths after high school. Contra "
2023-01-09,Americans Set an Example for the Rioters in Brazil,"We memorize its opening sentences in school, throw quotes from it into speeches, and generally treat the American Declaration of Independence as a familiar source of reliable tropes. But when it was published in 1776, the Declaration was a radical document, and its language inspired other radical documents. In 1789, French revolutionaries published the Declaration of the Rights of Man, declaring that “men are born and remain free and equal in rights.” In 1804, the leaders of the Haitian slave rebellion proclaimed the Haitian Declaration of Independence, vowing that “in the end we must live ind "
2023-01-09 15:47:00,17 Readers Weigh the Risks in Sports,"This is an edition of Up for Debate, a newsletter by Conor Friedersdorf. On Wednesdays, he rounds up timely conversations and solicits reader responses to one thought-provoking question. Later, he publishes some thoughtful replies. Sign up for the newsletter here.
Last week I asked readers, “What do you think about the health and safety risks that are inherent in sports?”
Lauren says she’s grappled with the question as the mother of a teenage athlete:

My son, 16, dislocated his left pinky last night during a basketball game. After an ER visit and a resetting procedure that left me traumatized "
2023-01-09 15:47:00,How Will We Cancel People After Twitter?,"Whatever else it is, Twitter is a place where the average person can subject others to their displeasure. They have been mistreated by Southwest Airlines. They have been angered by the comments of a man who sells beans. They have learned, to their horror, that the father of their favorite indie pop star previously worked for the U.S. State Department. In posting about these things in a venue where the target of scorn might actually see the complaint—along with perhaps millions of other people—the aggrieved may experience some instant relief. If you want accountability on social media, you twee "
2023-01-09 15:47:00,All the Pretty Republicans,"And there were men there in attendance there with double faces, as they had been sutured one face to another with catgut and diabolic needle, and women with the nostrils of dragons.
Monstrosities of democracy they came forth in their pomp in the noon of the day. From the backwoods, from the boggy peninsulas. From the gleaming mall-lands. From the sucking swamps. Sun it did throb like a thumb in the eye of God. And the chamber was a cauldron of mockery, bepopulate with jeerers and carousers.
He would be Speaker of this chamber. O he would. Most keenly. To wield the gavel was his life’s whole gr "
2023-01-09 15:47:00,Maybe Don’t Unleash the Kraken,"These days, it’s a real headache to keep tabs on the coronavirus’s ever-shifting subvariants. BA.2, BA.4, and BA.5, three Omicron permutations that rose to prominence last year, were confusing enough. Now, in addition to those, we have to deal with BQ.1.1, BF.7, B.5.2.6, and XBB.1.5, the version of Omicron currently featuring in concerned headlines. Recently, things have also gotten considerably stranger. Alongside the strings of letters and numbers, several nicknames for these subvariants have started to gain traction online. Where once we had Alpha and Delta and Omicron, we now have Basilisk "
2023-01-09 15:47:00,Winners of the 2022 Close-up Photographer of the Year,"The fourth year of the Close-up Photographer of the Year competition has just come to a close, and the winners have been announced. The contest “celebrates close-up, macro, and micro photography,” among 11 separate categories. More than 9,000 entries were received from 54 countries this year. Contest organizers have once more been kind enough to share some of the winners and finalists with us below "
2023-01-09 08:00:00,Brazil’s ‘January 6 Moment’ Is a Warning,"Three days ago, cable-news channels marked the second anniversary of the assault on the U.S. Capitol by replaying videos taken on January 6, 2021. Anybody who watched CNN on Thursday would have seen hours of footage of protestors breaking through thin police lines, storming the Capitol, and wreaking havoc in the symbolic heart of American democracy.
This made the videos that those same channels started to broadcast on Sunday afternoon look eerily familiar. Once again, protestors were easily breaking through a thin line of police. Once again, thousands of people were storming key government bui "
2023-01-09 08:00:00,In Praise of Social Climbing,"I was born to be a social climber. The Evita score was ever present on my grandparents’ stereo when I was growing up, and I idolized Eva Perón, who made her way from poverty to the highest echelons of government and society. She was a woman who, at least from the musical’s point of view, saw clearly where she was in life and decided she wasn’t going to stay there. What did a tiny thing like class background matter to a person with wit, determination, and a knack for making friends? These were qualities, I realized, that could transform your future. They were also things that money couldn’t buy "
2023-01-10 01:00:00,The GOP Goes Down the Rabbit Hole,"This is an edition of The Atlantic Daily, a newsletter that guides you through the biggest stories of the day, helps you discover new ideas, and recommends the best in culture. Sign up for it here.
If you were hoping that a razor-thin majority in the House was going to moderate the behavior of congressional Republicans and create some sort of platform for governing, you are about to be disappointed. GOP House leaders have told us what to expect, and we should take them at their word.
But first, here are three new stories from The Atlantic.

What the rioters in Brazil learned from Americans
May "
2023-01-10 10:00:00,"The Atlantic Debuts Atlantic Editions, New Book Imprint With the Independent Publisher Zando","The first three books are publishing today from Atlantic Editions, a first-of-its-kind book imprint launched as a partnership between The Atlantic and the independent publisher Zando, with titles from staff writers Megan Garber and Sophie Gilbert (a finalist for the 2022 Pulitzer Prize in Criticism) and senior editor Lenika Cruz. This new line of paperback books features definitive essays by Atlantic authors; each is themed on a single consequential topic. The imprint draws from The Atlantic’s rich literary history and represents a new venue for publishing Atlantic writers, incorporating both "
2023-01-10 07:00:00,ESPN Gave Dana White a Pass on Domestic Violence,"When the head of a major sports organization is caught on video slapping his wife multiple times, his career should be in jeopardy. But other than a few days of remarkably mild criticism, Ultimate Fighting Championship President Dana White appears to be avoiding any real professional consequences.
Last week, TMZ released a video that shows White in a heated argument with his wife, Anne, at a nightclub in Cabo San Lucas, Mexico, on New Year’s Eve. In the video, White approaches his visibly distraught wife, who strikes him in the face. White then retaliates by slapping her twice, and the two bri "
2023-01-10 07:00:00,A Chance for a Reset on Venezuela,"The long-running misadventure of Juan Guaidó’s so-called interim presidency in Venezuela has finally come to an end. Guaidó is the former legislator who declared himself Venezuela’s rightful president in January 2019 in a high-stakes bid to force out the country’s strongman ruler, Nicolás Maduro. But Guaidó was a fictitious president in charge of a fictitious government and, despite the full-throated support of President Donald Trump, his crusade was a chimera—it went nowhere as it lurched from one ill-prepared maneuver to another.
The ordinary Venezuelans who initially came out in thousands i "
2023-01-10 07:00:00,I Was Born on a Black Commune,"In the commune I once called home, I was too young to understand what it meant to be born into a Black-liberation movement. I knew only that I lived in an apartment building where everyone loved me, a place where everyone who loved me was Black.
Each morning, to combat the Detroit winter, my mother would swathe me in layers of too-big clothing, capping off the baggy outfit with a white T-shirt that read Alkebu-lan Academy in red letters. We’d walk down the hall on scalloped red carpet, saying hello to chatty neighbors lingering in doorways. The elevator was as old and cantankerous as a grandpa "
2023-01-10 07:00:00,Pope Benedict XVI and the Church After the Fall,"Corruption in the Catholic Church long predated the eight-year papacy of Pope Benedict XVI, which began in 2005. The Protestant reformers hammered their critique of Catholic greed and treachery into history several centuries before this pope. The churn of time proved no cure for the Church’s failings. When Hannah Arendt published her reflections on the life and death of Pope John XXIII in 1965, she hung her consideration on the questions posed to her by a canny Roman chambermaid: “Madam, this Pope was a real Christian. How could that be? And how could it happen that a true Christian would sit "
2023-01-10 17:00:00,"Amazingly, George Santos Is a Member of Congress","This is an edition of The Atlantic Daily, a newsletter that guides you through the biggest stories of the day, helps you discover new ideas, and recommends the best in culture. Sign up for it here.
Amid the fight for the House speaker’s gavel, it was easy to forget that George Santos is now actually a member of Congress.
But first, here are three new stories from The Atlantic.

The sports scandal almost nobody is talking about
Is defying parents the only ethical alternative?
Pope Benedict XVI and the Church after the fall

This Guy
Remember Herschel Walker, the Georgia football star who was a "
2023-01-10 17:00:00,"The Buy Now, Pay Later Bubble Is About to Burst","As familiar as Americans are with the concept of credit, many of us, upon encountering a sandwich that can be financed in four easy payments of $3.49, might think: Yikes, we’re in trouble.
Putting a banh mi on layaway—this is the world that buy-now, pay-later programs have wrought. In a few short years, financial-technology firms such as Affirm, Afterpay, and Klarna, which allow consumers to pay for purchases over several interest-free installments, have infiltrated nearly every corner of e-commerce. People are buying cardigans with this kind of financing. They’re buying groceries and OLED TVs "
2023-01-10 17:00:00,The Last of Us Makes the Apocalypse Feel New Again,"In the landscape of video-game adaptations, a specific quandary comes up again and again as the medium grows in ambition: How do you translate a game that was itself clearly inspired by film and television? When The Last of Us was released on PlayStation in 2013, I marveled at its cinematic verisimilitude. It updated a familiar zombie-apocalypse aesthetic with some clever scientific twists; the game’s world is overrun by a fungal infection that turns its victims into mindless, violent monsters. But what made The Last of Us even more immersive was how it implicates players in the lead character "
2023-01-11 07:07:00,No One Really Knows Why People Stutter,"Okay, here comes our waiter. I stare at the silverware. He clicks his pen. I’m always the last to order. Sometimes my mom tries to help me by tossing out what she thinks I want.
“Cheeseburger, John?”
“... Yyyy-uhh ... yyyueaah,” I force out.
If I’m lucky, there are no follow-up questions. I’m rarely lucky.
“And how would you like that cooked?” the waiter asks.
“... ... ... ... Mmm-muh ... mmm-edium.”
His face changes. I want it medium rare, but R’s are hard, so I cut myself off.
“And what kind of cheese?”
Vowels are supposed to be easier, but I can never get through that first sound. I skip it "
2023-01-11 07:07:00,Science Has a Crummy-Paper Problem,"This is Work in Progress, a newsletter by Derek Thompson about work, technology, and how to solve some of America’s biggest problems. Sign up here to get it every week.
We should be living in a golden age of creativity in science and technology. We know more about the universe and ourselves than we did in any other period in history, and with easy access to superior research tools, our pace of discovery should be accelerating. But, as I wrote in the first edition of this newsletter, America is running out of new ideas.
“Everywhere we look we find that ideas … are getting harder to find,” a gro "
2023-01-11 08:00:00,The Meaning of Dry January,"Edward Slingerland is a philosophy professor who wrote a book arguing that alcohol has helped humans create the world as we know it. But this January, he’ll be forgoing alcohol—at least for half of the month.
Slingerland, the author of Drunk: How We Sipped, Danced, and Stumbled Our Way to Civilization, is, for the first time, participating in Dry January, the annual tradition where drinkers go sober for the first month of the year. (Slingerland is doing just half the month.) In doing so, he’ll join a growing number of Americans (according to one poll, as much as one-fifth of the population) wh "
2023-01-11 18:00:00,The Trump-Bolsonaro Connection,"This is an edition of The Atlantic Daily, a newsletter that guides you through the biggest stories of the day, helps you discover new ideas, and recommends the best in culture. Sign up for it here.
Staff writer and Pulitzer Prize–winning historian Anne Applebaum is uniquely qualified to plumb the American influence on Brazil’s “January 6 moment,” the insurrection on Sunday by supporters of the country’s far-right former president, Jair Bolsonaro. I called Anne to discuss her article about how antidemocratic revolutions can be contagious, and the diplomatic path forward for the United States.
B "
2023-01-11 18:00:00,Are Our Immune Systems Stuck in 2020?,"In the two-plus years that COVID vaccines have been available in America, the basic recipe has changed just once. The virus, meanwhile, has belched out five variants concerning enough to earn their own Greek-letter names, followed by a menagerie of weirdly monikered Omicron subvariants, each seeming to spread faster than the last. Vaccines, which take months to reformulate, just can’t keep up with a virus that seems to reinvent itself by the week.
But SARS-CoV-2’s evolutionary sprint might not be the only reason that immunity can get bogged down in the past. The body seems to fixate on the fir "
2023-01-11 16:00:00,The Coming Meat Utopia Is Real,"This is an edition of Up for Debate, a newsletter by Conor Friedersdorf. On Wednesdays, he rounds up timely conversations and solicits reader responses to one thought-provoking question. Later, he publishes some thoughtful replies. Sign up for the newsletter here.
Question of the Week
Last week, Spiegel International reported on a country where carnivores can already legally dine on meat that is produced from the stem cells of animals. As the article put it:

Just imagine for a moment that you could save the world with chicken nuggets. All you would have to do is just eat them. Your teeth woul "
2023-01-11 16:00:00,Prince Harry’s Book Undermines the Very Idea of Monarchy,"Imagine a fairy-tale city—on the coast, perhaps, with sailboats bobbing in the breeze. This is Ursula K. Le Guin’s Omelas, a fictional utopia where “the air of morning was so clear that the snow still crowning the Eighteen Peaks burned with white-gold fire.”
But Omelas holds a horrifying secret: Its continued existence relies on a single malnourished, unloved child being kept in a cellar, alone and uncomforted, in filth and fear.
“They all know it is there, all the people of Omelas,” Le Guin writes. “They all know that it has to be there. Some of them understand why, and some do not, but they "
2023-01-11 16:00:00,The Speeches That Saved the Golden Globes,"If you live outside Los Angeles, with its bounty of For Your Consideration billboards, I’ve got a question for you: Did you know the Golden Globes were being televised last night?
If you didn’t, there’s a good reason: NBC pulled the show off the air last year after a Los Angeles Times exposé revealed that the Hollywood Foreign Press Association, the absurdly small voting body behind the awards, lacked diversity in its membership and engaged in questionable ethical and financial practices. This year, the network committed to a one-off trial of airing the Globes again, but many industry insiders "
2023-01-11 16:00:00,Can We Talk About How Weird Baby Mammals Are?,"As adults, bats—the only mammals in the world capable of bona fide flight—are all about their wings. The trademark appendages can span up to 66 inches; they help bats snag insects, climb trees, attract mates, even fan their bodies in the summer heat. But as babies, bats are all about their giant clown feet.
Most mammals exit the womb with hind limbs that measure only about 20 to 60 percent of their maximum size. But compare a newborn little Japanese horseshoe bat’s foot with its mother’s, and they’re “almost identical,” says Daisuke Koyabu, an evolutionary embryologist at the University of Tsu "
2023-01-11 16:00:00,"Suddenly, California Has Too Much Water","In the Talmudic parable of Honi the Circle Maker, the drought-stricken people of Jerusalem send up a prayer that God should deliver them rain. And sure enough, after a few false starts, he does. Except that once the rain starts, it won’t let up. It pours and pours until the people are forced to flee to higher ground, their homes flooded by the answer to their prayer.
That, minus the whole divine-intervention part, is roughly the situation that California currently finds itself in. After years of virtually unremitting drought, the state is now suddenly, tragically, swamped with an overabundance "
2023-01-12 10:00:00,The Gas-Stove Debate Exemplifies the Silliest Tendencies of American Politics,"Occasionally, a news item comes around that seems to perfectly exemplify the most knee-jerk tendencies of both of America’s two main political parties—a moment when, without really considering any of the underlying issues, partisans immediately harden into familiar postures and begin emitting lots of hot air.
Hot air, in the most recent example, is not just a figure of speech. At issue is the future of gas stoves. In December, scientists published a study finding that ranges that burn natural gas account for almost 13 percent of childhood-asthma cases in the United States. Some advocates in bo "
2023-01-12 16:00:00,Cities Really Can Be Both Denser and Greener,"When I moved from small-town Oregon to Paris’s 11th arrondissement last summer, the city seemed like a poem in gray: cobblestones, seven-story buildings, the steely waters of the Seine. But soon I started noticing the green woven in with the gray. Some of it was almost hidden, tucked inside the city’s large blocks, behind the apartment buildings lining the streets. I even discovered a sizable public park right across the street from my building, with big trees, Ping-Pong tables, citizen-tended gardens, and “wild” areas of vegetation dedicated to urban biodiversity. To enter it, you have to go "
2023-01-12 16:00:00,Netanyahu’s Betrayal of Democracy Is a Betrayal of Israel,"This past summer, I marked a personal milestone: 40 years since moving to Israel.
The summer of 1982 was one of the lowest points in Israeli history. All of the ambivalence over Israel that would divide the Jewish people in the coming decades began to coalesce then, when Israel was fighting a war in Lebanon that large parts of the Israeli public regarded as unnecessary and deceitful.
I had joined an Israel that was, for the first time, bitterly divided over the perception of threat. War had always united Israelis; now war was dividing them. Once inconceivable, huge anti-government demonstratio "
