DATE,TITLE,SUMMARY
2023-03-09 06:00:00,In Their Feelings,"If you’re looking to the stars—and why wouldn’t you be?—you’ll know that Saturn has entered the sign of Pisces. It happened in early March: Shaggy old Saturn, god of constriction and mortality, lowered his iron haunches into the Piscean waters. He’ll be there until May 2025, an intractable lump in that wishy-washy element. Displacing it. Blocking it. Imposing his limits. Enough with the changeability, he says to dippy, fin-flashing Pisces. Enough with the half-assedness. Endless mutation is not possible. Now you’re going to face—and be stuck with—yourself.
This will be a challenge, one senses "
2023-03-09 06:00:00,The Protective Power of Nostalgia,"“How to Build a Life” is a column by Arthur Brooks, tackling questions of meaning and happiness. Click here to listen to his podcast series on all things happiness, How to Build a Happy Life.
Ever since our earliest days together in our mid-20s, my wife has known about a mystical place called Lincoln City. It’s a modest beach town on the central-Oregon coast, but for me, it holds a Shangri-la-like mythos. Lincoln City is where I spent one blissful week each year as a boy, combing the rough beaches for agates, fishing off the local pier, and playing with matches in the firepit outside my aunt "
2023-03-09 06:00:00,The Only Oscars Prediction List You’ll Need,"After two years of existential crises over the purpose of the Academy Awards, during movie seasons wrecked by COVID and vanishing ticket sales and unstable streaming economies, the Oscars are back this month feeling relatively normal. What a miracle. The ceremony, which airs Sunday on ABC, will be hosted by Jimmy Kimmel (the first solo host since Kimmel himself in 2018) and will honor some of the biggest movies of the past year; blockbuster nominees include Top Gun: Maverick, Elvis, and Avatar: The Way of Water.
The awards race is also in an unsettled state, which is rare given that precursor "
2023-03-09 17:00:00,America’s in the Midst of a Socioeconomic Shift,"This is an edition of Up for Debate, a newsletter by Conor Friedersdorf. On Wednesdays, he rounds up timely conversations and solicits reader responses to one thought-provoking question. Later, he publishes some thoughtful replies. Sign up for the newsletter here.
Question of the Week
How have cars shaped your life, and/or what do you think about their future? (I’m eager to hear anything from attacks on the automobile to defenses of the great American road trip to eagerness for driverless electric cars to laments that the kids these days don’t learn how to drive when they turn 16, let alone ho "
2023-03-09 14:00:00,We Programmed ChatGPT Into This Article,"ChatGPT, the internet-famous AI text generator, has taken on a new form. Once a website you could visit, it is now a service that you can integrate into software of all kinds, from spreadsheet programs to delivery apps to magazine websites such as this one. Snapchat added ChatGPT to its chat service (it suggested that users might type “Can you write me a haiku about my cheese-obsessed friend Lukas?”), and Instacart plans to add a recipe robot. Many more will follow.
They will be weirder than you might think. Instead of one big AI chat app that delivers knowledge or cheese poetry, the ChatGPT s "
2023-03-09 14:00:00,Elon Musk Just Realized How Bad Twitter Is,"In recent memory, a conversation about Elon Musk might have had two fairly balanced sides. There were the partisans of Visionary Elon, head of Tesla and SpaceX, a selfless billionaire who was putting his money toward what he believed would save the world. And there were critics of Egregious Elon, the unrepentant troll who spent a substantial amount of his time goading online hordes. These personas existed in a strange harmony, displays of brilliance balancing out bursts of terribleness. But since Musk’s acquisition of Twitter, Egregious Elon has been ascendant, so much so that the argument for "
2023-03-09 13:00:00,"Duck Off, Autocorrect","By most accounts, I’m a reasonable, levelheaded individual. But some days, my phone makes me want to hurl it across the room. The problem is autocorrect, or rather autocorrect gone wrong—that habit to take what I am typing and mangle it into something I didn’t intend. I promise you, dear iPhone, I know the difference between its and it’s, and if you could stop changing well to we’ll, that’d be just super. And I can’t believe I have to say this, but I have no desire to call my fiancé a “baboon.”
It’s true, perhaps, that I am just clumsy, mistyping words so badly that my phone can’t properly dec "
2023-03-09 11:00:00,Boycott Bans Are an Assault on Free Speech,"America began with boycotts. Angry about Britain’s tax raises, the historian T. H. Breen writes, American colonists saw their refusal to purchase British goods as a “reflexive response to taxation without representation,” and their collective action helped forge an early sense of American identity as a precursor to the Revolution itself.
The Revolution-era boycotts were hardly the last American consumer protests. Abolitionists urged Americans to buy only goods produced by “free labor,” and the 20th-century civil-rights movement famously included the Montgomery bus boycott against Alabama’s seg "
2023-03-09 10:00:00,How Biden Wants to Shape the 2024 Battlefield,"President Joe Biden is following a strategy of asymmetrical warfare as the 2024 presidential race takes shape.
Through the early maneuvering, the leading Republican candidates, particularly former President Donald Trump and Florida Governor Ron DeSantis are trying to ignite a procession of culture-war firefights against what DeSantis calls “the woke mind virus.”
With the exception of abortion rights, Biden, by contrast, is working to downplay or defuse almost all cultural issues. Instead Biden is targeting his communication with the public almost exclusively on delivering tangible economic ben "
2023-03-09 10:00:00,"In This Novel, the Dead Are Never Far Away","In 1976, the Argentine armed forces staged a coup against the president of Argentina, Isabel Perón. In short order, the military installed a junta that suspended political parties and various government functions, aggressively pursued free-market policies, and disappeared thousands of people over the next seven years. Victims of the regime—suspected dissidents or “subversives”—were abducted, tortured, and murdered, and many were buried in unmarked, mass graves. This period of state terror, the so-called Dirty War, has left a legacy of trauma that bedevils Argentina to this day.
The Argentine w "
2023-03-10 01:32:00,"Photos of the Week: Sea Dragon, Mermaid Convention, Inflatable Tank","Speed skating in the Netherlands, a teddy bear clinic in Belgium, a newly-found sphinx statue in Egypt, an International Women’s Day march in Chile, carpet weaving in Afghanistan, Holi celebrations in India, skijoring in Colorado, a “cats who look like cows” competition in Thailand, and much more "
2023-03-09 19:00:00,The Ugly Elitism of the American Right,"This is an edition of The Atlantic Daily, a newsletter that guides you through the biggest stories of the day, helps you discover new ideas, and recommends the best in culture. Sign up for it here.
Fox News will likely never face any real consequences for the biggest scandal in the history of American media. But will Republican voters finally understand who really looks down on them?
First, here are three new stories from The Atlantic.

Elon Musk is spiraling.
The freakish powers of Miley Cyrus and Lana Del Rey
The topic Biden keeps dodging

Loathing and Indifference
It’s time to talk about el "
2023-03-10 09:00:00,An Ode to Nicknames,"Here’s what I think about Spare, by Prince Harry.
I think it’s a very interesting book, a feat of psychosensory downloading by the master ghostwriter J. R. Moehringer. But it should have been called Spike. “The Spare”—as in, not the heir—is what members of the Royal Family have allegedly dubbed the brooding prince. “Spike,” however, is his nickname, or his most resonant one. It’s the one used by his more roistering and familiar chums. Spike is who Harry really is. Spike is his punk-rock Etonian ginger essence. Spike, as T. S. Eliot put it in “The Naming of Cats,” is his “ineffable effable / Ef "
2023-03-10 09:00:00,All of Shakespeare’s Plays Are About Race,"Pop quiz: Which of the following Shakespeare works is about race? (A) Hamlet, (B) Othello, (C) Romeo and Juliet, (D) the sonnets. If you answered B, you’re not alone. Many of us have been taught that Othello is Shakespeare’s primary race play, because, of course, it focuses on a Black character. You might also recall that Shakespeare wrote a few other plays with nonwhite characters: the Prince of Morocco in The Merchant of Venice, a suitor to the heiress Portia, who begs her, “Mislike me not for my complexion.” Or Cleopatra, the African queen whom Roman soldiers blame for seducing their genera "
2023-03-10 08:00:00,Second Life,"Illustrations by Katherine Lam
Editor’s Note: Read an interview with Mona Simpson about her writing process.
During Donnie’s first week in the mixed unit (drugs and crazy), a girl threw a TV set out the window because she thought it was criticizing her. Donnie walked to the window to look. “Probably was,” he mumbled. He’d grown up with a mother who came alive when insulted. The guy sleeping across the room, who’d dealt heroin with his own now-jailed dad, was woken up by the noise and asked, “Are we dead yet?”
“No. You’re just sleeping,” Donnie told him, and the boy’s eyes closed again; his thi "
2023-03-10 08:00:00,Live Closer to Your Friends,"Sometime during the pandemic lockdowns, I began to nurture a fantasy: What if I were neighbors with all of my friends? Every day, as I took long walks through North Vancouver that were still nowhere near long enough to land me at a single pal’s doorstep, I would reflect on the potential joys of a physically closer network. Wouldn’t it be great to have someone who could join me on a stroll at a moment’s notice? Or to be able to drop by to cook dinner for a friend and her baby? How good would it be to have more spontaneous hangs instead of ones that had to be planned, scheduled, and most likely "
2023-03-10 06:00:00,"The Scandalous, Clueless, Irresistible Oscars","As a film critic, I have complicated feelings about Oscar season, a baggy calendrical concept that now includes every month of the year, from the indie-film discoveries of the Sundance Film Festival in January to the awards voting by critics’ groups in December. The complaints about the Academy Awards are as well rehearsed as the acceptance speech of a surefire victor: The most deserving nominees seldom win, and the most inventive movies of the year typically get no nominations at all. The voting process is so opaque and so subject to external influence—barraged by ever more expensively manage "
2023-03-10 18:03:00,You Won’t Regret Starting a K-Drama,"Don’t write off popular Korean-language TV series as sappy melodrama. These shows will expand your conception of what storytelling can be. Read on for recommendations for your weekend.
But first, here are three new stories from The Atlantic:


Trump gets a taste of his own medicine.


The Oscars’ incredible knack for being wrong


Live closer to your friends.


To describe the plot of Crash Landing on You to the uninitiated is to invite mockery. After a paragliding test from Seoul gone wrong, a South Korean heiress and entrepreneur crash lands, literally, onto a stunningly handsome North Korea "
2023-03-10 12:00:00,The Value in Decoding Fairy Tales,"The wolf’s yellow eyes, sharp claws, and snapping teeth haunt our fairy tales and idioms, Erica Berry writes in her recent book, Wolfish. She asks why the animal has persisted as such a potent symbol of fear, arguing that this may color the way we see the world we share with animals and one another. By deconstructing stories such as “The Three Little Pigs” and “Little Red Riding Hood,” Lily Meyer wrote this week, Berry asks what dangers these canine villains are standing in for.
Berry is far from the only writer to investigate the significance of well-known fables. In Beauty and the Beast, Mar "
2023-03-10 12:00:00,What You Can’t Say on YouTube,"Recently, on a YouTube channel, I said something terrible, but I don’t know what it was. The main subject of discussion—my reporting on the power of online gurus—was not intrinsically offensive. It might have been something about the comedian turned provocateur Russell Brand’s previous heroin addiction, or child-abuse scandals in the Catholic Church. I know it wasn’t the word Nazi, because we carefully avoided that. Whatever it was, it was enough to get the interview demonetized, meaning no ads could be placed against it, and my host received no revenue from it.
“It does start to drive you mad "
2023-03-10 19:00:00,Silicon Valley Bank’s Failure Is Now Everyone’s Problem,"Whispers about insolvency. A bank run. A desperate attempt to raise funds. A bank failure. Market gyrations. Concerns about financial contagion.
History is repeating itself. On Friday, California regulators shut down Silicon Valley Bank, a lender aimed at start-ups, technology firms, and wealthy individuals. The Federal Deposit Insurance Corporation stepped in as the bank’s receiver. Account holders with less than $250,000 in savings will have full access to their funds as of Monday, the FDIC said. Account holders with more than that—the overwhelming majority of entities banking with SVB, acco "
2023-03-11 09:00:00,The False Promise of the ‘Great Resignation’,"In my dreams, Google begs me to come back. Human resources tells me that they have the perfect software-engineering role and that I alone can do it. Even though it’s been three years since I quit—frustrated by sexual harassment, an excruciating HR investigation, and being discouraged from applying for a promotion, which led to a reduction in pay—I always accept their offer, flooded with joy and relief. I clip my holographic badge back on to my belt loop; I clutch my corporate MacBook to my chest. Reunited with my colleagues, I throw myself back into debugging, ecstatic that my life has a clear "
2023-03-11 09:00:00,Finding Happiness in Middle Age,"This is an edition of The Wonder Reader, a newsletter in which our editors recommend a set of stories to spark your curiosity and fill you with delight. Sign up here to get it every Saturday morning.
In a 2021 Atlantic article that I’ve now read many times, the writer Deborah Copaken reflects on her time spent with another writer, Nora Ephron. A random phone call (“Hi, Deb, this is Nora Ephron.” “Yeah, right. And I’m Joan of Arc.”) led to a decade-long friendship between Copaken and Ephron—or, as Copaken calls her, “this daughterless woman who has all but adopted me and several other women.”
C "
2023-03-11 09:00:00,Net-Zero Homes Aren’t Just for Millionaires,"This article was originally published by High Country News.
Fourteen-year-old Callie Lawson is living with a broken bedroom door perpetually ajar, leaking privacy. A teenager’s nightmare. That’s just one of the many repairs needed for her family’s aging mobile home—repairs that most craftsmen, unaccustomed to working on factory-built structures, either don’t know how to fix or are unwilling to tackle. Jeff, Callie’s father, is losing patience, too, with the rent hikes on the trailer lot and the leaky roof he can’t afford to mend. Meanwhile, Callie’s mother, Kim, yearns for the sort of home tha "
2023-03-11 09:00:00,Is Scream Losing Its Voice?,"In January 2022, when the fifth Scream film came out, more than a decade had passed since someone had last donned the Ghostface mask and terrorized teens with threatening phone calls and a deftly wielded hunting knife. That movie, the first Scream not directed by the series’ now-deceased auteur, Wes Craven, had a lot of new developments to catch up on in the genre it ribbed so well: the rise of “elevated” horror, the tiresome formulae of legacy sequels, and how a killer who’s reliant on landlines might function in the smartphone era. The result was enough of a hit for executives to green-light "
2023-03-11 08:00:00,A Novel That Dissects True Crime’s Magnetism,"Rebecca Makkai’s new novel, I Have Some Questions for You, begins with a dark joke. The narrator is recounting conversations with strangers about the podcast she’s making, a Serial-style exploration of the murder of a girl at an elite boarding school in the ’90s. “Wasn’t that the one where the guy kept her in the basement?” they sometimes ask. “Wasn’t it the one where she was stabbed in—no. The one where she got in a cab with—different girl. The one where she went to the frat party …” The punch line isn’t just that violence against women has become so ubiquitous that the victims blur in our mi "
2023-03-11 06:00:00,Blasphemy Forever,"Almost half a century ago, an English busybody named Mary Whitehouse took a gay publisher to court in London for blasphemy. The publisher had printed a poem depicting a Roman centurion as a necrophile having his way with the corpse of Jesus Christ. She won the case but lost the culture war: Hers was the last successful prosecution for blasphemy in the United Kingdom, and in 2008, after decades as a dead letter, England’s blasphemy law officially ceased to exist.
But the moralists never left, and English authorities have stumbled when trying to figure out how to mediate between them and those t "
2023-03-12 10:53:00,A Prayer for Less,"When I converted to Catholicism as an adult, I quickly became acquainted with Lent, the contemplative and solemn liturgical season of fasting, prayer, and almsgiving preceding Holy Week. It had been mentioned in my southern, Protestant upbringing, but was as insignificant a feature of the late winter as ice and snow: Where I grew up, the post-Christmas chill of the new year glided into the mid-60s before February was out, which meant that the crocuses and jonquils and buttercups crowned the grass long before Easter arrived. In New England, where I live now, winter is a long, gray, wandering se "
2023-03-12 09:00:00,A Crime Series That’s Endlessly Curious,"This is an edition of The Atlantic Daily, a newsletter that guides you through the biggest stories of the day, helps you discover new ideas, and recommends the best in culture. Sign up for it here.
Good morning, and welcome back to The Daily’s Sunday culture edition, in which one Atlantic writer reveals what’s keeping them entertained.
Today’s special guest is staff writer Kaitlyn Tiffany, whose work focuses on technology and internet culture. She also co-writes the newsletter Famous People with her friend Lizzie Plaugic. Kaitlyn most recently wrote about how Andrew Tate is haunting YouTube; m "
2023-03-12 09:00:00,The Cellist,"Galway Kinnell was a Pulitzer Prize–winning poet, an anti-war activist, a member of the civil-rights group Congress of Racial Equality, and a devoted husband and father. He was not a man of faith. And yet, having been raised in a devout family, he said in a 1989 interview with Columbia: A Journal of Literature and Art, “the language of Christianity remains with me.” Without it, he didn’t know quite how to talk about what he treasured. In his poem “The Olive Wood Fire,” he goes as far as referring to his son as “God.” (“There isn’t actually any other word which will do,” he told Columbia.)
“The "
2023-03-12 09:00:00,How to Write an Award-Show Acceptance Speech,"The moment an artist wins an Oscar or a Grammy or a Tony, they are handed two things: some kind of statue (sure, nice) and, perhaps more important, 45 seconds—maybe a minute, two tops—of live, relatively unbridled stage time with millions of people watching. They can use that time however they choose, thanking their parents, thanking their agents, thanking God, advocating for causes, crying. After that the music will play.
Wendy Shanker is a writer with a niche skill: She helps celebrity clients draft acceptance speeches so that they can maximize these high-adrenaline, high-profile moments.
Sh "
2023-03-12 09:00:00,The Statistics That Come Out of Nowhere,"This winter, the university where one of us works sent out an email urging employees to wear a hat on particularly cold days because “most body heat is lost through the top of the head.” Many people we know have childhood memories of a specific figure—perhaps 50 percent or, by some accounts, 80 percent of the heat you lose is through your head. But neither figure is scientific: One is flawed, and the other is patently wrong. A 2004 New York Times column debunking the claim traced its origin to a U.S. military study from the 1950s in which people dressed in neck-high Arctic-survival suits were "
2023-03-12 16:00:00,The Rare Joy of Jenna Ortega on SNL,"The beauty of an ensemble comedy cast comes partly from its fluidity. As fun as it must be to peacock in the spotlight, holding everyone’s attention, it’s just as important to know when to step back. Not every Saturday Night Live host exhibits that knowledge, but some of the stronger ones clearly pick up on the dynamic and thrive in sketches where their contributions fall closer to that of a supporting player. Last night, Jenna Ortega, a first-time host and the star of Netflix’s brooding Wednesday, folded neatly into the cast, helping deliver a refreshingly impish episode reminiscent at times "
2023-03-12 23:00:00,‘This Is the American Dream’,"The Oscars have a lot to navigate this year, between their ongoing struggles to increase diversity and atone for last year’s most shocking moment. But the 95th ceremony began with two powerful wins, which in turn delivered two powerful speeches. Ke Huy Quan and Jamie Lee Curtis—both nominated for the first time—won Best Supporting Actor and Best Supporting Actress, respectively, for their work in Everything Everywhere All at Once.
Quan and Curtis arrived at their storied moments from two strikingly different paths: Quan as a refugee and Curtis as the daughter of Hollywood legends Janet Leigh a "
2023-03-12 23:00:00,What’s Missing From the Grand Finale of The Last of Us,"This story contains spoilers for the entire first season of The Last of Us.
Video-game adaptations used to be defined by how much they could ignore their source material. A Super Mario Bros. movie couldn’t actually be about cartoon Italians jumping on mushrooms with eyes, so it became a battle against leather-clad lizards in an industrial dystopia. The Street Fighter game is about, well, fighting in the street, but the movie is a G.I. Joe rip-off with far-flung action sequences. But as time has passed and button-mashing children of the ’90s like myself have grown up, video games have become ha "
2023-03-13 10:35:00,The Supreme Court Just Keeps Deciding It Should Be Even More Powerful,"By its own maneuvering, the modern Supreme Court has made itself the most powerful branch of government. Superior to Congress. Superior to the president. Superior to the states. Superior to precedent, procedure, and norms. In effect, superior to the people.
Most talked about in this regard, of course, is the Court’s ending of long-established reproductive rights in Dobbs v. Jackson Women’s Health Organization. But the assertion of extreme power extends well beyond the issue of abortion.
For example, in a case called TransUnion LLC v. Ramirez, the conservative majority in 2021 narrowed Congress "
2023-03-13 10:35:00,The Next Stage of COVID Is Starting Now,"To be a newborn in the year 2023—and, almost certainly, every year that follows—means emerging into a world where the coronavirus is ubiquitous. Babies might not meet the virus in the first week or month of life, but soon enough, SARS-CoV-2 will find them. “For anyone born into this world, it’s not going to take a lot of time for them to become infected,” maybe a year, maybe two, says Katia Koelle, a virologist and infectious-disease modeler at Emory University. Beyond a shadow of a doubt, this virus will be one of the very first serious pathogens that today’s infants—and all future infants—me "
2023-03-13 10:35:00,The Iraq War Reconsidered,"Twenty years ago, the United States went to war in Iraq to destroy Saddam Hussein’s weapons of mass destruction. Except for an arsenal of chemical-warfare shells and warheads, those weapons weren’t there—Saddam had shut down his efforts to build a nuclear bomb as well as his biological-warfare program. Instead, he thwarted and resisted international weapons inspectors in order to bluff the world into believing that he still possessed capabilities for mass killing. Saddam’s best-hidden secret was his (at least temporary) weakness.
The United States went to war to build a democracy in Iraq. That "
2023-03-13 10:35:00,You’re Better Off Not Knowing,"For many Americans, these claims sound self-evidently true: Information is good; knowledge is power; awareness of social ills is the mark of the responsible citizen. But what if they aren’t correct? Recent studies on the link between political awareness and individual well-being have gestured toward a liberating, if dark, alternative. Sometimes—perhaps even most of the time—it is better not to know.
Like taking a drug, learning about politics and following the news can become addictive, yet Americans are encouraged to do more of it, lest we become uninformed. Unless you have a job that require "
