DATE,TITLE,SUMMARY
2023-04-06 10:00:00,Nigeria’s Hollow Democracy,"Dear President Biden,
Something remarkable happened on the morning of February 25, the day of the Nigerian presidential election. Many Nigerians went out to vote holding in their hearts a new sense of trust. Cautious trust, but still trust. Since the end of military rule in 1999, Nigerians have had little confidence in elections. To vote in a presidential election was to brace yourself for the inevitable aftermath: fraud.
Elections would be rigged because elections were always rigged; the question was how badly. Sometimes voting felt like an inconsequential gesture as predetermined “winners” w "
2023-04-06 10:00:00,How Rural America Steals Girls’ Futures,"Photographs by Brenda Ann Kenneally
“Boy crazy” was what people called it. “She was so boy crazy,” I would hear about my girlfriends. I never heard the reverse, that a boy was “girl crazy.” Girls having crushes, sneaking out at night to have fun: It seems innocent enough. But in my small, conservative town, a “wrong” choice at a young age could cut girls off from their future dreams, leaving them mired in despair.
Growing up in the ’90s in Clinton, Arkansas, all that my best friend, Darci Brawner, and I dreamed about was getting out. “I want to see new people and new places,” I wrote in my jou "
2023-04-06 10:00:00,The Poisonous Atmosphere That Pervades Iran,"In late November, a journalist named Ali Pour-Tabatabaie reported that 18 girls from an arts academy in the city of Qom, Iran, had fallen sick, apparently from the effects of poison. The story got little attention at the time, as the country was consumed with the protests that had begun after the death of Mahsa Amini in police custody. The 22-year-old woman had been arrested by the morality police on grounds of not wearing the hijab, or mandatory headscarf, properly. Two weeks after that first report of poisoning, 51 students were hospitalized in Qom. By the end of December, a dozen more cases "
2023-04-06 19:00:00,The Week That Made Modern America,"This is an edition of The Atlantic Daily, a newsletter that guides you through the biggest stories of the day, helps you discover new ideas, and recommends the best in culture. Sign up for it here.
“Collective grief can have a way of warping the historical lens,” my colleague Vann R. Newkirk II explains in Holy Week, a new Atlantic podcast series exploring the week of fiery uprisings that broke out across many major U.S. cities following the assassination of Martin Luther King Jr. I spoke with Vann about what happened during that week, exactly 55 years ago, and how it diverted the civil-rights "
2023-04-06 19:00:00,What Does DEI Even Mean?,"Welcome to Up for Debate. Each week, he rounds up timely conversations and solicits reader responses to one thought-provoking question. Later, he publishes some thoughtful replies. Sign up for the newsletter here.
Question of the Week
This week, Donald Trump was arraigned on 34 felony counts and pleaded not guilty to all. His indictment has sparked debates about the legal soundness and wisdom of the criminal charges against him, his future in politics, and how the press is covering it all. What do you think?
Send your responses to conor@theatlantic.com or simply reply to this email.
Conversati "
2023-04-06 19:00:00,We Settled for Catan,"Board games are hostage situations. “C’mon, it’s fun!” your brother or so-called friend says, and then for the next two or eight hours you’re stuck. Rules are read, cardboard chits are distributed, and rounds of wit or chance (or both) transpire. But it is fun, because the joy of gaming first involves accepting arbitrary rules just to feel the sensation of having embraced them.
And yet, board games are terrible. Candy Land is stupid, Scrabble takes too long, Risk is how you learn your dad is an asshole, and Monopoly—let us not speak of Monopoly. Better, nerdier options have long existed (Diplo "
2023-04-07 08:04:00,The Power of a Public Apology,"Lorna Nungali Fejo was 4 years old when she was kidnapped by her government. Her family, who lived in an isolated desert village in the Australian outback, had heard that the authorities regularly stole Aboriginal children from their communities. They had dug holes into creek banks where kids could hide and practice how to stay motionless. Despite these efforts, one day, with help from an Aboriginal tracker, white “welfare men” showed up without warning and dragged off Lorna and her siblings and cousins, throwing them into the back of an open truck and stealing them from the only home they had "
2023-04-07 08:04:00,Why Britain Stinks,"Whenever I was in a bad mood as a child, my parents would toss me into the sea. It was the one thing, they said, that snapped me out of a temper. I grew up a 10-minute walk from the ocean in Wembury, a picture-postcard village in the southwest of England—an area popular for surfing, swimming, and rockpooling.
My father still lives in Wembury, and I still love to get in the water when I’m back home (I now live in London). One day in June 2021, however, I learned from a community Facebook page that going for a swim would not be possible. A blackboard had been erected at the beach with a message "
2023-04-07 08:04:00,Why the Government Is Good at Helping Banks but Not People,"We are really very good at helping banks. Last month, in no time at all, the federal government calmed a crisis that began at just a few institutions but threatened to spread throughout the financial system.
According to CNBC, within four days, banks had borrowed roughly $12 billion from a fund set up to give financial institutions access to favorable loans. Through more traditional borrowing routes, banks were able to acquire more than $300 billion. All this without endless political hemming and hawing from Congress, without the president’s signature, without action by state legislatures or g "
2023-04-07 06:00:00,An Ode to Bananas,"Don’t rush it.
There’s something so very friendly and edible about a banana, from its helpfully tubular design to its yielding texture to its mild and alkaline flavor; something so easy, you just want to shove it into your face. It could be astronaut food, almost: a specially engineered, hygienically sealed nutrition cylinder in high-visibility yellow. Slurp it down, Major Tom. Reset your potassium levels and get back to your Martian rock samples. The peel will float off, anemone-like, in zero gravity.
But to slurp it down, to eat it heedlessly, is to waste the banana. It’s to waste, first of "
2023-04-07 06:00:00,Why the Government Is Good at Helping Banks but Not People,"We are really very good at helping banks. Last month, in no time at all, the federal government calmed a crisis that began at just a few institutions but threatened to spread throughout the financial system.
According to CNBC, within four days, banks had borrowed roughly $12 billion from a fund set up to give financial institutions access to favorable loans. Through more traditional borrowing routes, banks were able to acquire more than $300 billion. All this without endless political hemming and hawing from Congress, without the president’s signature, without action by state legislatures or g "
2023-04-07 06:00:00,How Wisconsin Republicans Got So Angry,"Wisconsin Republicans are caught in a bind: What the base wants, the majority rejects. Because they see no way out, they’re angry, and the near future seems extremely volatile.
On Tuesday, Dan Kelly, a conservative, lost the most expensive judicial election in American history to the liberal Janet Protasiewicz, giving progressives a majority on Wisconsin’s high court for the first time in more than a decade. Abortion was clearly an animating issue; Wisconsinites voted for the candidate of the pro-choice movement.
Kelly didn’t go quietly or graciously. “I wish, in a circumstance like this, I wo "
2023-04-07 01:00:00,"Photos of the Week: Stork Nesting, Kart Crash, Frosty Blossoms","Tomb Sweeping Day in Hong Kong, a new 125-foot-tall bronze statue in India, the indictment of former President Donald Trump in New York City, wildfires in Spain, a Holy Week procession in El Salvador, a field of tulips in Italy, drought conditions in Tunisia, tornado damage in multiple U.S. states, and much more "
2023-04-07 11:00:00,Phones Will Never Be Fun Again,"When they came up with machine-sliced bread, did we start referring to other bread as “annoying”? After the invention of the dishwasher, did we start calling our sinks “stupid”? Post-railroad, did we slander boats as “useless and embarrassing”?
Obviously not. Yet after the smartphone came along, a category of product that was once known simply as “phones” became, rudely, “dumb phones.” If a phone didn’t have an app store and a powerful operating system and an internet connection, it was no longer considered particularly admirable that it performed the core function of telephoning. It was dumb "
2023-04-07 11:00:00,When the Human and the Artificial Collide,"Humanism is a tradition that prizes, above all, the irreplaceable experience of being a person. In her new book, Humanly Possible, Sarah Bakewell aims to revitalize the philosophy’s emphasis on morality, reason, and optimism. But Bakewell’s book has landed at a curious time, Franklin Foer writes: Her way of thinking is imperiled by a changing culture—especially recent developments in artificial intelligence. As these advancements threaten to upend the primacy of “the faculties of the independent mind, the very core of intellectual personhood,” Foer writes, humanism could use a champion. (Unfor "
2023-04-07 19:00:00,Not Just the Janitor of Abbott Elementary,"Of all the characters on Abbott Elementary, there’s one who never fails to make me laugh. I’m talking about Mr. Johnson, the janitor whose dry humor and droll facial expressions make him one of the funniest personas on ABC’s hit comedy. Here’s what we know about Mr. Johnson: He’s probably in his 70s. He’s worked at Abbott forever, his institutional knowledge rivaling that of the longest-tenured teachers. He has alluded to past lives as an Olympic athlete, a nude model, a champion rib eater, and Dorothy Hamill’s paramour. He thinks that lizard people live under the Denver Airport and that the I "
2023-04-07 19:00:00,The Flu May Never Be the Same,"In March 2020, Yamagata’s trail went cold.
The pathogen, one of the four main groups of flu viruses targeted by seasonal vaccines, had spent the first part of the year flitting across the Northern Hemisphere, as it typically did. As the seasons turned, scientists were preparing, as they typically did, for the virus to make its annual trek across the equator and seed new outbreaks in the globe’s southern half.
That migration never came to pass. As the new coronavirus spread, pandemic-mitigation measures started to squash flu-transmission rates to record lows. The drop-off was so sharp that seve "
2023-04-07 19:00:00,Air Has More Substance Than You’d Expect,"Air faces a steep challenge, in terms of winning its audience over. Ben Affleck’s film, set in the mid-1980s, wants viewers to root for Nike—yes, that Nike, the shoe company, the one that’s done pretty well for itself over the past few decades. Will these plucky Oregon underdogs box out their rivals and achieve success by selling a Michael Jordan–branded shoe? The answer to that question seems to be a fairly uncomplicated “yes,” so credit goes to Affleck, his screenwriter Alex Convery, and his star Matt Damon for conveying what it was like to create the Air Jordan brand.
More than a decade ago "
2023-04-08 01:00:00,The Trouble With Ozempic,"This is an edition of The Atlantic Daily, a newsletter that guides you through the biggest stories of the day, helps you discover new ideas, and recommends the best in culture. Sign up for it here.
Thanks to extraordinary demand for the drugs Ozempic and Wegovy, which cause weight loss, pharmaceutical companies are racing to bring even more potent anti-obesity treatments to market. But, as my colleague Yasmin Tayag wrote this week in The Atlantic, current challenges around these drugs’ potential for misuse, and barriers to safe access, aren’t likely to subside. I chatted with Yasmin about what "
2023-04-08 13:00:00,"If You Didn’t See Chaos in Kabul, Where Were You Looking?","“For all this talk of chaos, I just didn’t see it, not from my perch,” John Kirby, the National Security Council’s coordinator for strategic communications, said on Thursday at the White House, following the publication of the Biden administration’s report on the Afghanistan withdrawal. That statement made me angry. My perch was a lot lower than his, and I certainly saw chaos.
I had a modest part in the evacuation that was precipitated by the U.S. announcement in July 2021 that it was pulling out all troops by the end of August. At the time, I was working in London for a member of Parliament w "
2023-04-08 13:00:00,I’m Pro-Life. I Worry That the Abortion-Pill Ruling Could Backfire.,"Pro-life activists across the country are celebrating the decision by a federal district-court judge in Texas to force mifepristone, a drug used in self-induced abortions, off the market. This response makes sense: If, as pro-lifers like myself believe, the embryo developing in a mother’s womb is a human life, it is therefore worthy of both legal protection and social support. Steps that make it harder for women to have an abortion are welcome.
The drug’s ultimate legal status is uncertain. The Texas ruling would go into effect after a seven-day window, allowing the federal government to appea "
2023-04-08 09:00:00,Ali Wong Has Never Been Funnier—Or More Heartbreaking,"The first time I saw Amy, Ali Wong’s character in Beef, I found myself sitting up a little straighter and leaning a little closer toward my TV. I knew Wong had a starring role, but Amy caught me off guard. Wearing a cream-colored bucket hat, her hands gripping the steering wheel and her face frozen in fear, she looked nothing like what I expected of the faceless driver I’d just watched in the show’s opening minutes—the one who’d careened recklessly across lanes, taunting, threatening, and throwing trash at a stranger.
Then again, Beef likes toying with assumptions of who its characters might b "
2023-04-08 09:00:00,How Trends Are Made,"This is an edition of The Wonder Reader, a newsletter in which our editors recommend a set of stories to spark your curiosity and fill you with delight. Sign up here to get it every Saturday morning.
When my colleague Amanda Mull’s mom wouldn’t let her buy high heels in high school, she got an after-school job and bought them herself. Amanda continued her dedication to foot-ruining footwear for years: “When I was 25, a physical therapist who was treating my ankle, destroyed years prior during rec-league soccer, told me that he’d never before had a client with a leg injury show up in flip-flops "
2023-04-08 09:00:00,Make Wisconsin a Democracy Again,"Many Republican legislators lost their job in the 2018 blue-wave midterm that swept Democrats into the majority in the U.S. House.
But not in Wisconsin. There, Republicans celebrated the fourth straight election in which they maintained close to a two-thirds majority in the state assembly, despite winning about 200,000 fewer votes and losing every statewide race. Those extra 200,000 votes won precisely one additional assembly seat for the Democrats. Since then, their control of the state legislature has remained unthreatened.
How is that possible? After Democrats got wiped out in the 2010 midt "
2023-04-09 07:00:00,The Ruling That Threatens the Future of Libraries,"If civilization ever falls to a zombie apocalypse or nuclear Armageddon, we will need to have preserved centuries of accumulated practical knowledge to rise again. And if humanity should go extinct, leaving nothing but our legacy, the alien explorers who discover the ruins of our society would struggle to interpret human history without some great store of information to guide them.
Maybe these postapocalyptic scenarios are far-fetched, but even if society is never, say, drowned by the seas in some climate-driven disaster, leaving the remnants of humanity clinging to a few small bits of land "
2023-04-09 15:39:00,"A Return to the Freaky, Awkward Glory Days of SNL","When Molly Shannon auditioned for Saturday Night Live in the mid-’90s, she received some appallingly bad advice. A scout warned her against doing the character Mary Katherine Gallagher—a geeky teenager who stuck her hands in her armpits and smelled them when she got nervous—because the show’s executive producer, Lorne Michaels, wouldn’t like it. “He’ll think it’s weird, that dirty little character,” Shannon recalled being told. Despite listening to that guidance for her first round, Shannon surfaced Mary Katherine during her second, and Michaels saw the potential. Which is why last night, more "
2023-04-09 11:00:00,The Texas Abortion-Pill Ruling Signals Pro-Lifers’ Next Push,"The chaos unleashed by the U.S. Supreme Court’s reversal of Roe v. Wade was underscored on Friday when federal judges released dueling opinions on mifepristone, a pill used in more than half of abortions in the United States. In a suit by 17 progressive states and the District of Columbia, Judge Thomas O. Rice of the Eastern District of Washington State ordered the FDA to preserve access to mifepristone. In a competing ruling from Texas, Judge Matthew J. Kacsmaryk held that the FDA lacked the authority to have approved mifepristone in the first place, more than 20 years ago. Kacsmaryk’s ruling "
2023-04-09 11:00:00,Where’s the AI Culture War?,"You know something strange is afoot when Elon Musk comes out in favor of tech regulation. Or when Kevin McCarthy and a left-wing Joe Biden appointee agree that one particular issue is a priority. These are not people who tend to agree on, well, anything. But such are the nascent, topsy-turvy politics of artificial intelligence.
AI is not really a single issue you can be for or against the way you can with, say, guns or abortion. It is, to name just a few aspects, an economic issue (Will it replace millions of jobs?), a foreign-policy issue (What if China surpasses us?), and a political issue "
2023-04-09 11:00:00,Sailing to Italy,"When the poet Mark Strand was a child, his family was constantly in motion; he lived in Cleveland, Halifax, Montreal, New York, and Philadelphia, then Colombia, Mexico, Peru. “I moved around so much, and went to so many different schools,” he once said, “that I never found my own place.” Apparently, he never stopped reflecting on what that lack of a stable place meant, either—on how one’s identity can emerge from their environment, and how it can crumble without a consistent one. The task of poetry, he wrote, is to examine “the edge of the self, the edge of the world—that shadow-land between s "
2023-04-09 11:00:00,The Hardest Decisions Mothers Make,"I count the weeks. Before, it was months. Soon it will be days.
I’m counting the time left before my oldest child leaves home. The time left that the four of us will live together, under this roof, intact as a family.
This child, whose name is James, loves soccer. Always has. There’s a photo of him, age 1—1!—tiny soccer ball at his feet and huge grin on his face. Barely able to walk and already learning to dribble. Now fast-forward 16 years. He’s a starting striker on his high-school varsity team. He lives for these games.
This is a boy so catastrophically, irredeemably messy that even his you "
2023-04-09 11:00:00,Weepy British Alt-Rock That Stands the Test of Time,"This is an edition of The Atlantic Daily, a newsletter that guides you through the biggest stories of the day, helps you discover new ideas, and recommends the best in culture. Sign up for it here.
Good morning, and welcome back to The Daily’s Sunday culture edition, in which one Atlantic writer reveals what’s keeping them entertained.
Today’s special guest is the Atlantic staff writer Derek Thompson, the author of the new Atlantic Editions title On Work: Money, Meaning, Identity; The Atlantic’s Work in Progress newsletter; and the 2018 best seller Hit Makers: How to Succeed in an Age of Distr "
2023-04-09 23:25:00,Succession Finally Did It,"This article contains spoilers through the third episode of Succession Season 4.
He is … not risen?
I think? For three-plus seasons, Logan Roy has ducked and weaved his way past near fatalities—a hemorrhagic stroke, multiple corporate coup attempts, a congressional investigation, a troublesome UTI, a collapse in the Hamptons—like a hirsute, cashmere-clad Road Runner. Hostile board meeting? Meep meep. Attempted patricidal veto under the Tuscan sun? Fuck off. You could be forgiven, after all this, for thinking him immortal. Which is why it was so unsettling to realize, as the Roy children did, v "
2023-04-10 07:53:00,Trapped With COVID,"The first prisoner to die was 69 years old, a wheelchair-using former printing-press operator who called himself Cap. He’d arrived at the penitentiary from Orleans Parish in the winter of 1978 with a life sentence for murder. He was overweight and suffered from a variety of health issues. As a young man, Cap had survived an accidental electrocution. As an old man, he was swiftly killed by COVID-19. He was hurriedly buried by a masked-and-gloved skeleton crew of apprehensive, incarcerated volunteers at Point Lookout, the prison cemetery.
Afterward, the world became very small. Who would be next "
2023-04-10 07:53:00,How Should Portuguese Americans Be Classified?,"My grandfather José was a dark-skinned, thickly accented man who lived in Escondido, California, where 52 percent of the 150,000 inhabitants are Hispanic. But José, born in Portugal, was not Hispanic, at least not according to present-day federal definitions. Throughout the 60 years that my avô lived in the United States, such federal classifications changed constantly. He was once a minority, now not. For a while he was Hispanic, until he was white. The question of who Portuguese Americans are has become an existential debate for members of the community, with profound consequences for their "
2023-04-10 07:53:00,A Sharp Satire About Doing Good—By Compromising Everything,"Ask me how much time and money I have devoted, in my adult life, to conscious efforts to be a good person, and I would struggle to quantify it. Of course, I would also struggle to tell you what “being good” means. My ideas seem to change constantly, which means the target shifts. Besides, the world I inhabit does not make goodness easy, for me or anyone else. I put clothes I no longer wear in giveaway bins run by a profoundly inefficient nonprofit; I assiduously recycle despite reports that my plastic is likely “headed to landfills, or worse”; I sign up for shifts at a food bank, then cancel b "
2023-04-10 07:53:00,The Pornography Paradox,"Content, some say, wants to be free; so, reportedly, do we. At any rate, such conclusions jibe with at least 9 billion visits a month to porn websites and “tubes,” where professionals and amateurs upload sex videos for others to stream, at any hour we please, at no monetary cost. As many reading this presumably already know. (Not judging.)
Is nonstop free pornography liberating, or is it shackling, leaving us less humanlike than ever? This is one of the contemporary conundrums that the sociologist Kelsy Burke explores in The Pornography Wars: The Past, Present, and Future of America’s Obscene "
2023-04-10 13:00:00,The Three Biggest Misconceptions About Israel’s Upheaval,"For the past three months, Israelis have been protesting across the country against the attempted overhaul of their judicial system by Prime Minister Benjamin Netanyahu’s hard-right coalition. In February, a survey found that nearly one in five Israelis had taken part in a demonstration. This unprecedented activism culminated in a national strike at the end of March that compelled Netanyahu to pause, but not abandon, his efforts to push through the legislation. Today, representatives of the two sides sat down to continue negotiations toward a potential compromise. Yet despite all the coverage "
2023-04-10 13:00:00,The Problem With Weather Apps,"Technologically speaking, we live in a time of plenty. Today, I can ask a chatbot to render The Canterbury Tales as if written by Taylor Swift or to help me write a factually inaccurate autobiography. With three swipes, I can summon almost everyone listed in my phone and see their confused faces via an impromptu video chat. My life is a gluttonous smorgasbord of information, and I am on the all-you-can-eat plan. But there is one specific corner where technological advances haven’t kept up: weather apps.
Weather forecasts are always a game of prediction and probabilities, but these apps seem to "
2023-04-10 13:00:00,Quit Your Bucket List,"Years ago, just after I finished my psychiatry residency, a beloved supervisor called to say she had some bad news. At a routine checkup, she had glanced at her chest X-ray up on the viewing box while waiting for her doctor to come into the room. She was a trauma surgeon before becoming a psychiatrist and had spent years reading chest X-rays, so she knew that the coin-size lesion she saw in her lung was almost certainly cancer, given her long history of smoking.
We had dinner soon after. She was still more than two years away from the end of her life and felt physically fine—vital, even. That "
