DATE,TITLE,SUMMARY
2018-07-28 14:32:03,14 Things Every Woman Should Know By The Time She Turns 40,The wisdom of Gen X women.
2018-10-12 12:30:01,I Tried Out for ‘The Bachelor’ 3 Times And This Is What I Learned,"I was feeling desperate and when you’re feeling desperate, you do nonsensical and illogical things."
2018-11-05 13:30:28,I Went Into Treatment For Body Dysmorphic Disorder. This Is What It’s Like.,"I couldn’t go more than 15 minutes without checking my reflection — without, in BDD/OCD terms, ritualizing."
2018-11-13 13:30:13,"I’m American, But You Might Never Know It By Looking At My Life. That’s The Point.","I possess a Taiwanese birth certificate, a U.S. passport, a German marriage certificate and a Swiss permanent residency card."
2018-11-08 13:30:16,What It’s Like To Be A ‘Highly Sensitive Person’ When You’re A Man,Men are taught from a young age that our worth is in our strength — both physical and emotional.
