DATE,TITLE,SUMMARY
2024-09-09 06:06:34,"China's property market has 'not found a bottom' yet, Standard Chartered CEO Bill Winters says","Winters described the investing environment in China as ""difficult,"" explaining consumer confidence and international investor confidence was relatively low."
2024-09-09 05:06:38,This 29-year-old millionaire doesn’t own a home — here’s how he spends and invests his money instead,Timothy Armoo is not what you might expect from a multi-millionaire.
2024-09-09 19:30:19,"The 'vibecession' is ending as the U.S. economy nails a soft landing, economists say","As inflation cools and the Fed is set to lower interest rates, consumer sentiment is improving. But a recession will happen at some point."
2024-09-10 11:00:01,Sales of $10 million homes surge in Palm Beach and New York,"The number of homes that sold for $10 million or more in the second quarter jumped 44% in Palm Beach and 16% in New York, according to Knight Frank."
2024-09-11 17:42:59,Americans have more than $32 trillion in home equity — a record high. Here's what to know before you tap it,"Many Americans are house-rich, thanks to a runup in home prices. But high borrowing costs make it harder to tap your home for cash."
2024-09-11 17:11:38,Here's the inflation breakdown for August 2024 — in one chart,"The consumer price index rose by 2.5% in August, on an annual basis. It was the lowest reading since February 2021."
2024-09-11 11:28:46,Mortgage rates hit lowest level since February 2023,"Mortgage rates fell for the sixth straight week last week, but mortgage demand still seems to be waiting for something bigger."
2024-09-11 11:34:14,Chairman of property firm Damac expresses concerns over 'expensive' Dubai,"Increasing demand for property, especially in the luxury space, is boosting prices not just of homes but of everything else in Dubai."
2024-09-12 19:20:32,Why we started a position tied to housing and where we see this stock going,The stock started to work again over the past few months after bond yields plunged.
2024-09-12 14:31:19,"Homeowners may be 'overconfident in their retirement readiness,' economist says. Here's why","Owning a home can help you build equity and control housing costs. But it can cloud your judgment on retirement readiness, one expert says."
2024-09-13 08:28:53,UK leads resurgence in European office investment,"The U.K. is leading a recovery in Europe's long subdued office real estate market, with overall investment in the sector expected to pick up further in the second half of the year."
2024-09-13 20:12:27,Montana's hot housing market heats up critical Senate race,"Sen. Jon Tester has the most difficult reelection of any candidate, and he's making his fight against unaffordable housing a part of his campaign."
2024-09-13 15:55:06,"Don't expect 'immediate relief' from the Federal Reserve's first rate cut in years, economist says. Here's why","The first interest rate cut in four years is on deck. For many households, this policy shift is welcome news, but one cut won't make a big impact, experts say."
2024-09-17 06:33:18,This 38-year-old is financially independent with passive income. Here's how he built a 7-figure real estate portfolio,"Shu Matsuo Post, 38, has reached financial independence after building a seven-figure real estate portfolio. Today, he lives in Japan with his wife and kids."
2024-09-18 16:32:05,"The Fed is poised for its first rate cut in years, but it may be too soon to refinance your mortgage","The Federal Reserve is poised to begin cutting interest rates, which can influence mortgage rates. But it still may be too soon to refinance your mortgage."
2024-09-18 11:33:50,Weekly mortgage demand surges 14% higher as interest rates hit two-year low,"Mortgage rates don't follow the Fed exactly, but they are influenced by policy and could move on Wednesday's news."
2024-09-18 18:39:36,The Federal Reserve just cut interest rates by a half point. Here's what that means for your wallet,"The first rate cut in years will affect many types of consumer products. Here's what it means for credit cards, mortgage rates, auto loans and savings accounts."
2024-09-18 18:08:59,"Despite the Fed's first interest rate cut in years, it may be too soon to refinance your mortgage. Here's why","The Federal Reserve just made its first interest rate cut, which can influence mortgage rates. But it still may be too soon to refinance your mortgage."
2024-09-19 15:53:08,"August home sales drop more than expected, as prices set a new record","The median price of an existing home sold in August was $416,700, up 3.1% from August 2023."
2024-09-19 14:33:22,"From mortgages to auto loans, experts weigh in on when — or if — to refinance as interest rates fall","The Federal Reserve just cut interest rates by a half point. That may open up some refinancing opportunities for borrowers, depending on the type of loan."
2024-09-20 10:47:29,Britain's ultra-wealthy are threatening to exit en masse ahead of proposed tax changes,"Labour's plans to axe the U.K.'s non-dom tax regime could spark an ultra wealthy exodus, advisers and research bodies have warned."
2024-09-23 17:40:54,You can't always refinance a mortgage to capitalize on lower rates: Here's when a lender may say 'no',"If you're considering a mortgage refinance to take advantage of lower rates, here's how to make sure you qualify."
2024-09-24 05:24:37,Property stocks in Hong Kong rally on mortgage stimulus,Hang Seng Mainland Properties Index surged as much as 5% after PBOC Gov. Pan Gongsheng announced several measures on Tuesday.
2024-09-24 17:40:13,Take a look inside a $1.1 million 'zero emissions' home,Federal officials are trying to boost the energy efficiency of residential and commercial real estate.
2024-09-25 17:16:48,"It's not a great fall housing market, but this is 'as good as it gets,' economist says",Mortgage rates are lower and more homes are for sale in some areas. Here's what to expect in the housing market this fall.
2024-09-25 12:38:54,"Mortgage refinance boom takes hold, as weekly demand surges 20%","Applications to refinance a home loan surged 20% last week compared with the previous week, according to the Mortgage Bankers Association's seasonally adjusted index."
2024-09-27 04:03:51,Hong Kong's New World Development shares surge 23% after CEO resigns,The company said Chief Operating Officer Eric Ma Siu-Cheung has been appointed as the new CEO.
2024-09-30 09:49:13,China property stocks rally after major cities ease homebuying restrictions,"Shares of Chinese property developers rallied on Monday, fueled by easing homebuying measures, following authorities' blitz of policy stimulus last week."
2024-09-30 15:10:25,"States forge ahead with Inflation Reduction Act energy rebates — so far, South Dakota is the only one to opt out","Arizona, Maine, New York, New Mexico, Rhode Island and Wisconsin have launched consumer rebate programs tied to energy efficiency."
2024-09-30 15:32:07,6 strategies to help mitigate rising car and home insurance costs,"While overall inflation has slowed, insurance costs are taking a bigger bite out of many household budgets. Here are some ways to save money on insurance."
2024-09-30 14:22:00,Rupert Murdoch’s property group REA ends chase to buy Rightmove after multiple rejected offers,Rupert Murdoch's Australian property listing firm REA Group said Monday it would no longer seek to buy UK property portal Rightmove.
2024-10-01 07:49:45,"Singapore private housing prices cool, ending an over year-long rally","Singapore's private home prices fell for the first time in five quarters amid depressed sales, preliminary market data showed on Tuesday."
2024-10-01 14:22:14,"Real estate fees settlement created 'a new competitive ballgame,’ expert says. Here's what buyers, sellers need to know",Buying and selling a home may look a little a different in your area now that the NAR settlement has taken effect. Here's what it means for you.
2024-10-02 11:45:37,Red-hot refinance demand retreats after tiny bump higher in mortgage rates,"Mortgage rates moved ever so slightly higher last week, but it was enough to take a little heat out of what had been a briefly red-hot refinance market."
2024-10-02 07:42:24,China property stocks surge to highest levels in a year as stimulus rally continues,"Shares of most Hong Kong-listed Chinese property stocks surged to their highest in over a year, as China's recent slew of stimulus continue to buoy markets."
2024-10-03 10:24:54,UK house sales rise since the Covid-19 boom as lower mortgage rates spur activity,"Lower mortgage rates are sparking an uptick in the U.K. housing market, with home sales rising last month at the fastest pace since the post-lockdown boom, new data shows."
2024-10-03 22:58:51,UK house sales rise at fastest pace since Covid boom as lower mortgage rates boost activity,"Lower mortgage rates are sparking an uptick in the U.K. housing market, with home sales rising last month at the fastest pace since the post-lockdown boom, new data shows."
2024-10-04 19:29:20,Zillow adds climate risk data to home listings as threats rise,"More than 80% of buyers now consider climate risk when purchasing a home, according to a survey by Zillow."
2024-10-04 17:53:26,Mortgage rates spike after stronger-than-expected jobs report,The average rate on the 30-year fixed mortgage is now 6.53% according to Mortgage News Daily.
2024-10-04 13:01:41,Here are the pros and cons of renting versus owning a home in those retirement years,"More than 7 million adults of ages 65 and above rent instead of own in the U.S. While they are at risk to rent price increases, they save on home maintenance costs."
2024-10-06 14:44:33,Ryan Serhant: AI will make real estate agents more personable in home buying and selling,"Ryan Serhant, star of reality TV real estate show  ""Owning Manhattan"" says AI can help agents get better at building homebuyer and seller relationships."
2024-10-08 18:56:24,"Here are key steps to file a homeowners insurance claim after a natural disaster, experts say","It's important to quickly file a claim to your insurance provider to avoid rebuilding delays, experts say. Here are three key steps to take."
2024-10-09 12:48:26,Weekly mortgage demand drops as interest rates hit the highest level since August,Applications to refinance a home loan fell last week.
2024-10-09 18:52:25,"33% of homeowners would hire a 'questionable' contractor to save money, report finds","A third of homeowners are willing to hire a ""questionable"" contractor to save money, a report finds. But that may leave room for error, and sometimes fraud."
2024-10-11 13:35:21,How a homeowners insurance provision can help with living expenses after a natural disaster,"""Loss of use coverage"" can help homeowners and renters cover certain living expenses if their home was damaged in a natural disaster. Here's what to know."
2024-10-15 12:00:01,How a rare type of mortgage is landing homebuyers a 3% rate,U.S. homebuyers are looking into mortgage assumption as a way to secure a sub-3% mortgage rate.
2024-10-16 01:03:29,"I bought a $54,000 abandoned house in Japan and turned it into a luxury Airbnb—take a look inside","Anton Wormann, 32, transformed an abandoned house in Japan into a luxury Airbnb stay. Today, it brings in about $11,000 a month."
2024-10-15 19:37:11,Buying a home? Here are some key steps to consider from top-ranked advisors,"If you plan to buy a home, you need to take proper steps to prepare for the purchase. Here's how to get there and what to consider, according to experts."
2024-10-15 14:02:51,Inside a high-tech parking garage where robots valet park your car,Better-utilized space for parking could mean a developer needs fewer floors devoted to vehicles — freeing up square footage for residences.
2024-10-16 11:41:09,"Weekly mortgage demand tanks 17%, after interest rates hit the highest level since August","Mortgage interest rates rose last week for the third straight week, hitting the highest level since August."
2024-10-16 08:03:30,Hong Kong leader announces measures to address housing crisis in annual policy address,Hong Kong Chief Executive John Lee announced a series of measures aimed at addressing the city’s housing affordability crisis during an annual policy address.
2024-10-17 04:40:55,China pledges more financial support for 'whitelist' real estate projects,"Ni Hong, China's minister of housing and urban-rural development, made the announcement at a press conference on Thursday."
2024-10-18 11:00:01,"The commercial real estate recovery is on, but the rebound may be uneven","The Fed's shift in policy is ""the most notable green shoot"" for the CRE market, according to Wells Fargo analysts."
2024-10-21 18:51:21,Do real estate agents have to disclose if someone died in a house? Here's how to find out,"Disclosure laws around stigmas will depend on where you are buying a home. If a home's history matters to you in your home purchase, here's what to do."
2024-10-23 14:15:32,September home sales drop to lowest level since 2010,
2024-10-23 13:36:40,"Mortgage demand drops to its lowest level since July, as interest rates return to summer highs","Total mortgage application volume dropped 6.7% from the previous week, hitting its lowest level since July"
2024-10-23 20:36:08,Why bond yields are rising and what stock investors should do about that,"Bond traders are at it again, pushing Treasury yields higher and signaling the Fed was too heavy-handed when it cut rates last month."
2024-10-23 19:10:31,"4 ways to make your home down payment savings grow, according to top-ranked advisors",Coming up with a down payment for a house can be a challenge for homebuyers facing high home prices. Here are five ways to grow the funds.
2024-10-25 19:43:10,"This is 'the biggest difference' in today's housing market, according to hosts of 'Property Brothers'","Though the housing market faces underlying supply constraints, a home purchase is still a good investment, say co-hosts of the TV show ""Property Brothers."""
2024-10-29 12:00:01,Inflation is down — but the middle class is still feeling financial pressure. Here's why,Economists say there's a strong role for policy in affecting the prices of essential goods for American families.
2024-10-29 23:43:41,China's property market is expected to stabilize in 2025 — but stay subdued for years,"China's struggling real estate sector may not start turning around until the second half of next year, even with the latest stimulus measures, analysts predict."
2024-10-29 14:29:13,"Buying a home is 'a way to increase your net worth over time,' top-ranked advisor says","Homeowners generally have a higher net-worth than renters. But the equity does not appear overnight. Here's what to consider, experts say."
2024-10-29 14:19:08,Jim Cramer says buy Stanley Black & Decker's post-earnings plunge 'aggressively',Shares of the Club stock tumbled Tuesday after the DeWalt owner reported earnings.
2024-10-30 17:20:03,"Pending home sales took an unexpected leap higher last month, but rates have climbed back up",The average rate on the 30-year fixed mortgage was coming down all through August and touched its most recent low of 6.11% on Sept. 11.
2024-10-30 12:52:52,$2 billion marina development aims to turn Fort Lauderdale into 'mini Monaco',"The new development at the Bahia Mar marina will include a hotel, condo towers, a beach club, restaurants and retail space, according to the plans."
2024-10-30 11:45:26,Mortgage demand stalls as interest rates surge higher ahead of election,"Total mortgage application volume was essentially flat, falling 0.1% compared with the previous week."
2024-10-31 18:21:03,Halloween kicks off a season of home insurance risks. Here's what homeowners need to know,Holidays like Halloween can increase the likelihood of certain risks as more people visit your property. Here are three steps to cross off your list this holiday season.
2024-11-03 14:00:01,Should I pay off my mortgage in retirement? New book tackles big money questions,"Retirement planning is filled with big questions. For some retirees, whether or not to pay off their mortgage is one of them."
2024-11-04 19:01:54,More homeowners just started pulling cash out of their properties. Here's why.,"While mortgage rates don't exactly follow the Federal Reserve's rate, home equity lines of credit, or HELOCs, are tied to it."
2024-11-05 21:08:26,"Average age of first-time homebuyers is 38, an all-time high. Here's what that says about the real estate market","The typical first-time homebuyer is now 38 years old, a record high, according to the National Association of Realtors."
2024-11-06 17:37:24,"Mortgage rates surge higher on Trump victory, causing housing stocks to fall","Lennar, D.R. Horton and PulteGroup were all down Wednesday. Retailers Home Depot and Lowe's were also lower."
2024-11-06 12:37:43,Brits brace for higher mortgage payments despite Bank of England seen cutting rates,Britons are facing the prospect of higher mortgages for longer even as the Bank of England readies to cut rates on Thursday.
2024-11-06 12:00:01,Weekly mortgage demand tanks 11% as interest rates surge higher,"Total mortgage application volume dropped 10.8% compared to the previous week, according to the Mortgage Bankers Association's seasonally adjusted index."
2024-11-07 21:01:23,The Federal Reserve cuts interest rates by a quarter point after election. Here's what that means for you,"The second interest rate cut in a row will affect consumer borrowing costs. Here's what it means for your credit card, mortgage rate, car loan and savings."
2024-11-08 18:30:43,Wall Street is bullish on one portfolio retail stock while raising concerns about another,We're talking about Home Depot and Best Buy.
2024-11-10 19:49:20,The 2 things that will drive the stock market after last week's Trump-Fed rally,"Talk about an eventful week. And, the hurdles to come."
2024-11-10 16:41:42,What Trump's mass deportation plan would mean for immigrant workers and the economy,President-Elect Donald Trump says his mass deportation plan will go ahead. Hiring firms and labor economists have begun to weigh the damage.
2024-11-10 13:27:24,Young adults in Puerto Rico are struggling financially. Here's what that means and why some return,"More than half of adults ages 18 to 29 in Puerto Rico are financially fragile compared to older generations on the island, and young adults in the U.S."
2024-11-11 19:09:36,Megacap tech stocks make some room — here is where investors are branching out,"Every weekday, the Investing Club releases the Homestretch; an actionable afternoon update just in time for the last hour of trading."
2024-11-11 17:09:48,"What's behind Salesforce's record highs — plus, a possible stock to buy after this week's earnings","The Investing Club holds its ""Morning Meeting"" every weekday at 10:20 a.m. ET."
2024-11-11 16:11:17,"Here's what the Trump presidency could mean for the housing market, experts say",Donald Trump wants to address the housing shortage in the U.S. But some of his promises might be hurdles in the way.
2024-11-13 12:19:21,Mortgage demand stalls as financial markets digest Trump presidency,"While tiny, the week's increase in total application volume marked the first rise in overall demand in seven weeks."
2024-11-13 19:51:44,"Homebuilder deal activity is surging, fueled by major Japanese buyers",Strong demand for new housing has smaller builders ripe for takeover. The Japanese are big players because their cost of capital is low.
2024-11-15 15:00:28,Mortgage rates may be stabilizing after the election. Here's what to expect into early 2025,"The average 30-year fixed-rate mortgage was 6.78% on Nov. 14, unchanged from a week ago."
2024-11-17 14:00:01,Young adults are holding off on moving out of their parents' house — here's what's behind the trend,About 1 in 3 adults ages 18 to 34 in the U.S. are living with at least one of their parents as a way of saving money.
2024-11-20 17:34:44,We're making another trim of a stock under pressure to protect hard-fought profits,Discipline is driving this trade because we do not want to turn gains into a losses.
2024-11-20 13:27:37,"Weekly mortgage demand inched up, despite higher interest rates. Here's why","After flatlining the week before, mortgage demand rose last week, despite mortgage rates rising for the fourth straight week."
2024-11-21 15:33:07,"Home sales surged in October, just before mortgage rates jumped","Sales were 2.9% higher than October of last year, marking the first annual increase in over three years."
2024-11-26 21:40:29,"Renters struggle to build wealth, report finds. Here's how they can boost financial well-being",Renters typically have a much smaller net worth compared with 
2024-11-26 19:22:18,How President-elect Donald Trump's policies may affect investors in these 8 market sectors,"President-elect Donald Trump's agenda carries risks and rewards for various investment sectors, market experts said."
2024-11-27 14:53:47,Homebuyer demand for mortgages jumps 12% after first interest rate drop in over 2 months,"While the drop in rates wasn't exactly huge, there was a fair amount of pent-up demand among homebuyers."
2024-12-02 19:26:33,Here's what the rise of homeowners associations means for buyers,"Homeowners associations, or HOAs, are becoming more common. The biggest complaint among current owners is the cost, report finds."
2024-12-03 16:13:59,This factor can get your mortgage application denied — even if you're a high earner,"The debt-to-income ratio was the most common reason buyers were denied a mortgage, according to a report. Here's how to improve it."
2024-12-04 12:54:48,"Homebuyer demand for mortgages jumped 6%, as interest rates fell to the lowest level in over a month",Potential homebuyers are responding to lower mortgage rates and a higher supply of homes for sale.
2024-12-05 18:28:00,Market FOMO? We go to the charts for attractive purchase levels on 2 buy-rated stocks,Feeling shut out of this hot market? You're not alone.
2024-12-05 18:31:16,"More Americans are living in malls, as developers get creative to help ease the housing crisis","Real estate developers are building housing inside of or next to shopping malls as department stores like Macy's, JC Penney and Sears shrink or cease to exist."
2024-12-06 21:48:18,AI startups are snatching up San Francisco real estate as Gen Z craves office life,"With the Covid pandemic approaching its five-year anniversary, a growing number of startups in San Francisco are ditching remote work."
2024-12-08 15:00:01,"5 housing market predictions for 2025, according to economists","Housing has been an expensive necessity, whether you're buying or renting. Here are five things to pay attention to in 2025, experts say."
2024-12-09 19:33:06,A Florida 'condo cliff' is coming as owners deal with fallout from 2021 Surfside collapse,"For some associations, the costs are in the millions of dollars, and condo owners, many of whom are retirees on fixed incomes, are on the hook."
2024-12-11 16:13:19,'Unverifiable income' can limit your mortgage options — here's how to get around it,"Your mortgage application may be denied if the lender cannot verify your annual income. If you meet certain exceptions, a non-conventional mortgage may work."
2024-12-11 17:57:38,"Alexander real estate brothers, sibling raped 'dozens of victims,' federal indictment alleges","Top real estate agents Tal and Oren Alexander and their brother, Alon, were arrested in Miami and face federal sex trafficking charges."
2024-12-11 13:13:53,"Mortgage refinance demand surges 27%, as interest rates drop for the third straight week","Mortgage rates fell again last week, and while the drop wasn't huge, it was enough to spur current homeowners to look for some savings."
2024-12-13 17:58:41,Federal Reserve is likely to cut interest rates next week. Here's what that means for you,"The third interest rate cut in a row is on deck, which is welcome news for consumers struggling to keep up with sky-high interest charges."
2024-12-17 19:46:28,"After taking morning profits, we're afternoon buyers of 2 stocks in an oversold market",This is our second trade alert of the day.
2024-12-18 17:01:17,These are the top 10 'housing hot spots' for 2025 — none are in Florida,"It's too soon to tell if 2025 will be a housing market favoring buyers or sellers. But some areas could offer affordable conditions, according to experts."
2024-12-18 12:29:44,"Mortgage demand drops for the first time in 5 weeks, after interest rates rise","Total application volume fell 0.7% compared with the previous week, according to the MBA's seasonally adjusted index. That was the first decline in five weeks."
2024-12-18 21:03:19,The Federal Reserve cuts interest rates by another quarter point. Here's what that means for you,The central bank has now shaved a full percentage off its benchmark rate since September. Here's what it means for your borrowing costs.
2024-12-18 18:58:14,American homeowners are wasting more space than ever before,"The number of extra bedrooms — defined as a bedroom in excess of the number of people in a home, and even including one for an office — has reached a new high."
2024-12-19 16:56:29,We're buying the recent dips on 2 stocks in the most oversold market in over a year,These purchases are being made out of discipline to the S&amp;P 500 Short Range Oscillator.
2024-12-19 17:02:05,"November home sales surged more than expected, boosted by lower mortgage rates","Sales of previously owned homes rose 4.8% in November compared with October, according to the National Association of Realtors"
2024-12-20 22:53:47,The Fed cut interest rates but mortgage costs jumped. Here's why,The average 30-year fixed mortgage rate spiked after the Federal Reserve cut rates. Experts say expectations for rate cuts in 2025 fueled the jump.
