DATE,TITLE,SUMMARY
2024-01-14 01:15:37,January 13 GOP primary campaign updates,GOP presidential candidates are racing to give their final pitch to Iowa voters with just days until the state's pivotal caucuses kick off the 2024 primary contests. Follow here for the latest live news updates from the campaign trail.
2024-01-14 05:08:08,"January 13, 2024 Israel-Hamas war","The US carried out more strikes against the Houthi rebels in Yemen this weekend as the UN warned of ""utter horror"" unfolding in Gaza."
2024-01-14 05:04:44,The latest on Israel's war in Gaza,"The United Nations described scenes of ""utter horror"" in northern Gaza this weekend as the US struck more Houthi rebel targets in Yemen. Follow for live updates."
2024-01-14 14:00:18,It's the final day before the Iowa caucuses,GOP presidential candidates are racing to give their final pitch to Iowa voters ahead of tomorrow's pivotal caucuses in the state. Follow here for the latest live news updates from the campaign trail.
2024-01-14 20:31:46,January 12 - 2024 campaign updates,GOP presidential candidates are racing to give their final pitch to Iowa voters with just days until the state's pivotal caucuses kick off the 2024 primary contests. Follow here for the latest live news updates from the campaign trail.
2024-01-15 00:59:17,January 14 - 2024 campaign updates,GOP presidential candidates are racing to give their final pitch to Iowa voters ahead of tomorrow's pivotal caucuses in the state.
2024-01-15 04:59:36,"January 14, 2024 Israel-Hamas war","The United Nations described scenes of ""utter horror"" in northern Gaza this weekend as Israel marked 100 days of its war against Hamas. Follow for live updates."
2024-01-15 13:40:12,A suspect was charged in the Gilgo Beach serial killings cold case. Here's a timeline of the case and the investigation,"For more than a decade, a string of unsolved killings known as the Gilgo Beach murders terrorized residents and confounded authorities on Long Island's South Shore after a woman's 2010 disappearance led investigators to find 10 sets of human remains in addition to hers and launched the hunt for a possible serial killer."
2024-01-15 12:50:36,GOP candidates to face first test of primary season in Iowa caucuses,"The first test of the 2024 presidential primary season is Monday night, when Iowa Republicans gather to caucus and vote for a nominee. Follow here for the latest live news updates, results and analysis."
2024-01-15 14:45:19,Barry Diller Fast Facts,View the Barry Diller Fast Facts on CNN to learn more about the life of the media mogul.
2024-01-15 16:12:17,X-59: NASA's 'quiet' supersonic plane revealed,"Sonic booms are part of the reason why supersonic passenger planes don't fly today. Now, NASA is working to transform the boom into a ""thump,"" paving the way for a new generation of quieter supersonic aircraft."
2024-01-16 01:01:09,GOP candidates face first test of primary season in Iowa caucuses,"The first test of the 2024 presidential primary season is Monday night, when Iowa Republicans gather to caucus and vote for a nominee. Follow here for the latest live news updates, results and analysis."
2024-01-16 02:15:29,"Trump wins Iowa GOP caucuses, CNN projects, as Haley and DeSantis battle for second","Former President Donald Trump wins the Iowa caucuses, CNN projects, cementing his frontrunner status in the GOP field. Follow here for the latest live news updates, results and analysis."
2024-01-16 01:34:49,"Devil's dung or dinner delight? The story behind hing, one of India's most divisive ingredients","Asafoetida, aka hing, is a mainstay of Indian cooking. But not everyone can appreciate this challenging flavor."
2024-01-16 04:41:57,CNN projects Trump wins Iowa GOP caucuses as DeSantis takes second,"Former President Donald Trump wins the Iowa caucuses, CNN projects, cementing his frontrunner status in the GOP field. Follow here for the latest live news updates, results and analysis."
2024-01-16 04:58:19,"January 15, 2024 Israel-Hamas war","Israel's war in Gaza has brought famine with ""such incredible speed,"" the UN relief chief told CNN. Follow live updates."
2024-01-16 12:59:10,Trump's trial in E. Jean Carroll defamation case to begin,A jury will be asked to decide how much in damages former President Donald Trump must pay E. Jean Carroll for his 2019 defamatory statements about Carroll's sexual assault allegations. Follow the latest here.
2024-01-16 12:58:19,Trump wins Iowa GOP caucuses as DeSantis takes second,"Former President Donald Trump wins the Iowa caucuses, cementing his frontrunner status in the GOP field. Follow here for the latest live news updates, results and analysis."
2024-01-16 15:23:15,25 ways to stay warm this winter that won't break the bank,"If you can't afford, don't have or are cutting back on indoor heating, here are 25 ways to stay warm this winter — with or without indoor heating — on a budget."
2024-01-16 15:05:56,The latest on the Iowa caucuses and 2024 primary campaign,"Former President Donald Trump won the Iowa caucuses, cementing his front-runner status in the GOP field. Follow here for the latest live news updates and analysis."
2024-01-16 16:05:39,Venice entry fee tickets go on sale. Here's how they work,"Venice's long awaited entry fee for day trippers kicks off on April 25. Here's how to pay, and how to claim an exemption if you're staying in the city."
2024-01-16 16:05:32,Trump's trial in E. Jean Carroll defamation case begins,A jury will be asked to decide how much in damages former President Donald Trump must pay E. Jean Carroll for his 2019 defamatory statements about Carroll's sexual assault allegations. Follow the latest here.
2024-01-16 17:25:36,What we know about the women known as the 'Gilgo Four',Rex Heuermann has now been charged with killing four women whose bodies were discovered bound with belts or tape and wrapped in burlap along a stretch of Long Island's Gilgo Beach in 2010.
2024-01-16 18:22:16,Dow Jones Industrial Average Fast Facts,Read Fast Facts on CNN to learn about the Dow Jones Industrial Average.
2024-01-16 18:19:03,Tiger Woods Fast Facts,Read CNN's Fast Facts on Tiger Woods and learn more about one of the most successful golfers in history.
2024-01-16 18:14:20,Vanessa Redgrave Fast Facts,Read CNN Fast Facts about the life of award-winning actress Vanessa Redgrave.
2024-01-16 18:11:46,Paul Ryan Fast Facts,"Read CNN's Fast Facts on the former speaker of the US House of Representatives, Paul Ryan."
2024-01-16 18:06:03,Amy Coney Barrett Fast Facts,Read CNN's Fast Facts about the life of US Supreme Court Justice Amy Coney Barrett.
2024-01-16 18:03:51,Barack Obama Fast Facts,Read Barack Obama Fast Facts from CNN to learn more about the 44th president of the United States.
2024-01-16 17:56:57,Lloyd Austin Fast Facts,View CNN's Fast Facts on Lloyd Austin and learn more about the US Secretary of Defense.
2024-01-16 17:53:20,Nicolas Sarkozy Fast Facts,See CNN's Nicolas Sarkozy Fast Facts for a look at the life of the former president of France.
2024-01-16 17:51:20,Wayne Gretzky Fast Facts,"Read CNN's Fast Facts about Wayne Gretzky and learn about the Hall of Fame hockey player called ""The Great One."""
2024-01-16 17:49:17,Ray Rice Fast Facts,Read CNN's Fast Facts about Ray Rice and learn more about the former NFL running back.
2024-01-16 19:26:36,2024 Presidential Candidates Fast Facts,Read CNN's Fast Facts to learn more about the 2024 presidential candidates.
2024-01-16 19:22:44,Australian Open Fast Facts,"Read CNN's Fast Facts about the Australian Open, one of four competitions that make up the ""Grand Slam"" in professional tennis."
2024-01-16 19:20:19,Winter Olympic Competitions Fast Facts,Read CNN's Winter Olympics Fast Facts to learn more about the athletic competitions.
2024-01-16 22:16:36,John Reed Fast Facts,Read CNN's Fast Facts about John Reed and learn more about the former Citigroup CEO.
2024-01-16 22:15:16,Elton John Fast Facts,"View CNN's Fast Facts to learn more about Elton John, the award-winning singer, composer and pianist."
2024-01-17 00:58:07,CNN town hall with Ron DeSantis,"Republican presidential candidate Ron DeSantis is participating in a live CNN town hall in New Hampshire tonight, one week before the state's primary and a day after the Iowa caucuses. Follow here for the latest."
2024-01-17 04:58:28,"January 16, 2024 Israel-Hamas war","Israel's defense minister says the intensive stage of the country's military offensive in Gaza will ""end soon."" Follow live updates."
2024-01-17 12:58:14,The latest on the 2024 primary campaign,Former President Donald Trump and GOP rivals Ron DeSantis and Nikki Haley are making their final appeals to New Hampshire voters ahead of next week's primary. Follow here for the latest updates from the campaign trail.
2024-01-17 13:29:52,Trump's trial in E. Jean Carroll defamation case,A jury will be asked to decide how much in damages former President Donald Trump must pay E. Jean Carroll for his 2019 defamatory statements about Carroll's sexual assault allegations. Follow the latest here.
2024-01-17 16:20:37,King Charles III Fast Facts,"Read CNN's Fast Facts on King Charles III, King of the United Kingdom and other Commonwealth realms."
2024-01-17 19:04:48,Princess Catherine Fast Facts,"Read CNN's Fast Facts about the Princess of Wales, the former Kate Middleton."
2024-01-17 19:01:31,Jay Inslee Fast Facts,Read CNN's Jay Inslee Fast Facts to learn more about the governor of Washington and former 2020 Democratic presidential candidate.
2024-01-18 00:30:28,January 17 - Trump's trial in E. Jean Carroll defamation case,A jury will be asked to decide how much in damages former President Donald Trump must pay E. Jean Carroll for his 2019 defamatory statements about Carroll's sexual assault allegations.
2024-01-18 02:52:52,January 17 - 2024 campaign updates,Former President Donald Trump and GOP rivals Ron DeSantis and Nikki Haley are making their final appeals to New Hampshire voters ahead of next week's primary.
2024-01-18 05:00:22,"January 17, 2024 Israel-Hamas war","The US carried out another round of strikes in Yemen against the Houthis, according to two US officials, marking the fourth time the US has struck the Iran-backed rebel group in less than a week."
2024-01-18 12:58:48,The latest on the 2024 primary campaign,Donald Trump and GOP rivals Nikki Haley and Ron DeSantis are making their final appeals to New Hampshire voters ahead of the state's pivotal 2024 primary contest. Follow here for the latest live news updates from the campaign trail.
2024-01-18 13:35:06,Trump's trial in E. Jean Carroll defamation case,A jury will be asked to decide how much in damages former President Donald Trump must pay E. Jean Carroll for his 2019 defamatory statements about Carroll's sexual assault allegations. Follow the latest here.
2024-01-18 19:19:54,Primetime Emmys Fast Facts,Read CNN's Fast Facts about the Primetime Emmy Awards.
2024-01-18 19:16:10,Jerome Powell Fast Facts,"Read CNN's Fast Facts about Jerome ""Jay"" Powell to learn about the Federal Reserve chairman."
2024-01-18 19:14:09,Meta Fast Facts,Read CNN's Meta Fast Facts to learn about the social media giant.
2024-01-18 19:58:47,2024 Presidential Debates Fast Facts,Read CNN's Fast Facts to learn more about the 2024 presidential debates.
2024-01-18 22:40:50,January 18 - Trump's trial in E. Jean Carroll defamation case,A jury will be asked to decide how much in damages former President Donald Trump must pay E. Jean Carroll for his 2019 defamatory statements about Carroll's sexual assault allegations.
2024-01-19 01:45:59,CNN town hall with Nikki Haley,"GOP presidential candidate Nikki Haley is participating in a CNN town hall tonight in New Hampshire, with just days until the state's pivotal 2024 primary contest. Follow here for the latest live news updates."
2024-01-19 11:24:41,This train route is being revived after over 100 years,A direct railway link across the Italy-Slovenia border as part of a new Milan-Ljubljana train is bringing back the infrastructure of the Austro-Hungarian Empire.
2024-01-19 13:21:33,Final sprint to the New Hampshire primary,"GOP candidates Donald Trump, Nikki Haley and Ron DeSantis are making their final appeals to New Hampshire voters with just days until the state's pivotal 2024 primary contest. Follow here for the latest updates from the campaign trail."
2024-01-19 18:03:01,Nikki Haley Fast Facts,"Read CNN's Fast Facts on Nikki Haley, former US ambassador to the United Nations and former Republican governor of South Carolina."
