DATE,TITLE,SUMMARY
2024-01-01 05:21:19,"December 31, 2023 Israel-Hamas war","Israel's war against Hamas is at its ""highest level and will continue for months,"" Prime Minister Benjamin Netanyahu warned Saturday. Follow for live updates."
2024-01-01 08:53:26,"Powerful earthquake hits western Japan, triggering tsunami warnings","A 7.5 magnitude earthquake struck western Japan on Monday afternoon, triggering tsunami warnings. Follow here for live updates."
2024-01-01 14:58:40,"Powerful earthquake hits Japan, triggering tsunami warnings","A 7.5 magnitude earthquake struck western Japan on Monday afternoon, triggering tsunami warnings. Follow here for live updates."
2024-01-01 18:58:33,Israel to pull some troops from Gaza in war against Hamas,"The IDF said it expects warfare in Gaza to last ""throughout"" 2024 as it begins to reduce the number of soldiers in the territory and prepares for a new phase of the conflict. Follow for live updates."
2024-01-01 18:56:06,"Powerful earthquake hits Japan, causing damage and outages","A 7.5 magnitude earthquake struck western Japan on Monday afternoon, triggering tsunami warnings. Follow here for live updates."
2024-01-01 19:56:36,Multiple dead in powerful Japan earthquake,"A 7.5 magnitude earthquake struck western Japan on Monday, triggering tsunami warnings and leaving at least four people dead. Follow here for live news updates."
2024-01-02 04:59:16,"January 1, 2024 Israel-Hamas war","The IDF said it expects warfare in Gaza to last ""throughout"" 2024 as it begins to reduce the number of soldiers in the territory and prepares for a new phase of the conflict. Follow for live updates."
2024-01-02 05:46:48,"January 1, 2024 Japan earthquake","A 7.5 magnitude earthquake struck western Japan on Monday, triggering tsunami warnings and leaving at least four people dead. Follow here for live news updates."
2024-01-02 11:58:49,Japan Airlines jet bursts into flames after collision with quake-relief plane,A Japan Airlines plane burst into flames on landing at Tokyo's Haneda airport after it collided with an aircraft involved in earthquake relief efforts. This comes after a 7.5-magnitude earthquake struck the west coast of Japan a day earlier. Follow here for live news updates.
2024-01-02 13:05:13,Japan Airlines jet burst into flames after collision with quake-relief plane,A Japan Airlines plane burst into flames on landing at Tokyo's Haneda airport after it collided with an aircraft involved in earthquake relief efforts. This comes after a 7.5-magnitude earthquake struck the west coast of Japan a day earlier. Follow here for live news updates.
2024-01-02 15:17:08,The latest on Israel's war on Hamas,"Israel's military announced it would begin to withdraw thousands of soldiers from Gaza, but said it was preparing for fighting to last throughout 2024. Follow here for live news updates."
2024-01-02 15:11:21,The latest on the deadly Rochester crash,"A deadly car crash outside a New Year's concert in Rochester, New York, is being investigated as domestic terrorism,  according to a source familiar with the investigation. Follow here for the latest live news updates."
2024-01-02 18:32:46,Claudine Gay expected to resign presidency of Harvard University amid plagiarism allegations,"Embattled Harvard President Claudine Gay will resign Tuesday, according to The Harvard Crimson. The Crimson, citing a person with knowledge of the decision, said Gay will resign and that it is unclear who will be appointed to serve in the interim."
2024-01-02 19:35:23,Covid-19 Pandemic Timeline Fast Facts,"Read CNN's Fast Facts about the coronavirus outbreak, declared a pandemic by the World Health Organization."
2024-01-02 19:34:18,College Football Playoff Fast Facts,Read Fast Facts on CNN about the College Football Playoff and learn about the four-team seeded postseason format which replaced the BCS.
2024-01-02 19:30:49,Princess Catherine Fast Facts,"Read CNN's Fast Facts about the Princess of Wales, the former Kate Middleton."
2024-01-02 19:20:21,Claudine Gay resigns the presidency of Harvard University amid plagiarism allegations,Embattled Harvard President Claudine Gay resigned on Tuesday in a letter to the Harvard community. Follow along for the latest news.
2024-01-03 04:59:50,"January 2, 2024 Israel-Hamas war","Hamas said one of its senior leaders, Saleh Al-Arouri, was killed in an attack Tuesday in southern Beirut, Lebanon. Israel did not claim responsibility, although a US official told CNN that Israel carried out the strike."
2024-01-03 11:00:04,Italy divided over new pineapple pizza,"Pineapple pizza has always been a shunned food in Italy. But now, one of the country's best known pizza makers has created his own 'pizza all'ananas' -- leaving the country divided."
2024-01-03 10:56:18,This place was inhabited for centuries -- but has only recently had tourists,"Also known as al-Hijr or Mada'in Saleh, Hegra is the crown jewel of Saudi Arabia's archaeological attractions and was the first place in the country inscribed on the UNESCO World Heritage list."
2024-01-03 19:12:25,Michelle Obama Fast Facts,View the Michelle Obama Fast Facts from CNN and learn more information about the first lady and the wife of 44th US President Barack Obama.
2024-01-03 19:09:52,Dolly Parton Fast Facts,Read CNN's Fast Facts on Dolly Parton to learn more about the award-winning country music star.
2024-01-04 05:00:16,"January 3, 2024 Israel-Hamas war",A US official told CNN that Israel carried out the strike in Lebanon that killed senior Hamas leader Saleh Al-Arouri. Israel did not claim responsibility for the attack.
2024-01-04 13:57:39,The latest on the 2024 primary campaign,Republican presidential candidates are hitting the campaign trail in Iowa as they race to make their pitch to voters less than two weeks until the state's pivotal GOP caucuses. Follow here for the latest live news updates.
2024-01-04 16:31:19,"Multiple people shot at Perry High School in Iowa, sheriff says","Authorities are investigating a shooting at Perry High School in Perry, Iowa, according to Dallas County officials. The site has been secured, with law enforcement and medical staff on site. Follow for live updates."
2024-01-04 19:11:01,Michael Skakel Fast Facts,"View CNN's Fast Facts on Michael Skakel, convicted in 2002 of the 1975 murder of his neighbor, Martha Moxley. Skakel's conviction was vacated by the Connecticut Supreme Court in 2018."
2024-01-04 19:09:32,Jeff Bezos Fast Facts,Read CNN's Jeff Bezos Fast Facts to learn about the founder of Amazon.
2024-01-04 19:06:47,Benjamin Netanyahu Fast Facts,Read CNN's Fast Facts about former Israeli Prime Minister Benjamin Netanyahu.
2024-01-04 21:26:10,"One student killed, several wounded at Perry High School in Iowa, officials say","A student was killed and five people wounded in a shooting at Perry High School in Iowa, officials said Thursday.. Follow for live updates."
2024-01-04 23:41:34,CNN's town halls with DeSantis and Haley in Iowa,Florida Gov. Ron DeSantis and former South Carolina Gov. Nikki Haley are participating in back-to-back CNN presidential town halls tonight in Iowa — with just a week and a half to go until the state's pivotal Republican caucuses. Follow here for the latest live news updates.
2024-01-05 00:31:05,"January 4, 2024 - One student killed, several wounded at Perry High School in Iowa, officials say","A 17-year-old gunman killed a sixth grade student and wounded five other people Thursday at Perry High School near Des Moines, Iowa, authorities said."
2024-01-05 02:00:34,CNN town hall with Ron DeSantis,Florida Gov. Ron DeSantis and former South Carolina Gov. Nikki Haley are participating in back-to-back CNN presidential town halls tonight in Iowa — with just a week and a half to go until the state's pivotal Republican caucuses. Follow here for the latest live news updates.
2024-01-05 03:05:28,CNN town hall with Nikki Haley,Florida Gov. Ron DeSantis and former South Carolina Gov. Nikki Haley are participating in back-to-back CNN presidential town halls tonight in Iowa — with just a week and a half to go until the state's pivotal Republican caucuses. Follow here for the latest live news updates.
2024-01-05 04:15:32,CNN's town halls with DeSantis and Haley,Florida Gov. Ron DeSantis and former South Carolina Gov. Nikki Haley are participating in back-to-back CNN presidential town halls tonight in Iowa — with just a week and a half to go until the state's pivotal Republican caucuses. Follow here for the latest live news updates.
2024-01-05 04:58:27,"January 4, 2023 Israel-Hamas war",Israel's military intensified its ground offensive and issued new evacuation instructions in central and southern Gaza. Fleeing Palestinians say they have little access to food or water. Follow for live updates.
2024-01-05 11:48:34,The sexiest new hotels for 2024,"From LA to Bangkok, Madagascar to Transylvania, here are 24 of the best-looking new hotel openings for 2024."
2024-01-05 12:36:50,Wall Street awaits final jobs report of 2023,"Investors are expecting a slowdown in monthly job gains as the Federal Reserve's 11 rate hikes flow through the labor market. The US economy is expected to have added 160,000 jobs in December."
2024-01-05 14:58:43,"The US economy added 216,000 jobs last month, blowing past expectations","Investors were expecting a slowdown in monthly job gains as the Federal Reserve's 11 rate hikes flow through the labor market. Instead, the US economy added 216,000 jobs in December."
2024-01-05 14:00:10,The latest on the 2024 primary campaign,"Former President Donald Trump and other GOP presidential candidates are hitting the campaign trail in Iowa on Friday ahead of the state's pivotal caucuses. Meanwhile, President Joe Biden is set to deliver a speech in Pennsylvania. Follow here for the latest live news updates."
2024-01-05 15:45:14,Markets head for losing week after red-hot jobs report,"Investors were expecting a slowdown in monthly job gains as the Federal Reserve's 11 rate hikes flow through the labor market. Instead, the US economy added 216,000 jobs in December."
2024-01-05 19:28:00,ISIS Fast Facts,"Read CNN's ISIS Fast Facts to learn about the Islamic State in Iraq and Syria, also referred to as ISIL and IS."
2024-01-05 19:24:42,2023 In Review Fast Facts,Read CNN's 2023 in Review Fast Facts to learn more about the events of 2023.
2024-01-05 19:22:07,Oscar Pistorius Fast Facts,"Read CNN's Fast Facts about Oscar Pistorius, the South African ex-Olympic sprinter convicted in the shooting death of his girlfriend Reeva Steenkamp."
2024-01-05 21:41:46,Harvard student groups issued an anti-Israel statement. CEOs want them blacklisted,Billionaire hedge fund CEO Bill Ackman and several other business leaders are demanding Harvard University release the names of students whose organizations signed on to a letter blaming solely Israel for the deadly attacks by Hamas.
2024-01-05 21:03:48,Markets end the week lower after red-hot jobs report,"The major stock indexes fell Friday after the latest employment data from the Bureau of Labor Statistics showed the US economy added 216,000 jobs in December, far more than expected."
2024-01-05 22:13:29,The latest on the 2024 campaign and Trump Colorado appeal,"President Joe Biden and Former President Donald Trump are hitting the campaign trail Friday. Meanwhile, the Supreme Court said it will hear Trump's Colorado 14th Amendment appeal. Follow here for the latest live news updates."
2024-01-05 22:45:57,Jack Nicklaus Fast Facts,Read CNN's Fast Facts on Jack Nicklaus and learn more about the professional golfer.
2024-01-06 02:31:00,"January 5, 2024 - US election campaign news",The US Supreme Court said Friday it will review the Colorado Supreme Court's unprecedented decision removing former President Donald Trump from that state's ballot. The court has set oral arguments for February 8.
2024-01-06 05:00:27,"January 5, 2023 Israel-Hamas war","Israeli Defense Minister Yoav Gallant outlined post-war plans for Gaza that envision the enclave without Hamas control and with ""no Israeli civilian presence."""
2024-01-06 18:40:39,FAA grounds certain Boeing jets after Alaska Airlines emergency landing,"The FAA has temporarily grounded certain Boeing 737-9 Max aircraft after a section of an Alaska Airlines plane blew out of the aircraft mid-flight on Friday, officials said. Follow for live updates."
2024-01-06 19:28:23,Certain Boeing Max jets grounded after Alaska Airlines emergency landing,"The FAA has temporarily grounded certain Boeing 737-9 Max aircraft after a section of an Alaska Airlines plane blew out of the aircraft mid-flight on Friday, officials said. Follow for live updates."
2024-01-07 05:06:48,"January 6, 2024 Israel-Hamas war","The Israeli military dropped new flyers on neighborhoods in central Gaza on Saturday, urging Palestinians to evacuate. The UN says they have nowhere safe to go."
2024-01-07 21:20:53,Today's new in 10 minutes,"January 8, 2024"
2024-01-07 22:57:13,Golden Globe Awards 2024,The 81st annual Golden Globe Awards are being held at the Beverly Hilton Hotel tonight. Follow for live updates.
2024-01-07 23:55:20,Today's news in 10 minutes,"January 8, 2024"
2024-01-08 04:10:47,"""Oppenheimer"" and ""Succession"" are big winners at Golden Globes",The 81st annual Golden Globe Awards are being held at the Beverly Hilton Hotel tonight. Follow for live updates.
2024-01-08 04:58:27,"January 7, 2024 Israel-Hamas war",The IDF says it has completed the dismantling of Hamas' command structure in northern Gaza. Follow for live updates.
2024-01-08 04:36:00,Golden Globe Awards 2024,"Christopher Nolan's three-hour biography about J. Robert Oppenheimer cleaned up the major movie awards at the Golden Globes on Sunday night, including for best movie, best director and two of the acting awards. Follow live coverage."
2024-01-08 13:59:07,Final sprint to the Iowa caucuses,GOP presidential candidates are racing to make their pitch to Iowa voters with one week to go until the state's pivotal caucuses. Follow here for the latest live news updates.
2024-01-08 13:47:58,20 of the world's best soups,"If a bowl of soup strikes you as the ultimate in comfort, you've got plenty of company. Here are 20 of the world's best soups -- from Mexico to Thailand -- to fill stomach and soul."
2024-01-08 17:25:41,20 best German foods,"German food is more than a mere mix of beer, sauerkraut and sausage. Done well, it is rich, hearty and delicious. Check out our list of Germany's 20 best foods."
2024-01-09 01:56:44,January 8 -- 2024 campaign updates,GOP presidential candidates are racing to make their pitch to Iowa voters with one week to go until the state's pivotal caucuses.
2024-01-09 03:58:39,Today's new in 10 minutes,"January 9, 2024"
2024-01-09 05:33:32,"January 4, 2024 Israel-Hamas war",Israel's military intensified its ground offensive and issued new evacuation instructions in central and southern Gaza. Fleeing Palestinians say they have little access to food or water. Follow for live updates.
2024-01-09 05:04:50,"January 5, 2024 Israel-Hamas war","Israeli Defense Minister Yoav Gallant outlined post-war plans for Gaza that envision the enclave without Hamas control and with ""no Israeli civilian presence."""
2024-01-09 05:00:45,"January 8, 2024 Israel-Hamas war",US Secretary of State Antony Blinken has arrived in Tel Aviv ahead of key meetings with Israeli officials.
2024-01-09 11:14:03,Winter storm slams central and eastern US,"A fast-moving storm will unload strong winds, possible strong tornadoes, serious flooding, snow and blizzard conditions across the central and eastern US. Follow here for the latest."
2024-01-09 12:59:37,Trump's appeals hearing on presidential immunity claims,Donald Trump is expected to be in court as his lawyers argue the former president has immunity from prosecution related to his efforts to overturn the 2020 election. Follow here for the latest live news updates.
2024-01-09 14:03:07,Final sprint to the Iowa caucuses,GOP presidential candidates are racing to make their pitch to Iowa voters with less than a week to go until the state's pivotal caucuses. Follow here for the latest live news updates.
2024-01-09 14:29:38,2024 campaign updates,GOP presidential candidates are racing to make their pitch to Iowa voters with one week to go until the state's pivotal caucuses.
2024-01-09 22:21:17,January 8 -- 2024 campaign updates,GOP presidential candidates are racing to make their pitch to Iowa voters with one week to go until the state's pivotal caucuses.
2024-01-09 23:56:16,January 9 - 2024 campaign update,GOP presidential candidates are racing to make their pitch to Iowa voters with less than a week to go until the state's pivotal caucuses.
2024-01-09 23:46:04,You're trapped in a blizzard. Do you know what to do next to survive?,"Would you know what to do if you were stuck outdoors or in a car during a blizzard? Here's how to first avoid these dangerous winter storms, and then what to do if you're stuck in one."
2024-01-10 01:27:10,What to do if your flight is canceled or delayed,Here are some expert tips about what travelers should do when flights are delayed or canceled.
2024-01-10 04:59:37,"January 9, 2024 - Winter storm slams central and eastern US","An exceptionally powerful storm packing nearly every winter weather threat is tracking across the central and eastern US on Tuesday. More than 40 million people are under a severe storm threat, according to the Storm Prediction Center."
2024-01-10 05:06:03,"January 9, 2024 Israel-Hamas war","US Secretary of State Antony Blinken made clear to the Israeli government that Palestinians must be allowed to return to their homes in Gaza ""as soon as conditions allow,"" the top US diplomat said Tuesday. Follow for live updates. Follow for live updates."
2024-01-10 13:53:51,Final sprint to the Iowa caucuses,GOP candidates Ron DeSantis and Nikki Haley will face off in a CNN debate Wednesday night as they race to make their final appeals to Iowa voters with just days until the state's pivotal caucuses. Follow here for the latest live news updates.
2024-01-10 14:50:07,Martin O'Malley Fast Facts,Read CNN's Martin O'Malley Fast Facts and learn more information about the former Maryland governor.
2024-01-10 14:49:01,College Football Playoff Fast Facts,Read Fast Facts on CNN about the College Football Playoff and learn about the seeded postseason format which replaced the BCS.
2024-01-10 14:47:35,US School Violence Fast Facts,"Read Fast Facts from CNN about elementary, middle and high school (excludes colleges and universities) violence with fatalities, from 1927 to present."
2024-01-10 14:46:07,Lloyd Austin Fast Facts,View CNN's Fast Facts on Lloyd Austin and learn more about the US Secretary of Defense.
2024-01-10 14:44:55,Eric Holder Fast Facts,Read CNN's Fast Facts on Eric Holder and learn more about the life of the former US Attorney General.
2024-01-10 14:43:59,Charles Taylor Fast Facts,Read CNN's Fast Facts on Charles Taylor and learn more about the former president of Liberia and convicted war criminal.
2024-01-10 14:42:38,Golden Globe Awards Fast Facts,"Read CNN's Fast Facts about the Golden Globe Awards, which are presented by the Hollywood Foreign Press Association."
2024-01-10 21:08:44,Carlos Slim Fast Facts,See CNN's Carlos Slim Fast Facts for a look at the life of the billionaire executive.
2024-01-10 21:07:13,Dick Cheney Fast Facts,Read CNN's Fast Facts about Dick Cheney and learn more about the 46th vice president of the United States.
2024-01-10 21:06:13,Nolan Ryan Fast Facts,"Read CNN's Fast Facts about Hall of Fame pitcher Nolan Ryan. He played baseball for 27 seasons, won 324 games, and was on the All-Star Team eight times."
2024-01-10 21:05:57,"Delayed, lost or damaged luggage: What you should do",The prospect of airlines losing luggage looms larger than ever. Here's what to do to help prevent your baggage from being delayed or lost -- and what to do if it's gone forever.
2024-01-10 23:15:47,CNN GOP presidential debate with Ron DeSantis and Nikki Haley,GOP candidates Ron DeSantis and Nikki Haley will face off in a CNN debate Wednesday night as they race to make their final appeals to Iowa voters with just days until the state's pivotal caucuses. Follow here for the latest live news updates.
2024-01-11 05:00:04,"January 10, 2024 Israel-Hamas war","The US said Secretary of State Antony Blinken discussed ""ongoing efforts to minimize civilian harm"" in Gaza during a meeting with Palestinian Authority President Abbas in the West Bank. Follow for live news updates."
2024-01-11 13:41:49,Closing arguments in Trump's civil fraud trial in New York,The judge overseeing the New York civil fraud trial against former President Donald Trump is hearing closing oral arguments on Thursday. Follow here for the latest live news updates.
2024-01-11 13:08:34,The latest on the 2024 campaign and highlights from GOP debate,GOP candidates are racing to make their final appeals to Iowa voters with just days until the state's pivotal caucuses. Follow here for the latest live news updates.
2024-01-11 15:45:23,The sexiest new hotels for 2024,"From LA to Bangkok, Madagascar to Transylvania, here are 24 of the best-looking new hotel openings for 2024."
2024-01-11 19:17:17,Chris Christie Fast Facts,Read CNN's Fast Facts on former New Jersey Governor Chris Christie and learn about the presidential candidate.
2024-01-11 19:15:13,2011 Africa and Middle East Unrest Fast Facts,Read CNN's 2011 Africa and Middle East Unrest Fast Facts and learn more about the Arab Spring anti-government protests that began in Tunisia in 2010.
2024-01-11 18:26:09,Here are 5 ways to do good on MLK Day,"Martin Luther King Jr. Day is officially today, but it is always time to do something good. Here are a few creative ways people of all ages can help the world around them in honor of Dr. King."
2024-01-11 19:59:16,Hunter Biden's court appearance on federal tax evasion charges,"Hunter Biden has his first court appearance in his criminal tax case on Thursday in a federal court in Los Angeles. The president's son was charged with nine counts, including failure to file and pay taxes. Follow here for the latest live news updates."
2024-01-11 19:29:17,Strategic Petroleum Reserve Fast Facts,Read Fast Facts from CNN about the US Strategic Petroleum Reserve.
2024-01-11 19:23:59,2024 Presidential Debates Fast Facts,Read CNN's Fast Facts to learn more about the 2024 presidential debates.
2024-01-11 19:22:03,2024 Presidential Candidates Fast Facts,Read CNN's Fast Facts to learn more about the 2024 presidential candidates.
2024-01-11 22:09:24,Today's news in 10 minutes,"December 15, 2023"
2024-01-12 00:07:06,January 11 - 2024 campaign updates and highlights from GOP debate,GOP candidates are racing to make their final appeals to Iowa voters with just days until the state's pivotal caucuses. Follow here for the latest live news updates.
2024-01-12 01:26:19,US strikes Houthi targets as Israel-Hamas war rages,"The US and UK military have launched strikes against the Houthi rebels in Yemen Thursday, officials told CNN. Follow for live news updates."
2024-01-12 04:59:18,"January 11, 2024 Israel-Hamas war","The US and UK military have launched strikes against the Houthi rebels in Yemen Thursday, officials told CNN. Follow for live news updates."
2024-01-12 07:01:30,Powerful winter storm set to wallop eastern half of the US,"Another powerful storm is preparing to unleash blizzard conditions, severe thunderstorms, damaging winds and brutal cold across the eastern half of the US. Follow here for the latest."
2024-01-12 13:59:39,Final sprint to the Iowa caucuses,GOP presidential candidates are racing to give their final pitch to Iowa voters with just days until the state's pivotal caucuses kick off the 2024 primary contests. Follow here for the latest live news updates from the campaign trail.
2024-01-12 14:24:40,She's the only woman living on an island of convicted criminals,"Giulia Manca checked into an island hotel run by convicted criminals in 2011 looking for relaxing break. She liked it so much, she now lives there full time, the only woman on an island of male prisoners."
2024-01-12 17:07:15,Powerful winter storm hits eastern half of the US,"Another powerful storm is unleashing blizzard conditions, severe thunderstorms, damaging winds and brutal cold across the eastern half of the US. Follow here for the latest."
2024-01-12 17:04:54,9 places where you can walk in MLK Jr.'s footsteps,"From his homeland in the South to unexpected places far beyond America's shores, here are 10 places that shaped Martin Luther King Jr.'s passage through history."
2024-01-12 20:58:11,Frostbite can strike quickly. Here's what you need to know,"Frostbite is dangerous and can often happen quickly, depending on both the temperature and wind chill factor. Here's how to know if it's frostbite and how to treat it."
2024-01-12 21:28:35,What to do if your flight is canceled or delayed,Here are some expert tips about what travelers should do when flights are delayed or canceled.
2024-01-13 05:12:26,"January 12, 2024 Israel-Hamas war","The Houthis vowed to retaliate after the US and UK militaries launched joint strikes against multiple targets, and Israel hit back against a genocide case brought by South Africa to the UN's top court."
2024-01-13 05:08:49,Fresh US strikes on Houthi targets as Israel-Hamas war rages,"American warship USS Carney fired Tomahawk missiles in strike on a Houthi radar site in Yemen early Saturday local time, US Central Command says. Follow for live updates."
2024-01-13 19:32:27,US strikes more Houthi targets as Israel-Hamas war rages,"American warship USS Carney fired Tomahawk missiles in a strike on a Houthi radar site in Yemen early Saturday local time, US Central Command says. Follow for live updates."
