DATE,TITLE,SUMMARY
2024-11-24 19:33:47,Fetterman admits Dems 'sort of lost ourselves' on key election issue,"Sen. John Fetterman, D-Pa., said Democrats &quot;sort of lost ourselves&quot; on border security and immigration, resulting in the loss of Congress and the White House."
2024-11-24 21:08:17,Blinken questioned for State Department hosting in-house therapy sessions after Trump win,Secretary of State Antony Blinken received a fiery letter from Rep. Darrell Issa after it was reported that the State Department held therapy sessions following Trump&apos;s win.
2024-11-25 09:00:21,"'Be aware': House lawmakers describe what it's like living under threat by China, Iran",House lawmakers spoke with Fox News Digital about facing foreign threats from U.S. adversaries.
2024-11-25 09:00:00,"Trump's legal cases likely to die out amid impending White House return, experts say",Experts and attorneys say President-elect Trump&apos;s Georgia case will likely be dismissed amid his impending return to the White House while his New York hush money case remains a question mark.
2024-11-25 09:00:52,"Fighter pilot, decorated combat veteran Jeff Witt announces bid to fill Florida House seat vacated by Gaetz",Fighter pilot and decorated combat veteran Jeff Witt is entering the race to fill former Rep. Matt Gaetz&apos;s seat representing Florida&apos;s 1st congressional district.
2024-11-25 11:13:56,Ohio congressman vying to replace JD Vance in the Senate says Trump's agenda must be priority on 'Day One',"Rep. Mike Carey, among Ohio Republicans vying for JD Vance&apos;s Senate seat, said he&apos;s best equipped to implement President-elect Trump&apos;s agenda on &quot;day one.&quot;"
2024-11-25 14:15:44,"Trump urges Florida Republican to mount congressional bid: 'RUN, RANDY, RUN!'","President-elect Donald Trump urges Florida state Sen. Randy Fine to run for U.S. House seat, pledging his endorsement."
2024-11-18 12:25:51,Size of slim Republican House majority hangs on 3 uncalled races,There are still three uncalled House races that will determine the size of the Republican majority in Congress after the 2024 elections.
2024-11-25 15:46:43,"PETA protests Biden turkey pardon with 'Hell on Wheels' display, subliminal messaging to make people go vegan","PETA will bombard the streets of D.C. Monday with visceral cries of distressed turkeys and subliminal messages urging people to go vegan, as the White House participates in its annual turkey pardon tradition."
2024-11-25 16:00:36,New study finds DEI initiatives creating 'hostile attribution bias',A breakout study on DEI materials from the Network Contagion Research Institute found that they may cause psychological harm in the form of hostile attribution bias.
2024-11-25 16:50:25,"NY Dem Rep. Ritchie Torres dubs Gov. Kathy Hochul 'the new Joe Biden,' warns of potential 2026 election loss",Democratic Rep. Ritchie Torres described New York Gov. Kathy Hochul as &quot;the new Joe Biden&quot; and warned of a possible 2026 gubernatorial election loss.
2024-11-25 16:46:38,"Trump planning to lift Biden's LNG pause, increase oil drilling during 1st days in office: report","President-elect Donald Trump reportedly plans to &quot;go strong&quot; on overturning President Biden&apos;s climate policies, such as lifting a pause on LNG exports."
2024-11-25 16:39:52,"ICE group praises Trump for Homan, Noem picks to lead immigration team: ‘Fired up’",An ICE law enforcement association is supporting the picks of Thomas Homan and Kristi Noem to lead the Trump administration&apos;s deportation operation next year.
2024-11-25 17:46:37,Denver mayor says he’s prepared to go to jail over opposition to Trump deportations of illegal immigrants,Denver Mayor Mike Johnston says he is prepared to got to jail over the opposition to the mass deportation plan to be launched by President-elect Trump.
2024-11-25 19:15:23,'A lot of waste': Blackburn and Ramaswamy talk DOGE cuts,"Vivek Ramaswamy talked to Sen. Marsha Blackburn on her podcast, &apos;Unmuted,&apos; Monday about areas of focus for the new Department of Government Efficiency (DOGE)."
2024-11-25 18:50:35,"White House insists Biden, Harris have 'one of most successful administrations in history' despite 2024 loss","The White House released a memo that hailed the Biden-Harris administration as one of the most successful in history, despite losing the 2024 election."
2024-11-25 18:26:02,Biden does his final White House Thanksgiving turkey pardoning: 'Last time to speak here as your president',President Biden said the Thanksgiving turkey pardoning at the White House Monday is &quot;my last time to speak here as your president during the season.&quot;
2024-11-25 18:24:10,Special Counsel Smith seeks to dismiss Jan. 6 charges against Trump,"Special Counsel Jack Smith is asking a judge to drop all charges against President-elect Donald Trump stemming from Smith&apos;s investigation into the Jan. 6 U.S. Capitol breach, Fox News Digital has learned."
2024-11-25 20:19:43,Conservative satire outlet censored by Elon Musk-rival Bluesky: 'Chilling reminder',"&quot;It&apos;s ironic that the platform championing tolerance and freedom from Musk&apos;s influence is itself so intolerant of differing views,&quot; said Babylon Bee creator Kyle Mann."
2024-11-25 19:37:45,Gavin Newsom threatens intervention if Trump kills Biden's $7.5K EV tax credit,"Gov. Gavin Newsom revealed that he would offer Californians a $7,500 tax credit for electric vehicles if President-elect Trump gets rid of the rebate."
2024-11-25 18:24:10,"Special Counsel Smith seeks to dismiss Jan. 6 case, already dismissed classified records charges against Trump","Special Counsel Jack Smith is asking a judge to drop all charges against President-elect Donald Trump stemming from Smith&apos;s investigation into the Jan. 6 U.S. Capitol breach, Fox News Digital has learned."
2024-11-25 21:04:24,DNC union launches GoFundMe to help former staffers hit by massive layoffs after election losses,The union representing DNC staff launched a GoFundMe to raise money for those who were abruptly laid off last week – as some described the cuts as a &quot;betrayal&quot; of party values.
2024-11-25 20:33:58,Trump begins endorsing replacements to replenish GOP majority in House as Cabinet picks shrink lead,President-elect Trump began endorsing fellow Republicans this week to replace members of Congress who have vacated their seats to join Trump&apos;s Cabinet.
2024-11-25 18:24:10,"Special Counsel Smith seeks to dismiss Jan. 6 charges, appeal in classified records case against Trump","Special Counsel Jack Smith is asking a judge to drop all charges against President-elect Donald Trump stemming from Smith&apos;s investigation into the Jan. 6 U.S. Capitol breach, Fox News Digital has learned."
2024-11-25 18:24:10,"Judge grants Jack Smith request to dismiss Jan. 6 charges against Trump, appeal dropped in Florida docs case","The federal case against President-elect Donald Trump, which stemmed from Smith&apos;s investigation into the Jan. 6 U.S. Capitol breach, was dismissed on Monday."
2024-11-25 22:05:36,Fox News Politics: Prosecutorial Pass,"The Fox News Politics newsletter, with the latest updates on the Trump transition, exclusive interviews and more Fox News politics content."
2024-11-25 21:39:38,"Court upholds red state's ban on trans surgeries, treatments for minors",Missouri AG Bailey&apos;s court win makes Missouri the first state to uphold a law banning gender procedures and hormone treatments for minors.
2024-11-25 21:34:17,Congress has just weeks to avoid a partial government shutdown after Thanksgiving,Congress will only have a few weeks to avoid a partial government shutdown before the pre-Christmas deadline.
2024-11-26 02:52:35,Missouri law requiring photo ID to vote remains intact: 'Huge win for election security',Missouri Attorney General Andrew Bailey announced that a state law requiring a photo ID to vote was upheld in a court ruling on Monday.
2024-11-26 02:24:36,President-elect Trump appoints three key positions in White House offices,"President-elect Trump appointed James Braid, Alex Latcham and Matt Brasseaux to serve in key White House office positions, including the Office of Legislative Affairs."
2024-11-26 06:09:12,Washington governor-elect announces subcommittee to combat Project 2025,Washington governor-elect Bob Ferguson announced Monday that he is creating a subcommittee in his transition team to fight against Project 2025.
2024-11-26 08:00:07,Trump dropped Matt Gaetz after complaining about high political cost of defending him,"President-elect Trump quickly ditched former Rep. Matt Gaetz, R-Fla., after it became apparent that nothing could save his nomination for attorney general. Enter, stage left: Pam Bondi."
2024-11-26 09:00:15,Dem attorneys general prepare for legal battle with Trump after filing hundreds of challenges last term,At least half of America is represented by Democratic state attorneys general -- ones who have positioned themselves as foils once again to a Trump White House.
2024-11-26 09:00:11,Blinken set to testify on Afghanistan withdrawal in House amid looming contempt vote,"After months of requests and a looming contempt vote, Antony Blinken agreed to testify in front of the GOP controlled House under threat of contempt vote."
2024-11-26 10:53:34,What's next for this popular Republican governor after he leaves office?,What&apos;s next for popular Republican Gov. Chris Sununu when he leaves office in January after eight years of steering swing state New Hampshire?
2024-11-26 10:23:53,Kyrsten Sinema responds to Democrats admitting filibuster will help them stop Trump agenda: 'Schadenfreude',Sen. Kyrsten Sinema appeared amused by Senate Democrats now backing the filibuster after her former party had called for it to be abolished during the Biden administration.
2024-11-26 13:12:24,Federal judge blocks Biden labor protections for foreign farmworkers,"A federal judge in Kentucky blocked a Biden-Harris Labor Department rule, saying it would have allowed foreign farmworkers with H-2A visas to unionize."
2024-11-26 12:36:46,"With Trump pledging endorsement, Florida CFO will run for Matt Gaetz's former House seat","Florida CFO Jimmy Patronis will run to represent Florida&apos;s 1st Congressional District, Matt Gaetz&apos;s former House seat. Patronis will resign from his CFO role effective March 31."
2024-11-18 12:25:51,Size of slim Republican House majority hangs on 3 uncalled races,There are still three uncalled House races that will determine the size of the Republican majority in Congress after the 2024 elections.
2024-11-26 14:30:12,NYC elementary school blasted for teaching 'gender identity' course to kindergarteners,"An elementary school in New York released a course description for a kindergarten class on &quot;gender identity,&quot; which recently went viral online."
2024-11-26 15:30:58,"Incoming border czar Homan to join Texas Gov. Abbott at key border point, serve meals to troops","Incoming border czar Thomas Homan will join Texas Gov. Greg Abbott in Eagle Pass, Texas, on Tuesday, and will serve meals to troops stationed at the border."
2024-11-26 14:30:12,NY elementary school blasted for teaching 'gender identity' course to kindergarteners,"An elementary school in New York released a course description for a kindergarten class on &quot;gender identity,&quot; which recently went viral online."
2024-11-26 16:17:16,Glenn Youngkin 'personally invites' new Trump admin to settle in Virginia over Maryland and DC,Virginia Gov. Glenn Youngkin dropped a video inviting the Trump transition team and new administration members to settle in Virginia -- just across the Potomac from the White House.
2024-11-26 18:08:04,‘Deporter-in-chief’ Obama surpassed deportations under Trump’s first term,"As many Democrats are voicing discontent with President-elect Donald Trump’s plans to carry out mass deportations in his second term, some commentators are pointing out that former President Barack Obama oversaw millions of deportations, even earning the title “deporter-in-chief.&quot;"
2024-11-26 18:03:57,"Special Counsel Jack Smith's federal Trump cases cost taxpayers more than $50 million, financials show","Jack Smith&apos;s investigations into Donald Trump over the last two years have presumably cost American taxpayers more than $50 million, according to Department of Justice expenditure reports."
2024-11-26 19:19:20,Federal judge sides with SpaceX after environmental group tried to stop rocket launches,A federal judge sided with Elon Musk&apos;s SpaceX after a Texas-based environmental group attempted to halt rocket launches at one of its sites.
2024-11-26 15:30:58,"Incoming border czar Homan joins Texas Gov. Abbott, praises state's 'unprecedented success'","Incoming border czar Thomas Homan joined Texas Gov. Greg Abbott in Eagle Pass, Texas, on Tuesday, and will serve meals to troops stationed at the border."
2024-11-26 18:27:14,California Bay Area city considers ordinance blocking local resources from supporting Trump mass deportations,Redwood City&apos;s city council voted in favor of having staff draft an ordinance for future consideration that would restrict the city from cooperating with immigration authorities
2024-11-26 18:27:07,Tom Cotton slams ‘partisans and obstructionists’ in DOD reportedly plotting to block Trump plans,Tom Cotton blasted Austin and defense officials for reportedly prepping to push back on Trump&apos;s agenda.
2024-11-26 20:21:38,New wall construction at Texas border kicks off with family of slain Jocelyn Nungaray watching,"A 1,400-acre Rio Grande ranch purchase marks Texas’ latest step in border wall expansion, with a new mile-long section underway in the coming weeks."
2024-11-26 20:10:45,Biden administration seeking to finalize $6.6B loan to build EV factory before term ends,The Department of Energy (DOE) is working to finalize a $6 billion loan to fund construction for an electric vehicle facility in Georgia.
2024-11-26 21:17:03,Ilhan Omar blasts Harris-Walz campaign for courting Liz Cheney: 'Huge misstep',A member of the progressive &quot;squad&quot; criticized the Harris-Walz campaign for its GOP outreach that included advertising the support of Liz Cheney.
2024-11-26 21:01:10,Construction trade group leaders look forward to new leadership under Trump: 'Relief on the horizon',Leaders from two of the nation&apos;s top construction trade groups told Fox News Digital they are looking forward to the new Trump administration with hopes of fewer regulations.
2024-11-26 21:39:59,Trump team signs memorandum of understanding with Biden White House to formalize transition,President-elect Trump&apos;s transition team says it has signed a memorandum of understanding with the Biden White House to formally begin the transition process.
2024-11-26 21:34:11,"Expert touts Trump's energy sector nominations, outlines hopes for administration agenda to spark energy boom",Fox News Digital spoke to energy expert Gabriella Hoffman about what she hopes to see over the next four years under President-elect Trump&apos;s energy policies.
2024-11-26 21:27:22,"Numbers of Afghans, Chinese coming through key migrant crossing surged since 2021: report","The number of nationals coming from special interest countries like Iran, Afghanistan and Iran has increased dramatically in recent years amid a broader increase through the Darien Gap."
2024-11-26 15:30:58,Incoming border czar Homan issues warning in Texas to Dems opposing Trump deportations: 'Don't test us',"Incoming border czar Thomas Homan joined Texas Gov. Greg Abbott in Eagle Pass, Texas, on Tuesday, and will serve meals to troops stationed at the border."
2024-11-26 22:38:15,"Familiar faces, familiar places: The latest from Capitol Hill","You never know just who you&apos;ll run into at the Capitol on a busy day – particularly when something big, like Matt Gaetz&apos;s withdrawal from consideration for attorney general, transpires."
2024-11-26 22:23:19,Fox News Politics: First Order of Business,"The Fox News Politics newsletter, with the latest updates on the Trump transition, exclusive interviews and more Fox News politics content."
2024-11-27 00:04:14,"Trump jokingly offers child ""millions"" for hair during Florida golf outing",President-elect Trump offered a child millions of dollars to purchase a child&apos;s hair as a joke on Monday at his Florida golf course.
2024-11-27 01:24:07,Trump's approval ratings jump in post-election poll while Biden's figures sink to 4-year low,"Poll figures for President Biden dropped to a four-year low in dissatisfaction from voters over how he is running the country, the poll found."
2024-11-27 01:12:40,Trump demands New York AG Letitia James drop civil fraud case 'for the greater good of the country',"Lawyers for President-elect Trump are demanding New York AG Letitia James drop her civil fraud case against him, his family and his businesses &quot;for the greater good of the country.&quot;"
2024-11-27 00:35:26,US lawmakers react to ceasefire deal between Israel and Hezbollah,"U.S. lawmakers reacted Tuesday to the ceasefire deal reached between Israel and Hezbollah, with one suggesting the deal is nothing but a political football."
2024-11-27 02:18:58,"Jay Bhattacharya, prominent physician and economist, nominated by Trump for NIH director",Stanford-trained physician and economist Jay Bhattacharya has been nominated by President-elect Donald Trump to be the next director of the NIH.
2024-11-27 01:55:59,"Trump taps Jamieson Greer for US trade representative, announces more picks",President-elect Trump announced several appointments and nominations Tuesday night to serve in his next administration.
2024-11-27 01:24:07,"Trump's approval ratings jump in post-election poll, while Biden's figures sink to 4-year low","Poll figures for President Biden dropped to a four-year low in dissatisfaction from voters over how he is running the country, the poll found."
2024-11-12 21:35:56,Get to know Donald Trump's Cabinet: Who has the president-elect picked so far?,Donald Trump has begun selecting people to fill top administration jobs in Washington upon returning to the Oval Office in January. Trump beat Vice President Kamala Harris in the 2024 election.
2024-11-27 08:00:21,Trump hit for hiring loyalists like Pam Bondi: Doesn’t every president do that?,"The media has criticized President-elect Donald Trump for nominating people he expects will support him, such as Pam Bondi, but presidents including Joe Biden have done the same thing."
2024-11-27 09:00:55,History of the Thanksgiving turkey pardon: When the White House began the long-held holiday tradition,The annual turkey pardoning is a long-held Thanksgiving tradition for the White House. But the history of exactly when the pardon began &quot;gets tricky.&quot;
2024-11-27 09:00:31,"Legal challenges on administrative reach expected in Trump's deregulatory scheme, experts say","Biden-era regulations can be expected to be on the chopping block via legal challenges once President-elect Donald Trump takes office, experts say."
2024-11-27 09:00:09,Utah senator coaches GOP aides on strategy for streamlining Trump’s agenda through Congress,Sen. Mike Lee and the GOP steering committee are holding trainings for GOP staff ahead of budget reconciliation so that they can quickly move President-elect Donald Trump&apos;s policies through.
2024-11-27 08:56:45,"Reps McGovern, Massie urge Biden to pardon Julian Assange to 'send a clear message' on press freedom",U.S. Reps. James McGovern and Thomas Massie wrote a letter to President Biden urging him to pardon WikiLeaks founder Julian Assange to &quot;send a clear message&quot; on press freedom.
2024-11-27 12:15:46,"Trump tariffs will bring Mexico to the table, Texas Democrat says",Rep. Henry Cuellar believes Trump&apos;s threat of tariffs will &quot;definitely get Mexico to the table so we can solve the problem about immigration and fentanyl.&quot;
2024-11-27 12:00:31,"University of Austin weeds out DEI, replaces it with merit-based initiatives: VP","The University of Austin, focusing on free speech and debate, replaces DEI with merit-based values, aiming to counter modern campus culture issues."
2024-11-27 13:00:28,Trump's AG pick has ‘history of consensus building’,"If confirmed, those who worked with Bondi expect her to use her role as attorney general to crack down on drugs and trafficking—a playbook first espoused as Florida&apos;s top prosecutor."
2024-11-27 13:37:09,Mississippi runoff election for state Supreme Court justice is too close to call,"A runoff election in the state Supreme Court in Mississippi race is too close to call, with State Sen. Jenifer Branning and Justice Jim Kitchens neck and neck as of Wednesday morning."
2024-11-27 14:40:54,Kerry suggests Africans without electricity must pick 'the right kinds of electricity',"John Kerry suggests Africans without electricity should &quot;choose the right kinds of electricity,&quot; and the U.S. should help them pay for it."
2024-11-18 12:25:51,Size of slim Republican House majority hangs on 3 uncalled races,There are still three uncalled House races that will determine the size of the Republican majority in Congress after the 2024 elections.
2024-11-27 16:57:29,Cuomo joins Netanyahu’s legal defense team against ICC warrants as he mulls 2025 NYC mayoral run,"Former New York Gov. Andrew M. Cuomo joined Bibi Netanyahu&apos;s legal defense team this week, as the Israeli leader faces war crimes charges from the ICC."
2024-11-27 16:19:28,"Trump Cabinet nominees, appointees targeted with ‘violent, unAmerican threats’","Nearly a dozen of President-elect Donald Trump’s Cabinet nominees and other appointees tapped for the incoming administration were targeted Tuesday night with “violent, unAmerican threats to their lives and those who live with them,&quot; prompting a “swift&quot; law enforcement response, Fox News Digital has learned."
2024-11-27 18:01:20,Trump nominates former Pence military aide for new Ukraine post,"Former Pence national security adviser Lt. Gen. Keith Kellogg is reportedly favored for a Ukraine envoy spot in the new Trump administration, according to reports."
2024-11-27 18:47:27,Kamala Harris campaign aide admits she never surpassed Trump in internal polls,"A top adviser to Kamala Harris said internal campaign polls never saw her beating Trump, despite her public polling posture."
2024-11-27 18:40:36,Elon Musk says there's substantial ignorance about America's national debt,"Elon Musk, who has been sounding the alarm about America&apos;s national debt, claims many people do not even know about the U.S. debt problem."
2024-11-27 18:24:59,Here are the candidates most likely to fill JD Vance’s Senate seat,"Many candidates are vying to replace Vice President-elect JD Vance in the Senate, and a new poll gives a glimpse at who the top candidates are."
2024-11-27 18:47:27,"Harris never led Trump, internal polls showed — but DNC officials were kept in the dark","A top adviser to Kamala Harris said internal campaign polls never saw her beating Trump, despite her public polling posture."
2024-11-27 21:23:48,Democrat Derek Tran unseats Rep. Michelle Steel in California's 45th Congressional District,"U.S. Army Veteran Derek Tran has won California 45th Congressional District, unseating Rep. Michelle Streel in one of the state&apos;s most closely-watched races."
2024-11-27 21:19:19,"Ohio governor signs 'bathroom bill' into law, restricting students from using opposite-sex restrooms",Republican Ohio Gov. Mike DeWine has signed a bill into law that will prevent schools from allowing students of the opposite sex into restrooms and locker rooms.
2024-11-27 20:40:59,RNC rails against California's late mail-in ballot counting amid national litigation: 'It is absurd',"The RNC is suing states over policies accepting mail-in ballots up to 7 days post-Election Day, claiming it delays certification and harms election integrity."
2024-11-27 21:41:50,Iowa Rep. Mariannette Miller-Meeks beats Dem challenger in state's 1st Congressional District,Iowa Republican Rep. Mariannette Miller-Meeks squared up against Democratic challenger Christina Bohannan in the race for the state&apos;s 1st Congressional District.
2024-11-27 21:40:12,Homan taking death threats against him ‘more seriously’ after Trump officials targeted with violent threats,Trump border czar Tom Homan says his family has received death threats in the past and that the recent threats against Trump officials means he now takes them more seriously.
2024-11-27 16:19:28,"Trump Cabinet nominees, appointees targeted with 'violent, unAmerican threats'","Nearly a dozen of President-elect Trump’s Cabinet nominees and other appointees tapped for the incoming administration were targeted Tuesday night with “violent, unAmerican threats to their lives and those who live with them,&quot; prompting a “swift&quot; law enforcement response, Fox News Digital has learned."
2024-11-27 21:40:12,Homan taking death threats against him 'more seriously' after Trump officials targeted with violent threats,Incoming Trump border czar Tom Homan says his family has received death threats in the past and that the recent threats against Trump officials means he now takes them more seriously.
2024-11-28 00:58:36,Trump says Mexico will stop flow of migrants after speaking with Mexican president following tariff threats,President-elect Trump on Wednesday said he had a productive conversation with Mexican President Claudia Sheinbaum Pardo over the phone.
2024-11-28 02:27:28,Appeals court rules Texas has right to build razor wire border wall to deter illegal immigration: 'Huge win',A federal appeals court ruled Wednesday that Texas may build a razor wire border wall to deter illegal immigration into the Lone Star State.
