DATE,TITLE,SUMMARY
2024-11-04 21:47:47,"Ohio Secretary of State says Biden admin, leftist groups are pushing back on voter roll audits",Ohio Secretary of State Frank LaRose says the Department of Homeland Security is preventing him from fully auditing state voter rolls.
2024-11-04 21:40:34,Harris makes last-ditch appeal to Michigan’s Muslim voters,"Vice President Kamala Harris used her last trip to Michigan to make an appeal to the swing state&apos;s Muslim population, which has been upset over the ongoing war in Gaza."
2024-11-04 21:20:49,"Arizona county defends restoring 98,000 with unconfirmed citizenship to voter rolls","The Maricopa County Recorder&apos;s Office defends its decision to restore the voter status of individuals affected by a glitch impacting 218,000 voters."
2024-11-04 22:52:21,Fox News Politics: Just one more sleep 'til Election Day,"Get the latest updates from the 2024 campaign trail, exclusive interviews and more Fox News politics content."
2024-11-04 22:51:41,"Biden-Harris EPA funding 'radical, left-leaning' environmental groups calling to end fossil fuels: report",The House Energy and Commerce Committee released a report detailing Environmental Protection Agency&apos;s (EPA) funding.
2024-11-04 22:20:22,Pennsylvania judge allows Elon Musk's PAC to continue $1M a day giveaway,"Musk&apos;s America PAC is allowed to continue their $1 million a day contest through Nov. 5, according to a ruling by a Pennsylvania judge on Monday."
2024-11-04 22:15:19,"Trump, Harris focus on the future of America in closing ads of 2024 presidential campaigns",Former President Trump and Vice President Harris&apos; released their closing ads in a final pitch to voters for the 2024 presidential election cycle.
2024-11-05 00:06:50,Harris-Trump showdown: Where they stand on this top issue for voters,Immigration and border security has been repeatedly cited as a top issue for voters. Here&apos;s where former President Trump and Vice President Harris stand on how to handle the crisis.
2024-11-04 22:36:25,Here's what you need to know when polls close in battleground states on Election Day,Voters in each swing state will be allowed differing times when they can go to a polling place and cast their ballot on Election Day 2024.
2024-11-04 23:08:54,"'Trojan horse’ amendment could allow illegals to vote, New York experts say",New Yorkers are voting on an abortion amendment this election day that some experts are saying is a &quot;Trojan horse&quot; to allow illegals to vote.
2024-11-04 23:08:27,Trump rallies in Pennsylvania city with highest Hispanic population hours before polls open,"Former President Donald Trump rallied in the now-Hispanic-majority Berks County seat of Reading on Monday, home to Taylor Swift and famous pretzel bakeries."
2024-11-05 00:59:31,The rise of AI: When will Congress regulate it?,"While some behind the AI boom may be assuring Americans there&apos;s nothing to worry about, many are looking to their congressional representatives for answers – and intervention."
2024-11-05 00:34:44,Anti-trafficking activist exposes how ‘slave ledger’ is being used by smugglers to control migrants,"An anti-smuggling activist is sharing what he says is a ledger by smugglers of their victims and how much they owe to the cartels, shining a light on the border crisis."
2024-11-05 00:17:37,JD Vance suggests new campaign slogan for Kamala Harris: 'Nothing comes to mind',"In one of his last stops of the 2024 campaign, Sen. JD Vance addressed voters in Atlanta on Monday night."
2024-11-05 02:12:12,Colorado secretary of state reveals voting equipment passwords were posted online for 4 months,"Jena Griswold, the Democrat secretary of state for Colorado, revealed that voting equipment passwords were posted online for four months before they were noticed and taken down."
2024-11-05 02:51:13,AOC slapped with community note after claiming massive Puerto Rican rally had to do with anti-Trump movement,"Rep. Alexandria Ocasio-Cortez was slapped with a community note on an X post Sunday, suggesting a rally in Puerto Rico was part of an anti-Trump movement."
2024-11-05 02:43:07,"Trump touts endorsements from Joe Rogan, baseball legend's son in final battleground pitch: 'Golden age'","Former President Donald Trump addressed supporters in Pittsburgh in his final pitch to Keystone State voters, touting there will be a &quot;golden age&quot; if elected."
2024-11-05 02:29:33,"Russia remains 'active threat' in influencing 2024 election, likely to focus on swing states: U.S. officials",Intelligence officials say that Russian actors are actively trying to meddle with the Nov. 5 election by disseminating fake videos meant to question election integrity.
2024-11-05 03:42:46,JD Vance blames economic woes on Harris leadership during election eve night rally in Pennsylvania,"While rallying on Election Day eve, Sen. JD Vance stopped in Newtown, Pennsylvania, where he told voters that Kamala Harris&apos; economic policy record proves she will not help their cost-of-living concerns."
2024-11-05 04:42:06,Tim Walz talks abortion during final campaign rally with Michigan voters: 'Everything is on the line',"In a barely five minute address to Michigan voters Monday night, Tim Walz spoke about abortion rights and insisted &quot;everything is on the line.&quot;"
2024-11-05 05:46:57,"At final Harris rally, Oprah warns a Trump presidency could end voting rights","Kamala Harris held her final rally before election day on the &quot;Rocky Steps&quot; of the Philadelphia Art Museum at Eakins Oval, where Oprah Winfrey warned about Trump and voting rights."
2024-11-05 05:37:41,Harris-Trump showdown: First votes cast at midnight in tiny New Hampshire township,"The first results of the 2024 election day show former President Donald Trump and Kamala Harris splitting the tiny town of Dixville Notch, New Hampshire&apos;s six votes."
2024-11-05 07:12:05,Trump says goodbye to 'big beautiful rallies' in last event before election,Former President Donald Trump bid farewell to his trademark rallies during an early morning event just hours before polls open in the critical swing state of Michigan.
2024-11-05 09:00:56,"Trump gets last-minute round of big-name endorsements including Joe Rogan, son of Roberto Clemente","On the eve of the election, President Trump received a round of last-minute endorsements from high-profile names, including Joe Rogan and the son of baseball legend Roberto Clemente Jr."
2024-11-05 09:00:31,"Harris, Trump conclude campaigning -now its up to the voters as Election Day 2024 gets underway","After nearly two years of campaigning, it&apos;s time for the voters to weigh in as Election Day 2024 arrives in the White House race between Vice President Kamala Harris and former President Trump"
2024-11-05 09:00:29,These ‘bellwether’ counties could determine next president,Election experts weigh in on what counties they will be watching on election night and which bellwether counties will matter most.
2024-11-05 09:00:17,What we know about Georgia's 4 million votes already cast ahead of Election Day,More than half of Georgia&apos;s active voters have already cast ballots heading into Election Day on Tuesday. Fox News Digital took a look at who those people are.
2024-11-04 19:43:16,Behind-the-scenes battles: Legal challenges that could impact the vote before Election Day begins,Lawsuits from Democrats and Republicans involving voting issues have made battleground states even more contentious before Election Day begins.
2024-10-22 12:18:10,Early votes top 81M in 2024 election,"Early in-person and mail-in ballots have begun pouring in across the country, and the tally in each state reveals mounting voter enthusiasm."
2024-11-05 12:00:24,"Abortion 'on the ballot' in 10 states this election, but it might not matter",Voters in 10 U.S. states will decide on major abortion provisions today. Here&apos;s how it could impact their vote.
2024-11-05 02:29:33,"Russia remains 'active threat' in influencing 2024 election, likely to focus on swing states: US officials",Intelligence officials say that Russian actors are actively trying to meddle with the Nov. 5 election by disseminating fake videos meant to question election integrity.
2024-11-05 13:00:46,GOP prepared for pivotal court battles that could decide 2024 election,Republicans have filed the majority of lawsuits in the run-up to Election Day to avoid many of the same pitfalls they say they encountered in 2020.
2024-11-05 13:00:10,'Very close': Nevada expert reveals which presidential candidate he predicts will win crucial battleground,An election expert in Nevada who has a perfect record of predicting elections in the state has predicted that Vice President Kamala Harris will narrowly win the Silver State.
2024-11-05 12:56:55,22 toss-up House races to watch on election night,Fox News provides a breakdown of the 22 House races ranked as Toss Ups in the 2024 election.
2024-11-05 12:44:42,State officials say lawyers ready to compel county election officials to swiftly certify vote if needed,Officials in battleground states say attorneys are ready to intervene if any counties try to stop the certification of votes in the 2024 election.
2024-11-05 12:40:39,"Trump slams Pelosi as 'evil, sick, crazy,' but stops short of profanity: 'It starts with a B'","Former President Donald Trump stopped just shy of calling former House Speaker Nancy Pelosi a profanity, saying that the word he had in mind, &quot;starts with a B.&quot;"
2024-11-05 14:09:26,9 competitive Senate races to watch on election night,"Nine competitive races in Michigan, Ohio, Pennsylvania, Wisconsin, Montana, Nebraska, Arizona, Maryland and Nevada could determine control of the Senate."
2024-11-05 14:04:41,Nigel Farage says Harris should pardon Trump if he loses,British Parliament member Nigel Farage says Kamala Harris should pardon Donald Trump if he loses the 2024 presidential election.
2024-11-05 13:49:54,4 governor's races to watch on election night,"There are four gubernatorial races that are being competitive, with New Hampshire being the hardest to call and is considered a toss-up, as former Sen. Kelly Ayotte takes on Joyce Craig."
2024-11-05 09:00:31,"Harris, Trump conclude campaigning – now it's up to the voters as Election Day 2024 gets underway","After nearly two years of campaigning, it&apos;s time for the voters to weigh in as Election Day 2024 arrives in the White House race between Vice President Kamala Harris and former President Trump"
2024-11-05 15:42:37,Voting on Election Day: Here's when polls close for all 50 states,Polls cross the country will remain open until at least the early evening local time as Americans cast their ballots on Election Day.
2024-11-05 15:36:13,AOC chimes in after JD Vance refers to Kamala Harris as 'trash',Rep. Alexandria Ocasio-Cortez commented after Sen. J.D. Vance called Vice President Kamala Harris &quot;trash.&quot;
2024-11-05 15:29:12,GOP senator sends warning to Biden admin about obligations for potential Trump transition,Sen. Bill Hagerty is reminding the federal government of its obligations in the event of a presidential transition ahead of the upcoming election.
2024-11-05 17:08:32,Pennsylvania county extends voting hours after 'software issue' with scanning ballots,Polls in a key Pennsylvania county will be open for an additional two hours Tuesday following a malfunction with ballot scanners.
2024-11-05 16:52:18,Indiana House GOP candidate arrested on eve of election,"A Republican candidate for Indiana’s House of Representatives was arrested on the eve of his election for allegedly violating a protection order, according to the Lafayette Journal &amp; Courier."
2024-11-05 16:44:09,"GOP Pennsylvania poll watchers admitted after initially being turned away, RNC says",Republican National Committee co-Chair Lara Trump says GOP poll watchers are now being let into facilities in Pennsylvania after they initially were turned away this morning.
2024-11-05 16:25:23,"Harris greets Pennsylvania family on porch, suggests staging 'door knock'","Kamala Harris joined canvassers in Reading, Pennsylvania, Monday, telling one family she wanted to &quot;door knock&quot; rather than speak with them on their porch."
2024-11-05 18:18:47,Harris spends last few campaign moments with 'Squad' member AOC,"Vice President Harris made one of her final campaign stops in Pennsylvania alongside Rep. Alexandria Ocasio-Cortez, D-N.Y., a member of the progressive “Squad.&quot;"
2024-11-05 17:50:54,"Trump casts vote in Palm Beach, says 'this was the best campaign we ran'",Former President Donald Trump after casting his vote in Florida on Election Day declares that &quot;this was the best campaign we ran.&quot;
2024-11-05 15:42:37,2024 voting: Here's when polls close for all 50 states on Election Day,Polls cross the country will remain open until at least the early evening local time as Americans cast their ballots on Election Day.
2024-11-05 21:07:57,"Adams, potential NYC mayoral challengers to rally support at Puerto Rico conference day after Election Day","New York City Mayor Eric Adams said he &quot;would like to go&quot; to the SOMOS conference in Puerto Rico, as a federal indictment complicates his re-election bid."
2024-11-05 20:51:29,"Battleground states' recount rules vary widely, here's a look at how they work",The recount rules vary widely among all seven battleground states.
2024-11-05 20:23:47,Obama releases Election Day video saying 'this is going to be close',Former President Barack Obama has released an Election Day video saying the contest between Donald Trump and Kamala Harris is &quot;going to be close.&quot;
2024-11-05 21:38:13,When will we know who won the US election?,Here is what you need to know about the 2024 presidential election results.
2024-11-05 23:15:18,Major battleground states extend polling hours in key precincts: What to know,"Several battleground states extended the hours of polling sites on Tuesday, citing unexpected wait times, technical issues, and other issues for voters in key precincts."
2024-11-05 23:25:12,Fox News Voter Analysis: Is this a change election? Top issues and mood of the nation as voters weigh in,"As the nation waits for the election results, voters way in on the issues facing the country and which candidate will being the change they are looking for."
2024-11-06 01:00:42,"Milwaukee orders recount of 31,000 absentee ballots, likely delaying results in Wisconsin","Some 30,000 absentee ballots in Milwaukee need to be recounted, likely delaying the results in the key swing state of Wisconsin, election officials said."
2024-11-06 01:00:02,Fox News Decision Desk projects Rick Scott Senate re-election win in Florida,"The Fox News Decision Desk projected Sen. Rick Scott will win a second term in the Senate, defeating a former Democrat congresswoman who challenged him for the seat."
2024-11-06 00:44:44,Longtime state attorney general elected governor in this red bastion,"The Fox News Decision Desk projects that Republican attorney general Patrick Morrisey of West Virginia will succeed GOP Gov. Jim Justice as the red-leaning state&apos;s governor, defeating Democrat Steve Williams"
2024-11-06 00:30:02,Fox News projects Justice victory in West Virginia as GOP flips Senate seat,The Fox News Decision Desk projects that Republican Gov. Jim Justice of West Virginia will defeat the Democrat Party&apos;s nominee - Wheeling mayor Glenn Elliott - as the GOP flips a seat
2024-11-06 00:27:44,Blue state Republican governor wins re-election to a fifth term in office,"Fox News projects that ​Republican Gov. Phil Scott of Vermont will win a fifth two-year term in office, defeating Democratic Party challenger Esther Charlestin."
2024-11-06 02:03:03,Fox News projects Republican Kelly Armstrong will win North Dakota governor's race,"U.S. Rep. Kelly Armstrong, R-N.D., is projected to win the North Dakota gubernatorial race, replacing sitting Gov. Doug Burgum, who ran for president."
2024-11-06 02:00:36,Fox News Decision Desk projects Democrats hold onto Senate seat in New Mexico,"The Fox News Decision Desk projects that Democrat Sen. Martin Heinrich of New Mexico will defeat Republican Senate nominee Nella Domenici, in a one-time swing state that now leans blue."
2024-11-06 01:41:39,Babydog goes to Washington: West Virginia's Justice flips Senate seat red,"Republican Gov. Jim Justice of West Virginia and his beloved dog, Babydog Justice, is headed to Washington D.C. after the Fox News Decision Desk has projected that he wins the Senate seat."
2024-11-06 01:24:55,Fox News projects Mike Kehoe to win Missouri governor's race,The Fox News Decision Desk projects Republican Lt. Gov. Mike Kehoe to win the open Missouri governor&apos;s race.
2024-11-06 03:16:00,Fox News projects Democrat wins governor's seat in Biden's home state of Delaware,"The Fox News Decision Desk projects Democrat Matt Meyer succeeded in keeping his party in control of Delaware, the home state of President Biden, after winning the state&apos;s governor&apos;s race."
2024-11-06 03:12:05,Rick Scott significantly improves his margin of victory with first re-election to Senate,"Florida GOP Sen. Rick Scott significantly improved his margin of victory in 2024 compared to his razor-thin victory in 2018, when he first joined the Senate."
2024-11-06 03:08:32,Fox News projects Gov. Spencer Cox to win Utah governor's race,Incumbent Republican Utah Gov. Spencer Cox and longtime Democratic Utah state Rep. Brian King battled in a race for the Utah governor&apos;s mansion Tuesday.
2024-11-06 03:03:55,Republican Gov. Greg Gianforte wins re-election in Montana,"The Fox News Decision Desk projects Republican Gov. Greg Gianforte will be re-elected to serve a second term as Montana governor, defeating Democratic nominee Ryan Busse."
2024-11-06 02:45:11,"Fox News Decision Desk projects Dem defeats Larry Hogan in Maryland, keeping Senate seat blue",Democrat Angela Alsobrooks is projected to win blue-state Maryland&apos;s competitive Senate race over former Republican Gov. Larry Hogan in a race that may determine the chamber&apos;s majority
2024-11-06 02:36:22,Republicans hold onto the most highly contested governor's seat this year,"Fox News projects former Sen. Kelly Ayotte, the Republican gubernatorial nominee in New Hampshire, will defeat Democratic nominee and former Manchester Mayor Joyce Craig to succeed retiring GOP Gov. Chris Sununu."
2024-11-06 02:32:44,"Fox News Decision Desk projects Ted Cruz wins third term, defeating Dem Colin Allred","The Fox News Decision Desk projected that incumbent Texas Sen. Ted Cruz would defeat his Democrat opponent Rep. Colin Allred Tuesday, winning a third term in the U.S. Senate."
2024-11-06 02:31:57,Fox News projects Sen. Mike Braun wins Indiana governor's race,Republican Sen. Mike Braun and Democrat Jennifer McCormick competed against third party candidates in the race to replace outgoing Indiana Gov. Eric Holcomb.
2024-11-06 02:28:16,"DeSantis claims victory over Florida abortion, marijuana amendments as supporters celebrate: 'Praise God'",Florida Gov. Ron DeSantis declared Tuesday that an amendment that would have created a constitutional right to abortion and another that would have legalized marijuana failed.
2024-11-06 02:19:50,Elon Musk reveals his political PAC's future amid tight presidential race,The Tesla and Space X CEO suggested Tuesday night he will continue to be deeply involved in politics nationwide even after the presidential election.
2024-11-06 04:08:59,College students at Liberty University in Virginia make 'huge line' to vote in presidential election: video,A video of Liberty University students lined up to vote in Virginia on social media underscored the participation of both GenZ voters and the Old Dominion State in the 2024 election.
2024-11-06 04:03:20,Delaware Democrat Sarah McBride projected to become first transgender member of Congress: AP,"Sarah McBride, a Delaware state senator, is projected to become the first openly transgender U.S. House member after defeating Republican John Whalen III."
2024-11-06 03:53:07,Fox News projects state Attorney General Josh Stein will win North Carolina governor's race,The Fox News Decision Desk projects North Carolina Attorney General Josh Stein will win the state&apos;s high-stakes gubernatorial election over Republican Lt. Gov. Mark Robinson.
2024-11-06 03:20:06,Florida's progressive abortion amendment fails following DeSantis push against 'bait and switch' legislation,A high-stakes abortion amendment in Florida has failed following a long-fraught battled against the progressive legislation by Republican Gov. Ron DeSantis.
2024-11-06 05:10:36,Biden-district Republican Nick LaLota projected to win re-election in New York,Rep. Nick LaLota&apos;s matchup against former CNN anchor John Avlon took place in an economically diverse district in suburban New York.
2024-11-06 05:00:57,'Fascist': Liberal critics melt down after Florida voters reject abortion rights amendment,"Liberal critics slam Florida and Gov. Ron DeSantis after voters in the state rejected an amendment that would have created a constitutional right to abortion, calling it &quot;fascist.&quot;"
2024-11-06 04:53:54,Fox News Decision Desk projects GOP takes back Senate majority in devastating blow to Dems,The Fox News Decision Desk projected that Republicans will be able to take back the Senate majority after winning enough races in the 2024 elections.
2024-11-06 04:50:37,Fox News Decision Desk projects Republican Deb Fischer holds Senate seat despite independent challenge,"The Fox News Decision Desk projected that Fischer would hold onto her Senate seat in Nebraska, despite the challenge from independent candidate Dan Osborn."
2024-11-06 04:48:04,Fox News projects Trump to win key state of North Carolina,Fox News projects former President Trump to defeat Vice President Harris in the state of North Carolina and win its key 16 electoral votes.
2024-11-06 04:31:28,Most vulnerable House Republican projected to lose NY swing seat,First-term Republican Rep. Brandon Williams was defeated by moderate Democratic challenger and New York state lawmaker John Mannion.
2024-11-06 04:23:41,Speaker Mike Johnson wins re-election to House in Louisiana's 4th Congressional District,Republican House leader Mike Johnson was declared victorious Tuesday night in his effort to keep Louisiana&apos;s 4th Congressional District seat.
2024-11-06 04:14:06,Fox News Decision Desk projects Bernie Moreno will flip Ohio Senate seat for GOP,"Fox News Decision Desk has projected a winner in the Ohio Senate race, which has been one of the most closely watched in the country as Republicans try to retake Senate control."
2024-11-06 06:02:39,The Hitchhiker’s Guide to the meaning of a Republican Senate - and What’s Ahead for the House,"The House and Senate could make history this election, with the Senate flipping to the GOP column and Democrats currently holding the seats needed to potentially win the House."
2024-11-06 05:57:11,Democrat Adam Schiff wins Dianne Feinstein's former Senate seat,"Rep. Adam Schiff won the late Dianne Feinstein&apos;s U.S. Senate seat, defeating GOP challenger and former MLB player Steve Garvey, the AP reported Tuesday night."
2024-11-06 05:52:27,Fox News projects Trump defeats Harris in Georgia,"The Fox News Decision Desk projects former President Trump has defeated Vice President Kamala in battleground Georgia, a critical state on the road to 270 Electoral College votes."
2024-11-06 05:25:28,"GOP Rep Monica De La Cruz projected to win re-election in Texas, fending off Democrat Michelle Vallejo",Republican Rep. Monica De La Cruz is projected to again defeat Democrat challenger Michelle Vallejo in Texas’ 15th Congressional District on Tuesday.
2024-11-06 05:18:34,Top Republican Bryan Steil's re-election in Wisconsin projected by Associated Press,Bryan Steil and Peter Barca competed in Wisconsin&apos;s 1st Congressional District in a race that will play a part in determining which party gains the House majority in the next Congress.
2024-11-06 05:14:14,GOP Rep Thomas Kean projected to survive Susan Altman's challenge in hotly contested New Jersey district,New Jersey voters cast their ballots Tuesday to select who will represent the Garden State&apos;s 7th congressional district.
2024-11-06 07:18:07,Harris will not speak from Howard University on election night as planned,"Vice President Kamala Harris&apos; campaign co-chair, Cedric Richmond, addressed those gathered at Harris&apos; alma mater at Howard University in the early morning hours of Wednesday."
2024-11-06 07:09:43,Democrat Rep. Jahana Hayes projected to defeat GOP challenger for 2nd time in Connecticut,Incumbent Democratic Rep. Jahana Hayes ran against Republican challenger George Logan to represent Connecticut&apos;s 5th Congressional District.
2024-11-06 07:04:14,Fox News projects Democrat AG Bob Ferguson to win Washington governor's race,Washington state has elected a new governor in the Evergreen State&apos;s first open gubernatorial contest since 2012 after Gov. Jay Inslee decided not to seek a fourth term.
2024-11-06 07:00:36,Voters in several states projected to approve constitutional amendments forbidding noncitizen voting,Voters in at least 7 states Tuesday approved amending their constitutions to explicitly ban noncitizens from voting in all elections.
2024-11-06 07:00:22,New Mexico Democratic Rep. Gabriel Vasquez projected to beat Trump-backed GOP challenger,"Democratic New Mexico Rep. Gabriel Vasquez squared off against Republican challenger Yvette Herrell in the toss-up, border-state House race."
2024-11-06 06:49:12,Progressive prosecutor in county where Laken Riley was found dead at hands of illegal migrant loses reelection,"The progressive prosecutor in the county where Laken Riley, a UGA student was found murdered by an illegal migrant, lost her reelection bid."
