DATE,TITLE,SUMMARY
2024-10-13 14:55:57,JD Vance warns of consequences for America if we continue to rely on 'Chinese slave labor',"Sen. JD Vance sounded the alarm on U.S. manufacturing on Sunday, telling Fox News that America has relied too long on Chinese &quot;slave labor.&quot;"
2024-10-13 15:49:51,Walz mocked after being caught on video struggling to load his own shotgun,Minnesota Gov. Tim Walz was the butt of social media jokes after he was caught on video struggling to load his own shotgun during a three-hour opening day pheasant hunt.
2024-10-13 15:41:47,"Migrant crime wave during Biden-Harris admin under scrutiny amid series of assaults, murders: A timeline","Here are some of the worst crimes allegedly committed by illegal immigrants in the last few years, amid a massive crisis at the southern border."
2024-10-10 16:00:13,Pro-defund police Dem in key race once threatened to 'kill' and 'bury' man over the phone: police records,New Mexico police records show Rep. Gabe Vasquez threatened to &quot;kill&quot; and &quot;bury&quot; a man over the phone before acknowledging he made the call and apologizing.
2024-10-13 18:03:19,Unknown drone fleet breached US military base airspace in Virginia for 17 straight days: report,"An unknown fleet of unmanned aircraft swarmed Langley Air Force Base in Virginia for 17 consecutive days late last year, the Wall Street Journal reported."
2024-10-13 17:54:26,Black group fires back at Obama for ‘insulting’ Harris pitch: 'Worst kind of identity politics',The Black Men for Trump advisory board took aim at former President Barack Obama for his statements appealing to Black men to vote for Vice President Kamala Harris.
2024-10-13 17:47:43,"Mayorkas calls on Congress to fund FEMA disaster relief, warning ‘hurricane season is not over’",Homeland Security Secretary Alejandro Mayorkas on Sunday warned that hurricane season isn&apos;t over and urged Congress to fund FEMA for future storms.
2024-10-13 17:45:37,Trump reveals which election issue is a 'bigger deal' than inflation and the economy,"Former President Trump joined Fox News&apos; Maria Bartiromo on &quot;Sunday Morning Futures&quot; for an exclusive and expansive interview, where he identified the border as a top 2024 issue."
2024-10-13 17:40:50,"US to deploy missile defense system, military personnel to Israel",President Biden approved the deployment of an advanced missile defense system to Israel along with roughly 100 U.S. troops.
2024-10-13 18:14:42,"Trump slams Biden's 'pathetic' correspondence with Netanyahu, reveals when he last spoke with world leader",Former President Trump slammed President Biden&apos;s relationship with Israel as &quot;pathetic&quot; after Biden went weeks without speaking with Prime Minister Netanyahu.
2024-10-13 19:38:22,Cringeworthy pro-Harris ad showcasing male support features professional actors,"A new political video featuring men &quot;man enough&quot; to vote for Vice President Kamala Harris is stacked with actors from the LA area, a review of the cast shows."
2024-10-13 21:00:21,Trump camp rips Harris over unearthed comments on renaming Columbus Day: 'Stereotypical leftist',The Trump campaign slammed Vice President Kamala Harris&apos; previous comments supporting renaming Columbus Day &quot;Indigenous People’s Day.&quot; in exclusive comment to Fox Digital.
2024-10-13 23:49:57,Trump receives unanimous endorsement from Border Patrol Union,The president of the National Border Patrol Council announced that the union for border patrol agents was fully supporting former President Trump.
2024-10-14 02:03:50,Catholics hold 'Rosary Rally' outside Gretchen Whitmer’s house after Doritos video sparks backlash,Catholics held a Rosary Rally outside the home of Michigan Gov. Gretchen Whitmer Sunday after she sparked backlash with a Doritos commercial that critics alleged was blasphemous.
2024-10-14 08:00:31,"Kamala Harris claims she's got a gun, but Second Amendment supporters say good luck getting yours","Kamala Harris recently drew the ire of Second Amendment advocates after claiming she owned a &quot;Glock,&quot; which contrasts with her previous support for bans and restrictions."
2024-10-14 08:00:15,AI sector frustrated by Congress' slow pace keeping up with the advanced tech,People who work with the AI sector have said the industry is dissatisfied with the rate at which Congress is moving to keep pace with the advanced technology.
2024-10-14 07:33:16,Massachusetts town issues cease and desist to resident projecting political signs on town water tower,Massachusetts town official warns resident projecting political signs onto the town&apos;s municipal water tower to stop or face fines.
2024-10-14 09:00:50,Harris unveils agenda to help Black men 'get ahead' as polls show Trump gains,VP Harris is rolling out a new agenda that aims to boost financial and career prospects for Black Men in the wake of Obama&apos;s warning amid polling that indicates Trump making gains.
2024-10-14 12:07:46,Trump and Harris poll in dead heat in NBC News survey as Election Day approaches,Vice President Kamala Harris and former President Donald Trump are polling neck and neck in an NBC News poll as Election Day draws near.
2024-10-14 12:00:04,Union workers in crucial swing state reveal issues driving their support for VP Harris: 'Very excited',Two supporters of Vice President Kamala Harris from Nevada&apos;s largest labor union spoke to Fox News Digital about why they are campaigning for the vice president in the leadup to the election.
2024-10-14 11:37:06,AAPI voters lean toward Harris over Trump on key issues in poll,"Vice President Harris is crushing former President Donald Trump among Asian Americans, Hawaiian natives and Pacific islanders, according to a new poll."
2024-10-14 12:55:04,Trends are good in the swing county GOP chair calls ‘Little Pennsylvania’: It’ll ‘be a repeat of ‘16’,"Erie County, Pennsylvania, Republican Party Chair Tom Eddy spoke to Fox News Digital in a recent interview on his party&apos;s ground game, what he is seeing in his swing area and the importance of voting early."
2024-10-14 12:40:54,Harris campaign deploys Bill Clinton to key states 22 days from Election Day,Bill Clinton is campaigning for Kamala Harris in the key battlegrounds of Georgia and North Carolina just three weeks shy of Election Day.
2024-10-14 14:52:49,Former GOP governor warns Harris admin will 'try to sneak through' healthcare benefits for illegal immigrants,"Former Louisiana Gov. Bobby Jindal is warning that a Medicare for All plan, which Vice President Kamala Harris has previously supported, would be an invitation to illegal immigrants."
2024-10-14 16:07:28,"Top House committee launches probe into Biden admin 'priorities' on FEMA hurricane relief, migrant spending",Republicans on the House Homeland Security Committee are investigating the Department of Homeland Security&apos;s priorities when it comes to disaster relief and funding for migrants at the southern border.
2024-10-14 15:57:46,Ohio GOP Senate challenger flips script on Dem incumbent's first campaign promises as poll numbers tighten,Fox News Digital spoke to Ohio GOP Sen. candidate Bernie Moreno about why polls are trending in his direction in his highly watched race that could determine Senate control.
2024-10-14 15:44:12,"Harris, Trump battle for the biggest of the battlegrounds: 'It's clearly ground zero'","With a margin-of-error race and just three weeks to go until Election Day, Vice President Kamala Harris and former President Trump on Monday each campaign in battleground Pennsylvania on Monday"
2024-10-14 15:29:20,Trio of new polls agree on where Trump and Harris stand with 3 weeks to go until Election Day,"With just over three weeks to go until Election Day, a trio of new national polls in the White House race indicate former President Donald Trump erasing recent gains made by Vice President Kamala Harris."
2024-10-14 15:21:29,"'Distrust and chaos': Georgia Dems, GOP battle over new ballot rule as early voting kicks off Tuesday",One of the biggest political fights in Georgia this election season will be over a new rule that all ballots must be hand counted after being tabulated by a machine.
2024-10-14 15:15:51,Biden warned Iran that killing Trump would be an act of war: report,President Biden reportedly instructed his National Security Council to make clear to Iran that any attempt on former President Trump’s life would be viewed as an act of war.
2024-10-14 17:03:19,Trump opens up largest betting lead since days after Biden's dropout,Former President Trump has opened up a betting lead over Vice President Kamala Harris in the race for president of over 10 points for the first time since July 31.
2024-10-14 16:53:25,Ban on gender treatments for kids defended by Republican AGs ahead of Supreme Court oral arguments,Tennessee Attorney General Jonathan Skrmetti and Missouri Attorney General Andrew Bailey defend the Volunteer State&apos;s ban on sex-change surgeries for minors as SCOTUS prepares to hear the case this fall.
2024-10-14 16:24:31,Columbus Day Flashback: Harris excoriated European explorers for 'wave of devastation' to Native peoples,Vice President Kamala Harris&apos; 2021 comments claiming the U.S. must &quot;not shy away&quot; from it&apos;s &quot;shameful past&quot; of European explorers resurfaced on social media this election cycle.
2024-10-14 17:54:35,"Bill Clinton suggests Laken Riley would still be alive if border 'properly' secured, hitting Republicans","The border was featured heavily in a speech by former President Bill Clinton in Georgia, where he is stumping for Vice President Kamala Harris."
2024-10-10 18:47:13,Trump announces his daughter Tiffany is pregnant: 'So that's nice',Former President Donald Trump shared his daughter Tiffany and husband Michael are expecting a baby while giving remarks at the Detroit Economic Club on Thursday.
2024-10-14 17:38:19,Harris goads Trump to release medical records after she gets clean bill of health from personal physician,Vice President Kamala Harris argued this weekend that former President Donald Trump is &quot;hiding&quot; from public appearances and attempted to goad him into releasing updated records about his health after she did so herself Saturday.
2024-10-14 15:57:46,Ohio GOP Senate challenger reacts to polls showing dead heat in critical Senate race: 'Radical liberal',Fox News Digital spoke to Ohio GOP Sen. candidate Bernie Moreno about why polls are trending in his direction in his highly watched race that could determine Senate control.
2024-10-14 14:52:49,Former GOP governor warns Harris admin will 'try to sneak through' health care benefits for illegal immigrants,"Former Louisiana Gov. Bobby Jindal is warning that a “Medicare-for-all&quot; plan, which Vice President Kamala Harris has previously supported, would be an invitation to illegal immigrants."
2024-10-14 18:50:46,Trump ally Tim Scott mulls bid for top role at Senate campaign arm,Tim Scott is considering running for a the top role at the Senate Republicans&apos; campaign arm for the next election cycle.
2024-10-14 18:24:50,'The left has perfected this': Conservatives take page from Obama's playbook in battleground Wisconsin,Turning Point Action is using a strategy focused on turning out likely conservative voters in Wisconsin that they say the left has been using for years.
2024-10-14 18:16:08,"Who is Vem Miller, man arrested outside Trump Coachella rally? 4 things to know","Vem Miller released an extensive statement detailing his political and profession history after his arrest at former President Trump&apos;s rally in Coachella, California."
2024-10-14 18:13:52,"Trump campaign hints at Election Day transportation options for voters impacted by Hurricanes Helene, Milton",Former President Trump&apos;s campaign hinted at Election Day transportation options for those in the Southeast impacted by Hurricane Helene and Hurricane Milton.
2024-10-14 19:51:37,"Afghan charged with Election Day terror plot raises questions, fears from lawmakers: ‘This is real’","An Election Day terror plot, allegedly being planned by an Afghan national who came to the U.S. in 2021, is raising new concerns about the numbers brought to the U.S."
2024-10-14 19:33:54,'Did not expect that': GOP Rep Luna speaks out after meeting with Biden on hurricane response,Rep. Anna Paulina Luna spoke with Fox News Digital about disaster recovery efforts in her area after Hurricane Milton.
2024-09-23 19:58:43,"Cruz race now a toss-up should be warning for Texas GOP, says expert","Sen. Ted Cruz, R-Texas, is facing a tight race with Rep. Colin Allred, D-Texas, something that should serve as a warning to Republicans hoping to keep the state red."
2024-10-14 21:11:15,Fox News Politics: Who is to blame for the border?,"The latest updates from the 2024 campaign trail, exclusive interviews and more Fox News politics content"
2024-10-14 20:56:59,"'Dumb thing for her to do': Rift between Harris and Biden camps causing internal disruptions, sources say","Sources close to the White House have expressed an ongoing rift between President Joe Biden and his staff and Kamala Harris and her staff, beginning as early as the first few weeks after Harris became the Democratic Party&apos;s new nominee."
2024-10-14 21:24:06,Harris doubles down with 'Indigenous Peoples' Day' post amid outrage over Columbus Day rhetoric,"Amid outrage over Vice President Kamala Harris&apos; previous rhetoric on ending the recognition of Columbus Day, Harris doubled down with an X post celebrating Indigenous Peoples’ Day."
2024-10-14 23:54:15,Kamala Harris accused of plagiarizing in 2009 book about being 'smart on crime',"Harris is accused of plagiarizing several times in her book on smart policing, which was released in 2009."
2024-10-14 23:48:59,User’s manual on what House races to watch on Election Night,"Election night in 2024 will not only determine who stands in the White House, but also may change the fate of who controls the House of Representatives."
2024-10-14 23:17:08,Hurricane-hit battleground states face additional voting hurdles in run-up to Election Day,Voters in storm-ravaged parts of North Carolina and other Southern states could have limited access to the polls this November.
2024-10-15 01:55:33,"Harris plays mashup of Trump’s 'enemy within' comments at Erie rally, shortly after crowd chants 'lock him up'","Vice President Kamala Harris spoke before an arena in Erie, Pennsylvania, where she queued up a montage of Donald Trump speaking about &quot;enemies within.&quot;"
2024-10-15 01:24:56,"Tim Walz boasts about having support of Dick Cheney, Bernie Sanders, Taylor Swift during Wisconsin rally","Minnesota Gov. Tim Walz boasted of having the support of Dick Cheney, Bernie Sanders and Taylor Swift, during a rally in Wisconsin on Monday."
2024-10-15 07:00:26,"As a cautious Kamala loses momentum, Democrats are panicking over a Trump win",What seemed to be an unstoppable hype train for the Kamala Harris campaign is now screeching to a halt – and the polls show it all too clearly.
2024-10-15 08:00:51,Fireworks expected in final Pennsylvania Senate debate in race that may decide chamber's majority,Democrat Sen. Bob Casey of Pennsylvania and Republican challenger Dave McCormick face off Tuesday in their final debate in a showdown that may decide if the GOP wins back the majority.
2024-10-15 08:00:51,BATTLEGROUND SERIES: Arizona's 11 electoral votes hinge on key swing county Biden won by a hair in 2020,"Maricopa County, Arizona will play a critical role in determining not only wins Arizona&apos;s electoral votes but who wins the White House, locals told Fox News Digital."
2024-10-15 08:00:40,Supreme court races in key states could tip scales on policy questions,"Unlike Georgia and Nevada, battleground states such as Arizona, North Carolina and Michigan will likely see high-stakes state supreme court races."
2024-10-15 09:00:15,"Early voting begins in Georgia, Utah","Early voting begins in Georgia and Utah on Tuesday, marking a total of 46 states and Washington, D.C., that have begun the election process."
2024-10-15 09:32:08,First on Fox: Top outside group backing Senate Republicans showcases fundraising haul,"In the battle for the Senate majority, the top super PAC supporting Republican incumbents and candidates says it hauled in $114.5 million during the July-September third quarter of 2024 fundraising."
2024-10-15 08:00:40,Supreme Court races in key states could tip scales on policy questions,"Unlike Georgia and Nevada, battleground states such as Arizona, North Carolina and Michigan will likely see high-stakes state Supreme Court races."
2024-10-15 12:00:57,Dem strategists ratchet up Hitler-Trump comparisons despite concerns about heated rhetoric,Two Democratic commentators recently compared former President Donald Trump to Adolph Hitler despite the multiple attempts to assassinate the former president.
2024-10-15 12:00:01,‘Boys playing girls’ sports’ ad lands Texas Dem in hot water with LGBTQ activists on eve of pivotal debate,"Rep. Colin Allred, running to unseat Sen. Ted Cruz in Texas, is facing pushback from some progressive activists in his own party for a recent campaign ad."
2024-10-15 11:31:33,"Harris touts her work on the economy, but what has she actually done for small businesses?","Vice President Kamala Harris has hit the campaign trail with ambitious plans to boost small businesses, but does her record match the rhetoric from her presidential campaign?"
2024-10-15 11:30:51,Trump resoundingly endorses Texas Sen. Ted Cruz ahead of Tuesday night Senate debate,Former President Donald Trump is supporting Sen. Ted Cruz&apos;s reelection bid as the Texas Republican faces Democratic challenger Rep. Colin Allred in the 2024 election.
2024-10-15 11:26:19,"Harris holds big advantage among early voters, Trump with Election Day voters: poll","Vice President Kamala Harris holds a commanding lead over former President Trump in support from early voters, according to a new NBC News poll released Tuesday."
2024-10-15 12:57:12,Fox News Power Rankings: Harris loses her lead and a new electorate emerges,The latest Fox News Power Rankings show a tighter presidential race than ever before.
2024-10-15 11:28:02,"'Squad' member calls Netanyahu a 'genocidal maniac,' sparking backlash from Israeli ambassador to the UN","Rep. Rashida Tlaib, D-Mich., is drawing criticism from an Israeli official for her post on X calling Prime Minister Benjamin Netanyahu a &quot;genocidal maniac.&quot;"
2024-10-15 12:31:44,"Trump lawyers request to move New York criminal case to federal court, citing SCOTUS immunity ruling",Lawyers for former President Donald Trump on Tuesday requested that his New York criminal case be transferred to federal court.
2024-10-15 12:30:52,"Harris' off-putting manner put Zelenskyy on defensive ahead of Russian invasion, new book reveals","Vice President Kamala Harris&apos;s adversarial demeanor was off-putting to Ukraine&apos;s president in the days before Russia&apos;s invasion, according to journalist Bob Woodward&apos;s new book &quot;War.&quot;"
2024-10-15 13:59:09,GOP governor slams ‘unprecedented’ DOJ lawsuit over removal of noncitizens from voter rolls,The Virginia governor&apos;s office is defending itself against what it says is an &quot;unprecedented&quot; lawsuit by the DOJ targeting its efforts to purge noncitizens from voter rolls.
2024-10-15 13:18:11,Trump cuts Pennsylvania town hall short over medical emergencies in crowd,Former President Donald Trump stopped questions at a town hall event after two medical emergencies took place in the Pennsylvania crowd.
2024-10-15 14:52:05,'Ruining our car industry': Biden-Harris EV regs prove flashpoint in Michigan Senate debate,"Republican former Rep. Mike Rogers and Democratic Rep. Elissa Slotkin argued over EV mandates, abortion, immigration, and gun control during a tense debate in Michigan."
2024-10-15 14:43:49,"Harris and Trump tied in battleground Michigan, Senate race on razor's edge: AARP poll","A new AARP poll finds that Vice President Kamala Harris and former President Donald Trump are tied in the 2024 battleground state of Michigan, with voters split along generational and gender lines."
2024-10-15 14:40:42,Trump says 'I don't care when you vote' in new House GOP ad urging voters to turn out early,House Republicans&apos; campaign arm is out with a new digital advertisement reminding voters that the election is 21 days away.
2024-10-15 15:58:24,"Netanyahu hits Biden admin, says Israel – not US – will decide how to handle Iran",Israeli Prime Minister Benjamin Netanyahu stated that his regime and not the U.S. will decide how to retaliate against Iran.
2024-10-15 15:17:01,"Georgia judge rules election officials must certify vote counts, even if they suspect fraud",A judge in a key battleground state has ruled that county election officials must certify results by the legal deadline even if they suspect fraud or mistakes.
2024-10-15 16:53:33,"Harris support for EVs could tank campaign in critical swing state, expert says",Vice President Kamala Harris&apos; previous support for electric vehicle mandates and subsidies could cost her votes in the critical swing state of Michigan in November.
2024-10-15 16:38:58,'I was much better off': These voters back Trump in top battleground county,"Several voters in a top battleground county in Wisconsin explained why they are supporting former President Donald Trump in 2024, citing the economy and immigration."
2024-10-15 17:29:56,Popular PA Democratic mayor warns Trump is ‘out-messaging’ Harris: 'I get more from Colbert',"Easton Mayor Salvatore Panto Jr., spoke to Fox News Digital for an interview on Monday, when he warned that the Democratic campaign apparatus messaging is lacking."
2024-10-15 17:16:04,Harris ramps up outreach to Black male voters as polls suggest Trump making gains,"Vice President Kamala Harris and former President Donald Trump are locked in a margin-of-error battle for the White House, and Harris is making a full court press for Black men."
2024-10-15 17:09:20,Bidens on the trail: President and first lady campaign in the biggest of the battlegrounds,President Biden and first lady Jill Biden head to battleground Pennsylvania to campaign for down-ballot Democrats and Vice President Kamala Harris in her race against former President Trump.
2024-10-15 18:54:31,Nathan Wade grilled by House investigators probing Georgia Trump prosecution,Former Fulton County prosecutor Nathan Wade was on Capitol Hill for a closed-door deposition on Tuesday.
2024-10-15 19:19:46,New report warns bloodthirsty Venezuelan gang's footprint will remain in US ‘for decades',"Tren de Aragua, a violent Venezuelan gang that has sparked national headlines, will likely remain in the U.S. for decades, according to a new report being released this week."
2024-10-15 19:12:23,Trump says GOP is 'party of common sense' during contentious Bloomberg interview,Former President Trump said the Republican Party is “the party of common sense&quot; Tuesday during a contentious interview with Bloomberg News in Chicago.
2024-10-15 21:05:32,From cease-fire push to boots on the ground in Israel: US seemingly accepts involvement in escalating war,The U.S. is now more deeply entrenched in the conflict in the Middle East after a pivotal move to send troops to Israel was announced this week.
2024-10-15 20:49:26,Afghan ISIS terror plot: Biden admin agencies point fingers as lawmakers demand answers,"The vetting of an Afghan national accused of plotting an ISIS-inspired terror attack is under scrutiny, with government agencies pointing fingers on the matter."
2024-10-15 20:45:11,"Biden-Harris admin warns Israel over Gaza humanitarian aid, leaked letter reveals",The U.S. warned Israel that it needs to quickly improve the humanitarian situation in Gaza or be at risk of violating U.S. law and possibly jeopardizing crucial security aid to the country.
2024-10-15 22:05:39,Local officials face off against Georgia's elections board over rule that could shake up November,A new set of rules by Georgia&apos;s State Elections Board is facing a flurry of legal challenges.
2024-10-15 21:13:29,Fox News Politics: Nathan Wade grilled,"The latest updates from the 2024 campaign trail, exclusive interviews and more Fox News politics content"
2024-10-15 23:35:28,More than 230 doctors and health care professionals call on Trump to release medical records,"More than 230 doctors, nurses and healthcare providers have signed a letter calling on former President Trump to release his medical records and health information."
2024-10-16 07:00:47,"Why Trump, battling media hostility, is declaring war on fact-checkers","With Kamala Harris drawing favorable coverage from the media and Donald Trump seemingly triggering journalistic outrage, Trump is taking on fact-checkers."
2024-10-16 08:00:49,VP Harris to sit down hours from now with Bret Baier for first Fox News interview,"Vice President Harris will sit down with Bret Baier on &quot;Special Report&quot; for her first formal interview on Fox News, with less than three weeks to go in her battle against former President Trump."
2024-10-16 08:00:38,Trump to join Fox News' Harris Faulkner at all-women town hall in battleground state,Former President Trump joining Fox News&apos; &quot;The Faulkner Focus&quot; with Harris Faulkner on Oct. 16 for a town hall with all-female voters.
2024-10-16 08:00:29,Anti-Israel rhetoric intensifies in critical battleground city: 'Utterly chilling',"Multiple rallies in Dearborn recently featured increased anti-Israel rhetoric, highlighting a problem for the Harris campaign in the battleground state of Michigan."
