DATE,TITLE,SUMMARY
2024-09-08 19:38:08,Elon Musk pledges support for Second Amendment: 'Tyrants' disarm the people,"Tech billionaire Elon Musk doubled down on his support of the Second Amendment, saying the right to bear arms stops &quot;a tyrannical government from taking your rights away.&quot;"
2024-09-08 20:22:55,Democrats driving religious vote away from party as Trump courts Catholics: ‘Anti-Christian’ party,"The Democratic Party is likely pushing away religious voters with &quot;anti-Christian&quot; policies such as abortion and transgender issues, while Trump courts the voting bloc."
2024-09-08 22:44:12,House GOP releases scathing report on Biden's withdrawal from Afghanistan,House Foreign Affairs Chair Mike McCaul released a scathing report from his committee on the 2021 Afghanistan withdrawal and highlighted areas of mismanagement.
2024-09-09 05:26:36,House Dems issue response to GOP report on Biden's withdrawal from Afghanistan,The House Democrats on the Foreign Affairs Committee released their own memo on President Biden&apos;s chaotic 2021 withdrawal from Afghanistan after the GOP&apos;s report.
2024-09-09 08:00:50,"9/11 families call on Trump, Harris to oppose US-Saudi deal until kingdom admits involvement in terror attack","More than 3,000 family members of 9/11 victims are demanding Trump and Harris oppose any peace deal with Saudi Arabia unless the Kingdom acknowledges its involvement in the attack."
2024-09-09 08:00:40,"Dems face tight timeline to confirm Biden-Harris judges, surpass Trump legacy",Democrats face several obstacles in helping President Biden appoint more federal judges than former President Trump did during his term.
2024-09-09 12:48:05,"Harris finally adds policy page to campaign website, devotes several sections to Trump",Democratic presidential nominee Vice President Harris added policy proposals to her campaign website 50 days after President Biden exited the race.
2024-09-09 12:15:35,"Retired generals defend Harris, blame Trump on Afghanistan withdrawal: report",A group of retired generals and admirals are pushing back on criticism of the Biden-Harris administration&apos;s handling of the U.S. withdrawal from Afghanistan.
2024-09-08 08:00:18,Pennsylvanians offer mixed answers on where Harris stands on key issues: 'Better than the alternative',"Fox News Digital spoke on Thursday to a dozen Pennsylvanians in Pittsburgh, where Vice President Harris is reportedly conducting debate prep."
2024-09-09 14:04:24,"Harris solidifies support with Black voters, Trump numbers hold steady: poll","More Black Americans say they are planning to head to the polls on Election Day now that Vice President Kamala Harris is running, a new poll says."
2024-09-09 14:00:25,Gaetz questions Jack Smith's authority to keep up Trump probes after judge calls him 'unlawfully appointed',"Rep. Matt Gaetz is writing to Attorney General Merrick Garland, questioning the legitimacy of special counsel Jack Smith&apos;s most recent legal moves."
2024-09-09 15:48:44,Harris doubles down on support for left-wing benefit for illegal immigrants: 'Smart solutions',"Vice President Kamala Harris is backing an earned pathway to citizenship for illegal immigrants in a new policy page on her website, doubling down on her previous position."
2024-09-09 15:15:42,State Department denies lack of planning for withdrawal laid out in GOP-led Afghanistan report,"Republicans have &quot;issued partisan statements, cherry-picked facts, withheld testimonies from the American people, and obfuscated the truth behind conjecture,&quot; according to a State Department spokesperson."
2024-09-09 17:53:20,Conservative group registers 50K voters in swing states: ‘Could change the outcome’,"Seeking a conservative majority in Washington, Heritage Action for America finished what may only be its first endeavor in swing states to register voters."
2024-09-09 17:39:29,New report sounds alarm on China's role in destroying US families with deadly drug: 'Destabilizing crisis',A new report by the Heritage Foundation is shining a light on China&apos;s role in the deadly fentanyl crisis that has been killing Americans for years.
2024-09-09 17:16:39,Trump allies offer debate strategies to beat Harris: 'Already knocked one Democrat out',Republican allies of former President Donald Trump offer some advice for the former president in his debate showdown with Vice President Kamala Harris and spotlight the stakes in the 2024 election.
2024-09-09 17:13:12,"Biden has signed just 2 executive orders since dropping out of 2024 race, trailing past presidents","President Biden signed two executive orders since ending his re-election bid, trailing Presidents Trump and Obama in the Augusts of their last terms."
2024-09-09 18:09:57,"Senate to swear in Menendez successor following NJ lawmaker's conviction, resignation","Sen. Bob Menendez, D-N.J.,&apos;s successor, George Helmy, New Jersey Gov. Phil Murphy&apos;s former chief of staff, will be sworn into the Senate on Monday."
2024-09-09 19:01:59,"Liberal think tank's deep ties to Biden admin, far-left policies could come back to haunt Harris campaign",The Biden administration has deep ties to a liberal think tank when it comes to staffing and policy while the Harris campaign criticizes Trump for ties to a conservative think tank.
2024-09-09 20:41:11,Biden-Harris admin has 'failed' repeatedly on health care: analysis,The Health Markets Policy Network criticizes the Biden-Harris administration for diverting $266 billion from Medicare to green energy policies.
2024-09-09 20:21:50,Obama's half brother rips Biden-Harris agenda while hyping second Trump term: 'We're going to win',The half brother of former President Obama says he is voting for former President Trump in November and explained why he no longer supports Democrats.
2024-09-09 20:19:23,MS-13 gang member suspected of murder allowed to attend Maryland high school,A MS-13 gang member who was the primary suspect in a 2022 murder was allowed to enroll at a Maryland high school without the county school system being informed of his status.
2024-09-09 20:02:50,Romania and Latvia confirm incursions by Russian drones into NATO airspace,"Latvia and Romania, two member countries of NATO, said Russian drones violated their airspace over the weekend in a move that could stoke boiling-hot tensions between Moscow and the military alliance."
2024-09-09 21:13:10,"Mike Pence, other former top Trump officials featured in Harris campaign ad slamming Trump as 'dangerous'","A new advertisement from the Harris campaign slamming Trump as &quot;dangerous&quot; will feature months-old comments from several former top Trump officials, including Donald Trump&apos;s former vice president Mike Pence and his former Defense Secretary Mark Esper."
2024-09-09 22:41:46,White House pushes back against scathing report on Biden's withdrawal from Afghanistan,"The White House defended President Biden&apos;s handling of the withdrawal from Afghanistan back in 2021, despite a scathing report released Sunday by Republican lawmakers."
2024-09-09 22:40:51,Fox News Politics: Fight Night Eve,"The latest updates from the 2024 campaign trail, exclusive interviews and more Fox News politics content"
2024-09-09 21:53:01,"Migrant controversy hits heartland as Alabama council meeting boils over, state officials slam feds' 'mess'","Sylacauga, Alabama, residents fume at officials over an influx of Haitian migrants legally in their town under Temporary Protective Status as state lawmakers seek action."
2024-09-09 23:14:49,Mike Johnson faces conservative mutiny over Trump-backed plan to avert government shutdown,House Speaker Mike Johnson cannot afford to lose more than four GOP votes on his government funding plan to pass it without Democratic votes.
2024-09-09 23:54:18,McCaul says he will hold Blinken in contempt after State Department shrugs off his demands for testimony,"Foreign Affairs Chairman Rep. Mike McCaul said he still intends to haul in Antony Blinken on the Afghanistan withdrawal, and will hold him in contempt of Congress if he does not comply."
2024-09-10 02:11:37,"Contingent elections: what they are, and what to expect if 2024 triggers one","Pundits are predicting a close election – so close, in fact, that it may be prudent to explore Congress&apos; role if neither Trump nor Harris garners 270 electoral votes."
2024-09-10 02:05:37,Trump-backed plan to avoid government shutdown advances to House-wide vote as Republicans defect,The House Rules Committee passed Speaker Mike Johnson&apos;s plan for a short-term government funding bill attached to Republicans&apos; SAVE Act aimed at election security.
2024-09-10 07:00:26,Debate challenge: The pressure’s on Kamala as she and Trump trade flip-flop charges,"Trump and Harris are close in many major polls. With Tuesday being the vice president&apos;s first debate in four years, the pressure is on for her to outperform the former president."
2024-09-10 08:00:16,Kamala Harris' new climate director said she is hesitant to have children because of climate change threats,The Harris campaign&apos;s new climate engagement director has questioned whether she will have kids due to fears over climate change.
2024-09-10 08:00:53,"Harris and Trump face off in historic debate, experts point to 'High, high stakes'","What&apos;s at stake, what the candidates need to do, and how they are preparing, as Vice President Kamala Harris and former President Trump face off Tuesday in their first and potentially only 2024 debate"
2024-09-10 08:00:26,Race to replace GOP governor in blue state on tap as primary season comes to a close on Tuesday,"The battle to succeed retiring Republican Gov. Chris Sununu is the marquee battle as New Hampshire, Delaware and Rhode Island hold the final state primaries of the 2024 election cycle"
2024-09-09 12:48:05,"Harris finally adds policy page to campaign website, devotes several sections to Trump",Democratic presidential nominee Vice President Harris added policy proposals to her campaign website 50 days after President Biden exited the race.
2024-09-10 10:00:07,House launches poll watcher program amid GOP-wide push for election security,House Administration Committee Chair Bryan Steil is rolling out the latest iteration of Congress&apos; Election Observer Program this week.
2024-09-10 08:00:26,Race to replace GOP governor in swing state on tap as primary season comes to a close on Tuesday,"The battle to succeed retiring Republican Gov. Chris Sununu is the marquee battle as New Hampshire, Delaware and Rhode Island hold the final state primaries of the 2024 election cycle"
2024-09-10 11:43:02,"Trump-Harris race neck and neck nationally in new survey, pollster sees 'warning sign' for Dems",A new poll released Wednesday found former President Trump and Vice President Harris in a dead heat ahead of the presidential debate in Philadelphia.
2024-09-10 12:52:38,"Independents RFK Jr., Tulsi Gabbard to spin for Trump at debate, joining Vance and other Republicans",Democrats turned independents Tulsi Gabbard and Robert F. Kennedy Jr. who are backing Donald Trump will be in the debate spin room on behalf of the former president as debates Vice President Harris
2024-09-10 12:37:43,"Harris ACLU questionnaire shows she supported gender transition surgeries for detained migrants, defunding ICE",A resurfaced document from when Kamala Harris was running for president in 2019 shows her advocating for causes such as gender transition surgeries for detained migrants.
2024-09-10 12:30:52,"Jimmy Carter’s family reveals how president felt about Biden quitting, which DNC speaker stole the show","Former President Jimmy Carter is closely watching the presidential election while in hospice care, lamenting it was &quot;sad&quot; to see President Biden bow out of race."
2024-09-10 12:09:04,Arizona's proof of citizenship law heads back to the courts amid fears of noncitizen voting,Arizona residents shared their views on the ongoing court battle over Arizona&apos;s 2022 election bill that requires voters to show proof of citizenship.
2024-09-10 12:01:32,"Taxpayers lost more than $100B to COVID unemployment insurance fraud, committee finds","FIRST ON FOX: American taxpayers lost more than $100 billion dollars to fraud and improper payments as a result of temporary unemployment insurance programs created in response to COVID-19, the House Oversight Committee found."
2024-09-10 12:00:04,NRA bets big on Montana in gun rights push as Tester teeters in Senate race,The NRA is targeting Sen. Jon Tester of Montana for his Second Amendment record as it pushes voters to usher in a pro-gun rights Senate majority.
2024-09-10 13:26:21,USSS assistant director asked to retire over Butler assassination attempt on Trump,A high-ranking leader within the Secret Service has been asked to retire following the attempted assassination on former President Donald Trump.
2024-09-10 14:17:41,Biden-Harris border crisis: Victims of illegal immigrant crime testify in House hearing,The mother of 12-year-old Jocelyn Nungaray was set share her perspective before Congress after two illegal immigrants were charged in her daughter&apos;s killing.
2024-09-10 14:00:44,Flashback: DA Harris' plan to prosecute drug dealers starting on their 3rd offense shot down by police,Vice President Kamala Harris proposed a drug crime program when she served as San Francisco district attorney that would have prosecuted drug dealers only after their second detention.
2024-09-10 14:00:04,Harris-Walz hit with blistering ad on China record ahead of presidential debate: 'Time to fight back',A conservative anti-CCP group is blasting the Harris-Walz campaign in a new ad that will run during Tuesday night&apos;s debate between Vice President Kamala Harris and former President Trump.
2024-09-10 15:19:51,House honoring 13 US service members killed in 2021 Abbey Gate bombing during Afghanistan withdrawal,"House Speaker Mike Johnson, R-La., will posthumously present the Gold Medal to the 13 U.S. service members killed at the Abbey Gate bombing."
2024-09-10 15:30:18,US to sanction Mexican drug cartel Jalisco over fentanyl trafficking,"FIRST ON FOX: The Treasury Department is expected to announce sanctions Tuesday against individuals and entities linked to a violent Mexico-based drug trafficking cartel responsible for a significant portion of fentanyl and other deadly drugs trafficked into the United States, Fox News Digital has learned."
2024-09-10 15:00:48,How a lone Nebraska district could decide the presidential election,"Nebraska&apos;s Second Congressional District is one of the ultimate swing districts in the country, and this year, it could play and outsized role in choosing the next president."
2024-09-10 14:59:47,Trump-Harris debate: Sen Rick Scott identifies 'biggest thing' that can help former president,Sen. Rick Scott said it would be ideal for former President Donald Trump if Vice President Kamala Harris &quot;could talk 99% of the time&quot; during Tuesday&apos;s Philadelphia debate.
2024-09-10 14:17:41,Biden-Harris border crisis: Mother of Jocelyn Nungaray gives emotional testimony during migrant crime hearing,The mother of 12-year-old Jocelyn Nungaray was set share her perspective before Congress after two illegal immigrants were charged in her daughter&apos;s killing.
2024-09-10 17:08:30,US and Iraqi officials drawing up plan that could see American troops pulling out as soon as next year,Washington and Baghdad are working on a plan to draw down the U.S. troop presence in Iraq as soon as next year.
2024-09-10 16:56:38,A look back at Trump's past debates,A look at some of Donald Trump&apos;s past debates reveal what to expect in his Sept. 10 matchup against Vice President Kamala Harris.
2024-09-10 18:48:30,House GOP doubts grow as Johnson digs in on funding fight: 'Playing with a government shutdown',Speaker Mike Johnson said he is forging ahead with his plan on government funding despite the measure hemorrhaging GOP support.
2024-09-10 18:06:03,First and potentially only presidential debate between Harris and Trump being held in crucial battleground,The first and potentially only debate between former President Trump and Vice President Kamala Harris is taking place in the key general election battleground of Pennsylvania
2024-09-10 17:56:50,"Lawyer defending Google in DOJ case prepping Harris for debate is 'conflict of interest,' Jordan investigates",House Republicans asked the DOJ about “potential conflicts of interest&quot; regarding Google&apos;s lead lawyer reportedly helping Vice President Kamala Harris for her debate.
2024-09-10 19:05:39,Back on the trail: Top Biden surrogate Newsom now campaigning for Harris,"Democratic Gov. Gavin Newsom, a top surrogate for President Biden, is back on the campaign trail, this time for fellow Californian Vice President Kamala Harris as she debates Donald Trump."
2024-09-10 13:26:21,"USSS assistant director encouraged to retire over Butler assassination attempt on Trump, source reveals","A high-ranking leader within the Secret Service has been encouraged to retire following the attempted assassination on former President Donald Trump, a source tells Fox News."
2024-09-10 21:34:41,'You are culpable': Stefanik demands Cuomo apologize for COVID nursing home deaths in heated exchange,Former New York Gov. Andrew Cuomo testified before Congress amid an ongoing investigation into nursing home deaths during the COVID pandemic.
2024-09-10 23:49:58,"Harris camp's new policy page criticized for lacking specifics on border security: 'There's no there, there'","The Harris campaign released policy platform on its website after criticism over its absence, but the new platform left much to be desired for critics of Harris&apos; border policy positions."
2024-09-11 00:27:18,Dem incumbent survives challenge as GOP picks a winner in Rhode Island Senate primaries,Voters in Rhode Island&apos;s Senate primary on Tuesday chose the two candidates who will represent the Republican and Democrat parties in November.
2024-09-11 01:40:49,Delaware Democrat advances toward becoming first trans member of Congress,Delaware State Sen. Sarah McBride was the only candidate in the primary to have raised any funds
2024-09-11 01:32:21,Former cop wins GOP primary in Delaware to face candidate who would be first transgender person in Congress,The Republican has a steep hill to climb to become the first GOP member to hold a statewide office in Delaware since 2010
2024-09-11 01:09:54,"Primary results are in, race is set to replace Democratic governor of Biden's home state in November",The match is set for the general election to decide Delaware&apos;s next governor in November. Matt Meyer and Mike Ramone won their primaries.
2024-09-11 02:30:34,"Trump, Harris trade barbs on crime during first presidential debate: 'Through the roof'",Former President Donald Trump and VP Kamala Harris sparred on the issue of crime in Tuesday night&apos;s debate trading jabs on who will more effective on the issue.
2024-09-11 02:20:28,Trump says he 'probably took a bullet to the head' due to Dem rhetoric,Former President Donald Trump said during the debate that he likely took a &quot;bullet to the head&quot; due to Vice President Harris and the Democratic Party&apos;s rhetoric against him.
2024-09-11 02:09:56,"Harris claims Trump abortion platform makes ‘no exception,’ moments after Trump says the opposite",Vice President Kamala Harris said former President Trump would not allow exceptions for abortion despite Trump saying he supports exceptions moments before.
2024-09-11 03:23:26,Taylor Swift endorses Kamala Harris for president after debate: ‘I’ve made my choice’,Taylor Swift on Tuesday endorsed Kamala Harris for president just minutes after the Democratic nominee&apos;s presidential debate against Republican nominee Donald Trump.
2024-09-11 03:16:37,Trump flips 'I'm talking' script from 2020 debate against Kamala Harris during presidential debate showdown,Former President Trump used one of Vice President Kamala Harris&apos; most famous debate lines against her Tuesday night when he asked her to let him continue speaking.
2024-09-11 03:15:53,Trump fact checks Harris on Charlottesville riot accusation: 'Debunked',"Former President Donald Trump slammed Vice President Kamala Harris for citing the Charlottesville riots of 2017 during the debate, saying the narrative has been debunked."
2024-09-11 04:45:52,Social media erupts over 'repulsive' Trump-Harris presidential debate: 'Phony and rehearsed',Reactions poured in on both sides of the aisle following the conclusion of the first presidential debate between former President Donald Trump and VP Kamala Harris.
2024-09-11 04:45:03,Fox News voter panel says Harris won debate,A panel of voters participating in Fox News Digital&apos;s debate discussion said that Vice President Kamala Harris came out as the winner over former President Donald Trump.
2024-09-11 04:34:26,Voter slams Harris for 'race baiting' and 'fear mongering' during debate,One voter reacting to the debate for a Fox News Digital panel took issue with Vice President Kamala Harris &quot;race baiting&quot; and &quot;fear mongering&quot; former President Donald Trump.
2024-09-11 04:23:41,Voters react to Trump saying he 'took a bullet to the head' over left rhetoric,"A Fox News Digital focus group of Republicans, Democrats and Independents used dials to react live to former President Trump&apos;s commenting about taking a bullet."
2024-09-11 04:13:29,New Hampshire makes primary picks for Governor and House races,"It&apos;s primary day in New Hampshire, which along with Rhode Island &amp; Delaware held the final state primary contests of the 2024 election cycle. The top race - the battle to succeed GOP Gov. Chris Sununu"
2024-09-11 04:07:42,"Kamala stays on offense, Trump went to personal attacks, ABC much tougher on former president","Former US President Donald Trump and US Vice President Kamala Harris faced off on Tuesday at the second presidential debate, moderated by ABC&apos;s David Muir and Linsey Davis."
2024-09-11 03:58:28,"Trump spars with Harris, moderators during heated presidential debate: 'She doesn't have a plan'","The highlights as Vice President Kamala Harris and former President Trump face off Tuesday in their first and potentially only debate ahead of the 2024 election, a showdown in Philadelphia"
2024-09-11 06:00:27,"Democrats heap praise on Harris' debate performance, say she 'destroyed' Trump's career","Democrats heaped praise on Vice President Kamala Harris for her debate performance against President Donald Trump, arguing she &quot;destroyed&quot; him in a &quot;knockout.&quot;"
2024-09-11 08:00:59,"Trump, Harris travel to New York City, Shanksville to commemorate 9/11 attacks just hours after debate",Former President Trump and Vice President Kamala Harris both traveled to New York City to commemorate 9/11 following their first presidential debate showdown.
2024-09-11 08:00:32,Top 5 moments during Trump-Harris presidential debate: 'I'm talking now',"A variety of issues were broached during the debate between former President Trump and Kamala Harris, but there were several moments that stood out more than others."
2024-09-11 09:44:08,"Trump allies claim victory in debate, criticize moderators as 'pro-Kamala activists'",Former President Donald Trump&apos;s allies are rushing to declare victory on his behalf after his debate against Vice President Kamala Harris.
2024-09-11 10:52:02,"Harris leads in Virginia, a state Trump is aiming to flip: poll",A new Washington Post-Schar School poll released Tuesday shows Vice President Kamala Harris leading former President Donald Trump by eight percentage points among likely voters in Virginia.
2024-09-11 11:42:59,Harris surprises social media by saying she's a gun owner,"Democratic presidential nominee Kamala Harris said she was a gun owner on during the debate against former President Trump, shocking social media."
2024-09-11 12:08:51,Focus group reacts to Donald Trump's claim that Ukraine war is 'dying to be settled',Republicans significantly backed former President Donald Trump&apos;s Ukraine comments while Dems appeared unmoved by his remarks and independents showed a slight drop-off.
2024-09-11 12:03:33,Focus group reacts to Trump saying he wanted to send Harris a 'MAGA hat' for copying his policies,A Fox focus group reacts to former President Trump saying he wanted to gift Vice President Kamala Harris a &quot;MAGA&quot; hat for copying his policies.
2024-09-11 08:00:59,"Trump, Harris shake hands in show of unity at Ground Zero for 9/11 commemoration",Former President Trump and Vice President Kamala Harris both traveled to New York City to commemorate 9/11 following their first presidential debate showdown.
2024-09-11 13:36:07,"Huge majority of debate watchers say Harris took home the victory, CNN poll finds",A majority of debate watchers say Vice President Kamala Harris defeated former President Trump in their Pennsylvania debate Tuesday night.
2024-09-11 13:01:46,Trump says Taylor Swift endorsing Harris was 'just a question of time',"Former President Donald Trump dismissed pop superstar Taylor Swift&apos;s support for Vice President Kamala Harris, saying on Wednesday morning that the endorsement was always &quot;just a question of time.&quot;"
2024-09-11 15:11:11,Trump-Harris debate: Body language expert weighs in on high-stakes faceoff: ‘Fell into the trap’,Body language expert Susan Constantine says that former President Trump&apos;s demeanor turned angry at the debate after he was goaded by Vice President Kamala Harris.
2024-09-11 14:55:33,"Focus group reacts to Trump, Harris faceoff over Project 2025",A focus group reacting to the presidential debate pitting former President Donald Trump against Vice President Kamala Harris revealed their thoughts on Project 2025.
