DATE,TITLE,SUMMARY
2024-01-02 04:00:00,Plane in flames at Tokyo Airport,
2024-01-02 04:00:00,Michelle Mone's husband says family 'treated as punchbag' in row over PPE,
2024-01-02 04:00:00,Casualties reported as Ukraine hit by wave of strikes after Putin promises revenge; Poland scrambles jets to protect airspace | War latest,
2024-01-02 04:00:00,Amber wind warning issued as Storm Henk to batter parts of UK with 80mph gusts,
2024-01-02 04:00:00,Plane in flames on runway of Tokyo airport,
2024-01-02 04:00:00,'Hundreds' evacuated from plane; footage shows explosion as it taxies on runway; plane snaps in half on runway | Japan plane fire latest,
2024-01-12 07:00:00,What military firepower does Britain have in the Gulf?,
2024-01-12 07:00:00,Why have the UK and US launched strikes on Yemen and who are the Houthis?,
2024-01-12 07:00:00,UK strikes may be counterproductive and dangerous - and could lead to unanticipated attacks elsewhere,
2024-01-12 07:00:00,Friday's newspaper front pages,
2024-01-12 07:00:00,At least five killed after UK-US strikes on Yemen - as Houthis warn it will not go 'unanswered',
2024-01-12 07:00:00,New weather warnings as UK to be hit by snow - temperatures set to plunge as low as -5C,
2024-01-12 07:00:00,Here's the cleverest way to book annual leave to maximise time off; Apple (briefly) overtaken as world's most valuable company | Money,
2024-01-12 07:00:00,Mother and ex-boyfriend jailed for murdering toddler who suffered 'unimaginable pain' in 'frenzied attack',
2024-01-12 07:00:00,US and UK 'trying to turn Red Sea into sea of blood'; footage shows moment RAF jet hits targets in Yemen | Middle East latest,
