DATE,TITLE,SUMMARY
2025-01-03 00:00:01,Jim Cramer cautions against speculating on nuclear power and quantum computing,CNBC's Jim Cramer on Thursday warned investors about speculating too heavily in sectors such as nuclear power and quantum computing.
2025-01-02 23:55:01,Cramer's Lightning Round: Uber is a buy,"""Mad Money"" host Jim Cramer rings the lightning round bell, which means he's giving his answers to callers' stock questions at rapid speed."
2025-01-02 23:30:41,Jim Cramer lists what could help the market in 2025,"After stocks slumped during a volatile first session of the year, CNBC's Jim Cramer suggested what could lead to market gains in 2025."
2025-01-03 23:55:01,Cramer's Lightning Round: Home Depot is a buy,"""Mad Money"" host Jim Cramer rings the lightning round bell, which means he's giving his answers to callers' stock questions at rapid speed."
2025-01-03 23:43:52,"Cramer's week ahead: nonfarm payrolls, PMI and earnings from Albertsons",CNBC's Jim Cramer on Friday walked investors through next week's market action.
2025-01-03 23:38:42,Jim Cramer's four big-picture questions for 2025,CNBC's Jim Cramer on Friday opined on the uncertainty of 2025 and listed four of the most pressing macroeconomic questions he's thinking about.
2025-01-06 23:56:09,Cramer's Lightning Round: Seagate Technology is 'a value trap',"""Mad Money"" host Jim Cramer rings the lightning round bell, which means he's giving his answers to callers' stock questions at rapid speed."
2025-01-06 23:45:18,Jim Cramer says now is a good time to buy Uber at a discount,CNBC's Jim Cramer on Monday reviewed the bull and bear cases for Uber.
2025-01-06 23:46:31,Jim Cramer explores why consumer goods stocks are seeing losses,CNBC's Jim Cramer reviewed Monday's market action and gave his take on why a large swath of stocks are notching losses.
2025-01-08 00:15:02,Jim Cramer says Nvidia's pullback could be a good chance to buy,"CNBC's Jim Cramer extolled Nvidia's stock and reviewed its Tuesday action, saying the decline was unrelated to the company and its prospects."
2025-01-08 00:00:44,Cramer's Lightning Round: 'I'd be careful' with Novo Nordisk,"""Mad Money"" host Jim Cramer rings the lightning round bell, which means he's giving his answers to callers' stock questions at rapid speed."
2025-01-07 23:57:26,Jim Cramer looks ahead to Friday's employment data: 'We’re at the mercy of macro numbers',CNBC's Jim Cramer reviewed Tuesday's market-wide decline.
2025-01-08 23:56:17,Cramer's Lightning Round: 'I would be a seller of QuantumScape',"""Mad Money"" host Jim Cramer rings the lightning round bell, which means he's giving his answers to callers' stock questions at rapid speed."
2025-01-08 23:54:23,Jim Cramer opines on TikTok ban: 'Let's just call it anybody’s ballgame',CNBC's Jim Cramer on Wednesday gave investors his read on the future of TikTok.
2025-01-08 23:53:28,Jim Cramer urges investors to sell volatile stocks in quantum computing: 'I can't be part of this froth',"CNBC's Jim Cramer on Wednesday told investors to be wary of market froth, especially volatile stocks related to quantum computing."
2025-01-11 00:00:09,Cramer's Lightning Round: AeroVironment is a buy,"""Mad Money"" host Jim Cramer rings the lightning round bell, which means he's giving his answers to callers' stock questions at rapid speed."
2025-01-10 23:57:55,Jim Cramer's week ahead: Bank earnings and new economic data,CNBC's Jim Cramer on Friday reviewed next week's market-moving events: major bank earnings and new data from the Labor Department.
2025-01-11 00:24:31,Jim Cramer explains why DraftKings is a buy through the NFL's playoffs,"CNBC's Jim Cramer on Friday told investors why he thinks it's a good time to buy sports betting platform DraftKings, whose stock has recently pulled back."
2025-01-13 23:55:45,Cramer's Lightning Round: Arbutus Biopharma is 'the ultimate spec',"""Mad Money"" host Jim Cramer rings the lightning round bell, which means he's giving his answers to callers' stock questions at rapid speed."
2025-01-13 23:54:22,Jim Cramer explains why the Nasdaq failed to rally on Monday,CNBC's Jim Cramer examined Monday's market action.
2025-01-14 00:05:11,Bristol Myers Squibb CEO describes new drug for treating schizophrenia,"Bristol Myers Squibb CEO Chris Boerner described Cobenfy, a new drug to treat schizophrenia and may also help with bipolar disorder and Alzheimer's disease."
2025-01-14 23:57:19,Jim Cramer says he supports healthcare stocks for their long-term value,"CNBC's Jim Cramer stresses the importance of investing for the long term, highlighting healthcare stocks Eli Lilly, Merck and Regeneron."
2025-01-14 23:52:43,Cramer's Lightning Round: Super Micro Computer is a sell,"""Mad Money"" host Jim Cramer rings the lightning round bell, which means he's giving his answers to callers' stock questions at rapid speed."
2025-01-14 23:52:34,Merck CEO talks medicines beyond the company's top cancer drug,"Merck CEO Rob Davis told CNBC's Jim Cramer that there's more to the pharmaceutical giant than its lucrative cancer drug, Keytruda."
2025-01-16 00:00:01,New San Francisco Mayor talks bolstering police force: 'We have the money',San Francisco Mayor Daniel Lurie told CNBC's Jim Cramer on Wednesday that his city has the funding to hire more police officers.
2025-01-15 23:58:38,Cramer's Lightning Round: 'I do not dig RIG',"""Mad Money"" host Jim Cramer rings the lightning round bell, which means he's giving his answers to callers' stock questions at rapid speed."
2025-01-15 23:27:33,Jim Cramer says to stay focused on earnings reports after Wednesday's stock rally,CNBC's Jim Cramer examined Wednesday's market rally and stressed that it's important to stay focused on corporate earnings and commentary from management.
2025-01-16 23:55:26,Cramer's Lightning Round: Virtu Financial is a buy,"""Mad Money"" host Jim Cramer rings the lightning round bell, which means he's giving his answers to callers' stock questions at rapid speed."
2025-01-16 23:34:20,First Horizon CEO says he's cautious about interest rate cuts in 2025,"CNBC's Jim Cramer highlights the regional bank space, talking with First Horizon CEO Bryan Jordan."
2025-01-16 23:32:14,Jim Cramer reflects on how the Biden administration might have affected the market,CNBC's Jim Cramer on Thursday mused about how President Joe Biden impacted the market.
2025-01-17 23:56:35,Cramer's Lightning Round: Adobe is a buy,"""Mad Money"" host Jim Cramer rings the lightning round bell, which means he's giving his answers to callers' stock questions at rapid speed."
2025-01-18 00:02:41,Jim Cramer parses big bank earnings and says stocks have 'quite a bit more upside',CNBC's Jim Cramer on Friday reviewed earnings reports from top banks that reported this week.
2025-01-17 23:33:34,"Cramer's week ahead: Inauguration, earnings from Procter & Gamble and American Express","CNBC's Jim Cramer guided investors through next week on Wall Street, highlighting President-elect Donald Trump's inauguration."
2025-01-22 00:16:29,Jim Cramer reflects on how Trump's first days in office impacted stocks,"CNBC's Jim Cramer dissected Tuesday's market action, speculating about how President Donald Trump's first days in the White House are impacting the market."
2025-01-22 00:03:28,Cramer's Lighting Round: ASML is a buy,"""Mad Money"" host Jim Cramer rings the lightning round bell, which means he's giving his answers to callers' stock questions at rapid speed."
2025-01-21 23:44:49,Jim Cramer: Taiwan Semi's bullish earnings brings renewed optimism to broader sector,"Jim Cramer reviewed the market reaction to TSMC's fourth quarter earnings report, with its profit rising 57% from a year earlier to a record high"
2025-01-22 23:55:10,"Cramer's Lightning Round: Sportradar is 'speculative, but I like it'","""Mad Money"" host Jim Cramer rings the lightning round bell, which means he's giving his answers to callers' stock questions at rapid speed."
2025-01-22 23:31:56,RBN Energy exec: Trump's oil and gas push won't necessarily bring more drilling,RBN Energy Executive Chairman Rusty Braziel spoke with CNBC's Jim Cramer about the impact of the president's energy agenda.
2025-01-22 23:11:41,Jim Cramer predicts market action will reflect Trump instead of the Fed,CNBC's Jim Cramer on Wednesday told investors there will be a shift in Wall Street's focus.
2025-01-23 23:56:18,Cramer's Lightning Round: Lam Research is a buy,"""Mad Money"" host Jim Cramer rings the lightning round bell, which means he's giving his answers to callers' stock questions at rapid speed."
2025-01-23 23:48:24,Jim Cramer: Not all Trump comments are investing opportunities,"CNBC's Jim Cramer on Thursday told investors that President Donald Trump's remarks, however highly-publicized, will not always yield solid investments."
2025-01-23 23:39:37,Jim Cramer says oil service stocks won't see gains just yet under Trump,CNBC's Jim Cramer told investors why he thinks oil service stocks might not immediately soar under President Donald Trump.
2025-01-25 00:13:03,Jim Cramer critiques Texas Instruments as it deals with auto and industrial market slump,CNBC's Jim Cramer on Friday critiqued Texas Instruments.
2025-01-25 00:07:47,Cramer's Lightning Round: 'I'm worried about Wendy's',"""Mad Money"" host Jim Cramer rings the lightning round bell, which means he's giving his answers to callers' stock questions at rapid speed."
2025-01-25 00:10:34,Jim Cramer's week ahead: Fed meeting and Big Tech earnings,CNBC's Jim Cramer highlighted what he's paying attention to next week as Wall Street launches into earnings season.
2025-01-28 01:32:13,Beacon Roofing CEO describes dealings with QXO as takeover bid heats up,Beacon Roofing CEO Julian Francis described communications with a building products distributor looking to acquire his company.
2025-01-28 00:28:47,"As Nvidia tanks, Jim Cramer says there's not enough information to make a move","CNBC's Jim Cramer reviewed Monday's market action as AI start-up DeepSeek disrupted the tech sector, sending market leader Nvidia into a tailspin."
2025-01-28 00:08:42,Cramer's Lightning Round: BlackRock is a buy,"""Mad Money"" host Jim Cramer rings the lightning round bell, which means he's giving his answers to callers' stock questions at rapid speed."
2025-01-28 23:55:17,Cramer's Lightning Round: Waste Management is a buy,"""Mad Money"" host Jim Cramer rings the lightning round bell, which means he's giving his answers to callers' stock questions at rapid speed."
2025-01-28 23:55:16,"As Nvidia recovers, Jim Cramer considers what DeepSeek really means for the tech world","After a market-wide panic over AI start-up DeepSeek, CNBC's Jim Cramer reflected on what the new player's entrance into the arena means for Big Tech."
2025-01-28 23:40:31,Nucor CEO says he's optimistic about what Trump policies mean for steel trade,"In a Tuesday interview with CNBC's Jim Cramer, Nucor CEO Leon Topalian expressed optimism about what Trump's tariff policies mean for the U.S. steel industry."
2025-01-30 00:16:23,Brinker CEO talks Chili's turnaround: 'This is just the beginning',Brinker International CEO Kevin Hochman detailed how his company has improved its Chili's chain in an interview with CNBC's Jim Cramer.
2025-01-29 23:57:14,Cramer's Lightning Round: Keysight is a buy,"""Mad Money"" host Jim Cramer rings the lightning round bell, which means he's giving his answers to callers' stock questions at rapid speed."
2025-01-29 23:44:27,"Despite a 'fraught' day for the market, Jim Cramer finds positives in Wednesday's action","For the Mad Money host, solid earnings results matter more now than monetary policy, as ""good profits combined with a benign Fed equal higher stock prices."""
2025-01-30 23:58:02,Cramer's Lightning Round: Plains All American Pipeline is a buy,"""Mad Money"" host Jim Cramer rings the lightning round bell, which means he's giving his answers to callers' stock questions at rapid speed."
2025-01-30 23:51:37,WM CEO says new acquisition is a 'natural hedge' for the company,"In an interview with CNBC's Jim Cramer, WM CEO Jim Fish described how the waste management company's recent acquisition helps reduce volatility."
2025-01-30 23:50:06,Jim Cramer explains how better management can change a stock's fate,"CNBC's Jim Cramer highlighted CEOs from Starbucks, Chili's parent Brinker International and General Electric."
2025-01-31 23:55:52,Cramer's Lightning Round: Don't sell Adobe,"""Mad Money"" host Jim Cramer rings the lightning round bell, which means he's giving his answers to callers' stock questions at rapid speed."
2025-02-01 00:36:21,"DeepSeek's threat to Nvidia's earnings may not be so serious, Jim Cramer says",CNBC's Jim Cramer on Friday told investors DeepSeek might not pose as serious a threat to Nvidia's sales as many investors feared this week.
2025-02-01 00:03:43,"Jim Cramer's week ahead: Earnings from Amazon, Alphabet, Eli Lilly, Palantir",CNBC's Jim Cramer on Friday walked investors through an earnings-heavy week.
2025-02-04 00:50:07,Flexport CEO breaks down the complex and uncertain global trade landscape,Flexport CEO Ryan Petersen detailed how his customers are dealing with a volatile global trade environment in a Monday interview with CNBC's Jim Cramer.
2025-02-04 00:11:37,Cramer's Lightning Round: Five9 is a buy,"""Mad Money"" host Jim Cramer rings the lightning round bell, which means he's giving his answers to callers' stock questions at rapid speed."
2025-02-04 00:08:58,"Investors shouldn't be surprised by Trump's tariff hikes, Jim Cramer says","CNBC's Jim Cramer unpacked Monday's market action, saying investors shouldn't be so shocked by President Donald Trump's steep tariff hikes."
2025-02-05 01:01:17,"Amid tariff worries, Chipotle CEO says about 50% of the chain's avocados are sourced from Mexico",Chipotle CEO Scott Boatwright told CNBC's Jim Cramer the burrito maker has managed to diversify its avocado supply.
2025-02-05 00:00:10,Cramer's Lighting Round: AbbVie is a buy,"""Mad Money"" host Jim Cramer rings the lightning round bell, which means he's giving his answers to callers' stock questions at rapid speed."
2025-02-04 23:56:57,"Wall Street needs to take Trump more seriously, Jim Cramer says",CNBC's Jim Cramer unpacked President Donald Trump's actions over the past few days.
2025-02-05 23:55:30,Cramer's Lightning Round: Don't buy Bitdeer,"""Mad Money"" host Jim Cramer rings the lightning round bell, which means he's giving his answers to callers' stock questions at rapid speed."
2025-02-05 23:53:27,Columbia Sportswear CEO talks tariff impact: 'We need some surety about what's going to happen',"In a Wednesday interview with CNBC's Jim Cramer, Columbia Sportswear CEO Tim Boyle said his company needs more clarity about global tariff decisions."
2025-02-05 23:33:26,Jim Cramer explains how to find buying opportunities in this market,CNBC's Jim Cramer reviewed recent market action as earnings season stretches on.
2025-02-07 00:07:59,Jim Cramer reviews 10 stocks leading the Dow now,"CNBC's Jim Cramer on Thursday thought it worthwhile to review ten stocks that led the Dow Jones Industrial Average over the past year, including 3M and Amgen."
2025-02-07 01:04:09,E.l.f. Beauty CEO explains softer sales trends in January,E.l.f. Beauty CEO Tarang Amin told CNBC's Jim Cramer why the company saw lighter business in January.
2025-02-07 00:50:47,Cramer's Lightning Round: NextEra Energy is a buy,"""Mad Money"" host Jim Cramer rings the lightning round bell, which means he's giving his answers to callers' stock questions at rapid speed."
2025-02-07 00:43:16,Roblox CEO talks growth goals after earnings: 'There's a huge market out there',"In a Thursday interview with CNBC's Jim Cramer, Roblox CEO Dave Baszucki reflected on the most recent quarter."
2025-02-19 00:31:37,"Disney stock is a bargain on the dip, Jim Cramer says",CNBC's Jim Cramer on Tuesday told investors why he thinks now is a good time to invest in Disney.
2025-02-18 23:58:11,"Cramer's Lightning Round: 'For a spec, you can buy' Red Cat","""Mad Money"" host Jim Cramer rings the lightning round bell, which means he's giving his answers to callers' stock questions at rapid speed."
2025-02-18 23:56:19,"Trump tariffs, Musk's DOGE role and AI are among the top concerns shared by CEOs, Cramer says","Among major executives' primary concerns are the actions of the Trump administration and artificial intelligence, Cramer said."
2025-02-20 00:27:32,Cramer's Lightning Round: Deere is a buy,"""Mad Money"" host Jim Cramer rings the lightning round bell, which means he's giving his answers to callers' stock questions at rapid speed."
2025-02-20 00:24:38,SpartanNash CEO describes how the wholesaler tries to keep egg prices down,SpartanNash CEO Tony Sarsam gave CNBC's Jim Cramer a read on the egg pricing landscape and explained how his company tries to keep costs to customers down.
2025-02-19 23:58:27,Jim Cramer breaks down a 'conflicting group of currents' in the business cycle,CNBC's Jim Cramer on Wednesday challenged the notion that today's market is following a cohesive business cycle.
2025-02-21 00:14:15,Kontoor Brands CEO describes growth plans for new acquisition,"In a Thursday interview with CNBC's Jim Cramer, Kontoor Brands CEO Scott Baxter discussed the apparel company's new acquisition."
2025-02-21 00:05:41,"Keep a diverse portfolio if you want to own speculative stocks, Jim Cramer says",CNBC's Jim Cramer told investors who want to own speculative stocks that it's unwise to take on such risks without also maintaining a diverse portfolio.
2025-02-20 23:56:04,Cramer's Lightning Round: Sunoco is a buy,"""Mad Money"" host Jim Cramer rings the lightning round bell, which means he's giving his answers to callers' stock questions at rapid speed."
2025-02-22 00:01:37,EQT CEO says natural gas will 'take the lion's share' of AI power demand,"In a Friday interview with CNBC's Jim Cramer, EQT CEO Toby Rice claimed that natural gas will be a major source of power for the burgeoning AI boom."
2025-02-22 00:01:33,"Cramer's week ahead: Earnings from Nvidia, Dell and Home Depot",CNBC's Jim Cramer on Friday walked investors through next week on Wall Street.
2025-02-21 23:59:39,Cramer's Lighting Round: 'Hold on' to FTAI Aviation,"""Mad Money"" host Jim Cramer rings the lightning round bell, which means he's giving his answers to callers' stock questions at rapid speed."
2025-02-25 01:10:45,Celsius CEO talks new acquisition and rise of sugar-free energy drinks,Celsius CEO John Fieldly told CNBC's Jim Cramer on Monday that the sugar free category is a dominant force on the energy drink market.
2025-02-24 23:57:21,"Market froth needs to settle down, Jim Cramer says","CNBC's Jim Cramer on Monday described how he thinks froth is disrupting the market, saying trendier stocks need to cool off before others can bounce back."
2025-02-24 23:57:08,Cramer's Lightning Round: Energy Transfer is a buy,"""Mad Money"" host Jim Cramer rings the lightning round bell, which means he's giving his answers to callers' stock questions at rapid speed."
2025-02-26 01:16:54,Robinhood CEO talks SEC lawsuit dismissal: 'It's nice to not have to play as much defense',"In a Tuesday interview with CNBC's Jim Cramer, Robinhood CEO Vlad Tenev praised the new administration's attitude towards financial services and cryptocurrency."
2025-02-26 00:14:03,Cramer's Lightning Round: Sell Wendy's,"""Mad Money"" host Jim Cramer rings the lightning round bell, which means he's giving his answers to callers' stock questions at rapid speed."
2025-02-26 00:06:53,Jim Cramer: Wavering faith in data centers is shaping market action,"CNBC's Jim Cramer on Tuesday described stocks' recent movement, saying companies tied to the prevalence of data centers are declining."
2025-02-27 00:42:26,Axon Enterprise CEO describes how the company aims 'to make the bullet obsolete',Axon Enterprise CEO Rick Smith told CNBC's Jim Cramer on Wednesday how the company is trying to help police reduce gun use.
2025-02-27 00:11:30,Cramer's Lightning Round: Hold on to Badger Meter,"""Mad Money"" host Jim Cramer rings the lightning round bell, which means he's giving his answers to callers' stock questions at rapid speed."
2025-02-26 23:54:40,"Tariff uncertainty is weighing on market action, Jim Cramer says",CNBC's Jim Cramer suggested uncertainty regarding tariff policy will continue to shape market action.
2025-02-28 00:21:45,Jim Cramer weighs egg producer Vital Farms as its stock dips due to accounting issues,CNBC's Jim Cramer on Thursday reviewed the stock of Vital Farms.
2025-02-27 23:57:45,Cramer's Lightning Round: 'I don't want to be a part of' Nebius,"""Mad Money"" host Jim Cramer rings the lightning round bell, which means he's giving his answers to callers' stock questions at rapid speed."
2025-02-27 23:53:06,Jim Cramer lists stocks that could withstand the impact of Trump's tariffs,CNBC's Jim Cramer on Thursday opined on the market instability caused by some of President Donald Trump's tariff decisions.
2025-03-05 00:37:10,Royal Caribbean CEO gives read on consumers' leisure habits,"Royal Caribbean CEO Jason Liberty said consumers still want to spend money on cruises, even as tariff hikes threaten the health of the broader economy."
2025-03-05 00:12:28,Cramer's Lightning Round: 'You've got a winner in Cheesecake Factory',"""Mad Money"" host Jim Cramer rings the lightning round bell, which means he's giving his answers to callers' stock questions at rapid speed."
2025-03-04 23:49:46,Jim Cramer talks Trump tariffs and investor woes after Dow tumbles,CNBC's Jim Cramer laid out Wall Street's concerns over a trade war from Trump tariffs and offered his take on how the White House might view the issue.
2025-03-06 00:50:21,CrowdStrike CEO describes the escalating threat of foreign hackers,CrowdStrike CEO George Kurtz told CNBC's Jim Cramer on Wednesday that the cyber threat environment is only getting worse.
2025-03-06 00:01:58,Cramer's Lightning Round: 'Stay away from' Albemarle,"""Mad Money"" host Jim Cramer rings the lightning round bell, which means he's giving his answers to callers' stock questions at rapid speed."
2025-03-06 00:04:07,Cramer suggests Trump is upending the way investors evaluate stocks,CNBC's Jim Cramer reflected on Wednesday's uneven day of trading and suggested that President Donald Trump is changing the way investors view stocks.
2025-03-07 00:24:25,Cramer's Lightning Round: Don't sell Tetra Tech,"""Mad Money"" host Jim Cramer rings the lightning round bell, which means he's giving his answers to callers' stock questions at rapid speed."
2025-03-06 23:43:26,"A lack of clarity from the White House is driving stocks down, Jim Cramer says","CNBC's Jim Cramer on Thursday reflected on recent market turbulence, tying the decline to a lack of clarity from the White House."
2025-03-07 01:09:28,Gap CEO unpacks blowout quarter: 'The progress is real',Gap CEO Richard Dickson described the apparel company's most recent quarter.
2025-03-08 00:30:26,Jim Cramer names casual dining stocks to buy on the pullback,CNBC's Jim Cramer said there are buying opportunities in casual dining stocks as the market pulls back.
2025-03-08 00:09:06,Cramer's Lightning Round: Rigetti Computing is 'a meme stock',"""Mad Money"" host Jim Cramer rings the lightning round bell, which means he's giving his answers to callers' stock questions at rapid speed."
2025-03-08 00:07:33,"Cramer's week ahead: New inflation data, earnings from Oracle and Adobe",CNBC's Jim Cramer told investors what to look for on Wall Street next week.
2025-03-10 23:49:05,Jim Cramer explains why the White House sent Wall Street into a panic,CNBC's Jim Cramer opined on how President Donald Trump helped cause Monday's intense decline.
2025-03-10 23:31:55,"Don't let Monday's sell-off scare you out of the market entirely, Jim Cramer says",CNBC's Jim Cramer advised investors not to leave the market entirely because of the massive sell-off.
2025-03-10 23:17:53,Cramer's Lightning Round: Merck is a buy,"""Mad Money"" host Jim Cramer rings the lightning round bell, which means he's giving his answers to callers' stock questions at rapid speed."
2025-03-11 23:42:11,"Market action signals the White House should change course on tariffs, Jim Cramer says","CNBC's Jim Cramer suggested tariffs dictate recent market action, saying stocks indicate that the White House should take a different approach to the issue."
2025-03-11 23:08:30,Cramer's Lightning Round: 'We're going to stay away from' Sirius XM,"""Mad Money"" host Jim Cramer rings the lightning round bell, which means he's giving his answers to callers' stock questions at rapid speed."
2025-03-11 23:09:08,"Dell is a buy as the AI sector takes a hit, Jim Cramer says","As the market sell-off continues, CNBC's Jim Cramer suggested Dell is a good stock to buy even while investors lose faith in the validity of the AI boom."
2025-03-12 23:22:19,Cramer's Lightning Round: Waste Management is 'fantastic',"""Mad Money"" host Jim Cramer rings the lightning round bell, which means he's giving his answers to callers' stock questions at rapid speed."
2025-03-12 23:11:55,"Charts indicate Tesla could be ready to rally, Jim Cramer says",CNBC's Jim Cramer on Wednesday reviewed analysis from chartist Larry Williams that suggests Tesla's gains could be the start of a rally.
2025-03-12 22:51:56,"Fed rate cuts could ward off a serious recession, Jim Cramer says",CNBC's Jim Cramer analyzed Wednesday's market action.
2025-03-13 23:45:45,Cramer's Lightning Round: Nano Nuclear Energy is a sell,"""Mad Money"" host Jim Cramer rings the lightning round bell, which means he's giving his answers to callers' stock questions at rapid speed."
2025-03-13 22:42:26,Jim Cramer: The White House should change its messaging,"CNBC's Jim Cramer on Thursday lamented the negative sentiment surrounding the economy, which he thinks the White House is currently projecting."
