DATE,TITLE,SUMMARY
2025-03-13 23:31:18,Jim Cramer names retail stocks to buy as the market pulls back,"CNBC's Jim Cramer on Thursday highlighted two stocks in the retail space that he thinks investors have an opportunity to buy on the dip, Ralph Lauren and Gap."
2025-03-14 23:36:30,"Jim Cramer names IPOs to buy on weakness: Cava, Reddit and Viking","CNBC's Jim Cramer told investors how to make the most of a tough spell of market losses, advising them to find bargains in the IPO sector."
2025-03-14 23:04:18,"Cramer's week ahead: Fed meeting and earnings from FedEx, Micron and General Mills",CNBC's Jim Cramer walked investors through next week on Wall Street.
2025-03-14 22:56:01,Cramer's Lightning Round: SoundHound AI is a 'meme stock',"""Mad Money"" host Jim Cramer rings the lightning round bell, which means he's giving his answers to callers' stock questions at rapid speed."
2025-03-17 23:37:26,Cramer's Lighting Round: Intercontinental Exchange is 'a winner',"""Mad Money"" host Jim Cramer rings the lightning round bell, which means he's giving his answers to callers' stock questions at rapid speed."
2025-03-17 23:34:51,Papa John's CEO explains how the chain focuses on value for consumers,"In a Monday interview with CNBC's Jim Cramer, Papa John's CEO Todd Penegor described how the pizza franchise tweaked its methods to focus on value."
2025-03-17 23:16:49,Treasury Secretary Scott Bessent says corrections are 'healthy' and 'normal.' Jim Cramer disagrees,CNBC's Jim Cramer on Monday parsed recent market action.
2025-03-19 11:40:20,Dell CEO explains why he thinks the PC refresh cycle is starting,Dell Technologies CEO Michael Dell told CNBC's Jim Cramer on Tuesday why he thinks the PC refresh cycle is beginning.
2025-03-18 23:09:45,Cramer explains why investors are no longer paying up for AI stocks,"CNBC's Jim Cramer on Tuesday suggested that despite the fervor for AI, investors are no longer willing to pay high prices for stocks related to the technology."
2025-03-18 23:03:45,Cramer's Lightning Round: Uber is a buy,"""Mad Money"" host Jim Cramer rings the lightning round bell, which means he's giving his answers to callers' stock questions at rapid speed."
2025-03-20 00:42:45,Nvidia's Jensen Huang on why DeepSeek's new model will need ‘100 times more computing’,Nvidia CEO Jensen Huang spoke with CNBC's Jim Cramer about DeepSeek's new AI model.
2025-03-19 23:14:46,"Focus on long-term market trends like AI, Jim Cramer says",CNBC's Jim Cramer advised investors to set their sights on long-term market themes like artificial intelligence.
2025-03-19 23:43:30,Cramer's Lightning Round: Realty Income over Gladstone Land,"""Mad Money"" host Jim Cramer rings the lightning round bell, which means he's giving his answers to callers' stock questions at rapid speed."
2025-03-20 23:18:31,Nvidia CEO and Cisco CEO discuss the global outlook on the AI arms race,"In an interview CNBC's Jim Cramer, Nvidia CEO Jensen Huang and Cisco CEO Chuck Robbins described global leaders' fervor to compete in the AI arms race."
2025-03-20 23:06:40,Cramer's Lightning Round: Waste Management is a buy,"""Mad Money"" host Jim Cramer rings the lightning round bell, which means he's giving his answers to callers' stock questions at rapid speed."
2025-03-20 23:02:42,Jim Cramer says holding Home Depot stock is a good idea,Jim Cramer spoke with Home Depot CEO Ted Decker on how the company may thrive despite Trump's tariffs.
2025-03-21 23:56:00,Wynn Resorts CEO explains why the company is expanding into the UAE,Wynn Resorts CEO Craig Billings told CNBC's Jim Cramer on Friday why the casino giant decided to expand into the United Arab Emirates.
2025-03-21 23:56:31,"Cramer's week ahead: Earnings from GameStop, McCormick and Dollar Tree","CNBC's Jim Cramer on Friday listed the next week's top market-moving events, including earnings reports from GameStop, McCormick and Dollar Tree."
2025-03-21 22:55:40,Cramer's week ahead: Don't buy Twilio,"""Mad Money"" host Jim Cramer rings the lightning round bell, which means he's giving his answers to callers' stock questions at rapid speed."
2025-03-24 23:01:46,"Charts suggest subscription stocks like Netflix and Spotify can weather uncertainty, says Jim Cramer",CNBC's Jim Cramer on Monday reviewed analysis from chartist Bob Lang.
2025-03-24 23:03:56,"Monday's rally reflects hopes for a new 'path' on tariffs, Jim Cramer says","CNBC's Jim Cramer dissected Monday's market action, attributing stocks' rebound to investors' hopes for a clearer future on global trade."
2025-03-24 22:56:22,Cramer's Lightning Round: HCA is a buy,"""Mad Money"" host Jim Cramer rings the lightning round bell, which means he's giving his answers to callers' stock questions at rapid speed."
2025-03-25 23:48:04,Cramer's Lighting Round: Sell SoundHound AI,"""Mad Money"" host Jim Cramer rings the lightning round bell, which means he's giving his answers to callers' stock questions at rapid speed."
2025-03-25 23:34:10,'This might be the boom that doesn’t go bust': Jim Cramer remains optimistic about AI because of Big Tech's deep pockets,CNBC's Jim Cramer on Tuesday defended the artificial intelligence boom.
2025-03-25 23:29:28,Palo Alto Networks CEO describes cybersecurity risk with agentic AI,Palo Alto Networks CEO Nikesh Arora detailed how agentic AI technology brings new threats from cybercriminals.
2025-03-27 00:12:16,Paychex CEO explains why he doesn't see a recession on the horizon,Paychex CEO John Gibson told CNBC's Jim Cramer on Wednesday why he doesn't think a recession is imminent.
2025-03-26 23:09:42,Cramer's Lightning Round: 'I like' NextEra Energy,"""Mad Money"" host Jim Cramer rings the lightning round bell, which means he's giving his answers to callers' stock questions at rapid speed."
2025-03-26 23:01:47,Cramer tells Nvidia investors to prepare for 'turbulence',CNBC's Jim Cramer on Wednesday opined on declines in the tech sector.
2025-03-27 23:01:38,Cramer's Lighting Round: 'I would be a buyer' of Grail,"""Mad Money"" host Jim Cramer rings the lightning round bell, which means he's giving his answers to callers' stock questions at rapid speed."
2025-03-27 22:53:56,Cramer praises Uber stock: 'I don't think it's done going higher',CNBC's Jim Cramer on Thursday pinpointed Uber as a stock poised to perform well right now.
2025-03-27 22:50:19,Jim Cramer says 'the market may be far healthier than we think.' Here's why,"CNBC's Jim Cramer think sthe market may not be as grim as some on Wall Street fear, pointing to gains attained by stocks in energy, healthcare and finance."
2025-03-28 23:46:35,Cramer's week ahead: Inflation data and tariff news,CNBC's Jim Cramer walked investors through next week on Wall Street.
2025-03-28 23:52:28,CoreWeave CEO says debt is 'the fuel for this company',CoreWeave CEO Michael Intrator unpacked the cloud computing company's first day trading on the Nasdaq
2025-03-28 23:03:02,"Cramer's Lighting Round: Sportradar is 'a very interesting, intriguing stock'","""Mad Money"" host Jim Cramer rings the lightning round bell, which means he's giving his answers to callers' stock questions at rapid speed."
2025-03-31 23:18:33,Jim Cramer says Trump's behavior has overshadowed U.S. economic strength,CNBC's Jim Cramer said he believes investor sentiment has gotten too negative and could improve if President Donald Trump clarifies his tariff policies.
2025-04-01 23:16:29,Jim Cramer says a 20% tariff on most imports would be 'horrendous' for the economy,"CNBC's Jim Cramer sees five issues with President Donald Trump's potential 20% blanket tariffs, including their effect on inflation and domestic manufacturing."
2025-04-02 23:36:13,Jim Cramer says Trump tariffs are more punitive than reciprocal,"As President Donald Trump announced 'reciprocal tariffs' on Wednesday, CNBC's Jim Cramer said the president is focused on punishing U.S. trading partners."
2025-04-03 22:39:07,Jim Cramer says investors should follow the post-dot-com-bubble playbook,"As tariffs tanked stocks on Thursday, CNBC's Jim Cramer believes investors should look to the same sectors that rose after the dot-com bubble burst in 2000."
2025-04-04 23:31:08,Cramer's week ahead: Banks kick off critical earnings season,"After President Donald Trump's tariffs crushed stocks, CNBC's Jim Cramer said next week's earnings will provide a look at how CEOs are dealing with the fallout."
2025-04-07 22:30:00,Jim Cramer says a recession is likely but investors shouldn't panic sell,"CNBC's Jim Cramer said on Monday that although he believes an economic recession is likely, investors should stay the course rather than panic and sell."
2025-04-08 22:36:30,Jim Cramer says the market can't keep up with President Trump,"As stocks initially soared before falling on Tuesday, CNBC's Jim Cramer said the market is not equipped to react to President Donald Trump's tariff policies."
2025-04-09 23:12:14,Jim Cramer shares 4 lessons learned from Trump tariff turmoil,"As stocks cheered President Trump's tariff pause on Wednesday, CNBC's Jim Cramer shared four lessons from the past week of market action."
2025-04-10 23:08:52,KeyCorp CEO talks tariff impact: 'The notion of reshoring is real',KeyCorp CEO Chris Gorman told CNBC's Jim Cramer that the U.S.'s new tariffs will likely lead to reshoring.
2025-04-10 22:56:34,Cramer's Lightning Round: 'No' to Applied Digital,"""Mad Money"" host Jim Cramer rings the lightning round bell, which means he's giving his answers to callers' stock questions at rapid speed."
2025-04-10 22:41:33,"Trump's new tariff on China is 'more of an embargo,' Jim Cramer says",CNBC's Jim Cramer on Thursday gave investors his read on what steep tariffs on China mean for the U.S. economy.
2025-04-11 23:30:27,Jim Cramer explains the best way to pick stocks right now,CNBC's Jim Cramer on Friday explained how he might navigate the market in this turbulent economic environment.
2025-04-11 22:56:59,"Jim Cramer's week ahead: Earnings from Goldman Sachs, Johnson & Johnson and Netflix",CNBC's Jim Cramer on Friday told investors which market-moving events to follow next week.
2025-04-11 22:55:18,Cramer's Lightning Round: Don't buy Occidental Petroleum,"""Mad Money"" host Jim Cramer rings the lightning round bell, which means he's giving his answers to callers' stock questions at rapid speed."
2025-04-14 23:14:49,RBN Energy CEO says you can't have lower oil prices and boost production: 'It doesn't make any sense',"In a Monday interview with CNBC's Jim Cramer, RBN Energy executive Rusty Braziel gave his read on the oil industry."
2025-04-14 22:58:24,Cramer's Lightning Round: 'I'm going to have to say no to Ardmore Shipping',"""Mad Money"" host Jim Cramer rings the lightning round bell, which means he's giving his answers to callers' stock questions at rapid speed."
2025-04-14 22:50:28,Jim Cramer explains why these market themes are working right now,CNBC's Jim Cramer on Monday explained why he thinks certain sectors can do well on the market right now.
2025-04-15 22:55:36,Cramer's Lightning Round: 'You have to trim' Nvidia,"""Mad Money"" host Jim Cramer rings the lightning round bell, which means he's giving his answers to callers' stock questions at rapid speed."
2025-04-15 22:52:41,Jim Cramer presses Trump administration on stalled deregulation,CNBC's Jim Cramer on Tuesday questioned some of the Trump administration's regulatory choices and offered some of his own ideas.
2025-04-15 22:49:19,"Shares of CVS and Dollar General made a turnaround due to their 'newfound sole survivor status,' Jim Cramer says",CNBC's Jim Cramer on Tuesday suggested why CVS and Dollar General have seen gains recently after lagging last year.
2025-04-16 23:17:33,"Even with tariffs looming, Jim Cramer says consumer companies must cut prices",CNBC's Jim Cramer on Wednesday told investors it is likely consumer-oriented companies will be compelled to lower prices.
2025-04-16 23:06:09,"Trump's tariff policies have put Big Tech in a jam, Jim Cramer says",CNBC's Jim Cramer on Wednesday opined on how Trump's tariffs will impact Big Tech.
2025-04-16 22:59:01,Cramer's Lightning Round: American Financial Group is a buy,"""Mad Money"" host Jim Cramer rings the lightning round bell, which means he's giving his answers to callers' stock questions at rapid speed."
2025-04-17 23:38:09,"Cramer's week ahead: Earnings from Tesla, Alphabet, Capital One and Boeing",CNBC's Jim Cramer guided investors through an earnings-heavy week.
2025-04-17 23:28:05,Former DOJ antitrust chief Jonathan Kanter describes how the ad world might evolve after Google loses antitrust case,Former DOJ antitrust leader Jonathan Kanter unpacked Google's recent loss in court.
2025-04-17 22:58:12,Cramer's Lightning Round: 'I want you to stay away from' AMC,"""Mad Money"" host Jim Cramer rings the lightning round bell, which means he's giving his answers to callers' stock questions at rapid speed."
