INDEX,DOWNLOAD_TIME,DATE,TITLE,SUMMARY
0,2022-01-24 14:27:18.602131,2022-01-24 05:00:00,Why Texas election officials are rejecting hundreds of vote-by-mail applications,"A poll worker in Austin, Texas, stamps a voter's 2020 ballot before dropping it into a secure box. Ahead of the state's March primary, local"
1,2022-01-24 14:27:18.602131,2022-01-24 05:00:00,Pelosi opens the door to stock trading ban for members of Congress,"House Speaker Nancy Pelosi, D-Calif., told reporters she doesn't think new laws governing lawmakers' investments are needed, but if members "
2,2022-01-24 14:27:18.602131,2022-01-24 05:00:00,How Biden is trying to clean up his comments about Russia and Ukraine,"President Biden planned to talk about infrastructure on the anniversary of his inauguration. But first, he had to clean up some comments he "
3,2022-01-24 14:27:18.602131,2022-01-24 05:00:00,The Jan. 6 panel wants to talk to Ivanka Trump,"Former President Donald Trump and daughter Ivanka Trump walk to Marine One on the South Lawn of the White House on Jan. 4, 2020"
4,2022-01-24 14:27:18.602131,2022-01-24 05:00:00,Schumer insists failed votes on voting rights and filibuster were right thing to do,"Senate Majority Leader Chuck Schumer, D-N.Y., speaks during a news conference Tuesday on Capitol Hill following a Senate Democratic Caucus "
5,2022-01-24 14:27:18.602131,2022-01-24 05:00:00,District attorney in Georgia asks for a special grand jury for Trump election probe,"In Georgia, Fulton County District Attorney Fani Willis is weighing whether Donald Trump and others committed crimes by trying to pressure "
6,2022-01-24 14:27:18.602131,2022-01-24 05:00:00,Families are in distress after the first month without the expanded child tax credit,"Children draw on top of a canceled check prop during a rally in favor of the child tax credit in front of the U.S. Capitol on Dec. 13, 2021"
7,2022-01-24 14:27:18.602131,2022-01-24 05:00:00,Biden's limits on ICE offered hope. But immigrant advocates say he's broken promises,"U.S. Immigration and Customs Enforcement's fugitive operations team makes an arrest at a home in Paramount, Calif., on March 1, 2020"
8,2022-01-24 14:27:18.602131,2022-01-24 05:00:00,Federal court blocks Biden's vaccine mandate for federal workers,President Biden speaks in October about the coronavirus pandemic and encouraged states and businesses to support vaccine mandates
9,2022-01-24 14:27:18.602131,2022-01-24 05:00:00,There's now a phone line to order your free at-home COVID tests,The website COVIDTests.gov allows people to order four at-home tests per residence and have them delivered by mail. Now there's a phone 
