INDEX,DOWNLOAD_TIME,DATE,TITLE,SUMMARY
0,2023-03-16 11:13:37.666287,2023-03-16 13:00:22,What Will The Fed Do In March?,"The Federal Open Market Committee meets next week, at which time it is expected to raise its benchmark interest rate another 50 basis points, to a range of 4.75% to 5.00%, if we correctly interpret Fed Chair Jerome Powell’s testimony to Congress last week, when he said “the ultimate level of interest rates is likely [&#8230;]"
1,2023-03-15 11:13:37.152544,2023-03-15 13:00:15,How to Steer Clear of the Silicon Valley Bank Meltdown,"Editor’s Note: Our experts here at INO.com cover a lot of investing topics and great stocks every week. To help you make sense of it all, every Wednesday we’re going to pick one of those stocks and use Magnifi Personal to compare it with its peers or competitors. Here we go… Bank stocks have dropped [&#8230;]"
2,2023-03-14 11:13:36.662833,2023-03-14 13:00:23,"""50 Cent"" Profits From 3-Letter Acronyms","In February 2023, the US economy produced 311,000 jobs, surpassing market expectations of 205,000, and revised down from 504,000 in January. This indicates a labor market that remains tight, with an average of 343,000 jobs added per month over the previous six months. This is another upbeat NFP report following last month's even stronger data. [&#8230;]"
3,2023-03-13 11:13:36.403677,2023-03-13 14:31:47,What Is ESG Investing?,"Business malpractices are pretty hard to be swept under the rug any longer. Moreover, pursuing positive changes has gripped the world recently as the world increasingly faces environmental and sustainability concerns. Recently, ESG investments were pushed into the limelight after the Senate voted to overturn a Labor Department rule that permits fiduciary retirement fund managers [&#8230;]"
4,2023-03-11 10:13:35.394718,2023-03-10 16:58:16,Trade With Jim Cramer With New ETF,"Anyone who regularly watches or has only seen Jim Cramer’s TV show “Mad Money” even just once notices that the former fund manager, now a TV personality, makes a ton of stock recommendations while on air. So many that it is hard to keep up with what companies he likes and which ones he would [&#8230;]"
5,2023-03-10 10:13:33.504337,2023-03-09 16:31:20,Silver Lining For These Two Stocks,"While the price of gold (GLD) has been pummeled over the past month, it’s the silver price (SLV) that has taken the real beating. This is evidenced by the industrial metal finding itself more than 18% off its recent highs, more than double the ~7% correction of gold in the same period. The violent decline [&#8230;]"
6,2023-03-09 10:13:33.134010,2023-03-08 15:54:49,Semiconductors Are Heating Up - Here's The Best One,"Editor’s Note: Our experts here at INO.com cover a lot of investing topics and great stocks every week. To help you make sense of it all, every Wednesday we’re going to pick one of those stocks and use Magnifi Personal to compare it with its peers or competitors. Here we go… The never-ending demand for [&#8230;]"
7,2023-03-08 10:13:32.757587,2023-03-07 17:46:32,Best Growth Stock? One To Watch Now,"Twilio Inc. (TWLO) enables developers to build, scale, and operate real-time communications within software applications through a cloud communication platform and a customer engagement platform. The company operates both in the United States and internationally. Over the past three years, TWLO’s revenues have increased at a 50% CAGR. Its total assets increased at a 34.6% [&#8230;]"
8,2023-03-07 10:13:31.221762,2023-03-06 17:23:13,Gold Update: Is Half Enough?,"Since my last major update in November, the gold futures price has increased by almost 12%. At that time, most readers had chosen the bullish target of $2,089, where the price would retest the all-time high. The gold futures chart is due for an update as it has reached a significant point in the current [&#8230;]"
9,2023-03-05 12:05:20.909404,2023-03-05 14:00:19,1 No-Brainer Gaming Stock For 2023,"After witnessing unprecedented growth during the pandemic, videogame publishers are witnessing a reversion to the mean with a reversal to pre-pandemic lifestyles amid macroeconomic uncertainties driven by inflation and increased borrowing costs due to interest-rate hikes. However, despite the softened demand in the broader industry, incumbents, like Activision Blizzard, Inc (ATVI), have cornered pockets of [&#8230;]"
