INDEX,DOWNLOAD_TIME,DATE,TITLE,SUMMARY
0,2022-09-03 11:50:24.267859,2022-09-02 08:30:00,Trump is heading to Pennsylvania to make his case. So is Biden.,It’s no accident the current and former presidents are both stumping in the Keystone state this weekend.
1,2022-09-03 11:50:24.267859,2022-09-02 14:10:36,Why Sarah Palin’s loss is a warning for the GOP,"A chunk of Alaska’s Republican voters, who strongly favored Trump in 2020, preferred a Democrat over the lightning-rod candidate."
2,2022-09-03 11:50:24.267859,2022-09-03 15:31:11,Fuel leak ruins NASA’s 2nd shot at launching moon rocket,"The first attempt earlier in the week was also marred by escaping hydrogen, but those leaks were elsewhere on the 322-foot rocket, the most powerful ever built by NASA."
3,2022-09-03 10:48:09.330004,2022-09-03 12:38:29,The seeds of Biden’s democracy speech sprouted long before the Mar-a-Lago search,"But the actions of Trump and his supporters, along with threats of violence, sped up Biden’s need to address the nation."
4,2022-09-03 10:48:09.330004,2022-09-02 16:08:43,Climate chief Gina McCarthy leaving White House as John Podesta returns,Her departure comes as the administration moves on to the next phase of Biden’s climate agenda.
5,2022-09-03 10:48:09.330004,2022-09-03 11:00:00,Eating While Politicking Is Harder Than It’s Ever Been. Here’s Why.,"Eating on the campaign trail has never been easy. But in today’s diverse, stratified America, it’s more perilous than ever."
6,2022-09-03 10:48:09.330004,2022-09-02 08:30:00,A Conservative Publisher Wants to Be the Answer to Liberal Children’s Books. There’s Just One Problem.,"The books aren’t bad, necessarily. They’re just not for kids."
7,2022-09-03 07:39:40.148662,2022-09-02 08:30:00,How Trump Taught Everybody to Be Obnoxious and Cruel,"Trump's instinct for casual savagery used to be abnormal. Now it's part of the everyday diet of American political life, replicated by both Democrats and Republicans."
8,2022-09-03 07:39:40.148662,2022-09-02 08:31:00,A MAGA Answer to Vogue Offers Advice on Owning the Libs – and Season’s Best Fashions,"The Conservateur, a fledgling, ideologically flavored women’s publication, mixes fashion, lifestyle and red meat. It also just might say something about where our culture is headed."
9,2022-09-03 07:39:40.148662,2022-09-02 15:10:01,"Prosecutors detail items seized from Trump estate, including dozens of empty ‘classified’ folders",The disclosure came in a federal court filing released Friday.
10,2022-09-03 00:46:04.581847,2022-09-02 19:51:47,Bill Barr: The facts show the Feds were being ‘jerked around’ by Trump,The former attorney general has been an open critic of the former president.
11,2022-09-02 21:20:21.636877,2022-09-03 11:01:00,Flying’s summer of hell goes out with a bang,"The airlines’ hot mess in the skies is also drawing the ire of lawmakers, and becoming a growing problem for Transportation Secretary Pete Buttigieg to figure out."
12,2022-09-02 21:20:21.636877,2022-09-03 11:00:00,It’s a global phenomenon — now New York is poised to lead the nation in congestion pricing,Political squabbles and private interests are harrying the long-awaited tolling program.
13,2022-09-02 21:20:21.636877,2022-09-03 11:00:00,New data shows thousands of transgender Medicaid recipients sought care in Florida,Florida’s Medicaid regulator released the data about three weeks after it blocked coverage for transition-related medical care in early August.
14,2022-09-02 17:54:38.664626,2022-09-03 11:00:00,Jackson's water emergency exposes a dilemma for Biden,The president has pledged to steer funding to impoverished communities with histories of pollution and discrimination. But can he win cooperation from GOP-led states?
15,2022-09-02 17:54:38.664626,2022-09-02 23:13:31,Biden’s U.S.-Pacific island summit targets China’s growing influence,U.S. seeks to stymie contagion effect of Solomon Islands’ Beijing tilt.
16,2022-09-02 17:54:38.664626,2022-09-03 11:50:00,Hungary's Orbán travels to Moscow for Gorbachev's funeral,
17,2022-09-02 17:54:38.655930,2022-09-03 01:40:22,U.S. Border Patrol: 8 migrants die trying to cross Rio Grande,"U.S. officials recovered six bodies, while Mexican teams recovered two others, according to a CBP statement."
18,2022-09-02 17:54:38.655930,2022-09-03 00:46:28,Jan. 6 committee withdraws subpoena for RNC data,The committee decided that the effort to obtain the data has been overtaken by other developments in the investigation.
19,2022-09-02 17:54:38.655930,2022-09-02 23:55:00,FTC digs in on Amazon's iRobot deal,The agency takes the first step toward an iRobot investigation just as it pushes forward with One Medical probe.
20,2022-09-02 17:54:38.655930,2022-09-02 22:36:05,IRS mistakenly disclosed private taxpayer information,The data was posted on its website for a year before being recently discovered and removed.
21,2022-09-02 17:54:38.655930,2022-09-02 18:06:18,Biden’s Iran envoy to give classified briefing on nuclear talks,"Last week, negotiators seemed to be making progress toward reviving the Iran nuclear deal, after Iran appeared to drop several key demands."
22,2022-09-02 17:54:38.655930,2022-09-02 17:27:35,"White House requests $47 billion in aid for Ukraine, virus fights and natural disasters",The White House said it is asking that the continuing resolution Congress also provides funding for “immediate needs” in the first quarter of fiscal year 2023.
23,2022-09-02 17:54:38.655930,2022-09-02 17:24:34,VA plans to offer abortion services to certain veterans and beneficiaries,"The VA submitted an interim final rule that would enable it to provide abortions when the life or health of a veteran or beneficiary is in peril, or in cases of rape or incest."
24,2022-09-02 17:54:38.655930,2022-09-02 03:11:30,Man detained after pointing gun at Argentine vice president,"The man, who had not been identified, was detained seconds into the incident."
25,2022-09-02 17:54:38.655930,2022-09-01 23:27:24,Judge tosses suit from former Trump adviser over Russia surveillance,"Trump-appointed federal judge calls allegations ""troubling,"" but no grounds for civil suit."
26,2022-09-02 17:54:38.655930,2022-09-01 22:48:42,Jan. 6 select panel asks Newt Gingrich to testify,It’s the select panel’s first notable public step in weeks.
27,2022-09-02 17:54:38.655930,2022-09-01 18:53:39,Opinion | The Trump Show Is Good for Trump — and Biden,"When the current president rails against the former guy, both get the lift they need for 2024."
28,2022-09-02 17:54:38.655930,2022-08-30 08:30:00,Opinion | Could This Flag Help Bring Brittney Griner Home?,<i>Robert C. O’Brien was Special Envoy for Hostage Affairs from 2018-2019 and U.S. National Security Advisor from 2019-2021.
29,2022-09-02 17:54:38.655930,2022-08-31 08:30:00,8 Devastating Presidential Insults,Trump’s got nothing on these.
30,2022-09-02 17:54:38.655930,2022-08-31 17:46:45,Opinion | The Messianic Trump Cult,"To the perpetual surprise of hard-core Trump supporters, the 2020 election can’t be undone."
31,2022-09-02 17:54:38.655930,2022-08-31 08:30:00,‘Gorbachev Is Hard to Understand’,"After 14 years of conversations, the Russian reformer’s ultimate undoing finally became clear."
32,2022-09-02 17:54:38.655930,2022-08-29 14:00:00,Opinion | Why Trump’s Documents Case Is Really Just Like a Drug Prosecution,He had possession of something he shouldn’t have. It’s that simple.
33,2022-09-02 17:54:38.655930,2022-08-28 11:00:00,What I Learned About Media Rage After Getting Fired From Fox,I was fired from my job on Decision Desk after calling the election for Biden in 2020. The funny thing is I should have seen it coming.
34,2022-09-02 17:54:38.655930,2022-08-26 12:56:41,Trump Didn’t Kill Reaganism. These Guys Did.,A new book argues that Ronald Reagan’s election actually marked the end of an era of conservatism — and opened the door to the angrier politics that took Reaganism’s place.
35,2022-09-02 17:54:38.655930,2022-08-26 08:30:00,A Putin Critic Fell from a Building in Washington. Was It Really a Suicide?,D.C. police say they don’t suspect foul play. Fellow activists are incensed. And the city where it happened is barely paying attention.
36,2022-09-02 17:54:38.655930,2022-08-26 08:30:00,Ro Khanna’s Apology Tour. And Why Trump Voters Love It.,The congressman from Silicon Valley is pressure-testing a message that he thinks could save the Democratic party in the industrial Midwest.
37,2022-09-02 17:54:38.655930,2022-08-26 08:30:00,‘Are We the Problem?’ The New Dean of Columbia J-School Wrestles With Its Place in the Industry,Does J-school even matter anymore? Jelani Cobb is on a mission to mold the next generation of journalists. But first comes fundraising.
38,2022-09-02 17:54:38.655930,2022-08-25 14:34:48,Opinion | Taxing Tech Companies for the Failure of the News Industry Is Just Unfair,"Google and Facebook didn’t kill newspapers, despite what you’ve read. It was self-inflicted."
39,2022-09-02 17:54:38.655930,2022-09-03 11:50:00,Republicans are poised to win the House and Senate. Welcome to our Election Forecast.,We rated every race in play in the midterms. Here’s who we think will win.
40,2022-09-02 17:54:38.655930,2022-09-02 08:30:00,The nation’s cartoonists on the week in politics,"Every week political cartoonists throughout the country and across the political spectrum apply their ink-stained skills to capture the foibles, memes, hypocrisies and other head-slapping events in the world of politics. The fruits of these labors are hundreds of cartoons that entertain and enrage readers of all political stripes. Here's an offering of the best of this week's crop, picked fresh off the Toonosphere. Edited by Matt Wuerker."
41,2022-09-02 17:54:38.655930,2022-09-01 17:21:35,Judge again rejects Graham bid to throw out subpoena in Atlanta-area Trump probe,District Court Judge Leigh Martin May said she was “unpersuaded by the breadth of Senator Graham’s argument.”
42,2022-09-02 17:54:38.655930,2022-09-01 15:33:01,Attorney connected to Oath Keepers charged with obstructing Jan. 6 session of Congress,"The U.S. Attorney’s office in Washington, D.C., said Kellye SoRelle, 43, was arrested in Junction, Texas, early Thursday."
43,2022-09-02 17:54:38.655930,2022-09-01 16:47:16,Judge considers temporary limit on DOJ access to Trump documents,"DOJ attorneys pushed back sharply against any such limits, warning against disruption of their ongoing criminal investigation."
44,2022-09-02 17:54:38.655930,2022-08-31 13:23:50,Garland’s perilous path to prosecuting Trump,The attorney general has multiple hurdles to overcome if he really wants to bring a criminal case against the former president.
45,2022-09-02 17:54:38.655930,2022-08-30 21:58:32,Biden dodges the August curse,<i>Christopher Cadelago is a White House correspondent at POLITICO.
46,2022-09-02 17:54:38.655930,2022-09-01 16:01:14,Biden addresses nation: ‘Too much of what’s happening ... today is not normal’,Meridith McGraw is a POLITICO reporter.
47,2022-09-02 17:54:38.655930,2022-09-02 01:45:10,Republicans attack administration agenda in response to Biden's 'soul of the nation' address,Democrats praised Biden's calls for unity.
48,2022-09-02 17:54:38.655930,2022-08-30 21:15:00,‘Where the hell are we?’: Biden slams Republicans for encouraging political violence,The president’s visit to Pennsylvania on Tuesday is his first of three over the next week to the midterm battleground state.
49,2022-09-02 17:54:38.655930,2022-09-01 08:30:00,Dr. Oz and David McCormick will finally reunite,"The former foes are set to appear at a foreign policy event next week, hosted by Trump’s former State Dept. spokesperson."
