INDEX,DOWNLOAD_TIME,DATE,TITLE,SUMMARY
0,2022-10-01 15:16:12.313872,2022-10-01 11:07:48,Tudor Dixon seeks a culture war in campaign against Michigan Gov. Gretchen Whitmer,"Tudor Dixon, the Republican taking on Michigan Gov. Gretchen Whitmer in November's midterm election, is turning to tactics that have worked for other Republican winners in competitive governor's races as she seeks to turn the race into a cultural battle over education, transgender athletes and more."
1,2022-10-01 15:16:12.313872,2022-10-01 15:16:00,"Police buy students, teachers ice cream to welcome the school year",
2,2022-10-01 15:16:12.313872,2022-10-01 15:16:00,Quadruple shooting leaves 1 person in critical,
3,2022-10-01 15:16:12.313872,2022-10-01 15:16:00,Man charged with murdering mother,
4,2022-10-01 15:16:12.309352,2022-10-01 13:58:02,Firefly successfully launches uncrewed rocket,"Texas-based commercial rocket company Firefly launched a rocket into space Friday morning, about a year after a previous attempt ended in an explosion."
5,2022-10-01 15:16:12.309352,2022-09-30 18:55:22,"At least 25 deaths in Puerto Rico may be linked to Hurricane Fiona, island health department says","Less than two weeks after Hurricane Fiona barreled through Puerto Rico, the island's health department says at least 25 deaths may be linked to the storm."
6,2022-10-01 15:16:12.309352,2022-09-30 18:06:53,Bay Area sheriff's office audit reveals 45 officers failed psychological evaluation,"In Alameda County, just across the bay from San Francisco, 45 sheriff's deputies have had their guns taken away."
7,2022-10-01 15:16:12.309352,2022-09-30 18:59:28,"Several states are sending out inflation relief checks, but some economists say they could further fuel rising prices","Several states are sending taxpayers money to help them cope with inflation, but some economists warn that the payments will do little to alleviate the pain of rising costs and could further fuel inflation."
8,2022-10-01 15:16:12.309352,2022-09-30 21:38:28,Election workers to be trained to deal with violence at polls as midterms approach,"Federal officials are offering state and local election officials training to ""safely de-escalate"" confrontations with voters that could turn violent ahead of November's midterm elections, according to an email to election workers obtained by CNN."
9,2022-10-01 15:16:12.309352,2022-10-01 02:17:11,Government shutdown averted as Biden signs funding bill,"The House of Representatives voted on Friday to approve a stopgap bill to fund the government through December 16, averting a shutdown just hours ahead of a midnight deadline when funding was set to expire."
10,2022-10-01 15:16:12.309352,2022-10-01 00:04:14,Biden reestablishes arts committee that was dissolved over Trump's handling of Charlottesville,"President Joe Biden issued an executive order on Friday that includes a provision reestablishing the President's Committee on the Arts and the Humanities, a panel that was dissolved in 2017 when the committee's members resigned over then-President Donald Trump's handling of a deadly White nationalist rally in Charlottesville, Virginia."
11,2022-10-01 15:16:12.309352,2022-10-01 13:19:30,Spam is cool again. Here's why,Spam is cool.
12,2022-10-01 15:16:12.309352,2022-09-30 10:56:28,"Swiss court, in favor of Lindt, orders Lidl to destroy its chocolate bunnies","Lindt & Spruengli's foil-wrapped chocolate bunnies deserve protection from copycat products, Switzerland's highest court ruled on Thursday, and ordered German discounter Lidl to stop selling a similar product in Switzerland and to destroy its remaining stock."
13,2022-10-01 15:16:12.309352,2022-09-30 20:06:52,Dow suffers worst month since March 2020,"September was a horrible month for stocks. The Dow fell nearly 9%, its worst monthly drop since March 2020, when pandemic lockdowns started in the United States. The index ended Friday deeply in the red, too."
14,2022-10-01 15:16:12.309352,2022-09-30 17:54:07,"Americans are still weighed down by high inflation, though sentiment is improving",Americans are feeling more positive about the economy and believe inflation will settle down — but plenty of uncertainty is still swirling.
15,2022-10-01 15:16:12.309352,2022-10-01 15:16:00,10 y/o author on a mission to help end hunger,
16,2022-10-01 15:16:12.309352,2022-10-01 15:16:00,4th grader saves choking classmate,
17,2022-10-01 15:16:12.309352,2022-10-01 15:16:00,Reporter reunites w/ woman he rescued from flood,
18,2022-10-01 15:16:12.309352,2022-10-01 15:16:00,Boil water advisory affecting 11K customers,
19,2022-10-01 15:16:12.309352,2022-10-01 15:16:00,"Person kills bear that was eating chickens, goats",
20,2022-10-01 15:16:12.309352,2022-10-01 15:16:00,Man claims apartment while he was on vacation,
21,2022-10-01 15:16:12.309352,2022-10-01 15:16:00,Woman indicted for allegedly trying to kill cops,
22,2022-10-01 15:16:12.309352,2022-10-01 15:16:00,Community members rally try to save their police department,
23,2022-10-01 15:16:12.309352,2022-10-01 15:16:00,"""Hot Girl Walk"" your way to mental health",
24,2022-10-01 15:16:12.309352,2022-10-01 15:16:00,Man pleads guilty in murders of 2 farmers,
25,2022-10-01 15:16:12.309352,2022-10-01 15:16:00,Woman shot at least 14 times in front of children,
26,2022-10-01 15:16:12.309352,2022-10-01 15:16:00,One woman is running an entire police operation,
27,2022-10-01 15:16:12.309352,2022-10-01 15:16:00,Strange moves out after living in home for sale,
28,2022-10-01 15:16:12.309352,2022-10-01 15:16:00,Lion cubs born in zoo for the first time in years,
