INDEX,DOWNLOAD_TIME,DATE,TITLE,SUMMARY
0,2024-03-10 16:16:52.261597,2024-03-10 19:59:14,Marc Lore Is Trying to Build the Amazon of Food Delivery,"Marc Lore, the entrepreneur behind Diapers.com and Jet.com, would like to disrupt food delivery. But he really wants to build a brand that actually lasts."
1,2024-03-10 16:16:52.261597,2024-03-10 09:00:55,Debate Over Bank Industry Rules One Year After SVB Collapse,Silicon Valley Bank’s collapse last March set the stage for a clash between bankers and their regulators.
2,2024-03-10 16:16:52.261597,2024-03-10 00:30:33,Boeing Subject of Criminal Inquiry by DOJ,The investigation is tied to an incident on an Alaska Airlines flight in early January. Boeing also told a Senate panel that it cannot find a record of the work done on the Alaska plane.
3,2024-03-10 16:16:52.261597,2024-03-10 00:03:39,Potential Obstacle to Trump Media’s Merger Appears to Have Been Cleared,Two early founders of Donald Trump’s social media company reached a temporary truce with the company on Saturday.
4,2024-03-10 16:16:52.261597,2024-03-10 18:05:00,Jool Baby Infant Swings Recalled Over Suffocation Hazard,Federal regulators said that the Jool Baby swings should not have been marketed as sleep products because they have an incline angle that is not safe.
5,2024-03-10 16:16:52.261597,2024-03-10 16:47:06,Elon Musk Has a Giant Charity. Its Money Stays Close to Home.,"After making billions in tax-deductible donations to his philanthropy, the owner of Tesla and SpaceX gave away far less than required in some years — and what he did give often supported his own interests."
6,2024-03-10 16:16:52.261597,2024-03-10 16:52:50,"William Whitworth, Revered Writer and Editor, Is Dead at 87","After writing memorable character sketches and fine-tuning others’ copy at The New Yorker, he spent two decades as editor in chief of The Atlantic Monthly."
7,2024-03-09 15:16:51.725177,2024-03-09 18:13:40,How Trump’s Justice Dept. Derailed an Investigation of a Major Company,The industrial giant Caterpillar hired William Barr and other lawyers to defuse a federal criminal investigation of alleged tax dodges.
8,2024-03-09 15:16:51.725177,2024-03-09 20:24:50,The Surprising Left-Right Alliance That Wants More Apartments in Suburbs,The YIMBY movement isn’t just for liberals any more. Legislators from both sides of the political divide are working to add duplexes and apartments to single-family neighborhoods.
9,2024-03-09 15:16:51.725177,2024-03-09 08:00:35,Inside the World of People Placing Bets on Oscar Winners,Inside the world of people making bets on the winners of the Academy Awards — with some taking home thousands of dollars.
10,2024-03-09 15:16:51.725177,2024-03-09 17:07:29,A New Film at SXSW Warns of the Potential Harm of Microplastics,"At SXSW, a documentary traces the arc of plastics in our lives, and highlights evolving research of the potential harm of its presence in our bodies."
11,2024-03-09 15:16:51.725177,2024-03-09 13:00:02,What Would Paying Student Athletes Look Like?,A college team’s vote to unionize adds pressure on the N.C.A.A. to abandon rules that forbid paying student athletes like employees.
12,2024-03-09 15:16:51.725177,2024-03-09 17:46:44,BMW Is a Surprise Winner in Electric Vehicles,"Once considered a laggard, the German luxury carmaker is one of only a few established automakers that has been able to compete effectively against Tesla."
13,2024-03-09 15:16:51.725177,2024-03-09 10:02:30,Toyota’s Hybrid-First Strategy Is Delivering Big Profits,"Toyota, the world’s largest automaker, has been criticized for selling few electric vehicles, but its decision to focus on hybrids is paying off financially."
14,2024-03-09 15:16:51.725177,2024-03-09 19:57:30,How Fraudsters Break Into Social Security Accounts and Steal Benefits,Thousands of people receiving Social Security benefits have had their money diverted into criminal accounts. Here’s what to know.
15,2024-03-09 15:16:51.725177,2024-03-08 23:58:28,"With Cyberattack Fix Weeks Away, Health Providers Slam United","Hospitals, doctors and clinics expressed frustration that they will have to wait even longer for reimbursements after hackers paralyzed the largest U.S. billing clearinghouse."
16,2024-03-09 15:16:51.725177,2024-03-08 22:42:44,Ratings Jump 18% for Biden’s Feisty State of the Union,"President Biden attracted about five million more viewers than last year for his prime-time address on Thursday, Nielsen said."
17,2024-03-09 15:16:51.725177,2024-03-09 14:06:32,"Max Hardy, 40, Dies; Helped Bring Chef-Driven Cuisine to Detroit","With his unique blend of Lowcountry and Caribbean influences, he ranked among the best of a new generation of Black culinary wizards."
18,2024-03-09 15:16:51.725177,2024-03-08 20:59:11,States Dig Into Homeowners Insurance and Why It’s Hard to Buy,State regulators asked more than 400 companies for data on their homeowners insurance businesses. The inquiry comes at a moment when severe weather is increasing risk.
19,2024-03-09 15:16:51.725177,2024-03-08 21:00:03,New York-Style Bagels Are Making It Big in London,"Bakeries selling big, doughy bagels have opened to rave reviews in Britain, but some traditionalists are standing by the London “beigel.”"
20,2024-03-09 15:16:51.725177,2024-03-08 15:51:25,"What History and Economics Suggest About Biden-Trump, Round 2","Underlying economic and market factors mattered in previous presidential rematches. They may help President Biden, even if polls aren’t showing that so far."
21,2024-03-08 15:16:51.296546,2024-03-08 14:00:34,Car Deals Are Easier to Find but Lenders Are Tightening Their Terms,It has become harder for some borrowers to get affordable car loans as banks and dealerships face a rising number of delinquencies.
22,2024-03-08 15:16:51.296546,2024-03-08 23:18:13,Biden Targets Big Business and Billionaires,The president used his State of the Union address to plug his economic record and announce a policy wish list that involves raising taxes on multinationals and the wealthy.
23,2024-03-08 15:16:51.296546,2024-03-08 15:06:17,A.L.S. Drug Relyvrio Fails Clinical Trial and May Be Withdrawn From the Market,"Leaders of the treatment’s manufacturer, Amylyx, said they would announce their plans for it within eight weeks."
24,2024-03-08 15:16:51.296546,2024-03-08 11:45:07,F.D.A. Delays Action on Closely Watched Alzheimer’s Drug,"Eli Lilly’s donanemab was expected to be approved this month, but the agency has decided to convene a panel of independent experts to evaluate the drug’s safety and efficacy."
25,2024-03-08 15:16:51.296546,2024-03-08 10:04:24,Biden Portrays Next Phase of Economic Agenda as Middle-Class Lifeline,"The president used his State of the Union speech to pitch tax increases for the rich, along with plans to cut costs and protect consumers."
26,2024-03-08 15:16:51.296546,2024-03-09 12:13:34,"U.S. Employers Add 275,000 Jobs in Another Strong Month","Economists are trying to gauge whether forecasts of a slowing labor market were mistaken or just premature. For now, gains are consistent and strong."
27,2024-03-08 15:16:51.296546,2024-03-08 10:02:27,The jobs report comes as the Fed considers the timing of interest rate cuts.,"The Federal Reserve is primarily watching progress on inflation as it contemplates its next steps, but it is also keeping an eye on the labor market."
28,2024-03-08 15:16:51.296546,2024-03-08 14:32:45,Planning a Trip? Tips and Tricks for Working With a Travel Adviser,"The internet has turned us all into our own travel planners, but for complicated itineraries or milestone trips, an adviser can save you money and headaches."
29,2024-03-08 15:16:51.296546,2024-03-08 17:31:36,How Cable TV Hosts Reacted to Biden’s State of the Union Address,Television hosts responded to the State of the Union address along partisan lines. But almost everyone agreed the president was feisty.
30,2024-03-08 15:16:51.296546,2024-03-08 00:00:04,Trade Groups Sue to Block Credit Card Late Fee Limit,Banking groups and Texas business associations asked a federal court to abolish a new federal rule that would cap most late fees at $8.
31,2024-03-08 15:16:51.296546,2024-03-08 13:14:00,Rivian Will Delay Construction of a $5 Billion Factory in Georgia,"The money-losing electric vehicle company, which makes vans, trucks and S.U.V.s, is trying to preserve cash as it works to produce and sell more affordable vehicles."
32,2024-03-08 15:16:51.296546,2024-03-07 22:17:14,"Rupert Murdoch, 92, Is Engaged to Girlfriend Elena Zhukova","The media titan Rupert Murdoch, 92, is engaged once more. This time it is to Elena Zhukova, a retired molecular biologist."
33,2024-03-08 15:16:51.296546,2024-03-08 18:01:43,Key OpenAI Executive Played a Pivotal Role in Sam Altman’s Ouster,"Mira Murati, OpenAI’s chief technology officer, brought questions about Mr. Altman’s management to the board last year before he was briefly ousted from the company, people familiar with the matter said."
34,2024-03-08 15:16:51.296546,2024-03-07 21:43:21,Self Service for Airport Security? It’s Happening in Las Vegas.,"At security lanes at Harry Reid International Airport, travelers with PreCheck clearance can test a new self-service screening process with remote T.S.A. agents and video monitors."
35,2024-03-08 15:16:51.296546,2024-03-08 00:47:25,Possible TikTok Ban Prompts Users to Inundate Congress With Phone Calls,Many Capitol Hill offices were inundated with phone calls after TikTok urged users to tell their representatives they opposed a new bill aimed at the company.
36,2024-03-08 15:16:51.296546,2024-03-07 19:51:12,"Strategic Financial Solutions, Facing Fraud Charges, Is Blocked From Operating",Strategic Financial Solutions is accused of fraud in a lawsuit by federal and state prosecutors.
37,2024-03-08 15:16:51.296546,2024-03-08 02:16:28,New York Community Bank Tries to Reassure Markets After $1 Billion Rescue,"Management told investors that deposits had fallen, but the bank’s shares jumped on the details of a shift in strategy and large cash infusion led by the former Treasury secretary Steven Mnuchin."
38,2024-03-08 15:16:51.296546,2024-03-07 16:17:43,FDA Urges Recall of Lead-Tainted Cinnamon Brands,The agency tested 75 types of cinnamon after hundreds of children were poisoned by the spice in applesauce. It found some lead in cinnamon brands sold at some dollar stores and other markets.
39,2024-03-08 15:16:51.296546,2024-03-07 18:21:27,Spate of Mock News Sites With Russian Ties Pop Up in U.S.,"The fake news organizations, experts say, represent a technological leap in the Kremlin’s efforts to spread false and misleading narratives."
40,2024-03-08 15:16:51.296546,2024-03-08 03:06:13,Top US Senators Urge Stores to Stop Sellng Illicit Vapes,Lawmakers want shopkeepers to remove e-cigarettes that were not authorized by the F.D.A. Retailers say it is not that simple.
41,2024-03-08 15:16:51.296546,2024-03-07 21:06:39,Mike Tyson to Fight Jake Paul in Match on Netflix,"The July bout between Mr. Tyson, the former world champion, and Mr. Paul, the influencer turned boxer, is part of Netflix’s push into “sports-adjacent” live events."
42,2024-03-08 15:16:51.296546,2024-03-08 02:19:23,"European Central Bank, Citing Wage Growth, Keeps Rates Steady","Although inflation has eased, the eurozone’s central bank said that “domestic price pressures remain high.” Rates remain the highest in the central bank’s history."
43,2024-03-08 15:16:51.296546,2024-03-07 13:06:41,Fed Chair Powell Signals a Retreat on Banking Rules,The Fed chair said regulators could scale back or rework a sweeping capital-requirements proposal that Wall Street has been fighting for months.
44,2024-03-08 15:16:51.296546,2024-03-07 22:20:46,"In State of the Union, Biden Will Cheer the Economy and Draw a Contrast With Trump",Allies are pushing the president to do more to sell skeptical voters on his economic record and to attack his likely Republican rival on tax policy.
45,2024-03-08 15:16:51.296546,2024-03-07 10:03:04,Salesforce AI Executive Clara Shih Leads with a Beginner’s Mind,Clara Shih of Salesforce AI is the leader behind the company’s artificial intelligence efforts.
46,2024-03-08 15:16:51.296546,2024-03-07 10:02:57,"Sheila Watson, Leader of a London Nonprofit, Wants to Improve Mobility","Sheila Watson works for a foundation that focuses on safe and environmentally sound mobility, supporting projects targeting access, emissions and safety."
47,2024-03-08 15:16:51.296546,2024-03-07 10:01:47,Japan-Based NGO Looks Beyond Diamonds and Money,"Mining can be dangerous, exploitative and harmful to the environment. Chie Murakami’s organization is aiming to change that by raising awareness and addressing the needs of miners."
48,2024-03-08 15:16:51.296546,2024-03-07 16:32:27,Britain Is Cutting Taxes Again. Why Now?,The government announced a budget as a national election looms. Here’s what you need to know.
49,2024-03-08 15:16:51.296546,2024-03-09 04:55:03,How China Came to Dominate the World in Solar Energy,Beijing is set to further increase its manufacturing and installation of solar panels as it seeks to master global markets and wean itself from imports.
50,2024-03-08 15:16:51.296546,2024-03-07 02:10:50,Chinese National Accused of Stealing AI Secrets From Google,"Linwei Ding, a Chinese national, was arrested in California and accused of uploading hundreds of files to the cloud."
51,2024-03-08 15:16:51.296546,2024-03-07 08:39:33,Big American Tech Profits From Chinese Ad Spending Spree,"Temu, Shein, and streaming and gaming apps looking to break into the U.S. market are spending huge sums to get their wares in front of American consumers."
52,2024-03-08 15:16:51.296546,2024-03-07 01:04:03,I.M.F. Agrees to Much Larger Rescue Package for Egypt,"The International Monetary Fund will provide $8 billion to Egypt, which is going through its worst economic crisis in decades."
53,2024-03-08 15:16:51.296546,2024-03-06 21:14:08,Do You Have Experience Working With Boeing? We Want to Hear From You.,Boeing’s quality control practices have been criticized after a panel on one of the company’s 737 Max jets blew open during a flight in January.
54,2024-03-08 15:16:51.296546,2024-03-06 22:21:51,Steven Mnuchin Backs New York Community Bank in $1 Billion Deal,"Mr. Mnuchin, the former Treasury secretary, led investors who put together a package in an effort to rescue the struggling lender."
55,2024-03-08 15:16:51.296546,2024-03-06 20:50:01,"John Walker, Tech Executive Who Popularized AutoCAD, Dies at 74","He avoided the spotlight, but he helped bring to market an explosively popular computer program that revolutionized the architecture and design industries."
