INDEX,DOWNLOAD_TIME,DATE,TITLE,SUMMARY
0,2022-09-25 17:46:51.660606,2022-09-25 16:52:00,Markets waking up to the fact a global recession is real: Scott Shellady,Prosper Trading Academy CEO Scott Bauer and Cow Guy Group founder Scott Shellady analyze the market selloff as the Dow enters bear market 
1,2022-09-25 17:46:51.660606,2022-09-25 16:52:00,"Dow plunges nearly 500 points, enters bear market territory",State Street Global Advisors chief investment strategist Michael Arone tells 'The Claman Countdown' to expect more market volatility as the 
2,2022-09-25 17:46:51.660606,2022-09-25 16:52:00,Qualcomm collaborates with Mercedes-Benz to accelerate automotive chip ambitions,Qualcomm CEO Cristiano Amon announces on 'The Claman Countdown' a deal with Mercedes-Benz to power vehicles with Snapdragon digital chassis 
3,2022-09-25 17:46:51.660606,2022-09-25 16:52:00,Dow hits bear market as stock selloff goes from bad to worse,Investors continued to dump U.S. stocks as fears grow that a potential recession will be deeper than initial forecasts as the Federal 
4,2022-09-25 17:46:51.660606,2022-09-25 16:52:00,Markets realizing they can’t fight the Fed: Ben Levisohn,"Barron’s markets editor Ben Levisohn, reporter Carleton English and associate editor Jack Hough discuss the impact of the Fed’s third 75"
5,2022-09-25 17:46:51.660606,2022-09-25 16:52:00,"Market turbulence, inflation, geopolitical uncertainty prompt dip in fintech investment: KPMG","Global fintech investment fell from $111.2 billion in the second half of 2021 to $107.8 billion in the first half of 2022, according to KPMG"
6,2022-09-25 17:46:51.660606,2022-09-25 16:52:00,"Iran blocks internet, social media as Mahsa Amini protests grow","Amid protests against the death of Mahsa Amini, Iranian officials have cut off the public's access to mobile internet and social media "
7,2022-09-25 17:46:51.660606,2022-09-25 16:52:00,Gasoline prices rise for a fifth straight day,"Gas prices have now increased for five straight days, following a slow decline for nearly 100 days"
8,2022-09-15 17:04:49.651049,2022-09-25 17:46:00,"Americans increasingly resorting to 'buy now, pay later' loans for necessities like food and fuel","High inflation already sparked a surge in credit card debt, but now data shows consumers are increasingly using 'buy now, pay later' loans "
9,2022-09-15 17:04:49.651049,2022-09-25 17:46:00,Ford CEO Jim Farely explains what drove the automaker's investment in ICE vehicles,FOX Business correspondent Grady Trimble speaks to Ford CEO Jim Farley about the evolution of the company's electric vehicle and ICE 
