INDEX,DOWNLOAD_TIME,DATE,TITLE,SUMMARY
0,2023-05-28 01:36:26.735346,2023-05-28 01:36:00,Biden and McCarthy race to sell their debt ceiling deal to lawmakers before the government runs out of money,"The ""agreement in principle"" clinched by House Republicans and the White House late Saturday to raise the nation's borrowing limit was the culmination of mad-dash negotiations over the course of the past week that regularly stretched late into the night."
1,2023-05-28 01:36:26.729803,2022-12-10 17:24:17,How Kyrsten Sinema's decision makes Democrats' 2024 Senate map tighter,"Arizona Sen. Kyrsten Sinema decided to shake up the political world on Friday by becoming an independent. The former Democrat is still caucusing with the party in the Senate, so the Democratic caucus still has 51 members. Now, instead of 49 Democrats and two independents within their ranks, the caucus has 48 Democrats and three independents."
2,2023-05-28 01:36:26.729803,2022-12-11 16:16:48,Meet the woman steering Biden's bipartisan winning streak on Capitol Hill,The Biden administration managed to rack up a long list of major legislative wins in its first two years despite facing one of the most closely-divided Congresses in history.
3,2023-05-28 01:36:26.729803,2023-05-28 01:36:00,CNN Political Briefing,"The political news you need to know, in 10 minutes or less. Hosted by David Chalian."
4,2023-05-28 01:36:26.729803,2023-05-28 01:36:00,The Axe Files with David Axelrod,Go beyond the soundbites and get to know some of the most interesting players in politics.
5,2023-05-28 01:36:26.729803,2023-05-28 01:36:00,Margins of Error,Look closely at almost anything and you'll find data—lots of it. But what are those numbers really saying about who we are and what we believe? Harry Enten is on a mission to find out.
6,2023-05-28 01:36:26.729803,2022-12-08 03:36:24,The notable legal clouds that continue to hang over Donald Trump,"All eyes are on former President Donald Trump, who has launched another White House bid."
7,2023-05-28 01:36:26.729803,2022-11-29 23:32:13,The fine print of the Respect for Marriage Act,Let's start with the positive: Republicans and Democrats are coming together to protect same-sex marriage from the Supreme Court.
8,2023-05-28 01:36:26.729803,2023-02-24 19:56:15,Everything you need to know about Biden's student loan forgiveness program,"President Joe Biden's federal student loan forgiveness program, which promises to deliver up to $20,000 of debt relief for millions of borrowers, is on hold indefinitely as legal challenges work their way through the courts."
9,2023-05-28 01:36:26.729803,2023-05-28 02:14:50,Politics of the Day,Politics of the Day
10,2023-05-28 01:36:26.729803,2023-05-28 01:36:00,0% intro APR until 2024 is 100% insane,
11,2023-05-28 01:36:26.729803,2023-05-28 01:36:00,It's official: now avoid credit card interest into 2024,
12,2023-05-28 01:36:26.729803,2023-05-28 01:36:00,Experts: this is the best cash back card of 2022,
13,2023-05-28 01:36:26.729803,2023-05-28 01:36:00,Turn Your Rising Home Equity Into Cash You Can Use,
14,2023-05-28 01:36:26.729803,2023-05-28 01:36:00,Dream Big with a Home Equity Loan,
15,2023-05-28 01:36:26.729803,2023-05-28 01:36:00,Want Cash Out of Your Home? Here Are Your Best Options,
16,2023-05-28 01:36:26.729803,2023-05-28 01:36:00,Use the Right Card for Holiday Gifts (Save Hundreds on Interest),
17,2023-05-28 01:36:26.729803,2023-05-28 01:36:00,10 Cards Charging 0% Interest Until 2024,
18,2023-05-28 01:36:26.729803,2023-05-28 01:36:00,Get a $200 Cash Back Bonus on Holiday Gift Buying,
19,2023-05-28 01:36:26.729803,2023-05-28 01:36:00,Here's what's in the debt ceiling deal,"After several weeks of tense negotiations, President Joe Biden and House Republicans have reached an agreement in principle to raise the debt ceiling and cap spending."
20,2023-05-28 01:36:26.729803,2023-05-28 01:36:00,White House and House Republicans strike agreement in principle to raise debt ceiling,White House and House GOP negotiators are racing to finalize a deal to raise the nation's debt limit as early as Saturday with time running perilously short and the risk of a first-ever US default growing.
21,2023-05-28 01:36:26.729803,2023-05-28 01:36:00,,CNN's David Gergen and Manu Raju say that the pressure is on House Speaker Kevin McCarthy to deliver a divided Republican conference to support an agreement on the debt ceiling.
22,2023-05-28 01:36:26.729803,2023-05-28 01:36:00,,"Rep. Maxwell Frost (D-FL), the first member of Generation Z to serve in Congress, says Republicans are holding Americans hostage as they seek to cut spending in exchange for raising the nation's debt limit."
23,2023-05-28 01:36:26.729803,2023-05-28 01:36:00,Texas House of Representatives votes to impeach Attorney General Ken Paxton,"The Texas House of Representatives has voted to impeach Attorney General Ken Paxton, an unprecedented move following a legislative probe that faulted the third-term Republican for a yearslong pattern of corruption, including abusing his office's powers, retaliating against whistleblowers and obstructing justice."
24,2023-05-28 01:36:26.729803,2023-05-28 01:36:00,,The Texas House of Representatives has voted to impeach the state's Attorney General Ken Paxton. CNN correspondent Rosa Flores has more on the unprecedented move.
25,2023-05-28 01:36:26.729803,2023-05-28 01:36:00,,"Rep. Tim Burchett (R-TN) explains to CNN's Jim Acosta why he's a ""no"" on any deal forged between White House and GOP negotiators to raise the nation's debt ceiling."
26,2023-05-28 01:36:26.729803,2023-05-28 01:36:00,,"Texas Attorney General Ken Paxton is facing calls of impeachment from his own party. The GOP controlled House plans to vote tomorrow on the 20 impeachment articles against Paxton, who faces accusations of abusing his office. CNN's Ed Lavendera reports."
27,2023-05-28 01:36:26.729803,2023-05-28 01:36:00,Iowa governor signs bill to loosen child labor laws,Iowa Republican Gov. Kim Reynolds signed a bill Friday that loosens child labor laws by extending the hours that teens can work and the establishments where they can be employed.
28,2023-05-28 01:36:26.729803,2023-05-28 01:36:00,"New Iowa law restricts gender identity education, bans books with sexual content","Iowa Gov. Kim Reynolds signed a sweeping bill into law Friday that will restrict education about gender identity and sexual orientation and ban books with certain sexual content from school libraries, as well as require schools to notify parents if their child asks to use a new name or pronoun."
29,2023-05-28 01:36:26.729803,2023-05-28 01:36:00,Harris becomes first woman to deliver commencement address at West Point,"Vice President Kamala Harris on Saturday became the first woman to deliver a commencement address at the  graduation ceremony at the US Military Academy in West Point, New York, warning graduates they were ""an increasingly unsettled world where long standing principles are at risk."""
