INDEX,DOWNLOAD_TIME,DATE,TITLE,SUMMARY
0,2022-07-11 13:08:43.989120,2022-07-11 16:58:26,House January 6 committee will not hold hearing on Thursday,"The House committee investigating the January 6, 2021, Capitol Hill insurrection will not hold a hearing this Thursday, as had previously been under consideration, a source familiar with the committee's plans told CNN."
1,2022-07-11 13:08:43.989120,2022-07-11 16:52:23,Extreme temperatures will challenge the Texas power grid this week,Several days of triple-digit heat will challenge the Texas power grid this week -- and scientists are saying the Lone Star State is on track to have one of the hottest summers on record.
2,2022-07-11 13:08:43.989120,2022-07-11 16:51:07,Women say they were drugged at summer gathering of Germany's ruling party,Nine women have reported they were drugged by an unknown substance after attending the annual summer party of Germany's Social Democratic Party (SPD) -- whose Chancellor Olaf Scholz is a member -- last week.
3,2022-07-11 13:08:43.989120,2022-07-11 16:45:34,"Jen Shah, 'Real Housewives of Salt Lake City' cast member, pleads guilty to telemarketing fraud","Jennifer Shah, a cast member of the ""Real Housewives of Salt Lake City,"" pleaded guilty Monday to defrauding hundreds of victims, including some elderly, in a years-long telemarketing fraud scheme."
4,2022-07-11 13:08:43.989120,2022-07-11 16:39:36,Biden says gun violence has turned America's communities into 'killing fields',"President Joe Biden on Monday said gun violence has turned everyday places in America into ""killing fields"" as he marked the passage of the first significant federal gun safety legislation in 30 years."
5,2022-07-11 13:08:43.989120,2022-07-11 16:34:52,Russia's invasion of Ukraine,Ukraine has launched a counteroffensive against Russian troops in the southern regions of Kherson and Zaporizhzhia. Follow here for live updates
6,2022-07-11 13:08:43.989120,2022-07-11 16:34:41,MLB All-Star Game Fast Facts,"Read CNN's MLB All-Star Game Fast Facts and learn more about the baseball competition that's also known as the ""Midsummer Classic."""
7,2022-07-11 13:08:43.989120,2022-07-11 16:33:55,Faroe Islands sets quota of 500 dolphins to be killed in controversial annual whale hunt,The government of the Faroe Islands has set a catch limit of 500 dolphins for the territory's annual whale hunt this year.
8,2022-07-11 13:08:43.989120,2022-07-11 16:30:48,Chairman of Texas House Committee investigating Uvalde school shooting pushes for release of hallway surveillance video,The chairman of the Texas House committee investigating the Uvalde school shooting pushed to release hallway surveillance video that shows what police were doing as a gunman remained inside adjoining classrooms for about 77 minutes.
9,2022-07-11 13:08:43.989120,2022-07-11 16:30:32,Elon Musk Fast Facts,Read CNN's Fast Facts about Elon Musk and learn about the entrepreneur behind Tesla and SpaceX.
10,2022-07-11 13:08:43.989120,2022-07-11 16:12:01,President Biden will share the Webb Telescope's first image today,President Joe Biden will share the first image from the James Webb Space Telescope on Monday at the White House at 5 p.m. ET. The rest of Webb's first images will be released on Tuesday.
11,2022-07-11 13:08:43.989120,2022-07-11 16:12:00,A crucial Russian gas pipeline has been shut for repairs. Will it ever reopen?,"Since the West hit Russia with bruising sanctions following its invasion of Ukraine, a frightening question has loomed: What if Russia turns off natural gas to Europe?"
12,2022-07-11 12:08:43.380986,2022-07-11 16:37:04,"'Originally there were no options,' says pilot who landed his plane on a North Carolina highway","When the engine on his small plane failed three times, Vincent Fraser had no choice but to make an emergency landing in mountainous terrain just south of Great Smoky Mountains National Park."
13,2022-07-11 12:08:43.380986,2022-07-11 16:30:38,Here's what the January 6 committee has revealed through its 6 hearings,"In its six hearings so far, the House select committee investigating January 6, 2021, has focused squarely on former President Donald Trump, connecting his role in efforts to overturn the 2020 election to the violent attack at the US Capitol."
14,2022-07-11 12:08:43.380986,2022-07-11 16:13:46,Penguins at a Japanese aquarium are being fed cheaper fish - and they aren't happy,"An aquarium employee waves a mackerel near a penguin -- but there's no reaction. When she moves the fish closer to its beak, the penguin turns away haughtily. An otter sniffs the fish, then runs away."
15,2022-07-11 12:08:43.380986,2022-07-11 16:04:38,What's next for Sri Lanka as angry protesters occupy their leaders' luxury houses?,Angry protesters who stormed the official residences of Sri Lanka's President and Prime Minister have succeeded in forcing their leaders' resignations as the country lurches further into crisis.
16,2022-07-11 12:08:43.380986,2022-07-11 16:01:04,A pregnant woman got a ticket for driving in the HOV lane in Texas. She says her fetus was her passenger,"The officer noted that there did not seem to be anyone else in the car, but Brandy Bottone had a retort -- she was 34 weeks pregnant."
17,2022-07-11 12:08:43.380986,2022-07-11 15:50:23,Here's a look at who might replace Boris Johnson as UK Prime Minister,Rivals of Britain's Prime Minister Boris Johnson have been plotting to replace him as scandals have mounted. Here are some of the possible contenders in a Conservative Party leadership contest.
18,2022-07-11 12:08:43.380986,2022-07-11 15:49:56,The euro and the dollar are a penny away from parity for the first time in 20 years,"For the first time in 20 years, the exchange rate between the euro and the US dollar is nearly the same -- the two currencies are less than one cent away from parity."
19,2022-07-11 12:08:43.380986,2022-07-11 15:43:57,Opinion: The US can still avoid a recession. Here's how,"Soft landings are rarer than recessions and are far more difficult to navigate. But even though the US economic expansion's path is narrowing, the road ahead isn't blocked just yet."
20,2022-07-11 11:08:42.844489,2022-07-11 15:35:38,BTS member V is a fan of Lizzo and the feeling seems mutual,Lizzo has some famous fans.
21,2022-07-11 11:08:42.844489,2022-07-11 15:30:38,Don't believe these 8 common credit score myths,"You probably already know that you need a good credit score to get the best interest rates on a mortgage or auto loan, which can make a big difference to your budget over time."
22,2022-07-11 11:08:42.844489,2022-07-11 15:26:54,Miles Teller says he's down to do another 'Top Gun' movie if Tom Cruise is,Miles Teller has a need for more speed!
23,2022-07-11 11:08:42.844489,2022-07-11 15:05:31,"Russian strike on residential building kills 29 in eastern Ukraine, officials say","At least 29 people have been confirmed dead after a Russian strike hit an apartment block in the Donetsk region of eastern Ukraine over the weekend, Ukrainian officials said Monday."
24,2022-07-11 11:08:42.844489,2022-07-11 15:04:03,Italian tourist town imposes fines for bare chests,"The mayor of an Italian tourist town has moved to impose fines on under-dressed people citing concerns over ""quality of life."""
25,2022-07-11 10:08:42.210996,2022-07-11 15:01:54,Scientists are searching for solutions after studies show pulse oximeters don't work as well for people of color,"Often when Dr. Thomas Valley sees a new patient in the intensive care unit at Michigan Medicine in Ann Arbor, he clamps a pulse oximeter on their finger -- one of the many devices he uses to gauge their health and what course of care they might require, whether they are a child having seizures, a teenage car accident victim or an older person with Covid-19."
26,2022-07-11 10:08:42.210996,2022-07-11 14:55:53,A sprinkler system has been installed in the forest and a cabin wrapped in foil as wildfire threatens Yosemite's beloved sequoias,"Fire crews are working to steer a growing wildfire away from Yosemite National Park's legendary giant sequoias, taking protective measures like installing a sprinkler system to dampen the ground around one of the park's most famous trees."
27,2022-07-11 10:08:42.210996,2022-07-11 14:46:36,This is what doomed Elon Musk's Twitter deal,"When Elon Musk announced his intention to buy Twitter almost 90 days ago, the world — and financial markets — looked different."
28,2022-07-11 10:08:42.210996,2022-07-11 14:25:58,How to get free fries at McDonald's and Wendy's this week,McDonald's and Wendy's are both giving away free fries this week.
29,2022-07-11 10:08:42.210996,2022-07-11 14:19:23,June's strawberry moon will light up the sky this week,"June's full moon, the strawberry moon, will illuminate the sky this week. It gets its name from indigenous peoples and is a reminder of the short period of time when strawberries are ripe and ready to be gathered."
