INDEX,DOWNLOAD_TIME,DATE,TITLE,SUMMARY
0,2024-05-03 16:13:44.091379,2024-05-03 13:29:27,US job market slows in April,"Friday’s government report showed that last month’s hiring gain was down sharply from the blockbuster increase of 315,000 in March."
1,2024-04-19 16:13:40.152720,2024-04-19 09:00:00,Trump Is Misleading You With Covid-Era Statistics. So Is Biden.,"Biden and Trump are both campaigning on warped economic statistics, cherry-picking weird data from the Covid crisis."
2,2024-04-05 16:13:35.939933,2024-04-05 13:18:52,"US employers added a surprisingly robust 303,000 jobs in March in a sign of economic strength","By any measure, it amounted to a strong month of hiring."
3,2024-03-30 16:13:34.314929,2024-03-29 14:35:08,‘The last mile is harder’: Stubborn inflation stalls Fed rate cuts,"The concern is that higher rates are putting pressure on households and businesses looking to borrow, weighing on hiring, investment and the housing market."
4,2024-03-08 15:16:35.895584,2024-03-08 14:10:42,"US employers add a surprisingly strong 275,000 jobs in sign of continued economic strength","Last month’s job growth was up from a revised gain of 229,000 jobs in January."
5,2024-03-08 15:16:35.895584,2024-03-06 10:01:00,The toughest pain points awaiting Biden at the State of the Union,"The president’s team thinks it's had a historically successful first term, delivering victories on the economy, climate, drug pricing and more. But many Americans aren’t feeling it."
