INDEX,DOWNLOAD_TIME,DATE,TITLE,SUMMARY
0,2023-08-17 17:26:24.519195,2023-08-17 06:00:00,Trio booked flights to Pakistan a day before Surrey girl's body found,
1,2023-08-17 17:26:24.519195,2023-08-17 06:00:00,Homeless man admits stealing dummies from five children and using them in his tent,
2,2023-08-17 17:26:24.519195,2023-08-17 06:00:00,Game Of Thrones and EastEnders actor dies aged 36,
3,2023-08-17 17:26:24.519195,2023-08-17 06:00:00,A-level results: Number of top grades down on last year but still above pre-pandemic levels,
4,2023-08-17 17:26:24.519195,2023-08-17 06:00:00,Britney Spears and husband Sam Asghari separate - reports,
5,2023-08-17 17:26:24.519195,2023-08-17 06:00:00,'Greatest interviewer of our time' - colleagues and famous faces pay tribute to Michael Parkinson | Latest,
6,2023-08-17 17:26:24.519195,2023-08-17 06:00:00,Broadcaster Sir Michael Parkinson has died,
7,2023-08-17 17:26:24.519195,2023-08-17 06:00:00,Joy and anxiety as results in; Clarkson's annual tweet backed by PM; regions with most top grades revealed | A-level results live,
8,2023-08-17 17:26:24.519195,2023-08-17 06:00:00,Ukraine gives up on F-16 jets for counteroffensive - as Kyiv faces 'big test' in coming days | War latest,
9,2023-08-17 17:26:24.514930,2023-08-10 17:26:00,"As heavyweights crash out of Women's World Cup, cautious Lionesses prepare to face Nigeria",
