INDEX,DOWNLOAD_TIME,DATE,TITLE,SUMMARY
0,2024-03-09 05:16:53.211490,2024-03-08 21:01:49,"Biden proposes $10,000 tax breaks for first-time homebuyers, 'starter home' sellers",President Biden has proposed a new first-time homebuyer tax credit.
1,2024-03-08 15:16:52.815018,2024-03-07 15:39:39,Pimco's Sonali Pier lets her 'cautious contrarianism' speak for itself: The bets she's making now,Sonali Pier is a portfolio manager at Pimco and leads the firm's Diversified Income Fund.
2,2024-03-06 07:16:36.660754,2024-03-06 18:40:13,Weekly mortgage demand surges 11% as more homes hit the spring market,Mortgage demand surged back last week as the spring season kicked off with still higher mortgage rates.
3,2024-03-05 17:16:36.392039,2024-03-05 22:01:05,Trump's best option to get $540 million for legal judgments could be 'clean' property with private lenders,Donald Trump has just a few weeks to put up more than $454 million in cash or bonds to stave off his collectors while he appeals his New York civil fraud case.
4,2024-03-05 03:16:36.184633,2024-03-04 18:29:55,"Tour this $24 million mansion in Delray Beach, Florida, where home prices have doubled","The mansion is located in Stone Creek Ranch, a gated community that's home to billionaire hedge fund manager Steven Cohen and NFL star Khalil Mack."
5,2024-03-01 01:16:33.577662,2024-03-01 06:05:17,"Britain to lead 2024 European real estate boom as international buyers eye opportunities, research says",The U.K. looks poised to lead a European real estate resurgence this year as international investors return capital to the strained property market.
6,2024-03-01 01:16:33.577662,2024-02-29 19:10:39,36% of homebuyers and sellers don’t know they can negotiate real estate agent fees. Here’s how to do it,"Many homebuyers and sellers don't know they can negotiate real estate agent fees. Of those who try, a majority successfully lowered the fees. Here's how."
7,2024-02-28 07:16:31.976963,2024-02-28 12:47:28,7% interest rates hit weekly mortgage demand hard,Higher mortgage rates continue to hit demand from both current homeowners and potential homebuyers.
8,2024-02-28 07:16:31.976963,2024-02-28 06:59:07,Hong Kong property stocks jump after city scraps cooling measures,Financial Secretary Paul Chan announced that Hong Kong will scrap all buy-side property tightening measures for residential properties with immediate effect.
9,2024-02-28 07:16:31.976963,2024-02-28 05:53:06,China's Country Garden gets liquidation petition from creditor,"Country Garden said it will oppose the petition ""vigorously"" and seek legal measures to do so. A court hearing will be held May 17."
10,2024-02-28 07:16:31.976963,2024-03-01 21:37:06,The hottest housing markets for the super rich in 2024,"One-quarter of the ultrawealthy people in the U.S. plan to buy a home this year, and they're increasingly venturing to the luxury real estate market overseas."
11,2024-02-27 17:16:31.578249,2024-02-27 17:26:44,Here are this year's most competitive rental markets,"Miami is the most competitive city in the nation for renters, but on a regional level, the Midwest ranks first for competition."
12,2024-02-27 17:16:31.578249,2024-02-27 16:43:27,This startup claims its new homes will generate more energy than they use,Aro's homes incorporate energy-efficient systems and appliances with sustainable materials.
13,2024-02-27 03:16:31.213991,2024-02-27 20:43:18,Aspiring homeowners say they face two major obstacles to buying. Here's why 20% say it'll 'never' happen,Various factors make homeownership unaffordable for Americans. About half of aspiring homeowners blame two factors that further push away their goal.
14,2024-02-24 19:16:29.885598,2024-02-24 14:00:01,Your home sale may leave you in a tax shock. Here's how to reduce your capital gains tax bill,"If you made a profit selling your home in 2023, that windfall could be subject to capital gains taxes. Here's what sellers need to know this season."
15,2024-02-23 15:16:29.264499,2024-02-23 16:04:48,"'If your parents are homeowners, you're more likely to be a homeowner,' housing expert says. Here's why",Several factors may affect your path toward homeownership — one may be your parents. Here are a few reasons why.
16,2024-02-23 15:16:29.264499,2024-02-23 12:10:22,Germany’s housebuilding sector is in a 'confidence crisis' as the economy struggles,"Germany’s housebuilding sector has gone from bad to worse in recent months as it is in a ""confidence crisis,"" one CEO says."
17,2024-02-22 11:16:28.419602,2024-02-22 19:04:58,"Existing home sales rose 3% to start the year, but higher mortgage rates are already hurting","Sales of previously owned homes rose in January, boosted by lower mortgage interest rates of November and December."
18,2024-02-21 21:16:27.883557,2024-02-21 21:58:32,'Who's going to do that?': Trump faces hurdles in securing appeal bond for fraud case,"Donald Trump plans to fight the massive fine he received in his New York business fraud case. But first, he has to secure a bond — and that might not be easy."
19,2024-02-21 21:16:27.883557,2024-02-21 20:03:36,"With mortgage rates remaining high, renting is less expensive than buying","While both housing and rent prices have outpaced wage growth in most areas, renting can be less expensive in most markets."
20,2024-02-21 21:16:27.883557,2024-02-21 16:35:23,"52% of Black Americans say homeownership is a mark of success, report finds. But it can conflict with other goals","While homeownership is a path to build wealth, a mortgage payment and other housing-related expenses can cause financial strain."
21,2024-02-21 07:16:27.191720,2024-02-21 13:07:45,Mortgage demand takes a massive hit as interest rates cross back over 7%,Applications for a mortgage to purchase a home fell 10% last week as interest rates surged to the highest level since early December.
22,2024-02-20 17:16:26.983361,2024-02-20 18:53:28,Strong earnings and an online advertising play by Walmart have us wondering about Costco,"Every weekday, the Investing Club releases the Homestretch; an actionable afternoon update just in time for the last hour of trading."
23,2024-02-20 17:16:26.983361,2024-02-20 19:32:27,"More Black women are becoming homeowners — it doesn’t mean it's easier, economist says","While Black women in the U.S. are outpacing Black men as homebuyers, buying still isn't easy. Here are a few hurdles that affect homeownership for Black women."
24,2024-02-18 23:16:26.117395,2024-02-18 15:01:01,2 out of 5 industrial stocks are at record highs. Here's our post-earnings outlook on all of them,"Earnings season was not perfect for our industrial-focused portfolio companies, but we're feeling pretty good about their prospects."
25,2024-02-17 05:16:24.980114,2024-02-17 13:38:02,Trump ordered to pay $454 million in fines and interest in NY business fraud case,"The fraud trial ruling comes as Donald Trump seeks the Republican presidential nomination, setting up a likely rematch with President Joe Biden."
26,2024-02-16 15:16:24.692943,2024-02-16 19:48:12,Mortgage rates shoot to 2-month high after new report shows inflation is still hot,"The average rate on the 30-year fixed mortgage jumped to 7.14%, according to Mortgage News Daily. That is the highest level in two months."
27,2024-02-16 15:16:24.692943,2024-02-16 14:45:36,People are moving out of cities with poor air quality — but many end up facing other climate risks,"Renters and homeowners are beginning to factor climate risks into moving decisions. Yet, affordability remains the deciding factor."
28,2024-02-14 21:16:23.758710,2024-02-14 13:30:01,"Black Americans still face 'disproportionately steep hurdles' to homeownership, expert says","While homeownership remains out of reach for many Black people in the U.S., there are two things buyers should do to increase their chances."
29,2024-02-14 07:16:23.208239,2024-02-14 18:00:36,"Mortgage rates surge higher again, causing homebuyers to pull back","Mortgage rates are rising sharply again, causing mortgage demand to drop."
