INDEX,DOWNLOAD_TIME,DATE,TITLE,SUMMARY
0,2022-03-24 07:44:29.292205,2022-03-24 03:00:00,The West’s Unity Is Temporary,"As Joe Biden meets with European counterparts in Brussels today, the leader of an ostensibly reunited free world, it is worth recalling "
1,2022-03-23 23:44:04.209592,2022-03-23 20:00:00,"The Threat to Free Speech, Beyond ‘Cancel Culture’","This is an edition of Up for Debate, a newsletter by Conor Friedersdorf. On Wednesdays, he rounds up timely conversations and solicits "
2,2022-03-23 23:44:04.209592,2022-03-23 17:00:00,An Artist Who Makes Me Excited About the Future of Music,"Apparently one of the most exciting stories in music this year is a lack of excitement about music. In January, the question “Is old music"
3,2022-03-23 23:44:04.209592,2022-03-23 17:00:00,America Is About to Test How Long ‘Normal’ Can Hold,"At this very moment, the United States, as a whole, remains in its legit pandemic lull. Coronavirus case counts and hospitalizations are "
4,2022-03-23 23:44:04.209592,2022-03-23 15:00:00,What Working Mothers Heard in Judge Jackson’s Words,"Amid the partisan grandstanding and enumeration of credentials in Ketanji Brown Jackson’s Supreme Court confirmation hearings, a few lines"
5,2022-03-23 23:44:04.209592,2022-03-23 15:00:00,A Month of War Has Transformed Ukraine,"Tomorrow will mark one month since Russia’s invasion of Ukraine began on February 24. In that time, more than 3.5 million Ukrainians have "
6,2022-03-23 15:43:22.760110,2022-03-23 12:00:00,The Conundrum of Sexual Life in Today’s America,"They’ve appeared in major metropolitan areas of America: bright ads in startling technicolor, featuring eely, long tongues and hairy "
7,2022-03-23 15:43:22.760110,2022-03-23 11:00:00,Get Ready for a Wave of Missed Infections,COVID-19 tests were in such short supply during the winter’s Omicron surge that most infections—affecting up to three out of four 
8,2022-03-23 15:43:22.760110,2022-03-23 11:00:00,To Save or Not to Save Daylight?,"Last week, like most Americans, the country’s senators stumbled into Monday morning after a jarring weekend transition to daylight saving "
9,2022-03-23 15:43:22.760110,2022-03-23 11:00:00,American Companies Can’t Sugarcoat Their Carbon Pollution Anymore,"In 1966, at the height of the Cold War, The Wall Street Journal ran an ad that made a surprising claim: Every day, the Kremlin got 12 copies"
