INDEX,DOWNLOAD_TIME,DATE,TITLE,SUMMARY
21,2022-09-17 19:01:19.337547,2022-09-16 11:14:23,Intuitive Machines to go public as a space exploration company after merger with SPAC Inflection Point Acquisition,"<p>Space exploration company Intuitive Machines announced Friday that it will go public through a merger with special purpose acquisition company (SPAC) Inflection Point Acquisition Corp.  in a deal that values the combined company at about $815 million. When the deal closes, which is expected to occur in the first quarter of 2023, the combined company will be named Intuitive Machines Inc. and the stock will be listed on the Nasdaq, but the new ticker symbol has not yet been determined. Intuitive Machines said it currently has $188 million in contracted backlog and expects to generate revenue of approximately $102 million in 2022. The company said for its first space mission scheduled for no earlier than the first quarter of 2023, its lunar lander is expected to transport government and commercial payloads to the moon. Inflection Point's stock, which is still inactive in premarket trading, has gained 1.0% over the past three months while the S&amp;P 500  has tacked on 2.9%.</p><p>Market Pulse Stories are Rapid-fire, short news bursts on stocks and markets as they move. Visit MarketWatch.com for more information on this news."
22,2022-09-17 19:01:19.337547,2022-09-16 11:00:57,"UPS stock falls after FedEx profit warning, but Citi sees better execution and market share gains","<p>Shares of United Parcel Service Inc.  dropped 6.7% in premarket trading toward a three month low, weighed down by rival package deliver FedEx Corp.'s  profit and revenue warning, but Citi analyst Christian Wetherbee said UPS appears to be managing the tough macro environment better than its rival. FedEx's stock plunged 19.6% toward a two-year low, after saying late Thursday that it suffered lower global volumes, a trend that worsened toward the end of the quarter and is expected to weaken further in the current quarter. Citi's Wetherbee said it's hard to assume UPS isn't affected by the macro/service headwinds that FedEx noted, but his conversations with UPS management suggest ""a level of confidence"" that they did better in matching costs and revenue. He wrote in a research note that FedEx's warning was clearly a negative for UPS, ""but we think UPS continues to execute more effectively and with some [market] share gains, it should be a relative outperformer."" UPS stock, which had already dropped 7.6% amid a three-day losing streak through Thursday, has dropped 13.7% year to date, while FedEx shares have tumbled 20.8%, the Dow Jones Transportation Average  has dropped 18.0% and the Dow Jones Industrial Average  has shed 14.8%.</p><p>Market Pulse Stories are Rapid-fire, short news bursts on stocks and markets as they move. Visit MarketWatch.com for more information on this news."
23,2022-09-17 19:01:19.337547,2022-09-16 10:56:54,EU regulator recommends extending Gilead's COVID treatment Veklury for use in pediatric patients,"<p>Gilead Sciences Inc.  said Friday the European regulator has adopted a positive opinion on extending the use of its COVID treatment Veklury for pediatric patients. The European Commission will review the recommendation, and if adopted, Veklury, also called remdesivir, could become the only authorized treatment for adolescents at high risk of developing severe disease and children with COVID who require supplemental oxygen. The positive opinion was based on a Phase 2/3 trial of Veklury among pediatric patients hospitalized with COVID, with a high proportion of participants showing clinical improvement and recovery, as well as date from trials involving adult patients.  The news comes after the World Health Organization expanded its recommended guide for the use of Veklury to treat patients with severe COVID, an expansion from simply ""those with non-severe COVID-19 at the highest risk of hospitalization."" Gilead shares were down 0.8% premarket, and have fallen 10% in the year to date, while the S&amp;P 500  has fallen 18%. </p><p>Market Pulse Stories are Rapid-fire, short news bursts on stocks and markets as they move. Visit MarketWatch.com for more information on this news."
24,2022-09-17 19:01:19.337547,2022-09-16 10:47:01,BJ's says it will accept SNAP EBT cards at all its clubs across the U.S. including for online shopping and same-day delivery,"<p>BJ's Wholesale Club  said Friday it will accept SNAP EBT cards at all of its clubs and outlets across the U.S. SNAP, or Supplemental Nutrition Assistance Program, is the government's food stamp program, while EBT stands for Electronic Benefits Transfer. The payments can also be used at BJs.com and for shopping options such as pickup, shipping and same-day delivery. BJs shares were not yet active premarket but have gained 14% in the year to date, while the S&amp;P 500  has fallen 18%. </p><p>Market Pulse Stories are Rapid-fire, short news bursts on stocks and markets as they move. Visit MarketWatch.com for more information on this news."
25,2022-09-17 19:01:19.337547,2022-09-16 10:40:51,Xenia Hotels REIT to pay first quarterly dividend in 2 1/2 years,"<p>Xenia Hotels & Resorts Inc.  said Friday that it has reinstated its quarterly dividend, after stopping payment around the start of the COVID-19 pandemic. The upscale hotel real estate investment trust said it will pay a quarterly dividend of 10 cents a share on Oct. 14 to shareholders of record on Sept. 30. Based on Thursday's stock closing price of $16.22, the annual dividend rate implies a dividend yield of 2.47%, which compares with the yield for the SPDR Real Estate Select Sector ETF  of 3.14% and the implied yield for the S&amp;P 500  of 1.69%. The last quarterly dividend paid was 27.5 cents a share in March 2020. Xenia's stock, which was still inactive in premarket trading, has gained 1.6% over the past three months while the REIT sector ETF has tacked on 1.4% and the S&amp;P 500 has advanced 2.9%.</p><p>Market Pulse Stories are Rapid-fire, short news bursts on stocks and markets as they move. Visit MarketWatch.com for more information on this news."
26,2022-09-17 19:01:19.337547,2022-09-16 10:28:29,TikTok parent ByteDance to buy back $3 billion worth of shares -- report,"<p>China-based ByteDance, the privately held parent of social media app TikTok, is looking to repurchase $3 billion of its shares, to help improve liquidity positions of some of its shareholders, according to a Reuters report. The buyback would value ByteDance at about $300 billion, Reuters reported, citing a memo to investors seen on Friday. ByteDance will propose the repurchases to its shareholders at the end of September, and plans to execute the repurchases in the next two to three months, Reuters reported, citing a person with knowledge of the matter.</p><p>Market Pulse Stories are Rapid-fire, short news bursts on stocks and markets as they move. Visit MarketWatch.com for more information on this news."
27,2022-09-17 19:01:19.337547,2022-09-16 10:20:19,Coronavirus tally: WHO expands guidelines for Gilead's COVID treatment Veklury,"<p>The World Health Organization expanded its recommended guide for the use of Gilead's  COVID-19 treatment Veklury late Thursday, adding another treatment to its toolbox. The company said WHO updated its guidelines to recommend the drug to treat patients with severe COVID, an expansion from simply ""those with non-severe COVID-19 at the highest risk of hospitalization."" In late July, European Commission regulators recommended that Veklury be used as an expanded COVID-19 treatment. The move comes as U.S. known cases of COVID are continuing to ease, although the true tally is likely higher given how many people are testing at home, where the data are not being collected. The daily average for new cases stood at 64,308 on Thursday, according to a New York Times tracker, down 28% from two weeks ago. The daily average for hospitalizations was down 11% at 33,143while the daily average for deaths is down 4% to 491.  Globally, the confirmed case tally rose above 611 million on Friday, according to data aggregated by Johns Hopkins, while the death toll is above 6.52 million with the U.S. leading the world with 95.6 million cases and 1,052,939 deaths.</p><p>Market Pulse Stories are Rapid-fire, short news bursts on stocks and markets as they move. Visit MarketWatch.com for more information on this news."
28,2022-09-17 19:01:19.337547,2022-09-16 07:23:31,European delivery rivals slump after FedEx profit warning,"<p>Shares of European delivery firms skidded Friday morning after a profit warning from FedEx . Royal Mail  shares skidded 10% in London, while DHL owner Deutsche Post  stock slid 7% in Frankfurt. FedEx blamed ""macroeconomic weakness"" in Asia and ""service challenges"" in Europe for a $500 million revenue shortfall in these regions.</p><p>Market Pulse Stories are Rapid-fire, short news bursts on stocks and markets as they move. Visit MarketWatch.com for more information on this news."
29,2022-09-17 19:01:19.337547,2022-09-15 23:36:55,Republic First shares rise after bank discloses inbound deal interest and sets up strategic review committee,"<p>Republic First Bancorp Inc.  jumped 8% in premarket trades Thursday after the company said it's initiating a strategic review in the wake of ""inquiries by multiple parties expressing interest in one or more potential strategic transactions with the company.  Republic First said it set up a strategic review committee to review the recent inquiries and to evaluate, together with independent advisors, including Keefe, Bruyette & Woods Inc. The company does not plan to comment further unless and until the board has approved a specific course of action. </p><p>Market Pulse Stories are Rapid-fire, short news bursts on stocks and markets as they move. Visit MarketWatch.com for more information on this news."
