INDEX,DOWNLOAD_TIME,DATE,TITLE,SUMMARY
0,2022-10-01 13:02:06.645997,2022-10-01 15:00:01,"Despite success this year, underperformance rates are 'abysmal' for large-cap active managers for the long run","Active managers are having their best year since 2009, according to an S&amp;P Global study. But the results come with a caveat."
1,2022-10-01 13:02:06.645997,2022-10-01 13:54:57,‘The Fed is breaking things’ – Here’s what has Wall Street on edge as risks rise around the world,"The Fed's efforts to tame inflation are rippling around the world, with potentially unforeseen consequences for investors."
2,2022-10-01 13:02:06.640690,2022-09-30 20:06:08,"Stocks making the biggest moves midday: Nike, Rent-A-Center, Carnival Cruise",These are the stocks posting the largest moves in midday trading.
3,2022-10-01 13:02:06.640690,2022-09-30 13:00:18,Fed Vice Chair Brainard warns against retreating from inflation fight prematurely,Fed Vice Chair Lael Brainard stressed the need to tackle inflation and the importance of not shrinking from the task until it is finished.
4,2022-10-01 13:02:06.640690,2022-09-30 11:47:53,"Stocks making the biggest moves premarket: Nike, Micron, Amylyx and others",These are the stocks posting the largest moves before the bell.
5,2022-10-01 13:02:06.640690,2022-09-30 11:49:12,New coin designs for King Charles III released by the UK's Royal Mint,"The 50p coin, which will be in circulation before the end of the year, shows the new king without a crown and facing left."
6,2022-10-01 13:02:06.640690,2022-09-29 20:08:34,"Stocks making the biggest moves midday: Apple, CarMax, Coinbase, Peloton and more",These are the stocks posting the largest moves in midday trading.
7,2022-10-01 13:02:06.640690,2022-09-29 12:04:59,"Stocks making the biggest moves premarket: Apple, CarMax, Bed Bath & Beyond and more",These are the stocks posting the largest moves before the bell.
8,2022-10-01 13:02:06.640690,2022-09-30 06:39:30,Pension fund panic led to Bank of England's emergency intervention: Here's what you need to know,The Bank of England on Wednesday launched a historic intervention to stabilize the U.K. economy.
9,2022-10-01 13:02:06.640690,2022-09-29 01:07:44,'Do not bet': China's central bank warns against yuan speculation,"The People's Bank of China has warned against betting on the yuan, after its rapid decline against the U.S. dollar this week."
10,2022-10-01 13:02:06.640690,2022-09-29 00:24:55,"Ken Griffin says Fed has not done enough, must continue on its path to reset inflation expectations","Ken Griffin, Citadel Founder & CEO, believes the Federal Reserve has more work to do to bring down inflation even after a series of big rate hikes."
11,2022-10-01 13:02:06.640690,2022-09-28 17:30:11,"Stocks making the biggest moves midday: Apple, Netflix, Biogen, Canopy Growth and more",These are the stocks posting the largest moves in midday trading.
12,2022-10-01 13:02:06.640690,2022-09-28 14:36:56,Stanley Druckenmiller sees 'hard landing' in 2023 with a possible deeper recession than many expect,Stanley Druckenmiller spoke at CNBC Delivering Alpha Investor Summit in New York City Wednesday.
13,2022-10-01 13:02:06.640690,2022-09-28 13:43:18,Billionaire investor Ray Dalio says UK’s economic plan 'suggests incompetence',"The financial market turmoil resulting from the U.K. government's spending plan ""suggests incompetence,"" according to billionaire investor Ray Dalio."
14,2022-10-01 13:02:06.640690,2022-09-28 11:53:46,"Stocks making the biggest moves premarket: Biogen, Thor Industries, Lyft and more",These are the stocks posting the largest moves before the bell.
15,2022-10-01 13:02:06.640690,2022-09-28 05:06:22,A game about sheep is going viral in China even as gaming regulation remains tight,A new game that's gone viral in China hit people's screens with surprising speed at a time when giants such as NetEase have waited months for title approvals.
16,2022-10-01 13:02:06.640690,2022-09-27 20:16:14,"Stocks making the biggest moves midday: Hertz, Ford, Keurig Dr Pepper and more",These are the stocks posting the largest moves midday.
17,2022-10-01 13:02:06.640690,2022-09-27 17:04:53,"Investors believe aggressive Fed will keep stock market down for the rest of 2022, CNBC survey shows","The Fed's aggressive tightening is making the majority of Wall Street investors believe stocks will be underwater for longer, according to a new CNBC survey."
18,2022-10-01 13:02:06.640690,2022-09-29 10:31:24,Crypto lender Nexo gets U.S. bank charter after buying stake in regulated bank,"Nexo's bank license will bring users enhanced legal safeguards and help it expand its footprint in the U.S., the company said."
19,2022-10-01 13:02:06.640690,2022-09-28 00:00:02,Cathie Wood's new fund gives small investors access to the VC market for just $500,"Cathie Wood's Ark Invest launched a new venture capital fund, targeting individual investors with just a $500 minimum investment."
20,2022-10-01 13:02:06.640690,2022-09-27 13:19:36,Bankrupt crypto lender Voyager to sell assets to Sam Bankman-Fried's FTX for $1.4 billion,"FTX, the bitcoin exchange founded by billionaire Sam Bankman-Fried, is set to buy Voyager Digital's assets after winning a bankruptcy auction."
21,2022-10-01 13:02:06.640690,2022-09-27 11:01:27,"Stocks making the biggest moves premarket: Keurig Dr Pepper, CSX, Li Auto and more",Check out the companies making headlines before the bell.
22,2022-10-01 13:02:06.640690,2022-09-26 20:12:34,"Stocks making the biggest moves midday: Wynn Resorts, Planet Fitness, AMC, Lyft and more",These are the stocks posting the largest moves in midday trading.
23,2022-10-01 13:02:06.640690,2022-09-27 00:52:57,Wall Street’s fear gauge hits highest level since June,"The Cboe Volatility Index, better known as the VIX, jumped nearly 3 points to 32.70 on Monday, hitting its highest level since mid-June."
24,2022-10-01 13:02:06.640690,2022-09-27 05:39:14,"Pound tanking, massive tax cuts and talk of emergency hikes. Here's what's going on in the UK",The first fiscal policy announcement from new British Prime Minister Liz Truss's government has been met with one of the worst market reactions in modern history.
25,2022-10-01 13:02:06.640690,2022-09-26 10:56:12,"Stocks making the biggest moves premarket: Planet Fitness, PG&E, Las Vegas Sands and more",Check out the companies making headlines before the bell.
26,2022-10-01 13:02:06.640690,2022-09-26 08:17:08,Singapore's Temasek leads a $40 million funding round in a Chinese startup,"Chinese startup Well-Link Technologies has built a business on real-time cloud rendering, including helping miHoYo launch its Genshin Impact game on the cloud."
27,2022-10-01 13:02:06.640690,2022-09-24 15:00:42,Wall Street milestone: ETF popularity hits record number,"More 3,000 ETFs trading simultaneously for the first time ever this month — a 30% increase since December 2020, according to Morningstar."
28,2022-10-01 13:02:06.640690,2022-09-23 20:27:07,"Stocks making the biggest moves midday: FedEx, Boeing, Ally, Domino's and more",These are the stocks posting the largest moves in midday trading.
29,2022-10-01 13:02:06.640690,2022-09-23 17:13:50,Hedge funds ramp up market bets as volatility brings the asset class back into favor,"Hedge funds' total gross trading flow had the largest notional increase since 2017 last week heading into the Fed's rate decision, according to Goldman's data."
