INDEX,DOWNLOAD_TIME,DATE,TITLE,SUMMARY
0,2024-05-04 11:41:13.036995,2024-05-04 15:27:04,Fever rookie Caitlin Clark stuns in WNBA debut before sellout crowd: 'You couldn’t ask for a better game',Indiana Fever rookie Caitlin Clark scored 21 points before a sellout crowd in her first WNBA game on Friday night. The Fever loss the contest 79-76.
1,2024-05-04 11:41:13.036995,2024-05-04 15:21:44,"Jewel stays mum on Kevin Costner romance rumors, but says she's 'found love'",The folk icon opened up about finding happiness and &quot;love&quot; months after a rumored romance with Kevin Costner surfaced.
2,2024-05-04 11:41:13.036995,2024-05-04 15:10:06,Judge denies request to lift ban on ASU students suspended for anti-Israel protests: report,The U.S. District Court of Arizona denied twenty student protesters&apos; lawsuit seeking to lift their suspension from Arizona State University.
3,2024-05-04 10:41:11.593247,2024-05-04 15:26:09,"Patriotic Rutgers, UNC students push back against anti-America, anti-Israel agitators: 'Seeing a movement'","Rutgers University students in New Jersey react to a show of patriotism on the school&apos;s campus Thursday, when exams were canceled due to anti-Israel protest disruptions."
4,2024-05-04 10:41:11.593247,2024-05-04 14:31:56,'Stop the invasion': Migrant flights in battleground state ignite bipartisan backlash from lawmakers,"Montana representatives are sounding the alarm on the southern border crisis, after a group of migrants flew into state late Wednesday night."
5,2024-05-04 10:41:11.593247,2024-05-04 14:10:21,Amazing mint julep recipe from Paula Deen for Kentucky Derby Day,"Just in time for the Kentucky Derby in Louisville, Kentucky, on Saturday, May 4, 2024, chef Paula Deen shared a delicious recipe for her mint julep drink."
6,2024-05-04 10:11:10.908382,2024-05-04 14:08:34,Leo Terrell flames alma mater UCLA as 'national embarrassment' in wake of anti-Israel chaos on campus,"Civil rights attorney Leo Terrell told &apos;Life, Liberty &amp; Levin&apos; he is disgusted with his postgraduate alma mater, the University of California-Los Angeles."
7,2024-05-04 10:11:10.908382,2024-05-04 13:22:43,"WWII veteran, 100, finally receives his college diploma nearly 60 years after graduation","John &quot;Jack&quot; Milton, 100, recently received his diploma from the University of Maryland Global Campus nearly six decades after he was supposed to walk at graduation."
8,2024-05-04 09:11:09.596646,2024-05-04 13:01:11,"'Wheel of Fortune' fans 'enraged' after contestant's 'painful' mistake costs her $7,250","&quot;Wheel of Fortune&quot; fans took to social media to express their disbelief after a contestant&apos;s mistake cost her over $7,000."
9,2024-05-04 09:11:09.596646,2024-05-04 13:00:20,Former Trump official announces major 'Deport Them All' border initiative amid bid to flip crucial Senate seat,"Dr. Jeff Gunter, Republican Nevada Senate candidate and former U.S. ambassador to Iceland, announced a new initiative to help end the border crisis."
10,2024-05-04 09:11:09.596646,2024-05-04 12:44:38,Maher torches Biden's student loan handout: 'My tax dollars are supporting this Jew hating? I don't think so!',HBO&apos;s Bill Maher slammed the Biden administration&apos;s latest student loan handout proposal he insisted ultimately funds &quot;Jew hating&quot; on college campuses.
11,2024-05-04 09:11:09.596646,2024-05-04 12:41:22,'Kittens' dropped off at Arizona Humane Society turned out to be something else,The Arizona Humane Society issued a warning about rescuing baby animals after a well-meaning person dropped off a litter of baby foxes thinking they were pets in need of help.
12,2024-05-04 09:11:09.596646,2024-05-04 12:16:08,"Sportsbook exec discusses Kentucky Derby's popularity, rise of horse betting: 'This is the Super Bowl'","The 150th Kentucky Derby will be run on Saturday, and as sports gambling has increased, so has the amount of people who will be betting on the race."
13,2024-05-04 08:41:08.993206,2024-05-04 12:08:15,Georgia senators find little oversight over how Fani Willis spends taxpayer dollars: 'Like the Wild West',Georgia lawmakers heard testimony from Fulton County officials Friday that suggested there is little oversight over how District Attorney Fani Willis manages her $36.6 million budget.
14,2024-05-04 08:41:08.993206,2024-05-04 12:05:00,Former Columbia football star Marcellus Wiley discusses student protests: 'I'm disgusted',Student protests over the Israel-Hamas war have popped at college campuses across the US following the arrests of demonstrators at Columbia University last month.
15,2024-05-04 08:11:08.116225,2024-05-04 12:04:59,"New election integrity group will pour millions into paying, protecting whistleblowers on 'front lines'",A new election integrity group is hoping to restore election integrity leading up to the November election by financially incentivizing whistleblowers to come forward.
16,2024-05-04 08:11:08.116225,2024-05-04 11:57:12,Kentucky Derby 2024: What to know about the first leg of horse racing's Triple Crown,Everything you need to know about the 150th running of the Kentucky Derby.
17,2024-05-04 08:11:08.116225,2024-05-04 11:52:15,Fisherman hooks prehistoric 200-pound alligator snapping turtle before catching monster alligator gar,"A fisherman from Kentucky reeled in a monster-sized, 200-pound alligator snapping turtle in Texas; he also caught a massive alligator gar that has been submitted for a world record."
18,2024-05-04 08:11:08.116225,2024-05-04 11:38:01,Japanese government responds to Biden claim that Japan is 'xenophobic': 'Unfortunate',"Japanese officials at the embassy in Washington, DC told Fox News Digital that President Biden&apos;s comments were &quot;unfortunate&quot; and &quot;not based on an accurate understanding of Japan&apos;s policies.&quot;"
19,2024-05-04 08:11:08.116225,2024-05-04 11:35:08,"California tuberculosis outbreak kills 1, infects 14 as officials declare health emergency","A public health emergency has been announced in Long Beach, California after a deadly outbreak of tuberculosis (TB) resulted in one person dying and nine people being hospitalized."
20,2024-05-04 07:41:07.520645,2024-05-04 11:01:32,'Impact is severe': Texas Republicans erupt over DHS migrant flight program as state becomes top destination,Texas Republicans are furious at new revelations that the state is one of the top destinations for a controversial Biden parole program expanded in 2023.
21,2024-05-04 07:11:06.874757,2024-05-04 11:00:59,Kentucky Derby quiz! How well do you know the historic American horse race?,Kentucky Derby quiz! See how well you know the annual American horse race ahead of its 150th celebration on May 4 — from historical facts to fashion trends.
22,2024-05-04 07:11:06.874757,2024-05-04 11:00:45,"NY vs. Trump: Bragg's own witness, Hope Hicks, implodes case against Trump",On Day 11 of the Trump hush money trial prosecutors called former campaign press secretary to the stand. That&apos;s when their case began to collapse.
23,2024-05-04 07:11:06.874757,2024-05-04 10:00:04,"American veterans who commit suicide are 95% male, crisis often driven by family disputes, say experts","Veterans who commit suicide are 95% male and the crisis is often driven by marital disputes and a resulting inabiilty to see their children on a regular basis, experts and advocates said."
24,2024-05-04 06:11:05.587283,2024-05-04 09:53:19,"Man, 65, bitten by shark off South Carolina coast while spearfishing, Coast Guard says","A 65-year-old man was spearfishing about 20 miles off the coast of Charleston, South Carolina, when he was bitten by a shark, the Coast Guard said."
