INDEX,DOWNLOAD_TIME,DATE,TITLE,SUMMARY
0,2022-10-24 09:24:56.879954,2022-10-24 10:19:57,Rishi Sunak will become the next U.K. prime minister,"A popular former chancellor of the exchequer under Boris Johnson's premiership, Sunak lost out to Liz Truss in the race to replace him earlier this summer."
1,2022-10-24 06:53:21.932412,2022-10-24 09:01:12,A Washington state woman fended off a black bear attack,"The woman sustained non-life threatening injuries and is being treated at a hospital, according to officials. Wildlife officers killed a bear found nearby."
2,2022-10-24 05:37:34.483285,2022-10-24 09:00:42,Children's hospitals grapple with a nationwide surge in RSV infections,The latest spike is months early and it's pushing care facilities to capacity. Children under the age of 5 are most vulnerable.
3,2022-10-24 05:37:34.483285,2022-10-24 09:00:42,The first Nation's Report Card since COVID shows math and reading scores are down,"The test measures reading and math proficiency for fourth- and eighth-graders. It's administered every two years, but the pandemic delayed the 2021 report until now."
4,2022-10-24 05:37:34.483285,2022-10-24 09:00:42,Jury selection begins in the Trump Organization tax evasion trial,"Former President Donald Trump's family company has long been involved in countless business disputes that landed it in civil court. But it has never been tried in a court of law for crimes, until now."
5,2022-10-24 05:37:34.483285,2022-10-24 09:00:42,Democrats are losing Latino voters as Republicans eye opportunities these midterms,"While Democratic strategists acknowledge past mistakes and make renewed pledges to woo Latino voters, Republicans are also making inroads."
6,2022-10-24 05:37:34.483285,2022-10-24 09:00:12,The U.S. set a new record for apprehensions at the southern border,"Migrants apprehensions at the southern border this past year jumped by 37% compared to the year ago. A growing number of border-crossers are from Venezuela, Cuba and Nicaragua."
7,2022-10-24 05:37:34.483285,2022-10-24 09:00:00,"As a new trial starts, here's where the cases concerning George Floyd's murder stand","A jury trial is set to begin in Minnesota court for former officers Tou Thao and J. Alexander Kueng, who pleaded not guilty to charges of aiding and abetting the murder and manslaughter of Floyd."
8,2022-10-24 05:37:34.483285,2022-10-24 09:00:00,Those fake active shooter calls to schools? A similar thing happened before,"As schools across the U.S. are targeted by false calls about active shooters, NPR has found evidence that a similar scheme took place in the spring."
9,2022-10-24 05:37:34.483285,2022-10-24 07:42:35,Residents across India celebrate Diwali with festivities and dazzling lights,Indians celebrated Diwali on Monday as bright oil lamps and colorful lights lit up homes and streets across the country to mark the Hindu festival that symbolizes the victory of light over darkness.
10,2022-10-24 04:21:46.753456,2022-10-24 06:04:42,The Houston Astros and Philadelphia Phillies will face each other in the World Series,"Major League Baseball has its World Series lineup cards set, as the Houston Astros will face the Philadelphia Phillies."
11,2022-10-24 03:05:59.309631,2022-10-24 04:09:55,Deaths from southern tribal clashes in Sudan reach at least 220,"Two days of tribal fighting in Sudan's south killed at least 220 people, a senior health official said Sunday, marking one the deadliest bouts of tribal violence in recent years."
12,2022-10-23 22:00:39.991242,2022-10-23 22:20:12,Boris Johnson drops out of the race to be the next U.K. prime minister,Treasury chief Rishi Sunak is now the strong favorite to become Britain's next prime minister — the third this year — at a time of political turmoil and severe economic challenges.
13,2022-10-23 18:08:54.084717,2022-10-23 19:50:30,N.Y. officials announce plans for a memorial to the victims of the Buffalo shooting,"The May 14th Memorial Commission is a step in the state's long-term commitment to supporting and uplifting the East Side Buffalo community, officials say."
14,2022-10-23 14:19:21.213364,2022-10-23 18:01:00,Woodward's taped time with Trump reveals much about both the author and his subject,"We hear the former president striving to court Woodward's favor, praising him as ""a great historian"" and ""the great Bob Woodward."" Yet these interviews veer often into disagreements and even debates."
