INDEX,DOWNLOAD_TIME,DATE,TITLE,SUMMARY
0,2023-06-24 10:10:03.141892,2023-06-23 19:00:00,AI-Generated Junk Is Flooding Etsy,"Coloring books, stickers, mugs, and T-shirts are being pumped out by AI-assisted hustlers "
1,2023-06-24 10:10:03.141892,2023-06-23 19:00:00,Why Are So Many Women Being Told Their Hormones Are Out of Whack?,At-home test kits promise clarity about users’ health and fertility. Experts say they could just lead to more confusion 
2,2023-06-24 10:10:03.141892,2023-06-23 19:00:00,Tesla’s Magic Has Been Reduced to Its Chargers,"Ford and GM are turning to Tesla’s charging connectors, giving the company more influence over our EV future "
3,2023-06-24 10:10:03.141892,2023-06-23 19:00:00,Apple Is an AI Company Now,Lots of tiny AI tweaks are quietly taking over the iPhone 
4,2023-06-24 10:10:03.141892,2023-06-23 19:00:00,Car-Rental Companies Are Ruining EVs,Good luck charging your surprise electric rental car 
5,2023-06-24 10:10:03.141892,2023-06-23 19:00:00,When the Unnatural Becomes Natural,Artificial intelligence will redefine some of our deepest assumptions about the makeup of the world around us 
6,2023-06-24 10:10:03.141892,2023-06-23 19:00:00,AI Is an Existential Threat to Itself,Generative-AI programs may eventually consume material that was created by other machines—with disastrous consequences 
7,2023-06-24 10:10:03.141892,2023-06-23 19:00:00,How the Vape Shops Won,It’s a rough time for retail stores in America. How can there be so many vape shops 
8,2023-06-24 10:10:03.141892,2023-06-23 19:00:00,Your Phone Is a Mindfulness Trap,"Relying on apps for meditation is a recipe for distrac—hold on, I just got a text "
9,2023-06-24 10:10:03.141892,2023-06-23 19:00:00,The Nerds Are Bullies Now,Musk vs. Zuck makes losers of us all 
