INDEX,DOWNLOAD_TIME,DATE,TITLE,SUMMARY
0,2022-02-11 09:44:09.544927,2022-02-11 12:09:05,US auto factories disrupted by Canadian trucker rally,"After a year of computer chip shortages, supply chain problems and temporary plant closings, this was about the last thing the auto industry needed."
1,2022-02-11 09:44:09.544927,2022-02-11 13:27:27,"Canned cocktails are so big, they've made it to the Super Bowl","Anheuser-Busch, known for beers like Budweiser, Busch and Stella Artois, is shining a light on its canned cocktails with a new Super Bowl ad."
2,2022-02-11 09:44:09.544927,2022-02-11 09:44:00,2022: The Year of the One-Card Wallet,
3,2022-02-11 09:44:09.544927,2022-02-11 09:44:00,Card hits market with unlimited 2% cash rewards,
4,2022-02-11 09:44:09.540263,2022-02-11 09:21:10,Boris Johnson's go-to economic boast obscures the painful truth,Prime Minister Boris Johnson is fond of saying the United Kingdom has the fastest growing economy in the G7.
5,2022-02-11 09:44:09.540263,2022-02-10 12:51:39,Iraq faces deadlock after 'West-friendly' candidate suspended,"He's arguably Iraq's best-known face abroad. Hoshyar Zebari, a Kurd, was the country's longest-serving foreign minister, often hobnobbing with Western diplomats and journalists, but also cultivating strong ties with neighboring Arab states to make his country's case."
6,2022-02-11 09:44:09.540263,2022-02-10 11:30:47,"Libyan PM survives assassination attempt, source close to him says","Assailants struck Libyan Prime Minister Abdulhamid al-Dbeibah's car with bullets early on Thursday but he escaped unharmed, a government source close to him said, amid intense factional wrangling over control of the government."
7,2022-02-11 09:44:09.540263,2022-02-10 02:51:49,"No snow, no problem: Winter sports are booming in China","Eric Zhang was born in Chongqing, in southern China, and grew up enjoying warm-weather activities. But when he went to graduate school in New York City, he began to understand the allure of snow."
8,2022-02-11 09:44:09.540263,2022-02-09 23:20:58,Uber's business is over the pandemic slump,Uber's business is showing signs that it's moving past the pandemic slowdown.
9,2022-02-11 09:44:09.540263,2019-09-18 16:44:32,US cities are losing 36 million trees a year. Here's why it matters,"If you're looking for a reason to care about tree loss, the nation's latest heat wave might be it.  Trees can lower summer daytime temperatures by as much as 10 degrees Fahrenheit, according to a recent study."
10,2022-02-11 09:44:09.540263,2019-07-12 15:14:00,Miami's Little Haiti wasn't a target for developers. Until the seas started to rise,
11,2022-02-11 09:44:09.540263,2019-07-12 09:20:40,How rich people could help save the planet from the climate crisis,Rich people don't just have bigger bank balances and more lavish lifestyles than the rest of us -- they also have bigger carbon footprints.
12,2022-02-11 09:44:09.540263,2022-02-03 12:48:51,This luxury watch brand has become the ultimate status symbol for young celebrities,"From Joe DiMaggio to Albert Einstein, Princess Diana to Victoria Beckham, watchmaker Patek Philippe has long been a celebrity favorite. But the Swiss brand's reputation has taken an unexpected turn in recent years."
13,2022-02-11 09:44:09.540263,2022-02-04 15:54:03,Ai Weiwei helped design Beijing's Olympic stadium. But he regrets how it's being used today,"As the Beijing Winter Olympics gets underway, artist Ai Weiwei is once again criticizing China's ruling Communist Party -- and the International Olympic Committee (IOC), which he said is ""ignoring"" the safety of the country's athletes by prioritizing business and ""standing next to the authoritarians."""
14,2022-02-11 09:44:09.540263,2022-02-03 17:13:35,"Dürer drawing bought for $30 at yard sale worth more than $10 million, experts say",A 16th century drawing by one of the key figures of the German Renaissance has been valued in excess of $10 million after it was initially purchased at a yard sale for just $30 in 2017.
15,2022-02-11 09:44:09.540263,2022-02-03 10:49:33,Behind the making of 'Pam and Tommy',"When a trailer for the new Hulu series ""Pam & Tommy"" dropped in November, screenshots of Lily James' mesmerizing transformation into the ""Baywatch"" icon Pamela Anderson immediately went viral."
16,2022-02-11 09:44:09.540263,2022-02-07 09:18:37,Dramatic photos cast Europe's ancient castles in a new light,"For centuries, medieval castles -- hulking, isolated triumphs of masonry -- have held a special place in the Western imagination, evoking at once a sense of history, fantasy, war and romance. They are the perennial backdrops for period dramas and children's books, travel brochures and fashion spreads."
17,2022-02-11 09:44:09.540263,2022-01-28 05:00:32,Inside the $128M heist that shocked the world -- and the police chase that followed,"It took at least nine hard blows from an ax to smash the glass case in Dresden's historic Green Vault. Once the glass shattered, the two masked thieves grabbed 21 priceless diamond-studded artifacts and disappeared."
18,2022-02-11 09:44:09.540263,2022-02-08 10:29:18,London was building a bigger rival to the Eiffel Tower. Then it all went wrong,"Somewhere beneath the pitch of England's national stadium in Wembley, London, lie the foundations of what could have been the city's tallest building. Inspired by the Eiffel Tower in Paris, the Great Tower of London was poised to surpass it in height and reach almost 1,200 feet."
19,2022-02-11 09:44:09.540263,2022-02-09 17:35:56,The world's most romantic places,"Maybe you'd choose the white sands and turquoise waters of a deserted tropical beach. Perhaps it's the lure of iconic cultural cities such as Paris, Venice or Istanbul. Then again, the call of the wild from a safari is a pretty special way to spend time with your beloved."
20,2022-02-11 09:44:09.540263,2022-02-09 19:16:25,Traveling to Italy: What you need to know,"If you're planning to travel to Italy, here's what you'll need to know and expect if you want to visit during the Covid-19 pandemic."
21,2022-02-11 09:44:09.540263,2021-02-23 01:21:28,23 best Turkish foods,"Turkey may be famous for its kebabs, but the popular dish is just the tip of the iceberg when it comes to Turkish cuisine."
22,2022-02-11 09:44:09.540263,2022-01-28 11:33:05,Breakfast around the world: How different places start the day,"When it comes to breakfast foods around the world, there are as many ways to enjoy the first meal of the day as there are to say ""good morning."""
23,2022-02-11 09:44:09.540263,2022-01-24 09:49:27,The Italian village that doesn't speak Italian,"Nicknamed Italy's ""Little Provence,"" Sancto Lucio de Coumboscuro is an isolated village in almost every sense."
24,2022-02-11 09:44:09.540263,2021-12-10 20:25:10,The world's fastest trains,"As the world faces up to climate change, short-haul flights look increasingly unattractive to many travelers. The flygskam (flight shame) phenomenon that started in Scandinavia is already inspiring many travelers to reduce their reliance on airlines."
25,2022-02-11 09:44:09.540263,2021-12-18 11:29:07,This 10-year-old asked Santa last year for a Covid cure. This year he has a new request,"In their letters to Santa Claus, most kids ask for toys, dolls or maybe a new Xbox."
26,2022-02-11 09:44:09.540263,2021-12-19 05:21:54,"Teacher raises more than $100,000 for food to keep thousands of children from going hungry over winter break",Turquoise LeJeune Parker ends every class by telling each of her students she loves them.
27,2022-02-11 09:44:09.540263,2021-12-13 03:18:22,Meet CNN's Hero of the Year,• Hear Shirley Raines' emotional remarks after big win
28,2022-02-11 09:44:09.540263,2022-02-11 09:44:00,0% intro APR until 2023 is 100% insane,
