INDEX,DOWNLOAD_TIME,DATE,TITLE,SUMMARY
0,2023-05-02 16:11:20.028842,2023-05-02 15:18:00,Elon Musk’s Disastrous Week,"For the tech world’s most attention-grabbing man, performance comes before substance "
1,2023-05-02 16:11:20.028842,2023-05-02 15:18:00,Elon Musk Revealed What Twitter Always Was,"Stripped down to its skeleton, Twitter is the definitive “shame network "
2,2023-05-02 16:11:20.028842,2023-05-02 15:18:00,Silicon Valley’s Favorite Slogan Has Lost All Meaning,How one specific observation became a hyped-up law of everything 
3,2023-05-02 16:11:20.028842,2023-05-02 15:18:00,Will Tucker Carlson Become Alex Jones?,The host used his platform to bring hate and conspiracy theories from the fever swamps to cable TV 
4,2023-05-02 16:11:20.028842,2023-05-02 15:18:00,A Refuge From Internet Algorithms Is Hiding in Plain Sight,"Unlike TikTok and Instagram, the photos and reviews on Google Maps haven’t been packaged for your taste or mine "
5,2023-05-02 16:11:20.028842,2023-05-02 15:18:00,Chatbots Sound Like They’re Posting on LinkedIn,"Large language models make things up, but the worse problem may be in how they present those falsehoods "
6,2023-05-02 16:11:20.028842,2023-05-02 15:18:00,Goodbye to the Dried Office Mangoes,"Google is clawing back its famously lavish employee perks, sending a message that might be more symbolic than practical "
7,2023-05-02 16:11:20.028842,2023-05-02 15:18:00,You Will Miss Bed Bath &amp; Beyond,What we really lose when brick-and-mortar retailers close 
8,2023-05-02 16:11:20.028842,2023-05-02 15:18:00,Just Wait Until Trump Is a Chatbot,"Artificial intelligence is already showing up in political ads. Soon, it will completely change the nature of campaigning "
9,2023-04-19 16:11:04.171061,2023-04-18 16:11:00,The Problem With Weather Apps,How are we still getting caught in the rain 
