INDEX,DOWNLOAD_TIME,DATE,TITLE,SUMMARY
0,2022-07-30 17:50:13.360850,2022-07-30 11:00:00,Spain says 'all bodies are beach bodies' in a bid to encourage body positivity,"“Fat women suffer harassment on the street, on the beaches, they’re censored and stigmatized,” said the director of a rights group"
1,2022-07-30 17:50:13.360850,2022-07-30 11:00:00,"Justice Alito mocks Prince Harry, Boris Johnson for opposing Roe reversal","Alito, who authored the landmark opinion overturning the constitutional right to an abortion in the U.S., derided critics during a speech on"
2,2022-07-30 17:50:13.360850,2022-07-30 11:00:00,Hungary’s Orban says comments opposing ‘mixed race’ society not rooted in racism after backlash,"One of the Hungarian leader's aides resigned earlier this week, calling his speech “a pure Nazi text"
3,2022-07-30 17:50:13.360850,2022-07-30 11:00:00,Whodunnit? ‘WAGatha Christie’ libel trial concludes it was Rebekah Vardy,"In a case that has fascinated the media and public alike with its mix of glamour, soccer, and amateur sleuthing, the court backed Coleen "
4,2022-07-30 17:50:13.360850,2022-07-30 11:00:00,Kyiv and Moscow trade blame for strike reportedly killing dozens of Ukrainian POWs,Russia said Ukraine used a U.S.-supplied rocket system to hit a detention facility near the eastern front lines. Ukraine vehemently denied 
5,2022-07-30 17:50:13.360850,2022-07-30 11:00:00,What's behind severe hepatitis in kids? Researchers may have their strongest theory yet,"A new theory suggests that a co-infection of two viruses, plus a genetic marker, could be behind cases of dangerous liver inflammation among"
6,2022-07-30 17:50:13.360850,2022-07-30 11:00:00,"Climate change made U.K. heat wave hotter and more likely, study finds","“This new era of heat is particularly dangerous because most homes are not equipped for it there,” said University of Georgia "
7,2022-07-30 17:50:13.360850,2022-07-30 11:00:00,Shakira could face 8-year prison term if convicted in expected tax fraud trial,The Colombian pop star is charged with&nbsp;failing to pay&nbsp;the Spanish government 14.5 million euros ($15 million) in taxes between 
8,2022-07-30 17:50:13.360850,2022-07-30 11:00:00,Venezuela opposition leader Juan Guaidó wins U.K. court ruling in battle over gold,"The British government recognizes Guaidó as Venezuela’s president, and the Bank of England has refused to hand the gold over to President"
9,2022-07-30 17:50:13.360850,2022-07-30 11:00:00,"Russian operative used U.S. activist groups to spread propaganda, feds say","Aleksandr Viktorovich Ionov&nbsp;also worked to interfere in U.S. elections and undermine support for Ukraine, the Department of Justice "
