INDEX,DOWNLOAD_TIME,DATE,TITLE,SUMMARY
0,2023-08-17 17:21:38.188049,2023-08-17 14:41:46,"China's economic model is 'washed up on the beach,' says veteran investor David Roche","China's economic model is ""washed up on the beach"" and ""not going to take off again,"" which will have a big impact on global markets, says veteran investor David Roche."
1,2023-08-15 17:21:37.227681,2023-08-15 16:10:16,"Retail sales increased 0.7% in July, better than expected as consumer spending is holding up","The advanced retail sales report showed a seasonally adjusted increase of 0.7% for the month, better than the 0.4% Dow Jones estimate"
2,2023-08-14 17:21:36.750064,2023-08-15 02:01:45,"Russian ruble slumps to near 17-month low, briefly moves past 100 against dollar",Friday figures showed Russia's GDP expanded by a yearly 4.9% in the second quarter.
3,2023-08-11 17:21:35.485333,2023-08-11 13:32:22,"Wholesale prices rose 0.3% in July, higher than expected","The producer price index rose 0.3% for the month, slightly higher than expectations."
4,2023-08-10 17:21:35.033314,2023-08-10 15:54:38,"July CPI report shows inflation gauge rose 3.2%, less than expected","The consumer price index in July was expected to rise 0.2% from the prior month and 3.3% from a year ago, according to Dow Jones."
5,2023-08-10 17:21:35.033314,2023-08-11 12:54:22,"Interest rates should stay around 5% for longer — even as inflation falls, top economist Jim O'Neill says","Veteran economist Jim O'Neill says central banks will need to keep interest rates up around 5% across major economies for longer than the market expects, even as inflation subsides."
6,2023-08-09 17:21:34.614413,2023-08-10 17:17:49,"Thursday's inflation data may be low, but don't expect the Fed to declare 'mission accomplished' yet",History has shown that inflation is stubborn and can last longer than expected.
7,2023-08-08 17:21:33.999258,2023-08-08 17:00:38,Credit card balances jumped in the second quarter and are above $1 trillion for the first time,"Credit card debt 30 or more days late rose to 7.2% in the second quarter, up from 6.5% in Q1 and the highest rate since the first quarter of 2012."
8,2023-08-04 17:21:32.415853,2023-08-04 21:35:52,JPMorgan backs off recession call even with 'very elevated' risks,"Economists at the country's largest bank bailed on their recession call, joining a growing chorus that now thinks a contraction is no longer inevitable."
9,2023-08-04 17:21:32.415853,2023-08-04 20:00:46,"The story of inflation, as told through your child's backpack",Americans are expected to spend a record amount on school supplies this year. They're feeling sticker shock as inflation continues to push up prices.
10,2023-08-04 17:21:32.415853,2023-08-04 16:04:13,Black unemployment rate ticks lower in July as jobs market remains tight,"The jobless rate for Black workers fell to 5.8% in July, Labor Department data showed Friday."
11,2023-08-04 17:21:32.415853,2023-08-04 15:45:45,Here's where the jobs are for July 2023 — in one chart,"The health care and social assistance category grew by 87,100 jobs last month, continuing a hot streak."
12,2023-08-04 17:21:32.415853,2023-08-04 16:42:11,"July jobs report: U.S. payroll growth totaled 187,000, lower than expected","Nonfarm payrolls were expected to increase by 200,000 in July, according to the Dow Jones consensus estimate."
13,2023-08-03 17:21:32.005927,2023-08-03 23:53:01,Here's everything you need to look for in Friday's July jobs report,"Wall Street expects that nonfarm payrolls increased by 200,000 in July, the smallest gain since December 2020"
14,2023-08-03 17:21:32.005927,2023-08-03 08:41:51,"The Fitch U.S. ratings cut is here to stay, says analyst who worked on the S&P downgrade in 2011","""It does not take a grand sovereign and analytics genius to understand that the fiscal profile of the U.S. is much worse than it has been,"" said Elliot Hentov."
15,2023-08-02 17:21:31.477563,2023-08-02 19:18:43,The Fitch analyst behind the U.S. downgrade breaks down the decision—and how the country can regain the top rating,Fitch Ratings' Richard Francis told CNBC that the rating agency would need to see a long-term fiscal solution and a reduction of its debt.
16,2023-08-02 17:21:31.477563,2023-08-02 12:39:17,"Private sector added 324,000 jobs in July, well above expectations, ADP says","That total was well above the Dow Jones consensus estimate for 175,000, though it marked a decrease from the downwardly revised 455,000 in June."
17,2023-08-02 17:21:31.477563,2023-08-02 10:53:38,U.S. debt downgrade sinks global markets — but economists are not concerned,"Global stock markets tumbled on Wednesday after ratings agency Fitch downgraded the United States' long-term credit rating, but top economists say there is nothing to worry about."
18,2023-08-01 17:21:31.005462,2023-08-01 18:27:22,"Job openings, layoffs declined in June in a positive sign for the labor market","Employment openings totaled 9.58 million for the month, edging lower from the downwardly revised 9.62 million in May."
19,2023-07-31 17:21:30.583566,2023-07-31 09:15:52,"Saudi Arabia's economic growth slows as oil cuts, price drops bite into revenues",The International Monetary Fund had dubbed Riyadh the fastest growing economy in the Group of 20 in 2022.
20,2023-07-28 17:21:29.257472,2023-07-28 18:18:36,Key Fed inflation rate falls to lowest annual level in nearly 2 years,"Inflation showed further signs of cooling in June, according to a gauge released Friday that the Federal Reserve follows closely."
21,2023-07-28 17:21:29.257472,2023-07-29 02:55:56,The Bank of Japan just shocked markets with a policy tweak — here's why it matters,The Bank of Japan loosened its yield curve control in an unexpected move with ramifications across global financial markets.
22,2023-07-27 17:21:28.827983,2023-07-27 13:49:31,Turkey's central bank says inflation is set to hit 58% — more than double its previous estimate,"Turkey's central bank expects inflation to hit 58% by the end of 2023, its new governor Hafize Gaye Erkan said in her debut news conference Thursday."
23,2023-07-27 17:21:28.827983,2023-07-27 14:20:04,"GDP grew at a 2.4% pace in the second quarter, topping expectations despite recession calls",Gross domestic product was expected to increase at a 2% annualized pace in the second quarter.
24,2023-07-27 17:21:28.827983,2023-07-27 17:12:49,"European Central Bank raises rates by a quarter percentage point, says inflation set to remain ‘too high for too long’","The central bank did not share any forward guidance about its next moves, but did raise the possibility of a potential pause in rate hikes in September."
25,2023-07-25 17:21:27.707697,2023-07-25 06:07:15,What new norm of slower Chinese growth could mean for the global economy,"The Chinese economy could be facing a period of lower growth, which may have global ramifications after 45 years of rapid expansion and globalization."
26,2023-07-20 17:21:25.821251,2023-07-20 20:54:42,Federal Reserve officially launches new FedNow instant-payments service,"The system will be available 24 hours, seven days a week and is open to interested banks and credit unions."
27,2023-07-19 17:21:25.282488,2023-07-19 08:35:09,"UK inflation rate slides to 7.9% in June, below expectations","U.K. inflation cooled significantly in June, coming in below consensus expectations at 7.9% annually."
28,2023-07-18 17:21:24.915071,2023-07-18 15:32:55,Fed banking regulator warns A.I. could lead to illegal lending practices like excluding minorities,"Michael S. Barr said AI technology has potential, but also can be used for nefarious means."
29,2023-07-18 17:21:24.915071,2023-07-18 08:28:00,Goldman Sachs cuts odds of a U.S. recession in the next year,"The investment bank, however, expects some deceleration in subsequent quarters as a result of sequentially slower real disposable personal income growth."
