INDEX,DOWNLOAD_TIME,DATE,TITLE,SUMMARY
0,2023-05-28 04:45:09.854397,2023-05-28 01:00:00,Cuba's rural towns are hit hard with fuel shortages,"Amid weeklong fuel lines and having to cook with charcoal, the lack of fuel and cooking gas is perceived by many Cubans in the island’s countryside as the last straw "
1,2023-05-28 04:45:09.854397,2023-05-28 01:00:00,Pope Francis shows world his health is improving two months after hospitalization for bronchitis,"Almost two months after being hospitalized for bronchitis, Pope Francis thanked the doctors that caught the infection in a conversation with Telemundo. NBC News’ Anne Thompson reports on the Pontiff’s virtual town hall with young people around the world "
2,2023-05-28 04:45:09.854397,2023-05-28 01:00:00,China faces a new Covid wave that could peak at 65 million cases a week,"The country once had some of the harshest Covid restrictions on the planet, but the response from the government and the public is relatively muted this time "
3,2023-05-28 04:45:09.854397,2023-05-28 01:00:00,Will Chinese hacking derail U.S. hopes for a thaw with Beijing?,Warnings of a new type of Chinese malware come as Commerce Secretary Gina Raimondo met with her Chinese counterpart 
4,2023-05-28 04:45:09.854397,2023-05-28 01:00:00,Passenger opens plane door during flight in South Korea,"Police detained the unidentified person who opened the door minutes before landing, the airline said "
5,2023-05-28 04:45:09.854397,2023-05-28 01:00:00,"Pope Francis skipped audiences because of a fever, Vatican says",Vatican spokesman Matteo Bruni did not provide any further details on the health of the 86-year-old Roman Catholic leader 
6,2023-05-28 04:45:09.854397,2023-05-28 01:00:00,A tree felled in a storm leaves a nation mourning a 'great loss',"Sierra Leone has been dealt a “great loss,” the country’s leader said Thursday, after its Cotton Tree, which served as a symbol of national freedom, was brought down "
7,2023-05-28 04:45:09.854397,2023-05-28 01:00:00,New British Cycling rules bar transgender women from competing in elite female events,"Trans women, trans men, non-binary individuals and those whose sex was assigned male at birth will be eligible to compete in an ""open"" category under the new rules "
8,2023-05-17 12:44:31.230586,2023-05-21 04:45:00,Nigerian chef cooks nonstop for 100 hours to set new world record,"Hilda Baci dished up dozens of Nigerian delicacies, from soups to stew and various proteins and, of course, Jollof rice "
9,2023-05-17 12:44:31.230586,2023-05-21 04:45:00,Gimmick or innovation? Self-driving bus starts taking passengers in U.K. trial,"Autonomous buses began serving the streets of the Scottish capital, Edinburgh, on Monday "
