INDEX,DOWNLOAD_TIME,DATE,TITLE,SUMMARY
0,2022-10-10 07:12:11.984595,2022-10-10 10:48:44,Nobel economics prize awarded to U.S.-based economists including Bernanke for work on financial crises,"U.S.-based economists Ben Bernanke, Douglas Diamond and Philip Dybvig win the Nobel prize in economic sciences for research on banks and financial crises."
1,2022-10-10 07:12:11.984595,2022-10-10 10:43:53,Shaquille O’Neal reveals Jeff Bezos's investing principle that he still uses today,"Former NBA basketball player Shaquille O'Neal shared an investment principle he heard from Amazon founder Jeff Bezos, which has inspired his undertakings since."
2,2022-10-10 07:12:11.984595,2022-10-10 11:07:18,Musk's proposal for China-Taiwan relations gets slammed: Our freedom is 'not for sale',"Elon Musk has weighed in on China-Taiwan relations, and Taiwanese politicians are not impressed."
3,2022-10-10 06:12:11.650536,2022-10-10 09:47:26,Bank of England strengthens emergency stimulus to help ease market turmoil,"The Bank of England on Monday announced further measures to ensure financial stability in the U.K., building on its intervention in the long-dated bond market."
4,2022-10-10 06:12:11.650536,2022-10-10 09:04:21,Chinese chip stocks tumble after U.S. calls for new curbs on high-end tech,Chinese chip stocks fell Monday after the U.S. announced new export controls aimed at limiting Beijing's ability to produce advanced military systems.
5,2022-10-10 03:10:00.571723,2022-10-10 05:18:40,UK mortgage rates are soaring: Here's what you need to know as a first-time buyer,"As the U.K. mortgage sector has been in turmoil, what do first-time buyers need to keep in mind as they buy their property."
6,2022-10-10 02:10:00.312214,2022-10-10 01:45:31,China's top leaders are set for a reshuffle. Here are the names to watch,The ruling Communist Party of China is expected to begin its 20th National Congress on Oct. 16 to select a new leadership team.
7,2022-10-10 02:10:00.312214,2022-10-08 12:00:01,Why Silicon Valley is so excited about awkward drawings done by artificial intelligence,"Generative AI has gotten so much better that it's inspired people to leave their jobs, start new companies and dream about a new generation of tech giants."
8,2022-10-10 01:09:59.975496,2022-10-10 04:23:22,Musk says Beijing doesn't want him to sell Starlink in China,Elon Musk told the Financial Times Beijing doesn't want him to sell his Starlink satellite internet service in China after it was rolled out in Ukraine.
9,2022-10-09 23:09:59.172891,2022-10-10 00:06:36,Allianz Chief Economic Adviser El-Erian believes core inflation 'is still going up',"Allianz Chief Economic Adviser Mohamed El-Erian said he predicts headline inflation ""will probably come down to about 8%,"" but that core inflation ""is still going up."""
10,2022-10-09 22:09:58.898527,2022-10-10 08:51:48,Canada’s exports to countries in mega trade deal grew in 'tremendously difficult' times: Minister,"Over the weekend, ministers and senior officials from member countries of the CPTPP met in Singapore to review the progress of the agreement."
11,2022-10-09 22:09:58.898527,2022-10-08 13:00:01,"4 reasons people still follow toxic bosses, psychologist says: 'We're keeping them in power'","Ronald Riggio, a leadership professor at Claremont McKenna College, says there are four reasons people follow bad bosses. They all have to do with psychology."
12,2022-10-09 21:09:58.434689,2022-10-07 08:30:09,Wharton's Jeremy Siegel says today's biggest threat isn't inflation — it's recession,"Siegel said he was one of the first to warn of the Fed's ""inflationary policies"" in 2020 and 2021, but ""the pendulum has swung too far in the other direction."""
13,2022-10-09 21:09:58.434689,2022-10-09 09:44:12,"Verstappen wins chaotic, rain-shortened Japanese GP to clinch title","Max Verstappen sealed his second Formula 1 world championship amid huge confusion after winning a chaotic, rain-shortened Japanese Grand Prix."
14,2022-10-09 06:05:32.464399,2022-10-07 14:44:56,"Unemployment rate falls to 3.5% in September, payrolls rise by 263,000 as job market stays strong","Nonfarm payrolls in September increased 263,000 for the month, compared to the Dow Jones estimate of 275,000. The unemployment rate was 3.5%."
15,2022-10-08 09:58:50.351195,2022-10-07 20:13:55,September job gains affirm that the Fed has a long way to go in inflation fight,September's payrolls report provided assurance that the jobs market is strong and that the Fed will have to do more to slow it down.
16,2022-10-07 20:56:35.530062,2022-10-07 17:43:38,Biden signs executive order with new framework to protect data transfers between the U.S. and EU,The new Privacy Shield seeks to address European concerns of surveillance by U.S. intelligence agencies.
17,2022-10-07 17:56:34.299045,2022-10-09 11:22:20,Top Wall Street analysts pick these stocks as the market grows increasingly uncertain,"TipRanks analyst ranking service pinpoints Wall Street's best-performing stocks, including Apple & Amazon."
18,2022-10-07 17:56:34.294524,2022-10-07 12:29:19,"Postal workers in the UK, striking over pay and working conditions, agree crunch talks with Royal Mail bosses",Leaders of the trade union representing striking postal workers in the U.K. will meet with Royal Mail bosses on Monday for crunch talks.
19,2022-10-07 17:56:34.294524,2022-10-06 17:12:42,37-year-old millionaire reacts to couple who retired early with $2.2 million in Portugal: It's 'like cheating',"The author of ""Financial Freedom"" says a couple who retired early and is living abroad has done everything right, ""maybe too much right."""
20,2022-10-07 17:56:34.294524,2022-10-09 21:24:27,"The first crop of space mining companies didn't work out, but a new generation is trying again","A few years ago, it seemed space mining was inevitable. But, the closest we've gotten is prospecting missions. A few startups are hoping to change that."
21,2022-10-07 17:56:34.294524,2022-10-08 12:00:01,"European countries face an air-conditioning Catch-22 after its red hot, record-breaking summer","Europe faces a growing energy crisis coming into the colder, winter months. It will face another problem if more scorching summer heat waves return."
22,2022-10-07 17:56:34.294524,2022-10-07 23:57:38,Tesla stock had its worst week since March 2020 during a 'very intense 7 days' for Elon Musk,"Ukraine, Twitter, and a miss on Tesla deliveries were among the menu items on Musk's smorgasbord this week."
23,2022-10-07 17:56:34.294524,2022-10-07 16:26:42,Ron Insana: It's time to use an 'all of the above' energy policy to break up the OPEC+ cartel,Saudi Arabia's decision to ally with Russia means it's time for the U.S. to take every available step it can to boost U.S. energy production.
24,2022-10-07 17:56:34.294524,2022-10-07 21:16:44,Rocket builder Astra Space gets delisting warning from Nasdaq,Embattled small rocket-builder Astra said Friday it received a delisting warning from the Nasdaq after its stock spent 30 straight days below $1 per share.
25,2022-10-07 17:56:34.294524,2022-10-07 19:28:19,Why this investor doesn't back companies that use carbon offsets,"Zachary Bogue, co-founder of Palo Alto-based VC firm DCVC, does not invest in companies that depend on carbon offsets to make their business work."
26,2022-10-07 17:56:34.294524,2022-10-07 16:41:17,"Dr. Fauci: A new, more dangerous Covid variant could emerge this winter","Dr. Anthony Fauci has a sober warning for Americans: Don't be surprised if a new, more dangerous Covid variant emerges this upcoming winter."
27,2022-10-07 17:56:34.294524,2022-10-07 11:00:37,Women’s soccer is booming in England. But the big money hasn't caught up yet,"In-person and TV viewership are breaking records, and industry figures say they expect more money to flow into the women's game, taking it further."
28,2022-10-07 17:56:34.294524,2022-10-07 11:56:22,Samsung profit plunges in first drop since 2019 as chipmakers feel bite,Samsung forecast on Friday its operating profit plunged 32% in the third quarter of the year as weaker memory pricing and demand hit the technology giant.
29,2022-10-07 17:56:34.294524,2022-10-07 13:12:03,$570 million worth of Binance's BNB token stolen in another major crypto hack,"Binance said a cross-chain bridge linking with its Binance Smart Chain (BSC) was targeted, enabling hackers to move BNB tokens off the network."
