INDEX,DOWNLOAD_TIME,DATE,TITLE,SUMMARY
0,2023-03-14 11:13:32.960465,2023-03-14 13:36:41,Ron Baron bought Charles Schwab shares during Monday's double-digit sell-off,"The 79-year-old investor said he ""modestly increased"" his position in the financial name, seeing Monday's pullback as a buying opportunity."
1,2023-03-12 11:13:32.463408,2023-03-12 13:20:14,Top analysts are bullish on these five stocks in uncertain times,"TipRanks analyst ranking service pinpoints Wall Street's best-performing stocks, including Snowflake and Salesforce."
2,2023-03-11 10:13:32.184848,2023-03-10 21:04:09,"Crypto bank Signature slides on Friday amid troubles at Silicon Valley Bank, Silvergate",Signature Bank shares dropped as much as 32% on Friday and were halted amid a sell-off in bank stocks that continued for a second day.
3,2023-03-10 10:13:31.628981,2023-03-09 17:25:55,Women aren't investing at the same rate as men. Here's why it matters—and how the gap can be closed,"The reasons for the gender investing gap are nuanced — but if closed, it could mean an additional $3.22 trillion in the market."
4,2023-03-09 10:13:31.368212,2023-03-08 19:16:42,Want a risk-free 5% return? How to buy a 3-month Treasury,Even the most boring investments are exciting as yields on short-term Treasurys pop.
5,2023-03-05 12:05:01.608121,2023-03-05 12:37:37,Top Wall Street analysts pick these stocks for attractive returns,"TipRanks analyst ranking service pinpoints Wall Street's best-performing stocks, including Nvidia & Workday."
6,2023-03-03 12:05:00.680117,2023-03-03 16:50:27,Silvergate Capital shares drop 57% after the crypto bank delays its annual report,"Silvergate said it is reviewing events since the end of last year that could impact ""its ability to continue as a going concern."""
7,2023-02-28 12:04:59.635389,2023-02-28 17:07:00,The racial retirement savings gap remains wide – How these state IRA programs are working toward equity,Workers have put away $735 million in state retirement savings programs that are intended to help employees at small businesses.
8,2023-02-26 12:04:58.972184,2023-02-26 15:19:04,Top Wall Street analysts expect these stocks to thrive despite macro pressures,"TipRanks analyst ranking service pinpoints Wall Street's best-performing stocks, including Walmart & Datadog."
9,2023-02-25 12:04:58.814206,2023-02-25 12:42:02,Third Point’s Dan Loeb pens a pointed letter to Bath & Body Works – What could happen next,The veteran activist’s recent letter to the retailer’s board sets the table for a battle.
