INDEX,DOWNLOAD_TIME,DATE,TITLE,SUMMARY
0,2024-01-13 01:10:06.695015,2024-01-13 01:10:00,Stock market is still on sale: Ryan Payne,
1,2024-01-13 01:10:06.695015,2024-01-13 01:10:00,US economy is stronger than most people think: BlackRock CEO Larry Fink,
2,2024-01-13 01:10:06.695015,2024-01-13 01:10:00,We need to give the banks a break: Gerard Cassidy,
3,2024-01-13 01:10:06.695015,2024-01-13 01:10:00,"Citigroup announces elimination of 20,000 jobs after losses",
4,2024-01-13 01:10:06.695015,2024-01-13 01:10:00,Supernal CEO unveils stunning air taxi,
5,2024-01-13 01:10:06.695015,2024-01-13 01:10:00,Portfolio manager warns 2024 could be a 'challenging' and 'volatile' year,
6,2024-01-13 01:10:06.695015,2024-01-13 01:10:00,'Year of grave concern': Americans' trust in institutions at record lows,
7,2024-01-13 01:10:06.695015,2024-01-13 01:10:00,Market still has not been able to hit the new high: Ben Levisohn,
8,2024-01-13 01:10:06.695015,2024-01-13 01:10:00,"If Houthis respond, we attack them again in Yemen: KT McFarland",
9,2024-01-13 01:10:06.690649,2024-01-06 01:10:00,Investors should always expect the unexpected: David Tawil,
