INDEX,DOWNLOAD_TIME,DATE,TITLE,SUMMARY
0,2024-05-03 21:02:03.054783,2024-05-03 22:53:08,Cramer's Lightning Round: GE Vernova is a buy,"""Mad Money"" host Jim Cramer rings the lightning round bell, which means he's giving his answers to callers' stock questions at rapid speed."
1,2024-05-03 21:02:03.054783,2024-05-03 22:58:37,"Cramer says he likes Cracker Barrel, but investors should wait for more information before buying",CNBC's Jim Cramer on Friday analyzed Cracker Barrel's business over the past few years.
2,2024-05-03 21:02:03.054783,2024-05-03 22:42:05,"Cramer's week ahead: Earnings from Disney, Uber and Warner Bros. Discovery",CNBC's Jim Cramer on Friday guided investors through an earnings-packed week on Wall Street.
3,2024-05-03 21:02:03.050367,2024-05-03 19:29:58,Cramer's Lightning Round: General Motors is a buy,"""Mad Money"" host Jim Cramer rings the lightning round bell, which means he's giving his answers to callers' stock questions at rapid speed."
4,2024-05-03 21:02:03.050367,2024-05-02 23:47:19,"Cramer says he's willing 'to pay up' for Viking, the biggest IPO of the year",CNBC's Jim Cramer on Thursday reviewed the IPO of Viking.
5,2024-05-03 21:02:03.050367,2024-05-02 22:23:28,"Cramer says inflation data is driving market action, even during a major earnings week",CNBC's Jim Cramer bemoaned Wall Street's fixation with the Federal Reserve's next decision about interest rates.
6,2024-05-03 21:02:03.050367,2024-05-01 22:55:06,Cramer's Lighting Round: Dell is a buy,"""Mad Money"" host Jim Cramer rings the lightning round bell, which means he's giving his answers to callers' stock questions at rapid speed."
7,2024-05-03 21:02:03.050367,2024-05-01 23:14:18,Cramer says not to second-guess Fed Chair Powell after Wednesday's remarks,CNBC's Jim Cramer told investors to take Federal Reserve Chair Jerome Powell at his word.
8,2024-05-03 21:02:03.050367,2024-05-02 00:17:52,Tanger CEO explains the upside in replacing tenants and how outlets appeal to luxury brands,Tanger CEO Stephen Yalof told CNBC's Jim Cramer on Wednesday why it can be more valuable to replace tenants rather than renew leases.
9,2024-05-03 21:02:03.050367,2024-05-01 01:06:54,Restaurant Brands' Patrick Doyle says Burger King's varied prices help customers burdened by inflation,Restaurant Brands International's executive chairman Patrick Doyle discussed the state of the consumer with CNBC's Jim Cramer.
10,2024-05-03 21:02:03.050367,2024-04-30 23:52:46,Cramer's Lightning Round: Don't sell Trade Desk,"""Mad Money"" host Jim Cramer rings the lightning round bell, which means he's giving his answers to callers' stock questions at rapid speed."
11,2024-05-03 21:02:03.050367,2024-05-01 00:30:53,Jim Cramer says interest rate worries helped bring on Tuesday's end of April sell-off,"After a generally rough April, CNBC's Jim Cramer parsed Tuesday's market action."
12,2024-05-03 21:02:03.050367,2024-04-30 23:44:03,American Express CEO explains how the company is attracting younger consumers,American Express CEO Steve Squeri told CNBC's Jim Cramer on Tuesday that Millennial and Gen Z customers made up 60% of new card acquisitions.
13,2024-05-03 21:02:03.050367,2024-04-29 23:13:39,Cramer's Lightning Round: Palo Alto Networks is a buy,"""Mad Money"" host Jim Cramer rings the lightning round bell, which means he's giving his answers to callers' stock questions at rapid speed."
14,2024-05-03 21:02:03.050367,2024-04-30 00:32:09,"Cramer's bullish on Alphabet after earnings, would buy on a pullback","CNBC's Jim Cramer told investors he's pleased with Google parent Alphabet's most recent quarter, lauding the company's proof of profitability."
15,2024-05-03 21:02:03.050367,2024-04-30 00:19:15,Cramer says Apple's Monday rally doesn't have 'staying power' after analyst upgrade,CNBC's Jim Cramer told investors he's wary of Apple's Monday rally and they should wait to buy.
16,2024-05-03 21:02:03.050367,2024-04-26 22:55:47,Cramer's Lightning Round: Diamondback Energy is a buy,"""Mad Money"" host Jim Cramer rings the lightning round bell, which means he's giving his answers to callers' stock questions at rapid speed."
17,2024-05-03 21:02:03.050367,2024-04-26 23:21:18,"Cramer's week ahead: Fed meeting and earnings from Apple, Amazon, Eli Lilly",CNBC's Jim Cramer on Friday walked investors through next week on Wall Street.
18,2024-05-03 21:02:03.050367,2024-04-27 00:17:07,CEO says the FICO score provider isn't a monopoly: 'There are alternatives',GOP Missouri Sen. Josh Hawley penned a letter urging the Department of Justice to investigate Fair Isaac's potentially anticompetitive practices.
19,2024-05-03 21:02:03.050367,2024-04-26 00:27:41,Tractor Supply CEO says there's still 'significant migration' out of urban areas,"Tractor Supply CEO Hal Lawton told CNBC's Jim Cramer on Thursday that a substantial number of Americans are leaving cities, and many are headed to rural areas."
20,2024-05-03 21:02:03.050367,2024-04-25 23:05:41,Cramer's Lighting Round: Don't buy NuScale Power,"""Mad Money"" host Jim Cramer rings the lightning round bell, which means he's giving his answers to callers' stock questions at rapid speed."
21,2024-05-03 21:02:03.050367,2024-04-25 23:54:50,Cramer praises companies like Chipotle that can grow despite a slowing economy and inflation,"CNBC's Jim Cramer said companies that perpetually generate ""self-help"" are poised to do well in this market."
22,2024-05-03 21:02:03.050367,2024-04-25 18:36:44,"Cramer's bullish on Apple's Vision Pro, pointing to its potential use in enterprise",CNBC's Jim Cramer on Wednesday told investors he's confident in the success of Apple's Vision Pro and sees uses for the product outside the consumer space.
23,2024-05-03 21:02:03.050367,2024-04-24 22:57:25,Cramer's Lightning Round: Cloudflare is a buy,"""Mad Money"" host Jim Cramer rings the lightning round bell, which means he's giving his answers to callers' stock questions at rapid speed."
24,2024-05-03 21:02:03.050367,2024-04-24 23:37:06,"Cramer says the pull of the bond market is worrying, so keep some cash on hand",CNBC's Jim Cramer told investors to keep some cash on hand.
25,2024-05-03 21:02:03.050367,2024-04-24 00:09:44,"Despite earnings miss, Nucor CEO is confident this year will be a success","In a Tuesday interview with CNBC's Jim Cramer, Nucor CEO Leon Topalian said the steel maker was on the right track despite weaker-than-expected earnings."
26,2024-05-03 21:02:03.050367,2024-04-23 22:54:39,Cramer's Lightning Round: Broadcom is a buy,"""Mad Money"" host Jim Cramer rings the lightning round bell, which means he's giving his answers to callers' stock questions at rapid speed."
27,2024-05-03 21:02:03.050367,2024-04-23 22:58:11,Cramer points to signs the economy is slowing that could bring rate cuts from the Fed,"CNBC's Jim Cramer referred to these factors as ""brown shoots"" that are disrupting U.S. economic growth."
28,2024-05-03 21:02:03.050367,2024-04-23 00:24:37,"Cramer points to positives in Monday's rebound, but warns against lasting gains","Big Tech companies Tesla, Meta Platforms, Microsoft and Alphabet are scheduled to report their earnings this week."
29,2024-05-03 21:02:03.050367,2024-04-20 00:43:29,"Cramer’s week ahead: Earnings from Tesla, Merck and Big Tech",CNBC's Jim Cramer said next week's PCE index report will be the real gauge of inflation.
