INDEX,DOWNLOAD_TIME,DATE,TITLE,SUMMARY
0,2024-07-26 13:25:23.743128,2024-07-26 16:31:49,CNN Heroes Legal Disclosures 2024,"Eligibility:  In order to be eligible for the CNN Heroes Awards Program (the ""Awards Program""), nominees must be at least thirteen (13) years of age or older as of December 11, 2023."
1,2024-07-20 06:22:55.073631,2024-07-20 09:01:11,3 alleged gang members and an associate charged in the fatal shooting of an off-duty LAPD officer,Federal prosecutors charged three gang members and one gang associate Thursday in the fatal shooting of off-duty Los Angeles Police Department officer Fernando Arroyos during an attempted robbery.
2,2024-07-19 10:52:36.013835,2024-07-19 13:48:32,What to do if your flight is canceled or delayed,Here are some expert tips about what travelers should do when flights are delayed or canceled.
3,2024-07-19 10:52:36.009223,2024-07-05 17:57:33,"US job growth slowed in June, latest employment data shows","Live coverage of the June jobs report has now ended. The US economy added 206,000 jobs in June and the unemployment rate rose to 4.1%, according to the Bureau of Labor Statistics."
4,2024-07-19 10:52:36.009223,2024-07-04 13:45:01,Dare to bare: 24 of the world's best nude beaches,"From big-city bays to secluded shores, there are hundreds of beaches where you can legally frolic while naked. If you're so inclined, strip off that bathing suit and enjoy 24 of the best nude beaches around the world."
5,2024-07-19 10:52:36.009223,2024-06-28 12:57:05,Glastonbury Festival fashion history: Remember when Kate Moss wore rain boots?,"With Glastonbury back in full swing, we look back at how Kate Moss broke fashion's proverbial fourth wall when she joined the mortals in their muddy squalor."
6,2024-07-19 10:52:36.009223,2024-06-28 00:45:41,Case dismissed against teenage cousin of Uvalde school shooter for allegedly threatening school shooting,"The case against Nathan James Cruz was dismissed due to a missing witness, according to court records in Bexar County, Texas."
7,2024-07-19 10:52:36.009223,2024-06-20 13:13:16,The planet is getting hotter fast. This is what happens to your body in extreme heat,Human-caused climate change has already made heat waves around the world more frequent and intense.
8,2024-07-19 10:52:36.009223,2024-06-19 13:14:44,The Juneteenth flag is full of symbols. Here's what they mean,"Designing the Juneteenth flag was a deliberate process, says creator Ben Haith, who breaks down what each element of the flag represents."
9,2024-07-19 10:52:36.009223,2024-06-19 11:47:42,June 18 2024: US heat wave news,A dangerous heat wave is scorching parts of the Midwest and Northeast. Record-breaking high temperatures are forecast across dozens of cities where cooling centers have been opened to protect the vulnerable.
10,2024-07-19 10:52:36.009223,2024-06-19 00:25:07,'I know it happens': Boeing chief admits the company has retaliated against whistleblowers,The outgoing chief of the embattled airplane maker is testifying in the wake of a whistleblower's allegations of safety issues.
11,2024-07-19 10:52:36.009223,2024-06-18 01:42:44,"June 17, 2024 - Israel-Gaza news","Israeli Prime Minister Benjamin Netanyahu has disbanded the country's war cabinet, an Israeli official says, just over a week after opposition leader Benny Gantz withdrew from the body."
12,2024-07-19 10:52:36.009223,2024-06-14 12:48:09,Confessions of a 1980s flight attendant,"Ann Hood, a best-selling author, has recounted her adventures working as cabin crew on TWA flights in the 1980s in a book detailing the highs and lows of life during the early jet age."
13,2024-07-19 10:52:36.009223,2024-06-14 03:30:12,"June 13, 2024 Israel-Hamas war","The US-backed Gaza ceasefire proposal doesn't meet Hamas' demands for an end to the war, a senior official has told CNN. Osama Hamdan also said that ""no one has an idea"" how many of the hostages held in the enclave are alive."
14,2024-07-19 10:52:36.009223,2024-06-14 01:47:04,Biden and Zelensky lay out new US support for Ukraine,US President Joe Biden and Ukrainian President Volodymyr Zelensky signed a new security agreement Thursday as world leaders gathered for the G7 summit in Italy.
15,2024-07-19 10:52:36.009223,2024-06-13 21:20:54,Supreme Court maintains access to abortion pill in unanimous decision,The Supreme Court has issued a decision on whether the US Food and Drug Administration overstepped its authority by expanding access to the abortion pill mifepristone.
16,2024-07-19 10:52:36.009223,2024-06-13 20:09:29,Trump in Washington for meetings with Republican allies,Former President Donald Trump is back in Washington for the first time since becoming the presumptive Republican nominee as well as a convicted felon. Follow here for the latest live news updates.
17,2024-07-19 10:52:36.009223,2024-06-13 18:00:32,"What a medication abortion is like, according to a doctor","An expert in medication abortion describes how mifepristone and misoprostol work and what to expect after using these medications known as the ""abortion pill."""
18,2024-07-19 10:52:36.009223,2024-06-13 04:00:17,"June 12, 2024 Israel-Hamas war","Israel launched strikes on Al-Mawasi in southern Gaza early Thursday, bombarding an area it had previously designated as a ""safe zone"" by land, sea and air, according to the official Palestinian news agency WAFA."
19,2024-07-19 10:52:36.009223,2024-06-12 23:10:47,House GOP votes to hold Attorney General Garland in contempt,The House voted Wednesday to hold Attorney General Merrick Garland in contempt for refusing to turn over audio from President Joe Biden's interview with special counsel Robert Hur.
20,2024-07-19 10:52:36.009223,2024-06-12 20:24:33,The Fed expects to cut rates just once this year,The Federal Reserve said Wednesday it expects to cut its benchmark interest rate just once this year as inflation remains stubbornly high.
21,2024-07-19 10:52:36.009223,2024-06-11 22:41:57,Hunter Biden found guilty on all counts in gun case,A federal jury found Hunter Biden guilty Tuesday on all three federal felony gun charges he faced.
22,2024-07-19 10:52:36.009223,2024-06-11 16:12:23,As Equals: Frequently Asked Questions,"Find out more about As Equals, CNN's gender inequality series, and how you can get in touch with the team."
23,2024-07-19 10:52:36.009223,2024-06-11 05:09:45,"June 10, 2024 Israel-Hamas war",The UN Security Council adopted a resolution proposed by the United States for a permanent ceasefire and release of the hostages in Gaza.
24,2024-07-19 10:52:36.009223,2024-06-11 00:52:14,Apple introduces AI to its products at WWDC,"Apple introduced ""Apple Intelligence"" -- a suite of artificial intelligence tools -- to its products at its annual Worldwide Developers Conference (WWDC) on Monday, while announcing a host of Apple product updates."
25,2024-07-19 10:52:36.009223,2024-06-11 00:37:07,Jury begins deliberations in Hunter Biden's federal gun trial,Jury deliberations began Monday and will resume tomorrow in Hunter Biden's federal gun trial in Delaware.
26,2024-07-19 10:52:36.009223,2024-06-10 08:54:20,"June 10, 2024 - Israel-Hamas war",Israeli Prime Minister Benjamin Netanyahu has called on Benny Gantz to change his mind after the key war carbinet member resigned from government over the handling of the war in Gaza.
27,2024-07-19 10:52:36.009223,2024-06-10 03:02:35,News on the European election results 2024,"Results will soon start rolling in after the European elections, one of the world's largest democratic exercises. Follow for live updates."
28,2024-07-19 10:52:36.009223,2024-06-10 00:50:38,"June 9, 2024 Israel-Hamas war","Key Israeli war cabinet member Benny Gantz quit Prime Minister Benjamin Netanyahu's government Sunday. Meanwhile, the death toll from Israel's hostage rescue in central Gaza keeps rising. Follow for live updates."
29,2024-07-19 10:52:36.009223,2024-06-09 15:08:18,"June 8, 2024 - Israel-Gaza news","The Israeli military says it rescued four hostages from central Gaza on Saturday. Palestinians report scenes of horror on the ground, and Gaza hospital officials say more than 200 people were killed."
