INDEX,DOWNLOAD_TIME,DATE,TITLE,SUMMARY
0,2022-10-24 09:41:47.950792,2022-10-24 09:41:00,Rishi Sunak will be the next prime minister after his lone remaining rival dropped out of the fast-tracked race to become Conservative party leader,
1,2022-10-24 09:41:47.950792,2022-10-24 09:41:00,Sunak will become the first person of color to lead the UK,
2,2022-10-24 09:41:47.950792,2022-10-24 08:36:55,Timeline: The UK is set for its third PM in three months. See how they got here,There seems to be no end in sight of the political turmoil that Britain has endured since the country voted to leave the European Union back in 2016. CNN's Anna Stewart reports.
3,2022-10-24 09:41:47.950792,2022-10-24 02:35:14,Boris Johnson drops out of race to become UK prime minister,UK former Prime Minister Boris Johnson has pulled out of the contest to become the next Conservative Party leader and therefore the next prime minister.
4,2022-10-24 09:41:47.950792,2022-10-24 13:16:24,Opinion: Why Britain just got (another) prime minister it didn't vote for,"Britain's Conservative Party, which has weathered the resignation of two prime ministers since December 2019, cannot remain in government for another two years without calling a general election."
5,2022-10-24 09:41:47.950792,2022-10-21 01:41:19,Jake Tapper on the lessons from UK's recent political turmoil,CNN's Jake Tapper weighs in on the political turmoil unfolding in the UK and Liz Truss' brief tenure as prime minister.
6,2022-10-24 09:41:47.950792,2022-10-21 12:42:28,"Analysis: Fallout from Truss collapse rattles US democracy, too","Americans and Britons once smugly viewed political uprisings, governing meltdowns and self-defeating errors as the eruptions of unstable countries and immature political systems."
7,2022-10-24 09:41:47.950792,2022-10-24 09:41:00,Kherson resident confirms Russia is withdrawing administrative services from the city,• Freed Ukrainian women recount torture and other brutal treatment in Russian prisons
8,2022-10-24 09:41:47.950792,2022-10-24 12:48:55,Video: NASA launches study on 'unidentified aerial phenomena',"NASA is launching a study on unidentified aerial phenomena, commonly known as UFOs. The group of 16 people will gather data on unidentifiable events in the sky and release its findings to the public in mid-2023."
9,2022-10-24 09:41:47.950792,2022-10-24 13:04:16,New evidence of Covid-19's devastating impact on US children's education,"Fourth- and eighth-graders fell behind in reading and had the largest ever decline in math, according to a national educational assessment that shows the devastating impact of Covid-19 on America's children."
10,2022-10-24 09:41:47.950792,2022-10-24 13:08:35,Teen pleads guilty in Michigan high school shooting that killed 4 students,A teen accused of killing four students and wounding seven others at a Michigan high school last year pleaded guilty Monday to murder charges.
11,2022-10-24 09:41:47.950792,2022-10-24 12:55:01,Watch bear attack mountain climber on edge of a cliff,A bear attacked a mountain climber on the side of a cliff and the harrowing exchange was caught on camera.  HLN's Robin Meade has the details.
12,2022-10-24 09:41:47.950792,2022-10-24 04:02:26,"Analysis: Trump set to collide with Biden, the courts and facts","Former President Donald Trump and his movement are posing new challenges to accountability, free elections and the rule of law, ushering in a fresh period of political turmoil."
13,2022-10-24 09:41:47.950792,2022-10-24 04:30:25,RSV infections are running rampant in US,"In September, an 8-month-old baby came into Dr. Juanita Mora's office in Chicago with an infection the doctor hadn't expected to see for another two months: RSV."
14,2022-10-24 09:41:47.950792,2022-10-24 12:23:01,Father of infant hospitalized with RSV warns parents to be alert as respiratory illness spreads quickly,"Last week, Stephen Balka found himself living a parent's nightmare. His 2-month-old son Adrian was struggling to breathe, sometimes going as long as seven seconds between gasping breaths, the father said."
15,2022-10-24 09:41:47.950792,2022-10-24 06:59:47,Police release video in search of NYC man seen pushing subway commuter on the tracks,
16,2022-10-24 09:41:47.950792,2022-10-24 11:40:37,There is a rosy projection for the US economy,The housing market is rapidly losing steam. Interest rates continue to rise. The stock market remains volatile. And inflation continues to be a major problem for people trying to pay their bills.
17,2022-10-24 09:41:47.950792,2022-10-24 09:41:00,20 last-minute Halloween costumes to snag from Amazon ASAP,
18,2022-10-24 09:41:47.950792,2022-10-24 09:41:00,49 gifts every woman in your life would love to receive,
19,2022-10-24 09:41:47.950792,2022-10-24 09:41:00,34 of the most unique gifts to give this holiday season,
20,2022-10-24 09:41:47.950792,2022-10-21 11:47:54,Why there may be no turning back from Trumpism,"Republicans are feeling much better about the midterms. After a summer when it seemed as if the Democrats might defy the historic trend of the president's party doing poorly in these elections, the polls are looking up for the GOP."
21,2022-10-24 09:41:47.950792,2022-10-24 09:41:00,What if we got rid of all mosquitoes?,
22,2022-10-24 09:41:47.945159,2022-10-24 07:57:37,Los Angeles officials condemn display of support for Kanye West's antisemitic remarks,• Kanye West dropped by Balenciaga
23,2022-10-24 09:41:47.945159,2022-10-23 20:07:14,Authorities find Michigan family of 4 that had been missing for nearly a week,"A family of four that ""unexpectedly left their home"" in Fremont, Michigan and went missing for nearly a week were located by authorities on Sunday."
24,2022-10-24 09:41:47.945159,2022-10-23 17:59:24,Tennessee skydiver dies after landing on field prior to high school football game,"A skydiver has died after he landed on a football field prior to the start of a high school game in what Tennessee officials called a ""tragic incident,"" the Washington County Department of Education said in a statement."
25,2022-10-24 09:41:47.945159,2022-10-24 10:33:43,Matthew Perry recounts how Jennifer Aniston confronted him about his substance abuse,"Matthew Perry is continuing to share candid moments from his long journey to sobriety and the struggles he endured during his run on NBC's ""Friends"" while yoyo-ing between addictions to Vicodin and alcohol."
26,2022-10-24 09:41:47.945159,2022-06-29 02:07:30,See electric boat 'fly' above the water,Swedish startup Candela is making waves in the boating industry -- by making almost no waves at all.
27,2022-10-24 09:41:47.945159,2022-10-24 09:30:10,'Doctor Who' fans delighted as the Doctor regenerates as ... David Tennant,"""Doctor Who"" fans were drenched in nostalgia after David Tennant reprised his role as the Time Lord in the dramatic conclusion to the show's BBC centenary special."
28,2022-10-24 09:41:47.945159,2022-10-24 08:53:19,"Stop trying to fix yourself, this expert says","Straight away, Nora McInerny noticed core differences in how people responded to the coronavirus pandemic."
29,2022-10-24 09:41:47.945159,2022-10-24 11:32:52,Tom Brady's presumed final season continues to turn sour after humiliating 21-3 loss to Panthers,It wasn't meant to go like this.
30,2022-10-24 09:41:47.945159,2022-10-22 15:06:11,Family buys $1.3 million home and then starts getting creepy letters,"CNN's Michael Smerconish speaks with New York Magazine writer Reeves Wiedeman about the true story that inspired the Netflix series ""The Watcher."""
31,2022-10-24 09:41:47.945159,2022-10-23 14:20:20,'Truly deranged': Jake Tapper plays ad for GOP candidate who could win,"CNN's Jake Tapper plays an ad from Jim Marchant, the Republican Secretary of State candidate in Nevada, and discusses how election lies have become mainstream in the party."
32,2022-10-24 09:41:47.945159,2022-10-22 11:45:50,Teens go door-to-door saying they escaped abuse at their mother's home,Twin 15-year-olds escaped from their mother's house in Texas after they say they were abused for months and left handcuffed in a laundry room.
33,2022-10-24 09:41:47.945159,2022-10-23 22:35:35,Tim Burton says he probably won't work for Disney again,"Tim Burton is sounding off on his previous working relationship with Disney, saying he is unlikely to return to the company as a director in the future."
34,2022-10-24 09:41:47.945159,2022-10-24 09:51:01,Woman who travels the world with only a tiny bag,It's been a year of airport chaos and problems with baggage handling have left many travelers struggling to reunite with their luggage.
35,2022-10-24 09:41:47.945159,2022-10-23 19:50:10,"This thriller doesn't hit theaters until January, but it's already making waves",The lifelike but blank stare. The almost-but-not-quite accurate proportions. The vacant smile.
36,2022-10-24 09:41:47.945159,2022-10-24 01:41:16,'Ellen' star Sophia Grace is expecting her first child,"If you don't feel old yet, just wait: Sophia Grace, the adorable dancing toddler from ""Ellen,"" is going to be a mom."
37,2022-10-24 09:41:47.945159,2022-10-24 06:56:18,Phillies and Astros advance to the World Series,• Billionaire dumps Australia netball team in dispute over father's racist comments
38,2022-10-24 09:41:47.945159,2022-10-24 10:15:03,Simona Halep's former coach says 'no chance' the athlete knowingly took banned substance,Simona Halep's former coach has jumped to her defense after the former world No. 1 tested positive for a banned substance at the US Open earlier this year.
39,2022-10-24 09:41:47.945159,2022-10-24 11:27:58,LeBron James' missed buzzer-beater costs Lakers in loss to Trail Blazers as 'Dame Dolla' shines,"LeBron James missed a buzzer-beater to tie the game as the Los Angeles Lakers lost 106-104 to the Portland Trail Blazers, taking the LA team's season record to 0-3."
40,2022-10-24 09:41:47.945159,2022-10-24 09:41:00,Podcast: Anderson Cooper explores the unexpected feelings that come after experiencing a loss,
41,2022-10-24 09:41:47.945159,2022-10-24 09:59:36,Harvey Weinstein goes on trial in Los Angeles on charges of rape and sexual assault,"Two years after his conviction on rape and sexual assault charges, disgraced movie producer Harvey Weinstein is again set to go on trial on similar charges in Los Angeles."
42,2022-10-24 09:41:47.945159,2022-10-23 15:06:17,Alex Jones seeks new trial after Sandy Hook verdict of almost $1 billion,Far-right talk show host Alex Jones is seeking a new trial after a Connecticut jury decided this month he should pay $965 million in compensatory damages to eight families of Sandy Hook Elementary School shooting victims and one first responder.
43,2022-10-24 09:41:47.945159,2022-10-23 10:04:25,Diwali is having a mainstream moment in US,Diwali seems to be everywhere this year.
44,2022-10-24 09:41:47.945159,2022-10-22 15:54:15,"If a bear moves toward you, do you run or stay?","You're out for a hike on a glorious fall day. Suddenly, you spot a bear. And the bear has spotted you, too. Would you know what to do next?"
45,2022-10-24 09:41:47.945159,2022-10-20 17:19:11,The color of this blue cheese shocks Tucci,"In Puglia, Stanley Tucci visits a cheese bar that's serving 100-day-old blue cheese. All-new episodes of ""Stanley Tucci: Searching for Italy"" air Sundays at 9 p.m. ET on CNN."
46,2022-10-24 09:41:47.945159,2022-10-22 19:56:12,Terrifying photo shows ant close up,"No, this photo doesn't portray one of the new creatures on HBO's ""House of the Dragon,"" or an outtake from a horror movie. It's an award-winning close-up photo of ... an ant."
47,2022-10-24 09:41:47.945159,2022-10-24 11:33:34,Tesla's stock sinks after cutting prices on cars in China,"Tesla has cut starting prices for its Model 3 and Model Y cars by as much as 9% in China, reversing a trend of increases across the industry amid signs of softening demand in the world's largest auto market."
48,2022-10-24 09:41:47.945159,2022-10-23 19:57:23,Food waste is a huge climate problem. A new candy has a fix,The end of October is a sugar avalanche as kids don their Halloween costumes and snag as many sticky sweets as they can. But the prospect of collecting and eating a whole trick-or-treat bag of candy gets a little scary when you think about the impact.
49,2022-10-24 09:41:47.945159,2022-10-23 18:25:43,Tupperware wants to get out of the Mad Men-era,Tupperware wants to be where the cool kids play.
50,2022-10-24 09:41:47.945159,2022-10-24 09:41:00,"Shop Target's early Black Friday sale for deals on tech, kitchenware, gifts and more",
51,2022-10-24 09:41:47.945159,2022-10-24 09:41:00,Nordstrom's 2022 holiday guide is live: Here are 42 items you should buy,
52,2022-10-24 09:41:47.945159,2022-10-24 09:41:00,Allbirds' latest Mizzle shoes are made for nasty winter weather,
53,2022-10-24 09:41:47.945159,2022-10-24 09:41:00,"Our favorite product releases this week: Stanley, Hill House Home, Glossier and more",
54,2022-10-24 09:41:47.945159,2022-10-24 09:41:00,Here's how to get up to 50% off at Amazon when using your American Express card,
55,2022-10-24 09:41:47.945159,2022-10-24 09:41:00,57 of the best holiday and Christmas gift ideas to give (or get) this year,
56,2022-10-24 09:41:47.945159,2022-10-24 09:41:00,30 of our favorite Advent calendars to shop now before they sell out,
57,2022-10-24 09:41:47.945159,2022-10-24 09:41:00,We tested 10 electric toothbrushes to find the ones worth your money,
58,2022-10-24 09:41:47.945159,2022-10-24 09:41:00,The credit card we use to judge all other cards currently has its best sign-up bonus ever,
59,2022-10-24 09:41:47.945159,2022-10-23 20:29:38,An astonishing fall from grace,"In 1970, a protester in London, angered by the cancellation of a cricket tour, threw an egg at UK Prime Minister Harold Wilson, the leader of the Labour Party. His Conservative Party rival, Edward Heath responded, ""This was a secret meeting on a secret tour which nobody is supposed to know about. It means that there are men, and perhaps women, in this country walking around with eggs in their pockets, just on the off-chance of seeing the Prime Minister."""
60,2022-10-24 09:41:47.945159,2022-10-24 09:02:24,Part of me wished Iran's prison would burn down,"""Evin's on fire! It's going up in flames, and they're shooting at the prisoners inside!"" This was one of the flurry of messages I received late October 15 from Iranian activists and fellow survivors of the country's most notorious prison."
61,2022-10-24 09:41:47.945159,2022-10-22 15:19:55,Florida told them they could vote. DeSantis had them arrested,"The arresting police officers sounded almost apologetic as they detained the suspect in front of his home in Tampa, Florida."
62,2022-10-24 09:41:47.945159,2022-10-22 13:20:07,What is Half-Earth Day?,"When I first learned that October 22 marks Half-Earth Day, I thought it was because the date is six months to Earth Day. (True.) But it's got a message all its own."
63,2022-10-24 09:41:47.945159,2022-10-21 11:46:20,Why I'm rethinking Boy Scouts for my son,"An 11-year-old Boy Scout, Manuel 'Manny' Carvalho, was killed by a gunshot on August 28, at Camp Honokaia -- where my son's troop used to meet every week. A police investigation determined that during an official Boy Scouts of America (BSA) event at a scout camp rifle range, the boy was accidentally killed after he was shot by another unsupervised boy who was handling his parent's loaded semi-automatic assault rifle. No charges have yet been filed related to the incident, though potential offenses against three adults are being reviewed by prosecutors."
64,2022-10-24 09:41:47.945159,2022-10-17 10:14:07,My life with long Covid is unrecognizable,"In June 2020, I lay on my bed, willing myself not to cry again."
65,2022-10-24 09:41:47.945159,2022-10-24 09:41:00,How to safely make black-colored food for Halloween,
66,2022-10-24 09:41:47.945159,2022-10-24 09:41:00,17 Halloween dinners to make before a night of trick-or-treating,
67,2022-10-24 09:41:47.945159,2022-10-24 09:41:00,A comprehensive guide to baking at high altitudes,
68,2022-10-24 09:41:47.945159,2022-10-24 09:41:00,Apple hand pies always bring me back to childhood,
