INDEX,DOWNLOAD_TIME,DATE,TITLE,SUMMARY
0,2023-10-28 03:40:04.348062,2023-10-27 23:35:52,"Jim Cramer remembers Byron Wien: 'He was an optimist, always on the lookout for new ideas'",CNBC's Jim Cramer on Friday reminisced about notable investor and mentor Byron Wien.
1,2023-10-28 03:40:04.348062,2023-10-27 23:14:33,Cramer's Lightning Round: 'Pass' on General Motors,"""Mad Money"" host Jim Cramer rings the lightning round bell, which means he's giving his answers to callers' stock questions at rapid speed."
2,2023-10-28 03:40:04.348062,2023-10-27 23:08:38,"Cramer's week ahead: Federal Reserve meeting, Apple and Eli Lilly earnings","CNBC's Jim Cramer said he'll be watching for several notable earnings reports next week, including Apple, Caterpillar and drug maker Eli Lilly."
3,2023-10-28 03:40:04.343617,2023-10-26 22:57:23,Cramer's Lighting Round: 'Stay away' from HF Sinclair,"""Mad Money"" host Jim Cramer rings the lightning round bell, which means he's giving his answers to callers' stock questions at rapid speed."
4,2023-10-28 03:40:04.343617,2023-10-26 23:44:36,"Hertz CEO says company will continue to add electric vehicles to its fleet, despite issues",Hertz CEO Stephen Scherr told CNBC's Jim Cramer that his company will continue buying electric vehicles despite problems with the cars over the last quarter.
5,2023-10-28 03:40:04.343617,2023-10-26 23:54:15,Jim Cramer names six stocks worth looking to buy if there's a major sell-off,"Among the names CNBC's Jim Cramer likes are Procter & Gamble, General Electric and WM."
6,2023-10-28 03:40:04.343617,2023-10-25 23:49:43,Cramer's Lightning Round: Rivian is 'losing so much money',"""Mad Money"" host Jim Cramer rings the lightning round bell, which means he's giving his answers to callers' stock questions at rapid speed."
7,2023-10-28 03:40:04.343617,2023-10-25 23:33:14,Mattel CEO says opportunity lies beyond the toy aisle: 'We are here to build film franchises',"In an interview with CNBC's Jim Cramer, Mattel CEO Ynon Kreiz said his company has big plans to capitalize on its brands and intellectual property."
8,2023-10-28 03:40:04.343617,2023-10-25 22:44:12,Jim Cramer's five factors that could improve market conditions and help interest rates peak,"""All of these things will eventually create an investible moment,"" Cramer said. ""Until then, though, even the moves of the best stocks are just a trade."""
9,2023-10-28 03:40:04.343617,2023-10-25 00:42:39,Jim Cramer tells investors to hold out on buying until after interest rates rise,CNBC's Jim Cramer said Tuesday investors may be wise to hold off on buying until after the next interest rate hike.
10,2023-10-28 03:40:04.343617,2023-10-24 23:43:41,Cramer's Lightning Round: AT&T is 'not my favorite',"""Mad Money"" host Jim Cramer rings the lightning round bell, which means he's giving his answers to callers' stock questions at rapid speed."
11,2023-10-28 03:40:04.343617,2023-10-24 23:06:49,Cramer says to invest in defense companies as the U.S. looks to rebuild weapons stockpile,CNBC's Jim Cramer on Tuesday recommended defense stocks as the U.S. empties its arsenals to aid allies Israel and Ukraine.
12,2023-10-28 03:40:04.343617,2023-10-23 23:16:37,Cramer's Lightning Round: Sell Fisker,"""Mad Money"" host Jim Cramer rings the lightning round bell, which means he's giving his answers to callers' stock questions at rapid speed."
13,2023-10-28 03:40:04.343617,2023-10-23 23:31:20,Jim Cramer says there is a bull market in oil and gas thanks to recent big mergers,CNBC's Jim Cramer said oil stocks are increasing in value thanks to two major oil company mergers as well as the rising price of crude.
14,2023-10-28 03:40:04.343617,2023-10-23 22:51:45,Jim Cramer urges patience before buying stocks this week. Here's why,CNBC's Jim Cramer said investors shouldn't read too much into Monday's stock moves.
15,2023-10-28 03:40:04.343617,2023-08-31 23:00:42,Jim Cramer’s guide to investing: Don’t assume market action always makes sense,CNBC's Jim Cramer told investors market action doesn't always make sense.
16,2023-10-28 03:40:04.343617,2023-08-31 23:00:25,Jim Cramer’s guide to investing: Tune in to CEOs,CNBC's Jim Cramer told investors they should pay attention to and scrutinize what CEOs say about their companies.
17,2023-10-28 03:40:04.343617,2023-08-31 22:44:10,Jim Cramer’s guide to investing: Don’t get hung up on what could have been,CNBC's Jim Cramer told investors not to obsess over their mistakes.
18,2023-10-28 03:40:04.343617,2023-08-31 22:43:37,Jim Cramer’s guide to investing: Be flexible,CNBC's Jim Cramer reminded investors they must be flexible when owning individual stocks in a market that's inherently changeable.
19,2023-10-28 03:40:04.343617,2023-08-31 22:43:19,Jim Cramer’s guide to investing: Use good judgment and know your objectives,CNBC's Jim Cramer stressed the importance of using proper judgment when investing in individual stocks.
20,2023-10-28 03:40:04.343617,2023-06-28 22:20:13,"Cramer's guide to investing: Never subsidize losers, sell them",CNBC's Jim Cramer is teaching investors how to handle their losing stocks.
21,2023-10-28 03:40:04.343617,2023-10-19 22:35:33,Jim Cramer's guide to investing: Make sure you can explain your portfolio to an actual person,"CNBC's Jim Cramer said that to build a successful portfolio, it is imperative investors can understand and explain all their stock picks."
22,2023-10-28 03:40:04.343617,2023-07-03 17:05:10,"Jim Cramer's guide to investing: Prepare for corrections, they are inevitable","CNBC's Jim Cramer said investors always need to be prepared for corrections, because like they rain, they are unavoidable."
23,2023-10-28 03:40:04.343617,2023-07-03 16:30:12,Jim Cramer's guide to investing: Don't forget about bonds,"When investing in the stock market, you should always keep your eye on the bond market, CNBC's Jim Cramer said."
24,2023-10-28 03:40:04.343617,2023-10-19 22:32:43,Jim Cramer's guide to investing: Quality is key and patience is a virtue,"CNBC's Jim Cramer is sharing his essential investing tips. On Tuesday, he stressed the importance of patience and quality when it comes to choosing stocks."
25,2023-10-28 03:40:04.343617,2023-06-26 23:17:48,Jim Cramer's guide to investing: Don't be greedy,CNBC's Jim Cramer is sharing his basic tips for investing. One of his first and most essential rules is to not be greedy.
26,2023-10-28 03:40:04.343617,2023-06-29 21:37:38,Jim Cramer's guide to investing: Never buy all at once,CNBC's Jim Cramer has bought and sold tons of shares of stock over the years and said investors should never buy all at once.
27,2023-10-28 03:40:04.343617,2023-06-29 21:41:00,Jim Cramer's guide to investing: Do the homework,CNBC's Jim Cramer is telling investors they must do their homework if they want to have a successful stock portfolio.
28,2023-10-28 03:40:04.343617,2023-06-29 22:20:39,Jim Cramer's guide to investing: Panic is not a strategy,CNBC's Jim Cramer wants investors to know that panicking is not a strategy on the stock market.
29,2023-10-28 03:40:04.343617,2023-06-30 21:28:37,Jim Cramer's guide to investing: Don't own too many stocks,CNBC's Jim Cramer told investors to make sure they don't own too many stocks for their portfolio.
