INDEX,DOWNLOAD_TIME,DATE,TITLE,SUMMARY
0,2022-04-22 23:15:40.916811,2022-04-22 23:57:40,Jim Cramer: Buy Excelerate Energy now for a bargain,"""I think Excelerate Energy's a great way to play it, especially now that the stock has pulled back from its highs,"" the ""Mad Money"" host said Friday."
1,2022-04-22 23:15:40.916811,2022-04-22 23:52:59,Cramer's lightning round: I'm sticking with Bausch Health,"""Mad Money"" host Jim Cramer rings the lightning round bell, which means he's giving his answers to callers' stock questions at rapid speed."
2,2022-04-22 23:15:40.916811,2022-04-23 00:04:01,"Buy ’gift horse’ Danaher while it’s down, but leave room for other stocks, Cramer says","""Danaher is a gift horse down here. Don't look it in the mouth, just take it,"" the ""Mad Money"" host said Friday."
3,2022-04-22 23:15:40.916811,2022-04-22 22:57:43,"Cramer's week ahead: Tech giants report earnings, be ready to act on market bounces","""You can put a little money to work on days like today … but only if you have the money to begin with,"" the ""Mad Money"" host said Friday."
4,2022-04-22 23:15:40.916811,2022-04-22 21:43:40,"Covid was the third leading cause of death in the U.S. last year, with only heart disease and cancer killing more","Covid killed more than 415,000 people in 2021 and contributed to the deaths of another 45,000 people, according to the CDC."
5,2022-04-22 23:15:40.916811,2022-04-22 22:27:44,Florida Gov. DeSantis signs bill revoking Disney's special district status,Sunsetting the Reedy Creek Improvement District means that local counties will likely be left to foot the bill for potholes and emergency services at Disney World.
6,2022-04-22 23:15:40.916811,2022-04-22 21:30:11,Bed Bath & Beyond stock jumps on report company received bids for BuyBuy Baby unit,Bed Bath recently agreed to explore whether it should sell or spin off the baby apparel and gear retailer as part of a settlement with an activist investor.
7,2022-04-22 23:15:40.916811,2022-04-22 17:02:39,"Stocks making the biggest moves midday: HCA Healthcare, Kimberly-Clark, Gap and more",These are the stocks posting the largest moves in midday trading.
8,2022-04-22 23:15:40.916811,2022-04-22 16:26:04,Why the U.S. is going after yachts and mansions of Russian billionaire oligarchs,
9,2022-04-22 23:15:40.916811,2022-04-22 18:03:15,"Carlos Ghosn says he would face fair trial in France, suggests timing of arrest warrant 'suspicious'","Carlos Ghosn has said he expects to receive a ""fair trial"" in France after being issued an arrest warrant."
10,2022-04-22 23:15:40.916811,2022-04-22 17:33:13,"74% of people do not think they will ever achieve high net worth status, survey finds","Achieving high net worth status seems out of reach to many people, a survey finds. Calculating your bottom line can be the first step to becoming wealthier."
11,2022-04-22 23:15:40.916811,2022-04-22 14:50:22,Here’s what to do if you missed the April 18 tax filing deadline,"If you missed the April 18 tax deadline, you may cut back on penalties by filing your return promptly. Here's everything late filers need to know."
12,2022-04-22 23:15:40.916811,2022-04-22 16:23:13,Major retailers boost Black female entrepreneurship as employment gap lingers,"Ulta, Sephora and Target have created entrepreneurial diversity programs, providing mentorship, financial support and new business opportunities."
13,2022-04-22 23:15:40.916811,2022-04-22 13:33:40,It’s the French election this weekend — here’s what Wall Street expects to happen,"The outcome is far from certain, according to Wall Street, which is predicting potential market shocks in the case of a Le Pen victory."
14,2022-04-22 23:15:40.916811,2022-04-22 16:01:53,American Eagle is pitching a 'frenemy network' of vertical logistics to its retail peers — and it's paying off,"In the past year, American Eagle has acquired two supply chain businesses in order to build out a logistics platform."
15,2022-04-22 23:15:40.916811,2022-04-22 12:24:47,5 things to know before the stock market opens Friday,"U.S. stock futures were mixed Friday, one day after hawkish comments from Fed Chairman Jerome Powell hit markets."
16,2022-04-22 23:15:40.916811,2022-04-22 12:03:11,"Stocks making the biggest moves premarket: American Express, Verizon, Kimberly-Clark and more",These are the stocks posting the largest moves before the bell.
17,2022-04-22 23:15:40.916811,2022-04-23 01:56:03,"Singapore further eases Covid measures, removes tests for fully vaccinated travelers","Singapore is set to remove nearly all Covid safety measures from April 26, authorities announced on Friday."
18,2022-04-22 23:15:40.916811,2022-04-22 20:01:27,Gap stock slides 18% after cutting sales guidance; CEO of Old Navy division to leave,"A snarled supply chain has been particularly hard on its Old Navy division, which targets a lower-income consumer."
19,2022-04-22 23:15:40.911870,2022-04-22 01:43:31,Taiwan's 'biggest offshore wind farm' generates its first power,It's hoped that construction of the project will wrap up this year.
20,2022-04-22 23:15:40.911870,2022-04-22 00:02:07,Cramer's lightning round: Don't sell Marvell Technology,"""Mad Money"" host Jim Cramer rings the lightning round bell, which means he's giving his answers to callers' stock questions at rapid speed."
21,2022-04-22 23:15:40.911870,2022-04-22 04:36:32,Why would an Oscar-winning actor create a travel app? Kevin Costner shares his story,HearHere — a road trip app co-founded by Kevin Costner — notifies travelers when they're approaching a place with a great historical backstory.
22,2022-04-22 23:15:40.911870,2022-04-22 00:05:53,Jim Cramer says investors should avoid Carvana after the company’s disappointing quarter,"""I expect Carvana, they couldn't do anything for you, lately or otherwise,"" the ""Mad Money"" host said."
23,2022-04-22 23:15:40.911870,2022-04-21 22:31:45,"Be ready to snatch up these 8 software stocks when they bottom, Jim Cramer says","""Eventually, even these heinous stocks, formerly high-flying tech stocks, will get so cheap that they're going to find a bottom,"" the ""Mad Money"" host said."
24,2022-04-22 23:15:40.911870,2022-04-21 22:29:18,"These 12 manufacturers can help investors capitalize on the U.S. 'industrial renaissance,' Cramer says","""The United States has been reclaiming its industrial preeminence in sector after sector after sector,"" the ""Mad Money"" host said."
25,2022-04-22 23:15:40.911870,2022-04-21 23:05:46,SpaceX signs first Starlink inflight Wi-Fi deal with charter carrier JSX,SpaceX signed its first deal to add Starlink satellite internet to an air carrier's fleet of planes with semi-private charter company JSX
26,2022-04-22 23:15:40.911870,2022-04-22 00:14:00,Florida taxpayers could face a $1 billion Disney debt bomb if its special district status is revoked,"The Florida legislature on Thursday cleared a bill that would dissolve Disney's special improvement district, effective June 2023."
27,2022-04-22 23:15:40.911870,2022-04-21 18:36:20,Goldman's checking account for the masses nears as bank tests product with U.S. employees,Goldman's play to manage Americans' primary transaction hub is one of the significant steps it has taken to compete directly with giants such as Wells Fargo.
28,2022-04-22 23:15:40.911870,2022-04-22 00:16:22,"Florida Republicans vote to dissolve Disney's special district, eliminating privileges and setting up a legal battle",Dissolving the district would mean Reedy Creek employees and infrastructure would be absorbed by the local counties.
29,2022-04-22 23:15:40.911870,2022-04-21 20:06:53,"Stocks making the biggest moves midday: United Airlines, AT&T, Tesla and more",These are the stocks posting the largest moves in midday trading.
