INDEX,DOWNLOAD_TIME,DATE,TITLE,SUMMARY
0,2023-03-02 12:08:39.855528,2023-03-02 03:00:00,"Williamson accused teachers of looking for an 'excuse' not to work during pandemic, Hancock's leaked messages suggest",
1,2023-03-02 12:08:39.855528,2023-03-02 03:00:00,Government 'considered ordering death of all pet cats in UK' at start of COVID; journalist says Hancock sent 'menacing' message | Politics latest,
2,2023-03-02 12:08:39.855528,2023-03-02 03:00:00,Body of baby found in woodland; post-mortem to be carried out | Latest updates,
3,2023-03-02 12:08:39.855528,2023-03-02 03:00:00,Jeremy Clarkson not cancelled as host of Who Wants To Be A Millionaire? - ITV,
4,2023-03-02 12:08:39.855528,2023-03-02 03:00:00,The trial that is gripping America: Who is Alex Murdaugh and what is he accused of?,
5,2023-03-02 12:08:39.855528,2023-03-02 03:00:00,Three killed in attack on residential building; 'Wave after wave' of Russian attacks on Bakhmut | War latest,
6,2023-03-02 12:08:39.855528,2023-03-02 03:00:00,Baby's remains found in Brighton in search for couple's missing child,
7,2023-03-02 12:08:39.855528,2023-03-02 03:00:00,Prince Harry and Meghan asked to 'vacate' Frogmore Cottage,
8,2023-03-02 12:08:39.851154,2023-02-23 12:08:00,Senior Tory MP Damian Green rejected as candidate in next general election,
9,2023-03-02 12:08:39.851154,2023-02-23 12:08:00,Schoolchildren stuck in Calais for hours amid strikes by Border Force staff,
