INDEX,DOWNLOAD_TIME,DATE,TITLE,SUMMARY
0,2024-08-10 17:59:53.166439,2024-08-10 09:03:04,How to Avoid Online Scams and What to Do if You Become a Victim,Here are tips on how to dodge some of the most devastating schemes and what to do if you or someone you care about becomes ensnared.
1,2024-08-10 17:59:53.166439,2024-08-10 04:01:09,How Economic Grievances Were Exploited in Britain’s Violent Unrest,"Nationalist hatred has been linked to forces like stagnant wages and declining services, even though research shows immigration helps many economies."
2,2024-08-10 17:59:53.166439,2024-08-10 17:30:13,"Susan Wojcicki, YouTube’s Former CEO, Dies at 56",The business executive helped turn Google into an internet juggernaut and became one of the most prominent women in Silicon Valley.
3,2024-08-10 17:59:53.166439,2024-08-10 09:00:45,How to Keep Your Money Safe if Your Online Lender Is Not a Bank,The collapse of a little-known intermediary named Synapse Financial Technologies has put a spotlight on the risk that customers face when using popular banking start-ups.
4,2024-08-10 17:59:53.166439,2024-08-10 12:00:02,The Social Media Olympics,More lenient posting rules for Olympic athletes have helped spark a deluge of successful social media content. Some say that’s changing how we watch the Games.
5,2024-08-10 17:59:53.166439,2024-08-10 04:01:17,"Bangladesh Puts Its Eggs in One Economic Basket. Now, a Reckoning.",Garment exports lifted the country to new heights. But overreliance on that industry also helped bring down Prime Minister Sheikh Hasina.
6,2024-08-10 17:59:53.166439,2024-08-10 11:56:53,"FDA Declines to Approve MDMA Therapy, and Seeks Further Study",The agency said there was insufficient data to allow the use of a treatment for PTSD that involves the drug known as Ecstasy.
7,2024-08-10 17:59:53.166439,2024-08-09 21:57:20,"Stellantis to Lay Off Up to 2,450 at Ram Truck Plant in Warren, Michigan","The move is the latest sign of trouble for the trans-Atlantic automaker, which has had sluggish North American sales and has said it needs to cut costs."
8,2024-08-09 17:59:52.474687,2024-08-09 09:03:42,How to Cope When the Markets Panic,"Take a deep breath and make sure you’re well positioned for a potential storm, our columnist says. But stick it out for the long haul."
9,2024-08-09 17:59:52.474687,2024-08-09 13:00:09,What to Know About Online Paycheck Advances and Why They Face Scrutiny,"The Consumer Financial Protection Bureau has proposed a rule that would treat the offerings as loans, requiring the providers to disclose their charges as interest rates."
10,2024-08-09 17:59:52.474687,2024-08-09 12:22:36,"How the Olympics Mascot, Phryge, Went From Bizarre to Beloved","Merchandise featuring the cheery red figure, which is based on a symbol of the French Revolution, has become a best seller at boutiques around Paris."
11,2024-08-09 17:59:52.474687,2024-08-10 21:38:34,"Howie Cohen, Whose Alka-Seltzer Ads Spawned Catchphrases, Dies at 81","A copywriter, he and a partner in 1972 came up with “Try it, you’ll like it” and “I can’t believe I ate that whole thing.” Soon, sales were, well, fizzing."
12,2024-08-09 17:59:52.474687,2024-08-09 20:26:54,Smartmatic Executives Charged With Bribery of Philippine Official,The Justice Department said the executives from the voting technology company had funneled at least $1 million to obtain a contract to provide voting machines in the 2016 Philippine elections.
13,2024-08-09 17:59:52.474687,2024-08-09 18:56:05,The Big Number: $8.4 Billion,Disney’s weaker-than-expected revenue at its theme park unit.
14,2024-08-09 17:59:52.474687,2024-08-09 18:52:30,"Cash App Users May Claim Up to $2,500 in Data Breach Settlement",A proposed $15 million settlement stipulates that account holders can file for losses related to breaches disclosed in 2022 and 2023. A deadline looms for those claims.
15,2024-08-09 17:59:52.474687,2024-08-09 16:26:43,U.S. Vies With Allies and Industry to Tighten China Tech Controls,The Biden administration must navigate the interests of U.S. companies and allied governments as it tries to close off China’s access to advanced chips
16,2024-08-09 17:59:52.474687,2024-08-09 20:29:36,Trump’s Tax Plan Could Add to the National Debt. Harris’s Plan Tracks Biden’s.,The former president’s proposals to cut taxes would lose far more revenue than his plans to raise tariffs. The vice president has not released specifics.
17,2024-08-09 17:59:52.474687,2024-08-10 19:46:33,Can the S.S. United States Be Saved?,"(The storied ocean liner, that is.)"
18,2024-08-09 17:59:52.474687,2024-08-09 11:51:37,Trump Makes a Demand for Say Over the Fed,The former president made his clearest statement yet that he wants influence over the central bank’s rate policy if he wins re-election.
19,2024-08-09 17:59:52.474687,2024-08-09 13:29:02,"About 400 Million People Worldwide Have Had Long Covid, Researchers Say","The condition has put significant strain on patients and society — at a global economic cost of about $1 trillion a year, a new report estimates."
20,2024-08-09 17:59:52.474687,2024-08-09 09:04:54,Who Won Big in the Supreme Court’s Latest Term? The ‘Regulated Community.’,"The phrase, used across industries to signify a shared subjugation to regulatory fiat, has been popping up after three Supreme Court decisions last month."
21,2024-08-09 17:59:52.474687,2024-08-09 20:17:29,"After Stock Market’s Wild Week, Wall Street Wonders What’s Next",Investors have a factor to consider beyond the pace of inflation: Could the next sign of sputtering economic growth send stocks into a tailspin?
22,2024-08-09 17:59:52.474687,2024-08-09 17:40:39,Is a Disney Theme Park Vacation Still Worth the Price?,"As Disney has raised the cost of tickets and hotel rooms at its theme parks, and added pricey, difficult-to-navigate tools, even its most loyal fans are asking themselves if they should rethink their vacations."
23,2024-08-09 17:59:52.474687,2024-08-09 15:11:37,Avoiding Rental Car Toll Fees,"Using the rental company’s transponder can rack up hefty charges, but there are workarounds, from apps to paying by mail."
24,2024-08-09 17:59:52.474687,2024-08-09 08:39:23,China Battery Tech Reflects Research Boom and Big Spending,"Stressing science education, China is outpacing other countries in research fields like battery chemistry, crucial to its lead in electric vehicles."
25,2024-08-09 17:59:52.474687,2024-08-10 14:24:51,Why Isn’t Kamala Harris Giving Interviews or Holding News Conferences?,Critics say the vice president has been too cautious with the press. Her supporters think it’s the right strategy at the right time.
26,2024-08-09 17:59:52.474687,2024-08-09 04:16:25,Samsung Recalls 1 Million Stoves That Started 250 Fires and Killed Pets,Thirty models of Samsung stoves were part of the recall over fires started by accidental contact.
27,2024-08-09 17:59:52.474687,2024-08-09 14:18:23,Trump Suggests That President Should Have a ‘Say’ in Interest Rates,"Donald J. Trump said presidents should have input on interest rates, a comment likely to stoke fears that he could try to limit the Federal Reserve’s political independence."
28,2024-08-09 17:59:52.474687,2024-08-08 22:01:12,"Trump and Harris Agree to Debate on Sept. 10, ABC Says",The ABC anchors David Muir and Linsey Davis will moderate the candidates’ first face-to-face encounter since Kamala Harris entered the race.
29,2024-08-09 17:59:52.474687,2024-08-08 20:06:20,"Third Death Is Tied to Listeria, Health Officials Say",The death in Virginia came amid a nationwide outbreak linked to Boar’s Head deli meats. More than 40 people have been hospitalized.
30,2024-08-08 17:59:51.919827,2024-08-08 17:39:34,Jake Paul Lends His Celebrity (Some of It) to Olympic Boxing,"Paul, a social media influencer and boxer, usually promotes professional fighting. Now he’s in a partnership with U.S.A. Boxing, but his output in Paris has been minimal."
31,2024-08-08 17:59:51.919827,2024-08-08 18:12:33,"Mortgage Rates Drop Sharply, With 30-Year at 6.47%","The key mortgage rate had its biggest one-week decline of the year, falling to the lowest level in 15 months."
32,2024-08-08 17:59:51.919827,2024-08-08 22:01:37,Veterans and Lawmakers Lobby for Approval of MDMA Therapy,"The F.D.A. is poised to rule on the therapeutic use of the club drug Ecstasy, a potential watershed moment in the nascent field of psychedelic medicine."
33,2024-08-08 17:59:51.919827,2024-08-08 14:40:39,"Why Google, Microsoft and Amazon Shy Away From Buying A.I. Start-Ups","Google, Microsoft and Amazon have made deals with A.I. start-ups for their technology and top employees, but have shied from owning the firms. Here’s why."
34,2024-08-08 17:59:51.919827,2024-08-10 14:24:34,"From Tips to TikTok, Trump Swaps Policies With Aim to Please Voters",The former president’s economic agenda has made some notable reversals from the policies he pushed while in the White House.
35,2024-08-08 17:59:51.919827,2024-08-08 21:43:50,"Fed Rate Cuts Are Expected Soon, as Inflation Cools. But Will They Be Early Enough to Avoid a Recession?","The Federal Reserve was about to cut interest rates, turning the corner after a long fight with inflation. But now, its soft landing is in question."
36,2024-08-08 17:59:51.919827,2024-08-08 16:09:52,Oliver Darcy Departs CNN to Launch Subscription Media News Site,"Oliver Darcy is starting a subscription-based news site dedicated to covering the media industry, joining a crowded field."
37,2024-08-08 17:59:51.919827,2024-08-08 17:00:28,The Jobless Claims Report Could Upset Topsy-Turvy Markets,"A key jobless claims report could join a hiring slowdown, corporate earnings, and growth worries weighing on investors during an August to forget."
38,2024-08-08 17:59:51.919827,2024-08-08 12:27:04,"This Texas Energy Is So Bountiful, They Pay You to Take It Away","Natural gas has traded at negative prices for weeks at a time in West Texas, where pipelines often lack the capacity to get the fuel to places that need it."
39,2024-08-08 17:59:51.919827,2024-08-10 14:24:45,Where Are the Trumpiest Ads? All Over Truth Social.,Donald J. Trump’s social network is increasingly relying on a niche of the ad market that caters to hard-core Trump fans and Christian conservatives for revenue.
40,2024-08-08 17:59:51.919827,2024-08-08 14:57:40,Chinese Woman Loses Legal Challenge for Right to Freeze Her Eggs,"Despite a declining birthrate that has alarmed the nation’s leaders, regulations in China prevent unmarried women from freezing their eggs."
41,2024-08-08 17:59:51.919827,2024-08-09 13:33:48,Why TSMC Has Struggled to Manufacture Chips in Arizona,TSMC modeled its facility in Phoenix on one at home. But bringing the company’s complex manufacturing process to America has been a bigger challenge than it expected.
42,2024-08-08 17:59:51.919827,2024-08-07 23:00:08,"As Markets Rock, a Reporter Stays Steady","Joe Rennison, who covers financial markets for The New York Times, raced home from vacation when a slowdown in the U.S. economy sparked widespread worry."
43,2024-08-08 17:59:51.919827,2024-08-07 22:39:37,Warner Bros. Discovery Takes $9 Billion Write-Down on Cable Networks,"David Zaslav, the company’s chief executive, said the accounting change was an acknowledgment of the pressures facing traditional media."
44,2024-08-07 17:59:51.348114,2024-08-08 13:36:38,NASA Says Boeing Starliner Astronauts May Fly Home on SpaceX in 2025,The agency had insisted for a couple of months that it was confident that Suni Williams and Butch Wilmore would return on Starliner.
45,2024-08-07 17:59:51.348114,2024-08-07 18:46:30,"How the Media Is Covering Tim Walz, Kamala Harris’s Running Mate","Vice President Kamala Harris’s new running mate has cultivated an Everyman persona. Progressive publications are embracing it, but conservative outlets are more skeptical."
46,2024-08-07 17:59:51.348114,2024-08-07 21:35:13,Trump Dangles New Tax Cut Proposals With Real Political Appeal,The most recent and costliest of Mr. Trump’s ideas would end income taxes on Social Security benefits.
47,2024-08-07 17:59:51.348114,2024-08-07 18:36:58,Elon Musk Clashes With Keir Starmer Over Riots in UK,"Over the past few days, the billionaire has posted incendiary comments about violent protests on the social media platform he controls, drawing the ire of the prime minister."
48,2024-08-07 17:59:51.348114,2024-08-07 12:03:37,A Tim Walz Economics Primer,"Here’s how business executives and donors are evaluating Gov. Tim Walz of Minnesota, especially on taxes, labor unions, energy policy and more."
49,2024-08-07 17:59:51.348114,2024-08-07 11:23:15,New York Times Reports 13.6% Jump in Profit,"The publisher added about 300,000 digital subscribers in the latest quarter, and now has more than 10.8 million subscribers."
50,2024-08-07 17:59:51.348114,2024-08-07 13:53:38,"Disney Parks Struggle, Exposing New Trouble Spot","Companywide profit increased, the result of hit movies and streaming growth. But Disney said softening theme park demand “could impact the next few quarters.”"
51,2024-08-07 17:59:51.348114,2024-08-07 18:18:25,Why Japan Was Crushed Most in the Global Market Rout,"The fragility of a more-than-yearlong stock rally in Japan, fueled in part by a weak yen, has been exposed by the sudden strengthening of the currency."
52,2024-08-07 17:59:51.348114,2024-08-08 00:58:24,What’s Behind All the Stock Market Drama?,"Analysts and investors have many explanations, including worries about the health of the U.S. economy and shifts in the value of the Japanese yen."
53,2024-08-07 17:59:51.348114,2024-08-07 15:18:14,"To Avoid an Economic Recession, Consumer Spending Is Key","Consumer spending has powered the economic recovery from the pandemic shock. Now wallets are thinner, and some businesses are feeling the difference."
54,2024-08-07 17:59:51.348114,2024-08-09 17:50:28,"With ‘Sprint’ and ‘Simone Biles: Rising,’ Netflix Fills Olympic Content Gap","New seasons of documentaries about running, gymnastics and basketball are being filmed this summer as part of a partnership with the International Olympic Committee."
55,2024-08-07 17:59:51.348114,2024-08-07 17:35:21,Boeing Says It’s Changing Type of Panel That Blew Off Alaska Airlines Jet,The company told regulators the changes in design and production of the door plugs would allow its warning systems to detect malfunctions.
56,2024-08-07 17:59:51.348114,2024-08-07 12:06:43,Apple Store Workers Get First U.S. Contract,"The agreement at a Maryland store, the first to unionize, raises wages roughly 10 percent over three years and guarantees benefits and severance pay."
