INDEX,DOWNLOAD_TIME,DATE,TITLE,SUMMARY
0,2022-09-17 19:01:19.337547,2022-09-16 22:02:36,Wix stock rises after activist investor Starboard discloses 9% stake,"<p>Wix.com Ltd.  shares rose in the extended session Friday following a report that activist investor Starboard Value had built a 9% stake in the company, which was later confirmed. Shares rose 5% after hours, following a 3.5% decline to finish the regular session at $73.69. At first, shares rose following a Reuters report that was later confirmed by a Securities and Exchange Commission filing. Starboard said the purpose of the transaction was because it considered shares to be ""undervalued and represented an attractive investment opportunity,"" and planned to make ""suggestions for improving"" Wix's financial and operation performance. Wix shares are down 53% year to date, compared with an 18% decline in the S&amp;P 500 index </p><p>Market Pulse Stories are Rapid-fire, short news bursts on stocks and markets as they move. Visit MarketWatch.com for more information on this news."
1,2022-09-17 19:01:19.337547,2022-09-16 20:35:23,Goldman faces consumer bank inquiry from the U.S. Federal Reserve: Bloomberg,"<p>The U.S. Federal Reserve is reviewing Goldman Sachs Group Inc.'s  consumer-banking business, according to a report Friday by Bloomberg. Citing people familiar with the central bank, Bloomberg reported that the central bank has been questioning Goldman management for several weeks about the business. Goldman Sachs declined to comment, the report said. Goldman Sachs disclosed in an Aug. 4 filing that it's cooperating with the Consumer Financial Protection Bureau's investigation of GS Bank USA's credit card account management practices. The GS Bank USA probe includes the application of refunds, crediting of nonconforming payments, billing error resolution, advertisements, and reporting to credit bureaus, the filing said. Shares of Goldman Sachs are down 14.7% in 2022 compared to an 18.7% drop by the S&amp;P 500 . </p><p>Market Pulse Stories are Rapid-fire, short news bursts on stocks and markets as they move. Visit MarketWatch.com for more information on this news."
2,2022-09-17 19:01:19.337547,2022-09-16 20:06:00,"Stocks end lower after FedEx warning, post weekly declines","<p>Stocks fell Friday after FedEx Corp.  issued a profit warning that stirred fears of a global recession, but ended the day well off session lows. Major indexes booked large weekly losses as investors looked ahead to next week's Federal Reserve decision, which is expected to see policy makers deliver another large rate increase in an effort to get inflation under control. The Dow Jones Industrial Average  fell around 140 points, or 0.5%, to close near 30,822, according to preliminary figures, after dropping more than 400 points at its session low. The S&amp;P 500  ended 0.7% lower near 3,873, while the Nasdaq Composite  shed 0.9% to finish near 11,448. The decline left the Dow down 4.1% for the week, while the S&amp;P 500 saw a 4.8% weekly fall and the Nasdaq slid 5.5%.</p><p>Market Pulse Stories are Rapid-fire, short news bursts on stocks and markets as they move. Visit MarketWatch.com for more information on this news."
3,2022-09-17 19:01:19.337547,2022-09-16 20:02:00,The Tell: Wall Street’s most pessimistic bank sees almost 5% fed-funds rate on horizon,"<p>Anna Moneymaker/Getty ImagesAs financial market gloom continued to deepen on Friday, Deutsche Bank, Wall Street’s most pessimistic bank, came out with yet another eye-opening view: Its U.S. economists, led by Matt Luzzetti, now expect the Federal Reserve to end its rate-hike campaign at 4.9% in 2023’s first quarter.The notion of an almost 5% fed-funds rate, which in Deutsche Bank’s own words is “way beyond” what the market is pricing, comes just days ahead of the Fed’s next meeting on Sept. 20-21 and as investors remain anxious about how high interest rates will have to go to tame the worst stretch of inflation in four decades. Investors were still trying to wrap their heads around the likelihood that the fed-funds rate target will likely rise above 4% by year-end, and the stock market sold off on Friday — fueled by a profit warning by FedEx Corp. FDX, along with inflation and rate fears.Few market participants have openly talked about the prospect of an almost 5% fed-funds rate target, essentially double the current level of 2.25% to 2.5%. Such a scenario could have an even more punishing effect on stocks than what’s been predicted by billionaire investor and hedge-fund manager Ray Dalio, who estimates that a 4.5% level on rates would produce a 20% negative impact on equity prices. Meanwhile, one key market rate — the one-year Treasury yield BX:TMUBMUSD01Y — hovered near 4% on Friday, a development that some say could spill over into other rates and exacerbate worries throughout financial markets, in the U.S. and abroad. Deutsche Bank’s revised interest-rate forecast “is all about the inflation profile and how we expect inflation to remain at higher levels for longer,” Luzzetti, chief U.S. economist, said via phone. “The Fed has always gotten the fed-funds rate target above inflation during all of its past tightening cycles, whether inflation was high or not.”“For policy to be restrictive, real or inflation-adjusted rates need to be positive and, right now, Fed officials can’t rely on forecasts about inflation to decline over time,” he told MarketWatch. “For them to have confidence, they need to get the fed-funds rate above inflation, at least by early next year,” he said, although Deutsche Bank doesn’t expect an almost 5% fed-funds rate to be sustained for very long.  Deutsche Bank’s U.S. economists revised their expectations after Tuesday’s unexpectedly hot consumer-price index report for August, and the upgrade is now closer to the 5% to 6% range that some at the bank think is needed to cool inflation.Friday brought another downbeat day in financial markets, with all three major stock indexes DJIASPXCOMP finishing lower after trimming earlier heavy losses. FedEx’s profit warning was being read by some, such as BNP Paribas Chief U.S. Economist Carl Riccadonna, as fitting into his view that a “massive deceleration” is under way for the U.S. economy.Deutsche Bank was the first major Wall Street bank to call a U.S. recession in April. That same month, it went out further on a limb to say that it saw downside risk to its own pessimistic view. In June, Tim Wessel, a macro strategist, said he saw a chance that inflation fails to decelerate. And just three days ago, Henry Allen, a research analyst, said “that the pessimists will sadly prevail on this occasion” when it comes to the debate over whether the U.S. economy can achieve a soft landing.  On Friday, Deutsche Bank was joined by Dutch financial-services company Rabobank, with another take on the prospect of higher-than-expected rates. Strategist Philip Marey said Rabobank now expects the fed-funds rate to peak at 5% next year, up from its prior forecast of 4.5%, given persistent inflation and a wage-price spiral that’s already under way. Rabobank also doesn’t expect the Fed to pivot from its rate stance before 2024.</p><p>Market Pulse Stories are Rapid-fire, short news bursts on stocks and markets as they move. Visit MarketWatch.com for more information on this news."
4,2022-09-17 19:01:19.337547,2022-09-16 19:20:49,Nasdaq Composite heads for biggest weekly drop since January as U.S. stocks trade down Friday,"<p>The technology-heavy Nasdaq Composite is heading for its biggest weekly loss since January as U.S. stocks remained down in the final hour of trading Friday. The Nasdaq  is on track to lose 5.7% this week, FactSet data show, at last check. That puts it on track for the largest percentage drop since the stretch ending Jan. 21, according to Dow Jones Market Data. Stocks were slumping Friday afternoon amid heightened fears the U.S. may be heading for a recession after FedEx  delivered a profit warning and as investors brace for another large rate hike from the Federal Reserve next week. The S&amp;P 500  is heading for a weekly drop of 5% and the Dow Jones Industrial Average  is on pace to slide 4.3% this week, FactSet data show, at last check.</p><p>Market Pulse Stories are Rapid-fire, short news bursts on stocks and markets as they move. Visit MarketWatch.com for more information on this news."
5,2022-09-17 19:01:19.337547,2022-09-16 19:02:03,"American Healthcare REIT files to go public, with an NYSE listing expected","<p>American Healthcare REIT Inc. has filed for an initial public offering of common stock, but the terms of the IPO have not yet been determined. The California-based real estate investment trust focused on health care properties said it expects the stock to list on the New York Stock Exchange (NYSE) under the ticker symbol ""AHR."" BofA Securities, Citigroup and KeyBanc Capital Markets are the joint book-running managers. For the six months ended June 30, the company reported a net loss of $17.1 million on revenue of $764.4 million, after a loss of $24.1 million on revenue of $599.4 million in the same period a year ago. The company is looking to go public as investor interest in recently IPO's stock has picked up recently, but has lagged the broader market by a wide margin this year. The Renaissance IPO ETF  has run up 12.9% over the past three months but has tumbled 46.3% year to date, while the S&amp;P 500  has gained 5.4% the past three months while losing 18.9% this year.</p><p>Market Pulse Stories are Rapid-fire, short news bursts on stocks and markets as they move. Visit MarketWatch.com for more information on this news."
6,2022-09-17 19:01:19.337547,2022-09-16 18:53:45,"U.S. oil futures little changed for session, post a loss for the week","<p>U.S. oil futures gained just a penny on Friday after settling with a nearly 4% loss a day earlier. There's a lot of uncertainty overseas both on the supply side and on the demand side, said Colin Cieszynski, chief market strategist at SIA Wealth management. For the U.S., however, the most significant fundamental factor is ""how long the government plans to keep running down the [Strategic Petroleum Reserve], with midterm elections in about six weeks, and once they stop, when and how quickly does the drawdown supply become refill demand,"" he said. October WTI crude  rose by a penny to settle at $85.11 barrel on the New York Mercantile Exchange. For the week, the front-month contract lost 1.9%, according to Dow Jones Market Data.</p><p>Market Pulse Stories are Rapid-fire, short news bursts on stocks and markets as they move. Visit MarketWatch.com for more information on this news."
7,2022-09-17 19:01:19.337547,2022-09-16 18:09:58,Apollo-backed tech services company Intrado sells Safety unit to Stonepeak,"<p>Stonepeak said Friday it agreed to pay $2.4 billion for the Safety unit of Intrado Corp., a technology enabled services company backed by Apollo Global Management Inc. . The Safety unit specializes in 911 public emergency telecommunications services. Intrado will retain Workflows, which is part of its Life & Safety segment. Stonepeak senior managing director James Wyper said Intrado's Safety business ""represents an attractive opportunity to invest behind critical telecommunications infrastructure that underpins access to 911, a public good in the U.S.,"" according to a statement. RBC Capital Markets acted as lead financial adviser to Intrado on the transaction, which is expected to close in the first quarter of 2023. Paul, Weiss, Rifkind, Wharton & Garrison LLP served as legal adviser to Intrado, while Simpson Thacher & Bartlett advised Stonepeak. Shares of Apollo Global Management are down 24.3% in 2022, compared to a 19.3% drop by the S&amp;P 500 .</p><p>Market Pulse Stories are Rapid-fire, short news bursts on stocks and markets as they move. Visit MarketWatch.com for more information on this news."
8,2022-09-17 19:01:19.337547,2022-09-16 17:59:33,FedEx shares on track for their worst week since the 1987 stock market crash,"<p>FedEx Corp. shares  are currently down 23.4% on the week, putting them on track for their worst week since the stock market crash of October 1987. The stock lost 25.6% in the week through Oct. 23 of 1987. FedEx late Thursday slashed its earnings forecast, pulled its outlook for the year, and called for a shortfall of half a billion dollars. The news shook investors and led to a broad selloff that included major retailers who are perilously close to the key holiday shopping season. The global logistics and shipping company represents ""the pulse of global goods activity,"" said Jack Ablin, chief investment officer at Cresset Capital. ""Global shipping activity has been in a downtrend. Weekly trucking demand, after peaking last February, has been in freefall,"" Ablin said. Companies that ""double- and triple-ordered during supply chain shortages now face brimming inventory.""</p><p>Market Pulse Stories are Rapid-fire, short news bursts on stocks and markets as they move. Visit MarketWatch.com for more information on this news."
9,2022-09-17 19:01:19.337547,2022-09-16 17:56:52,"Gold futures end higher for the session, fall for the week","<p>Gold futures climbed on Friday, finding support following a September reading on U.S. consumer sentiment, but prices marked their fourth weekly loss in five weeks. A survey of consumer sentiment from the University of Michigan showed a rise to 59.5 in September. It also revealed that inflation has slowed a bit in the past few months. Gold prices had a terrible week, but saw a ""small relief rally"" on Friday as the economic numbers ""confirmed that the Fed can't be extra hawkish as that will completely kill the [economic] recovery,"" said Naeem Aslam, chief market analyst at AvaTrade. The gold market also saw ""some bargain hunters stepping into the market as prices are way too cheap."" December gold  rose $6.20, or 0.4%, to settle at $1,683.50 an ounce on Comex, a day after losing 1.9% and settling at its lowest since April 2020. For the week, the most-active contract lost 2.6%, according to Dow Jones Market Data.</p><p>Market Pulse Stories are Rapid-fire, short news bursts on stocks and markets as they move. Visit MarketWatch.com for more information on this news."
10,2022-09-17 19:01:19.337547,2022-09-16 17:06:09,Baker Hughes data show a weekly climb in active U.S. oil-drilling rigs,"<p>Baker Hughes  on Friday reported that the number of active U.S. rigs drilling for oil rose by eight to 599 this week. That followed declines in each of the previous two weeks. The total active U.S. rig count, which includes those drilling for natural gas, climbed by four to 763, according to Baker Hughes. Oil prices edged lower, with October West Texas Intermediate crude  down 10 cents, or 0.1%, at $85 a barrel on the New York Mercantile Exchange. </p><p>Market Pulse Stories are Rapid-fire, short news bursts on stocks and markets as they move. Visit MarketWatch.com for more information on this news."
11,2022-09-17 19:01:19.337547,2022-09-16 13:34:28,"U.S. stocks open lower Friday after FedEx profit warning, on track for weekly losses","<p>U.S. stocks opened lower after a FedEx profit warning and as investors worry about rising interest rates in the wake of inflation running hotter than expected in August. The Dow Jones Industrial Average  fell 1.1% soon after the opening bell, while the S&amp;P 500  dropped 1% and the Nasdaq Composite  slid 1.3%, according to FactSet data, at last check. The S&amp;P 500 and Nasdaq were each heading for a weekly decline of more than 5%, while the Dow was down almost 5% so far this week. A reading on consumer sentiment from the University of Michigan is due out at 10 a.m. Eastern time, along with consumers' five-year inflation expectations. Investors are anticipating another large rate hike from the Federal Reserve at its policy meeting next week in an effort to curb high inflation. </p><p>Market Pulse Stories are Rapid-fire, short news bursts on stocks and markets as they move. Visit MarketWatch.com for more information on this news."
12,2022-09-17 19:01:19.337547,2022-09-16 12:38:27,Intellia's stock is up 6% on data from an early-stage trial for its Crispr therapy,"<p>Shares of Intellia Therapeutics Inc.  gained 6.5% in premarket trading on Friday after the company and Regeneron Pharmaceuticals Inc.  announced positive data from an ongoing Phase 1 clinical trial evaluating their investigational Crispr therapy as a treatment for transthyretin amyloidosis with cardiomyopathy, which can cause heart failure. The data demonstrated a reduction in serum transthyretin in 12 patients for up to six months. ""At these deep and consistent levels of protein reduction, we believe NTLA-2001 has the potential to halt and even reverse the underlying cause of ATTR amyloidosis,"" Intellia President and CEO John Leonard said in a news release.  Intellia's stock has declined 42.0% this year, while the broader S&amp;P 500  is down 18.1%. </p><p>Market Pulse Stories are Rapid-fire, short news bursts on stocks and markets as they move. Visit MarketWatch.com for more information on this news."
13,2022-09-17 19:01:19.337547,2022-09-16 12:37:26,"Pfizer, BioNTech COVID vaccine gets CHMP recommendation for 'full' MA for all indications","<p>Pfizer Inc.  and BioNTech SE  said Friday that the Committee for Medicinal Products for Human Use (CHMP) for the European Medicines Agency (EMA) has recommended the companies' COVID-19 vaccine Comirnaty be converted to standard, or ""full,"" Marketing Authorization (MA) from conditional MA for all indications and formulations. The companies said the European Commission (EC) will review the CHMP recommendation and is expected to make a decision ""soon."" The vaccine has been granted MA by the EC to prevent COVID-19 in people aged 5 years and older, and the current conditional MA has been expanded to include a booster dose. Shares of Pfizer have declined 22.2% year to date through Thursday and BioNTech have dropped 44.1%, while the S&amp;P 500  has lost 18.2%.</p><p>Market Pulse Stories are Rapid-fire, short news bursts on stocks and markets as they move. Visit MarketWatch.com for more information on this news."
14,2022-09-17 19:01:19.337547,2022-09-16 12:20:09,FedEx stock selloff would shave about 250 points off the Dow transports' price,"<p>The selloff in FedEx Corp.'s stock  is enough, by itself, to push the Dow Jones Transportation Average  down well more than the broader stock market. The package delivery company's stock plunged 20.0% in premarket trading following a 'staggering' profit and revenue warning, which puts it on track to suffer a record one-day selloff. The implied price decline would shave about 250 points off the Dow transports price, which by itself would represent a 1.9% decline from Thursday's closing price of 13,510.73. Meanwhile, the Dow Jones Industrial Average  futures  slumped 242 points, or 0.8%, and futures  for the S&amp;P 500  slid 0.9%.</p><p>Market Pulse Stories are Rapid-fire, short news bursts on stocks and markets as they move. Visit MarketWatch.com for more information on this news."
15,2022-09-17 19:01:19.337547,2022-09-16 12:18:27,Novavax says its COVID vaccine is now available in Israel for use in people aged 12 and older,"<p>Novavax Inc.  said Friday that Israel has granted an import and use permit for the company's COVID vaccine for use in people aged 12 and older. The vaccine is protein based, using a more traditional technology than the mRNA used in the vaccines developed by Pfizer Inc.  and German partner BioNTech SE  and Moderna Inc. . The vaccine has now received authorization for use in adults aged 18 and older from more than 40 markets, including the U.S. It has also won authorization from the World Health Organization. Separately, the company said it has also won emergency use authorization in Taiwan for adolescents aged 12 through 17. Novavax shares were down 1.7% premarket and have fallen 77% in the year to date, while the S&amp;P 500  has fallen 18%. </p><p>Market Pulse Stories are Rapid-fire, short news bursts on stocks and markets as they move. Visit MarketWatch.com for more information on this news."
16,2022-09-17 19:01:19.337547,2022-09-16 12:14:26,Core & Main stock falls after upsized share offering priced at 5% discount,"<p>Shares of Core & Main Inc.  sank 7.3% in premarket trading Friday, after the distributor of water, storm drainage and fire protection products said its upsized stock offering priced at $23.75 a share. The company said selling shareholders sold 11.0 million shares in the offering, up from the late Thursday's announcement of a 10.0 million share offering. The pricing represented a 5.0% discount to Thursday's stock closing price of $25.01. Core & Main didn't receive any proceeds from the offering, while the selling shareholders raised $261.25 million. The share offering comes after the stock soared 20.4% over the past three months through Thursday, while the S&amp;P 500  gained 2.9%.</p><p>Market Pulse Stories are Rapid-fire, short news bursts on stocks and markets as they move. Visit MarketWatch.com for more information on this news."
17,2022-09-17 19:01:19.337547,2022-09-16 11:36:35,NCR stock plunges after company says it will break in two rather than sell itself,"<p>Shares of NCR Corp.  were tumbling 17% in premarket trading Friday after the company said it plans to split into two publicly traded businesses, with one focusing on digital commerce and the other oriented around ATMs. The late Thursday announcement signaled that management wasn't able to proceed with a sale of the company. ""Throughout the strategic review process, we received material interest in a whole company sale of NCR, as well as interest in various individual segments of our business,"" Executive Chairman Frank Martire said in a release. ""In recent days, it has become increasingly clear to the board that, given the state of current financing markets, we cannot deliver a whole company transaction that reflects an appropriate and acceptable value for NCR to our shareholders."" RBC Capital Markets analyst Daniel Perlin said in a note to clients Thursday evening that the announcement was ""not the outcome we were hoping for"" as his read of the situation suggests ""financing in the high-yield market did not support a price point high enough to receive shareholder approval."" NCR shares have lost 26% over the past 12 months as the S&amp;P 500  has declined by half that amount.</p><p>Market Pulse Stories are Rapid-fire, short news bursts on stocks and markets as they move. Visit MarketWatch.com for more information on this news."
18,2022-09-17 19:01:19.337547,2022-09-16 11:34:24,Chinese hotel group Atour Lifestyle files for IPO with plans to list on Nasdaq,"<p>China's Atour Lifestyle Holdings Ltd. filed for an initial public offering on Friday with plans to list on Nasdaq under the ticker ""ATAT."" BofA Securities and Citigroup are leads in a syndicate of six banks working on the deal. The company, which started life as a hotel chain, will use the proceeds to expand its hotel network in China, to develop new brands and products for its portfolio, to upgrade IT and to pursue strategic acquisitions, including M&amp;A and joint ventures, should it identify suitable targets. The company had a profit of $10.3 million in the first six months of the year on revenue of $144.3 million. ""Setting out as an upper midscale hotel chain group, we are now a leading lifestyle brand in China,"" the company says in its prospectus. The Renaissance IPO ETF  has fallen 43% in the year to date amid a severe drought in deals, while the S&amp;P 500  has fallen 18%. </p><p>Market Pulse Stories are Rapid-fire, short news bursts on stocks and markets as they move. Visit MarketWatch.com for more information on this news."
19,2022-09-17 19:01:19.337547,2022-09-16 11:30:03,"JetBlue raises revenue per ASM outlook, as it still sees 'robust' travel demand","<p>JetBlue Airways Corp.  said Friday that it is seeing ""strong demand"" extend beyond the summer peak, with ""robust"" demand for travel in September and beyond. The air carrier raised its third-quarter guidance for growth in revenue per available seat mile (RASM), compared with pre-pandemic 2019, to $22% to 24% from 19% to 23%. The company also revised its outlook for third-quarter ASM, or capacity, to down 0.5% to up 0.5% from down 3% to flat. JetBlue also raised its estimate for fuel price per gallon to $3.86 from $3.68, but maintained its forecast for cost per ASM excluding fuel versus 2019 at 15% to 17%. JetBlue's stock fell 1.6% in premarket trading, while the U.S. Global Jets ETF  shed 1.1% ahead of the open and futures  for the S&amp;P 500  slid 0.8%.</p><p>Market Pulse Stories are Rapid-fire, short news bursts on stocks and markets as they move. Visit MarketWatch.com for more information on this news."
20,2022-09-17 19:01:19.337547,2022-09-16 11:25:04,General Atlantic buys Softbank's stake in Kahoot!,
