INDEX,DOWNLOAD_TIME,DATE,TITLE,SUMMARY
0,2022-04-23 13:40:14.618371,2022-04-23 14:04:17,Three reasons why this struggling fintech stock may break out of its slump,"PayPal shares tumbled 16% this week, but one top analyst is making a bullish long-term case on a struggling stock."
1,2022-04-23 13:40:14.612410,2022-04-22 20:35:59,Fed's Mester casts doubt on the need for 'shock' interest rate hikes ahead,"Cleveland Fed President Loretta Mester said she's in favor of raising interest rates quickly, but not so quickly as to disrupt the economic recovery."
2,2022-04-23 13:40:14.612410,2022-04-22 17:02:39,"Stocks making the biggest moves midday: HCA Healthcare, Kimberly-Clark, Gap and more",These are the stocks posting the largest moves in midday trading.
3,2022-04-23 13:40:14.612410,2022-04-22 18:37:55,"Cuts to unemployment benefits didn’t spur jobs, report says","Federal unemployment benefits don't appear to have been a big contributor to labor shortages in 2021, according to the Federal Reserve Bank of San Francisco."
4,2022-04-23 13:40:14.612410,2022-04-22 15:36:40,Fintech giant Stripe jumps into crypto with a feature that lets Twitter users get paid in stablecoin,It's Stripe's first significant push into crypto since dropping support for bitcoin four years ago.
5,2022-04-23 13:40:14.612410,2022-04-22 12:03:11,"Stocks making the biggest moves premarket: American Express, Verizon, Kimberly-Clark and more",These are the stocks posting the largest moves before the bell.
6,2022-04-23 13:40:14.612410,2022-04-22 13:50:01,Sanctions threaten to cripple Russia's multibillion-dollar crypto industry,"Russia is the world's third-biggest bitcoin mining hub, according to Cambridge University data."
7,2022-04-23 13:40:14.612410,2022-04-23 08:40:57,"Digital banks showing weaknesses in their financial crime defenses, UK regulator warns",The U.K.'s Financial Conduct Authority warned that some challenger banks are failing to adequately assess the risk of financial crime when onboarding customers.
8,2022-04-23 13:40:14.612410,2022-04-22 05:43:47,"Many factory workers in Shanghai can't get back to work, even after Covid controls ease","Nearly a month since Covid restrictions began in earnest in Shanghai, foreign businesses say that less than half of their employees are able to return to work."
9,2022-04-23 13:40:14.612410,2022-04-22 23:49:55,"Dow plunges more than 900 points for its worst day since 2020, falls for a fourth straight week","Stocks sank on Friday as investors digested disappointing earnings and rising rates, sending the Dow Jones Industrial Average to its worst day since 2020."
10,2022-04-23 13:40:14.612410,2022-04-21 20:56:21,"Stocks making the biggest moves after hours: Snap, Gap and more",See which stocks are posting big moves after the bell.
11,2022-04-23 13:40:14.612410,2022-04-21 18:36:20,Goldman's checking account for the masses nears as bank tests product with U.S. employees,Goldman's play to manage Americans' primary transaction hub is one of the significant steps it has taken to compete directly with giants such as Wells Fargo.
12,2022-04-23 13:40:14.612410,2022-04-22 19:34:02,"Powell says taming inflation 'absolutely essential,' and a 50 basis point hike possible for May",Federal Reserve Chairman Jerome Powell on Thursday affirmed the central bank's determination to bring inflation down.
13,2022-04-23 13:40:14.612410,2022-04-21 20:06:53,"Stocks making the biggest moves midday: United Airlines, AT&T, Tesla and more",These are the stocks posting the largest moves in midday trading.
14,2022-04-23 13:40:14.612410,2022-04-21 11:48:01,"Stocks making the biggest moves premarket: American Airlines, Blackstone, AT&T and more",These are the stocks posting the largest moves before the bell.
15,2022-04-23 13:40:14.612410,2022-04-21 09:10:24,Crypto exchange Binance removes Twitter emoji that resembled a swastika after outcry,"""Well that was obviously really embarrassing,"" the company wrote on Twitter."
16,2022-04-23 13:40:14.612410,2022-04-21 05:43:40,"As the U.S. 10-year Treasury yield keeps climbing, here's what it means for China","The rise in the U.S. 10-year Treasury yield to three-year highs has erased its gap with its Chinese counterpart, something that hasn't happened since 2010."
17,2022-04-23 13:40:14.612410,2022-04-21 14:27:08,"Embattled hedge fund Melvin Capital weighs unwinding current fund to start new one, sources say","Plotkin has committed to keeping his ""new"" fund at or below $5 billion in capital and returning to a focus on shorting stocks, sources told CNBC."
18,2022-04-23 13:40:14.612410,2022-04-21 14:53:05,"As the dollar jumps to two-year highs, the 'Fast Money' traders deliver winners and losers","The ""Fast Money"" traders take a look at winners and losers as the dollar jumps to two year highs."
19,2022-04-23 13:40:14.612410,2022-04-22 01:10:21,"Nasdaq slides 2%, Dow falls more than 350 points in sharp reversal as rising rates weigh on stocks","Stocks fell Thursday in a sharp reversal, as a jump in Treasury yields offset the optimism coming from another batch of solid corporate earnings."
20,2022-04-23 13:40:14.612410,2022-04-20 21:03:06,"Stocks making the biggest moves after hours: Tesla, United, Carvana and more",See which stocks are posting big moves after the bell.
21,2022-04-23 13:40:14.612410,2022-04-20 19:12:04,"Fed's Daly says the economy can handle rate hikes, but a mild recession is possible",San Francisco Fed President Mary Daly acknowledged that a series of rate hikes over the coming months could tip the economy into a shallow recession.
22,2022-04-23 13:40:14.612410,2022-04-20 20:09:09,"Stocks making the biggest moves midday: Netflix, M&T Bank, Baker Hughes, IBM and more",These are the stocks posting the largest moves in midday trading.
23,2022-04-23 13:40:14.612410,2022-04-20 13:33:42,Goldman executive who helped create Marcus brand leaves for real estate investing start-up Cadre,Dustin Cohn joins other former executives in departing Goldman amid its plans to scale its retail banking business.
24,2022-04-23 13:40:14.612410,2022-04-20 11:51:35,"Stocks making the biggest moves premarket: Netflix, Procter & Gamble, Baker Hughes and more",These are the stocks posting the largest moves before the bell.
25,2022-04-23 13:40:14.612410,2022-04-20 05:13:46,"Bitcoin 'tribalism' is holding the crypto industry back, Ripple CEO says","""Tribalism"" around bitcoin and other cryptocurrencies is holding back the entire $2 trillion market, Ripple CEO Brad Garlinghouse has said."
26,2022-04-23 13:40:14.612410,2022-04-20 22:08:31,"Dow jumps 249 points on Wednesday, but the Nasdaq is dragged down by a big plunge in Netflix","The Dow rose on the back of strong earnings from Procter & Gamble, while the Nasdaq was dragged down by an epic plunge in shares of one-time darling Netflix."
27,2022-04-23 13:40:14.612410,2022-04-19 22:39:47,"Stocks making the biggest moves after hours: Netflix, IBM, Disney and more",See which stocks are posting big moves after the bell.
28,2022-04-23 13:40:14.612410,2022-04-20 14:21:16,Fed's Bostic expresses caution about the pace of interest rate hikes,Atlanta Fed President Raphael Bostic did not commit in a CNBC to interview to what pace the Fed should take in increasing benchmark rates.
29,2022-04-23 13:40:14.612410,2022-04-20 13:41:57,Robinhood revives plans to launch in the UK with deal to buy crypto app Ziglu,"Robinhood has agreed to buy Ziglu, a British fintech app that allows users to trade bitcoin and several other cryptocurrencies."
