DATE,TITLE,SUMMARY
2021-08-16 16:46:29,California Gov. Newsom sharpens message as Larry Elder poses threat in recall race,"As he hit the campaign trail this weekend to fight the Republican-led effort to oust him, California Gov. Gavin Newsom leaned into the microphone with a message for all the disengaged Democrats who might be inclined to ignore the September 14 recall election."
2021-08-16 16:45:18,LGBTQ groups across the US consider a new flag meant to be more inclusive of the transgender community and people of color,"Parts of the LGBTQ community are reckoning with the marginalization of certain groups, leading to more conversations and debates around the widespread adoption of the Progress Pride Flag."
2021-08-16 16:43:57,Blue Origin sues US government over NASA's decision to award SpaceX lunar lander contract,"Blue Origin filed a federal lawsuit Friday to challenge a NASA moon landing contract awarded solely to rival company SpaceX, upping the ante in an already tense standoff over the multibillion-dollar lunar lander program."
2021-08-16 16:35:13,"Amidst record-breaking heat waves, this weather station keeps its cool","While regions of the United States endure yet another heat wave this week in an already record-breaking year for temperatures, one place stands out as a cool escape. And its employees have quite the shivering resume."
2021-08-16 16:33:27,The infrastructure bill is more about maintaining train service than upgrading it,"Don't expect any 200 mph trains that rival Europe and Asia's best, or even cheaper fares."
2021-08-16 16:26:13,'Free Guy' tops box office with surprisingly solid opening weekend,"""Free Guy,"" an action comedy from Disney's 20th Century Studios starring Ryan Reynolds, opened to an estimated $28.4 million at the North American box office this weekend."
2021-08-16 16:18:43,'The White Lotus' was great. Let's hope it's not another 'True Detective',"""The White Lotus"" was great (Sunday's finale likely produced as many memes as viewers). Still, there's a degree of ambivalence about HBO's announcement that the show will return, even with a new cast and new setting."
2021-08-16 16:18:25,The mysterious Chinese fashion app that's as popular as Amazon,
2021-08-16 16:16:32,Meet the Nigerian artist illustrating the human experience with a ballpoint pen,Jacqueline Suowari's larger-than-life portraits are the culmination of thousands of tiny lines made using a simple ballpoint pen.
2021-08-16 16:16:21,Carli Lloyd: United States Women's National Team great to retire from football,"Carli Lloyd, who is one of the most successful players in the history of the United States Women's National Team (USWNT), is to retire from professional football."
2021-08-16 16:09:59,Biden's botched Afghan exit is a disaster at home and abroad long in the making,"The debacle of the US defeat and chaotic retreat in Afghanistan is a political disaster for Joe Biden, whose failure to orchestrate an urgent and orderly exit will further rock a presidency plagued by crises and stain his legacy."
2021-08-16 16:06:12,Ryan Reynolds says 'Free Guy' sequel is a go,"Well, that was quick and yet not."
2021-08-16 16:03:25,16-year-old South Carolina student dies from Covid-19 complications as school district struggles with infections,"As students return for the first day of school in Lancaster County, South Carolina, the district's leadership has confirmed that a 16-year-old student has died of complications from Covid-19."
2021-08-16 16:02:00,Investing green is harder than you'd think,"ESG investing — funds that are conscious of companies' actions on the environment, society and governance — is an increasingly popular trend for people concerned about how their money is being used. It sounds great, but it's complicated."
2021-08-16 18:00:17,Travel the world through tea with Atlas Tea Club,"You've probably heard of coffee subscriptions, but have you tried a tea subscription yet? Atlas, the brand that brought you Atlas Coffee Club, now offers a tea club that delivers single-origin tea from all around the world right to your door."
2021-08-16 17:56:51,"The 5 best skin care ingredients to smooth wrinkles, according to derms","There are a few powerhouse skin care ingredients that smooth wrinkles, buff hyperpigmentation away and overall work wonders on mature skin. CNN spoke to four dermatologists to find out the top actives, plus the products that come with them."
2021-08-16 17:56:36,CNN Underscored exclusive: Get your caffeine fix from Atlas Coffee Club for free,"Typically, your first full-size bag would cost $14, but today, Underscored readers can score a free bag and only pay the cost of shipping."
2021-08-16 17:54:30,Pfizer submits data to FDA showing a booster dose works well against original coronavirus and variants,Pfizer and BioNTech said Monday they have submitted initial data to the US Food and Drug Administration to support the use of a booster dose of Covid-19 vaccine.
2021-08-16 17:41:00,"The absolute best diaper bags to buy, according to mommy bloggers","Whether you're headed to run a quick errand or on a weeklong road trip with baby in tow, you need a diaper bag to hold bottles and pacifiers and, oh right, diapers too. That's why we talked to a bunch of influential moms to find their top picks."
2021-08-16 17:33:27,Biden returns to White House ahead of address on Afghanistan,President Joe Biden will address the crisis in Afghanistan from the White House on Monday afternoon as he faces mounting questions about his administration's apparent failure to prepare for the collapse of that nation's government.
2021-08-16 17:25:55,Crews battle Western wildfires that have caused thousands of evacuations,A wildfire in California is growing by thousands of acres while one in Utah has forced thousands of residents from their homes -- and crews say there is much more work to be done before the flames are under control.
2021-08-16 17:25:01,"State Street, which manages $3.5 trillion, is closing its New York offices","State Street, one of the world's largest asset managers, is shutting down its two midtown Manhattan offices as the Wall Street firm embraces a hybrid working model."
2021-08-16 17:21:17,Here's what the Underscored editors bought for days of deals,"In case you missed it, our very first Days of Deals event is happening now — a two-day exclusive promotion featuring savings on 35 brands and products that we can't get enough of, exclusively for Underscored readers."
2021-08-16 17:10:49,Colonial Pipeline says ransomware attack also led to personal information being stolen,"The ransomware attack that forced Colonial Pipeline, one of the largest fuel pipelines in the United States, to go offline this spring also compromised the personal information of nearly 6,000 individuals, a company spokesperson told CNN Business."
2021-08-16 17:10:02,Cuomo announces New York healthcare workers must be vaccinated against Covid-19,"The New York State Department of Health issued an order Monday requiring all healthcare workers be vaccinated against Covid-19 by September 27, according to a statement released by outgoing Gov. Andrew Cuomo's office."
2021-08-16 17:01:23,Rare Honus Wagner baseball card sells for record $6.6 million at auction,"A Honus Wagner baseball card, the most famous and among the rarest sports trading cards in the world, sold at auction Monday morning for a record $6.6 million. That blew away the previous record — a 1952 Topps Mickey Mantle card, which auctioned earlier this year for $5.2 million."
2021-08-16 18:48:10,How newspaper front pages covered the fall of Afghanistan to Taliban forces,"Falls. Collapses. Chaos. Those are some of the words splashed across the front pages of newspapers in the US and around the world after the Taliban took control of Afghanistan's capital city, Kabul."
2021-08-16 18:35:16,These restaurants are facing ingredient shortages. Here's how they're coping,A stressed supply chain means some restaurant operators are having problems buying certain ingredients. That could change what diners see on their plates.
2021-08-16 18:21:45,Named tropical systems line up right on cue,"If it seems like the tropics went from 0 to 60 in the blink of an eye, you're right. Almost as if someone turned on a light switch."
2021-08-16 18:15:26,Cuomo announces New York health care workers must be vaccinated against Covid-19,"The New York State Department of Health issued an order Monday requiring all health care workers be vaccinated against Covid-19 by September 27, according to a statement released by outgoing Gov. Andrew Cuomo's office."
2021-08-16 18:12:27,"Attorney General Merrick Garland, don't prosecute Donald Trump","During his presidency, Trump violated many unwritten norms that govern the conduct of presidents, writes Jeffrey Toobin, and one of the most important such transgressions was his refusal to concede defeat when he lost the election. But there are other norms, too, and one of them is to avoid prosecution -- and persecution -- of former presidents."
2021-08-16 18:11:40,Chaos in Kabul as Taliban take power and thousands try to flee,"Hundreds of people poured onto the tarmac at Kabul's international airport, desperately seeking a route out of Afghanistan on Monday, after the Taliban's sudden seizure of power sparked a chaotic Western withdrawal and brought to a crashing end the United States' two-decade mission in the country."
2021-08-16 18:00:46,"The best skin care products for people over 40, according to derms","As we age, the connective tissues that keep skin looking plump, vibrant and smooth start to lose momentum. We consulted four skin care experts to find out the best skin care products for women in their 40s, 50s and beyond."
2021-08-16 19:41:17,Ashraf Ghani Fast Facts,Read Fast Facts from CNN about Ashraf Ghani and learn more about the president of Afghanistan.
2021-08-16 19:40:33,These $15 faceplates let you customize your Ring Doorbell,"In the world of smart doorbells, Ring makes a ton of models and offers a package that has become quite popular amongst consumers. Not to mention that Ring's Video Doorbell Pro 2 is our pick for best doorbell, and the Video Doorbell 4 is the best wireless doorbell we've tested."
2021-08-16 19:32:25,"Exclusive: Title, cover and details of new Trump book from Bob Woodward and Robert Costa revealed","First it was ""Fear,"" then it was ""Rage,"" now it is ""Peril."" That is the title of the highly-anticipated third book about President Trump from legendary journalist Bob Woodward, this time written with co-author Robert Costa, a Washington Post national political reporter."
2021-08-16 19:29:19,First-ever water cuts expected for Colorado River in historic drought,Additional cuts — each tier with worsening impact on agriculture and municipal water — are expected if Lake Mead continues to fall.
2021-08-16 19:28:32,New York man pleads guilty to posting threats against Warnock and Congress,"A New York man has pleaded guilty after posting online violent threats against Congress and newly elected Georgia Democratic Sen. Raphael Warnock in the lead-up to and during the January 6 insurrection, federal prosecutors announced Monday."
2021-08-16 19:18:09,The best thermometers of 2021,"In our search for the best thermometers, CNN Underscored tested 15. Aside from evaluating the readings, we also considered ease of use, speed of readings and other nice-to-have options, ultimately finding three thermometers that stood out."
2021-08-16 19:13:03,Former Michigan Rep. Paul Mitchell dies at 64 after cancer battle,"Paul Mitchell, a former US congressman from Michigan who championed Republican priorities before leaving the party over its embrace of election lies, died on Sunday following a battle with cancer. He was 64."
2021-10-08 15:53:13,These people quit their jobs during the pandemic. Here's what they're doing now,Major life events -- like a global pandemic -- often lead people to take stock of their lives. And many workers are now taking a closer look at their jobs and realizing it's not what they want to be doing anymore.
2021-10-08 15:51:30,National Exercise Program Fast Facts,"Read Fast Facts from CNN about the National Exercise Program, the US system for emergency preparation drills."
2021-10-08 15:48:52,Andy Murray is back in the 'good books' after finding lost wedding ring,"Andy Murray is back in the ""good books"" after tracking down the wedding ring he lost when his trainers went missing earlier this week."
2021-10-08 15:45:36,Youngkin walks fine line on 'election integrity',"Glenn Youngkin is trying to walk a tightrope on so-called election integrity. The Virginia GOP gubernatorial nominee, who has acknowledged that President Joe Biden's election was legitimate, is digging into his call for an audit of the voting machines used in the 2020 election."
2021-10-08 15:44:25,Explosion at mosque in Afghanistan kills and wounds at least 100,"A suicide blast ripped through a Shia mosque in northern Afghanistan Friday, killing and injuring at least 100 people, a UN agency said."
2021-10-08 15:43:31,Biden signs bill that will give victims of mysterious 'Havana syndrome' better medical care,"President Joe Biden on Friday signed into law long-delayed legislation to provide support to victims of the mysterious ""Havana syndrome,"" a strange confluence of symptoms that have sickened diplomats, spies and service members around the globe."
2021-10-08 15:33:54,Jaclyn Moore of 'Dear White People' boycotts Netflix over Dave Chappelle's anti-transgender jokes,"Jaclyn Moore, writer and showrunner on the series ""Dear White People,"" is boycotting Netflix after the streamer released Dave Chappelle's latest stand-up special, which contained a slew of jokes aimed at transgender people."
2021-10-08 15:33:24,African scientists' historic malaria breakthrough celebrated by peers,"The World Health Organization's decision to recommend the widespread use of a long-awaited vaccine against malaria is an endorsement of the African scientists involved in developing it, a top official in the global health body told CNN on Thursday."
2021-10-08 15:25:46,New Jersey man in viral racist rant charged with another act of intimidation,"A New Jersey man arrested in July after a video showed him shouting racial slurs at a neighbor has been charged ""with leaving a threatening note on one of his victim's cars earlier this year,"" as well as vandalizing the victim's vehicle, according to a news release from the Burlington County Prosecutor's Office."
2021-10-08 15:25:06,New York City to eliminate gifted and talented school program after years of opponents saying that it segregated students,New York City will phase out its controversial gifted and talented student program after years of debate that the exclusive classes further segregated students.
2021-10-08 15:24:26,Wall Street isn't sweating the mixed jobs report,"America added far fewer jobs in September than expected, but investors didn't seem too disappointed: Stocks were flat Friday as Wall Street took solace that the unemployment rate continues to drop after the pandemic-fueled spike last year."
2021-10-08 15:23:24,Longest Serving US Senators Fast Facts,Read CNN's Fast Facts about the 25 longest-serving senators in US history.
2021-10-08 15:21:54,"2 shot dead at senior living facility in Maryland's Prince George's County, police say","Two people were killed in a shooting at a senior living facility in Maryland's Prince George's County, outside Washington, DC, a police spokesperson said Friday morning."
2021-10-08 15:21:00,Travel to the Netherlands during Covid-19: What you need to know before you go,"If you're planning a trip to the Netherlands, here's what you'll need to know and expect if you want to visit during the global coronavirus pandemic."
2021-10-08 15:17:53,The homecoming queen gave away her crown to comfort a grieving family and set an example for us all,"Nyla Covington was crowned homecoming queen at her Mississippi high school, but gave her crown to another student on the homecoming court, whose mother had passed away from cancer earlier that same day."
2021-10-08 15:17:43,Microsoft Surface Laptop Studio review: A seriously powerful and versatile 2-in-1,"The Microsoft Surface Laptop Studio is a great 2-in-1 for power users, offering a uniquely flexible display, great overall performance and an excellent keyboard."
2021-10-08 15:13:31,This Boston Marathon bombing survivor is on a mission to give fellow amputees the prosthetic legs insurance won't cover,"Heather Abbott was severely injured in the Boston Marathon bombing. Today, she is helping fellow amputees of all ages receive customized prostheses that allow them to live full, active lives."
2021-10-08 15:13:16,"Conditions may be improving in the search for Brian Laundrie, who officials say was under surveillance before disappearing","The search for Brian Laundrie, whose fiancée Gabby Petito was found dead in Wyoming after the pair embarked on a cross-country road trip over the summer, continues in an inhospitable Florida nature reserve that may soon prove easier to navigate for teams trying to find him, the Laundries' family attorney says."
2021-10-08 15:11:04,US judge recommends Cristiano Ronaldo rape case be dismissed,A federal judge in Nevada has recommended that the rape case involving Manchester United forward Cristiano Ronaldo be dismissed.
2021-10-08 15:07:40,US Marshals track down Dodgers fan who resembled most wanted fugitive,The US Marshals Service is back to the drawing board in it search for a fugitive on the run for 23 years.
2021-10-08 15:06:47,The Countess of Wessex is getting real about menopause. Why her groundbreaking message matters,"When Meghan, Duchess of Sussex opened up about her miscarriage last year, she was widely praised for the bravery she showed. Now, Sophie, the Countess of Wessex and the Queen's daughter-in-law, is speaking about another deeply personal issue riddled with stigma."
2021-10-08 15:03:17,Joe Biden has a *major* independents problem,It's not too much to say that independents handed Joe Biden the presidency in 2020.
2021-10-08 15:02:22,Woman sentenced to four days in jail for Yellowstone grizzly bear incident,A 25-year-old woman from Illinois has been sentenced to four days in federal custody for staying too close to a grizzly bear and her cubs at Yellowstone National Park in Wyoming.
2021-10-08 15:01:15,"Another disappointment: US economy adds only 194,000 jobs in September","America's economic recovery has hit a roadblock: US employers added only 194,000 jobs in September, another troubling sign that Covid is disrupting the economy."
2021-10-08 14:57:23,Travel to Croatia during Covid-19: What you need to know before you go,"If you're planning to travel to Croatia, here's what you'll need to know and expect if you want to visit during the Covid-19 pandemic"
2021-10-08 14:55:50,Biden administration blames ongoing pandemic fears for disappointing jobs report,The Biden administration is attributing the disappointing September jobs report to the ongoing Covid-19 pandemic and fears over the Delta variant.
2021-10-08 14:54:46,It's peak apple season: How to make the most of an apple adventure,"October is peak apple season for many regions of the United States, so it's time to pick your favorite apples to make pie, tarts, crisps, sauce, butter or just to enjoy as is."
2021-10-08 14:52:39,Some children's hospitals see another surge in rare Covid-19 complication MIS-C,"Scientists still don't know a lot about a rare and serious Covid-19 complication that impacts children, but what they do know is that when there is a surge of Covid-19 cases in their area, MIS-C cases will typically follow."
2021-10-08 14:48:24,Must-watch videos of the week,"Captain Kirk cracks Anderson Cooper up with his real-life trip to the final frontier, Hamilton star sends a history teacher a message and surveillance videos across Colorado capture an ""event of a lifetime"" on camera. These are the must-watch videos of the week."
2021-10-08 14:45:55,'Ted Lasso' and the great Nate debate,"If watching the trajectory of Nate Shelley, the formerly meek now mean assistant coach-turned-traitor on ""Ted Lasso,"" has made you uncomfortable this season, you're not alone. Count me among those who felt during most of the season that the character Nate (Nick Mohammed) had been done dirty by a room of cartoonishly evil writers, represented in my head only by a series of shadows and occasional shots of their ghoulish hands reaching for watered down cold brews at a conference table in a dark dungeon."
2021-10-08 18:20:15,'No Time to Die' is the most important film of the pandemic era,"In the nearly six decades since 1962's ""Dr. No,"" one thing has been a constant at the cinema: Bond, James Bond."
2021-10-08 18:09:02,"CDC vaccine advisers schedule meetings to discuss booster shots, vaccines for kids","Vaccine advisers to the US CDC have planned two meetings in the coming weeks to discuss more Covid-19 vaccine boosters, as well as Pfizer's application for emergency use authorization for its vaccine for children 5-11."
2021-10-08 18:07:07,"CDC vaccine advisers schedule meetings to discuss booster shots, vaccines for kids","Vaccine advisers to the US Centers for Disease Control and Prevention have planned two meetings in coming weeks to discuss more Covid-19 vaccine boosters, as well as Pfizer's application for emergency use authorization of its vaccine for children 5-11, officials said Friday."
2021-10-08 18:06:14,"Trump DC hotel incurred more than $70 million in losses while Trump was president, documents show","Former President Donald Trump racked up more than $70 million in losses over a four-year period from his Washington, DC, hotel, while publicly claiming that the hotel was making more than tens of millions of dollars, according to documents released by the House Oversight Committee."
2021-10-08 17:55:31,"Bannon to defy subpoena from January 6 committee, citing Trump's 'direction'","Steve Bannon will not cooperate with the House select committee investigating January 6, his lawyer said in an email obtained by CNN that cites former President Donald Trump's claim of executive privilege."
2021-10-08 17:53:34,136 countries agree to minimum corporate tax rate after Ireland drops its opposition,A group of 136 countries have agreed to a global treaty that would tax large multinationals at a minimum rate of 15% and require companies to pay taxes in the countries where they do business.
2021-10-08 17:48:38,Here's what having a Covid-19 vaccine for children might mean for your kids,Pfizer said Thursday it's asked the US Food and Drug Administration to authorize use of a low-dose version of its Covid-19 vaccine for children 5 to 11.
2021-10-08 17:38:09,Whoopi Goldberg receives apology from Barbara Corcoran for body shaming joke,"""Shark Tank"" star Barbara Corcoran has apologized to Whoopi Goldberg after Corcoran was accused of body shaming Goldberg on ""The View."""
2021-10-08 17:27:38,"California makes it illegal to remove a condom without consent, an act called 'stealthing'","California Gov. Gavin Newsom signed a bill into law Thursday making the state the first to prohibit ""stealthing,"" or removing a condom during intercourse without a partner's verbal consent."
2021-10-08 17:23:03,Seahawks' real-life hawk mascot flies into the stands and lands on a football fan,"Taima the Hawk is a fixture at Seattle Seahawks home games, swooping through Lumen Field to the delight of thousands of football fans."
2021-10-08 17:09:55,The facts around an IRS proposal some claim would allow 'spying' on Americans' bank accounts,"Recently, the Internal Revenue Service has gotten a lot of attention on social media -- specifically, an obscure proposal by the Biden administration to widen the authority to root out tax evasion by allowing the IRS to get annual, aggregated reports of flows from bank accounts with a minimum of $600."
2021-10-08 17:07:12,Justin and Christian Long had a blast making 'Lady of the Manor',"How does one come up with a paranormal buddy comedy tied, in part, to the antebellum era of history?"
2021-10-08 17:05:54,The debt limit is still a ticking time bomb,"Congress must act quickly to significantly extend or raise the debt ceiling for the long term, so that our nation does not lurch from crisis to crisis."
2021-10-08 17:05:32,"Biden points to Covid as a reason for disappointing jobs report, but argues progress is being made",President Joe Biden on Friday attributed the disappointing September jobs report to the ongoing Covid-19 pandemic but sought to frame the new data as steady progress toward the nation's economic recovery.
2021-10-08 17:04:47,22 of the most anticipated new books to read this October,"This month, celebrity tell-alls are hot on the most-anticipated new release list, as well as bestsellers from John Grisham and David Sedaris. We've rounded up 22 new October book releases to read now, all available to purchase or preorder on Amazon."
2021-10-08 16:53:33,"Facebook went offline this week. Experts say we should log out, too","The world experienced a forced break from Facebook's social networking tools on Monday, and many people felt liberated from their devices. Experts say we should liberate ourselves and do it more often."
2021-10-08 16:41:00,Afrobeats star Tiwa Savage says she's being blackmailed over a sex tape,"Tiwa Savage, the award-winning Nigerian singer-songwriter, says she's being blackmailed over some intimate footage she filmed with her current boyfriend."
