DATE,TITLE,SUMMARY
2021-10-08 16:39:47,GOP senators who voted to convict Trump say it's too soon to worry that he could undermine 2024 election,"Seven Senate Republicans defied former President Donald Trump by voting to convict him for inciting an insurrection after losing the 2020 election. But eight months later, they're largely responding with a collective shrug to warnings again he's taking steps to try to overturn the 2024 election, telling CNN they see no reason yet to be alarmed."
2021-10-08 16:38:45,How a LinkedIn message paved the way for 'The Facebook Files',It all started with a LinkedIn message.
2021-10-08 16:29:39,Chuck Schumer picked the wrong moment to go on a partisan rant,The Senate was in self-congratulatory mode on Thursday night.
2021-10-08 16:07:38,Traveling to the Maldives during Covid-19: What you need to know before you go,If you're planning a trip to the Maldives here's what you'll need to know and expect if you want to visit during the global coronavirus pandemic.
2021-10-08 16:06:23,9 amazing skin care deals from Amazon's Holiday Beauty Haul event,"The early holiday season continues at Amazon. In addition to some early Black Friday deals happening now, the mega-retailer is offering a variety of beauty sales that switch up throughout the month, too. From now until Oct. 25, Amazon's Holiday Beauty Haul is discounting beloved beauty items across all categories, from makeup to skin care and more."
2021-10-08 16:04:42,William Shatner jokes with crowd at New York Comic Con about space flight: 'I'm Captain Kirk and I'm terrified',"William Shatner spoke to a crowd at New York Comic Con on Thursday evening, just days before he will blast into space on a sub-orbital flight."
2021-10-08 16:04:14,Travel to Antarctica during Covid-19: What you need to know before you go,"If you're planning a trip to Antarctica, here's what you'll need to know and expect if you want to visit during the global coronavirus pandemic."
