DATE,TITLE,SUMMARY
2021-08-16 12:21:17,Canadian luxury scenic train line debuts its first US route,"The United States' railroad system is getting a boost from its northern neighbor. One of Western Canada's luxury scenic train lines, the Rocky Mountaineer, launched its first US route on August 15 between Denver, Colorado, and Moab, Utah."
2021-08-16 12:19:16,"Travis Barker, Blink-182 drummer, takes first flight since deadly 2008 plane crash","Travis Barker has flown on a plane for the first time since he survived a deadly plane crash 13 years ago, TMZ reports."
2021-08-16 12:08:04,Tropical depression threatens further devastation in earthquake-hit Haiti,"A tropical storm system is threatening to unleash flash flooding and mudslides on the area of Haiti where a 7.2-magnitude earthquake killed almost 1,300 people on Saturday."
2021-08-16 12:05:54,2021 Atlantic Hurricane Season Fast Facts,Read CNN's 2021 Atlantic Hurricane Season Fast Facts to learn about tropical storm systems that develop during the summer and fall.
2021-08-16 12:03:47,Wall Street's confusion about Airbnb is a sign of the times,It's a tough moment to predict the future of the travel industry. Just look at Airbnb's stock.
2021-08-16 11:59:43,The latest on Afghanistan,The Taliban took control of the presidential palace in Kabul Sunday after the country's president Ashraf Ghani fled the country. Follow here for the latest news.
2021-08-16 11:53:27,Malaysia Fast Facts,Read CNN's Fast Facts about Malaysia to learn more about the country located in Southeast Asia.
2021-08-16 11:43:20,Airlines avoid Afghan airspace as Kabul airport closes to commercial flights,"Major international airlines are scrambling to reroute flights away from Afghan airspace as the country falls to the Taliban, disrupting passenger services to India, Pakistan and the United Arab Emirates."
2021-08-16 11:37:53,Zambia's opposition leader wins landslide election as young people turnout in huge numbers,Zambian President Edgar Lungu has officially conceded to opposition leader Hakainde Hichilema following his landslide election victory on Monday.
2021-08-16 11:33:34,Who are the Taliban and how did they take control of Afghanistan so swiftly?,"Just last week, US intelligence analysts had predicted it would likely take several more weeks before Afghanistan's civilian government in Kabul fell to Taliban fighters. In reality, it only took a few short days."
2021-08-16 11:30:18,Haiti Fast Facts,Read CNN's Fast Facts on Haiti and learn more about the poorest country in the Western Hemisphere.
2021-08-16 11:29:57,Chaos in Kabul as Taliban take power and thousands try to flee,"Hundreds of people poured onto the tarmac at Kabul's international airport desperately seeking a route out of Afghanistan on Monday, after the Taliban's sudden seizure of power sparked a chaotic Western withdrawal and brought to a crashing end the United States' two-decade mission in the country."
2021-08-16 11:28:39,Earthquakes Fast Facts,View Earthquake Fast Facts from CNN and learn more about earthquakes worldwide.
2021-08-16 11:23:24,Schools close throughout the Florida Panhandle ahead of Tropical Storm Fred,"With Tropical Storm Fred gaining strength on the way to the Florida Panhandle, many schools in the area are closed Monday to brace for its impact."
2021-08-16 11:18:03,Hyatt is betting on luxury travel with $2.7 billion resorts deal,"Hyatt is expanding its reach in luxury resorts, betting that pent-up demand following the pandemic will boost demand for upmarket leisure travel."
2021-08-16 11:17:34,New clue to human evolution's biggest mystery emerges in Philippines,Geneticists have found that a Philippine ethnic group known as the Ayta Magbukon has the highest level of Denisovan ancestry in the world.
2021-08-16 10:57:56,India's Modi promises to spend over $1 trillion on infrastructure -- once again,Indian Prime Minister Narendra Modi has renewed a pledge to spend more than $1 trillion on infrastructure to create jobs for hundreds of thousands of young Indians and boost the economy.
2021-08-16 10:46:29,Netflix first original series from Nigeria drops highly anticipated trailer,"It is one of the most anticipated Nollywood films of all time and the trailer for King Of Boys: The Return Of The King was released Monday amid frenzy from fans of the crime and political thriller, who call themselves the KOB Army."
2021-08-16 10:42:29,US veterans are disappointed with how the war in Afghanistan is ending -- and fearful for their Afghan allies,"As the United States withdraws from Afghanistan, the world has watched as the Taliban has swiftly taken back control of the country, entering Kabul on Sunday as former Afghan President Ashraf Ghani fled the country and the United States evacuated its embassy."
2021-08-16 10:33:17,Connor Fields says he suffered brain shearing and bleeding after BMX crash,"American BMX rider Connor Fields says he is ""progressing nicely"" after he suffered brain shearing and bleeding, intubation, a broken rib and a collapsed lung following his crash at the Tokyo 2020 Olympics."
2021-08-16 10:33:02,"5 things to know for August 16: Afghanistan, Covid-19, Haiti, weather, China & Russia",Here's what else you need to know to Get Up to Speed and On with Your Day.
2021-08-16 10:30:10,Sex ed conversations you need to have with your tween or teen,Parents should begin having conversations with their children about puberty well before it begins (but it's not too late to start now).
2021-08-16 10:27:51,Former Rugby World Cup star Toutai Kefu and family attacked in Brisbane home,"Former Australian rugby player and Rugby World Cup winner Toutai Kefu and his family have been injured after being attacked in their home in Brisbane, Australia."
2021-08-16 10:27:03,Surgeon general worries about complacency on Covid-19 as cases surge and vaccinations lag,"With the outlook of the Covid-19 pandemic growing worse as hospitalizations and cases surge among the unvaccinated, the surgeon general said many of those who have followed precautions may soon grow complacent due to fatigue."
2021-08-16 10:26:43,Afghan President Ashraf Ghani flees the country as Taliban forces enter the capital,"The Taliban has seized control of every major city across the country, apart from Kabul, in the past two weeks, and its strikingly rapid push towards the capital has forced the US to bolster and speed up its efforts to evacuate its embassy staff."
2021-08-16 10:24:44,Meet the Nigerian artist illustrating the human experience with a ballpoint pen,Jacqueline Suowari's larger-than-life portraits are the culmination of thousands of tiny lines made using a simple ballpoint pen.
2021-08-16 09:53:37,Muhammad Ali's grandson marks professional boxing debut with a victory,The continuation of a legacy was how Nico Ali Walsh -- the grandson of Muhammad Ali -- described making his professional boxing debut in the sport on Saturday.
2021-08-16 09:28:05,Barcelona starts life without Lionel Messi with a thrilling win,Barcelona started its new post-Lionel Messi era with a thrilling 4-2 win against Real Sociedad on Sunday.
2021-08-16 09:05:14,The Delta variant is just one of the clouds hanging over China's economy,China's economic recovery is slowing down — and it's not just the spread of the Delta variant of Covid-19 that has economists and government officials on alert.
2021-08-16 09:01:51,Crews battle western wildfires that have caused thousands of evacuations,A wildfire in California is growing by thousands of acres while one in Utah has forced thousands of residents from their homes -- and crews say there is much more work to be done before the flames are under control.
2021-08-16 13:22:27,Historic increase in food stamps benefits is on the way,"Food stamps benefits will jump more than 25% above pre-pandemic levels, on average, starting in October -- the largest increase in the program's history, the Biden administration announced Monday."
2021-08-16 13:22:04,CNN Underscored exclusive: Save even more on refurbished tech from Decluttr,"Buying refurbished tech is both good for the planet and for your bank account, and now it's even less expensive, thanks to this exclusive offer from Decluttr."
2021-08-16 13:21:48,There's finally a Perfect Pot to go with your Always Pan,"Our Place, makers of the famous Always Pan, has finally created the ideal pairing to go with its much-loved eight-in-one saucepan: The Perfect Pot."
2021-08-16 13:14:49,CNN Underscored exclusive: Sleep soundly with savings on two Buffy comforters,"Buffy is the bedding company that's disrupting how you sleep — in a good way — and today, you can save on the brand's two top-rated comforters."
2021-08-16 13:03:25,3 ways companies can help advance racial equity,"To reduce friction, bolster trust and maximize the impact of commitments, corporations should lead the way by developing new models for partnering with groups — and other likeminded companies — that support and promote racial equity."
2021-08-16 12:58:52,The Cure's Simon Gallup 'fed up of betrayal' and leaving band after 40 years,"""Boys Don't Cry,"" but in the case of Simon Gallup, they do post their feelings on Facebook and offer their resignation publicly."
2021-08-16 12:58:19,The Census shows the GOP base is shrinking fast. So why does its power seem secure?,"Justin Gest writes that even though the latest US Census data reveals the diversification of America, which on the surface would suggest a bleak future for the Republican Party, demographic trends actually favor the GOP because of the way political power is apportioned in America."
2021-08-16 12:56:30,White fear is the wrong way to tell the Census story,"Right-wing media narratives frame America's growing non-White population as a problem to be solved through gerrymandering, xenophobia and anti-democratic legislation, writes Peniel Joseph of responses to recent US census data --  and yet, America's changing demographics tell a different, more inspiring story."
2021-08-16 12:47:08,Biden's botched Afghan exit is a disaster at home and abroad long in the making,"The debacle of the US defeat and chaotic retreat in Afghanistan is a political disaster for Joe Biden, whose failure to orchestrate an urgent and orderly exit will further rock a presidency plagued by crises and stain his legacy."
2021-08-16 12:46:36,Texas Supreme Court sides with governor and temporarily blocks mask mandates,"The Texas Supreme Court sided with Gov. Greg Abbott on Sunday in a ruling that temporarily blocks mask mandates recently issued in San Antonio and Dallas, though local officials said they will continue to enforce at least a portion of the mask mandates."
2021-08-16 14:24:34,Justice Department civil rights chief calls on Congress to pass voting rights bill,"The leader of the Justice Department's civil rights division told Congress Monday that ""voting rights are under pressure to an extent that has not been seen since the Civil Rights era."""
2021-08-16 14:24:23,CNN Underscored exclusive: Save up to 80% on tons of Under Armour gear from Woot!,"We've collaborated with Woot! to bring you exclusive savings on one of your favorite brands: Under Armour. At this link, you'll find dozens of UA items for men and women for up to 75% off, plus an additional 5% off with code CNN21."
2021-08-16 14:19:48,Our Muslim allies must step up to protect the women of Afghanistan,"Dean Obeidallah writes that with no US military option to protect women in Afghanistan from the Taliban's brutal treatment of women, the best approach at this point is enlisting our Muslim allies to pressure the Taliban ""Muslim to Muslim"" to stop its oppression of women."
2021-08-16 14:17:06,Our favorite Nordstrom products of 2021 so far,"From snuggly throw blankets to leggings you won't want to take off, here are our readers' most-purchased Nordstrom products of 2021."
2021-08-16 14:04:33,Score a pair of AirPods Pro for just $179.99 right now,"Apple's AirPods Pro are at the top of the true wireless pyramid; in fact, they're our pick for best true wireless earbuds. And right now you can score them for just $179.99."
2021-08-16 13:59:31,CNN Underscored exclusive: Bring a bidet into your bathroom with 15% off at Tushy,"Whether a past trip to Europe first piqued your interest in forsaking TP or you're simply feeling a little bidet-curious, it's time to take the plunge. Tushy, the Instagram-famous bidet company that makes easy-to-install toilet attachments, is offering up a discount for our Days of Deals event."
2021-08-16 13:55:30,Johnny Depp says Hollywood is boycotting him,"According to Johnny Depp, the past five years have been ""surreal"" for him."
2021-08-16 13:53:16,CNN Underscored exclusive: Get a Wave Solo free when you buy a Theragun Pro,"Right now, when you buy a Theragun Pro, you'll automatically get a free Wave Solo added to your cart at checkout. All you have to do is enter the code CNNUNDERSCORED before you make your purchase, and the $79 value is yours for free."
2021-08-16 13:50:39,"CNN Underscored exclusive: Save $250 at Saatva when you spend $1,000 or more","Typically, Saatva mattresses run between $840 and $2,099 depending on the model you choose, but today we're offering an additional $250 off your purchase of $1,000 or more as part of CNN Underscored's Days of Deals promotion."
2021-08-16 13:47:57,The titanic hubris of Lindsey Graham,Sen. Lindsey Graham thinks pretty highly of himself.
2021-08-16 13:46:59,"CNN Underscored exclusive: The sleek, versatile Proclamation Duo cookware set is $50 off","If you're looking for a cookware set that can truly do it all, consider the Proclamation Duo. With just three pieces — the pot, pan and universal lid — it can handle everything you need to achieve in the kitchen, from frying to double boiling."
2021-08-16 13:45:01,"Second Nigerian ""Chibok girl"" freed in a week seven years after abduction","A second young woman abducted seven years ago from the town of Chibok by Boko Haram militants was freed this week, Borno state's governor has said."
2021-08-16 13:44:08,CNN Underscored exclusive: Save $30 on custom jeans from sustainable denim brand Lasso,Lasso makes sustainable denim that's customized to fit you to a T — without the designer price tag — and now getting your ideal pair is even more affordable: ﻿﻿Take $30 off your entire purchase with code CNN30.
2021-08-16 13:41:37,Surgeon general worries about complacency on Covid-19 as cases surge and vaccinations lag,"With the outlook of the Covid-19 pandemic growing worse as hospitalizations and cases surge among the unvaccinated, the surgeon general said many of those who have followed precautions may soon grow complacent due to fatigue."
2021-08-16 13:40:39,CNN Underscored exclusive: Don't wait to score savings on Gravity Blankets' weighted blankets and more,"Whether you're already a weighted blanket fan or you have yet to hop on the warm, cozy, anxiety-reducing bandwagon, you'll find something to love with this sitewide promo from Gravity Blankets, a leader in the weighted blanket space."
2021-08-16 13:40:33,US temporarily suspends operations at Kabul airport as Afghans rush airfield,"The US military has temporarily suspended air operations at Kabul airport while US troops try to clear Afghans who have flooded onto the airfield in a desperate rush to escape the Taliban, a US defense official told CNN."
2021-08-16 13:37:17,Calm and fear on the streets of Kabul as jubilant Taliban celebrate their victory,"As the Taliban takes hold of the Afghan capital, Kabul's citizens wait anxiously to see how life under the Islamist regime will unfold."
2021-08-16 13:36:14,Roger Federer will miss US Open after announcing further knee surgery,"Tennis great Roger Federer will miss the US Open later this month and possibly the rest of the season, after announcing that he needs another knee surgery which will sideline him for ""many months."""
2021-08-16 13:27:11,CNN Underscored exclusive: Save 20% on Boll & Branch when you spend $175,Right now you can get 20% off Boll & Branch when you spend $175 or more.
2021-08-16 14:56:49,Roblox wants to rule the metaverse,"If you've ever tried to separate a Roblox-playing tween from their smartphone, you know how addictive the game can be. Roblox, the gaming platform that's super popular with young kids (and investors), will release financial results Monday afternoon."
2021-08-16 14:56:09,Debra Winger quit 'A League of Their Own' because of Madonna,"Debra Winger has shared why she says Geena Davis replaced her in the 1992 film ""A League of Their Own."""
2021-08-16 14:52:43,Earn more rewards on your groceries with these credit cards,"There are some great credit cards that earn extra rewards when you use them at the supermarket, so if you cook at home on a regular basis, it's important to make sure you have the best credit card in your wallet when you're shopping for groceries."
2021-08-16 14:52:19,ISIS slaughtered my Yazidi community. We don't want your pity -- we want justice.,"Seven years ago, ISIS killed and kidnapped Yazidis in Sinjar, in what UN investigators called a genocide. Nobel laureate Nadia Murad writes that her people are still waiting for action on bringing terrorists to justice and rebuilding her homeland."
2021-08-16 14:49:09,"Tokyo Paralympics will have no spectators, as Covid-19 situation in Japan remains serious","The Tokyo 2020 Paralympics will not have any spectators as the Covid-19 situation in Japan remains serious, according to organizers."
2021-08-16 14:49:01,CNN Underscored exclusive: Stock up on cozy Jambys for fall with this BOGO 50% off deal,"As if you needed yet another reason to stock up on comfy clothes: Jambys, the line of ""performance inactivewear"" that's literally made to be worn while loafing around at home, is offering up a BOGO promo that's too cozy to pass up."
2021-08-16 14:45:31,CNN Underscored exclusive: Fenty Beauty Gloss Bombs are now 25% off,"Right now if you buy two or more Gloss Bombs from the collection and use the code CNN25, you'll get 25% off. That means two Gloss Bombs, which typically cost $38 total, will run you just $28.50 at checkout."
2021-08-16 14:44:30,Texas Supreme Court sides with governor and temporarily blocks mask mandates,"The Texas Supreme Court sided with Gov. Greg Abbott on Sunday in a ruling that temporarily blocks mask mandates recently issued in San Antonio and Dallas, though local officials said they will continue to enforce at least a portion of the mask mandates."
2021-08-16 14:43:52,"In the largest Afghan enclave in the US, frustration, heartbreak and 'a sense of mourning'",The sense of hope that Afghan Americans had for repairing their fractured country is rapidly fading as provincial capital after provincial capital in their homeland falls to the Taliban.
2021-08-16 14:42:38,See the graffiti that makes this city a popular attraction,"Colombia's capital Bogotá has embraced street art and has been fostering urban artists like never before. Self-proclaimed neo-muralist, Ledania, delivers bright colors and stylized strokes that adorn high rise buildings, hotel lobbies and city blocks."
2021-08-16 14:37:25,Travel the world through tea with Atlas Tea Club,"You've probably heard of coffee subscriptions, but have you tried a tea subscription yet? Atlas, the brand that brought you Atlas Coffee Club, now offers a tea club that delivers single-origin tea from all around the world right to your door."
2021-08-16 14:32:18,CNN Underscored exclusive: Devour this 15% off deal on Omsom's meal starters,"Hungry for a delectable deal? Now's your chance to score two bundles from Omsom — the Asian meal starters that prompted our reviewer to boldly state, ""This is one of the best cooking products I've ever tested"" — at a discount."
2021-08-16 14:27:40,CNN Underscored exclusive: Stock up on ThirdLove bestsellers with $15 off when you spend $75 or more,"For CNN Underscored's Days of Deals, we've partnered with ThirdLove to further get the word out on how amazing the brand's undergarments truly are. As part of the promotion, you will receive $15 off all orders of $75 or more."
2021-08-16 16:00:08,"Exclusive: Title, cover and details of new Trump book from Bob Woodward and Robert Costa revealed","First it was ""Fear,"" then it was ""Rage,"" now it is ""Peril."" That is the title of the highly-anticipated third book about President Trump from legendary journalist Bob Woodward, this time written with co-author Robert Costa, a Washington Post national political reporter."
2021-08-16 15:55:17,Tesla is under investigation because its cars keep hitting emergency vehicles,Federal safety regulators are investigating at least 11 accidents involving Tesla cars using Autopilot or other self-driving features that crashed into emergency vehicles when coming upon the scene of an earlier crash.
2021-08-16 15:55:17,Tropical Storm Fred gains strength as it nears the Florida coast,Hurricane hunters within the storm say that Tropical Storm Fred is intensifying as it approaches Florida.
2021-08-16 15:54:54,Historic increase in food stamp benefits is on the way,"Food stamp benefits will jump 27% above pre-pandemic levels, on average, starting in October -- the largest increase in the program's history, the Biden administration announced Monday."
2021-08-16 15:51:15,"Being a better listener for your loved ones might protect their brain health, study finds","Having good listeners in your life might help your brain be more resilient in the face of any future age- or disease-related changes, a new study has found."
2021-08-16 15:46:56,Joe Biden is facing a crisis of competence,At the heart of Joe Biden's 2020 presidential campaign was a single word: competence.
2021-08-16 15:46:45,"Son Heung-Min: No Harrry Kane, no problem as Tottenham Hotspur stuns Manchester City in Premier League","No Harry Kane? No problem. Tottenham Hotspur stunned Manchester City on Sunday, grinding out a gritty 1-0 win, despite the absence of the London's club star striker, who has been linked with a move to the reigning Premier League champion."
2021-08-16 15:46:09,US resumes operations at Kabul airport after US forces kill two armed men,"Violence erupted at the Kabul airport as US forces shot and killed two armed men who fired on them Monday, according to a US defense official, as the US resumed temporarily suspended operations at the airfield after clearing crowds off the runways."
2021-08-16 15:30:17,Our favorite Nordstrom products of 2020 so far,"From live-in leggings to zit stickers, these are Underscored's bestselling Nordstrom products of 2020 so far."
2021-08-16 15:21:27,Canadian luxury scenic train line debuts its first US route,"One of Western Canada's luxury scenic train lines, the Rocky Mountaineer, launched its first US route on August 15 between Denver, Colorado, and Moab, Utah."
2021-08-16 15:21:15,Chaos in Kabul as Taliban take power and thousands try to flee,"Hundreds of people poured onto the tarmac at Kabul's international airport, desperately seeking a route out of Afghanistan on Monday, after the Taliban's sudden seizure of power sparked a chaotic Western withdrawal and brought to a crashing end the United States' two-decade mission in the country."
2021-08-16 15:18:35,Was US intervention in Afghanistan ever going to end any other way?,America's global reputation is meanwhile in for a shredding. And Biden's vows to fight for global democracy are now undermined by his own abandonment of a US-backed democratic government in Kabul.
2021-08-16 15:15:06,Biden to return to White House for address on Afghanistan,"President Joe Biden will address the crisis in Afghanistan from the White House on Monday afternoon, as he faces mounting questions about his administration's apparent failure to prepare for the collapse of that nation's government."
2021-08-16 15:14:06,Afghanistan's first female ambassador to the US: 'It was avoidable',"In a Q&amp;A with Roya Rahmani, Afghanistan's first women ambassador to the US, Peter Bergen asks about the shockingly quick advancement of Taliban forces in Afghanistan, following the withdrawal of the US."
2021-08-16 15:14:05,Crews battle western wildfires that have caused thousands of evacuations,A wildfire in California is growing by thousands of acres while one in Utah has forced thousands of residents from their homes -- and crews say there is much more work to be done before the flames are under control.
2021-08-16 15:13:41,There's finally a Perfect Pot to go with your Always Pan,"Our Place, makers of the famous Always Pan, has finally created the ideal pairing to go with its much-loved eight-in-one saucepan: The Perfect Pot."
2021-08-16 15:01:22,Ripples in Saturn's rings reveal planet's 'fuzzy' core,"A rippling detected within the rings around Saturn has helped scientists determine that the giant planet may be ""fuzzy"" at its core. The findings also sugget that Saturn's core is much larger than previous estimates."
2021-08-16 16:56:31,Here we go again: These companies say the Delta variant is hurting business,"As the Covid-19 Delta variant continues to spread, companies are warning that they expect pandemic fears to harm their businesses. The hospitality and entertainment industries, in particular, are feeling the pain."
2021-08-16 16:52:12,How to tell if your stress levels are normal or the sign of something more,"A little bit of stress is okay, but too much stress could lead to anxiety or depression. Here's how to tell the difference."
2021-08-16 16:50:37,"Travis Barker, Blink-182 drummer, takes first flight since deadly 2008 plane crash","Travis Barker has flown on a plane for the first time since he survived a deadly plane crash 13 years ago, TMZ reports."
2021-08-16 16:50:12,A third dose of Covid-19 vaccine is now authorized for some. Here's what you need to know about boosters for all,Vaccine makers are preparing for a next possible phase of the Covid-19 vaccine rollout: booster doses.
